"0907.1483","Lourdes Tabares","Antonio Dobado, Lourdes Tabares-Cheluci (Madrid U.), Siannah Penaranda
  (Zaragoza U.), Javier Rodriguez-Laguna (Carlos III U.)","Radiative corrections to the Higgs potential in the LH model","27 pages, 4 figures, 1 table","Eur.Phys.J.C66:429-443,2010","10.1140/epjc/s10052-010-1259-9",,"hep-ph","http://creativecommons.org/licenses/by/3.0/","  In this work we compute the radiative corrections to the Higgs mass and the
Higgs quartic couplings coming from the Higgs sector itself and the scalar
fields $\phi$ in the Littlest Higgs (LH) model. The restrictions that the new
contributions set on the parameter space of the models are also discussed.
Finally this work, together with our three previous papers, complete our
program addressed to compute the relevant contributions to the Higgs low-energy
effective potential in the LH model and the analysis of their phenomenological
consequences.
","[{""version"":""v1"",""created"":""Thu, 9 Jul 2009 10:06:24 GMT""},{""version"":""v2"",""created"":""Wed, 26 Aug 2009 17:03:18 GMT""}]","2014-11-20"
"0907.1484","Joerg R. Hoerandel","W.D. Apel, et al","A new method to measure the attenuation of hadrons in extensive air
  showers","accepted for publication in Physical Review D","Phys.Rev.D80:022002,2009","10.1103/PhysRevD.80.022002",,"astro-ph.HE","http://arxiv.org/licenses/nonexclusive-distrib/1.0/","  Extensive air showers are generated through interactions of high-energy
cosmic rays impinging the Earth's atmosphere. A new method is described to
infer the attenuation of hadrons in air showers. The numbers of electrons and
muons, registered with the scintillator array of the KASCADE experiment are
used to estimate the energy of the shower inducing primary particle. A large
hadron calorimeter is used to measure the hadronic energy reaching observation
level. The ratio of energy reaching ground level to the energy of the primary
particle is used to derive an attenuation length of hadrons in air showers. In
the energy range from $10^6$ GeV to $3\cdot10^7$ GeV the attenuation length
obtained increases from 170 \gcm2 to 210 \gcm2. The experimental results are
compared to predictions of simulations based on contemporary high energy
interaction models.
","[{""version"":""v1"",""created"":""Thu, 9 Jul 2009 13:29:01 GMT""}]","2009-08-11"
"0907.1485","Jang Soo Kim","Jang Soo Kim","Front representation of set partitions","16 pages, 7 figures, final version","SIAM J. Discrete Math. 25 (2011) 447-461",,,"math.CO","http://arxiv.org/licenses/nonexclusive-distrib/1.0/","  Let $\pi$ be a set partition of $[n]=\{1,2,...,n\}$. The standard
representation of $\pi$ is the graph on the vertex set $[n]$ whose edges are
the pairs $(i,j)$ of integers with $i<j$ in the same block which does not
contain any integer between $i$ and $j$. The front representation of $\pi$ is
the graph on the vertex set $[n]$ whose edges are the pairs $(i,j)$ of integers
with $i<j$ in the same block whose smallest integer is $i$. Using the front
representation, we find a recurrence relation for the number of $12...
k12$-avoiding partitions for $k\geq2$. Similarly, we find a recurrence relation
for the number of $k$-distant noncrossing partitions for $k=2,3$. We also prove
that the front representation has several joint symmetric distributions for
crossings and nestings as the standard representation does.
","[{""version"":""v1"",""created"":""Thu, 9 Jul 2009 10:21:56 GMT""},{""version"":""v2"",""created"":""Sat, 15 Aug 2009 14:27:46 GMT""},{""version"":""v3"",""created"":""Mon, 29 Aug 2011 14:35:25 GMT""}]","2011-08-30"
"0907.1486","Sascha Bornhauser","Rouzbeh Allahverdi (New Mexico U.), Sascha Bornhauser (New Mexico U.),
  Bhaskar Dutta (Texas A-M), Katherine Richardson-McDaniel (New Mexico U.)","Prospects for Indirect Detection of Sneutrino Dark Matter with IceCube","13 pages, 9 figures, replaced to match the published version, only
  minor changes: addition of one reference in section 5, correction of two
  typos","Phys.Rev.D80:055026,2009","10.1103/PhysRevD.80.055026",,"hep-ph","http://arxiv.org/licenses/nonexclusive-distrib/1.0/","  We investigate the prospects for indirect detection of right-handed sneutrino
dark matter at the IceCube neutrino telescope in a $U(1)_{B-L}$ extension of
the MSSM. The capture and annihilation of sneutrinos inside the Sun reach
equilibrium, and the flux of produced neutrinos is governed by the
sneutrino-proton elastic scattering cross section, which has an upper bound of
$8 \times 10^{-9}$ pb from the $Z^{\prime}$ mass limits in the $B-L$ model.
Despite the absence of any spin-dependent contribution, the muon event rates
predicted by this model can be detected at IceCube since sneutrinos mainly
annihilate into leptonic final states by virtue of the fermion $B-L$ charges.
These subsequently decay to neutrinos with 100% efficiency. The Earth muon
event rates are too small to be detected for the standard halo model
irrespective of an enhanced sneutrino annihilation cross section that can
explain the recent PAMELA data. For modified velocity distributions, the Earth
muon events increase substantially and can be greater than the IceCube
detection threshold of 12 events $\mathrm{km}^{-2}$ $\mathrm{yr}^{-1}$.
However, this only leads to a mild increase of about 30% for the Sun muon
events. The number of muon events from the Sun can be as large as roughly 100
events $\mathrm{km}^{-2}$ $\mathrm{yr}^{-1}$ for this model.
","[{""version"":""v1"",""created"":""Thu, 9 Jul 2009 10:15:14 GMT""},{""version"":""v2"",""created"":""Thu, 24 Sep 2009 18:43:32 GMT""}]","2009-11-05"
"0907.1487","Elizabeth Winstanley","Dominic Hosler and Elizabeth Winstanley","Higher-dimensional solitons and black holes with a non-minimally coupled
  scalar field","17 pages, revtex4, 21 figures, minor changes to match published
  version","Phys.Rev.D80:104010,2009","10.1103/PhysRevD.80.104010",,"gr-qc","http://arxiv.org/licenses/nonexclusive-distrib/1.0/","  We study higher-dimensional soliton and hairy black hole solutions of the
Einstein equations non-minimally coupled to a scalar field. The scalar field
has no self-interaction potential but a cosmological constant is included.
Non-trivial solutions exist only when the cosmological constant is negative and
the constant governing the coupling of the scalar field to the Ricci scalar
curvature is positive. At least some of these solutions are stable when this
coupling constant is not too large.
","[{""version"":""v1"",""created"":""Thu, 9 Jul 2009 10:16:37 GMT""},{""version"":""v2"",""created"":""Mon, 11 Jun 2012 18:25:28 GMT""}]","2012-06-12"
"0907.1488","Sang-Woo Kim","Goro Ishiki, Sang-Woo Kim, Jun Nishimura, Asato Tsuchiya","Testing a novel large-N reduction for N=4 super Yang-Mills theory on
  RxS^3","24 pages, 4 figures","JHEP 0909:029,2009","10.1088/1126-6708/2009/09/029","OU-HET 623, KEK-TH-1317","hep-th hep-lat","http://arxiv.org/licenses/nonexclusive-distrib/1.0/","  Recently a novel large-N reduction has been proposed as a maximally
supersymmetric regularization of N=4 super Yang-Mills theory on RxS^3 in the
planar limit. This proposal, if it works, will enable us to study the theory
non-perturbatively on a computer, and hence to test the AdS/CFT correspondence
analogously to the recent works on the D0-brane system. We provide a nontrivial
check of this proposal by performing explicit calculations in the large-N
reduced model, which is nothing but the so-called plane wave matrix model,
around a particular stable vacuum corresponding to RxS^3. At finite temperature
and at weak coupling, we reproduce precisely the deconfinement phase transition
in the N=4 super Yang-Mills theory on RxS^3. This phase transition is
considered to continue to the strongly coupled regime, where it corresponds to
the Hawking-Page transition on the AdS side. We also perform calculations
around other stable vacua, and reproduce the phase transition in super
Yang-Mills theory on the corresponding curved space-times such as RxS^3/Z_q and
RxS^2.
","[{""version"":""v1"",""created"":""Thu, 9 Jul 2009 10:18:41 GMT""}]","2009-10-09"
"0907.1489","Dr Carole G. Mundell","C.G. Mundell (ARI, Liverpool John Moores University), P. Ferruit
  (Observatoire de Lyon), N. Nagar (Universidad de Concepcion) and A.S. Wilson
  (University of Maryland)","Radio Variability in Seyfert Nuclei","Accepted for publication in Astrophysical Journal; 15 pages, 7
  figures and 3 tables","Astrophys.J.703:802-815,2009","10.1088/0004-637X/703/1/802",,"astro-ph.CO astro-ph.HE","http://arxiv.org/licenses/nonexclusive-distrib/1.0/","  Comparison of 8.4-GHz radio images of a sample of 11 early-type Seyfert
galaxies with previous observations reveals possible variation in the nuclear
radio flux density in 5 of them over a 7-yr period. We find no correlation
between radio variability and nuclear radio luminosity or Seyfert nuclear type,
although the sample is small and dominated by type 2 Seyferts. Instead, a
possible correlation between the presence of nuclear radio variability and the
absence of ~100-pc-scale radio emission is seen. NGC2110 is the only source
with significant extended radio structure and strong nuclear variability (>38%
nuclear decline over seven years). Our results suggest that all Seyferts may
exhibit variation in their nuclear radio flux density at 8.4 GHz, but that
variability is more easily recognised in compact sources in which emission from
the variable nucleus is not diluted by unresolved, constant flux density
radio-jet emission within the central ~50 pc. If flares in radio light curves
correspond to ejection of new relativistic components or emergence of shocks in
the underlying flow, we suggest that radio jets may be intrinsically
non-relativistic during quiescence, but that Seyferts, as black-hole driven
AGN, have the capacity to accelerate relativistic jets during radio flares.
Taken together with the increased detection rate of flat spectrum radio nuclei
in Seyferts imaged at VLBI resolutions and the detection of variable water
megamaser emission, our results support the paradigm of intermittent periods of
quiescence and nuclear outburst across the Seyfert population. (Abridged).
","[{""version"":""v1"",""created"":""Thu, 9 Jul 2009 10:19:52 GMT""}]","2009-09-28"
"0907.1491","Pawel Klaja","Pawel Klaja","Comparative studies of the interaction in the low energy ppeta and
  ppeta' systems","Ph.D.Thesis (Advisor: Prof. Pawel Moskal), 2009, 92pp",,,,"nucl-ex","http://arxiv.org/licenses/nonexclusive-distrib/1.0/","  The COSY-11 collaboration measured the pp -> ppeta and pp -> ppeta' reactions
in order to perform comparative studies of the interactions within the
proton-proton-meson system. This thesis presents in detail the analysis of the
pp -> ppeta' reaction which was measured at the proton beam momentum of 3.260
GeV/c. The elaboration results in differential distributions of squared
invariant proton-proton (s_pp) and proton-eta' (s_peta') masses, as well as in
angular distributions and the total cross section at an excess energy of 16.4
MeV. The differential distributions s_pp and s_peta' are compared to
theoretical predictions and to the analogous spectra determined for the pp ->
ppeta reaction. The comparison of the results for the eta and eta' meson
production rather excludes the hypothesis that the enhancement observed in the
invariant mass distributions is due to the meson-proton interaction. Further,
the shapes of the distributions do not favour any of the postulated theoretical
models.
","[{""version"":""v1"",""created"":""Thu, 9 Jul 2009 10:27:44 GMT""}]","2009-07-10"
"0907.1492","Mario Amado","M. Amado, E. Diez, D. L\'opez-Romero, F. Rossella, J.M. Caridad, F.
  Dionigi, V. Bellani and D.K. Maude","Plateau insulator transition in graphene","10 pages, 5 figures",,"10.1088/1367-2630/12/5/053004",,"cond-mat.mes-hall cond-mat.mtrl-sci","http://arxiv.org/licenses/nonexclusive-distrib/1.0/","  The quantum Hall effect in a single-layer graphene sample is studied in
strong magnetic fields up to 28 T. Our measurements reveal the existence of a
metal- insulator transition from filling factor $\nu=-2$ to $\nu=0$. The value
of the universal scaling exponent is found to be $\kappa=0.57 $ in graphene and
therefore in a truly two-dimensional system. This value of $\kappa$ is in
agreement with the accepted universal value for the plateau-insulator
transitions in standard quasi two-dimensional electron and hole gases.
","[{""version"":""v1"",""created"":""Thu, 9 Jul 2009 10:29:50 GMT""},{""version"":""v2"",""created"":""Tue, 30 Mar 2010 08:21:56 GMT""}]","2015-05-13"
"0907.1493","Chouikha","Islam Boussaada, A. Raouf Chouikha, Jean-Marie Strelcyn","Isochronicity conditions for some planar polynomial systems","31 pages",,,,"math.DS math.CA","http://arxiv.org/licenses/nonexclusive-distrib/1.0/","  We study the isochronicity of centers at $O\in \mathbb{R}^2$ for systems
$\dot x=-y+A(x,y), \dot y=x+B(x,y)$, where $A, B\in \mathbb{R}[x,y]$, which can
be reduced to the Lienard type equation. Using the so-called C-algorithm we
have found 27 new multiparameter isochronous centers.
","[{""version"":""v1"",""created"":""Thu, 9 Jul 2009 10:32:31 GMT""},{""version"":""v2"",""created"":""Thu, 10 Sep 2009 12:56:52 GMT""}]","2009-09-10"
"0907.1494","Victor Chulaevsky","Victor Chulaevsky","Grand Ensembles of deterministic operators. II. Localization for generic
  `haarsh' potentials",,,,,"math-ph math.MP","http://arxiv.org/licenses/nonexclusive-distrib/1.0/","  We consider a particular class of lattice Schr\""odinger operators with
deterministic potentials depending upon an infinite number of parameters in an
auxiliary measurable space. We prove exponential dynamical localization for
generic families in the strong disorder regime, using a variant of the
Multi-Scale Analysis. In our model, the potential is generated by a function on
a torus which is discontinuous (`haarsh') and constructed with the help of an
expansion which reminds Haar's wavelet expansions.
","[{""version"":""v1"",""created"":""Thu, 9 Jul 2009 10:36:47 GMT""},{""version"":""v2"",""created"":""Fri, 21 Jan 2011 15:20:09 GMT""},{""version"":""v3"",""created"":""Fri, 26 Jul 2013 15:04:47 GMT""},{""version"":""v4"",""created"":""Mon, 29 Jul 2013 11:17:22 GMT""}]","2013-07-30"
"0907.1495","Pierre Nolin","Pierre Nolin","Inhomogeneity and universality: off-critical behavior of interfaces","17 pages, 5 figures",,,,"math.PR","http://arxiv.org/licenses/nonexclusive-distrib/1.0/","  We further study the interfaces arising in a situation of inhomogeneity. More
precisely, we identify a characteristic length for the gradient percolation
model, that enables us to tighten previous estimates established for it. This
allows to construct non-trivial scaling limits: the limiting objects share some
properties with critical percolation interfaces, but locally, they rather
behave like off-critical percolation interfaces.
","[{""version"":""v1"",""created"":""Thu, 9 Jul 2009 10:39:13 GMT""}]","2009-07-10"
"0907.1496","Hisaki Hatanaka","Hisaki Hatanaka, Kwei-Chou Yang","Radiative and Semileptonic B Decays Involving Higher K-Resonances in the
  Final States","27 pages, 4 figures, 7 tables;contents and figures corrected, title
  and references revised","Eur.Phys.J.C67:149-162,2010","10.1140/epjc/s10052-010-1293-7",,"hep-ph hep-ex","http://arxiv.org/licenses/nonexclusive-distrib/1.0/","  We study the radiative and semileptonic B decays involving a spin-$J$
resonant $K_J^{(*)}$ with parity $(-1)^J$ for $K_J^*$ and $(-1)^{J+1}$ for
$K_J$ in the final state. Using the large energy effective theory (LEET)
techniques, we formulate $B \to K_J^{(*)}$ transition form factors in the large
recoil region in terms of two independent LEET functions
$\zeta_\perp^{K_J^{(*)}}$ and $\zeta_\parallel^{K_J^{(*)}}$, the values of
which at zero momentum transfer are estimated in the BSW model. According to
the QCD counting rules, $\zeta_{\perp,\parallel}^{K_J^{(*)}}$ exhibit a dipole
dependence in $q^2$. We predict the decay rates for $B \to K_J^{(*)} \gamma$,
$B \to K_J^{(*)} \ell^+ \ell^-$ and $B \to K_J^{(*)}\nu \bar{\nu}$. The
branching fractions for these decays with higher $K$-resonances in the final
state are suppressed due to the smaller phase spaces and the smaller values of
$\zeta^{K_J^{(*)}}_{\perp,\parallel}$. Furthermore, if the spin of $K_J^{(*)}$
becomes larger, the branching fractions will be further suppressed due to the
smaller Clebsch-Gordan coefficients defined by the polarization tensors of the
$K_J^{(*)}$. We also calculate the forward backward asymmetry of the $B \to
K_J^{(*)} \ell^+ \ell^-$ decay, for which the zero is highly insensitive to the
$K$-resonances in the LEET parametrization.
","[{""version"":""v1"",""created"":""Thu, 9 Jul 2009 11:16:41 GMT""},{""version"":""v2"",""created"":""Wed, 13 Jan 2010 10:56:04 GMT""}]","2014-11-20"
"0907.1498","Andre Sopczak","Andre Sopczak","Cross-sections and branching ratios for charged Higgs searches","8 pages, contribution to the Workshop on Prospects for Charged Higgs
  Discovery at Colliders, 16-19 September 2008, Uppsala, Sweden",,,,"hep-ph","http://arxiv.org/licenses/nonexclusive-distrib/1.0/","  For the preparation of the experimental search for charged Higgs bosons at
the LHC detailed studies have been made to determine the expected charged Higgs
boson production cross-sections and decay branching ratios at sqrts = 14 TeV.
In the mass regime below the t-quark mass the expected production
cross-sections are discussed using PYTHIA and FeynHiggs program packages based
on the decay t to H^+b. For higher masses Next-to-Leading-Order (NLO
calculations have been used, and particular attention has been given to the
intermediate-mass region. The decay branching ratios have been studied with the
program packages FeynHiggs and HDecay. Higher-order corrections (Delta_b
corrections) in the MSSM are consistently taken into account. Two benchmark
scenarios are considered, one of them the `mhmax'.
","[{""version"":""v1"",""created"":""Thu, 9 Jul 2009 10:57:32 GMT""}]","2009-07-10"
"0907.1499","Michael Khanevsky","M. Khanevsky","Hofer's metric on the space of diameters","11 pages, 4 figures","J. Topology and Analysis 2009 01:04, 407-416","10.1142/S1793525309000187",,"math.SG math.DS","http://arxiv.org/licenses/nonexclusive-distrib/1.0/","  The present paper considers Hofer's distance between diameters in the unit
disk. We prove that this distance is unbounded and show its relation to
Lagrangian intersections.
","[{""version"":""v1"",""created"":""Thu, 9 Jul 2009 10:52:44 GMT""}]","2021-06-15"
"0907.1500","Natalie Krivova","N.A. Krivova, S.K. Solanki, T. Wenzler, B. Podlipnik","Reconstruction of solar UV irradiance since 1974",,"J. Geophys. Res., 114, D00I04, doi:10.1029/2009JD012375","10.1029/2009JD012375",,"astro-ph.SR astro-ph.EP","http://arxiv.org/licenses/nonexclusive-distrib/1.0/","  Variations of the solar UV irradiance are an important driver of chemical and
physical processes in the Earth's upper atmosphere and may also influence
global climate. Here we reconstruct solar UV irradiance in the range 115-400 nm
over the period 1974-2007 by making use of the recently developed empirical
extension of the SATIRE models employing SUSIM data. The evolution of the solar
photospheric magnetic flux, which is a central input to the model, is described
by the magnetograms and continuum images recorded at the Kitt Peak National
Solar Observatory between 1974 and 2003 and by the MDI instrument on SoHO since
1996. The reconstruction extends the available observational record by 1.5
solar cycles. The reconstructed Ly-alpha irradiance agrees well with the
composite time series by Woods et al (2000). The amplitude of the irradiance
variations grows with decreasing wavelength and in the wavelength regions of
special interest for studies of the Earth's climate (Ly-alpha and oxygen
absorption continuum and bands between 130 and 350 nm) is one to two orders of
magnitude stronger than in the visible or if integrated over all wavelengths
(total solar irradiance).
","[{""version"":""v1"",""created"":""Thu, 9 Jul 2009 10:54:02 GMT""}]","2009-11-23"
"0907.1501","Dimitar Mekerov","Dobrinka Gribacheva, Dimitar Mekerov","Canonical connection on a class of Riemannian almost product manifolds","19 pages, some corrections in the example; J. Geom. (2012)",,"10.1007/s00022-011-0098-7",,"math.DG","http://arxiv.org/licenses/nonexclusive-distrib/1.0/","  The canonical connection on a Riemannian almost product manifold is an
analogue to the Hermitian connection on an almost Hermitian manifold. In this
paper we consider the canonical connection on a class of Riemannian almost
product manifolds with non-integrable almost product structure. We construct
and characterize an example by a Lie group.
","[{""version"":""v1"",""created"":""Thu, 9 Jul 2009 11:00:55 GMT""},{""version"":""v2"",""created"":""Fri, 21 Jan 2011 12:38:44 GMT""},{""version"":""v3"",""created"":""Tue, 22 Feb 2011 12:30:23 GMT""},{""version"":""v4"",""created"":""Wed, 21 Mar 2012 09:27:38 GMT""}]","2012-03-22"
"0907.1502","Dimitar Mekerov","Dimitar Mekerov","P-connection on Riemannian almost product manifolds","8 pages","C. R. Acad. Bulgare Sci., 2009, 62, p.1363-1370",,"RS09-FMI-003 of the Scientific Research Fund, Paisii Hilendarski
  University of Plovdiv, Bulgaria","math.DG","http://arxiv.org/licenses/nonexclusive-distrib/1.0/","  In the present work, we introduce a linear connection (preserving the almost
product structure and the Riemannian metric) on Riemannian almost product
manifolds. This connection, called P-connection, is an analogue of the first
canonical connection of Lichnerowicz in the Hermitian geometry and the
B-connection in the geometry of the almost complex manifolds with Norden
metric. Particularly, we consider the P-connection on a the class of manifolds
with nonintegrable almost product structure.
","[{""version"":""v1"",""created"":""Thu, 9 Jul 2009 11:06:57 GMT""}]","2011-01-24"
"0907.1503","Oleksandr Gamayun","O. Gamayun, A. Marshakov","First Order String Theory and the Kodaira-Spencer Equations. II","21 pages, 3 figures",,"10.1088/1126-6708/2009/09/065","FIAN/TD-09/09, ITEP/TH-26/09","hep-th","http://arxiv.org/licenses/nonexclusive-distrib/1.0/","  The first-order bosonic string theory, perturbed by primary operator,
corresponding to the deformation of target-space complex structure is
considered. We compute the correlation functions in this theory and study their
divergencies. It is found, that consistency of these correlation functions with
the world-sheet conformal invariance requires the Kodaira-Spencer equations to
be satisfied by target-space Beltrami differentials. This statement is checked
explicitly for the three-point and four-point correlators, containing one probe
operator. We discuss the origin of these divergences and their relation with
beta-functions or effective action and polyvertex structures in BRST approach.
","[{""version"":""v1"",""created"":""Thu, 9 Jul 2009 11:17:17 GMT""}]","2015-05-13"
"0907.1504","C. H. Young","Chadwick H. Young, Tyler L. Bourke, Michael M. Dunham, Neal J. Evans
  II, Jes K. Jorgensen, Yancy L. Shirley, Kaisa E. Young, Christopher De Vries,
  Mark J. Claussen, Victor Popa","The Spitzer c2d Survey of Nearby Dense Cores: VI. The Protostars of
  Lynds Dark Nebula 1221","accepted for publication in ApJ","Astrophys.J.702:340-351,2009","10.1088/0004-637X/702/1/340",,"astro-ph.GA","http://arxiv.org/licenses/nonexclusive-distrib/1.0/","  Observations of Lynds Dark Nebula 1221 from the Spitzer Space Telescope are
presented. These data show three candidate protostars towards L1221, only two
of which were previously known. The infrared observations also show signatures
of outflowing material, an interpretation which is also supported by radio
observations with the Very Large Array. In addition, molecular line maps from
the Five College Radio Astronomy Observatory are shown.
  One-dimensional dust continuum modelling of two of these protostars, IRS1 and
IRS3, is described. These models show two distinctly different protostars
forming in very similar environments. IRS1 shows a higher luminosity and larger
inner radius of the envelope than IRS3. The disparity could be caused by a
difference in age or mass, orientation of outflow cavities, or the impact of a
binary in the IRS1 core.
","[{""version"":""v1"",""created"":""Thu, 9 Jul 2009 11:21:41 GMT""}]","2009-08-12"
"0907.1505","Martin Markl","Martin Markl and Elisabeth Remm","(Non-)Koszulness of operads for n-ary algebras, galgalim and other
  curiosities","Substantially revised and extended version",,,,"math.AT math.KT","http://arxiv.org/licenses/nonexclusive-distrib/1.0/","  We investigate operads for various n-ary algebras. As a useful tool we
introduce galgalim - analogs of the Lie-hedra for n-ary algebras. We then focus
to algebras with one anti-associative operation. We describe the relevant part
of the deformation cohomology for this type of algebras using the minimal model
for the anti-associative operad. We also discuss free partially associative
algebras and formulate some open problems.
","[{""version"":""v1"",""created"":""Thu, 9 Jul 2009 11:24:08 GMT""},{""version"":""v2"",""created"":""Thu, 25 Aug 2011 19:18:49 GMT""}]","2011-08-26"
