"0907.1293","Michal Natora","Tomas Hruz, Michal Natora, Madhuresh Agrawal","Higher-order distributions and nongrowing complex networks without
  multiple connections","This is an updated version of the original article published in
  Physical Review E. The original article can be found at
  http://link.aps.org/doi/10.1103/PhysRevE.77.046101","Phys. Rev. E 77, 046101 (2008)","10.1103/PhysRevE.77.046101",,"physics.soc-ph cond-mat.stat-mech","http://arxiv.org/licenses/nonexclusive-distrib/1.0/","  We study stochastic processes that generate non-growing complex networks
without self-loops and multiple edges (simple graphs). The work concentrates on
understanding and formulation of constraints which keep the rewiring stochastic
processes within the class of simple graphs. To formulate these constraints a
new concept of wedge distribution (paths of length 2) is introduced and its
relation to degree-degree correlation is studied. The analysis shows that the
constraints, together with edge selection rules, do not even allow to formulate
a closed master equation in the general case. We also introduce a particular
stochastic process which does not contain edge selection rules, but which, we
believe, can provide some insight into the complexities of simple graphs.
","[{""version"":""v1"",""created"":""Thu, 9 Jul 2009 10:47:39 GMT""}]","2009-07-10"
"0907.1364","Sannino Francesco","Francesco Sannino (CP3-Origins)","QCD Dual","RevTeX, 13 pages. Added discussion on operator matching and flavor
  decoupling. Version to match the published one","Phys.Rev.D80:065011,2009","10.1103/PhysRevD.80.065011","CP3-Origins:2009-6","hep-th hep-lat hep-ph","http://arxiv.org/licenses/nonexclusive-distrib/1.0/","  We uncover a novel solution of the 't Hooft anomaly matching conditions for
QCD. Interestingly in the perturbative regime the new gauge theory, if
interpreted as a possible QCD dual, predicts the critical number of flavors
above which QCD in the nonperturbative regime, develops an infrared stable
fixed point. Remarkably this value is identical to the maximum bound predicted
in the nonpertubative regime via the all-orders conjectured beta function for
nonsupersymmetric gauge theories.
","[{""version"":""v1"",""created"":""Thu, 9 Jul 2009 06:48:39 GMT""},{""version"":""v2"",""created"":""Wed, 22 Jul 2009 10:02:30 GMT""},{""version"":""v3"",""created"":""Tue, 18 Aug 2009 20:21:13 GMT""}]","2009-09-25"
"0907.1372","Stephanie Simmons","Stephanie Simmons, Jonathan A. Jones, Steven D. Karlen, Arzhang
  Ardavan and John J. L. Morton","Magnetic field sensors using 13-spin cat states","6 pages, 5 figures; v2: corrected figure 3, expanded conclusion,
  simplified explanation of equation 2; v3: accepted version","Phys. Rev. A 82, 022330 (2010)","10.1103/PhysRevA.82.022330",,"quant-ph","http://arxiv.org/licenses/nonexclusive-distrib/1.0/","  Measurement devices could benefit from entangled correlations to yield a
measurement sensitivity approaching the physical Heisenberg limit. Building
upon previous magnetometric work using pseudo-entangled spin states in
solution-state NMR, we present two conceptual advancements to better prepare
and interpret the pseudo-entanglement resource as well as the use of a 13-spin
cat state to measure the local magnetic field with a sensitivity beyond the
standard quantum limit.
","[{""version"":""v1"",""created"":""Thu, 9 Jul 2009 12:54:39 GMT""},{""version"":""v2"",""created"":""Wed, 21 Oct 2009 09:45:24 GMT""},{""version"":""v3"",""created"":""Wed, 24 Nov 2010 15:34:08 GMT""}]","2010-11-25"
"0907.1378","Masahiro Hotta","Masahiro Hotta","Controlled Hawking Process by Quantum Energy Teleportation","22 pages, 5 figures, to be published in Physical Review D with title
  change, and some typos are corrected","Phys.Rev.D81:044025,2010","10.1103/PhysRevD.81.044025",,"gr-qc hep-th quant-ph","http://arxiv.org/licenses/nonexclusive-distrib/1.0/","  In this paper, a new quantum mechanical method to extract energy from black
holes with contracting horizons is proposed. The method is based on a gedanken
experiment on quantum energy teleportation (QET), which has been recently
proposed in quantum information theory. We consider this QET protocol for N
massless fields in near-horizon regions of large-mass black holes with
near-horizon geometry described by the Minkowski metric. For each field, a
two-level spin is strongly coupled with the local quantum fluctuation outside
the horizon during a short time period. After the measurement of N fields,
N-bit information is obtained. During the measurement, positive-energy wave
packets of the fields form and then fall into the black hole. The amount of
excitation energy is independent of the measurement result. After absorption of
the wave packets and increase of the black hole mass, a
measurement-result-dependent local operation of the N fields is performed
outside the horizon. Then, accompanying the extraction of positive energy from
the quantum fluctuation by the operation, negative-energy wave packets of the
fields form and then fall into the black hole, decreasing the black hole mass.
This implies that a part of the absorbed positive energy emitted from the
measurement devices is effectively retrieved from the black hole via the
measurement results.
","[{""version"":""v1"",""created"":""Thu, 9 Jul 2009 06:58:34 GMT""},{""version"":""v2"",""created"":""Mon, 1 Feb 2010 22:39:16 GMT""},{""version"":""v3"",""created"":""Wed, 3 Feb 2010 06:33:51 GMT""}]","2010-04-29"
"0907.1387","Sergio Lukic","Julien Keller and Sergio Lukic","Numerical Weil-Petersson metrics on moduli spaces of Calabi-Yau
  manifolds","28 pages, 8 figures",,,,"math.DG hep-th","http://arxiv.org/licenses/nonexclusive-distrib/1.0/","  We introduce a simple and very fast algorithm that computes Weil-Petersson
metrics on moduli spaces of polarized Calabi-Yau manifolds. Also, by using
Donaldson's quantization link between the infinite and finite dimensional G.I.T
quotients that describe moduli spaces of varieties, we define a natural
sequence of Kaehler metrics. We prove that the sequence converges to the
Weil-Petersson metric. We also develop an algorithm that numerically
approximates such metrics, and hence the Weil-Petersson metric itself. Explicit
examples are provided on a family of Calabi-Yau Quintic hypersurfaces in CP^4.
The scope of our second algorithm is much broader; the same techniques can be
used to approximate metrics on null spaces of Dirac operators coupled to
Hermite Yang-Mills connections.
","[{""version"":""v1"",""created"":""Thu, 9 Jul 2009 07:43:49 GMT""},{""version"":""v2"",""created"":""Mon, 9 Jul 2012 02:18:56 GMT""}]","2012-07-10"
"0907.1406","Omar Aboura","Omar Aboura (CES, Samos)","On the discretization of backward doubly stochastic differential
  equations",,,,,"math.PR","http://arxiv.org/licenses/nonexclusive-distrib/1.0/","  In this paper, we are dealing with the approximation of the process (Y,Z)
solution to the backward doubly stochastic differential equation with the
forward process X . After proving the L2-regularity of Z, we use the Euler
scheme to discretize X and the Zhang approach in order to give a discretization
scheme of the process (Y,Z).
","[{""version"":""v1"",""created"":""Thu, 9 Jul 2009 06:12:13 GMT""}]","2009-07-10"
"0907.1407","Philip Evans","P.A. Evans, A.P. Beardmore, J.P. Osborne, G.A. Wynn (U. Leicester)","The unusual 2006 dwarf nova outburst of GK Perseii","9 pages, 7 figures, accepted for publication in MNRAS",,"10.1111/j.1365-2966.2009.15376.x",,"astro-ph.SR","http://arxiv.org/licenses/nonexclusive-distrib/1.0/","  The 2006 outburst of GK Perseii differed significantly at optical and
ultraviolet wavelengths from typical outbursts of this object. We present
multi-wavelength (X-ray, UV and optical) Swift and AAVSO data, giving
unprecedented broad-band coverage of the outburst, allowing us to follow the
evolution of the longer-than-normal 2006 outburst across these wavelengths. In
the optical and UV we see a triple-peaked morphology with maximum brightness
~1.5 magnitudes lower than in previous years. In contrast, the peak hard X-ray
flux is the same as in previous outbursts. We resolve this dichotomy by
demonstrating that the hard X-ray flux only accounts for a small fraction of
the total energy liberated during accretion, and interpret the optical/UV
outburst profile as arising from a series of heating and cooling waves
traversing the disc, caused by its variable density profile.
","[{""version"":""v1"",""created"":""Thu, 9 Jul 2009 06:24:33 GMT""}]","2015-05-13"
"0907.1408","Gabriella Raimondo","G. Raimondo","Joint Analysis of near-infrared properties and surface brightness
  fluctuations of LMC star clusters","25 pages, 12 figures, 4 tables, Accepted for publication in ApJ","Astrophys.J.700:1247-1261,2009","10.1088/0004-637X/700/2/1247",,"astro-ph.GA","http://arxiv.org/licenses/nonexclusive-distrib/1.0/","  Surface brightness fluctuations have been proved to be a very powerful
technique to determine the distance and characterize the stellar content in
extragalactic systems. Nevertheless, before facing the problem of stellar
content in distant galaxies, we need to calibrate the method onto nearby
well-known systems. In this paper we analyze the properties at $J$ and $K_s$
bands of a sample of 19 star clusters in the Large Magellanic Cloud (LMC), for
which accurate near-infrared (NIR) resolved star photometry, and integrated
photometry are available. For the same sample, we derive the SBF measurements
in $J$ and $K_s$-bands. We use the multi-purpose stellar population code
\emph{SPoT (Stellar POpulations Tools)} to simulate the color-magnitude
diagram, stellar counts, integrated magnitudes, colors, and surface brightness
fluctuations of each cluster. The present procedure allows us to estimate the
age and metallicity of the clusters in a consistent way, and provides a new
calibration of the empirical $s$-parameter. We take advantage of the high
sensitivity of NIR surface brightness fluctuations to thermally pulsing
asymptotic (TP-AGB) stars to test different mass-loss rates affecting the
evolution of such stars. We argue that NIR-SBFs can contribute to the
disentangling of the observable properties of TP-AGB stars, especially in
galaxies, where a large number of these stars are present.
","[{""version"":""v1"",""created"":""Thu, 9 Jul 2009 06:28:33 GMT""}]","2009-07-22"
"0907.1409","Yulia Kuznetsova","Yulia Kuznetsova","A duality for Moore groups","This version is accepted by J. Oper. Theory","J. Oper. Theory 69 Iss.2 (2013), 571-600",,,"math.FA math.QA","http://arxiv.org/licenses/nonexclusive-distrib/1.0/","  We suggest a new generalization of Pontryagin duality from the category of
Abelian locally compact groups to a category which includes all Moore groups,
i.e. groups whose irreducible representations are finite-dimensional. Objects
in this category are pro-C*-algebras with a structure of Hopf algebras (in the
strict algebraic sense) with respect to a certain topological tensor product.
","[{""version"":""v1"",""created"":""Thu, 9 Jul 2009 15:40:02 GMT""},{""version"":""v2"",""created"":""Sun, 14 Mar 2010 19:56:53 GMT""},{""version"":""v3"",""created"":""Wed, 8 Dec 2010 20:55:26 GMT""},{""version"":""v4"",""created"":""Thu, 24 Feb 2011 14:07:06 GMT""},{""version"":""v5"",""created"":""Fri, 18 Mar 2011 12:09:20 GMT""},{""version"":""v6"",""created"":""Fri, 9 Dec 2011 11:41:52 GMT""}]","2015-03-13"
"0907.1411","Ilya Lvovich Shapiro","Valeri P. Frolov and Ilya L. Shapiro","Black Holes in Higher Dimensional Gravity Theory with Quadratic in
  Curvature Corrections","12 pages, 4 figures. A few references added, some details added to
  better illustrate the result. Version accepted in Physical Review D","Phys.Rev.D80:044034,2009","10.1103/PhysRevD.80.044034",,"gr-qc hep-th","http://arxiv.org/licenses/nonexclusive-distrib/1.0/","  Static spherically symmetric black holes are discussed in the framework of
higher dimensional gravity with quadratic in curvature terms. Such terms
naturally arise as a result of quantum corrections induced by quantum fields
propagating in the gravitational background. We focus our attention on the
correction of the form ${\cal C}^2=C_{\alpha\beta\gamma\delta}
C^{\alpha\beta\gamma\delta}$. The Gauss-Bonnet equation in four-dimensional
(4D) spacetime enables one to reduce this term in the action to the terms
quadratic in the Ricci tensor and scalar curvature. As a result the
Schwarzschild solution which is Ricci flat will be also a solution of the
theory with the Weyl scalar ${\cal C}^2$ correction. An important new feature
of the spaces with dimension $D > 4$ is that in the presence of the Weyl
curvature-squared term a solution necessary differs from the corresponding
`classical' vacuum Tangherlini metric. This difference is related to the
presence of {\em secondary} or {\em induced} hair. We explore how the
Tangherlini solution is modified by `quantum corrections', assuming that the
gravitational radius $r_0$ is much larger than the scale of the quantum
corrections. We also demonstrated that finding a general solution beyond the
perturbation method can be reduced to solving a single third order ODE (master
equation).
","[{""version"":""v1"",""created"":""Thu, 9 Jul 2009 12:58:58 GMT""},{""version"":""v2"",""created"":""Tue, 14 Jul 2009 10:21:31 GMT""},{""version"":""v3"",""created"":""Wed, 12 Aug 2009 00:01:35 GMT""}]","2009-11-06"
"0907.1412","Jose Illana","J.I. Illana, M. Masip, D. Meloni","Atmospheric lepton fluxes at ultrahigh energies","10 pages, 4 figures; published version","JCAP 0909:008,2009","10.1088/1475-7516/2009/09/008","UG-FT-254/09, CAFPE-124/09, RM3-TH/09-1","hep-ph astro-ph.HE","http://arxiv.org/licenses/nonexclusive-distrib/1.0/","  In order to estimate the possibility to observe exotic physics in a neutrino
telescope, it is essential to first understand the flux of atmospheric
neutrinos, muons and dimuons. We study the production of these leptons by
high-energy cosmic rays. We identify three main sources of muons of energy E >
10^6 GeV: the weak decay of charm and bottom mesons and the electromagnetic
decay of unflavored mesons. Contrary to the standard assumption, we find that
eta mesons, not the prompt decay of charm hadrons, are the dominant source of
atmospheric muons at these energies. We show that, as a consequence, the ratio
between the neutrino and muon fluxes is significantly reduced. For dimuons,
which may be a background for long-lived staus produced near a neutrino
telescope, we find that pairs of E ~ 10^7 GeV forming an angle above 10^-6 rad
are produced through D (80%) or B (10%) meson decay and through Drell-Yan
proceses (10%). The frequency of all these processes has been evaluated using
the jet code PYTHIA.
","[{""version"":""v1"",""created"":""Thu, 9 Jul 2009 14:01:56 GMT""},{""version"":""v2"",""created"":""Wed, 9 Sep 2009 15:42:02 GMT""}]","2009-09-28"
"0907.1413","Anand Sarwate","Kamalika Chaudhuri, Anand D. Sarwate","Privacy constraints in regularized convex optimization","This paper has been withdrawn by the authors due to some errors.
  Corrections have been included in arXiv:0912.0071v4",,,,"cs.CR cs.DB cs.LG","http://arxiv.org/licenses/nonexclusive-distrib/1.0/","  This paper is withdrawn due to some errors, which are corrected in
arXiv:0912.0071v4 [cs.LG].
","[{""version"":""v1"",""created"":""Thu, 9 Jul 2009 06:51:54 GMT""},{""version"":""v2"",""created"":""Fri, 4 Jun 2010 20:36:43 GMT""},{""version"":""v3"",""created"":""Tue, 21 Jun 2011 17:05:53 GMT""}]","2011-06-22"
"0907.1414","Narayanan Kutty Karuppath","Narayanankutty Karuppath and P.Achuthan","Quantum Non-Locality and Universe",,,,,"physics.gen-ph","http://arxiv.org/licenses/nonexclusive-distrib/1.0/","  The notion of Non-Locality (NL) in physics has great epistemological
implications and impact on the perceptive of Reality. Numerous counter
intuitive experimental results that clearly violate Bell's inequality have
prompted several physicists to believe in 'mysterious' non-local correlations
particularly in quantum systems of EPR type. Not commenting much on whether NL
is true or not, our contention is that NL, in general, leads to the concept of
holistic universe and further to a global concept of
'Consciousness-Centered-Cosmos' (CCC) as almost inevitable rational outcome.
These suggestions though ostensibly unorthodox, are rather within rational and
legitimate frame work of science. Our reasoning is quite distinct from the
erstwhile doctrine of the role of consciousness in the measurement problem and
state vector reduction although the latter may add further credence to the our
contention. We address particularly the implications NL and discuss certain
related aspects of new quantum world view in general. The less recognized
association of the principles of uncertainty with locality, causality, the
arrow of time and reality are brought out. Perhaps these underpinnings are much
less appreciated than necessary.
","[{""version"":""v1"",""created"":""Thu, 9 Jul 2009 07:25:36 GMT""}]","2009-07-10"
"0907.1415","Martin Gaskell","C. Martin Gaskell and Elizabeth S. Klimek","Variability of Active Galactic Nuclei from the Optical to X-ray Regions","Invited talk given at Euro Asian Astronomical Society meeting in
  Moscow, June 2002. 20 pages, 4 figures. References updated","Astron.Astrophys.Trans.611:22-680,2003","10.1080/1055679031000153851",,"astro-ph.CO astro-ph.GA","http://arxiv.org/licenses/nonexclusive-distrib/1.0/","  Some progress in understanding AGN variability is reviewed. Reprocessing of
X-ray radiation to produce significant amounts of longer-wavelength continua
seems to be ruled out. In some objects where there has been correlated X-ray
and optical variability, the amplitude of the optical variability has exceeded
the amplitude of X-ray variability. We suggest that accelerated particles
striking material could be linking X-ray and optical variability (as in
activity in the solar chromosphere). Beaming effects could be significant in
all types of AGN. The diversity in optical/X-ray relationships at different
times in the same object, and between different objects, might be explained by
changes in geometry and directions of motion relative to our line of sight.
Linear shot-noise models of the variability are ruled out; instead there must
be large-scale organization of variability. Variability occurs on
light-crossing timescales rather than viscous timescales and this probably
rules out the standard Shakura-Sunyaev accretion disk. Radio-loud and
radio-quiet AGNs have similar continuum shapes and similar variability
properties. This suggests similar continuum origins and variability mechanisms.
Despite their extreme X-ray variability, narrow-line Seyfert 1s (NLS1s) do not
show extreme optical variability.
","[{""version"":""v1"",""created"":""Thu, 9 Jul 2009 07:16:21 GMT""}]","2009-07-27"
"0907.1416","Philip Lah","Philip Lah, Michael B. Pracy, Jayaram N. Chengalur, Frank H. Briggs,
  Matthew Colless, Roberto De Propris, Shaun Ferris, Brian P. Schmidt and
  Bradley E. Tucker","The HI gas content of galaxies around Abell 370, a galaxy cluster at z =
  0.37","accepted by MNRAS",,"10.1111/j.1365-2966.2009.15368.x",,"astro-ph.CO","http://arxiv.org/licenses/nonexclusive-distrib/1.0/","  We used observations from the Giant Metrewave Radio Telescope to measure the
atomic hydrogen gas content of 324 galaxies around the galaxy cluster Abell 370
at a redshift of z = 0.37 (a look-back time of ~4 billion years). The HI 21-cm
emission from these galaxies was measured by coadding their signals using
precise optical redshifts obtained with the Anglo-Australian Telescope. The
average HI mass measured for all 324 galaxies is (6.6 +- 3.5)x10^9 solar
masses, while the average HI mass measured for the 105 optically blue galaxies
is (19.0 +- 6.5)x10^9 solar masses. The significant quantities of gas found
around Abell 370, suggest that there has been substantial evolution in the gas
content of galaxy clusters since redshift z = 0.37. The total amount of HI gas
found around Abell 370 is up to ~8 times more than that seen around the Coma
cluster, a nearby galaxy cluster of similar size. Despite this higher gas
content, Abell 370 shows the same trend as nearby clusters, that galaxies close
to the cluster core have lower HI gas content than galaxies further away. The
Abell 370 galaxies have HI mass to optical light ratios similar to local galaxy
samples and have the same correlation between their star formation rate and HI
mass as found in nearby galaxies. The average star formation rate derived from
[OII] emission and from de-redshifted 1.4 GHz radio continuum for the Abell 370
galaxies also follows the correlation found in the local universe. The large
amounts of HI gas found around the cluster can easily be consumed by the
observed star formation rate in the galaxies over the ~4 billion years (from z
= 0.37) to the present day.
","[{""version"":""v1"",""created"":""Thu, 9 Jul 2009 07:44:41 GMT""},{""version"":""v2"",""created"":""Fri, 10 Jul 2009 01:20:05 GMT""}]","2015-05-13"
"0907.1417","Radoslaw Smolec","W. A. Dziembowski and R. Smolec","Multimode Cepheids in the Large Magellanic Cloud - challenges for theory","3 pages, 4 figures, Stellar Pulsation: Challenges for Theory and
  Observation, Santa Fe, NM, 31 May - 5 June, 2009","AIP Conf.Proc.1170:83-85,2009","10.1063/1.3246580",,"astro-ph.SR","http://arxiv.org/licenses/nonexclusive-distrib/1.0/","  Data on multimode Cepheids from OGLE-III catalog of the LMC Cepheids are
confronted with results from model calculations. Models whose radial mode
periods are consistent with observation are not always in agreement with
published evolutionary models. Nonradial mode interpretation is considered for
the cases of unusual period ratios. The greatest challenge for stellar
pulsation theory is explanation of double-mode pulsators with period ratios
near 0.6.
","[{""version"":""v1"",""created"":""Thu, 9 Jul 2009 07:01:13 GMT""}]","2009-10-02"
"0907.1418","Anil Singh","A. K. Singh, M. Snure, A. Tiwari and S. Patnaik","Effect of epitaxial strain on the magneto-electric coupling of YMnO3
  thin films","17 pages, 4 figures. Accepted for publication in J. Appl. Phys",,"10.1063/1.3168423",,"cond-mat.mtrl-sci","http://arxiv.org/licenses/nonexclusive-distrib/1.0/","  We report synthesis of phase pure multiferroic YMnO3 thin films on sapphire
(0001)with conducting ZnGaO buffer contact layer. Films were prepared by using
pulsed laser deposition technique and characterized using x-ray
diffraction(XRD), Scanning electron microscopy (SEM), Energy dispersive
absorption spectroscopy (EDAX) and magnetic field dependent dielectric
measurement techniques. Structural characterizations indicated phase purity and
epitaxial nature of the films. The dielectric response indicated an anomaly in
dielectric constant and tand in the vicinity of 30 K, well below the bulk Neel
temperature ~ 70 K. This anomaly in dielectric constant and tand and its
magnetic field dependence is explained as an influence of strain due to lattice
mismatch between the substrate and YMnO3 film. A substantial enhancement in
magnetocapacitance was also observed for magnetic field applied parallel to ab
plane of the film. Our results show that it is possible to tune the
multiferroic property of YMnO3 via changes in ferroelastic route.
","[{""version"":""v1"",""created"":""Thu, 9 Jul 2009 07:01:37 GMT""}]","2015-05-13"
"0907.1419","Rodolfo H. Barb\'a","Rodolfo H. Barba, Jesus Maiz Apellaniz, Enrique Perez, Monica Rubio,
  Alberto Bolatto, Cecilia Farina, Guillermo Bosch, Nolan R. Walborn","An HST/NICMOS view of the prototypical giant HII region NGC604 in M33","Paper presented in the Workshop ""Young massive star clusters: initial
  conditions and environments"" (Granada, Spain - Sept 2007). Astrophysics &
  Space Science in press, 7 pages, 4 figures","Astrophys.Space Sci.324:309-313,2009","10.1007/s10509-009-0104-9",,"astro-ph.GA","http://arxiv.org/licenses/nonexclusive-distrib/1.0/","  We present the first high-spatial resolution near-infrared (NIR) imaging of
NGC 604, obtained with the NICMOS camera aboard the Hubble Space Telescope
(HST). These NICMOS broadband images reveal new NIR point sources, clusters,
and diffuse structures. We found an excellent spatial correlation between the
8.4 GHz radio continuum and the 2.2mu-m nebular emission. Moreover, massive
young stellar object candidates appear aligned with these radio peaks,
reinforcing the idea that those areas are star-forming regions. Three different
scaled OB associations are recognized in the NICMOS images. The brightest NIR
sources in our images have properties that suggest that they are red supergiant
stars, of which one of them was previously known. This preliminary analysis of
the NICMOS images shows the complexity of the stellar content of the NGC 604
nebula.
","[{""version"":""v1"",""created"":""Thu, 9 Jul 2009 07:13:02 GMT""}]","2009-12-04"
"0907.1420","Koichiro Umetsu","Koichiro Umetsu","Hawking Radiation from Kerr-Newman Black Hole and Tunneling Mechanism","18pages, 1 figure","Int.J.Mod.Phys.A25:4123-4140,2010","10.1142/S0217751X10050251",,"hep-th","http://arxiv.org/licenses/nonexclusive-distrib/1.0/","  We present the derivation of Hawking radiation by using the tunneling
mechanism in a rotating and charged black hole background. We show that the
4-dimensional Kerr-Newman metric, which has a spherically nonsymmetric
geometry, becomes an effectively 2-dimensional spherically symmetric metric by
using the technique of the dimensional reduction near the horizon. We can thus
readily apply the tunneling mechanism to the nonspherical Kerr and Kerr-Newman
metric.
","[{""version"":""v1"",""created"":""Thu, 9 Jul 2009 14:26:39 GMT""}]","2014-11-20"
