"0907.1441","Dennis Jack","D. Jack, P. H. Hauschildt, E. Baron","Time-dependent radiative transfer with PHOENIX","7 pages, 12 figures",,"10.1051/0004-6361/200810982",,"astro-ph.IM astro-ph.SR","http://arxiv.org/licenses/nonexclusive-distrib/1.0/","  Aims. We present first results and tests of a time-dependent extension to the
general purpose model atmosphere code PHOENIX. We aim to produce light curves
and spectra of hydro models for all types of supernovae. Methods. We extend our
model atmosphere code PHOENIX to solve time-dependent non-grey, NLTE, radiative
transfer in a special relativistic framework. A simple hydrodynamics solver was
implemented to keep track of the energy conservation of the atmosphere during
free expansion. Results. The correct operation of the new additions to PHOENIX
were verified in test calculations. Conclusions. We have shown the correct
operation of our extension to time-dependent radiative transfer and will be
able to calculate supernova light curves and spectra in future work.
","[{""version"":""v1"",""created"":""Thu, 9 Jul 2009 08:10:32 GMT""}]","2015-05-13"
"0907.1442","Gerald Teschl","Mark S. Ashbaugh, Fritz Gesztesy, Marius Mitrea, and Gerald Teschl","Spectral Theory for Perturbed Krein Laplacians in Nonsmooth Domains","60 pages","Adv. Math. 223, 1372-1467 (2010)","10.1016/j.aim.2009.10.006",,"math.SP math.AP","http://arxiv.org/licenses/nonexclusive-distrib/1.0/","  We study spectral properties for $H_{K,\Omega}$, the Krein--von Neumann
extension of the perturbed Laplacian $-\Delta+V$ defined on
$C^\infty_0(\Omega)$, where $V$ is measurable, bounded and nonnegative, in a
bounded open set $\Omega\subset\mathbb{R}^n$ belonging to a class of nonsmooth
domains which contains all convex domains, along with all domains of class
$C^{1,r}$, $r>1/2$. In particular, in the aforementioned context we establish
the Weyl asymptotic formula \[ #\{j\in\mathbb{N} |
\lambda_{K,\Omega,j}\leq\lambda\} = (2\pi)^{-n} v_n |\Omega|
\lambda^{n/2}+O\big(\lambda^{(n-(1/2))/2}\big) {as} \lambda\to\infty, \] where
$v_n=\pi^{n/2}/ \Gamma((n/2)+1)$ denotes the volume of the unit ball in
$\mathbb{R}^n$, and $\lambda_{K,\Omega,j}$, $j\in\mathbb{N}$, are the non-zero
eigenvalues of $H_{K,\Omega}$, listed in increasing order according to their
multiplicities. We prove this formula by showing that the perturbed Krein
Laplacian (i.e., the Krein--von Neumann extension of $-\Delta+V$ defined on
$C^\infty_0(\Omega)$) is spectrally equivalent to the buckling of a clamped
plate problem, and using an abstract result of Kozlov from the mid 1980's. Our
work builds on that of Grubb in the early 1980's, who has considered similar
issues for elliptic operators in smooth domains, and shows that the question
posed by Alonso and Simon in 1980 pertaining to the validity of the above Weyl
asymptotic formula continues to have an affirmative answer in this nonsmooth
setting.
","[{""version"":""v1"",""created"":""Thu, 9 Jul 2009 08:13:41 GMT""},{""version"":""v2"",""created"":""Mon, 25 Jan 2010 19:38:21 GMT""}]","2010-01-25"
"0907.1443","Pietro Falgari","M. Beneke (RWTH Aachen University), P. Falgari, C. Schwinn (IPPP
  Durham)","Soft radiation in heavy-particle pair production: all-order colour
  structure and two-loop anomalous dimension","36 pages, LaTeX, 2 figures. v2 matches published version (improved
  discussion of NNLL resummation, note added on work by Ferroglia et al.)","Nucl.Phys.B828:69-101,2010","10.1016/j.nuclphysb.2009.11.004","PITHA 09/16, IPPP/09/48, DCPT/09/96, SFB/CPP-09-59","hep-ph","http://arxiv.org/licenses/nonexclusive-distrib/1.0/","  We present a factorization formula for the production of pairs of heavy
coloured particles in hadronic collisions at the production threshold, which
forms the basis for the resummation of soft gluons and Coulomb gluons. We
construct a basis in colour space that diagonalizes the soft function appearing
in the factorization formula to all orders in perturbation theory. This extends
recent results on the structure of soft anomalous dimensions and allows us to
determine an analytic expression for the two-loop soft anomalous dimension at
threshold for all production processes of interest.
","[{""version"":""v1"",""created"":""Thu, 9 Jul 2009 08:14:29 GMT""},{""version"":""v2"",""created"":""Thu, 12 Nov 2009 15:30:17 GMT""}]","2010-04-08"
"0907.1444","Dance Spirkoska","D. Spirkoska, J. Arbiol, A. Gustafsson, S. Conesa-Boj, F. Glas, I.
  Zardo, M. Heigoldt, M. H. Gass, A. L. Bleloch, S. Estrade, M. Kaniber, J.
  Rossler, F. Peiro, J.R. Morante, L. Samuelson, G. Abstreiter and A.
  Fontcuberta i Morral","Structural and optical properties of high quality zinc-blende/wurtzite
  GaAs hetero-nanowires","24 pages","Phys. Rev. B 80, 245325 (2009)","10.1103/PhysRevB.80.245325",,"cond-mat.mes-hall cond-mat.mtrl-sci","http://arxiv.org/licenses/nonexclusive-distrib/1.0/","  The structural and optical properties of 3 different kinds of GaAs nanowires
with 100% zinc-blende structure and with an average of 30% and 70% wurtzite are
presented. A variety of shorter and longer segments of zinc-blende or wurtzite
crystal phases are observed by transmission electron microscopy in the
nanowires. Sharp photoluminescence lines are observed with emission energies
tuned from 1.515 eV down to 1.43 eV when the percentage of wurtzite is
increased. The downward shift of the emission peaks can be understood by
carrier confinement at the interfaces, in quantum wells and in random short
period superlattices existent in these nanowires, assuming a staggered
band-offset between wurtzite and zinc-blende GaAs. The latter is confirmed also
by time resolved measurements. The extremely local nature of these optical
transitions is evidenced also by cathodoluminescence measurements. Raman
spectroscopy on single wires shows different strain conditions, depending on
the wurtzite content which affects also the band alignments. Finally, the
occurrence of the two crystallographic phases is discussed in thermodynamic
terms.
","[{""version"":""v1"",""created"":""Thu, 9 Jul 2009 08:19:55 GMT""}]","2015-05-13"
"0907.1445","Maxim Dvornikov","Maxim Dvornikov (1,2) and Claudio O. Dib (1) ((1) Universidad
  T\'ecnica Federico Santa Mar\'ia, (2) IZMIRAN)","Spin-down of neutron stars by neutrino emission","9 pages, 2 eps figures, RevTeX 4-1. The paper was significantly
  modified. Now it addresses only the issues of a neutron star spin-down.
  Version to be published in Phys. Rev. D","Phys.Rev.D82:043006,2010","10.1103/PhysRevD.82.043006","USM-TH-250","astro-ph.HE hep-ph","http://arxiv.org/licenses/nonexclusive-distrib/1.0/","  We study the spin-down of a neutron star during its early stages due to the
neutrino emission. The mechanism we consider is the subsequent collisions of
the produced neutrinos with the outer shells of the star. We find that this
mechanism can indeed slow down the star rotation but only in the first tens of
seconds of the core formation, which is when the appropriate conditions of flux
and collision rate are met. We find that this mechanism can extract less than 1
% of the star angular momentum, a result which is much less than previously
estimated by other authors.
","[{""version"":""v1"",""created"":""Thu, 9 Jul 2009 15:02:49 GMT""},{""version"":""v2"",""created"":""Mon, 9 Aug 2010 12:58:36 GMT""}]","2014-11-20"
"0907.1446","Yao Cheng","Yao Cheng","Nuclear spin-density wave theory",,,,,"physics.gen-ph cond-mat.other","http://arxiv.org/licenses/nonexclusive-distrib/1.0/","  Recently [arXiv:0906.5417], we reported a quantum phase transition of 103mRh
excited by bremsstrahlung pumping. The long-lived Moessbauer excitation is
delocalized as a neutral quasiparticle carrying a spin current. This letter
gives a general theory for a nuclear spin-density wave propagating on crystals
consisting of identical nuclei with a multipolar transition.
","[{""version"":""v1"",""created"":""Thu, 9 Jul 2009 08:21:13 GMT""},{""version"":""v2"",""created"":""Tue, 15 Sep 2009 06:46:24 GMT""}]","2009-09-15"
"0907.1447","Matt Jarvis","Matt J. Jarvis (1), Hanifa Teimourian (1), Chris Simpson (2), Daniel
  J.B. Smith (2 and 3), Steve Rawlings (4) and David Bonfield (1) ((1)
  Hertfordshire, (2) LJMU, (3) Nottingham, (4) Oxford)","The discovery of a typical radio galaxy at z = 4.88","5 pages, 3 figures, accepted for publication in MNRAS Letters",,"10.1111/j.1745-3933.2009.00715.x",,"astro-ph.CO astro-ph.GA","http://arxiv.org/licenses/nonexclusive-distrib/1.0/","  In this letter we report the discovery of a z=4.88 radio galaxy discovered
with a new technique which does not rely on pre-selection of a sample based on
radio properties such as steep-spectral index or small angular size. This radio
galaxy was discovered in the Elais-N2 field and has a spectral index of alpha =
0.75, i.e. not ultra-steep spectrum. It also has a luminosity consistent with
being drawn from the break of the radio luminosity function and can therefore
be considered as a typical radio galaxy. Using the Spitzer-SWIRE data over this
field we find that the host galaxy is consistent with being similarly massive
to the lower redshift powerful radio galaxies (~1-3L*). We note however, that
at z=4.88 the H-alpha line is redshifted into the IRAC 3.6micron filter and
some of the flux in this band may be due to this rather than stellar continuum
emission. The discovery of such a distant radio source from our initial
spectroscopic observations demonstrate the promise of our survey for finding
the most distant radio sources.
","[{""version"":""v1"",""created"":""Thu, 9 Jul 2009 08:26:33 GMT""}]","2015-05-13"
"0907.1448","Yveline Lebreton","Yveline Lebreton, Josefina Montalban, Melanie Godart, Pierre Morel,
  Arlette Noels and Marc-Antoine Dupret","Ledoux's convection criterion in evolution and asteroseismology of
  massive stars","Contribution to the Proceedings of the 38th LIAC/HELAS-ESTA/BAG, 2008
  Accepted for publication in CoAst",,,,"astro-ph.SR","http://arxiv.org/licenses/nonexclusive-distrib/1.0/","  Saio et al. (2006) have shown that the presence of an intermediate convective
zone (ICZ) in post-main sequence models could prevent the propagation of
g-modes in the radiative interior and hence avoid the corresponding radiative
damping. The development of such a convective region highly depends on the
structure of the star in the mu-gradient region surrounding the convective core
during the main sequence phase. In particular,the development of this ICZ
depends on physical processes such as mass loss, overshooting (Chiosi & Maeder
1986, Chiosi et al. 1992, see also Godart et al., these proceedings) and
convective instability criterion (Schwarzschild's or Ledoux's criteria). In
this paper we study the consequences of adopting the Ledoux's criterion on the
evolution of the convective regions in massive stars (15 and 20 Msun), and on
the pulsation spectrum of these new B-type variables (also called SPBsg).
","[{""version"":""v1"",""created"":""Thu, 9 Jul 2009 08:59:57 GMT""}]","2009-07-10"
"0907.1449","Francisco Lobo","Tiberiu Harko, Zolt\'an Kov\'acs, Francisco S. N. Lobo","Testing Ho\v{r}ava-Lifshitz gravity using thin accretion disk properties","7 pages, 4 figures. V2: minor additions and references added; to
  appear in Phys. Rev. D","Phys.Rev.D80:044021,2009","10.1103/PhysRevD.80.044021",,"gr-qc astro-ph.HE hep-th","http://arxiv.org/licenses/nonexclusive-distrib/1.0/","  Recently, a renormalizable gravity theory with higher spatial derivatives in
four dimensions was proposed by Horava. The theory reduces to Einstein gravity
with a non-vanishing cosmological constant in IR, but it has improved UV
behaviors. The spherically symmetric black hole solutions for an arbitrary
cosmological constant, which represent the generalization of the standard
Schwarzschild-(A)dS solution, has also been obtained for the Horava-Lifshitz
theory. The exact asymptotically flat Schwarzschild type solution of the
gravitational field equations in Horava gravity contains a quadratic increasing
term, as well as the square root of a fourth order polynomial in the radial
coordinate, and it depends on one arbitrary integration constant. The IR
modified Horava gravity seems to be consistent with the current observational
data, but in order to test its viability more observational constraints are
necessary. In the present paper we consider the possibility of observationally
testing Horava gravity by using the accretion disk properties around black
holes. The energy flux, temperature distribution, the emission spectrum as well
as the energy conversion efficiency are obtained, and compared to the standard
general relativistic case. Particular signatures can appear in the
electromagnetic spectrum, thus leading to the possibility of directly testing
Horava gravity models by using astrophysical observations of the emission
spectra from accretion disks.
","[{""version"":""v1"",""created"":""Thu, 9 Jul 2009 08:31:24 GMT""},{""version"":""v2"",""created"":""Mon, 10 Aug 2009 12:49:13 GMT""}]","2009-08-25"
"0907.1451","Gerhard Ecker","V. Cirigliano, G. Ecker and A. Pich","Reanalysis of pion pion phase shifts from K -> pi pi decays","8 pages","Phys.Lett.B679:445-448,2009","10.1016/j.physletb.2009.08.027","LA-UR 09-03948, UWThPh-2009-5, IFIC/09-24, FTUV/09-0709","hep-ph","http://arxiv.org/licenses/nonexclusive-distrib/1.0/","  We re-investigate the impact of isospin violation for extracting the s-wave
pion pion scattering phase shift difference delta_0(M_K) - delta_2(M_K) from K
-> pi pi decays. Compared to our previous analysis in 2003, more precise
experimental data and improved knowledge of low-energy constants are used. In
addition, we employ a more robust data-driven method to obtain the phase shift
difference delta_0(M_K) - delta_2(M_K) = (52.5 \pm 0.8_{exp} \pm 2.8_{theor})
degrees.
","[{""version"":""v1"",""created"":""Thu, 9 Jul 2009 09:07:43 GMT""}]","2009-09-28"
"0907.1452","Tigran Tchrakian","Eugen Radu, D. H. Tchrakian","Gravitating Yang--Mills fields in all dimensions","Presented to Heraeus School, Bremen, September 2008",,,,"gr-qc","http://arxiv.org/licenses/nonexclusive-distrib/1.0/","  A classification of gravitating Yang--Mills systems in all dimensions is
presented. These systems are set up so that they support finite energy
solutions. Both regular and black hole solutions are considered, the former
being the limit of the latter for vanishing event horizon radius. Special
attention is paid to systems necessarily involving higher order Yang--Mills
curvature terms, along with the option of incorporating higher order terms in
the Riemann curvature. The scope here is restricted to Einstein systems, with
or without cosmological constant, and the Yang--Mills(--Higgs) systems.
","[{""version"":""v1"",""created"":""Thu, 9 Jul 2009 15:16:55 GMT""}]","2009-07-10"
"0907.1453","Wen Zhao","W.Zhao and W.Zhang","Detecting Relic Gravitational Waves in the CMB: Comparison of Planck and
  Ground-based Experiments","8 pages, 9 figures, 6 tables","Phys.Lett.B677:16-23, 2009","10.1016/j.physletb.2009.05.015",,"astro-ph.CO","http://arxiv.org/licenses/nonexclusive-distrib/1.0/","  We compare the detection abilities for the relic gravitational waves by two
kinds of forthcoming cosmic microwave background radiation (CMB) experiments,
space-based Planck satellite and the various ground-based experiments.
Comparing with the ground-based experiments, Planck satellite can observe all
the CMB power spectra in all the multipole range, but having much larger
instrumental noises. We find that, for the uncertainty of the tensor-to-scalar
ratio $\Delta r$, PolarBear (II) as a typical ground-based experiment can give
much smaller value than Planck satellite. However, for the uncertainty of the
spectral index $\Delta n_t$, Planck can give the similar result with PolarBear
(II). If combining these two experiments, the value of $\Delta n_t$ can be
reduced by a factor 2. For the model with $r=0.1$, the constraint $\Delta
n_t=0.10$ is expected to be achieved, which provides an excellent opportunity
to study the physics in the very early universe. We also find the observation
in the largest scale ($\ell<20$) is very important for constraining the
spectral index $n_t$. So it is necessary to combine the observations of the
future space-based and ground-based CMB experiments to determine the relic
gravitational waves.
","[{""version"":""v1"",""created"":""Thu, 9 Jul 2009 08:43:59 GMT""}]","2009-07-17"
"0907.1454","Vdovin Evgenij","E.E. Vdovin, O. Makarovsky, A. Patane, L. Eaves, Yu.N. Khanin","Sensitive detection of photoexcited carriers by resonant tunneling
  through a single quantum dot","5 pages, 4 figures","Physical Review B 79 (2009) 193311","10.1103/PhysRevB.79.193311",,"cond-mat.mes-hall","http://arxiv.org/licenses/nonexclusive-distrib/1.0/","  We show that the resonant tunnel current through a single energy level of an
individual quantum dot within an ensemble of dots is strongly sensitive to
photoexcited holes that become bound in the close vicinity of the dot. The
presence of these holes lowers the electrostatic energy of the quantum dot
state and switches the current carrying channel from fully open to fully closed
with a high on/off ratio (> 50). The device can be reset by means of a bias
voltage pulse. These properties are of interest for charge sensitive photon
counting devices.
","[{""version"":""v1"",""created"":""Thu, 9 Jul 2009 15:12:30 GMT""}]","2015-05-13"
"0907.1455","Anthony van Raan","Rodrigo Costas, Thed N. van Leeuwen, and Anthony F.J. van Raan","Is scientific literature subject to a sell-by-date? A general
  methodology to analyze the durability of scientific documents","26 pages, 9 tables, 5 figures",,,,"physics.soc-ph cs.DL physics.data-an","http://arxiv.org/licenses/nonexclusive-distrib/1.0/","  The study of the citation histories and ageing of documents are topics that
have been addressed from several perspectives, especially in the analysis of
documents with delayed recognition or sleeping beauties. However, there is no
general methodology that can be extensively applied for different time periods
and/or research fields. In this paper a new methodology for the general
analysis of the ageing and durability of scientific papers is presented. This
methodology classifies documents into three general types: Delayed documents,
which receive the main part of their citations later than normal documents;
Flash in the pans, which receive citations immediately after their publication
but they are not cited in the long term; and Normal documents, documents with a
typical distribution of citations over time. These three types of durability
have been analyzed considering the whole population of documents in the Web of
Science with at least 5 external citations (i.e. not considering
self-citations). Several patterns related to the three types of durability have
been found and the potential for further research of the developed methodology
is discussed.
","[{""version"":""v1"",""created"":""Thu, 9 Jul 2009 08:52:04 GMT""}]","2009-07-10"
"0907.1456","Sergey Neshveyev","Sergey Neshveyev","Von Neumann algebras arising from Bost-Connes type systems","AMS-LaTeX, 12 pages",,,,"math.OA math.DS","http://arxiv.org/licenses/nonexclusive-distrib/1.0/","  We show that the KMS_beta-states of Bost-Connes type systems for number
fields in the region 0<beta\le 1, as well as of the Connes-Marcolli GL_2-system
for 1<beta\le 2, have type III_1. This is equivalent to ergodicity of various
actions on adelic spaces. For example, the case beta=2 of the GL_2-system
corresponds to ergodicity of the action of GL_2(Q) on Mat_2(A) with its Haar
measure.
","[{""version"":""v1"",""created"":""Thu, 9 Jul 2009 08:58:07 GMT""}]","2009-07-10"
"0907.1457","Matthias Hoffmann","Janos Hebling, Matthias C. Hoffmann, Harold Y. Hwang, Ka-Lo Yeh and
  Keith A. Nelson","Observation of Nonequilibrium Carrier Distribution in Ge, Si and GaAs by
  Terahertz-pump--Terahertz-probe Measurements","4 figures",,"10.1103/PhysRevB.81.035201",,"cond-mat.mtrl-sci cond-mat.other","http://arxiv.org/licenses/nonexclusive-distrib/1.0/","  We compare the observed strong saturation of the free carrier absorption in
n-type semiconductors at 300 K in the terahertz frequency range when
single-cycle pulses with intensities up to 150 MW/cm2 are used. In the case of
germanium, a small increase of the absorption occurs at intermediate THz pulse
energies. The recovery of the free carrier absorption was monitored by
time-resolved THz-pump/THz-probe measurements. At short probe delay times, the
frequency response of germanium cannot be fitted by the Drude model. We
attribute these unique phenomena of Ge to dynamical overpopulation of the high
mobility gamma conduction band valley.
","[{""version"":""v1"",""created"":""Thu, 9 Jul 2009 09:26:11 GMT""},{""version"":""v2"",""created"":""Sat, 26 Sep 2009 15:51:24 GMT""}]","2015-05-13"
"0907.1458","Fabien Pazuki","F. Pazuki","Theta height and Faltings height",,"Bull. Soc. Math. Fr., 140.1, 2012, p. 19-49",,,"math.NT","http://arxiv.org/licenses/nonexclusive-distrib/1.0/","  Using original ideas from J.-B. Bost and S. David, we provide an explicit
comparison between the Theta height and the stable Faltings height of a
principally polarized abelian variety. We also give as an application an
explicit upper bound on the number of K-rational points of a curve of genus g>1
over a number filed K under a conjecture of S. Lang and J. Silverman. We
complete the study with a comparison between differential lattice structures.
","[{""version"":""v1"",""created"":""Thu, 9 Jul 2009 08:59:12 GMT""},{""version"":""v2"",""created"":""Tue, 30 Jun 2015 22:35:11 GMT""}]","2015-07-02"
"0907.1459","Victor Chulaevsky","A. Boutet de Monvel, V. Chulaevsky, P. Stollmann, Y. Suhov","Anderson localization in a two-particle continuous model with an
  alloy-type external potential","2 figures",,,,"math-ph math.MP","http://arxiv.org/licenses/nonexclusive-distrib/1.0/","  We establish exponential localization for a two-particle Anderson model in a
Euclidean space ${\mathbb R}^{d}$, $d\ge 1$, in presence of a non-trivial
short-range interaction and a random external potential of the alloy type.
Specifically, we prove that all eigenfunctions with eigenvalues near the lower
edge of the spectrum decay exponentially in $L^2$-norm.
","[{""version"":""v1"",""created"":""Thu, 9 Jul 2009 08:59:14 GMT""}]","2009-07-10"
"0907.1460","Hirohiko Sato","Hiroyuki Hagiwara, Hirohiko Sato, Masahiro Iwaki, Yasuo Narumi and
  Koichi Kindo","Quantum magnetism of perfect spin tetrahedra in Co$_{4}$B$_{6}$O$_{13}$","5 pages, 6 figures. Accepted for publication in Phys. Rev. B",,,,"cond-mat.str-el","http://arxiv.org/licenses/nonexclusive-distrib/1.0/","  Co$_{4}$B$_{6}$O$_{13}$ contains undistorted tetrahedral clusters of magnetic
Co$^{2+}$ ions. The high-field magnetization of this magnet exhibits a periodic
undulation indicating quantization of the total spin number per cluster.
Measurements of magnetic susceptibility and specific heat reveal that the
ground state is composed of several different singlet states, reflecting the
high symmetry of the spin tetrahedron. An exact diagonalization calculation
taking account of single-ion type anisotropies and Dzyaloshinsky-Moriya
interactions reproduces the expretimental results very well.
","[{""version"":""v1"",""created"":""Thu, 9 Jul 2009 09:02:36 GMT""}]","2009-07-10"
"0907.1461","Tommaso Coletta","F. Michaud, T. Coletta, S.R. Manmana, J.-D. Picon, F. Mila","Frustration induced plateaux in S>=1/2 Heisenberg spin ladders","11 pages, 8 figures,accepted for publication in Phys. Rev. B","Phys. Rev. B 81, 014407 (2010)","10.1103/PhysRevB.81.014407",,"cond-mat.str-el cond-mat.other","http://arxiv.org/licenses/nonexclusive-distrib/1.0/","  We study the T = 0 magnetization of frustrated two-leg spin ladders with
arbitrary value of the spin S. In the strong rung limit, we use degenerate
perturbation theory to prove that frustration leads to magnetization plateaux
at fractional values of the magnetization for all spins S, and to determine the
critical ratios of parallel to diagonal inter-rung couplings for the appearance
of these plateaux. These ratios depend both on the plateau and on the spin. To
confirm these results, and to investigate the properties of these ladders away
from the strong coupling limit, we have performed extensive density matrix
renormalization group (DMRG) calculations for S <= 2. For large enough
inter-rung couplings, all plateaux simply disappear, leading to a magnetization
curve typical of integer-spin chains in a magnetic field. The intermediate
region turns out to be surprisingly rich however, with, upon increasing the
inter-rung couplings, the development of magnetization jumps and, in some
cases, the appearance of one or more phase transitions inside a given plateau.
","[{""version"":""v1"",""created"":""Thu, 9 Jul 2009 10:37:11 GMT""},{""version"":""v2"",""created"":""Mon, 7 Dec 2009 13:09:26 GMT""}]","2010-02-01"
"0907.1462","Dmitry Zhuridov","Chao-Qiang Geng and Dmitry V. Zhuridov","Non-degenerate Low Energy Leptogenesis","This paper has been withdrawn",,,,"hep-ph","http://arxiv.org/licenses/nonexclusive-distrib/1.0/","  This paper has been withdrawn by the author due to a crucial sign error.
","[{""version"":""v1"",""created"":""Thu, 9 Jul 2009 09:13:53 GMT""},{""version"":""v2"",""created"":""Wed, 22 Jul 2009 02:40:02 GMT""},{""version"":""v3"",""created"":""Thu, 17 Dec 2009 03:25:45 GMT""},{""version"":""v4"",""created"":""Fri, 10 Sep 2010 00:27:55 GMT""}]","2010-09-13"
