"0907.1545","Se Baek Oh","Se Baek Oh, George Barbastathis, and Ramesh Raskar","Augmenting Light Field to model Wave Optics effects","Covering some of the topics presented in CVPR 2009 short course on
  light field: Present and Future",,,,"cs.CV","http://arxiv.org/licenses/nonexclusive-distrib/1.0/","  The ray-based 4D light field representation cannot be directly used to
analyze diffractive or phase--sensitive optical elements. In this paper, we
exploit tools from wave optics and extend the light field representation via a
novel ""light field transform"". We introduce a key modification to the
ray--based model to support the transform. We insert a ""virtual light source"",
with potentially negative valued radiance for certain emitted rays. We create a
look-up table of light field transformers of canonical optical elements. The
two key conclusions are that (i) in free space, the 4D light field completely
represents wavefront propagation via rays with real (positive as well as
negative) valued radiance and (ii) at occluders, a light field composed of
light field transformers plus insertion of (ray--based) virtual light sources
represents resultant phase and amplitude of wavefronts. For free--space
propagation, we analyze different wavefronts and coherence possibilities. For
occluders, we show that the light field transform is simply based on a
convolution followed by a multiplication operation. This formulation brings
powerful concepts from wave optics to computer vision and graphics. We show
applications in cubic-phase plate imaging and holographic displays.
","[{""version"":""v1"",""created"":""Thu, 9 Jul 2009 13:43:12 GMT""}]","2009-07-10"
"0907.1546","Junichiro Kono","C. Sun, J. Kono, Y. Cho, A. K. Wojcik, A. Belyanin, and H. Munekata","Above-Bandgap Magneto-optical Kerr Effect in Ferromagnetic GaMnAs","12 pages, 15 figures",,,,"cond-mat.mtrl-sci cond-mat.mes-hall","http://arxiv.org/licenses/nonexclusive-distrib/1.0/","  We have performed a systematic magneto-optical Kerr spectroscopy study of
GaMnAs with varying Mn densities as a function of temperature, magnetic field,
and photon energy. Unlike previous studies, the magnetization easy axis was
perpendicular to the sample surface, allowing us to take remanent polar Kerr
spectra in the absence of an external magnetic field. The remanent Kerr angle
strongly depended on the photon energy, exhibiting a large positive peak at
$\sim1.7$ eV. This peak increased in intensity and blue-shifted with Mn doping
and further blue-shifted with annealing. Using a 30-band ${\bf k\cdot p}$ model
with antiferromagnetic $s,p$-$d$ exchange interaction, we calculated the
dielectric tensor of GaMnAs in the interband transition region, assuming that
our samples are in the metallic regime and the impurity band has merged with
the valence band. We successfully reproduced the observed spectra without
\emph{ad hoc} introduction of the optical transitions originated from impurity
states in the band gap. These results lead us to conclude that above-bandgap
magneto-optical Kerr rotation in ferromagnetic GaMnAs is predominantly
determined by interband transitions between the conduction and valence bands.
","[{""version"":""v1"",""created"":""Thu, 9 Jul 2009 13:44:20 GMT""},{""version"":""v2"",""created"":""Wed, 19 May 2010 06:04:41 GMT""}]","2010-05-20"
"0907.1547","Jesus Guillera","Jesus Guillera","A Matrix form of Ramanujan-type series for $1/\pi$",,,,,"math.NT","http://arxiv.org/licenses/nonexclusive-distrib/1.0/","  In this paper we prove theorems related to the Ramanujan-type series for
$1/\pi$ (type $_3F_2$) and to the Ramanujan-like series, discovered by the
author, for $1/\pi^2$ (type $_5F_4$). Our developments for the cases $_3 F_2$
and $_5 F_4$ connect with the theory of modular functions and with the theory
of Calabi-Yau differential equations, respectively.
","[{""version"":""v1"",""created"":""Thu, 9 Jul 2009 13:45:05 GMT""}]","2009-07-10"
"0907.1548","Mohamed Elhamdadi","Mohamed Elhamdadi and Abdenacer Makhlouf","Cohomology and Formal Deformations of Left Alternative Algebras","13 pages","J. Gen. Lie Theory Appl. 5 (2011), Art. ID G110105, 10 pp",,,"math.RA math.QA","http://arxiv.org/licenses/nonexclusive-distrib/1.0/","  The purpose of this paper is to introduce an algebraic cohomology and formal
deformation theory of left alternative algebras. Connections to some other
algebraic structures are given also.
","[{""version"":""v1"",""created"":""Thu, 9 Jul 2009 13:45:31 GMT""}]","2016-10-17"
"0907.1549","Kazuhiro Yamamoto","Kazuhiro Yamamoto (Hiroshima Univ.), Tsutomu Kobayashi (Waseda Univ.),
  Gen Nakamura (Hiroshima Univ.)","Breaking the scale invariance of the primordial power spectrum in
  Horava-Lifshitz Cosmology","5 pages, 2 figures, accepted for publication in Physical Review D","Phys.Rev.D80:063514,2009","10.1103/PhysRevD.80.063514","HUPD-0903, WU-AP/301/09","astro-ph.CO gr-qc hep-th","http://arxiv.org/licenses/nonexclusive-distrib/1.0/","  We study the spectral tilt of primordial perturbations in Horava-Lifshitz
cosmology. The uniform approximation, which is a generalization of the familiar
Wentzel-Kramers-Brillouin (WKB) method, is employed to compute the spectral
index both numerically and analytically in a closed form. We clarify how the
spectral index depends on the inflation model and parameters in the modified
dispersion relation.
","[{""version"":""v1"",""created"":""Thu, 9 Jul 2009 13:48:32 GMT""},{""version"":""v2"",""created"":""Mon, 7 Sep 2009 01:25:07 GMT""}]","2009-09-24"
"0907.1550","Marco Squassina","Raffaella Servadei, Marco Squassina","Soliton dynamics for a general class of Schr\""odinger equations","26 pages",,,,"math.AP","http://arxiv.org/licenses/nonexclusive-distrib/1.0/","  The soliton dynamics for a general class of nonlinear focusing Schr\""odinger
problems in presence of non-constant external (local and nonlocal) potentials
is studied by taking as initial datum the ground state solution of an
associated autonomous elliptic equation.
","[{""version"":""v1"",""created"":""Thu, 9 Jul 2009 13:51:23 GMT""},{""version"":""v2"",""created"":""Mon, 14 Sep 2009 21:06:55 GMT""},{""version"":""v3"",""created"":""Wed, 16 Sep 2009 15:13:42 GMT""},{""version"":""v4"",""created"":""Fri, 18 Sep 2009 13:09:44 GMT""},{""version"":""v5"",""created"":""Fri, 13 Nov 2009 10:27:19 GMT""}]","2009-11-13"
"0907.1551","Martin Hecht","Bastian Schaefer, Martin Hecht, Jens Harting, Hermann Nirschl","Agglomeration and filtration of colloidal suspensions with DVLO
  interactions in simulation and experiment","revised version, 30 pages, 11 figures, 62 references","Journal of Colloid and Interface Science 349, 186 (2010)","10.1016/j.jcis.2010.05.025",,"cond-mat.soft cond-mat.mtrl-sci","http://arxiv.org/licenses/nonexclusive-distrib/1.0/","  Cake filtration is a widely used solid-liquid separation process. However,
the high flow resistance of the nanoporous filter cake lowers the efficiency of
the process significantly. The structure and thus the permeability of the
filter cakes depend on the compressive load acting on the particles, the
particles size, and the agglomeration of the particles. The latter is
determined by the particle charge and the ionic strength of the suspension, as
described by the Derjaguin-Landau-Verwey-Overbeek (DLVO) theory. In this paper,
we propose a combined stochastic rotation dynamics (SRD) and molecular dynamics
(MD) methodology to simulate the cake formation. The simulations give further
insight into the dependency of the filter cakes' structure on the agglomeration
of the particles, which cannot be accessed experimentally. The permeability, as
investigated with lattice Boltzmann (LB) simulations of flow through the
discretized cake, depends on the particle size and porosity, and thus on the
agglomeration of the particles. Our results agree qualitatively with
experimental data obtained from colloidal boehmite suspensions.
","[{""version"":""v1"",""created"":""Thu, 9 Jul 2009 13:54:17 GMT""},{""version"":""v2"",""created"":""Tue, 15 Jun 2010 11:44:46 GMT""}]","2010-07-21"
"0907.1552","Bart{\l}omiej Siudeja","R. Laugesen, B. Siudeja","Minimizing Neumann fundamental tones of triangles: an optimal Poincare
  inequality",,,,,"math.SP","http://arxiv.org/licenses/nonexclusive-distrib/1.0/","  The first nonzero eigenvalue of the Neumann Laplacian is shown to be minimal
for the degenerate acute isosceles triangle, among all triangles of given
diameter. Hence an optimal Poincar\'{e} inequality for triangles is derived.
  The proof relies on symmetry of the Neumann fundamental mode for isosceles
triangles with aperture less than $\pi/3$. Antisymmetry is proved for apertures
greater than $\pi/3$.
","[{""version"":""v1"",""created"":""Thu, 9 Jul 2009 13:58:17 GMT""}]","2009-07-10"
"0907.1553","Natalia Kiriushcheva","N. Kiriushcheva and S.V. Kuzmin","The Hamiltonian formulation of N-bein, Einstein-Cartan, gravity in any
  dimension: the Progress Report (Extended version of a talk given on
  CAIMS-2009, June 11-14, London, Canada)","48 pages",,,,"gr-qc hep-th","http://arxiv.org/licenses/nonexclusive-distrib/1.0/","  The Hamiltonian formulation of N-bein, Einstein-Cartan, gravity, using its
first order form in any dimension higher than two, is analyzed. This
Hamiltonian formulation allows to explicitly show where peculiarities of three
dimensional case (\textit{A.M.Frolov et al, 0902.0856 [gr-qc]}) occur and make
a conjecture, based on presented in this report results, that there is one
general for \textit{all} dimensions characteristic of N-bein formulation of
gravity: after elimination of second class constraints the algebra of Poisson
brackets among remaining first class secondary constraints is the Poincare
algebra and in all dimensions N-bein, Cartan-Einstein, gravity \textit{is the
Poincare gauge theory}. The gauge symmetry corresponding to the algebra of
first class constraints has two parameters - rotational (Lorentz) and
translational. Translational invariance is common to all dimensions but some
terms in general expressions for gauge transformations of N-beins and
connections are zero in a particular, three dimensional, case.
  The proof of our conjecture is outlined in detail. Some straightforward but
tedious calculations remain to be completed to call our conjecture - a theorem
and will be reported later.
","[{""version"":""v1"",""created"":""Thu, 9 Jul 2009 14:01:45 GMT""}]","2009-07-11"
"0907.1554","Agust\'i P\'erez-Madrid","A. Perez-Madrid and I. Santamaria-Holek","Statistical Mechanical Theory of a Closed Oscillating Universe",,,"10.1007/s10701-009-9388-4",,"cond-mat.stat-mech","http://arxiv.org/licenses/nonexclusive-distrib/1.0/","  Based on Newton's laws reformulated in the Hamiltonian dynamics combined with
statistical mechanics, we formulate a statistical mechanical theory supporting
the hypothesis of a closed oscillating universe. We find that the behaviour of
the universe as a whole can be represented by a free entropic oscillator whose
lifespan is nonhomogeneous, thus implying that time is shorter or longer
according to the state of the universe itself given through its entropy. We
conclude that time reduces to the entropy production of the universe and that a
nonzero entropy production means that local fluctuations could exist giving
rise to the appearance of masses and to the curvature of the space.
","[{""version"":""v1"",""created"":""Thu, 9 Jul 2009 14:02:14 GMT""}]","2015-05-13"
"0907.1555","Itzhak Goldman","Itzhak Goldman and Shmuel Nussinov","Limit on Continuous Neutrino Emission from Neutron Stars","5 pages, Added a section on energy transport in the neutron star,
  JHEP published","JHEP 1008:091,2010","10.1007/JHEP08(2010)091",,"astro-ph.SR hep-ph","http://arxiv.org/licenses/nonexclusive-distrib/1.0/","  The timing data of the binary pulsar PSR1913+16, are used to establish an
upper limit on the rate of continuous neutrino emission from neutron stars.
Neutrino emission from each of the neutron stars of the binary system,
increases the star binding energy and thus translates to a decrease in their
masses. This in turn implies an increase with time of the binary period. Using
the pulsar data we obtain an upper limit on the allowed rate of mass reduction
: $| \dot{M}| <1.1 \times 10^{-12} yr^{-1} M $, where $M$ is the total mass of
the binary. This constrains exotic nuclear equations of state that predict
continuous neutrino emissions. The limit applies also to other channels of
energy loss, e.g. axion emission. Continued timing measurements of additional
binary pulsars, should yield a stronger limit in the future.
","[{""version"":""v1"",""created"":""Thu, 9 Jul 2009 14:07:54 GMT""},{""version"":""v2"",""created"":""Wed, 22 Sep 2010 13:20:31 GMT""}]","2010-09-23"
"0907.1556","Ayan Chatterjee","Ayan Chatterjee","Entropy of Black Holes in N=2 Supergravity","21 Pages, major revision, results unchanged",,,,"gr-qc hep-th","http://arxiv.org/licenses/nonexclusive-distrib/1.0/","  Using the techniques of isolated horizon formalism, we construct the space of
solutions of asymptotically flat extremal black holes in N=2 pure supergravity
in 4 dimensions. We prove the laws of black hole mechanics. Further,
restricting to constant area phase space, we show that the spherical horizons
admits a U(1) Chern- Simons theory. Standard way of quantizing this topological
theory and counting states confirms that entropy is indeed proportional to the
area of horizon.
","[{""version"":""v1"",""created"":""Thu, 9 Jul 2009 14:30:25 GMT""},{""version"":""v2"",""created"":""Thu, 3 Dec 2009 17:04:36 GMT""}]","2009-12-03"
"0907.1557","Thomas Faestermann","Thomas Faestermann","Comment on ""Spin-rotation coupling in non-exponential decay of
  hydrogenlike heavy ions"" by G. Lambiase et al",,,,,"nucl-th","http://arxiv.org/licenses/nonexclusive-distrib/1.0/","  I note that the explanation of a recently posted paper by Lambiase et al.
[arXiv:0811.2302] for the oscillations in the electron capture decay rate,
reported by Litvinov et al.[arXiv:0801.2079], requires the cancellation of a
difference by eleven orders of magnitude for the two independent measurements.
Such a cancellation is (impossible)^2.
","[{""version"":""v1"",""created"":""Thu, 9 Jul 2009 14:10:35 GMT""}]","2009-07-10"
"0907.1558","Marcelo A. Montemurro","Marcelo A. Montemurro and Damian Zanette","Towards the quantification of the semantic information encoded in
  written language","19 pages, 4 figures","Advances in Complex Systems, Volume 13, Issue 2 (2010), pp.
  135-153","10.1142/S0219525910002530",,"physics.soc-ph cs.CL physics.data-an","http://arxiv.org/licenses/nonexclusive-distrib/1.0/","  Written language is a complex communication signal capable of conveying
information encoded in the form of ordered sequences of words. Beyond the local
order ruled by grammar, semantic and thematic structures affect long-range
patterns in word usage. Here, we show that a direct application of information
theory quantifies the relationship between the statistical distribution of
words and the semantic content of the text. We show that there is a
characteristic scale, roughly around a few thousand words, which establishes
the typical size of the most informative segments in written language.
Moreover, we find that the words whose contributions to the overall information
is larger, are the ones more closely associated with the main subjects and
topics of the text. This scenario can be explained by a model of word usage
that assumes that words are distributed along the text in domains of a
characteristic size where their frequency is higher than elsewhere. Our
conclusions are based on the analysis of a large database of written language,
diverse in subjects and styles, and thus are likely to be applicable to general
language sequences encoding complex information.
","[{""version"":""v1"",""created"":""Thu, 9 Jul 2009 14:36:47 GMT""},{""version"":""v2"",""created"":""Fri, 10 Jul 2009 11:35:08 GMT""},{""version"":""v3"",""created"":""Mon, 27 Jul 2009 06:40:04 GMT""}]","2010-05-17"
"0907.1559","Mariano Cadoni","M. Cadoni, M. Melis","Holographic entanglement entropy of the BTZ black hole","We added the comparison of some of our results with previous results
  for the quantum entropy of a scalar in the Euclidean BTZ background. Two more
  references have been also added","Found.Phys.40:638-657,2010","10.1007/s10701-010-9430-6",,"hep-th","http://arxiv.org/licenses/nonexclusive-distrib/1.0/","  We investigate quantum entanglement of gravitational configurations in 3D AdS
gravity using the AdS/CFT correspondence. We derive explicit formulas for the
holographic entanglement entropy (EE) of the BTZ black hole, conical
singularities and regularized AdS$_{3}$. The leading term in the large
temperature expansion of the holographic EE of the BTZ black hole reproduces
exactly its Bekenstein-Hawking entropy S_BH, whereas the subleading term
behaves as ln S_BH. We also show that the leading term of the holographic EE
for the BTZ black hole can be obtained from the large temperature expansion of
the partition function of a broad class of 2D CFTs on the torus. This result
indicates that black hole EE is not a fundamental feature of the underlying
theory of quantum gravity but emerges when the semiclassical notion of
spacetime geometry is used to describe the black hole.
","[{""version"":""v1"",""created"":""Thu, 9 Jul 2009 14:13:48 GMT""},{""version"":""v2"",""created"":""Wed, 22 Jul 2009 15:09:55 GMT""}]","2014-11-20"
"0907.1560","Shaaban Khalil","Shaaban Khalil","Lepton flavor violation in supersymmetric B-L extension of the standard
  model","17 pages",,"10.1103/PhysRevD.81.035002",,"hep-ph","http://arxiv.org/licenses/nonexclusive-distrib/1.0/","  Supersymmetric B-L extension of the Standard Model (SM) is one of the best
candidate for physics beyond the SM that accounts for TeV scale seesaw
mechanism and provides an attractive solution for the Higgs naturalness
problem. We analyze the charged lepton flavor violation (LFV) in this class of
models. We show that due to the smallness of Dirac neutrino Yukawa coupling,
the decay rates of l_i -> l_j gamma and l_i -> 3 l_j, generated by the
renormalization group evolution of soft SUSY breaking terms from GUT to seesaw
scale, are quite suppressed. Therefore, this model is free from the stringent
LFV constraints usually imposed on the supersymmetric seesaw model. We also
demonstrate that the right-sneutrino is a long-lived particle and can be pair
produced at the LHC through the B-L gauge boson. Then, they decay into
same-sign dilepton, with a total cross section of order O(1) pb. This signal is
one of the striking signatures of supersymmetric B-L extension of the SM.
","[{""version"":""v1"",""created"":""Thu, 9 Jul 2009 14:32:00 GMT""},{""version"":""v2"",""created"":""Wed, 20 Jan 2010 08:56:33 GMT""}]","2013-05-29"
"0907.1561","Mazyar Mirrahimi","Filippo Visco Comandini, Mazyar Mirrahimi, Michel Sorine","Inverse scattering for star-shaped nonuniform lossless electrical
  networks",,,,,"math-ph math.MP","http://arxiv.org/licenses/nonexclusive-distrib/1.0/","  The Frequency Domain Reflectometry (FDR) is studied as a powerful tool to
detect hard or soft faults in star-shaped networks of nonuniform lossless
transmission lines. Processing the FDR measurements leads to solve an inverse
scattering problem for a Schrodinger operator on a star-shaped graph.
Throughout this paper, we restrict ourselves to the case of minimal
experimental setup corresponding to only one diagnostic port plug. First, by
studying the asymptotic behavior of the reflection coefficient in the
high-frequency limit, we prove the identifiability of the geometry of this
star-shaped graph: the number of edges and their lengths. The proof being
rather constructive, it provides a method to detect the hard faults in the
network. Next, we study the potential identification problem by inverse
scattering, noting that the potentials represent the inhomogeneities due to the
soft faults in the network wirings. Here, the main result states that the
measurement of two reflection coefficients, associated to two different sets of
boundary conditions at the extremities of the tree, determines uniquely the
potentials; it is a generalization of the theorem of the two boundary spectra
on an interval.
","[{""version"":""v1"",""created"":""Thu, 9 Jul 2009 14:20:23 GMT""}]","2009-07-10"
"0907.1562","Bart{\l}omiej Siudeja","R. Laugesen, B. Siudeja","Maximizing Neumann fundamental tones of triangles",,,"10.1063/1.3246834",,"math.SP","http://arxiv.org/licenses/nonexclusive-distrib/1.0/","  We prove sharp isoperimetric inequalities for Neumann eigenvalues of the
Laplacian on triangular domains.
  The first nonzero Neumann eigenvalue is shown to be maximal for the
equilateral triangle among all triangles of given perimeter, and hence among
all triangles of given area. Similar results are proved for the harmonic and
arithmetic means of the first two nonzero eigenvalues.
","[{""version"":""v1"",""created"":""Thu, 9 Jul 2009 14:18:25 GMT""}]","2015-05-13"
"0907.1563","Yuri G. Zarhin","Jiangwei Xue, Yuri G. Zarhin","Centers of Hodge groups of superelliptic jacobians","29 pages, the paper will appear in Transformation Groups",,,,"math.AG math.NT","http://arxiv.org/licenses/nonexclusive-distrib/1.0/","  We give lower bounds for dimensions of the centers of Hodge groups of
superelliptic jacobians. In ""generic case"" this bound is precise. We also
discuss dimensions of simple abelian subvarieties of superelliptic jacobians.
","[{""version"":""v1"",""created"":""Thu, 9 Jul 2009 14:20:09 GMT""},{""version"":""v2"",""created"":""Wed, 18 Nov 2009 03:09:45 GMT""},{""version"":""v3"",""created"":""Wed, 20 Jan 2010 21:52:50 GMT""},{""version"":""v4"",""created"":""Thu, 21 Jan 2010 21:42:32 GMT""}]","2010-01-21"
"0907.1565","Artur Widera","Micha{\l} Karski, Leonid F\""orster, Jai-Min Choi, Andreas Steffen,
  Wolfgang Alt, Dieter Meschede and Artur Widera","Quantum Walk in Position Space with Single Optically Trapped Atoms","7 pages, 4 figures","Science 325, p174 (2009)","10.1126/science.1174436",,"quant-ph","http://arxiv.org/licenses/nonexclusive-distrib/1.0/","  The quantum walk is the quantum analogue of the well-known random walk, which
forms the basis for models and applications in many realms of science. Its
properties are markedly different from the classical counterpart and might lead
to extensive applications in quantum information science. In our experiment, we
implemented a quantum walk on the line with single neutral atoms by
deterministically delocalizing them over the sites of a one-dimensional
spin-dependent optical lattice. With the use of site-resolved fluorescence
imaging, the final wave function is characterized by local quantum state
tomography, and its spatial coherence is demonstrated. Our system allows the
observation of the quantum-to-classical transition and paves the way for
applications, such as quantum cellular automata.
","[{""version"":""v1"",""created"":""Thu, 9 Jul 2009 14:25:00 GMT""}]","2009-07-10"
"0907.1566","Tinggui Wang","Tinggui Wang (USTC), Hongyan Zhou (UFL, USTC), Weimin Yuan (YNAO),
  Honglin Lu (USTC), Xiaobo Dong (USTC) and Hongguang Shan (YNAO)","Metal-Enriched Outflows in the Ultra-Luminous infrared Quasar Q1321+058","31 pages, accepted to ApJ","Astrophys.J.702:851-861,2009","10.1088/0004-637X/702/2/851",,"astro-ph.CO astro-ph.HE","http://arxiv.org/licenses/nonexclusive-distrib/1.0/","  Quasar outflows may play important role in the evolution of its host galaxy
and central black hole. In this paper, we present a detailed study of multiple
outflows in the obscured ultra-luminous infrared quasar Q1321+058. The outflows
reveal themselves in the complex optical and UV emission line spectrum, with a
broad component blueshifted by 1650 km/s and a narrow component by 360 km/s,
respectively.The higher velocity component shows ever strong N III] and strong
Si III], in addition to strong [O III]5007 and [Ne III]3869 emission lines,
suggesting an overabundance of N and Si relative to C. The abundance pattern is
consistent a fast chemical enriching process associated with a recent
starburst. The outflow extends to several tens to hundred parsecs from the
quasar, and covers only a very small sky. We find that the outflow with line
emitting gas is energetically insufficient to remove the ISM of the host
galaxy. The velocity range and the column density suggest that the outflow
might be part of the low ionization broad absorption line region as seen in a
small class of quasars. The optical and UV continuum is starlight-dominated and
can be modelled with a young-aged (1 Myr) plus an intermediate-aged (~0.5-1
Gyr) stellar populations, suggesting a fast building of the stellar mass in the
host galaxy, consistent with the starburst-type metal abundances inferred from
the high velocity outflow spectrum. The broad band spectral energy distribution
shows that it is an obscured quasar with its bulk emission in the middle
infrared. The star formation rate, independently estimated from UV,
far-infrared, and emission line luminosity, is much lower than that is required
for the co-evolution of the black hole and its host spheroid.
","[{""version"":""v1"",""created"":""Thu, 9 Jul 2009 14:21:59 GMT""}]","2009-08-24"
