"0907.1782","Han Zhang  Dr","H. Zhang, D. Y. Tang, X. Wu, L. M. Zhao","Multi-wavelength dissipative soliton operation of an erbium-doped fiber
  laser",,,"10.1364/OE.17.012692",,"physics.optics physics.atom-ph","http://arxiv.org/licenses/nonexclusive-distrib/1.0/","  We report on the generation of multi-wavelength dissipative soliton (DS) in
an all normal dispersion fiber laser passively mode-locked with a semiconductor
saturable absorber mirror (SESAM). We show that depending on the strength of
the cavity birefringence, stable single-, dual- and triple-wavelength DSs can
be formed in the laser. The multi-wavelength soliton operation of the laser was
experimentally investigated, and the formation mechanisms of the
multi-wavelength DSs are discussed.
","[{""version"":""v1"",""created"":""Fri, 10 Jul 2009 11:07:22 GMT""}]","2015-05-13"
"0907.1783","Ronin Wu","Ronin Wu (NYU) David W. Hogg (NYU, MPIA) and John Moustakas (NYU,
  UCSD)","The Aromatic Features in Very Faint Dwarf Galaxies","submitted to ApJ","Astrophys.J.730:111,2011","10.1088/0004-637X/730/2/111",,"astro-ph.GA","http://arxiv.org/licenses/nonexclusive-distrib/1.0/","  We present optical and mid-infrared photometry of a statistically complete
sample of 29 very faint dwarf galaxies (M_r > -15 mag) selected from the SDSS
spectroscopic sample and observed in the mid-infrared with Spitzer IRAC. This
sample contains nearby (redshift z<0.005) galaxies three magnitudes fainter
than previously studied samples. We compare our sample with other star-forming
galaxies that have been observed with both IRAC and SDSS. We examine the
relationship of the infrared color, sensitive to PAH abundance, with
star-formation rates, gas-phase metallicities and radiation hardness, all
estimated from optical emission lines. Consistent with studies of more luminous
dwarfs, we find that the very faint dwarf galaxies show much weaker PAH
emission than more luminous galaxies with similar specific star-formation
rates. Unlike more luminous galaxies, we find that the very faint dwarf
galaxies show no significant dependence at all of PAH emission on
star-formation rate, metallicity, or radiation hardness, despite the fact that
the sample spans a significant range in all of these quantities. When the very
faint dwarfs in our sample are compared with more luminous (M_r ~ -18 mag)
dwarfs, we find that PAH emission depends on metallicity and radiation
hardness. These two parameters are correlated; we look at the PAH-metallicity
relation at fixed radiation hardness and the PAH-hardness relation at fixed
metallicity. This test shows that the PAH emission in dwarf galaxies depends
most directly on metallicity.
","[{""version"":""v1"",""created"":""Fri, 10 Jul 2009 11:11:06 GMT""}]","2011-03-18"
"0907.1784","Subramanian Kanmani Mr","S. Kanmani","Entangled states : Classical versus Quantum","Expository article on entanglement; 23 pages",,,,"quant-ph","http://arxiv.org/licenses/nonexclusive-distrib/1.0/","  Quantum mechanics of composite systems, gives rise to certain special states
called entangled states. A physical system, that is in an entangled state
displays an intricate correlation between its subsystems. There are also some
composite quantum states (classically correlated states or separable states)
that are not entangled. It is generally claimed, often without a rigorous proof
to support, that these intricate correlations of an entangled state cannot
occur in a classical system. This expository article, provides an elementary
proof that entangled states cannot arise in the setting of classical mechanics.
In addition, a detailed description of the origin of entanglement in quantum
systems is included. The mathematical concepts that are necessary for this
purpose are presented. The absence of entanglement in the classical setting is
due to the fact that every pure classical state of a composite system is a
product state, that is, a tensor product of two pure states of the subsystems.
In contrast, there are pure composite quantum states that cannot be expressed
in the form of a product state or even by a convex sum of product states.
Roughly speaking, this is because classical states are positive valued
functions on the phase-space while quantum states are positive linear
operators. The structure of the tensor product between two commutative spaces
of scalar valued functions is drastically different from that of the tensor
product between two non-commutative spaces of linear operators. In other words,
entanglement is a non-commutative phenomenon.
","[{""version"":""v1"",""created"":""Fri, 10 Jul 2009 11:33:05 GMT""}]","2009-07-13"
"0907.1785","Oleg P. Sushkov","Wei Chen, Giniyat Khaliullin, Oleg P. Sushkov","Coulomb Disorder Effects on ARPES and NQR Spectra in Cuprates","New version: minor changes, to appear in PRB",,,,"cond-mat.str-el cond-mat.dis-nn","http://arxiv.org/licenses/nonexclusive-distrib/1.0/","  The role of Coulomb disorder, either of extrinsic origin or introduced by
dopant ions in undoped and lightly-doped cuprates, is studied. We demonstrate
that charged surface defects in an insulator lead to a Gaussian broadening of
the Angle-Resolved Photoemisson Spectroscopy (ARPES) lines. The effect is due
to the long-range nature of the Coulomb interaction. A tiny surface
concentration of defects about a fraction of one per cent is sufficient to
explain the line broadening observed in Sr$_2$CuO$_2$Cl$_2$, La$_2$CuO$_{4}$,
and Ca$_{2}$CuO$_{2}$Cl$_{2}$. Due to the Coulomb screening, the ARPES spectra
evolve dramatically with doping, changing their shape from a broad Gaussian
form to narrow Lorentzian ones. To understand the screening mechanism and the
lineshape evolution in detail, we perform Hartree-Fock simulations with random
positions of surface defects and dopant ions. To check validity of the model we
calculate the Nuclear Quadrupole Resonance (NQR) lineshapes as a function of
doping and reproduce the experimentally observed NQR spectra. Our study also
indicates opening of a substantial Coulomb gap at the chemical potential. For a
surface CuO$_2$ layer the value of the gap is of the order of 10 meV while in
the bulk it is reduced to the value about a few meV.
","[{""version"":""v1"",""created"":""Fri, 10 Jul 2009 14:02:39 GMT""},{""version"":""v2"",""created"":""Tue, 1 Sep 2009 00:59:22 GMT""}]","2009-09-01"
"0907.1786","Anne-Laure Dalibard","Anne-Laure Dalibard (DMA), Laure Saint-Raymond (DMA)","Mathematical study of the $\beta$-plane model for rotating fluids in a
  thin layer","46 pages","Journal de Math\'ematiques Pures et Appliqu\'ees 94, 2 (2010)
  131-169","10.1016/j.matpur.2010.02.007",,"math.AP","http://arxiv.org/licenses/nonexclusive-distrib/1.0/","  This article is concerned with an oceanographic model describing the
asymptotic behaviour of a rapidly rotating and incompressible fluid with an
inhomogeneous rotation vector; the motion takes place in a thin layer. We first
exhibit a stationary solution of the system which consists of an interior part
and a boundary layer part. The spatial variations of the rotation vector
generate strong singularities within the boundary layer, which have
repercussions on the interior part of the solution. The second part of the
article is devoted to the analysis of two-dimensional and three-dimensional
waves. It is shown that the thin layer effect modifies the propagation of
three-dimensional Poincar\'e waves by creating small scales. Using tools of
semi-classical analysis, we prove that the energy propagates at speeds of order
one, i.e. much slower than in traditional rotating fluid models.
","[{""version"":""v1"",""created"":""Fri, 10 Jul 2009 11:53:08 GMT""}]","2012-07-03"
"0907.1787","Anne Philippe","Fr\'ed\'eric Lavancier (LMJL), Anne Philippe (LMJL), Donatas Surgailis","A two-sample test for comparison of long memory parameters",,,,,"math.ST stat.TH","http://arxiv.org/licenses/nonexclusive-distrib/1.0/","  We construct a two-sample test for comparison of long memory parameters based
on ratios of two rescaled variance (V/S) statistics studied in [Giraitis L.,
Leipus, R., Philippe, A., 2006. A test for stationarity versus trends and unit
roots for a wide class of dependent errors. Econometric Theory 21, 989--1029].
The two samples have the same length and can be mutually independent or
dependent. In the latter case, the test statistic is modified to make it
asymptotically free of the long-run correlation coefficient between the
samples. To diminish the sensitivity of the test on the choice of the bandwidth
parameter, an adaptive formula for the bandwidth parameter is derived using the
asymptotic expansion in [Abadir, K., Distaso, W., Giraitis, L., 2009. Two
estimators of the long-run variance: Beyond short memory. Journal of
Econometrics 150, 56--70]. A simulation study shows that the above choice of
bandwidth leads to a good size of our comparison test for most values of
fractional and ARMA parameters of the simulated series.
","[{""version"":""v1"",""created"":""Fri, 10 Jul 2009 11:53:45 GMT""},{""version"":""v2"",""created"":""Tue, 16 Feb 2010 07:26:15 GMT""}]","2010-02-16"
"0907.1788","Alexandre Soro","Alexandre Soro, Jerome Lacan","FNT-based Reed-Solomon Erasure Codes","submitted in CCNC'10",,,,"cs.IT math.IT","http://arxiv.org/licenses/nonexclusive-distrib/1.0/","  This paper presents a new construction of Maximum-Distance Separable (MDS)
Reed-Solomon erasure codes based on Fermat Number Transform (FNT). Thanks to
FNT, these codes support practical coding and decoding algorithms with
complexity O(n log n), where n is the number of symbols of a codeword. An
open-source implementation shows that the encoding speed can reach 150Mbps for
codes of length up to several 10,000s of symbols. These codes can be used as
the basic component of the Information Dispersal Algorithm (IDA) system used in
a several P2P systems.
","[{""version"":""v1"",""created"":""Fri, 10 Jul 2009 12:02:11 GMT""}]","2009-07-13"
"0907.1789","Carlo H\""am\""al\""ainen","Ales Drapal, Carlo Hamalainen, Viteslav Kala","Latin bitrades, dissections of equilateral triangles and abelian groups",,,,,"math.CO","http://arxiv.org/licenses/nonexclusive-distrib/1.0/","  Let $T = (T^{\textstyle \ast}, T^{\scriptscriptstyle \triangle})$ be a
spherical latin bitrade. With each $a=(a_1,a_2,a_3)\in T^{\textstyle \ast}$
associate a set of linear equations $\eq(T,a)$ of the form $b_1+b_2=b_3$, where
$b = (b_1,b_2,b_3)$ runs through $T^{\textstyle \ast} \setminus \{a\}$. Assume
$a_1 = 0 = a_2$ and $a_3 = 1$. Then $\eq(T,a)$ has in rational numbers a unique
solution $b_i = \bar b_i$. Suppose that $\bar b_i \ne \bar c_i$ for all $b,c
\in T^{\textstyle \ast}$ such that $b_i \ne c_i$ and $i \in \{1,2,3\}$. We
prove that then $T^{\scriptscriptstyle \triangle}$ can be interpreted as a
dissection of an equilateral triangle. We also consider group modifications of
latin bitrades and show that the methods for generating the dissections can be
used for a proof that $T^{\textstyle \ast}$ can be embedded into the
operational table of a finite abelian group, for every spherical latin bitrade
$T$.
","[{""version"":""v1"",""created"":""Fri, 10 Jul 2009 12:11:43 GMT""}]","2009-07-13"
"0907.1791","Oscar St{\aa}l","Farvah Mahmoudi, Oscar St{\aa}l","Flavor constraints on two-Higgs-doublet models with general diagonal
  Yukawa couplings","24 pages, 11 figures. v2: Minor changes to text and numerics, results
  and conclusions unchanged. References added","Phys.Rev.D81:035016,2010","10.1103/PhysRevD.81.035016",,"hep-ph","http://arxiv.org/licenses/nonexclusive-distrib/1.0/","  We consider constraints from flavor physics on two-Higgs-doublet models
(2HDM) with general, flavor-diagonal, Yukawa couplings. Analyzing the charged
Higgs contribution to different observables, we find that $b\to s\gamma$
transitions and $\Delta M_{B_d}$ restrict the coupling $\lambda_{tt}$ of the
top quark (corresponding to $\cot\beta$ in models with a $Z_2$ symmetry) to
$|\lambda_{tt}|<1$ for $m_{H^+}\lesssim 500$ GeV. Stringent constraints from
$B$ meson decays are obtained also on the other third generation couplings
$\lambda_{bb}$ and $\lambda_{\tau\tau}$, but with stronger dependence on
$m_{H^+}$. For the second generation, we obtain constraints on combinations of
$\lambda_{ss}$, $\lambda_{cc}$, and $\lambda_{\mu\mu}$ from leptonic $K$ and
$D_s$ decays. The limits on the general couplings are translated to the common
2HDM types I -- IV with a $Z_2$ symmetry, and presented on the
$(m_{H^+},\tan\beta)$ plane. The flavor constraints are most excluding in the
type II model which lacks a decoupling limit in $\tan\beta$. We obtain a lower
limit $m_{H^+}\gtrsim 300$ GeV in models of type II and III, while no lower
bound on $m_{H^+}$ is found for types I and IV.
","[{""version"":""v1"",""created"":""Fri, 10 Jul 2009 12:39:06 GMT""},{""version"":""v2"",""created"":""Thu, 12 Nov 2009 14:45:23 GMT""}]","2010-02-19"
"0907.1792","Jukka Kiukas","J. Kiukas, A. Ruschhaupt, R. F. Werner","Tunneling times with covariant measurements","12 pages, 2 figures","Found. Phys. 39: 829-846 (2009)","10.1007/s10701-009-9275-z",,"quant-ph","http://arxiv.org/licenses/nonexclusive-distrib/1.0/","  We consider the time delay of massive, non-relativistic, one-dimensional
particles due to a tunneling potential. In this setting the well-known Hartman
effect asserts that often the sub-ensemble of particles going through the
tunnel seems to cross the tunnel region instantaneously. An obstacle to the
utilization of this effect for getting faster signals is the exponential
damping by the tunnel, so there seems to be a trade-off between speedup and
intensity. In this paper we prove that this trade-off is never in favor of
faster signals: the probability for a signal to reach its destination before
some deadline is always reduced by the tunnel, for arbitrary incoming states,
arbitrary positive and compactly supported tunnel potentials, and arbitrary
detectors. More specifically, we show this for several different ways to define
``the same incoming state'' and ''the same detector'' when comparing the
settings with and without tunnel potential. The arrival time measurements are
expressed in the time-covariant approach, but we also allow the detection to be
a localization measurement at a later time.
","[{""version"":""v1"",""created"":""Fri, 10 Jul 2009 12:23:07 GMT""}]","2009-07-13"
"0907.1793","Mareike Massow","Stefan Felsner and Mareike Massow","Linear Extension Diameter of Downset Lattices of 2-Dimensional Posets","25 pages, 7 figures",,,,"math.CO","http://arxiv.org/licenses/nonexclusive-distrib/1.0/","  The linear extension diameter of a finite poset P is the maximum distance
between a pair of linear extensions of P, where the distance between two linear
extensions is the number of pairs of elements of P appearing in different
orders in the two linear extensions. We prove a formula for the linear
extension diameter of the Boolean Lattice and characterize the diametral pairs
of linear extensions. For the more general case of a downset lattice D_P of a
2-dimensional poset P, we characterize the diametral pairs of linear extensions
of D_P and show how to compute the linear extension diameter of D_P in time
polynomial in |P|.
","[{""version"":""v1"",""created"":""Fri, 10 Jul 2009 14:02:23 GMT""}]","2009-07-13"
"0907.1794","Patricia Reynaud-Bouret","Patricia Reynaud-Bouret, Vincent Rivoirard, Christine Tuleau-Malot","Adaptive density estimation: a curse of support?","34 pages 9 figures",,,,"math.ST stat.TH","http://arxiv.org/licenses/nonexclusive-distrib/1.0/","  This paper deals with the classical problem of density estimation on the real
line. Most of the existing papers devoted to minimax properties assume that the
support of the underlying density is bounded and known. But this assumption may
be very difficult to handle in practice. In this work, we show that, exactly as
a curse of dimensionality exists when the data lie in $\R^d$, there exists a
curse of support as well when the support of the density is infinite. As for
the dimensionality problem where the rates of convergence deteriorate when the
dimension grows, the minimax rates of convergence may deteriorate as well when
the support becomes infinite. This problem is not purely theoretical since the
simulations show that the support-dependent methods are really affected in
practice by the size of the density support, or by the weight of the density
tail. We propose a method based on a biorthogonal wavelet thresholding rule
that is adaptive with respect to the nature of the support and the regularity
of the signal, but that is also robust in practice to this curse of support.
The threshold, that is proposed here, is very accurately calibrated so that the
gap between optimal theoretical and practical tuning parameters is almost
filled.
","[{""version"":""v1"",""created"":""Fri, 10 Jul 2009 12:25:57 GMT""}]","2009-07-13"
"0907.1795","Florentin Millour","Florentin Millour (MPIFR)","Hot stars and interferometry","The interferometric view on hot stars, Vi\~na del Mar : Chili (2009)",,,,"astro-ph.IM","http://arxiv.org/licenses/nonexclusive-distrib/1.0/","  What is long-baseline optical/IR stellar interferometry? A few years ago,
many astronomers might not have been able to answer that question properly.
This is today hopefully not the case anymore, because mainstream facilities,
such as the VLTI, the Keck-I or the CHARA array, offer now this delicate
technique to an astronomer who wants to observe his favourite object at the
highest angular resolution available. The large teaching effort on what is
interferometry and for what purpose it can be used, together with weak, but
already convincing imaging capabilities, make the technique reaching a ?mature?
state. I will not discuss here the details of the technique, as already many
booklets are now published on the subject, but rather describe what makes
long-baseline stellar interferometry attractive for the field of hot star
astrophysics.
","[{""version"":""v1"",""created"":""Fri, 10 Jul 2009 12:29:00 GMT""}]","2016-11-26"
"0907.1796","Emilio N.M. Cirillo","Emilio N.M. Cirillo, Francesca R. Nardi","Metastability for a stochastic dynamics with a parallel heat bath
  updating rule",,"Journal of Statistical Physics 110, 183-217, 2003",,,"cond-mat.stat-mech math-ph math.MP","http://arxiv.org/licenses/nonexclusive-distrib/1.0/","  We consider the problem of metastability for a stochastic dynamics with a
parallel updating rule with single spin rates equal to those of the heat bath
for the Ising nearest neighbors interaction. We study the exit from the
metastable phase, we describe the typical exit path and evaluate the exit time.
We prove that the phenomenology of metastability is different from the one
observed in the case of the serial implementation of the heat bath dynamics. In
particular we prove that an intermediate chessboard phase appears during the
excursion from the minus metastable phase toward the plus stable phase.
","[{""version"":""v1"",""created"":""Fri, 10 Jul 2009 12:31:59 GMT""}]","2009-07-14"
"0907.1797","Andrea Beraudo","A. Beraudo, J.P. Blaizot, P. Faccioli and G. Garberoglio","Heavy-quarks in the QGP: study of medium effects through euclidean
  propagators and spectral functions","4 pages, 3 figures - To appear in the conference proceedings for
  Quark Matter 2009, March 30 - April 4, Knoxville, Tennessee","Nucl.Phys.A830:319c-322c,2009","10.1016/j.nuclphysa.2009.10.027",,"hep-ph","http://arxiv.org/licenses/nonexclusive-distrib/1.0/","  The heavy-quark spectral function in a hot plasma is reconstructed from the
corresponding euclidean propagator. The latter is evaluated through a
path-integral simulation. A weak-coupling calculation is also performed,
allowing to interpret the qualitative behavior of the spectral function in
terms of quite general physical processes.
","[{""version"":""v1"",""created"":""Fri, 10 Jul 2009 12:34:16 GMT""},{""version"":""v2"",""created"":""Mon, 21 Sep 2009 14:08:00 GMT""}]","2009-11-18"
"0907.1798","Renat Zhdanov","Renat Zhdanov","Nonlocal symmetries of evolution equations","13 pages, LaTeX",,,,"nlin.SI","http://arxiv.org/licenses/nonexclusive-distrib/1.0/","  We suggest the method for group classification of evolution equations
admitting nonlocal symmetries which are associated with a given evolution
equation possessing nontrivial Lie symmetry. We apply this method to
second-order evolution equations in one spatial variable invariant under Lie
algebras of the dimension up to three. As a result, we construct the broad
families of new nonlinear evolution equations possessing nonlocal symmetries
which in principle cannot be obtained within the classical Lie approach.
","[{""version"":""v1"",""created"":""Fri, 10 Jul 2009 12:40:52 GMT""}]","2009-07-13"
"0907.1799","T Rajasekharan","T. Rajasekharan and V. Seshubai","Energy effects on alloying through a re-interpretation of the parameters
  of Miedema",,,,,"cond-mat.mtrl-sci","http://arxiv.org/licenses/nonexclusive-distrib/1.0/","  The parameters Phi and N of Miedema are quoted precise to the second decimal
place and are considered very accurate after adjustment in their values to
correctly predict the signs of the heats of formation of more than 500 metallic
binary systems. In this paper, we argue that Phi is proportional to the
electronegativity (Chi) of metallic elements and that N^(1/3) is the valence
effective on a linear bond. We show that, with the above hypothesis, Chi can be
derived in the absolute sense, following Gordy, as the electrostatic potential
due to the effective charge of the nucleus of an atom in a metal, felt at the
mid-point of a bond to the nearest atom. The exponent 1/3 has its origin in the
high ligancy and resonance in metals. An excellent agreement with the
hypothesis is observed for the hypoelectronic elements, while the buffer and
hyperelectronic elements show interesting variations. It is argued that the
unlike atom pair bond energies, which are correlated to the distribution of
binary systems on the map constructed using the magnitudes of parameters del
Phi and del N of Miedema, originate from the scatter in the distribution of
elements in the electronegativity versus N^(1/3)/R graph. Since it is the
scatter that is important, we see that the small corrections effected by
Miedema et al. to the parameters Phi and N are significant in deciding the
energies involved. An interpretation is provided for the energy effects
involved in the alloying of metals.
","[{""version"":""v1"",""created"":""Fri, 10 Jul 2009 12:44:27 GMT""}]","2009-07-13"
"0907.1800","Philip Adams","Y.M. Xiong, P.W. Adams, and G. Catelani","Measurement of Conduction Electron Polarization Via the Pairing
  Resonance","4 figures; to appear in PRL","Phys. Rev. Lett. 103, 067009 (2009)","10.1103/PhysRevLett.103.067009",,"cond-mat.supr-con","http://arxiv.org/licenses/nonexclusive-distrib/1.0/","  We show that the pairing resonance in the Pauli-limited normal state of
ultra-thin superconducting Al films provides a spin-resolved probe of
conduction electron polarization in thin magnetic films. A
superconductor-insulator-ferromagnet tunneling junction is used to measure the
density of states in supercritical parallel magnetic fields that are well
beyond the Clogston-Chandresekhar limit, thus greatly extending the field range
of the tunneling density of states technique. The applicability and limitations
of using the pairing resonance as a spin probe are discussed.
","[{""version"":""v1"",""created"":""Fri, 10 Jul 2009 12:47:20 GMT""}]","2009-08-17"
"0907.1802","Thomas Heinzel","A. Tarasov, S. Hugger, Hengyi Xu, M. Cerchez, T. Heinzel, I.V.
  Zozoulenko, U. Gasser-Szerer, D. Reuter, and A. D. Wieck","Quantized magnetic confinement in quantum wires","4 pages, 3 figures","Phys. Rev. Lett. 104, 186801 (2010)","10.1103/PhysRevLett.104.186801",,"cond-mat.mes-hall","http://arxiv.org/licenses/nonexclusive-distrib/1.0/","  Ballistic quantum wires are exposed to longitudinal profiles of perpendicular
magnetic fields composed of a spike (magnetic barrier) and a homogeneous part.
An asymmetric magnetoconductance peak as a function of the homogeneous magnetic
field is found, comprising quantized conductance steps in the interval where
the homogeneous magnetic field and the magnetic barrier have identical
polarities, and a characteristic shoulder with several resonances in the
interval of opposite polarities. The observations are interpreted in terms of
inhomogeneous diamagnetic shifts of the quantum wire modes leading to magnetic
confinement.
","[{""version"":""v1"",""created"":""Fri, 10 Jul 2009 12:50:42 GMT""}]","2015-05-13"
