"0907.1309","Stuart Dowker","J.S.Dowker","Group theory aspects of spectral problems on spherical factors","14 pages",,,,"math.DG gr-qc hep-th math-ph math.GR math.MP","http://arxiv.org/licenses/nonexclusive-distrib/1.0/","  The Ray-Singer isospectral theorem (1971) is applied to a general spectral
function for Laplacians of twisted p-forms (say) on homogeneous Clifford-Klein
factors of the three-sphere. The inducing formulae necessary to express any
spectral quantity for any twisting in terms of those for cyclic subgroups of
the tetrahedral, octahedral and icosahedral deck groups are detailed. Further,
Artin's theorem allows the McKay correspondence to be obtained. The isospectral
theorem is shown to yield a derivation of the Sunada construction which is
equivalent to the later one by Pesce.
","[{""version"":""v1"",""created"":""Thu, 9 Jul 2009 18:24:48 GMT""}]","2009-07-10"
"0907.1322","Louis Gaudreau","L. Gaudreau, A. Kam, G. Granger, S. A. Studenikin, P. Zawadzki and A.
  S. Sachrajda","A Tuneable Few Electron Triple Quantum Dot","11 pages, 4 figures","Appl. Phys. Lett. 95, 193101 (2009)","10.1063/1.3258663",,"cond-mat.mes-hall","http://arxiv.org/licenses/nonexclusive-distrib/1.0/","  In this paper we report on a tuneable few electron lateral triple quantum dot
design. The quantum dot potentials are arranged in series. The device is aimed
at studies of triple quantum dot properties where knowing the exact number of
electrons is important as well as quantum information applications involving
electron spin qubits. We demonstrate tuning strategies for achieving required
resonant conditions such as quadruple points where all three quantum dots are
on resonance. We find that in such a device resonant conditions at specific
configurations are accompanied by novel charge transfer behaviour.
","[{""version"":""v1"",""created"":""Thu, 9 Jul 2009 17:32:45 GMT""}]","2015-05-13"
"0907.1345","Eduardo Fradkin","Benjamin M. Fregoso and Eduardo Fradkin","Ferro-Nematic ground state of the dilute dipolar Fermi gas","4 pages, 4 figures. v2 contains a significant revision of version v1
  which contained some incorrect results. v2 includes a detail discussion of
  the phase diagram (and of the degree of polarization of the ferro-nematic
  phase) including an estimate of the critical couplings. It supersedes the
  results presented in v1; Version v4 has minor changes","Physical Review Letters 103, 205301 (2009)","10.1103/PhysRevLett.103.205301",,"cond-mat.quant-gas cond-mat.str-el","http://arxiv.org/licenses/nonexclusive-distrib/1.0/","  It is shown that a homogeneous two-component Fermi gas with (long range)
dipolar and short-range isotropic interactions has a {\em ferro-nematic} phase
for suitable values of the dipolar and short-range coupling constants. The
ferro-nematic phase is characterized by having a non-zero magnetization and
long range orientational uniaxial order. The Fermi surface of spin up (down)
component is elongated (compressed) along the direction of the magnetization.
","[{""version"":""v1"",""created"":""Thu, 9 Jul 2009 19:50:30 GMT""},{""version"":""v2"",""created"":""Thu, 10 Sep 2009 23:41:34 GMT""},{""version"":""v3"",""created"":""Sun, 18 Oct 2009 03:32:20 GMT""},{""version"":""v4"",""created"":""Sat, 31 Oct 2009 15:36:51 GMT""}]","2009-11-18"
"0907.1354","Martin Lemoine","Martin Lemoine (IAP), Eli Waxman (Weizmann Institute of Science)","Anisotropy vs chemical composition at ultra-high energies","10 pages, 3 figures","JCAP 0911:009,2009","10.1088/1475-7516/2009/11/009",,"astro-ph.HE astro-ph.CO","http://arxiv.org/licenses/nonexclusive-distrib/1.0/","  This paper proposes and discusses a test of the chemical composition of
ultra-high energy cosmic rays that relies on the anisotropy patterns measured
as a function of energy. In particular, we show that if one records an
anisotropy signal produced by heavy nuclei of charge Z above an energy E_{thr},
one should record an even stronger (possibly much stronger) anisotropy at
energies >E_{thr}/Z due to the proton component that is expected to be
associated with the sources of the heavy nuclei. This conclusion remains robust
with respect to the parameters characterizing the sources and it does not
depend at all on the modelling of astrophysical magnetic fields. As a concrete
example, we apply this test to the most recent data of the Pierre Auger
Observatory. Assuming that the anisotropy reported above 55EeV is not a
statistical accident, and that no significant anisotropy has been observed at
energies <10EeV, we show that the apparent clustering toward Cen A cannot be
attributed to heavy nuclei. Similar conclusions are drawn regarding the
apparent excess correlation with nearby active galactic nuclei. We then discuss
a robust lower bound to the magnetic luminosity that a source must possess in
order to be able to accelerate particles of charge Z up to 100EeV,
L_B>10^{45}Z^{-2}erg/s. Using this bound in conjunction with the above
conclusions, we argue that the current PAO data does not support the model of
cosmic ray origin in active radio-quiet or even radio-loud galaxies. Finally,
we demonstrate that the apparent clustering in the direction of Cen A can be
explained by the contribution of the last few gamma-ray bursts or magnetars in
the host galaxy thanks to the scattering of the cosmic rays on the magnetized
lobes.
","[{""version"":""v1"",""created"":""Thu, 9 Jul 2009 18:06:56 GMT""}]","2009-11-13"
"0907.1377","Giuseppe Lanzafame Dr.","G. Lanzafame","An approach to the Riemann problem for SPH inviscid ideal flows","6 pages, 2 b/w figures, paper just submitted",,,,"physics.flu-dyn physics.comp-ph","http://creativecommons.org/licenses/by-nc-sa/3.0/","  In the physically non viscous fluid dynamics, ""shock capturing"" methods adopt
either an artificial viscosity contribution or an appropriate Riemann solver
algorithm. These techniques are necessary to solve the strictly hyperbolic
Euler equations if flow discontinuities (the Riemann problem) must be solved. A
necessary dissipation is normally used in such cases. An explicit artificial
viscosity contribution is normally adopted to smooth out spurious heating and
to treat transport phenomena. Such a treatment of inviscid flows is also widely
adopted in the Smooth Particle Hydrodynamics (SPH) finite volume free
Lagrangian scheme. In other cases, the intrinsic dissipation of Godunov - type
methods is implicitly useful. Instead ""shock tracking"" methods normally use the
Rankine - Hugoniot jump conditions to solve such problem. A simple, effective
solution of the Riemann problem in inviscid ideal gases is here proposed, based
on an empirical reformulation of the equation of state (EoS) in the Euler
equations in fluid dynamics, whose limit for a motionless gas coincides with
the classical EoS of ideal gases. The application of such effective solution of
the Riemann problem excludes any dependence, in the transport phenomena, on
particle resolution length $h$ in non viscous SPH flows. Results on 1D shock
tube tests are here shown.
","[{""version"":""v1"",""created"":""Thu, 9 Jul 2009 16:09:53 GMT""},{""version"":""v2"",""created"":""Fri, 17 Jul 2009 06:50:45 GMT""},{""version"":""v3"",""created"":""Tue, 21 Jul 2009 17:36:14 GMT""},{""version"":""v4"",""created"":""Mon, 3 Aug 2009 09:49:10 GMT""},{""version"":""v5"",""created"":""Mon, 21 Jun 2010 06:00:30 GMT""}]","2010-06-22"
"0907.1392","Clement Gombeaud","Cl\'ement Gombeaud, Tuomas Lappi and Jean-Yves Ollitrault","Effects of partial thermalization on HBT interferometry","Proceedings for Quark Matter 2009, Knoxville, TN USA","Nucl.Phys.A830:817c-820c,2009","10.1016/j.nuclphysa.2009.10.075",,"nucl-th","http://arxiv.org/licenses/nonexclusive-distrib/1.0/","  Hydrodynamical models have generally failed to describe interferometry radii
measured at RHIC. In order to investigate this ``HBT puzzle'', we carry out a
systematic study of HBT radii in ultrarelativistic heavy-ion collisions within
a two-dimensional transport model. We compute the transverse radii $R_o$ and
$R_s$ as functions of $p_t$ for various values of the Knudsen number, which
measures the degree of thermalization in the system. For realistic values of
the Knudsen number estimated from $v_2$ data, we obtain $R_o/R_s \simeq 1.2$,
much closer to data than standard hydrodynamical results. Femtoscopic
observables vary little with the degree of thermalization. Azimuthal
oscillations of the radii in non central collisions do not provide a good probe
of thermalization.
","[{""version"":""v1"",""created"":""Thu, 9 Jul 2009 19:44:41 GMT""},{""version"":""v2"",""created"":""Fri, 25 Sep 2009 07:51:04 GMT""}]","2009-11-18"
"0907.1410","Suresh Govindarajan","Suresh Govindarajan (IITM), K. Gopala Krishna (IMSc)","BKM Lie superalgebras from dyon spectra in Z_N-CHL orbifolds for
  composite N","LaTeX, 44 pages, 2 figures (v2)Physical interpretation for a family
  of BKM Lie superalgebras provided; typos corrected","JHEP 1005:014,2010","10.1007/JHEP05(2010)014","IITM/PH/TH/2009/3, IMsc-2009-04-06","hep-th math.AG","http://arxiv.org/licenses/nonexclusive-distrib/1.0/","  We show that the generating function of electrically charged 1/2-BPS states
in N=4 supersymmetric Z_N-CHL orbifolds of the heterotic string on T^6 are
given by multiplicative eta-products. The eta-products are determined by the
cycle shape of the corresponding symplectic involution in the dual type II
picture. This enables us to complete the construction of the genus-two Siegel
modular forms due to David, Jatkar and Sen [arXiv:hep-th/0609109] for Z_N
orbifolds when N is non-prime. We study the Z_4 CHL orbifold in detail and show
that the associated Siegel modular forms, \Phi_3(Z) and \widetilde{\Phi}_3(Z),
are given by the square of the product of three even genus-two theta constants.
Extending work by us[arXiv:0807.4451] as well as Cheng and
Dabholkar[arXiv:0809.4258], we show that their `square roots' appear as the
denominator formulae of two distinct Borcherds-Kac-Moody (BKM) Lie
superalgebras. The BKM Lie superalgebra associated with the generating function
of 1/4-BPS states, i.e., \widetilde{\Phi}_3(Z) has a parabolic root system with
a light-like Weyl vector and the walls of its fundamental Weyl chamber are
mapped to the walls of marginal stability of the 1/4-BPS states.
","[{""version"":""v1"",""created"":""Thu, 9 Jul 2009 16:15:16 GMT""},{""version"":""v2"",""created"":""Wed, 23 Dec 2009 13:04:45 GMT""}]","2010-05-12"
"0907.1450","Christian Wozar","Bjoern H. Wellegehausen, Andreas Wipf, Christian Wozar","Effective Polyakov Loop Dynamics for Finite Temperature G(2)
  Gluodynamics","10 pages, 14 figures","Phys.Rev.D80:065028,2009","10.1103/PhysRevD.80.065028",,"hep-lat cond-mat.stat-mech hep-th","http://arxiv.org/licenses/nonexclusive-distrib/1.0/","  Based on the strong coupling expansion we obtain effective 3-dimensional
models for the Polyakov loop in finite-temperature G_2 gluodynamics. The
Svetitsky-Jaffe conjecture relates the resulting continuous spin models with
G_2 gluodynamics near phase transition points. In the present work we analyse
the effective theory in leading order with the help of a generalised mean field
approximation and with detailed Monte-Carlo simulations. In addition we derive
a Potts-type discrete spin model by restricting the characters of the Polyakov
loops to the three extremal points of the fundamental domain of G_2. Both the
continuous and discrete effective models show a rich phase structure with a
ferromagnetic, symmetric and several anti-ferromagnetic phases. The phase
diagram contains first and second order transition lines and tricritical
points. The modified mean field predictions compare very well with the results
of our simulations.
","[{""version"":""v1"",""created"":""Thu, 9 Jul 2009 19:59:41 GMT""},{""version"":""v2"",""created"":""Thu, 9 Jul 2009 20:45:51 GMT""}]","2015-03-13"
"0907.1482","Arno Pauly","Arno Pauly","How discontinuous is Computing Nash Equilibria?","to be presented at CCA 2009",,,,"cs.GT","http://arxiv.org/licenses/nonexclusive-distrib/1.0/","  We investigate the degree of discontinuity of several solution concepts from
non-cooperative game theory. While the consideration of Nash equilibria forms
the core of our work, also pure and correlated equilibria are dealt with.
Formally, we restrict the treatment to two player games, but results and proofs
extend to the n-player case. As a side result, the degree of discontinuity of
solving systems of linear inequalities is settled.
","[{""version"":""v1"",""created"":""Thu, 9 Jul 2009 18:45:25 GMT""}]","2009-07-10"
"0907.1490","Saurabh Bose Mr.","S. K. Bose and R. C. Budhani","Robust coupling of superconducting order parameter in a mesoscale
  NbN-Fe-NbN epitaxial structure","9 pages, 4 figures","Appl. Phys. Lett. 95, 042507 (2009)","10.1063/1.3189284",,"cond-mat.supr-con cond-mat.mes-hall","http://arxiv.org/licenses/nonexclusive-distrib/1.0/","  We report an unconventional and promising route to self-assemble distributed
superconductor-ferromagnet-superconductor (S-F-S) Josephson Junctions on single
crystal [100] MgO. These structures consist of [110] epitaxial nano-plaquettes
of Fe covered with superconducting NbN films of varying thickness. The S-F-S
structures are characterized by strong magnetoresistance (MR) anisotropy for
the in-plane and out-of-plane magnetic fields. The stronger in-plane MR
suggests decoherence of S-F-S junctions whose critical current follows a
(1-T/Tc) and (1-T/Tc)1/2 dependence for T Tc and T<<Tc respectively, in
accordance with the theory of supercurrent transport in such junctions.
","[{""version"":""v1"",""created"":""Thu, 9 Jul 2009 16:51:23 GMT""}]","2009-07-31"
"0907.1497","G\'erard Watts","M\'arton Kormos, Ingo Runkel, and G\'erard M. T. Watts","Defect flows in minimal models","35 pages, 21 figures. 1 reference added","JHEP 0911:057,2009","10.1088/1126-6708/2009/11/057","KCL-MTH-09-06","hep-th","http://arxiv.org/licenses/nonexclusive-distrib/1.0/","  In this paper we study a simple example of a two-parameter space of
renormalisation group flows of defects in Virasoro minimal models. We use a
combination of exact results, perturbation theory and the truncated conformal
space approach to search for fixed points and investigate their nature. For the
Ising model, we confirm the recent results of Fendley et al. In the case of
central charge close to one, we find six fixed points, five of which we can
identify in terms of known defects and one of which we conjecture is a new
non-trivial conformal defect. We also include several new results on exact
properties of perturbed defects and on the renormalisation group in the
truncated conformal space approach.
","[{""version"":""v1"",""created"":""Thu, 9 Jul 2009 16:22:22 GMT""},{""version"":""v2"",""created"":""Wed, 20 Oct 2010 12:02:04 GMT""}]","2010-10-21"
"0907.1529","Enrique Mac\'ias-Virg\'os","E. Mac\'ias-Virg\'os, M. J. Pereira-S\'aez","Symplectic matrices with predetermined left eigenvalues","7 pages",,,,"math.RA math.AT","http://arxiv.org/licenses/nonexclusive-distrib/1.0/","  We prove that given four arbitrary quaternion numbers of norm 1 there always
exists a $2\times 2$ symplectic matrix for which those numbers are left
eigenvalues. The proof is constructive. An application to the LS category of
Lie groups is given.
","[{""version"":""v1"",""created"":""Thu, 9 Jul 2009 17:24:20 GMT""}]","2009-07-10"
"0907.1564","Stephen Powell","Stephen Powell, J. T. Chalker","Classical to quantum mapping for an unconventional phase transition in a
  three-dimensional classical dimer model","15 pages, 5 figures; v2: added appendix","Phys. Rev. B 80, 134413 (2009)","10.1103/PhysRevB.80.134413",,"cond-mat.stat-mech","http://arxiv.org/licenses/nonexclusive-distrib/1.0/","  We study the transition between a Coulomb phase and a dimer crystal observed
in numerical simulations of the three-dimensional classical dimer model, by
mapping it to a quantum model of bosons in two dimensions. The quantum phase
transition that results, from a superfluid to a Mott insulator at fractional
filling, belongs to a class that cannot be described within the
Landau-Ginzburg-Wilson paradigm. Using a second mapping, to a dual model of
vortices, we show that the long-wavelength physics near the transition is
described by a U(1) gauge theory with SU(2) matter fields.
","[{""version"":""v1"",""created"":""Thu, 9 Jul 2009 16:31:39 GMT""},{""version"":""v2"",""created"":""Fri, 16 Oct 2009 19:59:10 GMT""},{""version"":""v3"",""created"":""Fri, 16 Oct 2009 20:12:39 GMT""}]","2009-10-16"
"0907.1593","Mikheil Menteshashvili","D. Baeriswyl, D. Eichenberger and M. Menteshashvili","Variational ground states of the two-dimensional Hubbard model","18 pages, 4 figures, to be published in New J. Phys","New J. Phys. 11 (2009) 075010","10.1088/1367-2630/11/7/000",,"cond-mat.str-el cond-mat.supr-con","http://arxiv.org/licenses/nonexclusive-distrib/1.0/","  Recent refinements of analytical and numerical methods have improved our
understanding of the ground-state phase diagram of the two-dimensional (2D)
Hubbard model. Here we focus on variational approaches, but comparisons with
both Quantum Cluster and Gaussian Monte Carlo methods are also made. Our own
ansatz leads to an antiferromagnetic ground state at half filling with a
slightly reduced staggered order parameter (as compared to simple mean-field
theory). Away from half filling, we find d-wave superconductivity, but confined
to densities where the Fermi surface passes through the antiferromagnetic zone
boundary (if hopping between both nearest-neighbour and next-nearest-neighbour
sites is considered). Our results agree surprisingly well with recent numerical
studies using the Quantum Cluster method. An interesting trend is found by
comparing gap parameters (antiferromagnetic or superconducting) obtained with
different variational wave functions. They vary by an order of magnitude and
thus cannot be taken as a characteristic energy scale. In contrast, the order
parameter is much less sensitive to the degree of sophistication of the
variational schemes, at least at and near half filling.
","[{""version"":""v1"",""created"":""Thu, 9 Jul 2009 16:20:24 GMT""}]","2009-07-25"
"0907.1594","Eric Thrane","E. Thrane (for the Super-Kamiokande Collaboration)","Search for Astrophysical Neutrino Point Sources at Super-Kamiokande",,"Astrophys.J.704:503-512,2009","10.1088/0004-637X/704/1/503",,"astro-ph.HE","http://arxiv.org/licenses/nonexclusive-distrib/1.0/","  It has been hypothesized that large fluxes of neutrinos may be created in
astrophysical ""cosmic accelerators."" The primary background for a search for
astrophysical neutrinos comes from atmospheric neutrinos, which do not exhibit
the pointlike directional clustering that characterizes a distant astrophysical
signal. We perform a search for neutrino point sources using the upward-going
muon data from three phases of operation (SK-I, SK-II, and SK-III) spanning
2623 days of live time taken from April 1, 1996 to August 11, 2007. The search
looks for signals from suspected galactic and extragalactic sources, transient
sources, and unexpected sources. We find interesting signatures from two
objects--RX J1713.7-3946 (97.5% CL) and GRB 991004D (95.3% CL)--but the
signatures lack compelling statistical significance given trial factors. We set
limits on the flux and fluence of neutrino point sources above energies of 1.6
GeV.
","[{""version"":""v1"",""created"":""Thu, 9 Jul 2009 16:34:39 GMT""},{""version"":""v2"",""created"":""Tue, 18 Aug 2009 04:07:22 GMT""},{""version"":""v3"",""created"":""Fri, 21 Aug 2009 03:37:03 GMT""},{""version"":""v4"",""created"":""Thu, 24 Sep 2009 07:39:03 GMT""}]","2019-08-14"
"0907.1597","Thomas Hinton","James A. R. Marshall and Thomas G. Hinton","Beyond No Free Lunch: Realistic Algorithms for Arbitrary Problem Classes","(V3 fixed some other typos and improved some results)",,,,"cs.IT cs.NE math.IT","http://arxiv.org/licenses/nonexclusive-distrib/1.0/","  We show how the necessary and sufficient conditions for the NFL to apply can
be reduced to the single requirement of the set of objective functions under
consideration being closed under permutation, and quantify the extent to which
a set of objectives not closed under permutation can give rise to a performance
difference between two algorithms. Then we provide a more refined definition of
performance under which we show that revisiting algorithms are always trumped
by enumerative ones.
","[{""version"":""v1"",""created"":""Thu, 9 Jul 2009 16:10:43 GMT""},{""version"":""v2"",""created"":""Wed, 15 Jul 2009 09:21:22 GMT""},{""version"":""v3"",""created"":""Tue, 16 Mar 2010 15:44:37 GMT""}]","2010-03-17"
"0907.1598","Pedro Mendez-Hernandez","Rodrigo Banuelos, Pedro J. Mendez-Hernandez","Symmetrization of L\'evy processes and applications","25 pages",,,,"math.PR math.SP","http://arxiv.org/licenses/nonexclusive-distrib/1.0/","  It is shown that many of the classical generalized isoperimetric inequalities
for the Laplacian when viewed in terms of Brownian motion extend to a wide
class of Levy processes. The results are derived from the multiple integral
inequalities of Brascamp, Lieb and Luttinger but the probabilistic structure of
the processes plays a crucial role in the proofs.
","[{""version"":""v1"",""created"":""Thu, 9 Jul 2009 16:03:28 GMT""}]","2009-07-10"
"0907.1599","Bojan Mohar","Zdenek Dvorak and Bojan Mohar","Crossing-critical graphs with large maximum degree",,"J. Combin. Theory, Ser. B 100 (2010) 413-417","10.1016/j.jctb.2009.11.003",,"math.CO","http://arxiv.org/licenses/nonexclusive-distrib/1.0/","  A conjecture of Richter and Salazar about graphs that are critical for a
fixed crossing number $k$ is that they have bounded bandwidth. A weaker
well-known conjecture of Richter is that their maximum degree is bounded in
terms of $k$. In this note we disprove these conjectures for every $k\ge 171$,
by providing examples of $k$-crossing-critical graphs with arbitrarily large
maximum degree.
","[{""version"":""v1"",""created"":""Thu, 9 Jul 2009 16:04:34 GMT""}]","2011-01-14"
"0907.1600","Andrew Kent","Andrew D. Kent and Daniel L. Stein","Annular Spin-Transfer Memory Element","6 pages, 6 figures, submitted to IEEE Transactions On Nanotechnology","IEEE Transactions on Nanotechnology 10, 129 (2011)","10.1109/TNANO.2009.2033598",,"cond-mat.mes-hall","http://arxiv.org/licenses/nonexclusive-distrib/1.0/","  An annular magnetic memory that uses a spin-polarized current to switch the
magnetization direction or helicity of a magnetic region is proposed. The
device has magnetic materials in the shape of a ring (1 to 5 nm in thickness,
20 to 250 nm in mean radius and 8 to 100 nm in width), comprising a reference
magnetic layer with a fixed magnetic helicity and a free magnetic layer with a
changeable magnetic helicity. These are separated by a thin non-magnetic layer.
Information is written using a current flowing perpendicular to the layers,
inducing a spin-transfer torque that alters the magnetic state of the free
layer. The resistance, which depends on the magnetic state of the device, is
used to read out the stored information. This device offers several important
advantages compared to conventional spin-transfer magnetic random access memory
(MRAM) devices. First, the ring geometry offers stable magnetization states,
which are, nonetheless, easily altered with short current pulses. Second, the
ring geometry naturally solves a major challenge of spin-transfer devices:
writing requires relatively high currents and a low impedance circuit, whereas
readout demands a larger impedance and magnetoresistance. The annular device
accommodates these conflicting requirements by performing reading and writing
operations at separate read and write contacts placed at different locations on
the ring.
","[{""version"":""v1"",""created"":""Thu, 9 Jul 2009 16:07:11 GMT""}]","2015-05-13"
"0907.1601","Eric Schippers","Eric Schippers","A power matrix approach to the Witt algebra and Loewner equations","25 pages",,,,"math.CV math-ph math.MP","http://arxiv.org/licenses/nonexclusive-distrib/1.0/","  The theory of formal power series and derivation is developed from the point
of view of the power matrix. A Loewner equation for formal power series is
introduced. We then show that the matrix exponential is surjective onto the
group of power matrices, and the coefficients are entire functions of finitely
many coefficients of the infinitesimal generator. Furthermore coefficients of
the solution to the Loewner equation with constant infinitesimal generator can
be obtained by exponentiating an infinitesimal power matrix. We also use the
formal Loewner equations to investigate the relation between holomorphicity of
an infinitesimal generator to holomorphicity of the exponentiated matrix.
","[{""version"":""v1"",""created"":""Thu, 9 Jul 2009 16:09:56 GMT""}]","2009-07-10"
