"0907.1642","Malte Henkel","Malte Henkel and Michel Pleimling","Non-markovian global persistence in phase-ordering kinetics","Latex2e, 9 pages with 2 figures included, final version","J. Stat. Mech. P12012 (2009)","10.1088/1742-5468/2009/12/P12012",,"cond-mat.stat-mech hep-th math-ph math.MP","http://arxiv.org/licenses/nonexclusive-distrib/1.0/","  The persistence probability P_g(t) of the global order-parameter of a simple
ferromagnet undergoing phase-ordering kinetics after a quench from a fully
disordered state to below the critical temperature, T<T_c, is analysed. It is
argued that the persistence probability decays algebraically with time in the
entire low-temperature phase. For Markov processes, the associated global
persistence exponent theta_g = (2 lambda_C -d)/(2z) is related to the
autocorrelation exponent lambda_C. This relationship is confirmed for
phase-ordering in the exactly solved 1D Ising model and the d-dimensional
spherical model. For the 2D Glauber-Ising model, theta_g=0.063(2) is found
which indicates that the dynamics of the global order-parameter is described by
a non-markovian process.
","[{""version"":""v1"",""created"":""Thu, 9 Jul 2009 18:38:59 GMT""},{""version"":""v2"",""created"":""Mon, 30 Nov 2009 16:23:50 GMT""}]","2009-12-21"
"0907.1643","Jay Pasachoff","Jay M. Pasachoff, Vojtech Rusin, Miloslav Druckmuller, Peter Aniol,
  Metod Saniga, and Milan Minarovjech","The 2008 August 1 Eclipse Solar-Minimum Corona Unraveled","Accepted in The Astrophysical Journal, 6 July 2009","Astrophys.J.702:1297-1308,2009","10.1088/0004-637X/702/2/1297",,"astro-ph.SR","http://arxiv.org/licenses/nonexclusive-distrib/1.0/","  We discuss results stemming from observations of the white-light and [Fe XIV]
emission corona during the total eclipse of the Sun of 2008 August 1, in
Mongolia (Altaj region) and in Russia (Akademgorodok, Novosibirsk, Siberia).
Corresponding to the current extreme solar minimum, the white-light corona,
visible up to 20 solar radii, was of a transient type with well-pronounced
helmet streamers situated above a chain of prominences at position angles 48,
130, 241 and 322 degrees. A variety of coronal holes, filled with a number of
thin polar plumes, were seen around the poles. Furthering an original method of
image processing, stars up to 12 magnitude, a Kreutz-group comet (C/2008 O1),
and a coronal mass ejection (CME) were also detected, with the smallest
resolvable structures being of, and at some places even less than, 1 arcsec.
Differences, presumably motions, in the corona and prominences are seen even
with the 19-min time difference between our sites. In addition to the
high-resolution coronal images, which show the continuum corona (K-corona) that
results from electron scattering of photospheric light, images of the
overlapping green-emission-line (530.3 nm, [Fe XIV]) corona were obtained with
the help of two narrow-passband filters (centered on the line itself and for
the continuum in the vicinity of 529.1 nm, respectively), each with FWHM of
0.15 nm. Through solar observations, on whose scheduling and details we
consulted, with the Solar and Heliospheric Observatory, Hinode's XRT and SOT,
TRACE, and STEREO, as well as Wilcox Solar Observatory and SOHO/MDI
magnetograms, we set our eclipse observations in the context of the current
unusually low and prolonged solar minimum.
","[{""version"":""v1"",""created"":""Thu, 9 Jul 2009 18:40:58 GMT""}]","2010-10-28"
"0907.1644","Carlos Aragao de Carvalho","E. Reyes-Gomez, A. Bruno-Alfonso, S. B. Cavalcanti, C. A. A. de
  Carvalho, and L. E. Oliveira","Plasmon polaritons in photonic superlattices containing a left-handed
  material","4 pages, 4 figures",,"10.1209/0295-5075/88/24002",,"cond-mat.other","http://arxiv.org/licenses/nonexclusive-distrib/1.0/","  We analyze one-dimensional photonic superlattices which alternate layers of
air and a left-handed material. We assume Drude-type dispersive responses for
the dielectric permittivity and magnetic permeability of the left-handed
material. Maxwell's equations and the transfer-matrix technique are used to
derive the dispersion relation for the propagation of obliquely incident
optical fields. The photonic dispersion indicates that the growth-direction
component of the electric (or magnetic) field leads to the propagation of
electric (or magnetic) plasmon polaritons, for either TE or TM configurations.
Furthermore, we show that if the plasma frequency is chosen within the photonic
$<n(\omega)>=0$ zeroth-order bandgap, the coupling of light with plasmons
weakens considerably. As light propagation is forbidden in that particular
frequency region, the plasmon-polariton mode reduces to a pure plasmon mode.
","[{""version"":""v1"",""created"":""Thu, 9 Jul 2009 18:46:50 GMT""}]","2015-05-13"
"0907.1645","Paul Mackenzie","Paul B. Mackenzie","The CKM Matrix from Lattice QCD","To appear in Prog. Theor. Phys. Vol. 122, No.1 (Special Issue)","Prog.Theor.Phys.122:169-184,2009","10.1143/PTP.122.169",,"hep-ph","http://arxiv.org/licenses/nonexclusive-distrib/1.0/","  Lattice QCD plays an essential role in testing and determining the parameters
of the CKM theory of flavor mixing and CP violation. Very high precisions are
required for lattice calculations analysing CKM data; I discuss the prospects
for achieving them. Lattice calculations will also play a role in investigating
flavor mixing and CP violation beyond the Standard Model.
","[{""version"":""v1"",""created"":""Thu, 9 Jul 2009 19:03:36 GMT""}]","2010-01-08"
"0907.1646","Paul Frampton","Paul H. Frampton","Looking for Intermediate-Mass Black Holes","4pp latex. Plenary talk at BSM-LHC conference, Northeastern
  University, June 2009","Nucl.Phys.Proc.Suppl.200-202:176-178,2010","10.1016/j.nuclphysbps.2010.02.080",,"astro-ph.CO","http://arxiv.org/licenses/nonexclusive-distrib/1.0/","  A discussion of the entropy of the universe leads to the suggestion of very
many intermediate-mass black holes between thirty and three hundred thousand
solar masses in the halo. It is consistent with observations on wide binaries
as well as microlensing and considerations of disk stability that such IMBHs
constitute all cold dark matter
","[{""version"":""v1"",""created"":""Thu, 9 Jul 2009 19:24:02 GMT""}]","2014-11-20"
"0907.1647","Alan Horwitz","Alan Horwitz","An Area Inequality for Ellipses Inscribed in Quadrilaterals","Submitted for publication to the Journal of Mathematical
  Inequalities. 16 pages, no figures","Journal of Mathematical Inequalities, Volume 4, Issue 3(2010),
  431-443",,,"math.CA","http://arxiv.org/licenses/nonexclusive-distrib/1.0/","  If E is any ellipse inscribed in a convex quadrilateral, D, then we prove
that Area(E)/Area(D) is less than or equal to pi/4, and equality holds if and
only if D is a parallelogram and E is tangent to the sides of D at the
midpoints. This extends well known results for ellipses inscribed in triangles.
We also prove that the foci of the unique ellipse of maximal area inscribed in
a parallelogram, D, lie on the orthogonal least squares line for the vertices
of D. This does not hold in general for convex quadrilaterals.
","[{""version"":""v1"",""created"":""Thu, 9 Jul 2009 19:29:24 GMT""}]","2011-07-29"
"0907.1648","Igor Wigman","Igor Wigman","Fluctuations of the nodal length of random spherical harmonics, erratum","This is to correct a sign mistake that has been made in the previous
  version (that was published in Comm. Math. Phys.). As a result the leading
  constant in all the theorems was wrong, and the constants are now consistent
  with the one predicted by Berry. A corrected manuscript plus a detailed
  erratum with all the corrections that were made relatively to the version
  published is attached",,"10.1007/s00220-010-1078-8",,"math.PR math-ph math.MP","http://arxiv.org/licenses/nonexclusive-distrib/1.0/","  Using the multiplicities of the Laplace eigenspace on the sphere (the space
of spherical harmonics) we endow the space with Gaussian probability measure.
This induces a notion of random Gaussian spherical harmonics of degree $n$
having Laplace eigenvalue $E=n(n+1)$. We study the length distribution of the
nodal lines of random spherical harmonics. It is known that the expected length
is of order $n$. It is natural to conjecture that the variance should be of
order $n$, due to the natural scaling. Our principal result is that, due to an
unexpected cancelation, the variance of the nodal length of random spherical
harmonics is of order $\log{n}$. This behaviour is consistent with the one
predicted by Berry for nodal lines on chaotic billiards (Random Wave Model). In
addition we find that a similar result is applicable for ""generic"" linear
statistics of the nodal lines.
","[{""version"":""v1"",""created"":""Thu, 9 Jul 2009 19:30:31 GMT""},{""version"":""v2"",""created"":""Wed, 10 Mar 2010 23:07:43 GMT""},{""version"":""v3"",""created"":""Thu, 8 Sep 2011 22:39:35 GMT""}]","2015-05-13"
"0907.1649","L.D Contreras-Pulido Dr.","L.D. Contreras-Pulido and R. Aguado","Shot noise spectrum of artificial Single Molecule Magnets: measuring
  spin-relaxation times via the Dicke effect",,"Phys. Rev. B 81, 161309(R) (2010)","10.1103/PhysRevB.81.161309",,"cond-mat.mes-hall","http://arxiv.org/licenses/nonexclusive-distrib/1.0/","  We investigate theoretically shot noise in an artificial Single Molecule
Magnet based upon a CdTe quantum dot doped with a single S=5/2 Mn spin and
gated in the hole sector. Mn-hole exchange anisotropy is shown to lead to
profound consequences on noise, like super-Poissonian behaviour. We report on a
novel effect, similar to the Dicke effect in Quantum Optics, that allows to
separately extract the hole and Mn spin relaxation times using
frequency-resolved shot noise measurements. We expect that our findings may
have further relevance to experiments in other S>1/2 systems including
transport through Mn(12) molecules and STM spectroscopy of magnetic atoms.
","[{""version"":""v1"",""created"":""Thu, 9 Jul 2009 19:31:52 GMT""},{""version"":""v2"",""created"":""Thu, 9 Jul 2009 20:04:30 GMT""}]","2011-03-31"
"0907.1650","David Stockwell PhD","David R.B. Stockwell and Anthony Cox","Structural break models of climatic regime-shifts: claims and forecasts","Submitted to the International Journal of Forecasting on 5 July 2009",,,,"physics.ao-ph","http://arxiv.org/licenses/nonexclusive-distrib/1.0/","  A Chow test for structural breaks in the surface temperature series is used
to investigate two common claims about global warming. Quirk (2009) proposed
that the increase in Australian temperature from 1910 to the present was
largely confined to a regime-shift in the Pacific Decadal Oscillation (PDO)
between 1976 and 1979. The test finds a step change in both Australian and
global temperature trends in 1978 (HadCRU3GL), and in Australian rainfall in
1982 with flat temperatures before and after. Easterling & Wehner (2009)
claimed that singling out the apparent flatness in global temperature since
1997 is 'cherry picking' to reinforce an arbitrary point of view. On the
contrary, we find evidence for a significant change in the temperature series
around 1997, corroborated with evidence of a coincident oceanographic
regime-shift. We use the trends between these significant change points to
generate a forecast of future global temperature under specific assumptions.
","[{""version"":""v1"",""created"":""Thu, 9 Jul 2009 19:56:23 GMT""},{""version"":""v2"",""created"":""Thu, 9 Jul 2009 20:00:07 GMT""},{""version"":""v3"",""created"":""Sun, 12 Jul 2009 20:51:09 GMT""}]","2009-07-12"
"0907.1651","Dan Xie","Dimitri Nanopoulos, Dan Xie","N=2 SU Quiver with USP Ends or SU Ends with Antisymmetric Matter","Minor changes are made; refrences are added; 21 pages, 18 figures","JHEP 0908:108,2009","10.1088/1126-6708/2009/08/108",,"hep-th","http://arxiv.org/licenses/nonexclusive-distrib/1.0/","  We consider the four dimensional scale invariant N=2 SU quiver gauge theories
with USp(2N) ends or SU(2N) ends with antisymmetric matter representations. We
argue that these theories are realized as six dimensional A_{2N-1} (0,2)
theories compactified on spheres with punctures. With this realization, we can
study various strongly coupled cusps in moduli space and find the S-dual
theories. We find a class of isolated superconformal field theories with only
odd dimensional operators $D(\phi)\geq3$ and superconformal field theories with
only even dimensional operators $D(\phi)\geq4$.
","[{""version"":""v1"",""created"":""Thu, 9 Jul 2009 20:49:12 GMT""},{""version"":""v2"",""created"":""Wed, 12 Aug 2009 00:45:41 GMT""}]","2009-09-28"
"0907.1652","Martin Gaskell","C. Martin Gaskell and John Kormendy","An Improved Black Hole Mass - Bulge Luminosity Relationship for AGNs","To appear in ""Galaxy Evolution: Emerging Insights and New
  Challenges"", ASP Conference Series, ed. Shardha Jogee, Lei Hao, Guillermo
  Blanc, and Irina Marinova. 4 pages, 5 figures",,,,"astro-ph.GA astro-ph.CO","http://arxiv.org/licenses/nonexclusive-distrib/1.0/","  Two effects have substantially increased the scatter in the AGN black hole
mass - host galaxy bulge luminosity relationship derived from SDSS spectra. The
first is that at a fixed black hole mass, the SDSS spectrum depends strongly on
redshift because an SDSS fiber sees a larger fraction of the total light of
more distant galaxies. The second is that at a given redshift, the fraction of
host-galaxy light in the fiber increases with decreasing galaxy luminosity. We
illustrate the latter effect using the Kormendy et al. (2009) light profiles of
Virgo ellipticals. With allowance for the two effects, we obtain a black hole
mass - bulge luminosity relationship for AGNs which has a scatter of only +/-
0.23 dex in mass. This is less than the scatter found for inactive galaxies,
and is consistent with the measuring errors. We show that there is a
correspondingly tight linear relationship between the fraction of host galaxy
light in AGN spectra and the Eddington ratio. This linearity implies that at a
given black hole mass, the host luminosities of high-accretion-rate AGNs
(NLS1s) and low-accretion-rate AGNs are similar. The relationship between the
fraction of host galaxy light and the Eddington ratio provides a simple means
of estimating the fraction of host galaxy light in AGN spectra. This means that
the real amplitude of variability of low-accretion-rate AGNs is increased
relative to NLS1s.
","[{""version"":""v1"",""created"":""Thu, 9 Jul 2009 20:00:03 GMT""}]","2009-07-13"
"0907.1653","Roi Alonso","R. Alonso, A. Alapini, S. Aigrain, M. Auvergne, A. Baglin, M.
  Barbieri, P. Barge, A.S. Bonomo, P. Borde, F. Bouchy, S. Chaintreuil, R. De
  la Reza, H.J. Deeg, M. Deleuil, R. Dvorak, A. Erikson, M. Fridlund, F.
  Fialho, P. Gondoin, T. Guillot, A. Hatzes, L. Jorda, H. Lammer, A. Leger, A.
  Llebaria, P. Magain, T. Mazeh, C. Moutou, M. Ollivier, M. Patzold, F. Pont,
  D. Queloz, H. Rauer, D. Rouan, J. Schneider, G. Wuchterl","The secondary eclipse of CoRoT-1b","6 pages, to appear in A&A, submitted 18 march 2009, accepted 7 July
  2009",,"10.1051/0004-6361/200912102",,"astro-ph.EP","http://arxiv.org/licenses/nonexclusive-distrib/1.0/","  The transiting planet CoRoT-1b is thought to belong to the pM-class of
planets, in which the thermal emission dominates in the optical wavelengths. We
present a detection of its secondary eclipse in the CoRoT white channel data,
whose response function goes from ~400 to ~1000 nm. We used two different
filtering approaches, and several methods to evaluate the significance of a
detection of the secondary eclipse. We detect a secondary eclipse centered
within 20 min at the expected times for a circular orbit, with a depth of
0.016+/-0.006%. The center of the eclipse is translated in a 1-sigma upper
limit to the planet's eccentricity of ecosomega<0.014. Under the assumption of
a zero Bond Albedo and blackbody emission from the planet, it corresponds to a
T_{CoRoT}=2330 +120-140 K. We provide the equilibrium temperatures of the
planet as a function of the amount of reflected light. If the planet is in
thermal equilibrium with the incident flux from the star, our results imply an
inefficient transport mechanism of the flux from the day to the night sides.
","[{""version"":""v1"",""created"":""Thu, 9 Jul 2009 20:00:14 GMT""}]","2010-03-11"
"0907.1654","Rivay Mor","Rivay Mor, Hagai Netzer and Moshe Elitzur","Dusty Structure Around Type-I Active Galactic Nuclei: Clumpy Torus
  Narrow Line Region and Near-Nucleus Hot Dust","14 pages, including 11 figures, submitted to ApJ and revised
  following the referee's report","Astrophys.J.705:298-313,2009","10.1088/0004-637X/705/1/298",,"astro-ph.CO","http://arxiv.org/licenses/nonexclusive-distrib/1.0/","  We fitted Spitzer/IRS ~2-35 um spectra of 26 luminous QSOs in attempt to
define the main emission components. Our model has three major components: a
clumpy torus, dusty narrow line region (NLR) clouds and a blackbody-like dust.
The models utilize the clumpy torus of Nenkova et al. (2008) and are the first
to allow its consistent check in type-I AGNs. Single torus models and combined
torus-NLR models fail to fit the spectra of most sources but three component
models adequately fit the spectra of all sources. We present torus inclination,
cloud distribution, covering factor and torus mass for all sources and compare
them with bolometric luminosity, black hole mass and accretion rate. The torus
covering factor and mass are found to be correlated with the bolometric
luminosity of the sources. We find that a substantial amount of the ~2-7 um
radiation originates from a hot dust component, which likely situated in the
innermost part of the torus. The luminosity radiated by this component and its
covering factor are comparable to those of the torus. We quantify the emission
by the NLR clouds and estimate their distance from the center. The distances
are ~700 times larger than the dust sublimation radius and the NLR covering
factor is about 0.07. The total covering factor by all components is in good
agreement with the known AGN type-I:type-II ratio.
","[{""version"":""v1"",""created"":""Thu, 9 Jul 2009 20:00:15 GMT""}]","2011-02-11"
"0907.1655","Scott Noble","Scott C. Noble and Julian H. Krolik (Department of Physics and
  Astronomy, Johns Hopkins University)","GRMHD prediction of coronal variability in accreting black holes","Accepted for publication in ApJ, 35 pages, 11 figures (8 color and 3
  greyscale), AASTEX. High-resolution versions can be found at the following
  links: [PS] http://www.pha.jhu.edu/~scn/papers/grmhd_var.ps [PDF]
  http://www.pha.jhu.edu/~scn/papers/grmhd_var.pdf","Astrophys.J.703:964-975,2009","10.1088/0004-637X/703/1/964",,"astro-ph.HE","http://arxiv.org/licenses/nonexclusive-distrib/1.0/","  On the basis of data from an energy-conserving 3D general relativistic MHD
simulation, we predict the statistical character of variability in the coronal
luminosity from accreting black holes. When the inner boundary of the corona is
defined to be the electron scattering photosphere, its location depends only on
the mass accretion rate in Eddington units (\dot{M}). Nearly independent of
viewing angle and \dot{M}, the power spectrum over the range of frequencies
from approximately the orbital frequency at the innermost stable circular orbit
(ISCO) to ~100 times lower is well approximated by a power-law with index -2,
crudely consistent with the observed power spectra of hard X-ray fluctuations
in AGN and the hard states of Galactic binary black holes. The underlying
physical driver for variability in the light curve is variations in the
accretion rate caused by the chaotic character of MHD turbulence, but the power
spectrum of the coronal light output is significantly steeper. Part of this
contrast is due to the fact that the mass accretion rate can be significantly
modulated by radial epicyclic motions that do not result in dissipation, and
therefore do not drive luminosity fluctuations. The other part of this contrast
is due to the inward decrease of the characteristic inflow time, which leads to
decreasing radial coherence length with increasing fluctuation frequency.
","[{""version"":""v1"",""created"":""Thu, 9 Jul 2009 20:01:14 GMT""}]","2009-09-28"
"0907.1656","Jin Koda","J. Koda (1,2), N. Scoville (1), T. Sawada (3), M. A. La Vigne, S. N.
  Vogel (4), A. E. Potts, J. M. Carpenter, S. A. Corder (1), M. C. H. Wright
  (5), S. M. White, B. A. Zauderer (4), J. Patience, A. I. Sargent (1), D. C.
  -J. Bock (6), D. Hawkins, M. Hodges (7), A. Kemball (8), J.W. Lamb (7), R.L.
  Plambeck (5), M.W. Pound (4), S. L. Scott (7), P. Teuben (4), D.P. Woody (7),
  ((1) Caltech, (2) Stony Brook, (3) NRO, (4) U. Maryland, (5) Berkeley, (6)
  CARMA, (7) OVRO, (8) UIUC)","Dynamically Driven Evolution of the Interstellar Medium in M51","6 pages, including 3 figures. Accepted, ApJL","Astrophys.J.700:L132-L136,2009","10.1088/0004-637X/700/2/L132",,"astro-ph.CO astro-ph.GA","http://arxiv.org/licenses/nonexclusive-distrib/1.0/","  We report the highest-fidelity observations of the spiral galaxy M51 in CO
emission, revealing the evolution of giant molecular clouds (GMCs) vis-a-vis
the large-scale galactic structure and dynamics. The most massive GMCs
(so-called GMAs) are first assembled and then broken up as the gas flow through
the spiral arms. The GMAs and their H2 molecules are not fully dissociated into
atomic gas as predicted in stellar feedback scenarios, but are fragmented into
smaller GMCs upon leaving the spiral arms. The remnants of GMAs are detected as
the chains of GMCs that emerge from the spiral arms into interarm regions. The
kinematic shear within the spiral arms is sufficient to unbind the GMAs against
self-gravity. We conclude that the evolution of GMCs is driven by large-scale
galactic dynamics --their coagulation into GMAs is due to spiral arm streaming
motions upon entering the arms, followed by fragmentation due to shear as they
leave the arms on the downstream side. In M51, the majority of the gas remains
molecular from arm entry through the inter-arm region and into the next spiral
arm passage.
","[{""version"":""v1"",""created"":""Thu, 9 Jul 2009 20:01:39 GMT""}]","2009-07-22"
"0907.1657","Hendrik Weimer","Hendrik Weimer, Markus M\""uller, Igor Lesanovsky, Peter Zoller, Hans
  Peter B\""uchler","A Rydberg Quantum Simulator","8 pages, 4 figures","Nature Phys. 6, 382-388 (2010)","10.1038/nphys1614",,"quant-ph cond-mat.mes-hall cond-mat.str-el","http://arxiv.org/licenses/nonexclusive-distrib/1.0/","  Following Feynman and as elaborated on by Lloyd, a universal quantum
simulator (QS) is a controlled quantum device which reproduces the dynamics of
any other many particle quantum system with short range interactions. This
dynamics can refer to both coherent Hamiltonian and dissipative open system
evolution. We investigate how laser excited Rydberg atoms in large spacing
optical or magnetic lattices can provide an efficient implementation of a
universal QS for spin models involving (high order) n-body interactions. This
includes the simulation of Hamiltonians of exotic spin models involving
n-particle constraints such as the Kitaev toric code, color code, and lattice
gauge theories with spin liquid phases. In addition, it provides the
ingredients for dissipative preparation of entangled states based on
engineering n-particle reservoir couplings. The key basic building blocks of
our architecture are efficient and high-fidelity n-qubit entangling gates via
auxiliary Rydberg atoms, including a possible dissipative time step via optical
pumping. This allows to mimic the time evolution of the system by a sequence of
fast, parallel and high-fidelity n-particle coherent and dissipative Rydberg
gates.
","[{""version"":""v1"",""created"":""Fri, 10 Jul 2009 15:03:11 GMT""},{""version"":""v2"",""created"":""Mon, 9 Apr 2012 21:19:39 GMT""}]","2012-04-11"
"0907.1658","Raphael Flauger","Sergei Dubovsky, Raphael Flauger, Alexei Starobinsky, Igor Tkachev","Signatures of a Graviton Mass in the Cosmic Microwave Background","22 pages, 5 figures, v2: references added, accepted for publication
  in PRD","Phys.Rev.D81:023523,2010","10.1103/PhysRevD.81.023523","UTTG-06-09, TCC-23-09","astro-ph.CO hep-ph hep-th","http://arxiv.org/licenses/nonexclusive-distrib/1.0/","  There exist consistent low energy effective field theories describing gravity
in the Higgs phase that allow the coexistence of massive gravitons and the
conventional 1/r potential of gravity. In an effort to constrain the value of
the graviton mass in these theories, we study the tensor contribution to the
CMB temperature anisotropy and polarization spectra in the presence of a
non-vanishing graviton mass. We find that the observation of a B-mode signal
consistent with the spectrum predicted by inflationary models would provide the
strongest limit yet on the mass of an elementary particle -- a graviton -- at a
level of m\lesssim 10^(-30) eV\approx(10 Mpc)^(-1). We also find that a
graviton mass in the range between (10 Mpc)^(-1) and (10 kpc)^(-1) leads to
interesting modifications of the polarization spectrum. The characteristic
signature of a graviton mass in this range would be a plateau in the B-mode
spectrum up to angular multipoles of l\sim 100. For even larger values of the
graviton mass the tensor contribution to the CMB spectra becomes strongly
suppressed.
","[{""version"":""v1"",""created"":""Thu, 9 Jul 2009 20:05:04 GMT""},{""version"":""v2"",""created"":""Fri, 25 Dec 2009 02:20:26 GMT""}]","2014-11-20"
