"0907.1696","Yithsbey Giraldo","Yithsbey Giraldo, William A. Ponce and Luis A. S\'anchez","Stability of the Scalar Potential and Symmetry Breaking in the
  Economical 3-3-1 Model","to be published in EPJ C, 13 pages","Eur.Phys.J.C63:461-475,2009","10.1140/epjc/s10052-009-1101-4",,"hep-ph","http://arxiv.org/licenses/nonexclusive-distrib/1.0/","  A detailed study of the criteria for stability of the scalar potential and
the proper electroweak symmetry breaking pattern in the economical 3-3-1 model,
is presented. For the analysis we use, and improve, a method previously
developed to study the scalar potential in the two-Higgs-doublet extension of
the standard model. A new theorem related to the stability of the potential is
stated. As a consequence of this study, the consistency of the economical 3-3-1
model emerges.
","[{""version"":""v1"",""created"":""Fri, 10 Jul 2009 00:23:49 GMT""},{""version"":""v2"",""created"":""Fri, 24 Jul 2009 19:46:34 GMT""}]","2009-09-25"
"0907.1697","Ivan Novikov","C. Merino, I. S. Novikov and Yu. M. Shabelski","Nuclear Radii Calculations in Various Theoretical Approaches for
  Nucleus-Nucleus Interactions","14 Pages, 5 Figure, and 1 Table","Phys.Rev.C80:064616,2009","10.1103/PhysRevC.80.064616",,"nucl-th","http://arxiv.org/licenses/nonexclusive-distrib/1.0/","  The information about sizes and nuclear density distributions in unstable
(radioactive) nuclei is usually extracted from the data on interaction of
radioactive nuclear beams with a nuclear target. We show that in the case of
nucleus-nucleus collisions the values of the parameters depend rather strongly
on the considered theoretical approach and on the assumption about the
parametrization of the nuclear density distribution. The obtained values of
root-mean-square radii (R_{rms}) for stable nuclei with atomic weights A =
12-40 vary by approximately 0.1 fm when calculated in the optical
approximation, in the rigid target approximation, and using the exact
expression of Glauber Theory. We present several examples of R_{rms} radii
calculations using these three theoretical approaches and compare these results
with the data obtained from electron-nucleus scattering.
","[{""version"":""v1"",""created"":""Fri, 10 Jul 2009 04:23:55 GMT""}]","2011-01-26"
"0907.1698","Guilherme de Berredo-Peixoto","G. de Berredo-Peixoto","On the 1-loop calculations of softly broken fermion-torsion theory in
  curved space using the Stuckelberg procedure","Talk given at the 7th Alexander Friedmann International Seminar on
  Gravitation and Cosmology, Joao Pessoa, Brazil, 29 Jun - 5 Jul 2008. 4 pages
  and one figure","Int.J.Mod.Phys.A24:1570-1573,2009","10.1142/S0217751X09045017",,"hep-th","http://arxiv.org/licenses/nonexclusive-distrib/1.0/","  The soft breaking of gauge or other symmetries is the typical Quantum Field
Theory phenomenon. In many cases one can apply the Stuckelberg procedure, which
means introducing some additional field (or fields) and restore the gauge
symmetry. The original softly broken theory corresponds to a particular choice
of the gauge fixing condition. In this paper we use this scheme for performing
quantum calculations for fermion-torsion theory, softly broken by the torsion
mass in arbitrary curved spacetime.
","[{""version"":""v1"",""created"":""Fri, 10 Jul 2009 00:44:06 GMT""}]","2015-05-13"
"0907.1699","Kazushi Mimura","Kazushi Mimura, A.C.C. Coolen","Parallel dynamics of disordered Ising spin systems on finitely connected
  directed random graphs with arbitrary degree distributions","20 pages, 4 figures","J. Phys. A: Math. Theor., 42, 415001 (2009)","10.1088/1751-8113/42/41/415001",,"cond-mat.dis-nn","http://arxiv.org/licenses/nonexclusive-distrib/1.0/","  We study the stochastic parallel dynamics of Ising spin systems defined on
finitely connected directed random graphs with arbitrary degree distributions,
using generating functional analysis. For fully asymmetric graphs the dynamics
of the system can be completely solved, due to the asymptotic absence of loops.
For arbitrary graph symmetry, we solve the dynamics exactly for the first few
time steps, and we construct approximate stationary solutions.
","[{""version"":""v1"",""created"":""Fri, 10 Jul 2009 00:51:04 GMT""},{""version"":""v2"",""created"":""Mon, 24 Aug 2009 01:17:04 GMT""}]","2009-09-24"
"0907.1700","Chunbin Yang","H. Zheng, L. L. Zhu, C. B. Yang","Search For the Origin of the Away-side Double-humped Structure of jets
  in Heavy Ion Collisions","4 pages in revtex, 2 colored figures",,,,"nucl-th","http://arxiv.org/licenses/nonexclusive-distrib/1.0/","  A model is constructed for the origin of the double-humped structure found in
the di-hahron azimuthal correlation on the away-side in heavy ion collisions.
The parameters in the model are determined by fitting $\Delta\phi$ azimuthal
distribution in central Au+Au collisions at RHIC given by STAR collaboration
when the trigger momentum is in $3-4\rm {GeV/c}$ and the associated particle
momentum is in $1.3-1.8\rm{GeV/c}$. Then we apply our model to the semi-central
and peripheral Au+Au collisions at RHIC and the responding $\triangle \phi$
azimuthal distribution are reproduced respectively. Our results show that the
transverse flow effect plays an essential role in the experimentally observed
di-hadron azimuthal distribution structure. The spread of the hard parton
creation point and initial moving direction is also necessary for the
double-humped structure.
","[{""version"":""v1"",""created"":""Fri, 10 Jul 2009 00:55:20 GMT""}]","2009-07-13"
"0907.1701","Guilherme de Berredo-Peixoto","G. de Berredo-Peixoto and E.A. de Freitas","On the cosmological effects of the Weyssenhoff spinning fluid in the
  Einstein-Cartan framework","Work presented at the 7th Alexander Friedmann International Seminar
  on Gravitation and Cosmology, Joao Pessoa, Brazil, 29 Jun - 5 Jul 2008. No
  figures, 5 pages. New version with dynamical equation corrected, new
  reference and a brief comparison with its experimental bounds","Int.J.Mod.Phys.A24:1652-1655,2009","10.1142/S0217751X09045170",,"gr-qc","http://arxiv.org/licenses/nonexclusive-distrib/1.0/","  The effects of non-Riemannian structures in Cosmology have been studied long
ago and are still a relevant subject of investigation. In the seventies, it was
discovered that singularity avoidance and early accelerated expansion can be
induced by torsion in the Einstein-Cartan theory. In this framework, torsion is
not dynamical and is completely expressed by means of the spin sources. Thus,
in order to study the effects of torsion in the Einstein-Cartan theory, one has
to introduce matter with spin. In principle, this can be done in several ways.
In this work we consider the cosmological evolution of the universe in the
presence of a constant isotropic and homogeneous axial current and the
Weyssenhoff spinning fluid. We analyse possible solutions of this model, with
and without the spinning fluid.
","[{""version"":""v1"",""created"":""Fri, 10 Jul 2009 12:17:36 GMT""},{""version"":""v2"",""created"":""Thu, 1 Oct 2009 00:58:14 GMT""}]","2009-10-01"
"0907.1702","Steven Olmschenk","S. Olmschenk, D. Hayes, D. N. Matsukevich, P. Maunz, D. L. Moehring,
  C. Monroe","Quantum Logic Between Distant Trapped Ions","59 pages, 19 figures","Int. J. Quant. Info. 8, 337 (2010)","10.1142/S0219749910006381",,"quant-ph","http://arxiv.org/licenses/nonexclusive-distrib/1.0/","  Trapped atomic ions have proven to be one of the most promising candidates
for the realization of quantum computation due to their long trapping times,
excellent coherence properties, and exquisite control of the internal atomic
states. Integrating ions (quantum memory) with photons (distance link) offers a
unique path to large-scale quantum computation and long-distance quantum
communication. In this article, we present a detailed review of the
experimental implementation of a heralded photon-mediated quantum gate between
remote ions, and the employment of this gate to perform a teleportation
protocol between two ions separated by a distance of about one meter.
","[{""version"":""v1"",""created"":""Fri, 10 Jul 2009 01:17:24 GMT""}]","2010-06-15"
"0907.1703","Bahman Engheta","Bahman Engheta","Bound on the projective dimension of three cubics","to appear in Journal of Symbolic Computation","Journal of Symbolic Computation 45 (2010), 60-73","10.1016/j.jsc.2009.06.005",,"math.AC math.AG","http://arxiv.org/licenses/nonexclusive-distrib/1.0/","  We show that given any polynomial ring R over a field, and any ideal J in R
which is generated by three cubic forms, the projective dimension of R/J is at
most 36. We also settle the question whether ideals generated by three cubic
forms can have projective dimension greater than 4, by constructing one with
projective dimension equal to 5.
","[{""version"":""v1"",""created"":""Fri, 10 Jul 2009 01:17:43 GMT""}]","2010-10-20"
"0907.1704","Paul Frampton","Paul H. Frampton","Black Holes as Dark Matter","6 pages latex. Plenary talk at QTRF-5 Conference, University of
  Vaxjo, Sweden. June 2009","AIP Conf.Proc.1232:53-57,2010","10.1063/1.3431517",,"hep-th","http://arxiv.org/licenses/nonexclusive-distrib/1.0/","  While the energy of the universe has been established to be about 0.04
baryons, 0.24 dark matter and 0.72 dark energy, the cosmological entropy is
almost entirely, about $(1 - 10^{-15})$, from black holes and only $10^{-15}$
from everything else. This identification of all dark matter as black holes is
natural in statistical mechanics. Cosmological history of dark matter is
discussed.
","[{""version"":""v1"",""created"":""Fri, 10 Jul 2009 01:17:48 GMT""}]","2010-05-12"
"0907.1705","Wen-Chen Chang","W.C. Chang, M. Miyabe, T. Nakano, D.S. Ahn, J.K. Ahn, H. Akimune, Y.
  Asano, S. Dat\'e, H. Ejiri, H. Fujimura, M. Fujiwara, S. Fukui, H. Hasegawa,
  K. Hicks, K. Horie, T. Hotta, K. Imai, T. Ishikawa, T. Iwata, Y. Kato, H.
  Kawai, K. Kino, H. Kohri, N. Kumagai, S. Makino, T. Matsuda, T. Matsumura, N.
  Matsuoka, T. Mibe, Y. Miyachi, N. Muramatsu, M. Niiyama, M. Nomachi, Y.
  Ohashi, H. Ohkuma, T. Ooba, D.S. Oshuev, C. Rangacharyulu, A. Sakaguchi, P.M.
  Shagin, Y. Shiino, H. Shimizu, Y. Sugaya, M. Sumihama, Y. Toi, H. Toyokawa,
  M. Uchida, A. Wakai, C.W. Wang, S.C. Wang, K. Yonehara, T. Yorita, M.
  Yoshimura, M. Yosoi, R.G.T. Zegers (LEPS collaboration)","Measurement of the incoherent $\gamma d \to \phi p n$ photoproduction
  near threshold","5 pages, 4 figures. Published in Physics Letters B","Phys.Lett.B684:6-10,2010","10.1016/j.physletb.2009.12.051",,"nucl-ex","http://arxiv.org/licenses/nonexclusive-distrib/1.0/","  We report measurements of differential cross sections and decay asymmetries
of incoherent $\phi$-meson photoproduction from the deuteron at forward angles
using linearly polarized photons at \Eg=1.5-2.4 GeV. The nuclear transparency
ratio for the deuteron shows a large suppression, and is consistent with the
A-dependence of the ratio observed in a previous measurement with nuclear
targets. The reduction for the deuteron cannot be adequately explained in term
of isospin asymmetry. The present results suggest the need of refining our
understanding of the $\phi$-N interaction within a nucleus.
","[{""version"":""v1"",""created"":""Fri, 10 Jul 2009 01:32:51 GMT""},{""version"":""v2"",""created"":""Mon, 18 Jan 2010 03:33:33 GMT""}]","2014-11-20"
"0907.1706","S. I. Kruglov","S. I. Kruglov","Solutions of Podolsky's Electrodynamics Equation in the First-Order
  Formalism","17 pages, minor corrections, published version","J. Phys. A 43:245403, 2010","10.1088/1751-8113/43/24/245403",,"hep-th gr-qc hep-ph quant-ph","http://arxiv.org/licenses/nonexclusive-distrib/1.0/","  The Podolsky generalized electrodynamics with higher derivatives is
formulated in the first-order formalism. The first-order relativistic wave
equation in the 20-dimensional matrix form is derived. We prove that the
matrices of the equation obey the Petiau-Duffin-Kemmer algebra. The
Hermitianizing matrix and Lagrangian in the first-order formalism are given.
The projection operators extracting solutions of field equations for states
with definite energy-momentum and spin projections are obtained, and we find
the density matrix for the massive state. The $13\times 13$-matrix Schrodinger
form of the equation is derived, and the Hamiltonian is obtained. Projection
operators extracting the physical eigenvalues of the Hamiltonian are found.
","[{""version"":""v1"",""created"":""Fri, 10 Jul 2009 01:33:56 GMT""},{""version"":""v2"",""created"":""Thu, 22 Apr 2010 19:14:06 GMT""},{""version"":""v3"",""created"":""Tue, 25 May 2010 15:51:06 GMT""}]","2014-11-20"
"0907.1707","Enrico Prati","Enrico Prati","The Nature of Time: from a Timeless Hamiltonian Framework to Clock Time
  of Metrology","Fourth Classified at the FQXI Essay Contest ""The Nature of Time""","J. Phys.: Conf. Ser. 306 012013 (2011)","10.1088/1742-6596/306/1/012013",,"physics.class-ph","http://arxiv.org/licenses/nonexclusive-distrib/1.0/","  The problem of the Nature of Time is twofold: whether or not time is a
fundamental quantity of Nature, and how does clock time of metrology emerge in
the experimental description of dynamics. This work strongly supports the
fundamental timelessness of Nature. However, the correct view that physics is
described by relations between variables does not address the second problem of
how time does emerge at the macroscopic scale on the ground of a timeless
framework. In this work ordinary Hamiltonian dynamics is recast in a timeless
formalism capable to provide a definition of parameter time on the basis of the
only generalized coordinates, together with the Hamiltonian invariance on
trajectories, and a variational principle. Next, by relaxing the assumption of
periodicity of real clocks to the only cyclicity in the phase space, the second
problem is addressed. Physical systems, if complex enough, can be separated in
a subsystem whose dynamics is described, and another cyclic subsystem which
behaves as a clock. The dynamics of the first is mapped in the states of the
second cyclic subsystem which provides a discrete approximation of the
parameter time. Useful clocks fulfill a stability prescription which guarantees
that dynamics is expressed by simple laws also in terms of metric time as
naturally happens for parameter time. The two ideas provide a unitary framework
capable to account the fundamental timelessness of Nature, and the experimental
evidence of time evolution in macroscopic systems experienced by the observers.
","[{""version"":""v1"",""created"":""Fri, 10 Jul 2009 01:37:57 GMT""}]","2013-11-05"
"0907.1708","David Wang","D. S. Wang, A. G. Fowler, C. D. Hill, L. C. L. Hollenberg","Graphical algorithms and threshold error rates for the 2d colour code","20 pages, 19 figures","Quantum Information and Computation 10, 780 (2010)",,,"quant-ph","http://arxiv.org/licenses/nonexclusive-distrib/1.0/","  Recent work on fault-tolerant quantum computation making use of topological
error correction shows great potential, with the 2d surface code possessing a
threshold error rate approaching 1% (NJoP 9:199, 2007), (arXiv:0905.0531).
However, the 2d surface code requires the use of a complex state distillation
procedure to achieve universal quantum computation. The colour code of (PRL
97:180501, 2006) is a related scheme partially solving the problem, providing a
means to perform all Clifford group gates transversally. We review the colour
code and its error correcting methodology, discussing one approximate technique
based on graph matching. We derive an analytic lower bound to the threshold
error rate of 6.25% under error-free syndrome extraction, while numerical
simulations indicate it may be as high as 13.3%. Inclusion of faulty syndrome
extraction circuits drops the threshold to approximately 0.1%.
","[{""version"":""v1"",""created"":""Fri, 10 Jul 2009 01:46:49 GMT""}]","2010-10-07"
"0907.1709","Xu Lixin","Lixin Xu","Holographic Dark Energy Model with Hubble Horizon as an IR Cut-off","9 pages, 2 figures, Published Version","JCAP 0909:016,2009","10.1088/1475-7516/2009/09/016","ITP-DUT/2009-07","astro-ph.CO","http://arxiv.org/licenses/nonexclusive-distrib/1.0/","  The main task of this paper is to realize a cosmic observational compatible
universe in the framework of holographic dark energy model when the Hubble
horizon $H$ is taken as the role of an IR cut-off. When the model parameter $c$
of a time variable cosmological constant (CC) $\Lambda(t)=3c^{2}H^{2}(t)$
becomes time or scale dependent, an extra term enters in the effective equation
of sate (EoS) of the vacuum energy $w^{eff}_{\Lambda}=-c^2-d\ln c^{2}/3d\ln a$.
This extra term can make the effective EoS of time variable CC cross the
cosmological boundary and be phantom-like at present. For the lack of a first
principle and fundamental physics theory to obtain the form $c^2$, we give a
simple parameterized form of $c^2$ as an example. Then the model is confronted
by the cosmic observations including SN Ia, BAO and CMB shift parameter $R$.
The result shows that the model is consistent with cosmic observations.
","[{""version"":""v1"",""created"":""Fri, 10 Jul 2009 02:04:58 GMT""},{""version"":""v2"",""created"":""Wed, 9 Sep 2009 23:19:04 GMT""}]","2009-09-28"
"0907.1710","Tarun Grover","Tarun Grover, N. Trivedi, T. Senthil, Patrick A. Lee","Weak Mott insulators on the triangular lattice: possibility of a gapless
  nematic quantum spin liquid","Longer version, 7+ pages, 5 figures","Phys. Rev. B 81, 245121 (2010)","10.1103/PhysRevB.81.245121",,"cond-mat.str-el cond-mat.supr-con","http://arxiv.org/licenses/nonexclusive-distrib/1.0/","  We study the energetics of Gutzwiller projected BCS states of various
symmetries for the triangular lattice antiferromagnet with a four particle ring
exchange using variational Monte Carlo methods. In a range of parameters the
energetically favored state is found to be a projected $d_{x^2-y^2}$ paired
state which breaks lattice rotational symmetry. We show that the properties of
this nematic or orientationally ordered paired spin liquid state as a function
of temperature and pressure can account for many of the experiments on organic
materials. We also study the ring-exchange model with ferromagnetic Heisenberg
exchange and find that amongst the studied ans\""atze, a projected $f-$wave
state is the most favorable.
","[{""version"":""v1"",""created"":""Fri, 10 Jul 2009 02:30:17 GMT""},{""version"":""v2"",""created"":""Wed, 29 Dec 2010 23:27:38 GMT""}]","2011-01-04"
"0907.1711","Youjin Deng","Youjin Deng, Xiaofeng Qian, and Henk W.J. Blote","Single-cluster dynamics for the random-cluster model","7 figures, 4 tables","Phys.Rev.E80:036707,2009","10.1103/PhysRevE.80.036707",,"cond-mat.stat-mech","http://arxiv.org/licenses/nonexclusive-distrib/1.0/","  We formulate a single-cluster Monte Carlo algorithm for the simulation of the
random-cluster model. This algorithm is a generalization of the Wolff
single-cluster method for the $q$-state Potts model to non-integer values
$q>1$. Its results for static quantities are in a satisfactory agreement with
those of the existing Swendsen-Wang-Chayes-Machta (SWCM) algorithm, which
involves a full cluster decomposition of random-cluster configurations. We
explore the critical dynamics of this algorithm for several two-dimensional
Potts and random-cluster models. For integer $q$, the single-cluster algorithm
can be reduced to the Wolff algorithm, for which case we find that the
autocorrelation functions decay almost purely exponentially, with dynamic
exponents $z_{\rm exp} =0.07 (1), 0.521 (7)$, and $1.007 (9)$ for $q=2, 3$, and
4 respectively. For non-integer $q$, the dynamical behavior of the
single-cluster algorithm appears to be very dissimilar to that of the SWCM
algorithm. For large critical systems, the autocorrelation function displays a
range of power-law behavior as a function of time. The dynamic exponents are
relatively large. We provide an explanation for this peculiar dynamic behavior.
","[{""version"":""v1"",""created"":""Fri, 10 Jul 2009 02:32:51 GMT""}]","2010-01-18"
"0907.1712","Nicholas Fang","Leilei Yin and Nicholas X. Fang","Enhanced Surface Photon Drag on Plasmonic Metamaterials: A
  Fizeau-Doppler Shift Study","submitted to Applied Physics Letters",,,,"cond-mat.mes-hall cond-mat.other","http://arxiv.org/licenses/nonexclusive-distrib/1.0/","  In this work, we numerically study the Fizeau-Doppler shift of surface modes
in a moving plasmonic metamaterial. At proper surface plasmon resonance
conditions, a slow group velocity is resulted in the metamaterials, and our
simulation indicates a phase shift up to 4 orders of magnitude larger than the
normal mode. In addition, both appreciable positive and negative photon drag
could be observed. We also found an abrupt transition in the sign of phase
shift when silver film reaches a critical thickness. This opens new
opportunities in applications such as compact optical gyroscopes and
accelerometers.
","[{""version"":""v1"",""created"":""Fri, 10 Jul 2009 02:33:53 GMT""}]","2009-07-13"
"0907.1713","Guo-Qiang Zhu","Guo-Qiang Zhu","Off-diagonal geometric phase of atom-electron coupling in hydrogen atom","10 pages, 4 figures",,,,"quant-ph","http://arxiv.org/licenses/nonexclusive-distrib/1.0/","  In this paper, the off-diagonal geometric phase of thermal state in hydrogen
atom under the effects of external magnetic field is considered. Increasing
temperature tends to suppress the off-diagonal geometric phase, including
1-order and 2-order cases. On the other hand, the relationship between the
geometric phase and external magnetic field is discussed.
","[{""version"":""v1"",""created"":""Fri, 10 Jul 2009 02:42:36 GMT""}]","2009-07-13"
"0907.1714","Hao Xu","De-Xing Kong, Kefeng Liu, Ming Shen","A new kind of solutions of the Einstein's field equations with
  non-vanishing cosmological constant","9 pages",,,,"math-ph math.MP","http://arxiv.org/licenses/nonexclusive-distrib/1.0/","  In this paper we construct a new kind of solutions of the Einstein's field
equations with non-vanishing cosmological constant, which possess some
interesting physical properties. The singularities of this kind of solutions
are investigated. According to the general form of this kind of solutions, we
give some examples.
","[{""version"":""v1"",""created"":""Fri, 10 Jul 2009 04:07:48 GMT""},{""version"":""v2"",""created"":""Mon, 15 Aug 2011 15:21:40 GMT""}]","2011-08-16"
"0907.1715","Travis Schedler","Pavel Etingof and Travis Schedler","Zeroth Poisson homology of symmetric powers of isolated quasihomogeneous
  surface singularities","17 pages",,,,"math.SG math.AG math.QA","http://arxiv.org/licenses/nonexclusive-distrib/1.0/","  Let X be a surface with an isolated singularity at the origin, given by the
equation Q(x,y,z)=0, where Q is a weighted-homogeneous polynomial. In
particular, this includes the Kleinian surfaces X = C^2/G for G < SL(2,C)
finite. Let Y be the n-th symmetric power of X. We compute the zeroth Poisson
homology of Y, as a graded vector space with respect to the weight grading. In
the Kleinian case, this confirms a conjecture of Alev, that the zeroth Poisson
homology of the n-th symmetric power of C^2/G is isomorphic to the zeroth
Hochschild homology of the n-th symmetric power of the algebra of G-invariant
differential operators on C. That is, the Brylinski spectral sequence
degenerates in this case. In the elliptic case, this yields the zeroth
Hochschild homology of symmetric powers of the elliptic algebras with three
generators modulo their center, for the parameter equal to all but countably
many points of the elliptic curve.
","[{""version"":""v1"",""created"":""Fri, 10 Jul 2009 03:03:41 GMT""}]","2009-07-13"
"0907.1716","Maria N. Piacquadio","R. Hansen, M. Piacquadio","Mendes France and thermodynamical spectra: a comparative study of
  contractive and expansive fractal processes",,,,,"math-ph math.MP","http://arxiv.org/licenses/nonexclusive-distrib/1.0/","  This paper presents a comparative study of two families of curves in R(n).
The first ones comprise self-similar bounded fractals obtained by contractive
processes, and have a non-integer Hausdorff dimension. The second ones are
unbounded, locally rectifiable, locally smooth, obtained by expansive
processes, and characterized by a fractional dimension defined by M. Mendes
France. We present a way to relate the two types of curves and their respective
non-integer dimensions. Thus, to one fractal bounded curve we associate, at
first, a finite range of Mendes France dimensions, identifying the minimal and
the maximal ones. Later, we show that this discrete spectrum can be made
continuous, allowing it to be compared with some other multifractal spectra
encountered in the literature. We discuss the corresponding physical
interpretations.
","[{""version"":""v1"",""created"":""Fri, 10 Jul 2009 03:06:12 GMT""}]","2009-07-13"
