"0912.2073","Anthony J. Scholl","A. J. Scholl","Hypersurfaces and the Weil conjectures","12 pages; a few trivial corrections","International Mathematics Research Notices 2010","10.1093/imrn/rnq098",,"math.AG math.NT","http://arxiv.org/licenses/nonexclusive-distrib/1.0/","  We give a proof that the Riemann hypothesis for hypersurfaces over finite
fields implies the result for all smooth proper varieties, by a deformation
argument which does not use the theory of Lefschetz pencils or the l-adic
Fourier transform.
","[{""version"":""v1"",""created"":""Thu, 10 Dec 2009 19:35:27 GMT""},{""version"":""v2"",""created"":""Fri, 23 Apr 2010 15:22:40 GMT""},{""version"":""v3"",""created"":""Sat, 29 May 2010 20:17:46 GMT""}]","2010-06-01"
"0912.2074","Susan Benecchi","S. D. Benecchi, K. S. Noll, W. M. Grundy, and H. F. Levison","(47171) 1999 TC36, A Transneptunian Triple","16 pages, 8 figures, 6 tables. Accepted to Icarus",,"10.1016/j.icarus.2009.12.017",,"astro-ph.EP","http://arxiv.org/licenses/nonexclusive-distrib/1.0/","  We present new analysis of HST images of (47171) 1999 TC36 that confirm it as
a triple system. Fits to the point-spread function consistently show that the
apparent primary is itself composed of two similar-sized components. The two
central components, A1 and A2, can be consistently identified in each of nine
epochs spread over seven years of time. In each instance the component
separation, ranging from 0.023+/-0.002 to 0.031+/-0.003 arcsec, is roughly one
half of the Hubble Space Telescope's diffraction limit at 606 nm. The orbit of
the central pair has a semi-major axis of a~867 km with a period of P~1.9 days.
These orbital parameters yield a system mass that is consistent with Msys =
12.75+/-0.06 10^18 kg derived from the orbit of the more distant secondary,
component B. The diameters of the three components are dA1= 286(+45,-38) km,
dA2= 265(+41,-35 km and dB= 139(+22,-18) km. The relative sizes of these
components are more similar than in any other known multiple in the solar
system. Taken together, the diameters and system mass yield a bulk density of
p=542(+317,-211) kg m^-3. HST Photometry shows that component B is variable
with an amplitude of >=0.17+/-0.05 magnitudes. Components A1 and A2 do not show
variability larger than 0.08+/-0.03 magnitudes approximately consistent with
the orientation of the mutual orbit plane and tidally-distorted equilibrium
shapes. The system has high specific angular momentum of J/J'=0.93, comparable
to most of the known Transneptunian binaries.
","[{""version"":""v1"",""created"":""Thu, 10 Dec 2009 19:50:22 GMT""}]","2015-05-14"
"0912.2075","Philippe Goutet","Philippe Goutet (IMJ)","Isotypic Decomposition of the Cohomology and Factorization of the Zeta
  Functions of Dwork Hypersurfaces","32 pages, submitted for publication",,,,"math.NT","http://arxiv.org/licenses/nonexclusive-distrib/1.0/","  The aim of this article is to illustrate, on the example of Dwork
hypersurfaces, how the study of the representation of a finite group of
automorphisms of a hypersurface in its etale cohomology allows to factor its
zeta function.
","[{""version"":""v1"",""created"":""Thu, 10 Dec 2009 19:23:27 GMT""}]","2009-12-11"
"0912.2076","Christine Liebig","Christine Liebig and Joachim Wambsganss","Detectability of extrasolar moons as gravitational microlenses","14 pages, 11 figures. Updated to A&A published version: updated
  references, 1 additional illustration (Fig. 10), further analogies to solar
  system and extended discussion","Astron.Astrophys. 520:A68,2010","10.1051/0004-6361/200913844",,"astro-ph.EP","http://arxiv.org/licenses/nonexclusive-distrib/1.0/","  We evaluate gravitational lensing as a technique for the detection of
extrasolar moons. Since 2004 gravitational microlensing has been successfully
applied as a detection method for extrasolar planets. In principle, the method
is sensitive to masses as low as an Earth mass or even a fraction of it. Hence
it seems natural to investigate the microlensing effects of moons around
extrasolar planets. We explore the simplest conceivable triple lens system,
containing one star, one planet and one moon. From a microlensing point of
view, this system can be modelled as a particular triple with hierarchical mass
ratios very different from unity. Since the moon orbits the planet, the
planet-moon separation will be small compared to the distance between planet
and star. Such a configuration can lead to a complex interference of caustics.
We present detectability and detection limits by comparing triple-lens light
curves to best-fit binary light curves as caused by a double-lens system
consisting of host star and planet -- without moon. We simulate magnification
patterns covering a range of mass and separation values using the inverse ray
shooting technique. These patterns are processed by analysing a large number of
light curves and fitting a binary case to each of them. A chi-squared criterion
is used to quantify the detectability of the moon in a number of selected
triple-lens scenarios. The results of our simulations indicate that it is
feasible to discover extrasolar moons via gravitational microlensing through
frequent and highly precise monitoring of anomalous Galactic microlensing
events with dwarf source stars.
","[{""version"":""v1"",""created"":""Thu, 10 Dec 2009 20:43:04 GMT""},{""version"":""v2"",""created"":""Sun, 10 Oct 2010 17:02:41 GMT""}]","2014-11-20"
"0912.2077","Brian C. Tiburzi","Fu-Jiun Jiang, Brian C. Tiburzi","Hyperon Electromagnetic Properties in Two-Flavor Chiral Perturbation
  Theory","29 pages, 7 figures, v3: published version","Phys.Rev.D81:034017,2010","10.1103/PhysRevD.81.034017","MIT-CTP-4093, UMD-40762-458","nucl-th hep-lat hep-ph","http://arxiv.org/licenses/nonexclusive-distrib/1.0/","  The pion mass dependence of hyperon electromagnetic properties is determined
using two-flavor heavy baryon chiral perturbation theory. Specifically we
compute chiral corrections to the charge radii, magnetic moments, and magnetic
radii of the spin one-half hyperons, as well as the charge radii, magnetic
moments, magnetic radii, electric quadrupole moments, and quadrupole radii of
the spin three-half hyperons. Results for the nucleon and delta are also
included. Efficacy of the two-flavor theory is investigated by analyzing the
role played by virtual kaons. For the electromagnetic properties of spin
one-half hyperons, kaon loop contributions are shown to be well described by
terms analytic in the pion mass squared. Similarly kaon contributions to the
magnetic moments of spin three-half hyperons are well described in the
two-flavor theory. The remaining electromagnetic properties of spin three-half
resonances can be described in two-flavor chiral perturbation theory, however,
this description fails just beyond the physical pion mass. For the case of
experimentally known hyperon magnetic moments and charge radii, we demonstrate
that chiral corrections are under reasonable control, in contrast to the
behavior of these observables in the three-flavor chiral expansion. The
formulae we derive are ideal for performing the pion mass extrapolation of
lattice QCD data obtained at the physical strange quark mass.
","[{""version"":""v1"",""created"":""Thu, 10 Dec 2009 19:50:18 GMT""},{""version"":""v2"",""created"":""Mon, 14 Dec 2009 19:57:27 GMT""},{""version"":""v3"",""created"":""Thu, 11 Feb 2010 18:02:15 GMT""}]","2010-04-06"
"0912.2078","Oscar Cavichia","O. Cavichia, R.D.D. Costa, W.J. Maciel","Planetary nebulae in the inner Milky Way","2 pages, 1 figure, uses iaus.cls, in press, IAU Symp. 265, Chemical
  abundances in the Universe: Connecting the first Stars to Planets, Ed. K.
  Cunha, M. Spite, B. Barbuy",,"10.1017/S174392131000089X",,"astro-ph.GA astro-ph.SR","http://arxiv.org/licenses/nonexclusive-distrib/1.0/","  New abundances of planetary nebulae located towards the bulge of the Galaxy
are derived based on observations made at LNA (Brazil). We present accurate
abundances of the elements He, N, S, O, Ar, and Ne for 56 PNe located towards
the galactic bulge. The data shows a good agreement with other results in the
literature, in the sense that the distribution of the abundances is similar to
those works. From the statistical analysis performed, we can suggest a
bulge-disk interface at 2.2 kpc for the intermediate mass population, marking
therefore the outer border of the bulge and inner border of the disk.
","[{""version"":""v1"",""created"":""Thu, 10 Dec 2009 19:59:10 GMT""}]","2015-05-14"
"0912.2080","Luis Dieulefait","Luis Dieulefait","Langlands Base Change for GL(2)","27 pages. Main result improved: now there is no condition on the
  primes in the level of the newform (they are allowed to ramify in F)",,,,"math.NT","http://arxiv.org/licenses/nonexclusive-distrib/1.0/","  Let F be a totally real Galois number field. We prove the existence of base
change relative to the extension F/Q for every classical newform of odd level,
under simple local assumptions on the field F.
","[{""version"":""v1"",""created"":""Thu, 10 Dec 2009 19:54:08 GMT""},{""version"":""v2"",""created"":""Tue, 26 Apr 2011 17:37:41 GMT""},{""version"":""v3"",""created"":""Thu, 16 Jun 2011 20:26:14 GMT""}]","2011-06-20"
"0912.2081","Amitai Bin-Nun","Amitai Y. Bin-Nun","Relativistic Images in Randall-Sundrum II Braneworld Lensing","13 pages, 3 figures; Accepted for Publication in Physical Review D","Phys.Rev.D81:123011,2010","10.1103/PhysRevD.81.123011",,"gr-qc astro-ph.CO hep-ph","http://arxiv.org/licenses/nonexclusive-distrib/1.0/","  In this paper, we explore the properties of gravitational lensing by black
holes in the Randall-Sundrum II braneworld. We use numerical techniques to
calculate lensing observables using the Tidal Reissner-Nordstrom (TRN) and
Garriga-Tanaka metrics to examine supermassive black holes and primordial black
holes. We introduce a new way tp parameterize tidal charge in the TRN metric
which results in a large increase in image magnifications for braneworld
primordial black holes compared to their 4 dimensional analogues. Finally, we
offer a mathematical analysis that allows us to analyze the validity of the
logarithmic approximation of the bending angle for any static, spherically
symmetric metric. We apply this to the TRN metric and show that it is valid for
any amount of tidal charge.
","[{""version"":""v1"",""created"":""Thu, 10 Dec 2009 20:04:43 GMT""},{""version"":""v2"",""created"":""Tue, 25 May 2010 22:25:07 GMT""}]","2010-09-09"
"0912.2082","Brant M. Johnson","PHENIX Collaboration: A. Adare, et al","Transverse momentum dependence of J/psi polarization at midrapidity in
  p+p collisions at sqrt(s)=200 GeV","384 authors from 62 institutions, 11 pages, 9 figures, 2 tables. v2
  is expanded version submitted to Physical Review D. Plain text data tables
  for the points plotted in figures are available at
  http://www.phenix.bnl.gov/papers.html","Phys.Rev.D82:012001,2010","10.1103/PhysRevD.82.012001",,"hep-ex","http://arxiv.org/licenses/nonexclusive-distrib/1.0/","  We report the measurement of the transverse momentum dependence of inclusive
J/psi polarization in p+p collisions at sqrt(s)=200 GeV performed by the PHENIX
Experiment at RHIC. The polarization is studied in the helicity,
Gottfried-Jackson, and Collins-Soper frames for p_T < 5 GeV/c and |y| < 0.35.
The J/psi polarization in the helicity and Gottfried-Jackson frames is
consistent with zero for all transverse momenta, with a slight (1.8 sigma)
trend towards longitudinal polarization for transverse momenta above 2 GeV/c.
No conclusion is allowed due to the limited acceptance in the Collins-Soper
frame and the uncertainties of the current data. The results are compared to
observations for other collision systems and center of mass energies and to
different quarkonia production models.
","[{""version"":""v1"",""created"":""Thu, 10 Dec 2009 19:55:06 GMT""},{""version"":""v2"",""created"":""Wed, 28 Apr 2010 15:47:56 GMT""}]","2014-11-20"
"0912.2083","Philipp Maass","Petr Chvosta, Mario Einax, Viktor Holubec, Artem Ryabov and Philipp
  Maass","Energetics and performance of a microscopic heat engine based on exact
  calculations of work and heat distributions","21 pages, 7 figures",,"10.1088/1742-5468/2010/03/P03002",,"cond-mat.stat-mech","http://arxiv.org/licenses/nonexclusive-distrib/1.0/","  We investigate a microscopic motor based on an externally controlled
two-level system. One cycle of the motor operation consists of two strokes.
Within each stroke, the two-level system is in contact with a given thermal
bath and its energy levels are driven with a constant rate. The time evolution
of the occupation probabilities of the two states are controlled by one rate
equation and represent the system's response with respect to the external
driving. We give the exact solution of the rate equation for the limit cycle
and discuss the emerging thermodynamics: the work done on the environment, the
heat exchanged with the baths, the entropy production, the motor's efficiency,
and the power output. Furthermore we introduce an augmented stochastic process
which reflects, at a given time, both the occupation probabilities for the two
states and the time spent in the individual states during the previous
evolution. The exact calculation of the evolution operator for the augmented
process allows us to discuss in detail the probability density for the
performed work during the limit cycle. In the strongly irreversible regime, the
density exhibits important qualitative differences with respect to the more
common Gaussian shape in the regime of weak irreversibility.
","[{""version"":""v1"",""created"":""Thu, 10 Dec 2009 20:09:10 GMT""}]","2015-05-14"
"0912.2084","A. N. Ivanov","M. Faber, A. N. Ivanov, P. Kienle, J. Marton, M. Pitschmann","Molecule model for kaonic nuclear cluster anti-KNN","16 pages, 3 figures","Int.J.Mod.Phys.E20:1477-1490,2011","10.1142/S0218301311018484",,"nucl-th","http://arxiv.org/licenses/nonexclusive-distrib/1.0/","  We analyse the properties of the kaonic nuclear cluster (KNC) anti-KNN with
the structure Nx(anti-KN)_(I = 0), having the quantum numbers I(J^P) =
1/2(0^-), and treated as a quasi-bound hadronic molecule state. We describe the
properties of the hadronic molecule, or the KNC Nx(anti-KN)_(I = 0), in terms
of vibrational degrees of freedom with oscillator wave functions and chiral
dynamics. These wave functions, having the meaning of trial wave functions of
variational calculations, are parameterised by the frequency of oscillations of
the (anti-KN)_(I = 0) pair, which is fixed in terms of the binding energy of
the strange baryon resonance Lambda(1405), treated as a quasi-bound
(anti-KN)_(I = 0) state. The binding energies B_X and widths Gamma_X of the
states X = (anti-KN)_(I = 0) and X = anti-KNN, respectively, are calculated in
the heavy-baryon approximation by using chiral Lagrangians with meson-baryon
derivative couplings invariant under chiral SU(3)xSU(3) symmetry at the
tree-level approximation. The results are B_(anti-KNN) = 40.2 MeV and
Gamma_(anti-KNN) = Gamma^(non-pionic)_(anti-KNN) + Gamma^(pionic)_(anti-KNN) ~
(85 - 106) MeV and, where Gamma^(non-pionic)_(anti-KNN) ~ 21 MeV and
Gamma^(pionic)_(anti-KNN) ~ (64 - 86) MeV are the widths of non-pionic anti-KNN
-> N Lambda^0, N Sigma and pionic anti-KNN -> N Sigma pi decay modes,
calculated for B_(anti-KN) = 29 MeV and Gamma_(anti-KN) = (30 - 40) MeV,
respectively.
","[{""version"":""v1"",""created"":""Thu, 10 Dec 2009 20:17:49 GMT""},{""version"":""v2"",""created"":""Wed, 24 Nov 2010 15:58:40 GMT""}]","2011-07-15"
"0912.2085","Leonid Metlov","Leonid S.Metlov","Dynamical formation of a nonequilibrium subsystem under severe action","4 pages, 4 figures",,,"local report number 0106U006931","physics.comp-ph cond-mat.stat-mech physics.data-an","http://arxiv.org/licenses/nonexclusive-distrib/1.0/","  Formation of the nonequilibrium subsystem in dynamical processes during
defect generation is simulated by means of molecular dynamics. A particular
process of dissipation of the low-frequency acoustic emission into
high-frequency equilibrium vibrations of lattice is studied numerically. Clear
heuristic reasons are used to introduce different temperatures and entropies
for equilibrium and nonequilibrium subsystems. Simple relaxation equation is
proposed to describe time behavior of the nonequilibrium entropy.
","[{""version"":""v1"",""created"":""Thu, 10 Dec 2009 20:20:01 GMT""}]","2009-12-11"
"0912.2086","Corbett Redden","Corbett Redden","String structures and canonical 3-forms","32 pages; v.2 minor typos corrected","Pacific J. Math., 249(2):447-484, 2011","10.2140/pjm.2011.249.447",,"math.DG math.AT","http://arxiv.org/licenses/nonexclusive-distrib/1.0/","  Using basic homotopy constructions, we show that isomorphism classes of
string structures on spin bundles are naturally given by certain degree 3
cohomology classes, which we call string classes, on the total space of the
bundle. Using a Hodge isomorphism, we then show that the harmonic
representative of a string class gives rise to a canonical 3-form on the base
space, refining the associated differential character. We explicitly calculate
this 3-form for homogeneous metrics on 3-spheres, and we discuss how the
cohomology theory tmf could potentially encode obstructions to positive Ricci
curvature metrics.
","[{""version"":""v1"",""created"":""Thu, 10 Dec 2009 20:26:13 GMT""},{""version"":""v2"",""created"":""Tue, 8 Feb 2011 20:29:56 GMT""}]","2015-03-13"
"0912.2087","Hisato Yamaguchi","Hisato Yamaguchi, Goki Eda, Cecilia Mattevi, HoKwon Kim, and Manish
  Chhowalla","Highly Uniform 300 mm Wafer-Scale Deposition of Single and Multilayered
  Chemically Derived Graphene Thin Films","11 pages, 4 figures. accepted to ACS Nano",,,,"cond-mat.mtrl-sci","http://arxiv.org/licenses/nonexclusive-distrib/1.0/","  The deposition of atomically thin highly uniform chemically derived graphene
(CDG) films on 300 mm SiO2/Si wafers is reported. We demonstrate that the very
thin films can be lifted off to form uniform membranes than can be
free-standing or transferred onto any substrate. Detailed maps of thickness
using Raman spectroscopy and atomic force microscopy (AFM) height profiles
reveal that the film thickness is very uniform and highly controllable, ranging
from 1-2 layers up to 30 layers. After reduction using a variety of methods,
the CDG films are transparent and electrically active with FET devices yielding
exceptionally high mobilities of ~ 15 cm2/Vs and sheet resistance of ~ 1 k
Ohm/sq at ~ 70 % transparency.
","[{""version"":""v1"",""created"":""Thu, 10 Dec 2009 20:30:50 GMT""}]","2009-12-11"
"0912.2088","Ralf Meyer","Hvedri Inassaridze, Tamaz Kandelaki and Ralf Meyer","Localisation and colocalisation of triangulated categories at thick
  subcategories","11 pages","Math. Scand. 110 (2012), pp. 59-74",,,"math.CT","http://arxiv.org/licenses/nonexclusive-distrib/1.0/","  Given a thick subcategory of a triangulated category, we define a
colocalisation and a natural long exact sequence that involves the original
category and its localisation and colocalisation at the subcategory. Similarly,
we construct a natural long exact sequence containing the canonical map between
a homological functor and its total derived functor with respect to a thick
subcategory.
","[{""version"":""v1"",""created"":""Thu, 10 Dec 2009 20:31:10 GMT""}]","2015-10-23"
"0912.2089","Franziska Hinkelmann","Franziska Hinkelmann and Reinhard Laubenbacher","Boolean Models of Bistable Biological Systems",,,"10.3934/dcdss.2011.4.1443",,"q-bio.MN q-bio.QM","http://arxiv.org/licenses/nonexclusive-distrib/1.0/","  This paper presents an algorithm for approximating certain types of dynamical
systems given by a system of ordinary delay differential equations by a Boolean
network model. Often Boolean models are much simpler to understand than complex
differential equations models. The motivation for this work comes from
mathematical systems biology. While Boolean mechanisms do not provide
information about exact concentration rates or time scales, they are often
sufficient to capture steady states and other key dynamics. Due to their
intuitive nature, such models are very appealing to researchers in the life
sciences. This paper is focused on dynamical systems that exhibit bistability
and are desc ribedby delay equations. It is shown that if a certain motif
including a feedback loop is present in the wiring diagram of the system, the
Boolean model captures the bistability of molecular switches. The method is
appl ied to two examples from biology, the lac operon and the phage lambda
lysis/lysogeny switch.
","[{""version"":""v1"",""created"":""Thu, 10 Dec 2009 20:31:14 GMT""}]","2011-05-10"
"0912.2091","Samuel Kolins","Samuel Kolins","f-Vectors of Triangulated Balls","24 pages",,,,"math.CO math.GT","http://arxiv.org/licenses/nonexclusive-distrib/1.0/","  We describe two methods for showing that a vector can not be the f-vector of
a homology d-ball. As a consequence, we disprove a conjectured characterization
of the f-vectors of balls of dimension five and higher due to Billera and Lee.
We also provide a construction of triangulated balls with various f-vectors. We
show that this construction obtains all possible f-vectors of three and four
dimensional balls and we conjecture that this result also extends to dimension
five.
","[{""version"":""v1"",""created"":""Thu, 10 Dec 2009 22:23:25 GMT""}]","2009-12-14"
"0912.2092","Thomas Maier","T.A. Maier, G. Alvarez, M. Summers, T.C. Schulthess","Dynamic cluster quantum Monte Carlo simulations of a two-dimensional
  Hubbard model with stripe-like charge density wave modulations: Interplay
  between inhomogeneity and superconductivity","published version","Phys. Rev. Lett. 104, 247001 (2010)","10.1103/PhysRevLett.104.247001",,"cond-mat.supr-con cond-mat.str-el","http://arxiv.org/licenses/nonexclusive-distrib/1.0/","  Using dynamic cluster quantum Monte Carlo simulations, we study the
superconducting behavior of a 1/8 doped two-dimensional Hubbard model with
imposed uni-directional stripe-like charge density wave modulation. We find a
significant increase of the pairing correlations and critical temperature
relative to the homogeneous system when the modulation length-scale is
sufficiently large. With a separable form of the irreducible particle-particle
vertex, we show that optimized superconductivity is obtained for moderate
modulation strength due to a delicate balance between the modulation enhanced
pairing interaction, and a concomitant suppression of the bare
particle-particle excitations by a modulation reduction of the quasi-particle
weight.
","[{""version"":""v1"",""created"":""Thu, 10 Dec 2009 22:00:40 GMT""},{""version"":""v2"",""created"":""Tue, 13 Jul 2010 13:55:00 GMT""}]","2015-05-14"
"0912.2093","Jimmy Hutasoit","D. Boyanovsky, R. Holman, Jimmy A. Hutasoit","Oscillation dynamics of active-unsterile neutrino mixing in a
  $2+\tilde{1}$ mixing scheme","30 pages and 5 figures in RevTeX format","Phys.Rev.D81:033009,2010","10.1103/PhysRevD.81.033009",,"hep-ph","http://arxiv.org/licenses/nonexclusive-distrib/1.0/","  We consider the possibility that sterile neutrinos exist and admit a
description as unparticles; we call these {\em unsterile} neutrinos. We then
examine the nature of neutrino oscillations in a model where an unsterile can
mix with two active flavors with a very simple mass matrix of the see-saw type.
Despite these simplifications, we find a number of remarkable features, all of
which will occur generically when more realistic cases are considered. These
include momentum dependent mixing angles, ""invisible"" decay widths for the
unsterile-like mode, as well as the inheritance of a non-vanishing spectral
density for the massive active-like modes. We also obtain the disappearance and
appearance probabilities for the active-like neutrinos and find remarkable
interference effects between the active and unsterile neutrinos as a
consequence of threshold effects, yielding new oscillatory contributions with
different oscillation lengths. These effects are only measurable on short
baseline experiments because there both probabilities are suppressed as
compared to mixing with a canonical sterile neutrino, thereby providing a
diagnostics tool to discriminate unsterile from canonical sterile neutrinos. We
conclude with a discussion of whether these new phenomena could aid in the
reconciliation of the LSND and MiniBooNE results.
","[{""version"":""v1"",""created"":""Thu, 10 Dec 2009 21:00:02 GMT""},{""version"":""v2"",""created"":""Wed, 17 Feb 2010 18:24:42 GMT""}]","2010-04-15"
"0912.2094","Yuval Birnboim","Yuval Birnboim, Uri Keshet and Lars Hernquist","Cold Fronts from Shock Collisions","5 pages, 4 figures, this letter is superseded by a more detailed
  version in arXiv:1006.1892",,,,"astro-ph.CO astro-ph.HE","http://arxiv.org/licenses/nonexclusive-distrib/1.0/","  Cold fronts (CFs) are found in most galaxy clusters, as well as in some
galaxies and groups of galaxies. We propose that some CFs are relics of
collisions between trailing shocks. Such a collision typically results in a
spherical, factor ~1.4-2.7 density/temperature discontinuity. These CFs may be
found as far as the virial shock, unlike in other CF formation models. As a
demonstration of this effect, we use one dimensional simulations where halo
reverberations involving periodic collisions between the virial shock and
outgoing secondary shocks exist. These collisions yield a distinctive,
concentric geometric sequence of CFs which trace the expansion of the virial
shock.
","[{""version"":""v1"",""created"":""Thu, 10 Dec 2009 21:06:52 GMT""},{""version"":""v2"",""created"":""Tue, 23 Feb 2010 22:44:26 GMT""},{""version"":""v3"",""created"":""Fri, 18 Jun 2010 14:02:55 GMT""}]","2010-06-21"
