"0912.2136","Marty Ytreberg","F. Marty Ytreberg","Computational study of small molecule binding for both tethered and free
  conditions","4 pages, 2 figures",,,,"physics.bio-ph physics.chem-ph","http://arxiv.org/licenses/nonexclusive-distrib/1.0/","  Using a calix[4]arene-benzene complex as a test system we compare the
potential of mean force for when the calix[4]arene is tethered versus free.
When the complex is in vacuum our results show that the difference between
tethered and free is primarily due to the entropic contribution to the
potential of mean force resulting in a binding free energy difference of 6.5
kJ/mol. By contrast, when the complex is in water our results suggest that the
difference between tethered and free is due to the enthalpic contribution
resulting in a binding free energy difference of 1.6 kJ/mol. This study
elucidates the roles of entropy and enthalpy for this small molecule system and
emphasizes the point that tethering the receptor has the potential to
dramatically impact the binding properties. These findings should be taken into
consideration when using calixarene molecules in nanosensor design.
","[{""version"":""v1"",""created"":""Fri, 11 Dec 2009 01:22:38 GMT""}]","2009-12-14"
"0912.2137","Ivan K. Kostov","Ivan Kostov","Matrix models as conformal field theories: genus expansion","17 pages, 4 figures","Nucl.Phys.B837:221-238,2010","10.1016/j.nuclphysb.2010.05.006","IPhT-t09/150","hep-th math-ph math.MP","http://arxiv.org/licenses/nonexclusive-distrib/1.0/","  We obtain the topological expansion of the hermitian matrix model using its
representation as a CFT on a hyperelliptic Riemann surface. To each branch
point of the Riemann surface we associate an operator which represents a twist
field dressed by the modes of the twisted boson. The partition function of the
matrix model is computed as a correlation function of such dressed twist
fields. The perturbative construction of the dressing operators yields a set of
Feynman rules for evaluating the free energy and the loop observables at any
genus.
","[{""version"":""v1"",""created"":""Fri, 11 Dec 2009 10:28:35 GMT""},{""version"":""v2"",""created"":""Thu, 18 Feb 2010 15:45:01 GMT""}]","2014-11-20"
"0912.2138","Liqun Fu","Liqun Fu, Soung Chang Liew, Jianwei Huang","Effective Carrier Sensing in CSMA Networks under Cumulative Interference","10 pages",,,,"cs.NI","http://arxiv.org/licenses/nonexclusive-distrib/1.0/","  This paper proposes and investigates the concept of a safe carrier-sensing
range that can guarantee interference safe (also termed hidden-node-free)
transmissions in CSMA networks under the cumulative interference model.
Compared with the safe carrier-sensing range under the commonly assumed but
less realistic pairwise interference model, we show that the safe
carrier-sensing range required under the cumulative interference model is
larger by a constant multiplicative factor. The concept of a safe
carrier-sensing range, although amenable to elegant analytical results, is
inherently not compatible with the conventional power threshold carrier-sensing
mechanism (e.g., that used in IEEE 802.11). Specifically, the absolute power
sensed by a node in the conventional mechanism does not contain enough
information for it to derive its distances from other concurrent transmitter
nodes. We show that, fortunately, a carrier-sensing mechanism called
Incremental-Power Carrier-Sensing (IPCS) can realize the carrier-sensing range
concept in a simple way. Instead of monitoring the absolute detected power, the
IPCS mechanism monitors every increment in the detected power. This means that
IPCS can separate the detected power of every concurrent transmitter, and map
the power profile to the required distance information.
","[{""version"":""v1"",""created"":""Fri, 11 Dec 2009 02:04:15 GMT""}]","2009-12-14"
"0912.2139","Hui Liu","Z. G. Dong, H. Liu, T. Li, Z. H. Zhu, S. M. Wang, J. X. Cao, S. N.
  Zhu, and X. Zhang","Modeling the directed transmission and reflection enhancements of the
  lasing spaser in active metamaterials","20papges, 5 figures, http://dsl.nju.edu.cn/mpp","Phys. Rev. B 80, 235116 (2009)",,,"physics.optics physics.class-ph","http://arxiv.org/licenses/nonexclusive-distrib/1.0/","  Simultaneously enhanced reflectance and transmittance greater than 35 dB are
demonstrated for the lasing spaser (or spasing) behavior in an active fishnet
metamaterial. In mimicking a lasing cavity, an equivalent active slab with
Lorentz dispersion for the index of refraction is established to model the
spasing metamaterial through the Fabry-Perot effect. Numerical and theoretical
results show good agreement in the equal enhancement of reflectance and
transmittance, as well as the non-monotonic dependence of the spasing intensity
on the gain coefficient. In addition, directed emission of the spasing beam is
verified numerically.
","[{""version"":""v1"",""created"":""Fri, 11 Dec 2009 02:20:15 GMT""}]","2009-12-14"
"0912.2140","Yijian Ouyang","Yijian Ouyang, Hongjie Dai, Jing Guo","Projected Performance Advantage of Multilayer Graphene Nanoribbon as
  Transistor Channel Material","22 pages, 6 figures",,,,"cond-mat.mes-hall cond-mat.other","http://arxiv.org/licenses/nonexclusive-distrib/1.0/","  The performance limits of the multilayer graphene nanoribbon (GNR)
field-effect transistor (FET) are assessed and compared to those of monolayer
GNR FET and carbon nanotube (CNT) FET. The results show that with a thin high-k
gate insulator and reduced interlayer coupling, multilayer GNR FET can
significantly outperform its CNT counterpart with a similar gate and bandgap in
terms of the ballistic on-current. In the presence of optical phonon
scattering, which has a short mean free path in the graphene-derived
nanostructures, the advantage of the multilayer GNRFET is even more
significant. The simulation results indicate multilayer GNRs with
incommensurate non-AB stacking and weak interlayer coupling are the best
candidate for high performance GNR FETs.
","[{""version"":""v1"",""created"":""Fri, 11 Dec 2009 02:39:12 GMT""}]","2009-12-14"
"0912.2141","Fabio Pichierri","Fabio Pichierri","Macrodipoles of potassium and chloride ion channels as revealed by
  electronic structure calculations","12 pages, 4 figures","Journal of Molecular Structure (Theochem) 950 (2010) 79-82","10.1016/j.theochem.2010.03.027",,"q-bio.BM","http://arxiv.org/licenses/nonexclusive-distrib/1.0/","  With the aid of quantum mechanical calculations we investigate the electronic
structure of the full length (FL) potassium channel protein, FL-KcsA, in its
closed conformation, and the electronic structure of the ClC chloride channel.
The results indicate that both ion channels are strongly polarized towards the
extracellular region with respect to the membrane mean plane. FL-KcsA possesses
an electric dipole moment of magnitude 403 Debye while ClC has a macrodipole
whose magnitude is about five times larger, 1983 Debye, thereby contributing to
differentiate their membrane electric barriers. The dipole vectors of both
proteins are aligned along the corresponding selectivity filters. This result
suggests that potassium and chloride ion channels are not passive with respect
to the movement of ions across the membrane and the ionic motion might be
partially driven by the electric field of the protein in conjunction with the
electrochemical potential of the membrane.
","[{""version"":""v1"",""created"":""Fri, 11 Dec 2009 02:34:43 GMT""}]","2010-05-25"
"0912.2142","Amanda Karakas","Amanda I. Karakas","Updated stellar yields from Asymptotic Giant Branch models","Accepted for publication in MNRAS; 15 pages",,"10.1111/j.1365-2966.2009.16198.x",,"astro-ph.SR astro-ph.GA","http://arxiv.org/licenses/nonexclusive-distrib/1.0/","  An updated grid of stellar yields for low to intermediate-mass
thermally-pulsing Asymptotic Giant Branch (AGB) stars are presented. The models
cover a range in metallicity Z = 0.02, 0.008, 0.004, and 0.0001, and masses
between 1Msun to 6Msun. New intermediate-mass Z = 0.0001 AGB models are also
presented, along with a finer mass grid than used in previous studies. The
yields are computed using an updated reaction rate network that includes the
latest NeNa and MgAl proton capture rates, with the main result that between ~6
to 30 times less Na is produced by intermediate-mass models with hot bottom
burning. In low-mass AGB models we investigate the effect on the production of
light elements of including some partial mixing of protons into the intershell
region during the deepest extent of each third dredge-up episode. The protons
are captured by the abundant 12C to form a 13C pocket. The 13C pocket increases
the yields of 19F, 23Na, the neutron-rich Mg and Si isotopes, 60Fe, and 31P.
The increase in 31P is by factors of ~4 to 20, depending on the metallicity.
Any structural changes caused by the addition of the 13C pocket into the
He-intershell are ignored. However, the models considered are of low mass and
any such feedback is likely to be small. Further study is required to test the
accuracy of the yields from the partial-mixing models. For each mass and
metallicity, the yields are presented in a tabular form suitable for use in
galactic chemical evolution studies or for comparison to the composition of
planetary nebulae.
","[{""version"":""v1"",""created"":""Fri, 11 Dec 2009 02:44:40 GMT""}]","2015-05-14"
"0912.2143","Francisco Mireles","Masaya Nishioka, Bruce A. Gurney, Ernesto E. Marinero and Francisco
  Mireles","Zero field spin splitting in AlSb/InAs/AlSb quantum wells induced by
  surface proximity effects","14 pages, 2 figures. (To be published in APL)",,"10.1063/1.3274129",,"cond-mat.mes-hall cond-mat.mtrl-sci","http://arxiv.org/licenses/nonexclusive-distrib/1.0/","  InAs quantum well heterostructures are of considerable interest for
mesoscopic device applications such as scanning probe and magnetic recording
sensors, which require the channel to be close to the surface. Here we report
on magnetotransport measurements of AlSb/InAs/AlSb Hall bars at a shallow depth
of 20 nm. Analysis of the observed Shubnikov-de Haas oscillations and modeling
show that spin splitting energies in excess of 2.3 meV occur at zero magnetic
field. We conclude that the spin-splitting results from the Rashba effect due
to the band bending in the quantum well. This is caused by substantial electron
transfer from the surface to the quantum well and becomes significant when the
quantum well is located near the surface.
","[{""version"":""v1"",""created"":""Fri, 11 Dec 2009 02:54:07 GMT""}]","2015-05-14"
"0912.2144","Jun Wu","Jun Wu, Mauricio Barahona, Yuejin Tan, Hongzhong Deng","Robustness of Regular Graphs Based on Natural Connectivity","18 pages, 5 figures",,,,"cond-mat.stat-mech gr-qc math.CO physics.soc-ph","http://arxiv.org/licenses/nonexclusive-distrib/1.0/","  It has been recently proposed that the natural connectivity can be used to
characterize efficiently the robustness of complex networks. The natural
connectivity quantifies the redundancy of alternative routes in the network by
evaluating the weighted number of closed walks of all lengths and can be seen
as an average eigenvalue obtained from the graph spectrum. In this paper, we
explore both analytically and numerically the natural connectivity of regular
ring lattices and regular random graphs obtained through degree-preserving
random rewirings from regular ring lattices. We reformulate the natural
connectivity of regular ring lattices in terms of generalized Bessel functions
and show that the natural connectivity of regular ring lattices is independent
of network size and increases with monotonically. We also show that random
regular graphs have lower natural connectivity, and are thus less robust, than
regular ring lattices.
","[{""version"":""v1"",""created"":""Fri, 11 Dec 2009 03:13:07 GMT""}]","2009-12-19"
"0912.2145","Rosanne Di Stefano","Rosanne Di Stefano","Short-duration lensing events: II. Expectations and Protocols","17 pages; 3 figures; submitted to ApJ 3 July 2009",,"10.1088/0067-0049/201/2/21",,"astro-ph.EP astro-ph.GA","http://arxiv.org/licenses/nonexclusive-distrib/1.0/","  Ongoing microlensing observations by OGLE and MOA regularly identify and
conduct high-cadence sampling of lensing events with Einstein diameter crossing
time, tau_E, of 16 or fewer days. Events with estimated values of tau_E of one
to two days have been detected. Short duration events tend to be generated by
low-mass lenses or by lenses with high transverse velocities. We compute the
expected rates, demonstrate the expected ranges of parameters for lenses of
different mass, and develop a protocol for observing and modeling
short-duration events. Relatively minor additions to the procedures presently
used will increase the rate of planet discovery, and also discover or place
limits on the population of high-speed dim stars and stellar remnants in the
vicinity of the Sun.
","[{""version"":""v1"",""created"":""Fri, 11 Dec 2009 03:39:13 GMT""}]","2015-05-14"
"0912.2147","Chong Chung Lih","Chong-Chung Lih","Study of $\pi^{0}$ and $\eta$ decays containing dilepton","13 pages, 1 figures. 2 tables; Charge factors added and numerical
  results corrected","J.Phys.G38:065001,2011","10.1088/0954-3899/38/6/065001",,"hep-ph","http://creativecommons.org/licenses/by/3.0/","  We calculate the momentum dependent form factors of $P \to \gamma^*
\gamma^*$($P=\pi^{0}, \eta$) within the light-front quark model. Using the form
factors, we examine the decays of $P \to l^+ l^-$, $P \to l^+ l^- \gamma$ and
$P \to l^+ l^- l^+ l^-$($l=e$ or $\mu$) and compare our results with the
experimental data and other theoretical predictions. In particular, for $\pi^0
\to e^+e^-$, we find that the decay branching ratio is $6.68\times 10^{-8}$,
which is consistent with the recent measurement of $(7.48\pm0.29\pm0.25)\times
10^{-8}$ by E799 of KTeV/Fermilab.
","[{""version"":""v1"",""created"":""Fri, 11 Dec 2009 03:48:58 GMT""},{""version"":""v2"",""created"":""Tue, 12 Jan 2010 08:24:42 GMT""},{""version"":""v3"",""created"":""Thu, 21 Jan 2010 00:07:16 GMT""},{""version"":""v4"",""created"":""Wed, 31 Mar 2010 13:06:31 GMT""},{""version"":""v5"",""created"":""Wed, 20 Oct 2010 09:13:53 GMT""}]","2011-04-20"
"0912.2149","Andre  Landulfo","Andre G. S. Landulfo, George E. A. Matsas and Adriano C. Torres","Influence of detector motion in entanglement measurements with photons",,,"10.1103/PhysRevA.81.044103",,"quant-ph","http://arxiv.org/licenses/nonexclusive-distrib/1.0/","  We investigate how the polarization correlations of entangled photons
described by wave packets are modified when measured by moving detectors. For
this purpose, we analyze the Clauser-Horne-Shimony-Holt Bell inequality as a
function of the apparatus velocity. Our analysis is motivated by future
experiments with entangled photons designed to use satellites. This is a first
step towards the implementation of quantum information protocols in a global
scale.
","[{""version"":""v1"",""created"":""Fri, 11 Dec 2009 04:15:14 GMT""}]","2012-08-09"
"0912.2150","Mark Wilde","Mark M. Wilde and David Fattal","Nonlocal quantum information in bipartite quantum error correction","14 pages, 4 figures","Quantum Information Processing, Volume 9, Number 5, pages 591-610,
  September 2010","10.1007/s11128-010-0175-0",,"quant-ph","http://arxiv.org/licenses/nonexclusive-distrib/1.0/","  We show how to convert an arbitrary stabilizer code into a bipartite quantum
code. A bipartite quantum code is one that involves two senders and one
receiver. The two senders exploit both nonlocal and local quantum resources to
encode quantum information with local encoding circuits. They transmit their
encoded quantum data to a single receiver who then decodes the transmitted
quantum information. The nonlocal resources in a bipartite code are ebits and
nonlocal information qubits and the local resources are ancillas and local
information qubits. The technique of bipartite quantum error correction is
useful in both the quantum communication scenario described above and in
fault-tolerant quantum computation. It has application in fault-tolerant
quantum computation because we can prepare nonlocal resources offline and
exploit local encoding circuits. In particular, we derive an encoding circuit
for a bipartite version of the Steane code that is local and additionally
requires only nearest-neighbor interactions. We have simulated this encoding in
the CNOT extended rectangle with a publicly available fault-tolerant simulation
software. The result is that there is an improvement in the ""pseudothreshold""
with respect to the baseline Steane code, under the assumption that quantum
memory errors occur less frequently than quantum gate errors.
","[{""version"":""v1"",""created"":""Fri, 11 Dec 2009 04:25:43 GMT""}]","2010-09-06"
"0912.2151","Janko Boehm","Janko Boehm, Stavros Argyrios Papadakis","Stellar subdivisions and Stanley-Reisner rings of Gorenstein complexes","v2: minor improvements, 14 pages, 1 figure","Australas. J. Combin. 55 (2013), 235-247",,,"math.AC math.CO","http://arxiv.org/licenses/nonexclusive-distrib/1.0/","  Unprojection theory aims to analyze and construct complicated commutative
rings in terms of simpler ones. Our main result is that, on the algebraic level
of Stanley-Reisner rings, stellar subdivisions of non-acyclic Gorenstein
simplicial complexes correspond to unprojections of type Kustin-Miller. As an
application, we inductively calculate the minimal graded free resolutions of
Stanley-Reisner rings associated to stacked polytopes, recovering results of
Terai, Hibi, Herzog and Li Marzi.
","[{""version"":""v1"",""created"":""Fri, 11 Dec 2009 04:37:25 GMT""},{""version"":""v2"",""created"":""Fri, 13 Jan 2012 11:32:10 GMT""}]","2013-09-24"
"0912.2152","Janko Boehm","Janko Boehm, Stavros Argyrios Papadakis","On the structure of Stanley-Reisner rings associated to cyclic polytopes","Version 2, minor improvements, 20 pages. Package may be downloaded at
  http://www.math.uni-sb.de/ag/schreyer/jb/Macaulay2/CyclicPolytopeRes/html/","Osaka J. Math. 49-1 (2012), 81-100",,,"math.AC math.CO","http://arxiv.org/licenses/nonexclusive-distrib/1.0/","  We study the structure of Stanley-Reisner rings associated to cyclic
polytopes, using ideas from unprojection theory. Consider the boundary
simplicial complex Delta(d,m) of the d-dimensional cyclic polytope with m
vertices. We show how to express the Stanley-Reisner ring of Delta(d,m+1) in
terms of the Stanley-Reisner rings of Delta(d,m) and Delta(d-2,m-1). As an
application, we use the Kustin-Miller complex construction to identify the
minimal graded free resolutions of these rings. In particular, we recover
results of Schenzel, Terai and Hibi about their graded Betti numbers.
","[{""version"":""v1"",""created"":""Fri, 11 Dec 2009 05:34:19 GMT""},{""version"":""v2"",""created"":""Mon, 24 Oct 2011 08:57:12 GMT""}]","2012-07-19"
"0912.2153","Chun-Hsu Su","Chun-Hsu Su, Andrew D. Greentree, Raymond G. Beausoleil, Lloyd C. L.
  Hollenberg, William J. Munro, Kae Nemoto, Timothy P. Spiller","Tunable photon-assisted bleaching of three-level systems for noise
  filtration","9 pages, 9 figures, significantly revised",,,,"quant-ph","http://arxiv.org/licenses/nonexclusive-distrib/1.0/","  Electromagnetically-induced transparency (EIT) exploits quantum coherence to
burn subnatural linewidth holes within a spectral line. We investigate the less
explored properties of EIT to effect absorptive nonlinear processes without
restrictions on the relative intensities of pump and probe fields. We show that
a three-level medium under imperfect EIT conditions can generate a form of
bleaching that is qualitatively similar to two-state saturable absorption. This
scheme has the advantages of greater sensitivity to signal intensity and
controllability over its bleaching intensity level post-fabrication. Such
effects could prove useful for noise filtration at very low light levels.
","[{""version"":""v1"",""created"":""Fri, 11 Dec 2009 05:42:46 GMT""},{""version"":""v2"",""created"":""Tue, 1 Feb 2011 02:42:18 GMT""}]","2011-02-02"
"0912.2154","Shuichi Matsukiyo","S. Matsukiyo and T. Hada","Relativistic particle acceleration in developing Alfv\'{e}n turbulence","15 pages, 9 figures, 1 table","Astrophys.J.692:1004,2009","10.1088/0004-637X/692/2/1004",,"astro-ph.HE astro-ph.SR","http://arxiv.org/licenses/nonexclusive-distrib/1.0/","  A new particle acceleration process in a developing Alfv\'{e}n turbulence in
the course of successive parametric instabilities of a relativistic pair plasma
is investigated by utilyzing one-dimensional electromagnetic full particle
code. Coherent wave-particle interactions result in efficient particle
acceleration leading to a power-law like energy distribution function. In the
simulation high energy particles having large relativistic masses are
preferentially accelerated as the turbulence spectrum evolves in time. Main
acceleration mechanism is simultaneous relativistic resonance between a
particle and two different waves. An analytical expression of maximum
attainable energy in such wave-particle interactions is derived.
","[{""version"":""v1"",""created"":""Fri, 11 Dec 2009 06:29:17 GMT""}]","2014-11-20"
"0912.2155","Vladislav Dubrovsky G","M.Yu. Basalaev, V.G. Dubrovsky and A.V. Topovsky","New exact multi line soliton and periodic solutions with constant
  asymptotic values at infinity of the NVN integrable nonlinear evolution
  equation via dibar-dressing method","43 pages, 28 figures, 25 references More exactly specified and
  concretize all figures, captions and explanations for these figures. The
  number of figures changed from 36 (in old version) to 28 (in new version)",,,,"nlin.SI","http://arxiv.org/licenses/nonexclusive-distrib/1.0/","  The classes of exact multi line soliton, periodic solutions and solutions
with functional parameters, with constant asymptotic values at infinity
u|_{xi^2+eta^2->infty}->-epsilon, for the hyperbolic and elliptic versions of
the Nizhnik-Veselov-Novikov (NVN) equation via dibar-dressing method of
Zakharov and Manakov were constructed. At fixed time these solutions are
exactly solvable potentials correspondingly for one-dimensional perturbed
telegraph and two-dimensional stationary Schroedinger equations. Physical
meaning of stationary states of quantum particle in exact one line and two line
soliton potential valleys was discussed. In the limit epsilon->0 exact special
solutions u^{1}, u^{2} (line solitons and periodic solutions) were found which
sum u^{1}+u^{2}(linear superposition) is also exact solution of NVN equation.
","[{""version"":""v1"",""created"":""Fri, 11 Dec 2009 06:09:56 GMT""},{""version"":""v2"",""created"":""Thu, 14 Jan 2010 06:03:56 GMT""}]","2010-01-14"
"0912.2156","il-Joong Kim","I.-J. Kim, K.-W. Min, K.-I. Seon, W. Han, and J. Edelstein","C IV Emission-line Detection of the Supernova Remnant RCW 114","7 pages, 7 figures, accepted for publication in The ApJ","Astrophys.J.709:823-831,2010","10.1088/0004-637X/709/2/823",,"astro-ph.GA","http://arxiv.org/licenses/nonexclusive-distrib/1.0/","  We report the detection of the C IV 1548, 1551 emission line in the region of
the RCW 114 nebula using the FIMS/SPEAR data. The observed C IV line intensity
indicates that RCW 114 is much closer to us than WR 90, a Wolf-Rayet star that
was thought to be associated with RCW 114 in some of the previous studies. We
also found the existence of a small H I bubble centered on WR 90, with a
different local standard of rest velocity range from that of the large H I
bubble which was identified previously as related to RCW 114. These findings
imply that the RCW 114 nebula is an old supernova remnant which is not
associated with WR 90. Additionally, the global morphologies of the C IV,
H-alpha, and H I emissions show that RCW 114 has evolved in a non-uniform
interstellar medium.
","[{""version"":""v1"",""created"":""Fri, 11 Dec 2009 06:12:53 GMT""}]","2014-11-20"
