"0912.2177","Valerij Gurin S","V.S. Gurin","A Quantum-Chemical Simulation of the Cadmium Chalcogenide Clusters
  Terminated with Hydrogen and Simple Functional Groups","11 pages incl. 2 figures",,,,"cond-mat.mes-hall","http://arxiv.org/licenses/nonexclusive-distrib/1.0/","  Ab initio calculations of cadmium chalcogenide nanoclusters with terminating
groups (H, O, N, and C atoms bound to the surface sulfur) are considered as a
simulation for the species produced in typical synthesis of bio-conjugates with
luminescent quantum dots. The approaches based on the Hartree-Fock (HF) method
and density functional theory (DFT) are used assuming geometry optimization
keeping the tetrahedral symmetry. The geometry and electronic structure of CdX
(X=S, Se, Te) clusters with size up to Cd17 (HF) and Cd4 (DFT) bound with
hydrogen and -OH, -NH2, -CH3, and -CH2CH3 groups are calculated and the effects
of the terminating groups upon core clusters are discussed.
","[{""version"":""v1"",""created"":""Fri, 11 Dec 2009 09:08:49 GMT""}]","2009-12-14"
"0912.2178","Owen Maroney","O.J.E.Maroney","Thermodynamic constraints on fluctuation phenomena","12 pages, 24 figures","Phys. Rev. E v80 n6 (2009)","10.1103/PhysRevE.80.061141",,"cond-mat.stat-mech","http://arxiv.org/licenses/nonexclusive-distrib/1.0/","  The relationships between reversible Carnot cycles, the absence of perpetual
motion machines and the existence of a non-decreasing, globally unique entropy
function forms the starting point of many textbook presentations of the
foundations of thermodynamics. However, the thermal fluctuation phenomena
associated with statistical mechanics has been argued to restrict the domain of
validity of this basis of the second law of thermodynamics. Here we demonstrate
that fluctuation phenomena can be incorporated into the traditional
presentation, extending, rather than restricting, the domain of validity of the
phenomenologically motivated second law. Consistency conditions lead to
constraints upon the possible spectrum of thermal fluctuations. In a special
case this uniquely selects the Gibbs canonical distribution and more generally
incorporates the Tsallis distributions. No particular model of microscopic
dynamics need be assumed.
","[{""version"":""v1"",""created"":""Fri, 11 Dec 2009 09:24:36 GMT""}]","2015-05-14"
"0912.2179","Lionel Bureau","Lionel Bureau (INSP)","Non-linear rheology of a nanoconfined simple fluid",,"Phys. Rev. Lett. 104 (2010) 218302","10.1103/PhysRevLett.104.218302",,"cond-mat.soft","http://arxiv.org/licenses/nonexclusive-distrib/1.0/","  We probe the rheology of the model liquid octamethylcyclotetrasiloxane
(OMCTS) confined into molecularly thin films, using a unique Surface Forces
Apparatus allowing to explore a large range of shear rates and confinement. We
thus show that OMCTS under increasing confinement exhibits the viscosity
enhancement and the non-linear flow properties characteristic of a sheared
supercooled liquid approaching its glass transition. Besides, we study the
drainage of confined OMCTS via the propagation of ""squeeze-out"" fronts. The
hydrodynamic model proposed by Becker and Mugele [Phys. Rev. Lett. {\bf 91},
166104 (2003)] to describe such front dynamics leads to a conclusion in
apparent contradiction with the dynamical slowdown evidenced by rheology
measurements, which suggests that front propagation is not controlled by large
scale flow in the confined films.
","[{""version"":""v1"",""created"":""Fri, 11 Dec 2009 09:33:15 GMT""},{""version"":""v2"",""created"":""Fri, 5 Feb 2010 13:48:56 GMT""}]","2010-05-28"
"0912.2180","Samy Tindel","Jorge A. Leon, Samy Tindel","Malliavin calculus for fractional delay equations",,,,,"math.PR","http://arxiv.org/licenses/nonexclusive-distrib/1.0/","  In this paper we study the existence of a unique solution to a general class
of Young delay differential equations driven by a H\""older continuous function
with parameter greater that 1/2 via the Young integration setting. Then some
estimates of the solution are obtained, which allow to show that the solution
of a delay differential equation driven by a fractional Brownian motion (fBm)
with Hurst parameter H>1/2 has a smooth density. To this purpose, we use
Malliavin calculus based on the Frechet differentiability in the directions of
the reproducing kernel Hilbert space associated with fBm.
","[{""version"":""v1"",""created"":""Fri, 11 Dec 2009 09:34:00 GMT""}]","2009-12-14"
"0912.2181","Vladimir Krechet G","V. G. Krechet, D. V. Sadovnikov","Spin-spin interaction in general relativity and induced geometries with
  nontrivial topology","4 two-column pages, no figures","Grav. Cosmol.15:337-340,2009","10.1134/S0202289309040082",,"gr-qc","http://arxiv.org/licenses/nonexclusive-distrib/1.0/","  We consider the dynamics of a self-gravitating spinor field and a
self-gravitating rotating perfect fluid. It is shown that both these matter
distributions can induce a vortex field described by the curl 4-vector of a
tetrad: $\omega^i = \frac12\eps^{iklm}e_{(a)k}e^{(a)}_{l;m}$, where $e^{(a)}_k$
are components of the tetrad. The energy-momentum tensor $T_{ik}(\omega)$ of
this field has been found and shown to violate the strong and weak energy
conditions which leads to possible formation of geometries with nontrivial
topology like wormholes. The corresponding exact solutions to the equations of
general relativity have been found. It is also shown that other vortex fields,
e.g., the magnetic field, can also possess such properties.
","[{""version"":""v1"",""created"":""Fri, 11 Dec 2009 09:55:46 GMT""}]","2015-05-14"
"0912.2182","Dimitri Karayannakis","D.Karayannakis","Gautchi's ratio and the Volume of the unit ball in R^n",,,,,"math.CA math.KT","http://arxiv.org/licenses/nonexclusive-distrib/1.0/","  Let Omega(n) be the volume of the unit ball in R^n. We formulate as an
infinite product the gamma function ratio gamma(x+1/2)/gamma(x),x>0, which
allows us to reproduce and /or produce a variety of formulas and inequalities,
some of them seemingly new, concerning Omega(n-1)/Omega(n),and
(Omega(n))^2/Omega(n-1)Omega(n+1)
","[{""version"":""v1"",""created"":""Fri, 11 Dec 2009 14:30:04 GMT""},{""version"":""v2"",""created"":""Tue, 10 Aug 2010 09:09:37 GMT""}]","2010-08-11"
"0912.2183","Rachele Fermani","Rachele Fermani, Tobias Mueller, Bo Zhang, Michael J. Lim, Rainer
  Dumke","Heating rate and spin flip lifetime due to near field noise in layered
  superconducting atom chips","7 pages, 7 figures","J. Phys. B: At. Mol. Opt. Phys. 43 (2010) 095002","10.1088/0953-4075/43/9/095002",,"physics.atom-ph quant-ph","http://arxiv.org/licenses/nonexclusive-distrib/1.0/","  We theoretically investigate the heating rate and spin flip lifetimes due to
near field noise for atoms trapped close to layered superconducting structures.
In particular, we compare the case of a gold layer deposited above a
superconductor with the case of a bare superconductor. We study a niobium-based
and a YBCO-based chip. For both niobium and YBCO chips at a temperature of 4.2
K, we find that the deposition of the gold layer can have a significant impact
on the heating rate and spin flip lifetime, as a result of the increase of the
near field noise. At a chip temperature of 77 K, this effect is less pronounced
for the YBCO chip.
","[{""version"":""v1"",""created"":""Fri, 11 Dec 2009 10:10:02 GMT""}]","2010-04-23"
"0912.2184","Siye Wu","Varghese Mathai and Siye Wu","Twisted Analytic Torsion","10 pages, based on a talk at the International Conference on Complex
  Analysis and Related Topics, August 2009, Beijing, to appear in the special
  volume in honor of Prof. Yang Lo on the occasion of his 70th birthday;
  correction of typos and some other minor changes","Sci China Math 53 (2010) 555--563","10.1007/s11425-010-0053-3",,"math.DG hep-th","http://arxiv.org/licenses/nonexclusive-distrib/1.0/","  We review the Reidemeister torsion, Ray-Singer's analytic torsion and the
Cheeger-M""uller theorem. We describe the analytic torsion of the de Rham
complex twisted by a flux form introduced by the current authors and recall its
properties. We define a new twisted analytic torsion for the complex of
invariant differential forms on the total space of a principal circle bundle
twisted by an invariant flux form. We show that when the dimension is even,
such a torsion is invariant under certain deformation of the metric and the
flux form. Under T-duality which exchanges the topology of the bundle and the
flux form and the radius of the circular fiber with its inverse, the twisted
torsions of invariant forms are inverse to each other for any dimension.
","[{""version"":""v1"",""created"":""Fri, 11 Dec 2009 10:18:19 GMT""},{""version"":""v2"",""created"":""Mon, 1 Mar 2010 13:05:11 GMT""}]","2010-03-13"
"0912.2185","Christian Berg","Christian Berg (University of Copenhagen), Henrik L. Pedersen
  (University of Copenhagen)","A Pick function related to the sequence of volumes of the unit ball in
  n-space",,,,,"math.CA math.CV","http://arxiv.org/licenses/nonexclusive-distrib/1.0/","  We show that
  F_a(x)=\frac{\ln \Gamma (x+1)}{x\ln(ax)} is a Pick function for a\ge 1 and
find its integral representation.
  We also consider the function f(x)=(\frac{\pi^{x/2}}{\Gamma(1+x/2)})^{1/(x\ln
x)} and show that \ln f(x+1) is a Stieltjes function and that f(x+1) is
completely monotonic on (0,\infty). In particular f(n)=\Omega_n^{1/(n\ln
n)},n\ge 2 is a
  Hausdorff moment sequence. Here \Omega_n is the volume of the unit ball in
Euclidean n-space
","[{""version"":""v1"",""created"":""Fri, 11 Dec 2009 10:18:18 GMT""}]","2009-12-14"
"0912.2187","Nikolay Trunov","N.G.Domostroeva and N.N.Trunov","An approximate Expression for Viscosity of Nanosuspensions","5 pages",,,,"physics.flu-dyn","http://arxiv.org/licenses/nonexclusive-distrib/1.0/","  We consider liquid suspensions with dispersed nanoparticles. Using two-points
Pade approximants and combining results of both hydrodynamic and molecular
dynamics methods, we obtain the effective viscosity for any diameters of
nanoparticles
","[{""version"":""v1"",""created"":""Fri, 11 Dec 2009 10:29:52 GMT""}]","2009-12-14"
"0912.2188","Fedele Lizzi","J.F. Carinena, J.M. Gracia-Bondia, Fedele Lizzi, Giuseppe Marmo and
  Patrizia Vitale","Monopole-based quantization: a programme","Contribution to the volume: Mathematical Physics and Field Theory,
  Julio Abad, In Memoriam}, M. Asorey, J.V. Garcia Esteve, M.F. Ranada and J.
  Sesma Editors, Prensas Universitaria de Zaragoza, (2009)",,,"DSF/18/2009, ICCUB-09-426","math-ph hep-th math.MP","http://arxiv.org/licenses/nonexclusive-distrib/1.0/","  We describe a programme to quantize a particle in the field of a (three
dimensional) magnetic monopole using a Weyl system. We propose using the
mapping of position and momenta as operators on a quaternionic Hilbert module
following the work of Emch and Jadczyk.
","[{""version"":""v1"",""created"":""Fri, 11 Dec 2009 10:59:49 GMT""}]","2009-12-14"
"0912.2189","Alexander Ilyichev","I. Akushevich, A. Ilyichev, N. Shumeiko","ELRADGEN 2.0: Monte Carlo generator for simulation of radiative events
  in polarized elastic electron-proton scattering","4 pages, 2 figures, 1 table. Talk given at the International meeting
  ""Advanced Study Institute On Symmetries And Spin"" (SPIN-Praha-2009)",,,,"hep-ph","http://arxiv.org/licenses/nonexclusive-distrib/1.0/","  A new version of Monte Carlo generator ELRADGEN for simulation of real photon
emission in elastic electron-proton scattering is presented. The extensions in
the new version include opportunity to deal with polarized particles:
longitudinally polarized electron and arbitrary polarized proton. Simulation
strategy, specifications of used kinematics, structure of the contributions to
the observed cross section, cross-checks, and numerical results for BLAST
experimental setup are presented and briefly discussed.
","[{""version"":""v1"",""created"":""Fri, 11 Dec 2009 11:26:16 GMT""}]","2009-12-14"
"0912.2190","Xavier Mora","Rosa Camps, Xavier Mora, Laia Saumell","A continuous rating method for preferential voting. The complete case","This is part one of a revised version of arxiv:0810.2263. Version 3
  is the result of certain modifications, both in the statement of the problem
  and in the concluding remarks, that enhance the results of the paper; the
  results themselves remain unchanged",,"10.1007/s00355-011-0548-z",,"math.OC cs.GT","http://arxiv.org/licenses/nonexclusive-distrib/1.0/","  A method is given for quantitatively rating the social acceptance of
different options which are the matter of a complete preferential vote.
Completeness means that every voter expresses a comparison (a preference or a
tie) about each pair of options. The proposed method is proved to have certain
desirable properties, which include: the continuity of the rates with respect
to the data, a decomposition property that characterizes certain situations
opposite to a tie, the Condorcet-Smith principle, and a property of clone
consistency. One can view this rating method as a complement for the ranking
method introduced in 1997 by Markus Schulze. It is also related to certain
methods of one-dimensional scaling or cluster analysis.
","[{""version"":""v1"",""created"":""Fri, 11 Dec 2009 10:38:54 GMT""},{""version"":""v2"",""created"":""Mon, 18 Oct 2010 13:07:58 GMT""},{""version"":""v3"",""created"":""Tue, 29 Mar 2011 22:20:52 GMT""}]","2012-03-09"
"0912.2191","Andrey Khvorostukhin S.","A.S. Khvorostukhin, V.D. Toneev, D.N. Voskresensky","Viscosity of hadron matter within relativistic mean-field based model
  with scaled hadron masses and couplings","16 pages, 6 figures; minor clarifying changes","Phys.Atom.Nucl.74:650-658,2011","10.1134/S1063778811040089",,"nucl-th hep-ex hep-ph","http://arxiv.org/licenses/nonexclusive-distrib/1.0/","  The shear ($\eta$) and bulk ($\zeta$) viscosities are calculated in a
quasiparticle relaxation time approximation for a hadron matter described
within the relativistic mean-field based model with scaled hadron masses and
couplings. Comparison with results of other models is presented. We demonstrate
that a small value of the shear viscosity to entropy density ratio required for
explaining a large elliptic flow observed at RHIC may be reached in the hadron
phase. Large values of the bulk viscosity are noted in case of the baryon
enriched matter.
","[{""version"":""v1"",""created"":""Fri, 11 Dec 2009 10:45:26 GMT""},{""version"":""v2"",""created"":""Fri, 18 Dec 2009 11:01:21 GMT""}]","2011-05-05"
"0912.2192","Mar Roca-Sogorb","Mar Roca-Sogorb, Jose L. Gomez, Ivan Agudo, Alan P. Marscher and
  Svetlana G. Jorstad","Unexpected High Brightness Temperature 140 PC from the Core in the Jet
  of 3C 120","5 pages, 5 figures Accepted to be published in ApJ Letters",,"10.1088/2041-8205/712/2/L160",,"astro-ph.CO","http://arxiv.org/licenses/nonexclusive-distrib/1.0/","  We present 1.7, 5, 15, 22 and 43 GHz polarimetric multi-epoch VLBA
observations of the radio galaxy 3C 120. The higher frequency observations
reveal a new component, not visible before April 2007, located 80 mas from the
core (which corresponds to a deprojected distance of 140 pc), with a brightness
temperature about 600 times higher than expected at such distances. This
component (hereafter C80) is observed to remain stationary and to undergo small
changes in its brightness temperature during more than two years of
observations. A helical shocked jet model - and perhaps some flow acceleration
- may explain the unusually high Tb of C80, but it seems unlikely that this
corresponds to the usual shock that emerges from the core and travels
downstream to the location of C80. It appears that some other intrinsic process
in the jet, capable of providing a local burst in particle and/or magnetic
field energy, may be responsible for the enhanced brightness temperature
observed in C80, its sudden appearance in April 2007, and apparent
stationarity.
","[{""version"":""v1"",""created"":""Fri, 11 Dec 2009 10:42:35 GMT""},{""version"":""v2"",""created"":""Wed, 16 Dec 2009 10:38:37 GMT""},{""version"":""v3"",""created"":""Fri, 26 Feb 2010 16:41:43 GMT""}]","2015-05-14"
"0912.2193","Tomasz Klimsiak","Tomasz Klimsiak","Reflected BSDEs and continuous solutions of parabolic obstacle problem
  for semilinear PDEs in divergence form","36 pages, 33rd Conference on Stochastic Processes and Their
  Applications, Berlin 2009",,,,"math.PR math.AP","http://arxiv.org/licenses/nonexclusive-distrib/1.0/","  We consider the Cauchy problem for semilinear parabolic equation in
divergence form with obstacle. We show that under natural conditions on the
right-hand side of the eqution and mild conditions on the obstacle a unique
continuous solution of the problem admits a stochastic representation in terms
of reflected backward stochastic differential equations. We derive also some
regularity properties of so- lutions and prove useful approximation results.
","[{""version"":""v1"",""created"":""Fri, 11 Dec 2009 10:42:50 GMT""}]","2009-12-14"
"0912.2194","James Percival","Colin C. Cotter, Darryl D. Holm, James R. Percival","The Square Root Depth Wave Equations","10 pages, 5 figures",,"10.1098/rspa.2010.0124",,"physics.flu-dyn nlin.CD","http://arxiv.org/licenses/nonexclusive-distrib/1.0/","  We introduce a set of coupled equations for multilayer water waves that
removes the ill-posedness of the multilayer Green-Naghdi (MGN) equations in the
presence of shear. The new well-posed equations are Hamiltonian and in the
absence of imposed background shear they retain the same travelling wave
solutions as MGN. We call the new model the Square Root Depth equations, from
the modified form of their kinetic energy of vertical motion. Our numerical
results show how the Square Root Depth equations model the effects of
multilayer wave propagation and interaction, with and without shear.
","[{""version"":""v1"",""created"":""Fri, 11 Dec 2009 10:45:36 GMT""}]","2015-05-14"
"0912.2195","Xavier Mora","Rosa Camps, Xavier Mora, Laia Saumell","A continuous rating method for preferential voting. The incomplete case","Part two of a revised version of arxiv:0810.2263. Version 3 is the
  result of several minor improvements",,,,"math.OC cs.GT","http://arxiv.org/licenses/nonexclusive-distrib/1.0/","  A method is given for quantitatively rating the social acceptance of
different options which are the matter of a preferential vote. In contrast to a
previous article, here the individual votes are allowed to be incomplete, that
is, they need not express a comparison between every pair of options. This
includes the case where each voter gives an ordered list restricted to a subset
of most preferred options. In this connection, the proposed method (except for
one of the given variants) carefully distinguishes a lack of information about
a given pair of options from a proper tie between them. As in the special case
of complete individual votes, the proposed generalization is proved to have
certain desirable properties, which include: the continuity of the rates with
respect to the data, a decomposition property that characterizes certain
situations opposite to a tie, the Condorcet-Smith principle, and clone
consistency
","[{""version"":""v1"",""created"":""Fri, 11 Dec 2009 10:46:14 GMT""},{""version"":""v2"",""created"":""Wed, 30 Mar 2011 15:46:35 GMT""},{""version"":""v3"",""created"":""Thu, 8 Mar 2012 17:44:52 GMT""}]","2012-03-09"
"0912.2196","Jan Verduijn","J. Verduijn, G.C. Tettamanzi, G.P. Lansbergen, N. Collaert, S.
  Biesemans, S. Rogge","Coherent transport through a double donor system in silicon",,,"10.1063/1.3318271",,"cond-mat.mes-hall cond-mat.str-el","http://arxiv.org/licenses/nonexclusive-distrib/1.0/","  Quantum coherence is of crucial importance for the applicability of donor
based quantum computing. In this Letter we describe the observation of the
interference of conduction paths induced by two donors in a nano-MOSFET
resulting in a Fano resonance. This demonstrates the coherent exchange of
electrons between two donors. In addition, the phase difference between the two
conduction paths can be tuned by means of a magnetic field, in full analogy to
the Aharonov-Bohm effect.
","[{""version"":""v1"",""created"":""Fri, 11 Dec 2009 10:47:00 GMT""}]","2015-05-14"
"0912.2197","Fedele Lizzi","J.F. Carinena, J.M. Gracia-Bondia, Fedele Lizzi, Giuseppe Marmo and
  Patrizia Vitale","Star-product in the presence of a monopole",,"Phys.Lett.A374:3614-3618,2010","10.1016/j.physleta.2010.06.069","DSF/19/2009 LPT ORSAY 09.108, ICCUB-09-427","math-ph hep-th math.MP","http://arxiv.org/licenses/nonexclusive-distrib/1.0/","  We present a deformed star-product for a particle in the presence of a
magnetic monopole. The product is obtained within a self-dual
quantization-dequantization scheme, with the correspondence between classical
observables and operators defined with the help of a quaternionic Hilbert
space, following work by Emch and Jadczyk. The resulting product is well
defined for a large class of complex functions and reproduces (at first order
in hbar) the Poisson structure of the particle in the monopole field. The
product is associative only for quantized monopole charges, thus incorporating
Dirac's quantization requirement.
","[{""version"":""v1"",""created"":""Fri, 11 Dec 2009 10:52:54 GMT""}]","2014-11-20"
"0912.2198","K. Shizuya","K. Shizuya","Pseudo-zero-mode Landau levels and pseudospin waves in bilayer graphene","4 pages, 2 figures, ep2ds18, Physica E",,"10.1016/j.physe.2009.11.055","YITP-09-95","cond-mat.mes-hall","http://arxiv.org/licenses/nonexclusive-distrib/1.0/","  Bilayer graphene in a magnetic field supports eight zero-energy Landau
levels, which, as a tunable band gap develops, evolve into two
nearly-degenerate quartets separated by the band gap. A close look is made into
the properties of such an isolated quartet of pseudo-zero-mode levels at half
filling in the presence of an in-plane electric field and the Coulomb
interaction. The pseudo-zero-mode levels turn out to support, via orbital
mixing, charge carriers with induced electric dipole moment, which lead to
characteristic collective excitations, pseudospin waves, with some controllable
features; possible experimental signals are discussed.
","[{""version"":""v1"",""created"":""Fri, 11 Dec 2009 10:56:03 GMT""}]","2015-05-14"
"0912.2199","Andrea Gabrielli","Mauro Conti, Roberto Di Pietro, Andrea Gabrielli, Luigi V. Mancini,
  and Alessandro Mei","The Smallville Effect: Social Ties Make Mobile Networks More Secure
  Against the Node Capture Attack",,,,,"cs.CR cs.NI","http://arxiv.org/licenses/nonexclusive-distrib/1.0/","  Mobile Ad Hoc networks, due to the unattended nature of the network itself
and the dispersed location of nodes, are subject to several unique security
issues. One of the most vexed security threat is node capture. A few solutions
have already been proposed to address this problem; however, those solutions
are either centralized or focused on theoretical mobility models alone. In the
former case the solution does not fit well the distributed nature of the
network while, in the latter case, the quality of the solutions obtained for
realistic mobility models severely differs from the results obtained for
theoretical models. The rationale of this paper is inspired by the observation
that re-encounters of mobile nodes do elicit a form of social ties. Leveraging
these ties, it is possible to design efficient and distributed algorithms that,
with a moderated degree of node cooperation, enforce the emergent property of
node capture detection. In particular, in this paper we provide a proof of
concept proposing a set of algorithms that leverage, to different extent, node
mobility and node cooperation--that is, identifying social ties--to thwart node
capture attack. In particular, we test these algorithms on a realistic mobility
scenario. Extensive simulations show the quality of the proposed solutions and,
more important, the viability of the proposed approach.
","[{""version"":""v1"",""created"":""Fri, 11 Dec 2009 11:05:57 GMT""}]","2016-09-08"
"0912.2200","Evgeny Ivanov","A.P. Isaev and E.A. Ivanov","Nonabelian N=2 Superstrings","32 pages, electronic version of ICTP preprint IC/90/97",,,"IC/90/97","hep-th","http://arxiv.org/licenses/nonexclusive-distrib/1.0/","  The Green-Schwarz covariant N=2 superstring action can be consistently
deduced as the action of the Wess-Zumino-Witten (WZW) sigma model defined on
the direct product of two N=1, D=10 Poincar\'e supertranslation groups.
Generalizing this result, we construct new WZW sigma models on the supergroups
with a nonabelian even part and interpret them as models of superstrings moving
on the supergroup manifolds. We show that these models are completely
integrable and in some special cases possess fermionic kappa-symmetry.
","[{""version"":""v1"",""created"":""Fri, 11 Dec 2009 11:16:52 GMT""}]","2009-12-14"
"0912.2201","Reginald Smith","Reginald D. Smith","Crossing the Line: Towards increasingly fruitful complex systems
  research for the physics community","15 pages",,,,"physics.gen-ph physics.pop-ph","http://arxiv.org/licenses/nonexclusive-distrib/1.0/","  This article addresses broad trends in interdisciplinary research in physics
where interactions with colleagues in fields such as computer science, ecology,
or economics can often be derailed by unintentional clashes of methodologies
and perspectives on the core science. Key causes of such breakdowns in
interdisciplinary work are detailed and solutions offered.
","[{""version"":""v1"",""created"":""Fri, 11 Dec 2009 13:35:39 GMT""},{""version"":""v2"",""created"":""Mon, 28 Dec 2009 12:07:42 GMT""},{""version"":""v3"",""created"":""Mon, 26 Sep 2011 15:51:32 GMT""}]","2011-09-27"
