"0912.3364","Nicolas Lodieu","N. Lodieu (1,2), M. R. Zapatero Osorio (3), E. L. Martin (3), E.
  Solano (3), M. Aberaturi (3) ((1) IAC, Tenerife, Spain (2) University of La
  Laguna, Tenerife, Spain, (3) Centro de Astrobiologia, CSIC-INTA, Madrid,
  Spain)","GTC Osiris spectroscopic identification of a faint L subdwarf in the
  UKIRT Infrared Deep Sky Survey","5 pages, 1 table, 3 figures, published in ApJ Letters (January 2010
  issue)",,"10.1088/2041-8205/708/2/L107",,"astro-ph.SR","http://arxiv.org/licenses/nonexclusive-distrib/1.0/","  We present the discovery of an L subdwarf in 234 square degrees common to the
UK Infrared Telescope (UKIRT) Infrared Deep Sky Survey Large Area Survey Data
Release 2 and the Sloan Digital Sky Survey Data Release 3. This is the fifth L
subdwarf announced to date, the first one identified in the UKIRT Infrared Deep
Sky Survey, and the faintest known. The blue optical and near-infrared colors
of ULAS J135058.86+081506.8 and its overall spectra energy distribution are
similar to the known mid-L subdwarfs. Low-resolution optical (700-1000 nm)
spectroscopy with the Optical System for Imaging and low Resolution Integrated
Spectroscopy spectrograph on the 10.4 m Gran Telescopio de Canarias reveals
that ULAS J135058.86+081506.8 exhibits a strong KI pressure-broadened line at
770 nm and a red slope longward of 800 nm, features characteristics of L-type
dwarfs. From direct comparison with the four known L subdwarfs, we estimate its
spectral type to be sdL4-sdL6 and derive a distance in the interval 94-170 pc.
We provide a rough estimate of the space density for mid-L subdwarfs of
1.5x10^(-4) pc^(-3).
","[{""version"":""v1"",""created"":""Thu, 17 Dec 2009 10:40:50 GMT""}]","2015-05-14"
"0912.3365","Istv?n Prause","Istv\'an Prause, Xavier Tolsa, Ignacio Uriarte-Tuero","Hausdorff measure of quasicircles","15 pages","Adv. Math. 229 (2) 2012, 1313-1328","10.1016/j.aim.2011.11.001",,"math.CV","http://arxiv.org/licenses/nonexclusive-distrib/1.0/","  S. Smirnov proved recently that the Hausdorff dimension of any K-quasicircle
is at most 1+k^2, where k=(K-1)/(K+1). In this paper we show that if $\Gamma$
is such a quasicircle, then $H^{1+k^2}(B(x,r)\cap \Gamma)\leq C(k) r^{1+k^2}$
for all x in \C and r>0, where H^s stands for the s-Haudorff measure. On a
related note we derive a sharp weak-integrability of the derivative of the
Riemann map of a quasidisk.
","[{""version"":""v1"",""created"":""Thu, 17 Dec 2009 11:24:05 GMT""}]","2012-01-16"
"0912.3366","Sandro Coriasco","Sandro Coriasco, Karoline Johansson and Joachim Toft","Global wave-front sets of Banach, Fr{\'e}chet and Modulation space
  types, and pseudo-differential operators","51 pages, mistakes and typos correction, reorganized materials","J. Differential Equations 254, 8, 3228-3258 (2013)","10.1016/j.jde.2013.01.014",,"math.FA","http://arxiv.org/licenses/nonexclusive-distrib/1.0/","  We introduce global wave-front sets $\operatorname{WF}_{{\mathcal B}} (f)$,
$f\in {\mathscr S}^\prime(\textbf{R}^d)$, with respect to suitable Banach or
Fr\'echet spaces ${\mathcal B}$. An important special case is given by the
modulation spaces ${\mathcal B}=M(\omega,\mathscr B)$, where $\omega$ is an
appropriate weight function and $\mathscr B$ is a translation invariant Banach
function space. We show that the standard properties for known notions of
wave-front set extend to $\operatorname{WF}_{{\mathcal B}} (f)$. In particular,
we prove that micro locality and microellipticity hold for a class of globally
defined pseudo-differential operators $\operatorname{Op}_t(a)$, acting
continuously on the involved spaces.
","[{""version"":""v1"",""created"":""Thu, 17 Dec 2009 11:01:17 GMT""},{""version"":""v2"",""created"":""Thu, 26 Jun 2014 00:26:52 GMT""},{""version"":""v3"",""created"":""Fri, 27 Jun 2014 22:53:34 GMT""}]","2014-07-01"
"0912.3367","Savita Mathur","S. Mathur, R.A. Garcia, C. Regulo, O.L. Creevey, J. Ballot, D.
  Salabert, T. Arentoft, P.-O. Quirion, W.J. Chaplin, and H. Kjeldsen","Determining global parameters of the oscillations of solar-like stars","15 pages, 17 figures, accepted for publication in A&A",,"10.1051/0004-6361/200913266",,"astro-ph.SR","http://arxiv.org/licenses/nonexclusive-distrib/1.0/","  Helioseismology has enabled us to better understand the solar interior, while
also allowing us to better constrain solar models. But now is a tremendous
epoch for asteroseismology as space missions dedicated to studying stellar
oscillations have been launched within the last years (MOST and CoRoT). CoRoT
has already proved valuable results for many types of stars, while Kepler,
which was launched in March 2009, will provide us with a huge number of seismic
data very soon. This is an opportunity to better constrain stellar models and
to finally understand stellar structure and evolution. The goal of this
research work is to estimate the global parameters of any solar-like
oscillating target in an automatic manner. We want to determine the global
parameters of the acoustic modes (large separation, range of excited pressure
modes, maximum amplitude, and its corresponding frequency), retrieve the
surface rotation period of the star and use these results to estimate the
global parameters of the star (radius and mass).To prepare the analysis of
hundreds of solar-like oscillating stars, we have developed a robust and
automatic pipeline. The pipeline consists of data analysis techniques, such as
Fast Fourier Transform, wavelets, autocorrelation, as well as the application
of minimisation algorithms for stellar-modelling. We apply our pipeline to some
simulated lightcurves from the asteroFLAG team and the Aarhus-asteroFLAG
simulator, and obtain results that are consistent with the input data to the
simulations. Our strategy gives correct results for stars with magnitudes below
11 with only a few 10% of bad determinations among the reliable results. We
then apply the pipeline to the Sun and three CoRoT targets.In particular we
determine the parameters of the Sun, HD49933, HD181906, and HD181420.
","[{""version"":""v1"",""created"":""Thu, 17 Dec 2009 11:07:28 GMT""},{""version"":""v2"",""created"":""Mon, 10 May 2010 01:11:58 GMT""}]","2015-05-14"
"0912.3368","Orestis Efthimiou","O. Efthimiou, K. Tamvakis","Inflation with the right-handed sneutrino revisited","9 pages, 3 figures","Phys.Lett.B685:235-238,2010","10.1016/j.physletb.2010.02.001",,"hep-ph","http://arxiv.org/licenses/nonexclusive-distrib/1.0/","  We consider an extension of nuMSSM with an extra U(1) that realizes D-term
inflation driven by the right-handed sneutrino. Non-renormalizable terms in the
Kahler potential and the superpotential are considered, the latter controlled
by a suitable discrete R-symmetry. We find that, for subplanckian inflaton
values, the predictions of inflationary parameters are compatible with
observations, establishing the right-handed sneutrino driven inflation as a
viable scenario.
","[{""version"":""v1"",""created"":""Thu, 17 Dec 2009 11:07:29 GMT""}]","2014-11-20"
"0912.3369","Pablo G. Camara","Pablo G. Camara, Cezar Condeescu, Emilian Dudas","Holomorphic variables in magnetized brane models with continuous Wilson
  lines","9 pages, no figures; v2: conventions for Wilson lines changed, major
  simplifications in expressions, discussions extended, typos corrected, some
  references added","JHEP 1004:029,2010","10.1007/JHEP04(2010)029","CERN-PH-TH-2009-254, CPHT-RR136.1209","hep-th","http://arxiv.org/licenses/nonexclusive-distrib/1.0/","  We analyze the action of the target-space modular group in toroidal type IIB
orientifold compactifications with magnetized D-branes and continuous Wilson
lines. The transformation of matter fields agree with that of twisted fields in
heterotic compactifications, constituting a check of type I/heterotic duality.
We identify the holomorphic N = 1 variables for these compactifications. Matter
fields and closed string moduli are both redefined by open string moduli. The
redefinition of matter fields can be read directly from the perturbative Yukawa
couplings, whereas closed string moduli redefinitions are obtained from D-brane
instanton superpotential couplings. The resulting expressions reproduce and
generalize, in the presence of internal magnetic fields, previous results in
the literature.
","[{""version"":""v1"",""created"":""Thu, 17 Dec 2009 11:15:27 GMT""},{""version"":""v2"",""created"":""Fri, 19 Mar 2010 18:35:36 GMT""}]","2014-11-20"
"0912.3370","Syksy Rasanen","Syksy Rasanen","Light propagation in statistically homogeneous and isotropic universes
  with general matter content","42 pages, no figures. v2: Corrected one detail about the angular
  diameter distance and two typos. No change in results","JCAP 1003:018,2010","10.1088/1475-7516/2010/03/018",,"astro-ph.CO gr-qc","http://arxiv.org/licenses/nonexclusive-distrib/1.0/","  We derive the relationship of the redshift and the angular diameter distance
to the average expansion rate for universes which are statistically homogeneous
and isotropic and where the distribution evolves slowly, but which have
otherwise arbitrary geometry and matter content. The relevant average expansion
rate is selected by the observable redshift and the assumed symmetry properties
of the spacetime. We show why light deflection and shear remain small. We write
down the evolution equations for the average expansion rate and discuss the
validity of the dust approximation.
","[{""version"":""v1"",""created"":""Thu, 17 Dec 2009 12:45:18 GMT""},{""version"":""v2"",""created"":""Tue, 18 Dec 2012 16:51:26 GMT""}]","2012-12-19"
"0912.3371","Sergei Kukhlevsky V","M. Mechler, S.V. Kukhlevsky, A. Mechler, D. McNaughton","Resonance enhancement effects in Raman-enhancing pyramid-like V-shape
  groove microstructures",,,,,"physics.optics","http://arxiv.org/licenses/nonexclusive-distrib/1.0/","  Microscopic pyramidal pits in a reflective surface, a geometry similar to a
retroreflector, are frequently used to enhance signal strength. The enhancement
effect is generally attributed to surface plasmons, however, the sub-wavelength
to near-wavelength dimensions of the pyramidal 3D geometry suggest
contributions from diffraction and near-field effects. Our theoretical analysis
of the light intensity distribution in the similar (but simpler) 2D geometry
assuming a perfect conductor screen, that is, in the absence of any plasmon
effects, shows that interference patterns forming within the cavity cause a
significant resonant increase in local intensity. Such effect can be important
for many applications, especially for the widely used Raman spectroscopy.
Resonant enhancement without plasmons of the emitted Raman signal due to
enhanced local field amplitude is also possible, which implies that the
geometry practically implements a Raman laser. Comparison of diffraction
patterns obtained with near-field and far-field approaches reveals that the
near-field component is responsible for the observed dramatic intensity
enhancement, and thus the Raman enhancement as well.
","[{""version"":""v1"",""created"":""Thu, 17 Dec 2009 12:27:30 GMT""}]","2009-12-18"
"0912.3372","Francesco Terranova","R. Battiston, M. Mezzetto, P. Migliozzi, F. Terranova","European facilities for accelerator neutrino physics: perspectives for
  the decade to come","32 pages, 10 figures, to appear in Riv. Nuovo Cimento","Riv.Nuovo Cim.033:313-343,2010","10.1393/ncr/i2010-10055-0",,"hep-ex hep-ph","http://arxiv.org/licenses/nonexclusive-distrib/1.0/","  Very soon a new generation of reactor and accelerator neutrino oscillation
experiments - Double Chooz, Daya Bay, Reno and T2K - will seek for oscillation
signals generated by the mixing parameter theta_13. The knowledge of this angle
is a fundamental milestone to optimize further experiments aimed at detecting
CP violation in the neutrino sector. Leptonic CP violation is a key phenomenon
that has profound implications in particle physics and cosmology but it is
clearly out of reach for the aforementioned experiments. Since late 90's, a
world-wide activity is in progress to design facilities that can access CP
violation in neutrino oscillation and perform high precision measurements of
the lepton counterpart of the Cabibbo-Kobayashi-Maskawa matrix. In this paper
the status of these studies will be summarized, focusing on the options that
are best suited to exploit existing European facilities (firstly CERN and the
INFN Gran Sasso Laboratories) or technologies where Europe has a world
leadership. Similar considerations will be developed in more exotic scenarios -
beyond the standard framework of flavor oscillation among three active
neutrinos - that might appear plausible in the occurrence of anomalous results
from post-MiniBooNE experiments or the CNGS.
","[{""version"":""v1"",""created"":""Thu, 17 Dec 2009 11:23:14 GMT""}]","2014-11-20"
"0912.3373","Pieralberto Sicbaldi","Pieralberto Sicbaldi","Extremal Domains of Big Volume for the First Eigenvalue of the
  Laplace-Beltrami Operator in a Compact Manifold","40 pages",,,,"math.DG","http://arxiv.org/licenses/nonexclusive-distrib/1.0/","  We prove the existence of extremal domains for the first eigenvalue of the
Laplace-Beltrami operator in some compact Riemannian manifolds of dimension $n
\geq 2$, with volume close to the volume of the manifold. If the first
(positive) eigenfunction $\phi_0$ of the Laplace-Beltrami operator over the
manifold is a nonconstant function, these domains are close to the complement
of geodesic balls of small radius whose center is close to the point where
$\phi_0$ attains its maximum. If $\phi_0$ is a constant function and $n \geq
4$, these domains are close to the complement of geodesic balls of small radius
whose center is close to a nondegenerate critical point of the scalar curvature
function.
","[{""version"":""v1"",""created"":""Thu, 17 Dec 2009 11:25:28 GMT""}]","2009-12-18"
"0912.3374","K. Narayan","K. Narayan","On nonsupersymmetric $\BC^4/\BZ_N$, tachyons, terminal singularities and
  flips","Latex, 43pgs incl. appendices, 2 eps figs, v2. minor clarifications
  added, to appear in JHEP",,"10.1007/JHEP03(2010)019",,"hep-th","http://arxiv.org/licenses/nonexclusive-distrib/1.0/","  We investigate nonsupersymmetric $\BC^4/\BZ_N$ orbifold singularities using
their description in terms of the string worldsheet conformal field theory and
its close relation with the toric geometry description of these singularities
and their possible resolutions. Analytic and numerical study strongly suggest
the absence of nonsupersymmetric Type II terminal singularities (i.e. with no
marginal or relevant blowup modes) so that there are always moduli or closed
string tachyons that give rise to resolutions of these singularities, although
supersymmetric and Type 0 terminal singularities do exist. Using gauged linear
sigma models, we analyze the phase structure of these singularities, which
often involves 4-dimensional flip transitions, occurring between resolution
endpoints of distinct topology. We then discuss 4-dim analogs of unstable
conifold-like singularities that exhibit flips, in particular their Type II GSO
projection and the phase structure. We also briefly discuss aspects of
M2-branes stacked at such singularities and nonsupersymmetric $AdS_4\times
S^7/\BZ_N$ backgrounds.
","[{""version"":""v1"",""created"":""Thu, 17 Dec 2009 11:28:56 GMT""},{""version"":""v2"",""created"":""Fri, 12 Feb 2010 07:14:20 GMT""}]","2015-05-14"
"0912.3376","Nicolau C. Saldanha","Ricardo S. Leite, Nicolau C. Saldanha and Carlos Tomei","Convergence rates to deflation of simple shift strategies","19 pages, 2 figures",,,,"math.NA math.SP","http://arxiv.org/licenses/nonexclusive-distrib/1.0/","  The computation of eigenvalues of real symmetric tridiagonal matrices
frequently proceeds by a sequence of QR steps with shifts. We introduce simple
shift strategies, functions sigma satisfying natural conditions, taking each n
x n matrix T to a real number sigma(T). The strategy specifies the shift to be
applied by the QR step at T. Rayleigh and Wilkinson's are examples of simple
shift strategies. We show that if sigma is continuous then there exist initial
conditions for which deflation does not occur, i.e., subdiagonal entries do not
tend to zero. In case of deflation, we consider the rate of convergence to zero
of the (n, n-1) entry: for simple shift strategies this is always at least
quadratic. If the function sigma is smooth in a suitable region and the
spectrum of T does not include three consecutive eigenvalues in arithmetic
progression then convergence is cubic. This implies cubic convergence to
deflation of Wilkinson's shift for generic spectra. The study of the algorithm
near deflation uses tubular coordinates, under which QR steps with shifts are
given by a simple formula.
","[{""version"":""v1"",""created"":""Thu, 17 Dec 2009 11:59:25 GMT""},{""version"":""v2"",""created"":""Fri, 13 Aug 2010 18:40:08 GMT""}]","2010-08-16"
"0912.3377","Francesco Bastianelli","Francesco Bastianelli, Gian Pietro Pirola, Lidia Stoppino","Galois closure and Lagrangian varieties","36 pages, 3 figures","Adv. Math. 225 (2010), 3463-3501",,,"math.AG","http://arxiv.org/licenses/nonexclusive-distrib/1.0/","  We use Galois closures of finite rational maps between complex projective
varieties to introduce a new method for producing varieties such that the
holomorphic part of the cup product map has non-trivial kernel. We then apply
our result to the two-dimensional case and we construct a new family of
surfaces which are Lagrangian in their Albanese variety. Moreover, we analyze
these surfaces computing their Chern invariants, and proving that they are not
fibred over curves of genus greater than one.
","[{""version"":""v1"",""created"":""Thu, 17 Dec 2009 11:58:41 GMT""},{""version"":""v2"",""created"":""Mon, 14 Jun 2010 11:33:29 GMT""}]","2014-10-03"
"0912.3379","Victor Chernyak","V.L. Chernyak","A three-loop check of the 'a - maximization' in SQCD with adjoint(s)","5 pages; the title changed, the text improved and expanded","JETP Lett.91:219-221,2010","10.1134/S0021364010050036",,"hep-th","http://arxiv.org/licenses/nonexclusive-distrib/1.0/","  The 'a - maximization' was introduced by K. Inrtiligator and B. Wecht for
finding anomalous dimensions of chiral superfields at the IR fixed points of
the RG flow. Using known explicit calculations of anomalous dimensions in the
perturbation theory of SQCD (with one or two additional adjoint fields), it is
checked here at the three-loop level.
","[{""version"":""v1"",""created"":""Thu, 17 Dec 2009 12:12:18 GMT""},{""version"":""v2"",""created"":""Tue, 22 Dec 2009 09:24:12 GMT""},{""version"":""v3"",""created"":""Tue, 9 Feb 2010 11:46:50 GMT""}]","2014-11-20"
"0912.3380","Petr Zavada","A.V. Efremov, P. Schweitzer, O.V. Teryaev, P.Zavada","Quark intrinsic motion and the link between TMDs and PDFs in covariant
  approach","5 pages, 3 figures, Contribution to the Proceedings of XIII Workshop
  on High Energy Spin Physics DSPIN-09, Dubna, Russia, September 1-5, 2009",,,,"hep-ph","http://arxiv.org/licenses/nonexclusive-distrib/1.0/","  The relations between TMDs and PDFs are obtained from the symmetry
requirement: relativistic covariance combined with rotationally symmetric
parton motion in the nucleon rest frame. This requirement is applied in the
covariant parton model. Using the usual PDFs as an input, we are obtaining
predictions for some polarized and unpolarized TMDs.
","[{""version"":""v1"",""created"":""Thu, 17 Dec 2009 12:22:33 GMT""},{""version"":""v2"",""created"":""Thu, 17 Dec 2009 22:58:30 GMT""},{""version"":""v3"",""created"":""Thu, 28 Jan 2010 16:18:49 GMT""}]","2010-01-28"
"0912.3381","Qing Chu","Qing Chu (LAMA)","Multiple recurrence for two commuting transformations",,,,,"math.DS","http://arxiv.org/licenses/nonexclusive-distrib/1.0/","  This paper is devoted to a study of the multiple recurrence of two commuting
transformations. We derive a result which is similar but not identical to that
of one single transformation established by Bergelson, Host and Kra. We will
use the machinery of ""magic systems"" established recently by B. Host for the
proof.
","[{""version"":""v1"",""created"":""Thu, 17 Dec 2009 12:13:23 GMT""}]","2009-12-18"
"0912.3382","Yuri Genenko","Yu.A. Genenko, J. Glaum, O. Hirsch, H. Kungl, M.J. Hoffmann, T.
  Granzow","Aging of poled ferroelectric ceramics due to relaxation of random
  depolarization fields by space-charge accumulation near grain boundaries","theory and experiment, 22 pages, 3 figures","Physical Review B 80, 224109 (2009)","10.1103/PhysRevB.80.224109",,"cond-mat.mtrl-sci","http://arxiv.org/licenses/nonexclusive-distrib/1.0/","  Migration of charged point defects triggered by the local random
depolarization field is shown to plausibly explain aging of poled ferroelectric
ceramics providing reasonable time and acceptor concentration dependences of
the emerging internal bias field. The theory is based on the evaluation of the
energy of the local depolarization field caused by mismatch of the
polarizations of neighbor grains. The kinetics of charge migration assumes
presence of mobile oxygen vacancies in the material due to the intentional or
unintentional acceptor doping. Satisfactory agreement of the theory with
experiment on the Fe-doped lead zirconate titanate is demonstrated.
","[{""version"":""v1"",""created"":""Thu, 17 Dec 2009 12:14:17 GMT""}]","2010-01-22"
"0912.3383","Robert Farr","R. S. Farr","Fractal design for efficient brittle plates under gentle pressure
  loading","10 pages, 5 figures","Phys. Rev. E 76, 046601 (2007)","10.1103/PhysRevE.76.046601",,"physics.class-ph physics.gen-ph","http://arxiv.org/licenses/nonexclusive-distrib/1.0/","  We consider a plate made from an isotropic but brittle elastic material,
which is used to span a rigid aperture, across which a small pressure
difference is applied. The problem we address is to find the structure which
uses the least amount of material without breaking. Under a simple set of
physical approximations and for a certain region of the pressure-brittleness
parameter space, we find that a fractal structure in which the plate consists
of thicker spars supporting thinner spars in an hierarchical arrangement gives
a design of high mechanical efficiency.
","[{""version"":""v1"",""created"":""Thu, 17 Dec 2009 12:17:33 GMT""}]","2009-12-18"
"0912.3384","Pekka Lahti","Pekka Lahti, Juha-Pekka Pellonpaa","On the complementarity of the quadrature observables","Dedicated to Peter Mittelstaedt in honour of his eightieth birthday","Found. Phys. 40 (2010) 1419-1428","10.1007/s10701-009-9373-y",,"quant-ph","http://arxiv.org/licenses/nonexclusive-distrib/1.0/","  In this paper we investigate the coupling properties of pairs of quadrature
observables, showing that, apart from the Weyl relation, they share the same
coupling properties as the position-momentum pair. In particular, they are
complementary. We determine the marginal observables of a covariant phase space
observable with respect to an arbitrary rotated reference frame, and observe
that these marginal observables are unsharp quadrature observables. The related
distributions constitute the Radon tranform of a phase space distribution of
the covariant phase space observable. Since the quadrature distributions are
the Radon transform of the Wigner function of a state, we also exhibit the
relation between the quadrature observables and the tomography observable, and
show how to construct the phase space observable from the quadrature
observables. Finally, we give a method to measure together with a single
measurement scheme any complementary pair of quadrature observables.
","[{""version"":""v1"",""created"":""Thu, 17 Dec 2009 12:16:06 GMT""}]","2015-05-14"
"0912.3385","Procheta Mallik","J. C. Brown, P. C. V. Mallik, N. R. Badnell","Revised Results for Non-thermal Recombination Flare Hard X-Ray Emission","6 pages, 8 figures, 1 table",,,,"astro-ph.SR","http://arxiv.org/licenses/nonexclusive-distrib/1.0/","  Brown and Mallik (BM) recently showed that, for hot sources, recombination of
non-thermal electrons (NTR) onto highly ionised heavy ions is not negligible
compared to non-thermal bremsstrahlung (NTB) as a source of flare hard X-rays
(HXRs) and so should be included in modelling non-thermal HXR flare emission.
In view of major discrepancies between BM results for the THERMAL continua and
those of the Chianti code and of RHESSI solar data, we critically re-examine
and correct the BM analysis and modify the conclusions concerning the
importance of NTR. Although the analytic Kramers expression used by BM is
correct for the purely hydrogenic recombination cross section, the heuristic
expressions used by BM to extend the Kramers expression beyond the `bare
nucleus' case to which it applies had serious errors. BM results have therefore
been recalculated using corrected expressions, which have been validated
against the results of detailed calculations. At T ~ 10-30 MK the dominant ions
are Fe 22+, 23+, 24+ for which BM erroneously overestimated NTR emission by
around an order of magnitude. Contrary to the BM claim, NTR in hot flare
plasmas does NOT dominate over NTB, although in some cases it can be comparable
and so still very important in inversions of photon spectra to derive electron
spectra, especially as NTR includes sharp edge features. The BM claim of
dominance of NTR over NTB in deka-keV emission is incorrect due to a serious
error in their analysis. However, the NTR contribution can still be large
enough to demand inclusion in spectral fitting, the spectral edges having
potentially serious effects on inversion of HXR spectra to infer fast electron
spectra.
","[{""version"":""v1"",""created"":""Thu, 17 Dec 2009 12:29:35 GMT""},{""version"":""v2"",""created"":""Wed, 24 Feb 2010 18:52:02 GMT""}]","2010-02-24"
