"0912.3278","Cynthia J. Olson Reichhardt","C. Reichhardt and C.J. Olson Reichhardt","Shear Banding and Spatiotemporal Oscillations in Vortex Matter in
  Nanostructured Superconductors","4 pages, 4 postscript figures","Phys. Rev. B Rapid Communications 81, 100506(R) (2010)","10.1103/PhysRevB.81.100506",,"cond-mat.supr-con cond-mat.soft","http://arxiv.org/licenses/nonexclusive-distrib/1.0/","  We propose a simple nanostructured pinning array geometry where a rich
variety of complex vortex shear banding phenomena can be realized. A single row
of pinning sites is removed from a square pinning array. Shear banding effects
arise when vortex motion in the pin-free channel nucleates motion of vortices
in the surrounding pinned regions, creating discrete steps in the vortex
velocity profile away from the channel. Near the global depinning transition,
the width of the band of moving vortices undergoes oscillations or fluctuations
that can span the entire system. We use simulations to show that these effects
should be observable in the transport properties of the system. Similar large
oscillations and shear banding effects are known to occur for sheared complex
fluids in which different dynamical phases coexist.
","[{""version"":""v1"",""created"":""Wed, 16 Dec 2009 22:17:01 GMT""}]","2015-05-14"
"0912.3279","Francesco Toppan","L. Faria Carvalho, Z. Kuznetsova and F. Toppan","Supersymmetric Extension of Hopf Maps: N=4 sigma-models and the S^3 ->
  S^2 Fibration","24 pages","Nucl.Phys.B834:237-257,2010","10.1016/j.nuclphysb.2010.03.017","CBPF-NF-011/09","hep-th math-ph math.MP","http://arxiv.org/licenses/nonexclusive-distrib/1.0/","  We discuss four off-shell N=4 D=1 supersymmetry transformations, their
associated one-dimensional sigma-models and their mutual relations. They are
given by I) the (4,4)_{lin} linear supermultiplet (supersymmetric extension of
R^4), II) the (3,4,1)_{lin} linear supermultiplet (supersymmetric extension of
R^3), III) the (3,4,1)_{nl} non-linear supermultiplet living on S^3 and IV) the
(2,4,2)_{nl} non-linear supermultiplet living on S^2. The I -> II map is the
supersymmetric extension of the R^4 -> R^3 bilinear map, while the II -> IV map
is the supersymmetric extension of the S^3 -> S^2 first Hopf fibration. The
restrictions on the S^3, S^2 spheres are expressed in terms of the
stereographic projections. The non-linear supermultiplets, whose
supertransformations are local differential polynomials, are not equivalent to
the linear supermultiplets with the same field content. The sigma-models are
determined in terms of an unconstrained prepotential of the target coordinates.
The Uniformization Problem requires solving an inverse problem for the
prepotential. The basic features of the supersymmetric extension of the second
and third Hopf maps are briefly sketched. Finally, the Schur's lemma (i.e. the
real, complex or quaternionic property) is extended to all minimal linear
supermultiplets up to N<=8.
","[{""version"":""v1"",""created"":""Wed, 16 Dec 2009 22:22:34 GMT""}]","2010-04-21"
"0912.3280","Jeff Forshaw","T.D. Coughlin and J.R. Forshaw","Central Exclusive Production in QCD","41 pages, 19 figures; minor typos fixed; version published in JHEP","JHEP 1001:121,2010","10.1007/JHEP01(2010)121","MAN/HEP/2009/46","hep-ph","http://arxiv.org/licenses/nonexclusive-distrib/1.0/","  We investigate the theoretical description of the central exclusive
production process, h1+h2 -> h1+X+h2. Taking Higgs production as an example, we
sum logarithmically enhanced corrections appearing in the perturbation series
to all orders in the strong coupling. Our results agree with those originally
presented by Khoze, Martin and Ryskin except that the scale appearing in the
Sudakov factor, mu=0.62 \sqrt{\hat{s}}, should be replaced with
mu=\sqrt{\hat{s}}, where \sqrt{\hat{s}} is the invariant mass of the centrally
produced system. We confirm this result using a fixed-order calculation and
show that the replacement leads to approximately a factor 2 suppression in the
cross-section for central system masses in the range 100-500 GeV.
","[{""version"":""v1"",""created"":""Wed, 16 Dec 2009 22:23:14 GMT""},{""version"":""v2"",""created"":""Wed, 10 Feb 2010 15:45:23 GMT""}]","2014-11-20"
"0912.3281","Petr Sulc","Konstantin Turitsyn, Petr Sulc, Scott Backhaus, Michael Chertkov","Distributed control of reactive power flow in a radial distribution
  circuit with high photovoltaic penetration","6 pages, 5 figures;","Proceedings of IEEE PES General Meeting 2010","10.1109/PES.2010.5589663",,"math.OC","http://arxiv.org/licenses/nonexclusive-distrib/1.0/","  We show how distributed control of reactive power can serve to regulate
voltage and minimize resistive losses in a distribution circuit that includes a
significant level of photovoltaic (PV) generation. To demonstrate the
technique, we consider a radial distribution circuit with a single branch
consisting of sequentially-arranged residential-scale loads that consume both
real and reactive power. In parallel, some loads also have PV generation
capability. We postulate that the inverters associated with each PV system are
also capable of limited reactive power generation or consumption, and we seek
to find the optimal dispatch of each inverter's reactive power to both maintain
the voltage within an acceptable range and minimize the resistive losses over
the entire circuit. We assume the complex impedance of the distribution circuit
links and the instantaneous load and PV generation at each load are known. We
compare the results of the optimal dispatch with a suboptimal local scheme that
does not require any communication. On our model distribution circuit, we
illustrate the feasibility of high levels of PV penetration and a significant
(20% or higher) reduction in losses.
","[{""version"":""v1"",""created"":""Wed, 16 Dec 2009 22:47:05 GMT""}]","2016-11-18"
"0912.3282","Claus Ernst","Yuanan Diao, Claus Ernst, Attila Por, Uta Ziegler","The Ropelengths of Knots Are Almost Linear in Terms of Their Crossing
  Numbers","53 pages, 28 figures",,,,"math.GT","http://arxiv.org/licenses/nonexclusive-distrib/1.0/","  For a knot or link K, let L(K) be the ropelength of K and Cr(K) be the
crossing number of K. In this paper, we show that there exists a constant a>0
such that L(K) is bounded above by a Cr(K) ln^5 (Cr(K)) for any knot K. This
result shows that the upper bound of the ropelength of any knot is almost
linear in terms of its minimum crossing number.
","[{""version"":""v1"",""created"":""Wed, 16 Dec 2009 23:08:10 GMT""}]","2009-12-18"
"0912.3283","D. J. Pisano","D.J. Pisano (WVU/NRAO), C. Garland (Castleton State College), K.
  Rabidoux, S. Wolfe (WVU), R. Guzman, J. Perez-Gallego (Florida), F.J.
  Castander (IEEC/CSIC)","The Evolution of Luminous Compact Blue Galaxies: Disks or Spheroids?","4 pages, 1 figure, to appear in ""Hunting for the Dark: The Hidden
  Side of Galaxy Formation"", Malta, 19-23 Oct. 2009, eds. V.P. Debattista &
  C.C. Popescu, AIP Conf. Ser","AIP Conf.Proc.1240:119-122,2010","10.1063/1.3458464",,"astro-ph.CO","http://arxiv.org/licenses/nonexclusive-distrib/1.0/","  Luminous compact blue galaxies (LCBGs) are a diverse class of galaxies
characterized by high luminosities, blue colors, and high surface brightnesses.
Residing at the high luminosity, high mass end of the blue sequence, LCBGs sit
at the critical juncture of galaxies that are evolving from the blue to the red
sequence. Yet we do not understand what drives the evolution of LCBGs, nor how
they will evolve. Based on single-dish HI observations, we know that they have
a diverse range of properties. LCBGs are HI-rich with M(HI)=10^{9-10.5} M(sun),
have moderate M(dyn)=10^{10-12} M(sun), and 80% have gas depletion timescales
less than 3 Gyr. These properties are consistent with LCBGs evolving into
low-mass spirals or high mass dwarf ellipticals or dwarf irregulars. However,
LCBGs do not follow the Tully-Fisher relation, nor can most evolve onto it,
implying that many LCBGs are not smoothly rotating, virialized systems. GMRT
and VLA HI maps confirm this conclusion revealing signatures of recent
interactions and dynamically hot components in some local LCBGs, consistent
with the formation of a thick disk or spheroid. Such signatures and the high
incidence of close companions around LCBGs suggest that star formation in local
LCBGs is likely triggered by interactions. The dynamical masses and apparent
spheroid formation in LCBGs combined with previous results from optical
spectroscopy are consistent with virial heating being the primary mechanism for
quenching star formation in these galaxies.
","[{""version"":""v1"",""created"":""Wed, 16 Dec 2009 22:48:37 GMT""}]","2014-11-20"
"0912.3284","Lei-Han Tang","Lei-Han Tang","Gauge glass in two dimensions","10 pages, no figure, to appear in Proceedings of YKIS 2009 Workshop:
  Frontiers of Nonequilibrium Physics",,"10.1143/PTPS.184.429",,"cond-mat.dis-nn cond-mat.soft","http://arxiv.org/licenses/nonexclusive-distrib/1.0/","  The gauge glass model offers an interesting example of a randomly frustrated
system with a continuous O(2) symmetry. In two dimensions, the existence of a
glass phase at low temperatures has long been disputed among numerical studies.
To resolve this controversy, we examine the behavior of vortices whose movement
generates phase slips that destroy phase rigidity at large distances. Detailed
analytical and numerical studies of the corresponding Coulomb gas problem in a
random potential establish that the ground state, with a finite density of
vortices, is polarizable with a scale-dependent dielectric susceptibility.
Screening by vortex/antivortex pairs of arbitrarily large size is present to
eliminate the logarithmic divergence of the Coulomb energy of a single vortex.
The observed power-law decay of the Coulomb interaction between vortices with
distance in the ground state leads to a power-law divergence of the glass
correlation length with temperature $T$. It is argued that free vortices
possess a bound excitation energy and a nonzero diffusion constant at any
$T>0$.
","[{""version"":""v1"",""created"":""Wed, 16 Dec 2009 22:37:14 GMT""}]","2015-05-14"
"0912.3286","Nikolai M. Chtchelkatchev","N.M. Chtchelkatchev, T.I. Baturina, A. Glatz, and V.M. Vinokur","Synchronized Andreev Transmission in SNS Junction Arrays","5 pages, 4 figures","Phys. Rev. B 82, 024526 (2010)","10.1103/PhysRevB.82.024526",,"cond-mat.mes-hall cond-mat.supr-con","http://arxiv.org/licenses/nonexclusive-distrib/1.0/","  We construct a nonequilibrium theory for the charge transfer through a
diffusive array of alternating normal (N) and superconducting (S) islands
comprising an SNSNS junction, with the size of the central S-island being
smaller than the energy relaxation length. We demonstrate that in the
nonequilibrium regime the central island acts as Andreev retransmitter with the
Andreev conversions at both NS interfaces of the central island correlated via
over-the-gap transmission and Andreev reflection. This results in a
synchronized transmission at certain resonant voltages which can be
experimentally observed as a sequence of spikes in the differential
conductivity.
","[{""version"":""v1"",""created"":""Wed, 16 Dec 2009 22:49:32 GMT""},{""version"":""v2"",""created"":""Wed, 3 Feb 2010 20:07:03 GMT""}]","2010-08-06"
"0912.3288","Leslie Rogers","L. A. Rogers, S. Seager","A Framework for Quantifying the Degeneracies of Exoplanet Interior
  Compositions","20 pages, 10 figures, published in ApJ","Astrophys.J.712:974-991,2010","10.1088/0004-637X/712/2/974",,"astro-ph.EP","http://arxiv.org/licenses/nonexclusive-distrib/1.0/","  Several transiting super-Earths are expected to be discovered in the coming
few years. While tools to model the interior structure of transiting planets
exist, inferences about the composition are fraught with ambiguities. We
present a framework to quantify how much we can robustly infer about
super-Earth and Neptune-size exoplanet interiors from radius and mass
measurements. We introduce quaternary diagrams to illustrate the range of
possible interior compositions for planets with four layers (iron core,
silicate mantles, water layers, and H/He envelopes). We apply our model to
CoRoT-7b, GJ 436b, and HAT-P-11b. Interpretation of planets with H/He envelopes
is limited by the model uncertainty in the interior temperature, while for
CoRoT-7b observational uncertainties dominate. We further find that our planet
interior model sharpens the observational constraints on CoRoT-7b's mass and
radius, assuming the planet does not contain significant amounts of water or
gas. We show that the strength of the limits that can be placed on a
super-Earth's composition depends on the planet's density; for similar
observational uncertainties, high-density super-Mercuries allow the tightest
composition constraints. Finally, we describe how techniques from Bayesian
statistics can be used to take into account in a formal way the combined
contributions of both theoretical and observational uncertainties to
ambiguities in a planet's interior composition. On the whole, with only a mass
and radius measurement an exact interior composition cannot be inferred for an
exoplanet because the problem is highly underconstrained. Detailed quantitative
ranges of plausible compositions, however, can be found.
","[{""version"":""v1"",""created"":""Wed, 16 Dec 2009 23:15:55 GMT""},{""version"":""v2"",""created"":""Fri, 4 Jun 2010 20:19:04 GMT""}]","2014-11-20"
"0912.3289","Maxim Konyushikhin","Evgeny A. Ivanov, Maxim A. Konyushikhin, Andrei V. Smilga","SQM with Non-Abelian Self-Dual Fields: Harmonic Superspace Description","15 pages, minor additions and changes; published version","JHEP 1005:033,2010","10.1007/JHEP05(2010)033","ITEP-TH-81/09","hep-th","http://arxiv.org/licenses/nonexclusive-distrib/1.0/","  We present a Lagrangian formulation for N=4 supersymmetric quantum-mechanical
systems describing the motion in external non-Abelian self-dual gauge fields.
For any such system, one can write a component supersymmetric Lagrangian by
introducing extra bosonic variables with topological Chern-Simons type
interaction. For a special class of such system when the fields are expressed
in the `t Hooft ansatz form, it is possible to give a superfield description
using harmonic superspace formalism. As a new explicit example, the N=4
mechanics with Yang monopole is constructed.
","[{""version"":""v1"",""created"":""Wed, 16 Dec 2009 23:20:02 GMT""},{""version"":""v2"",""created"":""Fri, 7 May 2010 21:04:57 GMT""}]","2010-05-25"
"0912.3290","Zhen-Qing Chen","Zhen-Qing Chen and Kazuhiro Kuwae","On subhamonicity for symmetric Markov processes",,,,,"math.PR math.AP","http://arxiv.org/licenses/nonexclusive-distrib/1.0/","  We establish the equivalence of the analytic and probabilistic notions of
subharmonicity in the framework of general symmetric Hunt processes on locally
compact separable metric spaces, extending an earlier work of the first named
author on the equivalence of the analytic and probabilistic notions of
harmonicity. As a corollary, we prove a strong maximum principle for locally
bounded finely continuous subharmonic functions in the space of functions
locally in the domain of the Dirichlet form under some natural conditions.
","[{""version"":""v1"",""created"":""Wed, 16 Dec 2009 23:46:27 GMT""}]","2009-12-18"
"0912.3292","M.P. Singh","M.P. Singh, K.D. Truong, S. Jandl, and P. Fournier","Multiferroic double perovskites: Opportunities, Issues and Challenges","12 pages, 3 figures",,"10.1063/1.3362922",,"cond-mat.mtrl-sci","http://arxiv.org/licenses/nonexclusive-distrib/1.0/","  Despite the great technological and scientific importance, a well-controlled
coupled behavior in magnetoelectric multiferroic materials at room temperature
remains challenging. We demonstrate that the self-ordered A2BBO6 (e.g., A = La,
B = Mn, and B = Ni) double perovskites provide a unique alternative opportunity
to control and/or to induce such behavior in oxides. In this paper, we outline
and discuss the various challenges and bottleneck issues related to this class
of materials using La2NiMnO6 as a prototype. Details of the synthesis
strategies, using pulsed laser deposition as a central tool, to obtain a
meticulous control over cation ordering is illustrated. The possible impact of
Ni/Mn cation ordering on the magnetic ground states, ferromagnetic transition
temperature, phonon behavior, and spin-phonon coupling are presented. Our
results are also compared with the current literature on related compounds.
","[{""version"":""v1"",""created"":""Thu, 17 Dec 2009 00:20:00 GMT""}]","2015-05-14"
"0912.3293","Robin Selinger","Badel L. Mbanga, Fangfu Ye, Jonathan V. Selinger, and Robin L. B.
  Selinger","Modeling elastic instabilities in nematic elastomers","4 pages, 6 figures","Phys. Rev. E 82, 051701 (2010)","10.1103/PhysRevE.82.051701",,"cond-mat.soft cond-mat.mtrl-sci","http://arxiv.org/licenses/nonexclusive-distrib/1.0/","  Liquid crystal elastomers are cross-linked polymer networks covalently bonded
with liquid crystal mesogens. In the nematic phase, due to strong coupling
between mechanical strain and orientational order, these materials display
strain-induced instabilities associated with formation and evolution of
orientational domains. Using a 3-d finite element elastodynamics simulation, we
investigate one such instability, the onset of stripe formation in a monodomain
film stretched along an axis perpendicular to the nematic director. In our
simulation we observe the formation of striped domains with alternating
director rotation. This model allows us to explore the fundamental physics
governing dynamic mechanical response of nematic elastomers and also provides a
potentially useful computational tool for engineering device applications.
","[{""version"":""v1"",""created"":""Thu, 17 Dec 2009 00:30:54 GMT""}]","2011-11-04"
"0912.3294","Liang Fu","Liang Fu and Erez Berg","Odd-Parity Topological Superconductors: Theory and Application to
  Cu$_x$Bi$_2$Se$_3$","4.1 pages, 2 figures","Phys. Rev. Lett. 105, 097001 (2010)","10.1103/PhysRevLett.105.097001",,"cond-mat.supr-con cond-mat.mtrl-sci","http://arxiv.org/licenses/nonexclusive-distrib/1.0/","  Topological superconductors have been theoretically predicted as a new class
of time-reversal-invariant superconductors which are fully gapped in the bulk
but have protected gapless surface Andreev bound states. In this work, we
provide a simple criterion that directly identifies this topological phase in
\textit{odd-parity} superconductors. We next propose a two-orbital $U-V$
pairing model for the newly discovered superconductor Cu$_x$Bi$_2$Se$_3$%. Due
to its peculiar three-dimensional Dirac band structure, we find that an
inter-orbital triplet pairing with odd-parity is favored in a significant part
of the phase diagram, and therefore gives rise to a topological superconductor
phase. Finally we propose sharp experimental tests of such a pairing symmetry.
","[{""version"":""v1"",""created"":""Thu, 17 Dec 2009 12:52:30 GMT""}]","2013-05-29"
"0912.3295","Peter J. Bickel","Peter J. Bickel, Ying Xu","Discussion of: Brownian distance covariance","Published in at http://dx.doi.org/10.1214/09-AOAS312A the Annals of
  Applied Statistics (http://www.imstat.org/aoas/) by the Institute of
  Mathematical Statistics (http://www.imstat.org)","Annals of Applied Statistics 2009, Vol. 3, No. 4, 1266-1269","10.1214/09-AOAS312A","IMS-AOAS-AOAS312A","math.ST stat.AP stat.TH","http://arxiv.org/licenses/nonexclusive-distrib/1.0/","  Discussion on ""Brownian distance covariance"" by G\'{a}bor J. Sz\'{e}kely and
Maria L. Rizzo [arXiv:1010.0297]
","[{""version"":""v1"",""created"":""Thu, 17 Dec 2009 00:58:07 GMT""},{""version"":""v2"",""created"":""Wed, 6 Oct 2010 05:29:35 GMT""}]","2010-10-07"
"0912.3296","Fabio Giuseppe Pusateri","Fabio Pusateri","On the limit as the surface tension and density ratio tend to zero for
  the two-phase Euler equations","Revised version, to appear. In the condition $\rho_- \leq
  \epsilon^{7/3}$, the exponent is now improved to 3/2. The vorticity of the
  outer velocity field has been added to the Energy, and a few arguments have
  been changed accordingly. Other minor changes. Typos corrected",,,,"math.AP","http://arxiv.org/licenses/nonexclusive-distrib/1.0/","  We consider the free-boundary motion of two perfect incompressible fluids
with different densities $\rho_+$ and $\rho_-$, separated by a surface of
discontinuity along which the pressure experiences a jump proportional to the
mean curvature by a factor $\epsilon^2$. Assuming the Raileigh-Taylor sign
condition and $\rho_- \leq \epsilon^{3/2}$ we prove energy estimates uniform in
$\rho_-$ and $\epsilon$. As a consequence we obtain convergence of solutions of
the interface problem to solutions of the free-boundary Euler equations in
vacuum without surface tension as $\epsilon$ and $\rho_-$ tend to zero.
","[{""version"":""v1"",""created"":""Thu, 17 Dec 2009 01:15:58 GMT""},{""version"":""v2"",""created"":""Sun, 6 Mar 2011 00:58:50 GMT""}]","2011-03-08"
"0912.3297","Mark Davis","Mark H.A. Davis, Xin Guo, Guoliang Wu","Impulse Control of Multidimensional Jump Diffusions","15 pages, 1 figure",,,,"math.OC math.AP","http://arxiv.org/licenses/nonexclusive-distrib/1.0/","  This paper studies regularity property of the value function for an
infinite-horizon discounted cost impulse control problem, where the underlying
controlled process is a multidimensional jump diffusion with possibly
`infinite-activity' jumps. Surprisingly, despite these jumps, we obtain the
same degree of regularity as for the diffusion case, at least when the jump
satisfies certain integrability conditions.
","[{""version"":""v1"",""created"":""Thu, 17 Dec 2009 01:07:17 GMT""}]","2009-12-18"
"0912.3298","Douglas Whittet","D. C. B. Whittet","Oxygen Depletion in the Interstellar Medium: Implications for Grain
  Models and the Distribution of Elemental Oxygen",,"Astrophys.J.710:1009-1016,2010","10.1088/0004-637X/710/2/1009",,"astro-ph.GA","http://arxiv.org/licenses/nonexclusive-distrib/1.0/","  This paper assesses the implications of a recent discovery (Jenkins 2009)
that atomic oxygen is being depleted from diffuse interstellar gas at a rate
that cannot be accounted for by its presence in silicate and metallic oxide
particles. To place this discovery in context, the uptake of elemental O into
dust is considered over a wide range of environments, from the tenuous
intercloud gas and diffuse clouds sampled by the depletion observations to
dense clouds where ice mantles and gaseous CO become important reservoirs of O.
The distribution of O in these contrasting regions is quantified in terms of a
common parameter, the mean number density of hydrogen. At the interface between
diffuse and dense phases (just before the onset of ice mantle growth) as much
as 160 ppm of the O abundance is unaccounted for. If this reservoir of depleted
oxygen persists to higher densities it has implications for the oxygen budget
in molecular clouds, where a shortfall of the same order is observed. Of
various potential carriers, the most plausible appears to be a form of
O-bearing carbonaceous matter similar to the organics found in cometary
particles returned by the Stardust mission. The ""organic refractory"" model for
interstellar dust is re-examined in the light of these findings, and it is
concluded that further observations and laboratory work are needed to determine
whether this class of material is present in quantities sufficient to account
for a significant fraction of the unidentified depleted oxygen.
","[{""version"":""v1"",""created"":""Thu, 17 Dec 2009 01:12:12 GMT""}]","2014-11-20"
"0912.3299","Anna Pachol","A. Borowiec, Kumar S. Gupta, S. Meljanac, A. Pachol","Constraints on the quantum gravity scale from kappa - Minkowski
  spacetime","9 pages, final published version, revised abstract, introduction and
  conclusion, to make it clear to general reader","Europhys.Lett.92:20006,2010","10.1209/0295-5075/92/20006","SINP-TNP/09-26","hep-th gr-qc math-ph math.MP","http://arxiv.org/licenses/nonexclusive-distrib/1.0/","  We compare two versions of deformed dispersion relations (energy vs momenta
and momenta vs energy) and the corresponding time delay up to the second order
accuracy in the quantum gravity scale (deformation parameter). A general
framework describing modified dispersion relations and time delay with respect
to different noncommutative kappa -Minkowski spacetime realizations is firstly
proposed here and it covers all the cases introduced in the literature. It is
shown that some of the realizations provide certain bounds on quadratic
corrections, i.e. on quantum gravity scale, but it is not excluded in our
framework that quantum gravity scale is the Planck scale. We also show how the
coefficients in the dispersion relations can be obtained through a
multiparameter fit of the gamma ray burst (GRB) data.
","[{""version"":""v1"",""created"":""Thu, 17 Dec 2009 01:21:41 GMT""},{""version"":""v2"",""created"":""Thu, 7 Jan 2010 20:40:04 GMT""},{""version"":""v3"",""created"":""Thu, 18 Nov 2010 13:51:11 GMT""}]","2010-11-26"
