"0912.2997","Rien van de Weygaert","Rien van de Weygaert, Erwin Platen","Cosmic Voids: structure, dynamics and galaxies","29 pages, 12 figures, invited review COSPA2008, Pohang, Korea. Modern
  Physics Letters A, accepted. For high-res version see
  http://www.astro.rug.nl/~weygaert/voids.cospa2008.weygaert.pdf",,"10.1142/S2010194511000092",,"astro-ph.CO","http://arxiv.org/licenses/nonexclusive-distrib/1.0/","  In this review we discuss several aspects of Cosmic Voids. Voids are a major
component of the large scale distribution of matter and galaxies in the
Universe. They are of instrumental importance for understanding the emergence
of the Cosmic Web. Their relatively simple shape and structure makes them into
useful tools for extracting the value of a variety cosmic parameters, possibly
including even that of the influence of dark energy. Perhaps most promising and
challenging is the issue of the galaxies found within their realm. Not only
does the pristine environment of voids provide a promising testing ground for
assessing the role of environment on the formation and evolution of galaxies,
the dearth of dwarf galaxies may even represent a serious challenge to the
standard view of cosmic structure formation.
","[{""version"":""v1"",""created"":""Wed, 16 Dec 2009 20:33:51 GMT""}]","2015-05-14"
"0912.3006","Diego Trancanelli","Nadav Drukker, Diego Trancanelli","A supermatrix model for N=6 super Chern-Simons-matter theory","23 pages","JHEP 1002:058,2010","10.1007/JHEP02(2010)058","HU-EP-09/30, NSF-KITP-09-120","hep-th","http://arxiv.org/licenses/nonexclusive-distrib/1.0/","  We construct the Wilson loop operator of N=6 super Chern-Simons-matter which
is invariant under half of the supercharges of the theory and is dual to the
simplest macroscopic open string in AdS_4 x CP^3. The Wilson loop couples, in
addition to the gauge and scalar fields of the theory, also to the fermions in
the bi-fundamental representation of the U(N) x U(M) gauge group. These
ingredients are naturally combined into a superconnection whose holonomy gives
the Wilson loop, which can be defined for any representation of the supergroup
U(N|M). Explicit expressions for loops supported along an infinite straight
line and along a circle are presented. Using the localization calculation of
Kapustin et al. we show that the circular loop is computed by a supermatrix
model and discuss the connection to pure Chern-Simons theory with supergroup
U(N|M).
","[{""version"":""v1"",""created"":""Wed, 16 Dec 2009 18:10:12 GMT""}]","2010-03-19"
"0912.3018","Otfried Guehne","Oleg Gittsovich, Otfried G\""uhne","Quantifying entanglement with covariance matrices","12 pages, 1 figure","Phys. Rev. A 81, 032333 (2010)","10.1103/PhysRevA.81.032333",,"quant-ph","http://arxiv.org/licenses/nonexclusive-distrib/1.0/","  Covariance matrices are a useful tool to investigate correlations and
entanglement in quantum systems. They are widely used in continuous variable
systems, but recently also for finite dimensional systems powerful entanglement
criteria in terms of covariance matrices have been derived. We show how these
results can be used for the quantification of entanglement in bipartite
systems. To that aim we introduce an entanglement parameter that quantifies the
violation of the covariance matrix criterion and can be used to give a lower
bounds on the concurrence. These lower bounds are easily computable and give
entanglement estimates for many weakly entangled states.
","[{""version"":""v1"",""created"":""Wed, 16 Dec 2009 18:59:41 GMT""}]","2010-04-22"
"0912.3039","Allan Bayntun Mr.","Allan Bayntun, C.P. Burgess and Leo van Nierop","Codimension-2 Brane-Bulk Matching: Examples from Six and Ten Dimensions","35 pages, JHEP style","New J.Phys.12:075015,2010","10.1088/1367-2630/12/7/075015",,"hep-th","http://arxiv.org/licenses/nonexclusive-distrib/1.0/","  Experience with Randall-Sundrum models teaches the importance of following
how branes back-react onto the bulk geometry, since this can dramatically
affect the system's low-energy properties. Yet the practical use of this
observation for model building is so far mostly restricted to branes having
only one transverse dimension (codimension-1) in the bulk space, since this is
where tools for following back-reaction are well-developed. This is likely a
serious limitation since experience also tells us that one dimension is rarely
representative of what happens in higher dimensions. We here summarize recent
progress on developing the matching conditions that describe how codimension-2
branes couple to bulk metric, gauge and scalar fields. These matching
conditions are then applied to three situations: D7-branes in F-theory
compactifications of 10D Type IIB string vacua; 3-branes coupled to bulk axions
in unwarped and non-supersymmetric 6D systems; and 3-branes coupled to chiral,
gauged 6D supergravity. For each it is shown how the resulting brane-bulk
dynamics is reproduced by the scalar potential for the low-energy moduli in the
dimensionally reduced, on-brane effective theory. For 6D supergravity we show
that the only 4D-maximally symmetric bulk geometries supported by
positive-tension branes are flat.
","[{""version"":""v1"",""created"":""Wed, 16 Dec 2009 18:07:05 GMT""}]","2014-11-20"
"0912.3097","Evan VanderZee","Evan VanderZee, Anil N. Hirani, Damrong Guoy, Vadim Zharnitsky, and
  Edgar Ramos","Geometric and Combinatorial Properties of Well-Centered Triangulations
  in Three and Higher Dimensions","Approximately 30 pages. Contains 25 figures. Some figures include
  multiple graphics",,,,"cs.CG cs.DM","http://arxiv.org/licenses/nonexclusive-distrib/1.0/","  An n-simplex is said to be n-well-centered if its circumcenter lies in its
interior. We introduce several other geometric conditions and an algebraic
condition that can be used to determine whether a simplex is n-well-centered.
These conditions, together with some other observations, are used to describe
restrictions on the local combinatorial structure of simplicial meshes in which
every simplex is well-centered. In particular, it is shown that in a
3-well-centered (2-well-centered) tetrahedral mesh there are at least 7 (9)
edges incident to each interior vertex, and these bounds are sharp. Moreover,
it is shown that, in stark contrast to the 2-dimensional analog, where there
are exactly two vertex links that prevent a well-centered triangle mesh in R^2,
there are infinitely many vertex links that prohibit a well-centered
tetrahedral mesh in R^3.
","[{""version"":""v1"",""created"":""Wed, 16 Dec 2009 19:57:17 GMT""}]","2009-12-17"
"0912.3122","Igor Sega","P. Prelovsek (1 and 2) and I. Sega (1) ((1) J. Stefan Institute,
  Ljubljana, Slovenia, (2) Faculty for mathematics and Physics, University of
  Ljubljana, Ljubljana, Slovenia)","Anomalous normal-state properties of iron pnictides: phenomenological
  theory","6 pages (revtex4), 4 ps figures","Phys. Rev. B 81, 115121 (2010)",,,"cond-mat.str-el cond-mat.supr-con","http://arxiv.org/licenses/nonexclusive-distrib/1.0/","  We employ the phenomenological theory of the quasiparticle relaxation based
on the simplified two-band description and the spin-fluctuation induced
interband coupling to analyze recent normal-state transport data in
electron-doped iron pnictides, in particular the Ba(Fe_1-x Co_x)_2As_2 family.
Temperature dependence of the resistivity, thermopower and the Hall constant
are evaluated. It is shown that their anomalous behavior emerging from
experiments can be consistently described within the same framework assuming
also non-Fermi-liquid spin fluctuations.
","[{""version"":""v1"",""created"":""Wed, 16 Dec 2009 16:29:21 GMT""},{""version"":""v2"",""created"":""Mon, 1 Mar 2010 11:38:32 GMT""}]","2010-03-18"
"0912.3135","D\'enes Sexty","J. Berges, S. Schlichting, D. Sexty","Dynamic critical phenomena from spectral functions on the lattice","18 pages, 6 figures, NPB version, minor changes","Nucl.Phys.B832:228-240,2010","10.1016/j.nuclphysb.2010.02.007",,"hep-lat hep-ph hep-th nucl-th","http://arxiv.org/licenses/nonexclusive-distrib/1.0/","  We investigate spectral functions in the vicinity of the critical temperature
of a second-order phase transition. Since critical phenomena in quantum field
theories are governed by classical dynamics, universal properties can be
computed using real-time lattice simulations. For the example of a relativistic
single-component scalar field theory in 2+1 dimensions, we compute the spectral
function described by universal scaling functions and extract the dynamic
critical exponent z. Together with exactly known static properties of this
theory, we obtain a verification from first principles that the relativistic
theory is well described by the dynamic universality class of relaxational
models with conserved density (Model C).
","[{""version"":""v1"",""created"":""Wed, 16 Dec 2009 17:56:20 GMT""},{""version"":""v2"",""created"":""Fri, 5 Feb 2010 15:42:27 GMT""}]","2011-03-28"
"0912.3142","Gianluca Calcagni","Gianluca Calcagni","Fractal universe and quantum gravity","4 pages. v2: typos corrected; v3: discussion improved, intuitive
  introduction added, matches the published version","Phys.Rev.Lett.104:251301,2010","10.1103/PhysRevLett.104.251301","AEI-2009-125","hep-th astro-ph.CO gr-qc","http://arxiv.org/licenses/nonexclusive-distrib/1.0/","  We propose a field theory which lives in fractal spacetime and is argued to
be Lorentz invariant, power-counting renormalizable, ultraviolet finite, and
causal. The system flows from an ultraviolet fixed point, where spacetime has
Hausdorff dimension 2, to an infrared limit coinciding with a standard
four-dimensional field theory. Classically, the fractal world where fields live
exchanges energy momentum with the bulk with integer topological dimension.
However, the total energy momentum is conserved. We consider the dynamics and
the propagator of a scalar field. Implications for quantum gravity, cosmology,
and the cosmological constant are discussed.
","[{""version"":""v1"",""created"":""Wed, 16 Dec 2009 20:51:50 GMT""},{""version"":""v2"",""created"":""Wed, 23 Dec 2009 12:08:19 GMT""},{""version"":""v3"",""created"":""Thu, 24 Jun 2010 16:51:54 GMT""}]","2014-11-20"
"0912.3153","Steve Blanchet","Steve Blanchet, Thomas Hambye, and Francois-Xavier Josse-Michaux","Reconciling leptogenesis with observable mu --> e gamma rates","One section added, a few equations and sentences rewritten,
  references added, results unchanged","JHEP 1004:023,2010","10.1007/JHEP04(2010)023",,"hep-ph","http://arxiv.org/licenses/nonexclusive-distrib/1.0/","  We perform a detailed analysis of thermal leptogenesis in the framework of
seesaw models which approximately conserve lepton number. These models are
known to allow for large Yukawa couplings and a low seesaw scale in agreement
with neutrino mass constraints, and hence to lead to large lepton flavour
violating rates that can be probed experimentally. Although large Yukawa
couplings lead to (inverse) decay rates much larger than the Hubble expansion
rate, we show that the leptogenesis washout induced is generically small if the
mass splitting between the right-handed neutrinos is small enough. As a result,
large lepton flavour violating rates are compatible with successful
leptogenesis. We emphasize that this scenario does not require any particular
flavour structure. A small splitting is natural and radiatively stable in this
context because it is protected by the lepton number symmetry.
","[{""version"":""v1"",""created"":""Wed, 16 Dec 2009 19:58:55 GMT""},{""version"":""v2"",""created"":""Mon, 15 Feb 2010 19:55:40 GMT""}]","2014-11-20"
"0912.3157","Lily Schrempp","Lily Schrempp and Iain A. Brown (University of Heidelberg)","Do Bound Structures Brake Cosmic Acceleration?","31 pages, 11 figures. Replaced with version published by JCAP --
  discussion concerning the strength of the scalar/matter coupling added","JCAP 1005:023,2010","10.1088/1475-7516/2010/05/023","HD-THEP-09-29","astro-ph.CO gr-qc","http://arxiv.org/licenses/nonexclusive-distrib/1.0/","  In this paper we investigate the impact of the coupling between a
quintessence field and clustered matter on the average equation of state of the
scalar field. We take the NFW profile to be characteristic of bound structures
on galactic and cluster scales, and the isothermal distribution to hold for
objects on supercluster scales. Solving analytically for the scalar-field
profile, we find that the greatest impact on the equation of state comes from
the superclusters. Employing numerical case studies, we verify this effect and
probe its dependence on the evolutionary state of the supercluster. An estimate
across the Hubble volume yields corrections to the homogeneous equation of
state of ~3%, increasing with coupling strength.
","[{""version"":""v1"",""created"":""Wed, 16 Dec 2009 16:39:22 GMT""},{""version"":""v2"",""created"":""Wed, 9 Jun 2010 12:38:57 GMT""}]","2010-06-10"
"0912.3175","Dmitri Diakonov","Dmitri Diakonov (St. Petersburg NPI and Bochum University)","Exotic pentaquarks as Gamov-Teller resonances","10 pages, 4 figures, extended version of the invited talk at Quark
  Nuclear Physics 2009, Beijing, Sep. 21-26, 2009",,,,"hep-ph hep-ex","http://arxiv.org/licenses/nonexclusive-distrib/1.0/","  If the number of colors Nc is taken large, baryons and their excitations can
be considered in a mean-field approach. We argue that the mean field in baryons
breaks spontaneously the spherical and SU(3) flavor symmetries, but retains the
SU(2) symmetry of simultaneous rotations in space and isospace. The one-quark
and quark-hole excitations in the mean field, together with the SU(3)
rotational bands about them determine the spectrum of baryon resonances, which
turns out to be in satisfactory accordance with reality when one puts Nc=3. A
by-product of this scheme is a confirmation of the light pentaquark baryon
Theta+ = uudds-bar as a typical Gamov-Teller resonance long known in nuclear
physics. An extension of the same large-Nc logic to charmed (and bottom)
baryons leads to a prediction of a anti-decapenta (15-bar)-plet of charmed
pentaquarks, two of which, Beta++_c = cuuds-bar and Beta+_c = cudds-bar, may be
light and stable with respect to strong decays, and should be looked for.
","[{""version"":""v1"",""created"":""Wed, 16 Dec 2009 16:16:40 GMT""},{""version"":""v2"",""created"":""Fri, 19 Feb 2010 16:41:30 GMT""}]","2010-02-19"
"0912.3176","Philip Hughes","M. F. Aller, H. D. Aller, P. A. Hughes","Linear Polarization as a Probe of Gamma Ray Flaring Blazar Jets","2009 Fermi Symposium eConf Proceedings C091122",,,,"astro-ph.HE","http://arxiv.org/licenses/nonexclusive-distrib/1.0/","  We describe and present initial results from a Fermi cycle 2 program designed
to monitor the behavior of the centimeter-band linear polarization and total
flux density emitted by gamma-ray-bright blazars during flaring. The goal of
the program is to identify changes in the magnetic field structure in the radio
jet associated with gamma-ray flaring and ultimately to test whether gamma-ray
flaring is associated with the onset of shocks in the radio jet. Light curves
illustrating radio band variability patterns are shown for sample program
sources.
","[{""version"":""v1"",""created"":""Wed, 16 Dec 2009 16:02:07 GMT""}]","2009-12-17"
"0912.3177","Relja Vasic","R. Vasic, J. T. Sadowski, Y.J. Choi, H.D. Zhou, C.R. Wiebe, S.W.
  Cheong, J. E. Rowe, M.D. Ulrich,","Surface Reconstruction of Hexagonal Y-doped HoMnO3 and LuMnO3 studied
  using low-energy electron diffraction","22 pages, 7 figures",,"10.1103/PhysRevB.81.165417",,"cond-mat.str-el cond-mat.other","http://arxiv.org/licenses/nonexclusive-distrib/1.0/","  We have investigated the (0001) surfaces of several hexagonal manganite
perovskites by low-energy electron diffraction (LEED) in order to determine if
the surface periodicity is different from that of the bulk materials. These
LEED studies were conducted using near-normal incidence geometry with a low
energy electron microscope (LEEM)/LEED apparatus from room temperature to 1200
degrees Celsius and with an electron energy in the range of 15-50 eV.
Diffraction patterns showed features of bulk-terminated periodicity as well as
a 2\times2 surface reconstruction. Possible origins for this surface
reconstruction structure are discussed and comparisons are made with surface
studies of other complex oxides.
","[{""version"":""v1"",""created"":""Wed, 16 Dec 2009 16:07:02 GMT""},{""version"":""v2"",""created"":""Wed, 7 Apr 2010 12:41:18 GMT""}]","2013-05-29"
"0912.3178","Nicola Cristiano Amorisco","G. Bertin, N. C. Amorisco","Prominent spiral arms in the gaseous outer galaxy disks","accepted for publication in Astronomy & Astrophysics",,"10.1051/0004-6361/200913611",,"astro-ph.CO astro-ph.GA","http://arxiv.org/licenses/nonexclusive-distrib/1.0/","  Context: Several spiral galaxies, as beautifully exhibited by the case of NGC
6946, display a prominent large-scale spiral structure in their gaseous outer
disk. Such structure is often thought to pose a dynamical puzzle, because
grand-design spiral structure is traditionally interpreted as the result of
density waves carried mostly in the stellar disk. Aims. Here we argue that the
outer spiral arms in the cold gas outside the bright optical disk actually have
a natural interpretation as the manifestation of the mechanism that excites
grand-design spiral structure in the main, star-dominated body of the disk: the
excitation is driven by angular momentum transport to the outer regions,
through trailing density waves outside the corotation circle that can penetrate
beyond the Outer Lindblad Resonance in the gaseous component of the disk.
  Methods: Because of conservation of the density wave action, these outgoing
waves are likely to become more prominent in the outer disk and eventually
reach non-linear amplitudes. To calculate the desired amplitude profiles, we
make use of the theory of dispersive waves.
  Results: If the conditions beyond the optical radius allow for an approximate
treatment in terms of a linear theory, we show that fitting the observed
amplitude profiles leads to a quantitative test on the density of the disk
material and thus on the dark matter distribution in the outer parts of the
galaxy.
  Conclusions: This study is thus of interest to the general problem of the
disk-halo decomposition of rotation curves.
","[{""version"":""v1"",""created"":""Wed, 16 Dec 2009 16:18:53 GMT""}]","2010-09-10"
"0912.3179","Chun Ning (Jeanie) Lau","Jairo Velasco Jr., Gang Liu, Lei Jing, Philip Kratz, Wenzhong Bao,
  Marc Bockrath, Chun Ning Lau","Probing Charging and Localization in the Quantum Hall Regime by Graphene
  pnp Junctions",,,"10.1103/PhysRevB.81.121407",,"cond-mat.mes-hall cond-mat.str-el","http://arxiv.org/licenses/nonexclusive-distrib/1.0/","  Using high quality graphene pnp junctions, we observe prominent conductance
fluctuations on transitions between quantum Hall (QH) plateaus as the top gate
voltage Vtg is varied. In the Vtg-B plane, the fluctuations form crisscrossing
lines that are parallel to those of the adjacent plateaus, with different
temperature dependences for the conductance peaks and valleys. These
fluctuations arise from Coulomb-induced charging of electron- or hole-doped
localized states when the device bulk is delocalized, underscoring the
importance of electronic interactions in graphene in the QH regime.
","[{""version"":""v1"",""created"":""Wed, 16 Dec 2009 16:18:51 GMT""}]","2015-05-14"
"0912.3180","Heiner Kohler","Heiner Kohler, Hans-Juergen Sommers, Sven Aberg and Thomas Guhr","Exact Fidelity and Full Fidelity Statistics in Regular and Chaotic
  Surroundings","4 pages 3 figures",,"10.1103/PhysRevE.81.050103",,"cond-mat.stat-mech cond-mat.dis-nn nlin.CD","http://arxiv.org/licenses/nonexclusive-distrib/1.0/","  For a prepared state exact expressions for the time dependent mean fidelity
as well as for the mean inverse paricipation ratio are obtained analytically.
The distribution function of fidelity in the long time limit and of inverse
participation ratio are studied numerically and analytically. Surprising
features like fidelity revival and enhanced non--ergodicity are observed. The
role of the coupling coefficients and of complexity of background is studied as
well.
","[{""version"":""v1"",""created"":""Wed, 16 Dec 2009 16:21:37 GMT""}]","2015-05-14"
"0912.3181","Nuno Cardoso","M. Cardoso, N. Cardoso, P. Bicudo","Lattice QCD computation of the colour fields for the static hybrid
  quark-gluon-antiquark system, and microscopic study of the Casimir scaling","7 pages, 10 figures","Phys.Rev.D81:034504,2010","10.1103/PhysRevD.81.034504",,"hep-lat","http://arxiv.org/licenses/nonexclusive-distrib/1.0/","  The chromoelectric and chromomagnetic fields, created by a static
gluon-quark-antiquark system, are computed in quenched SU(3) lattice QCD, in a
$24^3\times 48$ lattice at $\beta=6.2$ and $a=0.07261(85) fm$. We compute the
hybrid Wilson Loop with two spatial geometries, one with a U shape and another
with an L shape. The particular cases of the two gluon glueball and
quark-antiquark are also studied, and the Casimir scaling is investigated in a
microscopic perspective. This microscopic study of the colour fields is
relevant to understand the structure of hadrons, in particular of the hybrid
excitation of mesons. This also contributes to understand confinement with flux
tubes and to discriminate between the models of fundamental versus adjoint
confining strings, analogous to type-II and type-I superconductivity.
","[{""version"":""v1"",""created"":""Wed, 16 Dec 2009 16:23:46 GMT""}]","2010-04-06"
"0912.3182","Oliver Ratmann","Oliver Ratmann, Christophe Andrieu, Carsten Wiuf and Sylvia Richardson","Notes to Robert et al.: Model criticism informs model choice and model
  comparison","Reply to [arXiv:0909.5673v2]",,"10.1073/pnas.0912887107",,"stat.ME","http://arxiv.org/licenses/nonexclusive-distrib/1.0/","  In their letter to PNAS and a comprehensive set of notes on arXiv
[arXiv:0909.5673v2], Christian Robert, Kerrie Mengersen and Carla Chen (RMC)
represent our approach to model criticism in situations when the likelihood
cannot be computed as a way to ""contrast several models with each other"". In
addition, RMC argue that model assessment with Approximate Bayesian Computation
under model uncertainty (ABCmu) is unduly challenging and question its Bayesian
foundations. We disagree, and clarify that ABCmu is a probabilistically sound
and powerful too for criticizing a model against aspects of the observed data,
and discuss further the utility of ABCmu.
","[{""version"":""v1"",""created"":""Wed, 16 Dec 2009 16:31:51 GMT""}]","2015-05-14"
"0912.3183","Sebastian Egger n\'e Endres","Sebastian Endres, Frank Steiner","The Berry-Keating operator on $L^2(\rz_>,\ud x)$ and on compact quantum
  graphs with general self-adjoint realizations","33pp","J. Phys. A: Math. Theor. 43 (2010) 095204","10.1088/1751-8113/43/9/095204",,"math-ph math.MP","http://arxiv.org/licenses/nonexclusive-distrib/1.0/","  The Berry-Keating operator $H_{\mathrm{BK}}:=
-\ui\hbar(x\frac{\ud\phantom{x}}{\ud x}+{1/2})$ [M. V. Berry and J. P. Keating,
SIAM Rev. 41 (1999) 236] governing the Schr\""odinger dynamics is discussed in
the Hilbert space $L^2(\rz_>,\ud x)$ and on compact quantum graphs. It is
proved that the spectrum of $H_{\mathrm{BK}}$ defined on $L^2(\rz_>,\ud x)$ is
purely continuous and thus this quantization of $H_{\mathrm{BK}}$ cannot yield
the hypothetical Hilbert-Polya operator possessing as eigenvalues the
nontrivial zeros of the Riemann zeta function. A complete classification of all
self-adjoint extensions of $H_{\mathrm{BK}}$ acting on compact quantum graphs
is given together with the corresponding secular equation in form of a
determinant whose zeros determine the discrete spectrum of $H_{\mathrm{BK}}$.
In addition, an exact trace formula and the Weyl asymptotics of the eigenvalue
counting function are derived. Furthermore, we introduce the ""squared""
Berry-Keating operator $H_{\mathrm{BK}}^2:= -x^2\frac{\ud^2\phantom{x}}{\ud
x^2}-2x\frac{\ud\phantom{x}}{\ud x}-{1/4}$ which is a special case of the
Black-Scholes operator used in financial theory of option pricing. Again, all
self-adjoint extensions, the corresponding secular equation, the trace formula
and the Weyl asymptotics are derived for $H_{\mathrm{BK}}^2$ on compact quantum
graphs. While the spectra of both $H_{\mathrm{BK}}$ and $H_{\mathrm{BK}}^2$ on
any compact quantum graph are discrete, their Weyl asymptotics demonstrate that
neither $H_{\mathrm{BK}}$ nor $H_{\mathrm{BK}}^2$ can yield as eigenvalues the
nontrivial Riemann zeros. Some simple examples are worked out in detail.
","[{""version"":""v1"",""created"":""Wed, 16 Dec 2009 16:24:54 GMT""},{""version"":""v2"",""created"":""Thu, 28 Jan 2010 11:40:25 GMT""},{""version"":""v3"",""created"":""Fri, 29 Jan 2010 10:22:38 GMT""},{""version"":""v4"",""created"":""Thu, 5 May 2011 20:37:35 GMT""},{""version"":""v5"",""created"":""Mon, 9 May 2011 11:01:59 GMT""}]","2015-05-14"
