"0912.3220","Moritz Fragner","Moritz Fragner, Richard Nelson","Evolution of warped and twisted accretion discs in close binary systems","A high resolution version of the paper can be downloaded from:
  http://www.maths.qmul.ac.uk/~mmf/warped_discs.pdf This paper has been
  accepted for publication in A&A",,"10.1051/0004-6361/200913088",,"astro-ph.EP","http://arxiv.org/licenses/nonexclusive-distrib/1.0/","  We aim to examine the detailed disc structure that arises in a misaligned
binary system as a function of the disc aspect ratio h, viscosity parameter
alpha, disc outer radius R, and binary inclination angle gamma_F. We also aim
to examine the conditions that lead to an inclined disc being disrupted by
strong differential precession. We use a grid-based hydrodynamic code to
perform 3D simulations. This code has a relatively low numerical viscosity
compared with the SPH schemes that have been used previously to study inclined
discs. This allows the influence of viscosity on the disc evolution to be
tightly controlled. We find that for thick discs (h=0.05) with low alpha,
efficient warp communication in the discs allows them to precess as rigid
bodies with very little warping or twisting. Such discs are observed to align
with the binary orbit plane on the viscous evolution time. Thinner discs with
higher viscosity, in which warp communication is less efficient, develop
significant twists before achieving a state of rigid-body precession. Under the
most extreme conditions we consider (h=0.01, alpha=0.005 and alpha=0.1), we
find that discs can become broken or disrupted by strong differential
precession. Discs that become highly twisted are observed to align with the
binary orbit plane on timescales much shorter than the viscous timescale,
possibly on the precession time. We find agreement with previous studies that
show that thick discs with low viscosity experience mild warping and precess
rigidly. We also find that as h is decreased substantially, discs may be
disrupted by strong differential precession, but for disc thicknesses that are
significantly less (h=0.01) than those found in previous studies (h=0.03).
","[{""version"":""v1"",""created"":""Wed, 16 Dec 2009 19:19:26 GMT""}]","2015-05-14"
"0912.3221","Biswa Sengupta","B. Sengupta and S. B. Laughlin and J. E. Niven","Comparison of Langevin and Markov channel noise models for neuronal
  signal generation",,,"10.1103/PhysRevE.81.011918",,"q-bio.NC","http://arxiv.org/licenses/nonexclusive-distrib/1.0/","  The stochastic opening and closing of voltage-gated ion channels produces
noise in neurons. The effect of this noise on the neuronal performance has been
modelled using either approximate or Langevin model, based on stochastic
differential equations or an exact model, based on a Markov process model of
channel gating. Yet whether the Langevin model accurately reproduces the
channel noise produced by the Markov model remains unclear. Here we present a
comparison between Langevin and Markov models of channel noise in neurons using
single compartment Hodgkin-Huxley models containing either $Na^{+}$ and
$K^{+}$, or only $K^{+}$ voltage-gated ion channels. The performance of the
Langevin and Markov models was quantified over a range of stimulus statistics,
membrane areas and channel numbers. We find that in comparison to the Markov
model, the Langevin model underestimates the noise contributed by voltage-gated
ion channels, overestimating information rates for both spiking and non-spiking
membranes. Even with increasing numbers of channels the difference between the
two models persists. This suggests that the Langevin model may not be suitable
for accurately simulating channel noise in neurons, even in simulations with
large numbers of ion channels.
","[{""version"":""v1"",""created"":""Wed, 16 Dec 2009 20:18:36 GMT""}]","2015-05-14"
"0912.3222","Luigi Brugnano","Luigi Brugnano, Alessandra Sestini","Iterative solution of piecewise linear systems for the numerical
  solution of obstacle problems","22 pages, 5 figures","Journal of Numerical Analysis, Industrial and Applied Mathematics
  6, 3-4 (2011) 67-82",,,"math.NA","http://arxiv.org/licenses/nonexclusive-distrib/1.0/","  We investigate the use of piecewise linear systems, whose coefficient matrix
is a piecewise constant function of the solution itself. Such systems arise,
for example, from the numerical solution of linear complementarity problems and
in the numerical solution of free-surface problems. In particular, we here
study their application to the numerical solution of both the (linear)
parabolic obstacle problem and the obstacle problem. We propose a class of
effective semi-iterative Newton-type methods to find the exact solution of such
piecewise linear systems. We prove that the semiiterative Newton-type methods
have a global monotonic convergence property, i.e., the iterates converge
monotonically to the exact solution in a finite number of steps. Numerical
examples are presented to demonstrate the effectiveness of the proposed
methods.
","[{""version"":""v1"",""created"":""Wed, 16 Dec 2009 18:40:28 GMT""}]","2012-06-21"
"0912.3223","Istvan Lagzi","Ferenc Molnar Jr., Tamas Szakaly, Robert Meszaros, Istvan Lagzi","Air pollution modelling using a graphics processing unit with CUDA","5 figures","Comput. Phys. Commun., 181, 105-112, 2010","10.1016/j.cpc.2009.09.008",,"physics.comp-ph physics.med-ph","http://arxiv.org/licenses/nonexclusive-distrib/1.0/","  The Graphics Processing Unit (GPU) is a powerful tool for parallel computing.
In the past years the performance and capabilities of GPUs have increased, and
the Compute Unified Device Architecture (CUDA) - a parallel computing
architecture - has been developed by NVIDIA to utilize this performance in
general purpose computations. Here we show for the first time a possible
application of GPU for environmental studies serving as a basement for decision
making strategies. A stochastic Lagrangian particle model has been developed on
CUDA to estimate the transport and the transformation of the radionuclides from
a single point source during an accidental release. Our results show that
parallel implementation achieves typical acceleration values in the order of
80-120 times compared to CPU using a single-threaded implementation on a 2.33
GHz desktop computer. Only very small differences have been found between the
results obtained from GPU and CPU simulations, which are comparable with the
effect of stochastic transport phenomena in atmosphere. The relatively high
speedup with no additional costs to maintain this parallel architecture could
result in a wide usage of GPU for diversified environmental applications in the
near future.
","[{""version"":""v1"",""created"":""Wed, 16 Dec 2009 18:41:43 GMT""}]","2009-12-17"
"0912.3224","Marc Audard","M. Audard, G.S. Stringfellow, M. G\""udel, S.L. Skinner, F.M. Walter,
  E.F. Guinan, R.T. Hamilton, K.R. Briggs, C. Baldovin-Saavedra","A multi-wavelength study of the young star V1118 Orionis in outburst","Accepted in A&A, Tables will be published online",,"10.1051/0004-6361/200913037",,"astro-ph.SR astro-ph.HE","http://arxiv.org/licenses/nonexclusive-distrib/1.0/","  Abriged version for astroph: The young late-type star V1118 Orionis was in
outburst from 2005 to 2006. We followed the outburst with optical and
near-infrared photometry; the X-ray emission was further probed with
observations taken with XMM-Newton and Chandra during and after the outburst.
In addition, we obtained mid-infrared photometry and spectroscopy with Spitzer
at the peak of the outburst and in the post-outburst phase. The spectral energy
distribution of V1118 Ori varied significantly over the course of the outburst.
The optical flux showed the largest variations, most likely due to enhanced
emission by a hot spot. The latter dominated the optical and near-infrared
emission at the peak of the outburst, while the disk emission dominated in the
mid-infrared. The X-ray flux correlated with the optical and infrared fluxes,
indicating that accretion affected the magnetically active corona and the
stellar magnetosphere. The thermal structure of the corona was variable with
some indication of a cooling of the coronal temperature in the early phase of
the outburst with a gradual return to normal values. Color-color diagrams in
the optical and infrared showed variations during the outburst, with no obvious
signature of reddening due to circumstellar matter. Using MC realizations of
star+disk+hotspot models to fit the SED in ``quiescence'' and at the peak of
the outburst, we determined that the mass accretion rate varied from about
2.5E-7 Msun/yr to 1E-6 Msun/yr; in addition the fractional area of the hotspot
increased significantly as well. The multi-wavelength study of the V1118 Ori
outburst helped us to understand the variations in spectral energy
distributions and demonstrated the interplay between the disk and the stellar
magnetosphere in a young, strongly accreting star.
","[{""version"":""v1"",""created"":""Wed, 16 Dec 2009 18:42:39 GMT""}]","2015-05-14"
"0912.3225","Max Souza","Fabio A. C. C. Chalub, Max O. Souza","The SIR epidemic model from a PDE point of view",,"Math. Comp. Modelling, 53 (7-8), 1568--1574 (2011)","10.1016/j.mcm.2010.05.036",,"q-bio.PE","http://arxiv.org/licenses/nonexclusive-distrib/1.0/","  We present a derivation of the classical SIR model through a mean-field
approximation from a discrete version of SIR. We then obtain a hyperbolic
forward Kolmogorov equation, and show that its projected characteristics
recover the standard SIR model. Moreover, we show that the long time limit of
the evolution will be a Dirac measure. The exact position will depend on the
well-know $R_0$ parameter, and it will be supported on the corresponding stable
SIR equilibrium.
","[{""version"":""v1"",""created"":""Wed, 16 Dec 2009 18:55:29 GMT""}]","2013-01-21"
"0912.3226","Rui Pinto","R. Pinto, R. Grappin, J. Leorat","Coronal Inflows and Giant Polar Plumes","4 pages, 5 figures, accepted for publication in the Solar Wind 12
  conference proceedings (AIP Conference Proceedings)","AIP Conf.Proc.1216:80-83,2010","10.1063/1.3395968",,"astro-ph.SR","http://arxiv.org/licenses/nonexclusive-distrib/1.0/","  We present the first results of simulations of giant polar plumes and coronal
flows. We use a 2.5D axisymmetric MHD numerical model of an isothermal corona
and slow solar wind. A plume is generated just above asmall magnetic bipole
embedded in an unipolar flux region which is perturbed by Alfv\'en waves
injected from the coronal base. The boundary conditions are transparent. The
results are compared to those obtained previously with a 1D wind model in which
plumes are generated as a consequence of variations of the heating and
flux-tube expansion parameters.
","[{""version"":""v1"",""created"":""Wed, 16 Dec 2009 18:56:12 GMT""}]","2014-11-20"
"0912.3227","Khristo N. Boyadzhiev","Khristo N. Boyadzhiev","Evaluation of some simple Euler-type series",,"Far East Journal of Mathematical Sciences (FJMS), 29, Issue 1,
  (2008),1-11",,,"math.NT math.CA","http://arxiv.org/licenses/nonexclusive-distrib/1.0/","  Five series are evaluated in terms of zeta values. Three of the series
involve harmonic numbers and one involves Stirling numbers of the first kind.
The evaluation of these series is reduced to the evaluation of certain
integrals, including the moments of the polylogarithm.
","[{""version"":""v1"",""created"":""Wed, 16 Dec 2009 18:56:23 GMT""}]","2016-10-10"
"0912.3228","Vadim Bulitko","Valeriy K. Bulitko and Vadim Bulitko","On Backtracking in Real-time Heuristic Search",,,,,"cs.AI","http://arxiv.org/licenses/nonexclusive-distrib/1.0/","  Real-time heuristic search algorithms are suitable for situated agents that
need to make their decisions in constant time. Since the original work by Korf
nearly two decades ago, numerous extensions have been suggested. One of the
most intriguing extensions is the idea of backtracking wherein the agent
decides to return to a previously visited state as opposed to moving forward
greedily. This idea has been empirically shown to have a significant impact on
various performance measures. The studies have been carried out in particular
empirical testbeds with specific real-time search algorithms that use
backtracking. Consequently, the extent to which the trends observed are
characteristic of backtracking in general is unclear. In this paper, we present
the first entirely theoretical study of backtracking in real-time heuristic
search. In particular, we present upper bounds on the solution cost exponential
and linear in a parameter regulating the amount of backtracking. The results
hold for a wide class of real-time heuristic search algorithms that includes
many existing algorithms as a small subclass.
","[{""version"":""v1"",""created"":""Wed, 16 Dec 2009 18:59:29 GMT""}]","2009-12-17"
"0912.3229","David Charbonneau","David Charbonneau, Zachory K. Berta, Jonathan Irwin, Christopher J.
  Burke, Philip Nutzman, Lars A. Buchhave, Christophe Lovis, Xavier Bonfils,
  David W. Latham, Stephane Udry, Ruth A. Murray-Clay, Matthew J. Holman,
  Emilio E. Falco, Joshua N. Winn, Didier Queloz, Francesco Pepe, Michel Mayor,
  Xavier Delfosse, Thierry Forveille","A super-Earth transiting a nearby low-mass star","13 pages, 3 figures, published in Nature",,"10.1038/nature08679",,"astro-ph.EP astro-ph.SR","http://arxiv.org/licenses/nonexclusive-distrib/1.0/","  A decade ago, the detection of the first transiting extrasolar planet
provided a direct constraint on its composition and opened the door to
spectroscopic investigations of extrasolar planetary atmospheres. As such
characterization studies are feasible only for transiting systems that are both
nearby and for which the planet-to-star radius ratio is relatively large,
nearby small stars have been surveyed intensively. Doppler studies and
microlensing have uncovered a population of planets with minimum masses of
1.9-10 times the Earth's mass (M_Earth), called super-Earths. The first
constraint on the bulk composition of this novel class of planets was afforded
by CoRoT-7b, but the distance and size of its star preclude atmospheric studies
in the foreseeable future. Here we report observations of the transiting planet
GJ 1214b, which has a mass of 6.55 M_Earth and a radius 2.68 times Earth's
radius (R_Earth), indicating that it is intermediate in stature between Earth
and the ice giants of the Solar System. We find that the planetary mass and
radius are consistent with a composition of primarily water enshrouded by a
hydrogen-helium envelope that is only 0.05% of the mass of the planet. The
atmosphere is probably escaping hydrodynamically, indicating that it has
undergone significant evolution during its history. As the star is small and
only 13 parsecs away, the planetary atmosphere is amenable to study with
current observatories.
","[{""version"":""v1"",""created"":""Wed, 16 Dec 2009 19:01:53 GMT""}]","2015-05-14"
"0912.3230","Jacek Dobaczewski","B.G. Carlsson, J. Dobaczewski, J. Toivanen, P. Vesely","Solution of self-consistent equations for the N3LO nuclear energy
  density functional in spherical symmetry. The program HOSPHE (v1.00)","47 LaTeX pages, 2 figures, submitted to Computer Physics
  Communications","Comp. Phys. Commun. 181, 1641 (2010)","10.1016/j.cpc.2010.05.022",,"nucl-th","http://arxiv.org/licenses/nonexclusive-distrib/1.0/","  We present solution of self-consistent equations for the N3LO nuclear energy
density functional. We derive general expressions for the mean fields expressed
as differential operators depending on densities and for the densities
expressed in terms of derivatives of wave functions. These expressions are then
specified to the case of spherical symmetry. We also present the computer
program HOSPHE (v1.00), which solves the self-consistent equations by using the
expansion of single-particle wave functions on the spherical harmonic
oscillator basis.
","[{""version"":""v1"",""created"":""Wed, 16 Dec 2009 19:03:25 GMT""}]","2010-07-21"
"0912.3231","Helene Guerin","Jean-Baptiste Bardet (LMRS), H\'el\`ene Guerin (IRMAR), Florent
  Malrieu (IRMAR)","Long time behavior of diffusions with Markov switching",,,,,"math.PR","http://arxiv.org/licenses/nonexclusive-distrib/1.0/","  Let $Y$ be an Ornstein-Uhlenbeck diffusion governed by an ergodic finite
state Markov process $X$: $dY_t=-\lambda(X_t)Y_tdt+\sigma(X_t)dB_t$, $Y_0$
given. Under ergodicity condition, we get quantitative estimates for the long
time behavior of $Y$. We also establish a trichotomy for the tail of the
stationary distribution of $Y$: it can be heavy (only some moments are finite),
exponential-like (only some exponential moments are finite) or Gaussian-like
(its Laplace transform is bounded below and above by Gaussian ones). The
critical moments are characterized by the parameters of the model.
","[{""version"":""v1"",""created"":""Wed, 16 Dec 2009 19:09:02 GMT""},{""version"":""v2"",""created"":""Thu, 17 Dec 2009 20:04:45 GMT""}]","2009-12-17"
"0912.3232","Helene Guerin","Jean-Baptiste Bardet (LMRS), H\'el\`ene Guerin (IRMAR), Florent
  Malrieu (IRMAR)","On the Laplace transform of perpetuities with thin tails",,,,,"math.PR","http://arxiv.org/licenses/nonexclusive-distrib/1.0/","  We consider the random variables $R$ which are solutions of the
distributional equation $R\overset{\cL}{=}MR+Q$, where $(Q,M)$ is independent
of $R$ and $\ABS{M}\leq 1$. Goldie and Gr\""ubel showed that the tails of $R$
are no heavier than exponential. In this note we provide the exact lower and
upper bounds of the domain of the Laplace transform of $R$.
","[{""version"":""v1"",""created"":""Wed, 16 Dec 2009 19:09:53 GMT""},{""version"":""v2"",""created"":""Wed, 23 Dec 2009 07:28:08 GMT""}]","2009-12-23"
"0912.3233","Andrei Derevianko","Andrei Derevianko","Theory of ""magic"" optical traps for Zeeman-insensitive clock transitions
  in alkalis","4 pages, 2 fig, 1 table (v3: added discussion of the correct way of
  computing polarizabilities)","Phys. Rev. A 81, 051606(R) (2010)","10.1103/PhysRevA.81.051606",,"cond-mat.quant-gas physics.atom-ph","http://arxiv.org/licenses/nonexclusive-distrib/1.0/","  Precision measurements and quantum information processing with cold atoms may
benefit from trapping atoms with specially engineered, ""magic"" optical fields.
At the magic trapping conditions, the relevant atomic properties remain immune
to strong perturbations by the trapping fields. Here we develop a theoretical
analysis of a recently observed magic trapping for especially valuable
Zeeman-insensitive clock transitions in alkali-metal atoms. The involved
mechanism relies on applying ""magic"" bias B-field along circularly polarized
trapping laser field. We map out these B-fields as a function of trapping laser
wavelength for all commonly-used alkalis.
","[{""version"":""v1"",""created"":""Wed, 16 Dec 2009 19:14:14 GMT""},{""version"":""v2"",""created"":""Wed, 23 Dec 2009 18:28:47 GMT""},{""version"":""v3"",""created"":""Sat, 17 Apr 2010 03:30:00 GMT""}]","2015-05-14"
"0912.3234","Jacek Dobaczewski","J. Toivanen, B.G. Carlsson, J. Dobaczewski, K. Mizuyama, R.R.
  Rodriguez-Guzman, P. Toivanen, P. Vesely","Linear response strength functions with iterative Arnoldi
  diagonalization","9 RevTeX pages, 11 figures, submitted to Physical Review C","Phys.Rev.C81:034312,2010","10.1103/PhysRevC.81.034312",,"nucl-th","http://arxiv.org/licenses/nonexclusive-distrib/1.0/","  We report on an implementation of a new method to calculate RPA strength
functions with iterative non-hermitian Arnoldi diagonalization method, which
does not explicitly calculate and store the RPA matrix. We discuss the
treatment of spurious modes, numerical stability, and how the method scales as
the used model space is enlarged. We perform the particle-hole RPA benchmark
calculations for double magic nucleus 132Sn and compare the resulting
electromagnetic strength functions against those obtained within the standard
RPA.
","[{""version"":""v1"",""created"":""Wed, 16 Dec 2009 19:16:23 GMT""}]","2010-04-14"
"0912.3235","Moti Fridman","Moti Fridman, Micha Nixon, Eitan Ronen, Asher A. Friesem and Nir
  Davidson","Phase locking of coupled lasers with many longitudinal modes","3 pages, 4 figures, submitted to opt. lett",,"10.1364/OL.35.000526",,"physics.optics","http://arxiv.org/licenses/nonexclusive-distrib/1.0/","  Detailed experimental and theoretical investigations on two coupled fiber
lasers, each with many longitudinal modes, reveal that the behavior of the
longitudinal modes depends on both the coupling strength as well as the
detuning between them. For low to moderate coupling strength only longitudinal
modes which are common for both lasers phase-lock while those that are not
common gradually disappear. For larger coupling strengths, the longitudinal
modes that are not common reappear and phase-lock. When the coupling strength
approaches unity the coupled lasers behave as a single long cavity with
correspondingly denser longitudinal modes. Finally, we show that the gradual
increase in phase-locking as a function of the coupling strength results from
competition between phase-locked and non phase-locked longitudinal modes.
","[{""version"":""v1"",""created"":""Wed, 16 Dec 2009 19:24:43 GMT""}]","2015-05-14"
"0912.3236","Goran Djordjevic","R. Constantinescu and G. S. Djordjevic","Education and Research in the SEENET-MTP Regional Framework for Higher
  Education in Physics","6 pages, Talk given at 7th International Conference of the Balkan
  Physical Union, Alexandruoplos, Greece, 9-13 September 2009. To be published
  in AIP Conf.Proc",,"10.1063/1.3322351",,"physics.ed-ph physics.pop-ph","http://arxiv.org/licenses/nonexclusive-distrib/1.0/","  Southeastern European countries undergo significant changes in the
demand/supply ratio on the labour market and in the structure of professional
competences that are necessary for undertaking a professional activity. In
addition, brain-drain process and decrease of interest for a career in basic
sciences put many challenges for our community. Consequently, based on the
activity of the Southeastern European Network in Mathematical and Theoretical
Physics (SEENET MTP Network) in connecting groups and persons working in
mathematics and theoretical physics, we investigate specific qualifications
recognized in these fields in all the countries from the region, and the
related competences necessary for practicing the respective occupations. A list
of new possible occupations will be promoted for inclusion in the National
Qualifications Register for Higher Education. Finally, we analyze the vision
existing in this region on the higher education qualifications against the
European vision and experience, in particular in training of Master students,
PhD students, and senior teaching and research staff through the Network, i.e.
multilateral and bilateral programs.
","[{""version"":""v1"",""created"":""Wed, 16 Dec 2009 19:29:18 GMT""}]","2015-05-14"
"0912.3237","Emmanuel Kowalski","E. Kowalski, A. Nikeghbali","Mod-Gaussian convergence and the value distribution of $\zeta(1/2+it)$
  and related quantities","26 pages, 2 figures, v3: stronger quantitative statements and other
  changes",,"10.1112/jlms/jds003",,"math.NT math.PR","http://arxiv.org/licenses/nonexclusive-distrib/1.0/","  In the context of mod-Gaussian convergence, as defined previously in our work
with J. Jacod, we obtain lower bounds for local probabilities for a sequence of
random vectors which are approximately Gaussian with increasing covariance.
This is motivated by the conjecture concerning the density of the set of values
of the Riemann zeta function on the critical line. We obtain evidence for this
fact, and derive unconditional results for random matrices in compact classical
groups, as well as for certain families of L-functions over finite fields.
","[{""version"":""v1"",""created"":""Wed, 16 Dec 2009 19:39:12 GMT""},{""version"":""v2"",""created"":""Mon, 11 Jan 2010 13:05:52 GMT""},{""version"":""v3"",""created"":""Fri, 21 May 2010 20:07:19 GMT""}]","2014-02-26"
"0912.3238","Andreas Athenodorou","Andreas Athenodorou, Barak Bringoltz and Michael Teper","The spectrum of closed loops of fundamental flux in D = 3+1 SU(N) gauge
  theories","8 pages, 3 figures, Talk presented at the XXVII International
  Symposium on Lattice Field Theory, July 26-31, 2009, Peking University,
  Beijing, China","PoS LAT2009:223,2009",,,"hep-lat hep-th","http://arxiv.org/licenses/nonexclusive-distrib/1.0/","  We study the spectrum of closed flux tubes in four dimensional SU(N) gauge
theories. We do so by calculating the energies of the low lying states with the
variational technique (whose basis consists of about ~700 operators). We study
states of different values of angular momentum, transversal parity,
longitudinal parity, and longitudinal momentum, and compare the results with
effective string theories (ESTs) such as the Nambu-Goto (NG) model. Most of our
states agree very well with the Nambu-Goto predictions and since most of our
flux-tubes' lengths are outside the radius of convergence of the ESTs, then for
some states it is only the NG that predicts the spectrum well. This strongly
suggests that the ESTs can be re-summed. Nonetheless, there are a few states
(all with negative parity and in the same representation of the lattice
rotation group) that exhibit large deviations from the NG predictions; these
deviations might provide clues to the nature of the effective string theory
describing the large-N QCD string.
","[{""version"":""v1"",""created"":""Wed, 16 Dec 2009 20:44:39 GMT""}]","2010-11-05"
