"0912.3803","Jean-S\'ebastien Bernier","Jean-Sebastien Bernier, Tung-Lam Dao, Corinna Kollath, Antoine
  Georges, Pablo S. Cornaglia","Thermometry and signatures of strong correlations from Raman
  spectroscopy of fermionic atoms in optical lattices","13 pages, 22 figures","Phys. Rev. A 81, 063618 (2010)","10.1103/PhysRevA.81.063618",,"cond-mat.quant-gas cond-mat.str-el","http://arxiv.org/licenses/nonexclusive-distrib/1.0/","  We propose a method to directly measure the temperature of a gas of weakly
interacting fermionic atoms loaded into an optical lattice. This technique
relies on Raman spectroscopy and is applicable to experimentally relevant
temperature regimes. Additionally, we show that a similar spectroscopy scheme
can be used to obtain information on the quasiparticle properties and Hubbard
bands of the metallic and Mott-insulating states of interacting fermionic spin
mixtures. These two methods provide experimentalists with novel probes to
accurately characterize fermionic quantum gases confined to optical lattices.
","[{""version"":""v1"",""created"":""Mon, 21 Dec 2009 13:58:14 GMT""}]","2010-06-30"
"0912.3805","Mario Berta","Mario Berta and Matthias Christandl and Renato Renner","The Quantum Reverse Shannon Theorem based on One-Shot Information Theory","30 pages, 4 figures, published version","Commun. Math. Phys. 306, 579 (2011)","10.1007/s00220-011-1309-7",,"quant-ph","http://arxiv.org/licenses/nonexclusive-distrib/1.0/","  The Quantum Reverse Shannon Theorem states that any quantum channel can be
simulated by an unlimited amount of shared entanglement and an amount of
classical communication equal to the channel's entanglement assisted classical
capacity. In this paper, we provide a new proof of this theorem, which has
previously been proved by Bennett, Devetak, Harrow, Shor, and Winter. Our proof
has a clear structure being based on two recent information-theoretic results:
one-shot Quantum State Merging and the Post-Selection Technique for quantum
channels.
","[{""version"":""v1"",""created"":""Sun, 20 Dec 2009 20:56:13 GMT""},{""version"":""v2"",""created"":""Thu, 10 Mar 2011 03:14:59 GMT""},{""version"":""v3"",""created"":""Wed, 21 Sep 2011 09:21:17 GMT""}]","2011-09-22"
"0912.3806","Emil Avsar","Emil Avsar, Yoshitaka Hatta, Toshihiro Matsuo","Odderon in baryon-baryon scattering from the AdS/CFT correspondence","23 pages, v2: minor changes, to be published in JHEP","JHEP 1003:037,2010","10.1007/JHEP03(2010)037",,"hep-th hep-ph","http://arxiv.org/licenses/nonexclusive-distrib/1.0/","  Based on the AdS/CFT correspondence, we present a holographic description of
various C-odd exchanges in high energy baryon-baryon and baryon-antibaryon
scattering, and calculate their respective contributions to the difference in
the total cross sections. We predict that, due to the warp factor of AdS_5, the
total cross section in pp collisions is larger than in p\bar{p} collisions at
asymptotically high energies.
","[{""version"":""v1"",""created"":""Mon, 21 Dec 2009 05:43:19 GMT""},{""version"":""v2"",""created"":""Mon, 8 Mar 2010 15:13:51 GMT""}]","2010-04-22"
"0912.3823","Andrew Lutomirski","Edward Farhi, David Gosset, Avinatan Hassidim, Andrew Lutomirski,
  Daniel Nagaj, and Peter Shor","Quantum state restoration and single-copy tomography","edited for clarity; 13 pages, 1 figure","Phys. Rev. Lett. 105, 190503 (2010)","10.1103/PhysRevLett.105.190503","MIT-CTP-4099","quant-ph","http://arxiv.org/licenses/nonexclusive-distrib/1.0/","  Given a single copy of an n qubit quantum state |psi>, the no-cloning theorem
greatly limits the amount of information which can be extracted from it.
Moreover, given only a procedure which verifies the state, for example a
procedure which measures the operator |psi><psi|, we cannot prepare |psi> in
time polynomial in n . In this paper, we consider the scenario in which we are
given both a single copy of |psi> and the ability to verify it. We show that in
this setting, we can do several novel things efficiently. We present a new
algorithm that we call quantum state restoration which allows us to extend a
large subsystem of |psi> to the full state, and in turn this allows us to copy
small subsystems of |psi>. In addition, we present algorithms that can perform
tomography on small subsystems of |psi>, and we show how to use these
algorithms to estimate the statistics of any efficiently implementable POVM
acting on |psi> in time polynomial in the number of outcomes of the POVM.
","[{""version"":""v1"",""created"":""Mon, 21 Dec 2009 03:22:17 GMT""},{""version"":""v2"",""created"":""Tue, 10 May 2011 19:43:50 GMT""}]","2011-05-11"
"0912.3824","Peter Colberg","Peter H. Colberg, Felix H\""ofling","Highly accelerated simulations of glassy dynamics using GPUs: caveats on
  limited floating-point precision","12 pages, 7 figures, to appear in Comp. Phys. Comm., HALMD package
  licensed under the GPL, see http://research.colberg.org/projects/halmd","Comp. Phys. Comm. 182, 1120 (2011)","10.1016/j.cpc.2011.01.009","LMU-ASC 55/09","physics.comp-ph cond-mat.soft cs.DC","http://arxiv.org/licenses/nonexclusive-distrib/1.0/","  Modern graphics processing units (GPUs) provide impressive computing
resources, which can be accessed conveniently through the CUDA programming
interface. We describe how GPUs can be used to considerably speed up molecular
dynamics (MD) simulations for system sizes ranging up to about 1 million
particles. Particular emphasis is put on the numerical long-time stability in
terms of energy and momentum conservation, and caveats on limited
floating-point precision are issued. Strict energy conservation over 10^8 MD
steps is obtained by double-single emulation of the floating-point arithmetic
in accuracy-critical parts of the algorithm. For the slow dynamics of a
supercooled binary Lennard-Jones mixture, we demonstrate that the use of
single-floating point precision may result in quantitatively and even
physically wrong results. For simulations of a Lennard-Jones fluid, the
described implementation shows speedup factors of up to 80 compared to a serial
implementation for the CPU, and a single GPU was found to compare with a
parallelised MD simulation using 64 distributed cores.
","[{""version"":""v1"",""created"":""Sun, 20 Dec 2009 21:24:15 GMT""},{""version"":""v2"",""created"":""Mon, 17 Jan 2011 19:57:55 GMT""}]","2011-04-08"
"0912.3825","Andrew Lutomirski","Andrew Lutomirski, Scott Aaronson, Edward Farhi, David Gosset,
  Avinatan Hassidim, Jonathan Kelner, and Peter Shor","Breaking and making quantum money: toward a new quantum cryptographic
  protocol","14 pages","Innovations in Computer Science - ICS 2010, Tsinghua University,
  Beijing, China, January 5-7, 2010. Proceedings, 20-31, 978-7-302-21752-7
  Tsinghua University Press",,"MIT-CTP-4091","quant-ph","http://arxiv.org/licenses/nonexclusive-distrib/1.0/","  Public-key quantum money is a cryptographic protocol in which a bank can
create quantum states which anyone can verify but no one except possibly the
bank can clone or forge. There are no secure public-key quantum money schemes
in the literature; as we show in this paper, the only previously published
scheme [1] is insecure. We introduce a category of quantum money protocols
which we call collision-free. For these protocols, even the bank cannot prepare
multiple identical-looking pieces of quantum money. We present a blueprint for
how such a protocol might work as well as a concrete example which we believe
may be insecure.
","[{""version"":""v1"",""created"":""Mon, 21 Dec 2009 04:39:26 GMT""}]","2011-04-26"
"0912.3828","Vincenzo Vitale","Vincenzo Vitale and Aldo Morselli (for the Fermi/LAT Collaboration)","Indirect Search for Dark Matter from the center of the Milky Way with
  the Fermi-Large Area Telescope","Proceedings of the 2009 Fermi Symposium, 6 pages, eConf Proceedings
  C091122",,,,"astro-ph.HE","http://arxiv.org/licenses/nonexclusive-distrib/1.0/","  The Galactic Center region is expected to host the largest density of Dark
Matter (DM) particles within the Milky Way. Then a relatively large gamma-ray
signal would be expected from the possible DM particles annihilation (or
decay). We are searching for the DM gamma-ray signal from the Galactic Center,
which is also rich in bright discrete gamma-ray sources. Furthermore intense
diffuse gamma-ray emission due to cosmic-ray interactions with interstellar gas
and radiation is detected from the same direction. A preliminary analysis of
the data, taken during the first 11 months of the Fermi satellite operations,
is reported. The diffuse gamma-ray backgrounds and discrete sources, as we know
them today, can account for the large majority of the detected gamma-ray
emission from the Galactic Center. Nevertheless a residual emission is left,
not accounted for by the above models. An improved model of the Galactic
diffuse emission and a careful evaluation of new (possibly unresolved) sources
(or source populations) will improve the sensitivity for a DM search.
","[{""version"":""v1"",""created"":""Mon, 21 Dec 2009 02:06:55 GMT""}]","2019-08-14"
"0912.3853","Shunsuke Takagi","Craig Huneke, Shunsuke Takagi and Kei-ichi Watanabe","Multiplicity bounds in graded rings","19 pages; v.2: a new section added, treating a comparison of
  F-thresholds and F-jumping numbers","Kyoto J. Math. 51, no. 1 (2011), 127-147","10.1215/0023608X-2010-022",,"math.AC math.AG","http://arxiv.org/licenses/nonexclusive-distrib/1.0/","  The $F$-threshold $c^J(\a)$ of an ideal $\a$ with respect to an ideal $J$ is
a positive characteristic invariant obtained by comparing the powers of $\a$
with the Frobenius powers of $J$. We study a conjecture formulated in an
earlier paper \cite{HMTW} by the same authors together with M. Musta\c{t}\u{a},
which bounds $c^J(\a)$ in terms of the multiplicities $e(\a)$ and $e(J)$, when
$\a$ and $J$ are zero-dimensional ideals and $J$ is generated by a system of
parameters. We prove the conjecture when $\a$ and $J$ are generated by
homogeneous systems of parameters in a Noetherian graded $k$-algebra. We also
prove a similar inequality involving, instead of the $F$-threshold, the jumping
number for the generalized parameter test submodules introduced in \cite{ST}.
","[{""version"":""v1"",""created"":""Mon, 21 Dec 2009 15:06:57 GMT""},{""version"":""v2"",""created"":""Wed, 17 Feb 2010 03:32:50 GMT""}]","2015-01-14"
"0912.3861","Min Yang","Min Yang","On the de la Garza Phenomenon",,,,,"stat.ME","http://arxiv.org/licenses/nonexclusive-distrib/1.0/","  Deriving optimal designs for nonlinear models is in general challenging. One
crucial step is to determine the number of support points needed. Current tools
handle this on a case-by-case basis. Each combination of model, optimality
criterion and objective requires its own proof. The celebrated de la Garza
Phenomenon states that under a (p-1)th-degree polynomial regression model, any
optimal design can be based on at most p design points, the minimum number of
support points such that all parameters are estimable. Does this conclusion
also hold for nonlinear models? If the answer is yes, it would be relatively
easy to derive any optimal design, analytically or numerically. In this paper,
a novel approach is developed to address this question. Using this new
approach, it can be easily shown that the de la Garza phenomenon exists for
many commonly studied nonlinear models, such as the Emax model, exponential
model, three- and four-parameter log-linear models, Emax-PK1 model, as well as
many classical polynomial regression models. The proposed approach unifies and
extends many well-known results in the optimal design literature. It has four
advantages over current tools: (i) it can be applied to many forms of nonlinear
models; to continuous or discrete data; to data with homogeneous or
non-homogeneous errors; (ii) it can be applied to any design region; (iii) it
can be applied to multiple-stage optimal design; and (iv) it can be easily
implemented.
","[{""version"":""v1"",""created"":""Mon, 21 Dec 2009 05:15:42 GMT""}]","2009-12-22"
"0912.3876","Muzafar Maksumov Nusratullaevich","E.I.Ivannikova and M.N.Maksumov","On the possible critical behaviour of a marginally stable stellar disc","16 pages, 1 figure",,,,"astro-ph.GA","http://creativecommons.org/licenses/by-nc-sa/3.0/","  Using hydrodynamic approach, it is shown that the properties of a marginally
stable collisionless stellar disc resemble those of a thermodynamic system
undergoing a gas--liquid phase transition. The maximum in Toomre's stability
diagram, which separates gravitationally stable and unstable states with
respect to axisymmetric perturbations, can be treated as a critical point for
this transition. Static perturbations of stellar density are explored and the
mean perturbation amplitude is considered as the order parameter of the theory.
The disc's state is assumed to change as the disc passes through the critical
point. Since the disc tends to retain hydrostatic equilibrium, structures can
be formed spontaneously, identifiable with a seed spiral structure. A power-law
scaling of the order parameter in the vicinity of the critical point has been
found. The susceptibility and other Landau--Weiss exponents similar to those in
the Van der Waals theory are calculated. The critical behaviour of marginally
stable discs at the initial stage of their evolution occurs in numerical
simulations where snapshots of stellar positions reveal stellar splinters and
crescents diverging from the disc centre. These structures can be a result of
the phase transition. In numerical simulations, these structures eventually
reduce to decaying worm-type features because of the `heating' most likely
resulting from instability of stellar orbits due to resonances. Under
favourable conditions the critical behaviour leading to the establishment of
order in a stellar disc can result in the generation of a spiral structure.
","[{""version"":""v1"",""created"":""Mon, 21 Dec 2009 10:24:14 GMT""},{""version"":""v2"",""created"":""Mon, 4 Jan 2010 09:50:45 GMT""}]","2010-01-04"
"0912.3897","Richard Shurtleff","Richard Shurtleff","Ultra-High Energy Cosmic Rays from Galactic Supernovae","8 pages. This version, version 2, is updated with results from the
  LHC and Tevatron. It contains new comments. The underlying calculation is
  simplified, but not fundamentally changed from version 1","International Journal of Pure and Applied Physics (IJPAP). Vol. 8
  #3 (2012) pp. 135-142",,,"astro-ph.HE astro-ph.GA hep-ph","http://arxiv.org/licenses/nonexclusive-distrib/1.0/","  Suppose that even the highest energy cosmic rays (CRs) observed on Earth are
protons accelerated in local Milky Way Galaxy sources, with few if any from
more distant sources. In this paper we treat the problem that supernovae
remnants likely produce protons with energies up to about a PeV, but CRs with
100s of EeV energy are observed. We assume with minimal comment the idea that
`new physics' is at work and we accept that a CR's collision energy at the
Earth exceeds its kinetic energy as it travels through the Galaxy. There is
some evidence that the collision energy-kinetic energy difference has been seen
at the Tevatron and LHC, but it is small enough to attribute to standard
physics. This sets the threshold for energy bifurcation. Based on this
threshold and the CR spectrum endpoint, a formula for collision energy as a
function of kinetic energy is derived. With the function and the observed CR
spectrum we can predict the average spectrum of CR sources. Also we can
estimate the collision energies of proton beams as terrestrial particle
accelerators advance and produce beams with higher kinetic energies.
","[{""version"":""v1"",""created"":""Mon, 21 Dec 2009 13:26:01 GMT""},{""version"":""v2"",""created"":""Mon, 23 Jul 2012 16:42:30 GMT""}]","2013-05-06"
"0912.3934","Daniel Gezari","Daniel Y. Gezari","Lunar Laser Ranging Test of the Invariance of c","16 pages, 4 figures, submitted to Il Nuovo Cimento",,,,"physics.gen-ph","http://arxiv.org/licenses/nonexclusive-distrib/1.0/","  The speed of laser light pulses launched from Earth and returned by a
retro-reflector on the Moon was calculated from precision round-trip
time-of-flight measurements and modeled distances. The measured speed of light
(c) in the moving observers rest frame was found to exceed the canonical value
c = 299,792,458 m/s by 200+/-10 m/s, just the speed of the observatory along
the line-of-sight due to the rotation of the Earth during the measurements.
This is a first-order violation of local Lorentz invariance; the speed of light
seems to depend on the motion of the observer after all, as in classical wave
theory, and implies that a preferred reference frame exists for the propagation
of light. However, the present experiment cannot identify the physical system
to which such a reference frame might be tied.
","[{""version"":""v1"",""created"":""Sun, 20 Dec 2009 23:35:18 GMT""},{""version"":""v2"",""created"":""Thu, 24 Dec 2009 20:58:25 GMT""},{""version"":""v3"",""created"":""Tue, 22 Jun 2010 18:41:29 GMT""}]","2010-06-23"
"0912.3937","C. W. J. Beenakker","I. Serban, B. Beri, A.R. Akhmerov, C.W.J. Beenakker","Domain wall in a chiral p-wave superconductor: a pathway for electrical
  current","6 pages, 3 figures","Phys. Rev. Lett. 104, 147001 (2010)","10.1103/PhysRevLett.104.147001",,"cond-mat.supr-con cond-mat.mes-hall","http://arxiv.org/licenses/nonexclusive-distrib/1.0/","  Superconductors with p+ip pairing symmetry are characterized by chiral edge
states, but these are difficult to detect in equilibrium since the resulting
magnetic field is screened by the Meissner effect. Nonequilibrium detection is
hindered by the fact that the edge excitations are unpaired Majorana fermions,
which cannot transport charge near the Fermi level. Here we show that the
boundary between p_x+ip_y and p_x-ip_y domains forms a one-way channel for
electrical charge. We derive a product rule for the domain wall conductance,
which allows to cancel the effect of a tunnel barrier between metal electrodes
and superconductor and provides a unique signature of topological
superconductors in the chiral p-wave symmetry class.
","[{""version"":""v1"",""created"":""Mon, 21 Dec 2009 08:35:15 GMT""}]","2013-07-09"
"0912.3976","Alexander Kusenko","Warren Essey, Oleg E. Kalashev, Alexander Kusenko, John F. Beacom","Secondary photons and neutrinos from cosmic rays produced by distant
  blazars","4 pages, 2 figures; final version accepted for publication in PRL","Phys.Rev.Lett.104:141102,2010","10.1103/PhysRevLett.104.141102","UCLA/09/TEP/61, IPMU10-0044","astro-ph.HE hep-ph","http://arxiv.org/licenses/nonexclusive-distrib/1.0/","  Secondary photons and neutrinos produced in the interactions of cosmic ray
protons emitted by distant Active Galactic Nuclei (AGN) with the photon
background along the line of sight can reveal a wealth of new information about
the intergalactic magnetic fields (IGMF), extragalactic background light (EBL),
and the acceleration mechanisms of cosmic rays. The secondary photons may have
already been observed by gamma-ray telescopes. We show that the secondary
neutrinos improve the prospects of discovering distant blazars by IceCube, and
we discuss the ramifications for the cosmic backgrounds, magnetic fields, and
AGN models.
","[{""version"":""v1"",""created"":""Mon, 21 Dec 2009 05:38:10 GMT""},{""version"":""v2"",""created"":""Mon, 1 Mar 2010 21:05:23 GMT""},{""version"":""v3"",""created"":""Fri, 19 Mar 2010 21:59:51 GMT""}]","2012-04-03"
"0912.3995","Niranjan Srinivas","Niranjan Srinivas, Andreas Krause, Sham M. Kakade and Matthias Seeger","Gaussian Process Optimization in the Bandit Setting: No Regret and
  Experimental Design",,,"10.1109/TIT.2011.2182033",,"cs.LG","http://arxiv.org/licenses/nonexclusive-distrib/1.0/","  Many applications require optimizing an unknown, noisy function that is
expensive to evaluate. We formalize this task as a multi-armed bandit problem,
where the payoff function is either sampled from a Gaussian process (GP) or has
low RKHS norm. We resolve the important open problem of deriving regret bounds
for this setting, which imply novel convergence rates for GP optimization. We
analyze GP-UCB, an intuitive upper-confidence based algorithm, and bound its
cumulative regret in terms of maximal information gain, establishing a novel
connection between GP optimization and experimental design. Moreover, by
bounding the latter in terms of operator spectra, we obtain explicit sublinear
regret bounds for many commonly used covariance functions. In some important
cases, our bounds have surprisingly weak dependence on the dimensionality. In
our experiments on real sensor data, GP-UCB compares favorably with other
heuristical GP optimization approaches.
","[{""version"":""v1"",""created"":""Mon, 21 Dec 2009 00:08:19 GMT""},{""version"":""v2"",""created"":""Thu, 4 Feb 2010 06:15:15 GMT""},{""version"":""v3"",""created"":""Sat, 13 Feb 2010 18:24:43 GMT""},{""version"":""v4"",""created"":""Wed, 9 Jun 2010 23:24:13 GMT""}]","2015-03-13"
"0912.4012","Panayotis Mertikopoulos","Panayotis Mertikopoulos and Aris L. Moustakas","Balancing Traffic in Networks: Redundancy, Learning and the Effect of
  Stochastic Fluctuations","39 pages, 4 figures. Incorporated material on nonatomic potential
  games and Braess's paradox; some minor typos have now been corrected",,,,"math.PR cs.GT cs.IT cs.NI math.IT","http://arxiv.org/licenses/nonexclusive-distrib/1.0/","  We study the distribution of traffic in networks whose users try to minimise
their delays by adhering to a simple learning scheme inspired by the replicator
dynamics of evolutionary game theory. The stable steady states of these
dynamics coincide with the network's Wardrop equilibria and form a convex
polytope whose dimension is determined by the network's redundancy (an
important concept which measures the ""linear dependence"" of the users' paths).
Despite this abundance of stationary points, the long-term behaviour of the
replicator dynamics turns out to be remarkably simple: every solution orbit
converges to a Wardrop equilibrium.
  On the other hand, a major challenge occurs when the users' delays fluctuate
unpredictably due to random external factors. In that case, interior equilibria
are no longer stationary, but strict equilibria remain stochastically stable
irrespective of the fluctuations' magnitude. In fact, if the network has no
redundancy and the users are patient enough, we show that the long-term
averages of the users' traffic flows converge to the vicinity of an
equilibrium, and we also estimate the corresponding invariant measure.
","[{""version"":""v1"",""created"":""Mon, 21 Dec 2009 09:15:24 GMT""},{""version"":""v2"",""created"":""Sat, 27 Feb 2010 12:15:40 GMT""}]","2010-02-27"
"0912.4017","Feng-Wen An","Feng-Wen An","Algebraic Anabelian Functors","48 pages",,,,"math.AG math.NT","http://arxiv.org/licenses/nonexclusive-distrib/1.0/","  In this paper we will prove that there exists a covariant functor, called
algebraic anabelian functor, from the category of algebraic schemes over a
given field to the category of outer homomorphism sets of groups. The algebraic
anabelian functor, given in a canonical manner, is full and faithful. It
reformulates the anabelian geometry over a field. As an application of the
anabelian functor, we will also give a proof of the section conjecture of
Grothendieck for the case of algebraic schemes.
","[{""version"":""v1"",""created"":""Mon, 21 Dec 2009 12:34:42 GMT""}]","2009-12-22"
"0912.4020","Gia-Wei Chern","Gia-Wei Chern","Three-dimensional topological phases in a layered honeycomb spin-orbital
  model","10 pages, 5 figures","Phys. Rev. B 81, 125134 (2010)","10.1103/PhysRevB.81.125134",,"cond-mat.mes-hall cond-mat.str-el","http://arxiv.org/licenses/nonexclusive-distrib/1.0/","  We present an exactly solvable spin-orbital model based on the Gamma-matrix
generalization of a Kitaev-type Hamiltonian. In the presence of small magnetic
fields, the model exhibits a critical phase with a spectrum characterized by
topologically protected Fermi points. Upon increasing the magnetic field, Fermi
points carrying opposite topological charges move toward each other and
annihilate at a critical field, signaling a phase transition into a gapped
phase with trivial topology in three dimensions. On the other hand, by
subjecting the system to a staggered magnetic field, an effective time-reversal
symmetry essential to the existence of three-dimensional topological insulators
is restored in the auxiliary free fermion problem. The nontrivial topology of
the gapped ground state is characterized by an integer winding number and
manifests itself through the appearance of gapless Majorana fermions confined
to the two-dimensional surface of a finite system.
","[{""version"":""v1"",""created"":""Mon, 21 Dec 2009 15:53:38 GMT""},{""version"":""v2"",""created"":""Thu, 11 Feb 2010 21:36:00 GMT""}]","2010-07-13"
