"0912.4046","Jennifer Hom","Jennifer Hom","A note on cabling and L-space surgeries","3 pages","Algebraic & Geometric Topology 11 (2011) 219-223","10.2140/agt.2011.11.219",,"math.GT","http://arxiv.org/licenses/nonexclusive-distrib/1.0/","  We prove that the (p,q)-cable of a knot K in S^3 admits a positive L-space
surgery if and only if K admits a positive L-space surgery and q/p \geq
2g(K)-1, where g(K) is the Seifert genus of K. The ""if"" direction is due to
Hedden.
","[{""version"":""v1"",""created"":""Sun, 20 Dec 2009 19:33:54 GMT""}]","2011-11-29"
"0912.4047","Michael Bordag","M. Bordag, I. Pirozhenko","Vacuum energy between a sphere and a plane at finite temperature","14 pages, 3 figures, revised version with several improvements","Phys.Rev.D81:085023,2010","10.1103/PhysRevD.81.085023",,"quant-ph","http://arxiv.org/licenses/nonexclusive-distrib/1.0/","  We consider the Casimir effect for a sphere in front of a plane at finite
temperature for scalar and electromagnetic fields and calculate the limiting
cases. For small separation we compare the exact results with the corresponding
ones obtained in proximity force approximation. For the scalar field with
Dirichlet boundary conditions, the low temperature correction is of order $T^2$
like for parallel planes. For the electromagnetic field it is of order $T^4$.
For high temperature we observe the usual picture that the leading order is
given by the zeroth Matsubara frequency. The non-zero frequencies are
exponentially suppressed except for the case of close separation.
","[{""version"":""v1"",""created"":""Mon, 21 Dec 2009 15:07:04 GMT""},{""version"":""v2"",""created"":""Wed, 24 Mar 2010 06:31:35 GMT""}]","2015-03-13"
"0912.4048","Edward Miller","Sylvain E. Cappell and Edward Y. Miller","Eigenvalues of Transmission Graph Laplacians",,,,,"math.CO cs.DM","http://arxiv.org/licenses/nonexclusive-distrib/1.0/","  The standard notion of the Laplacian of a graph is generalized to the setting
of a graph with the extra structure of a ``transmission`` system. A
transmission system is a mathematical representation of a means of transmitting
(multi-parameter) data along directed edges from vertex to vertex. The
associated transmission graph Laplacian is shown to have many of the former
properties of the classical case, including: an upper Cheeger type bound on the
second eigenvalue minus the first of a geometric isoperimetric character,
relations of this difference of eigenvalues to diameters for k-regular graphs,
eigenvalues for Cayley graphs with transmission systems. An especially natural
transmission system arises in the context of a graph endowed with an
association. Other relations to transmission systems arising naturally in
quantum mechanics, where the transmission matrices are scattering matrices, are
made. As a natural merging of graph theory and matrix theory, there are
numerous potential applications, for example to random graphs and random
matrices.
","[{""version"":""v1"",""created"":""Sun, 20 Dec 2009 20:30:39 GMT""}]","2009-12-22"
"0912.4049","Elem\'er Rosinger","Elemer E Rosinger","Local Functions : Algebras, Ideals, and Reduced Power Algebras",,,,,"math.GM","http://arxiv.org/licenses/nonexclusive-distrib/1.0/","  A further significant extension is presented of the infinitely large class of
differential algebras of generalized functions which are the basic structures
in the nonlinear algebraic theory listed under 46F30 in the AMS Mathematical
Subject Classification. These algebras are constructed as {\it reduced powers},
when seen in terms of Model Theory. The major advantage of these differential
algebras of generalized functions is that they allow their elements to have
singularities on {\it dense} subsets of their domain of definition, and {\it
without} any restrictions on the respective generalized functions in the
neighbourhood of their singularities. Their applications have so far been in 1)
solving large classes of systems of nonlinear PDEs, 2) highly singular problems
in Differential Geometry, with respective applications in modern Physics,
including General Relativity and Quantum Gravity. These infinite classes of
algebras contain as a particular case the Colombeau algebras, since in the
latter algebras rather strongly limiting growth conditions, namely, of
polynomial type, are required on the generalized functions in the neighbourhood
of their singularities.
","[{""version"":""v1"",""created"":""Sun, 20 Dec 2009 20:38:14 GMT""},{""version"":""v2"",""created"":""Mon, 4 Jan 2010 23:39:28 GMT""},{""version"":""v3"",""created"":""Mon, 28 Jun 2010 13:40:52 GMT""}]","2010-06-29"
"0912.4050","Michael M. Scherer","S. Floerchinger, M. M. Scherer, C. Wetterich","Modified Fermi-sphere, pairing gap and critical temperature for the
  BCS-BEC crossover","8 pages, 7 figures, minor change in figures 2 and 3 (correction of
  axis label)","Phys.Rev.A81:063619,2010","10.1103/PhysRevA.81.063619",,"cond-mat.quant-gas","http://arxiv.org/licenses/nonexclusive-distrib/1.0/","  We investigate the phase diagram of two-component fermions in the BCS-BEC
crossover. Using functional renormalization group equations we calculate the
effect of quantum fluctuations on the fermionic self-energy parametrized by a
wavefunction renormalization, an effective Fermi radius and the gap. This
allows us to follow the modifications of the Fermi surface and the dispersion
relation for fermionic excitations throughout the whole crossover region. We
also determine the critical temperature of the second order phase transition to
superfluidity. Our results are in agreement with BCS theory including Gorkov's
correction for small negative scattering length a and with an interacting Bose
gas for small positive a. At the unitarity point the result for the gap at zero
temperature agrees well with Quantum-Monte-Carlo simulations while the critical
temperature differs.
","[{""version"":""v1"",""created"":""Sun, 20 Dec 2009 20:42:29 GMT""},{""version"":""v2"",""created"":""Mon, 9 Aug 2010 09:11:16 GMT""},{""version"":""v3"",""created"":""Thu, 11 Nov 2010 16:53:07 GMT""}]","2010-11-12"
"0912.4051","Claudio Grillo","C. Grillo and R. Gobat","On the Initial Mass Function and tilt of the Fundamental Plane of
  massive early-type galaxies","5 pages, 2 figures, accepted by MNRAS",,"10.1111/j.1745-3933.2009.00803.x",,"astro-ph.CO","http://arxiv.org/licenses/nonexclusive-distrib/1.0/","  We investigate the most plausible stellar Initial Mass Function (IMF) and the
main origin of the tilt of the Fundamental Plane (FP) for old, massive
early-type galaxies. We consider a sample of 13 bright galaxies of the Coma
cluster and combine our results with those obtained from a sample of 57 lens
galaxies in the same luminous mass range. We estimate the luminous mass and
stellar mass-to-light ratio values of the sample galaxies by fitting their SDSS
multi-band photometry with composite stellar population models computed with
different dust-free, solar-metallicity templates and IMFs. We compare these
measurements and those derived from two-component orbit-based dynamical
modelling. The photometric and dynamical luminous mass estimates of the
galaxies in our sample are consistent, within the errors, if a Salpeter IMF is
adopted. On the contrary, with a Kroupa or Chabrier IMF the two luminous mass
diagnostics differ at a more than 4 \sigma level. For the massive Coma
galaxies, their stellar mass-to-light ratio scales with luminous mass as the
corresponding effective quantities are observed to scale on the FP. This
indicates that the tilt of the FP is primarily caused by stellar population
properties. We conclude that old, massive lens and non-lens early-type galaxies
obey the same luminous and dynamical scaling relations, favour a Salpeter IMF,
and suggest a stellar population origin for the tilt of the FP. The validity of
these results for samples of early-type galaxies with different age and mass
properties still remains to be tested.
","[{""version"":""v1"",""created"":""Sun, 20 Dec 2009 21:00:03 GMT""},{""version"":""v2"",""created"":""Wed, 23 Dec 2009 13:30:10 GMT""}]","2015-05-14"
"0912.4052","Kurt Jacobs","Luciano Silvestri, Kurt Jacobs, Vanja Dunjko, Maxim Olshanii","Typical, finite baths as a means of exact simulation of open quantum
  systems","11 pages, revtex4-1, 5 png figures. v2: better results, further
  details; v4: extended presentation, new results included; v5: added
  discussion of entropy production","Phys. Rev. E 89, 042131 (2014)","10.1103/PhysRevE.89.042131",,"quant-ph","http://arxiv.org/licenses/nonexclusive-distrib/1.0/","  There is presently considerable interest in accurately simulating the
evolution of open systems for which Markovian master equations fail. Examples
are systems that are time-dependent and/or strongly damped. A number of elegant
methods have now been devised to do this, but all use a bath consisting of a
continuum of harmonic oscillators. While this bath is clearly appropriate for,
e.g., systems coupled to the EM field, it is not so clear that it is a good
model for generic many-body systems. Here we explore a different approach to
exactly simulating open-systems: using a finite bath chosen to have certain key
properties of thermalizing many-body systems. To explore the numerical
resources required by this method to approximate an open system coupled to an
infinite bath, we simulate a weakly damped system and compare to the evolution
given by the relevant Markovian master equation. We obtain the Markovian
evolution with reasonable accuracy by using an additional averaging procedure,
and elucidate how the typicality of the bath generates the correct thermal
steady-state via the process of ""eigenstate thermalization"".
","[{""version"":""v1"",""created"":""Mon, 21 Dec 2009 04:53:36 GMT""},{""version"":""v2"",""created"":""Tue, 29 Dec 2009 01:49:53 GMT""},{""version"":""v3"",""created"":""Tue, 11 May 2010 05:06:10 GMT""},{""version"":""v4"",""created"":""Thu, 18 Jul 2013 16:53:59 GMT""},{""version"":""v5"",""created"":""Wed, 9 Apr 2014 17:58:32 GMT""}]","2014-04-23"
"0912.4053","Maciej Niebrzydowski","Maciej Niebrzydowski","Coloring invariants of spatial graphs","12 pages, 9 figures","Journal of Knot Theory and Its Ramifications, Vol. 19, No. 06
  (2010), 829-841",,,"math.GT","http://arxiv.org/licenses/nonexclusive-distrib/1.0/","  We define the fundamental quandle of a spatial graph and several invariants
derived from it. In the category of graph tangles, we define an invariant based
on the walks in the graph and cocycles from nonabelian quandle cohomology.
","[{""version"":""v1"",""created"":""Sun, 20 Dec 2009 21:29:55 GMT""},{""version"":""v2"",""created"":""Wed, 23 Dec 2009 17:41:34 GMT""},{""version"":""v3"",""created"":""Mon, 7 Jun 2010 00:20:23 GMT""},{""version"":""v4"",""created"":""Wed, 9 Jun 2010 04:45:50 GMT""}]","2019-10-29"
"0912.4054","Eugenio Bianchi","Eugenio Bianchi, Elena Magliaro, Claudio Perini","Coherent spin-networks","15 pages","Phys.Rev.D82:024012,2010","10.1103/PhysRevD.82.024012",,"gr-qc","http://arxiv.org/licenses/nonexclusive-distrib/1.0/","  In this paper we discuss a proposal of coherent states for Loop Quantum
Gravity. These states are labeled by a point in the phase space of General
Relativity as captured by a spin-network graph. They are defined as the gauge
invariant projection of a product over links of Hall's heat-kernels for the
cotangent bundle of SU(2). The labels of the state are written in terms of two
unit-vectors, a spin and an angle for each link of the graph. The heat-kernel
time is chosen to be a function of the spin. These labels are the ones used in
the Spin Foam setting and admit a clear geometric interpretation. Moreover, the
set of labels per link can be written as an element of SL(2,C). Therefore,
these states coincide with Thiemann's coherent states with the area operator as
complexifier. We study the properties of semiclassicality of these states and
show that, for large spins, they reproduce a superposition over spins of
spin-networks with nodes labeled by Livine-Speziale coherent intertwiners.
Moreover, the weight associated to spins on links turns out to be given by a
Gaussian times a phase as originally proposed by Rovelli.
","[{""version"":""v1"",""created"":""Sun, 20 Dec 2009 21:11:09 GMT""},{""version"":""v2"",""created"":""Mon, 1 Feb 2010 20:34:10 GMT""},{""version"":""v3"",""created"":""Mon, 22 Feb 2010 22:31:52 GMT""},{""version"":""v4"",""created"":""Fri, 17 Sep 2010 18:28:26 GMT""}]","2010-09-20"
"0912.4055","Sergey Khoroshkin","Sergey Khoroshkin and Oleg Ogievetsky","Diagonal reduction algebras of $\gl$ type","24 pages, no figures",,,,"math.RT","http://arxiv.org/licenses/nonexclusive-distrib/1.0/","  Several general properties, concerning reduction algebras - rings of
definition and algorithmic efficiency of the set of ordering relations - are
discussed. For the reduction algebras, related to the diagonal embedding of the
Lie algebra $gl_n$ into $gl_n \oplus gl_n$, we establish a stabilization
phenomenon and list the complete sets of defining relations.
","[{""version"":""v1"",""created"":""Sun, 20 Dec 2009 21:14:25 GMT""}]","2009-12-22"
"0912.4056","Jeremy Shears","Jeremy Shears, Ian Miller and Richard Sabo","Measuring the superhump period of the dwarf nova RX J1715.6+6856","10 pages, 7 Figures. Accepted for publication in the Journal of the
  British Astronomical Association",,,,"astro-ph.SR","http://arxiv.org/licenses/nonexclusive-distrib/1.0/","  We report unfiltered CCD observations of the first confirmed superoutburst of
the dwarf nova RX J1715.6+6856 in August 2009. At quiescence the star was
magnitude 18.3 (CCD, clear). The outburst amplitude was at least 2.4 magnitudes
and it lasted at least 6 days, although the first part of the outburst was
probably missed. Analysis of the light curve revealed superhumps with
peak-to-peak amplitude of 0.1 magnitude, thereby showing it to be a member of
the SU UMa family. The mean superhump period was Psh = 0.07086(78) d with a
superhump period excess of epsilon = 0.038 and an estimated mass ratio q =
0.167. In the final stages of the outburst, as the star approached quiescence,
the superhumps disappeared to be replaced by a modulation corresponding to the
orbital period. The star was regularly monitored between August 2007 and
September 2009 revealing a total of 12 outbursts, with an outburst frequency of
approximately once per month.
","[{""version"":""v1"",""created"":""Sun, 20 Dec 2009 21:45:35 GMT""}]","2009-12-22"
"0912.4057","Benjamin Bayman","B. F. Bayman and F. Zardi","Coulomb Excitation of Multi-Phonon Levels of the Giant Dipole Resonance","16 pages, 5 figures","Phys.Rev.C81:037901,2010","10.1103/PhysRevC.81.037901",,"nucl-th","http://arxiv.org/licenses/nonexclusive-distrib/1.0/","  A closed expression is obtained for the cross-section for Coulomb excitation
of levels of the giant dipole resonance of given angular momentum and phonon
number. Applications are made to the Goldhaber-Teller and Steinwedel-Jensen
descriptions of the resonance, at non-relativistic and relativistic bombarding
energies.
","[{""version"":""v1"",""created"":""Sun, 20 Dec 2009 23:16:10 GMT""}]","2014-11-20"
"0912.4058","Vera Bendkowsky","V. Bendkowsky, B. Butscher, J. Nipper, J. Balewski, J. P. Shaffer, R.
  L\""ow, T. Pfau, W. Li, J. Stanojevic, T. Pohl, J. M. Rost","Rydberg trimers and excited dimers bound by internal quantum reflection","6 pages, 3 figures, 1 table",,"10.1103/PhysRevLett.105.163201",,"physics.atom-ph physics.chem-ph","http://arxiv.org/licenses/nonexclusive-distrib/1.0/","  Quantum reflection is a pure wave phenomena that predicts reflection of a
particle at a changing potential for cases where complete transmission occurs
classically. For a chemical bond, we find that this effect can lead to
non-classical vibrational turning points and bound states at extremely large
interatomic distances. Only recently has the existence of such ultralong-range
Rydberg molecules been demonstrated experimentally. Here, we identify a broad
range of molecular lines, most of which are shown to originate from two
different novel sources: a single-photon associated triatomic molecule formed
by a Rydberg atom and two ground state atoms and a series of excited dimer
states that are bound by a so far unexplored mechanism based on internal
quantum reflection at a steep potential drop. The properties of the Rydberg
molecules identified in this work qualify them as prototypes for a new type of
chemistry at ultracold temperatures.
","[{""version"":""v1"",""created"":""Sun, 20 Dec 2009 22:06:13 GMT""}]","2011-02-22"
"0912.4059","Graca Rocha Dr.","G. Rocha, C. R. Contaldi, J. R. Bond, K. M. Gorski","Application of XFaster power spectrum and likelihood estimator to Planck","25 pages, 20 figures, updated to reflect published version: slightly
  extended account of XFaster technique, added improved plots and minor
  corrections. Accepted for publication in MNRAS",,,,"astro-ph.CO astro-ph.IM","http://arxiv.org/licenses/nonexclusive-distrib/1.0/","  We develop the XFaster Cosmic Microwave Background (CMB) temperature and
polarization anisotropy power spectrum and likelihood technique for the Planck
CMB satellite mission. We give an overview of this estimator and its current
implementation and present the results of applying this algorithm to simulated
Planck data. We show that it can accurately extract the power spectrum of
Planck data for the high-l multipoles range. We compare the XFaster
approximation for the likelihood to other high-l likelihood approximations such
as Gaussian and Offset Lognormal and a low-l pixel-based likelihood. We show
that the XFaster likelihood is not only accurate at high-l, but also performs
well at moderately low multipoles. We also present results for cosmological
parameter Markov Chain Monte Carlo estimation with the XFaster likelihood. As
long as the low-l polarization and temperature power are properly accounted
for, e.g., by adding an adequate low-l likelihood ingredient, the input
parameters are recovered to a high level of accuracy.
","[{""version"":""v1"",""created"":""Mon, 21 Dec 2009 11:23:40 GMT""},{""version"":""v2"",""created"":""Fri, 12 Nov 2010 07:42:55 GMT""}]","2015-03-13"
"0912.4060","Daniel Soudry","Daniel Soudry, Ron Meir","History dependent dynamics in a generic model of ion channels - an
  analytic study","Several small modifications and corrections were made to last
  version, due to reviewer comments. The only major change - we added two
  further sub-sections in Methods (sections 4.1.4 and 4.3.3) and one section
  (G) in the Supplementary Information.","Front.Comput.Neurosci.4:3.(2010)","10.3389/fncom.2010.00003",,"q-bio.SC q-bio.NC q-bio.QM","http://arxiv.org/licenses/nonexclusive-distrib/1.0/","  Recent experiments have demonstrated that the timescale of adaptation of
single neurons and ion channel populations to stimuli slows down as the length
of stimulation increases; in fact, no upper bound on temporal time-scales seems
to exist in such systems. Furthermore, patch clamp experiments on single ion
channels have hinted at the existence of large, mostly unobservable,
inactivation state spaces within a single ion channel. This raises the question
of the relation between this multitude of inactivation states and the observed
behavior. In this work we propose a minimal model for ion channel dynamics
which does not assume any specific structure of the inactivation state space.
The model is simple enough to render an analytical study possible. This leads
to a clear and concise explanation of the experimentally observed exponential
history-dependent relaxation in sodium channels in a voltage clamp setting, and
shows that their recovery rate from slow inactivation must be voltage
dependent. Furthermore, we predict that history-dependent relaxation cannot be
created by overly sparse spiking activity. While the model was created with ion
channel populations in mind, its simplicity and genericalness render it a good
starting point for modeling similar effects in other systems, and for scaling
up to higher levels such as single neurons which are also known to exhibit
multiple time scales.
","[{""version"":""v1"",""created"":""Sun, 20 Dec 2009 22:47:39 GMT""},{""version"":""v2"",""created"":""Wed, 28 Apr 2010 18:59:27 GMT""}]","2010-04-29"
"0912.4061","Aleks Kleyn","Aleks Kleyn","Linear Equation in Finite Dimensional Algebra","English text - 7 pages; Russian text - 8 pages",,,,"math.GM","http://arxiv.org/licenses/nonexclusive-distrib/1.0/","  In the paper I considered methods for solving equations of the form axb+cxd=e
in the algebra which is finite dimensional over the field.
","[{""version"":""v1"",""created"":""Mon, 21 Dec 2009 02:49:37 GMT""},{""version"":""v2"",""created"":""Tue, 26 Jan 2010 03:33:19 GMT""},{""version"":""v3"",""created"":""Mon, 30 Apr 2012 15:58:12 GMT""}]","2012-05-01"
"0912.4062","Emil Vassev Dr.","Emil Vassev","Process Description of COM Object Life Cycle","15 pages, 7 figures",,,,"cs.OS cs.SE","http://arxiv.org/licenses/nonexclusive-distrib/1.0/","  The objective of this article is to provide for the reader a basic
description of all the steps involved in the COM object life-cycle process. COM
is a software technology and process performer. The first section briefly
introduces the Component Object Model (COM), considering the process of the COM
object life cycle as the baseline of all COM issues. The second part describes
in detail the basic steps of the process - client request, server location,
object creation, interaction, and disconnection. A brief description is given
for the components involved in each step. Finally, the third section provides a
brief conclusion summarizing all the process steps.
","[{""version"":""v1"",""created"":""Sun, 20 Dec 2009 23:49:25 GMT""}]","2009-12-22"
"0912.4063","Steven Verpoort","Steven Verpoort","A Characterisation of Manhart's Relative Normal Vector Fields","12 pages, 1 figure",,,,"math.DG","http://arxiv.org/licenses/nonexclusive-distrib/1.0/","  In this article a relation between curvature functionals for surfaces in the
Euclidean space and area functionals in relative differential geometry will be
given. Relative differential geometry can be described as the geometry of
surfaces in the affine space, endowed with a distinguished ""relative normal
vector field"" which generalises the notion of unit normal vector field N from
Euclidean differential geometry. A concise review of relative differential
geometry will be presented. The main result, to which the title of this article
refers, will be given in the third section. Here we consider, for a function
$f$ of two variables, relative normal vector fields of the form
$f(H,K)\,N-\grad_{\II}(f(H,K))$ for non-degenerate surfaces in the Euclidean
three-dimensional space. A comparison of the variation of the curvature
functional $\int f(H,K)\,\dd\Omega$ with the relative area functional obtained
from the above relative normal vector field, results in a distinguishing
property for the one-parameter family of relative normal vector fields which
was introduced by F.\ Manhart, and which is obtained by choosing
$f(H,K)=|K|^{\alpha}$ (where we will assume that $\alpha\neq 1$). More
precisely, the following will be shown in theorem~6: ``{The curvature
functionals $(\ast)$ for which the critical points coincide with the
relative-minimal surfaces with respect to the relative normal vector field
$(\dagger)$, are essentially those obtained from Manhart's family}."" In the
fourth section, we give a characterisation of the sphere by means of relations
between the support function and the curvatures. In the last section, we
combine the previously described results and arrive at a variational
characterisation of the sphere.
","[{""version"":""v1"",""created"":""Sun, 20 Dec 2009 23:52:38 GMT""}]","2009-12-22"
"0912.4064","Steven Verpoort","Steven Verpoort","Some Modifications of the Theorem of Beltrami","19 pages, 3 figures",,,,"math.DG","http://arxiv.org/licenses/nonexclusive-distrib/1.0/","  The two main topics of this text are as follows: Firstly, three modifications
of the theorem of Beltrami will be presented for diffeomorphisms between
Riemannian manifolds and a space form which preserve the geodesic circles, the
geodesic hyperspheres, or the minimal surfaces, respectively. Secondly, it is
defined what it means for an infinitesimal deformation of a metric to preserve
the geodesics up to first order, and a corresponding infinitesimal version of
Beltrami's theorem is given.
","[{""version"":""v1"",""created"":""Mon, 21 Dec 2009 00:03:19 GMT""}]","2009-12-22"
"0912.4065","Jeffrey Matayoshi","Jeffrey Matayoshi","The K-level crossings of a random algebraic polynomial with dependent
  coefficients",,,,,"math.PR","http://arxiv.org/licenses/nonexclusive-distrib/1.0/","  For a random polynomial with standard normal coefficients, two cases of the
K-level crossings have been considered by Farahmand. When the coefficients are
independent, Farahmand was able to derive an asymptotic value for the expected
number of level crossings, even if K is allowed to grow to infinity.
Alternatively, it was shown that when the coefficients have a constant
covariance, the expected number of level crossings is reduced by half. In this
paper we are interested in studying the behavior for dependent standard normal
coefficients where the covariance is decaying and no longer constant. Using
techniques similar to those of Farahmand, we will be able to show that for a
wide range of covariance functions behavior similar to the independent case can
be expected.
","[{""version"":""v1"",""created"":""Mon, 21 Dec 2009 00:03:52 GMT""}]","2009-12-22"
