"0912.4128","Keijo Kajantie","J. Alanen, K. Kajantie","Thermodynamics of a field theory with infrared fixed point from
  gauge/gravity duality","10 pages, 4 figures, references and comment on an alternative way of
  deriving the phase structure added","Phys.Rev.D81:046003,2010","10.1103/PhysRevD.81.046003","HIP-2009-31/TH","hep-ph hep-lat hep-th","http://arxiv.org/licenses/nonexclusive-distrib/1.0/","  We use gauge/gravity duality to study the thermodynamics of a field theory
with asymptotic freedom in the ultraviolet and a fixed point in the infrared.
We find a high temperature quark-gluon phase and a low T conformal unparticle
phase. The phase transition between the phases is of first order or continuous,
depending on the ratio of the radii of asymptotic AdS5 spaces at T=0 and
T=infinity. This is a prediction from a model of gauge/gravity duality, not yet
verified on the field theory side.
","[{""version"":""v1"",""created"":""Mon, 21 Dec 2009 10:42:27 GMT""},{""version"":""v2"",""created"":""Mon, 18 Jan 2010 11:37:21 GMT""}]","2010-04-21"
"0912.4129","Jiliang Jing","Jieci Wang, Junfeng Deng, Jiliang Jing","Classical correlation and quantum discord sharing of Dirac fields in
  noninertial frames","15 pages, 6 figures; Accepted for publication in Phys. Rev. A","Phys.Rev.A81:052120,2010","10.1103/PhysRevA.81.052120",,"quant-ph gr-qc","http://arxiv.org/licenses/nonexclusive-distrib/1.0/","  The classical and quantum correlations sharing between modes of the Dirac
fields in the noninertial frame are investigated. It is shown that: (i) The
classical correlation for the Dirac fields decreases as the acceleration
increases, which is different from the result of the scalar field that the
classical correlation is independent of the acceleration; (ii) There is no
simple dominating relation between the quantum correlation and entanglement for
the Dirac fields, which is unlike the scalar case where the quantum correlation
is always over and above the entanglement; (iii) As the acceleration increases,
the correlations between modes $I$ and $II$ and between modes $A$ and $II$
increase, but the correlations between modes $A$ and $I$ decrease.
","[{""version"":""v1"",""created"":""Mon, 21 Dec 2009 10:35:10 GMT""},{""version"":""v2"",""created"":""Thu, 13 May 2010 09:29:53 GMT""}]","2015-03-13"
"0912.4130","Klaus Thomsen","Klaus Thomsen","On the C*-algebra of a locally injective surjection and its KMS states","20 pages, no figures",,,,"math.OA","http://arxiv.org/licenses/nonexclusive-distrib/1.0/","  It shown that an a locally injective surjection on a compact metric space
admits a canonical locally homeomorphic extension such that the associated
C*-algebras are isomorphic. This is then used in a study of the possible
inverse temperatures of KMS states for a generalized gauge action.
","[{""version"":""v1"",""created"":""Mon, 21 Dec 2009 10:36:05 GMT""}]","2009-12-22"
"0912.4131","Sergio Messina","S. Messina, P. Parihar, J.-R. Koo, S.-L. Kim, S.-C. Rey, C. -U. Lee","RACE-OC Project: Rotation and variability in the open cluster M11
  (NGC6705)","Accepted by Astronomy and Astrophysics on Dec 15, 2009",,"10.1051/0004-6361/200912373",,"astro-ph.SR","http://arxiv.org/licenses/nonexclusive-distrib/1.0/","  Rotation and magnetic activity are intimately linked in main-sequence stars
of G or later spectral types. The presence and level of magnetic activity
depend on stellar rotation, and rotation itself is strongly influenced by
strength and topology of the magnetic fields. Open clusters represent
especially useful targets to investigate the rotation/activity/age connection.
The open cluster M11 has been studied as a part of the RACE-OC project
(Rotation and ACtivity Evolution in Open Clusters), which is aimed at exploring
the evolution of rotation and magnetic activity in the late-type members of
open clusters with different ages. Photometric observations of the open cluster
M11 were carried out in June 2004 using LOAO 1m telescope. The rotation periods
of the cluster members are determined by Fourier analysis of photometric data
time series. We further investigated the relations between the surface
activity, characterized by the light curve amplitude, and rotation. We have
discovered a total of 75 periodic variables in the M11 FoV, of which 38 are
candidate cluster members. Specifically, among cluster members we discovered 6
early-type, 2 eclipsing binaries and 30 bona-fide single periodic late-type
variables. Considering the rotation periods of 16 G-type members of the almost
coeval 200-Myr M34 cluster, we could determine the rotation period distribution
from a more numerous sample of 46 single G stars at an age of about 200-230 Myr
and determine a median rotation period P=4.8d. A comparison with the younger
M35 cluster (~150 Myr) and with the older M37 cluster (~550 Myr) shows that G
stars rotate slower than younger M35 stars and faster than older M37 stars. The
measured variation of the median rotation period is consistent with the
scenario of rotational braking of main-sequence spotted stars as they age.
","[{""version"":""v1"",""created"":""Mon, 21 Dec 2009 10:46:25 GMT""}]","2015-05-14"
"0912.4132","Anthony Leverrier","Anthony Leverrier and Philippe Grangier","A simple proof that Gaussian attacks are optimal among collective
  attacks against continuous-variable quantum key distribution with a Gaussian
  modulation","6 pages, appendix added","Phys. Rev. A 81, 062314 (2010)","10.1103/PhysRevA.81.062314",,"quant-ph","http://arxiv.org/licenses/nonexclusive-distrib/1.0/","  In this paper, we give a simple proof of the fact that the optimal collective
attacks against continous-variable quantum key distribution with a Gaussian
modulation are Gaussian attacks. Our proof makes use of symmetry properties of
the quantum key distribution protocol in phase-space.
","[{""version"":""v1"",""created"":""Mon, 21 Dec 2009 11:07:24 GMT""},{""version"":""v2"",""created"":""Thu, 20 May 2010 08:06:06 GMT""}]","2010-06-29"
"0912.4133","Edvige Corbelli","Edvige Corbelli, Silvio Lorenzoni, Ren\'e A. M. Walterbos, Robert
  Braun, David A. Thilker","A wide-field HI mosaic of Messier 31. II.The disk warp, rotation and the
  dark matter halo","19 pages, 16 figures, accepted for publication in A&A",,"10.1051/0004-6361/200913297",,"astro-ph.CO","http://arxiv.org/licenses/nonexclusive-distrib/1.0/","  We test cosmological models of structure formation using the rotation curve
of the nearest spiral galaxy, M31, determined using a recent deep, full-disk
21-cm imaging survey smoothed to 466 pc resolution. We fit a tilted ring model
to the HI data from 8 to 37 kpc. The disk of M31 warps from 25 kpc outwards and
becomes more inclined with respect to our line of sight. Newtonian dynamics
without a dark matter halo provide a very poor fit to the rotation curve
derived using the warp model. In the framework of modified Newtonian dynamic
however the 21-cm rotation curve is well fitted by the gravitational potential
traced by the baryonic matter density alone. The inclusion of a dark matter
halo with a density profile as predicted by structure formation in a
hierarchical clustering LambdaCDM cosmology makes the mass model in newtonian
dynamic compatible with the rotation curve data. The dark halo concentration
for the best fit is C=12 and its total mass is 1.2 10^{12} Msun. If a dark halo
model with a constant density core is considered, the core radius has to be
larger than 20 kpc in order for the model to fit to the data. We extrapolate
the best-fit LambdaCDM and constant-density core mass models to very large
galactocentric radii, comparable to the size of the dark matter halo. A
comparison of the predicted mass with the M31 mass determined at such large
radii using other dynamical tracers, confirms the validity of our results. In
particular the LambdaCDM dark halo model which best fits the 21-cm data well
reproduces the M31 mass traced out to 560 kpc. Our estimated total mass of M31
is 1.3 10^{12} Msun, with 12% baryonic fraction and only 6% of the baryons in
neutral gas.
","[{""version"":""v1"",""created"":""Mon, 21 Dec 2009 11:04:30 GMT""}]","2015-05-14"
"0912.4134","Stephen Hayden","C. Lester, Jiun-Haw Chu, J. G. Analytis, T. G. Perring, I. R. Fisher,
  S.M. Hayden","Dispersive Spin Fluctuations in the near optimally-doped superconductor
  Ba(Fe1-xCox)2As2 ($x$=0.065)","Final version","Phys. Rev. B 81, 064505 (2010)","10.1103/PhysRevB.81.064505",,"cond-mat.supr-con cond-mat.str-el","http://arxiv.org/licenses/nonexclusive-distrib/1.0/","  Inelastic neutron scattering is used to probe the collective spin excitations
of the near optimally-doped superconductor Ba(Fe1-xCox)2As2 ($x$=0.065).
Previous measurements on the antiferromagnetically ordered parents of this
material show a strongly anisotropic spin-wave velocity. Here we measure the
magnetic excitations up to 80 meV and show that a similar anisotropy persists
for superconducting compositions. The dispersive mode measured here connects
directly with the spin resonance previously observed in this compound. When
placed on an absolute scale, our measurements show that the local- or
wavevector- integrated susceptibility is larger in magnitude than that of the
ordered parents over the energy range probed.
","[{""version"":""v1"",""created"":""Mon, 21 Dec 2009 11:04:59 GMT""},{""version"":""v2"",""created"":""Thu, 14 Jan 2010 15:57:02 GMT""},{""version"":""v3"",""created"":""Fri, 26 Feb 2010 17:19:10 GMT""}]","2010-02-26"
"0912.4135","Maria Giovanna Mora","Helmut Abels, Maria Giovanna Mora, Stefan M\""uller","The time-dependent von K\'arm\'an plate equation as a limit of 3d
  nonlinear elasticity","16 pages",,,,"math.AP","http://arxiv.org/licenses/nonexclusive-distrib/1.0/","  The asymptotic behaviour of the solutions of three-dimensional nonlinear
elastodynamics in a thin plate is studied, as the thickness $h$ of the plate
tends to zero. Under appropriate scalings of the applied force and of the
initial values in terms of $h$, it is shown that three-dimensional solutions of
the nonlinear elastodynamic equation converge to solutions of the
time-dependent von K\'arm\'an plate equation.
","[{""version"":""v1"",""created"":""Mon, 21 Dec 2009 11:10:29 GMT""}]","2009-12-22"
"0912.4136","Jaume Terradas","J. Terradas, M. Goossens, I. Ballai","The effect of longitudinal flow on resonantly damped kink oscillations",,,"10.1051/0004-6361/200913487",,"astro-ph.SR","http://arxiv.org/licenses/nonexclusive-distrib/1.0/","  The most promising mechanism acting towards damping the kink oscillations of
coronal loops is resonant absorption. In this context most of previous studies
neglected the effect of the obvious equilibrium flow along magnetic field
lines. The flows are in general sub-Alfv\'enic and hence comparatively slow.
Here we investigate the effect of an equilibrium flow on the resonant
absorption of linear kink MHD waves in a cylindrical magnetic flux tube with
the aim of determining the changes in the frequency of the forward and backward
propagating waves and in the modification of the damping times due to the flow.
A loop model with both the density and the longitudinal flow changing in the
radial direction is considered. We use the thin tube thin boundary (TTTB)
approximation in order to calculate the damping rates. The full resistive
eigenvalue problem is also solved without assuming the TTTB approximation.
Using the small ratio of flow and Alfv\'en speeds we derive simple analytical
expressions to the damping rate. The analytical expressions are in good
agreement with the resistive eigenmode calculations. Under typical coronal
conditions the effect of the flow on the damped kink oscillations is small when
the characteristic scale of the density layer is similar or smaller than the
characteristic width of the velocity layer. However, in the opposite situation
the damping rates can be significantly altered, specially for the backward
propagating wave which is undamped while the forward wave is overdamped.
","[{""version"":""v1"",""created"":""Mon, 21 Dec 2009 11:21:18 GMT""}]","2015-05-14"
"0912.4137","Francesco Paolo Mancini","F. Mancini and F. P. Mancini","Different orderings in the narrow-band limit of the extended Hubbard
  model on the Bethe lattice","17 pages, 20 figures","Eur. Phys. J. B 73, 581 (2010)","10.1140/epjb/e2010-00031-8","unisa/cond-mat/002062009","cond-mat.str-el","http://arxiv.org/licenses/nonexclusive-distrib/1.0/","  We present the exact solution of a system of Fermi particles living on the
sites of a Bethe lattice with coordination number z and interacting through
on-site U and nearest-neighbor V interactions. This is a physical realization
of the extended Hubbard model in the atomic limit. Within the Green's function
and equations of motion formalism, we provide a comprehensive analysis of the
model and we study the phase diagram at finite temperature in the whole model's
parameter space, allowing for the on-site and nearest-neighbor interactions to
be either repulsive or attractive. We find the existence of critical regions
where charge ordering (V>0) and phase separation (V<0) are observed. This
scenario is endorsed by the study of several thermodynamic quantities.
","[{""version"":""v1"",""created"":""Mon, 21 Dec 2009 11:46:15 GMT""}]","2010-03-09"
"0912.4138","Tom Mackay","Tom G. Mackay (University of Edinburgh), Akhlesh Lakhtakia
  (Pennsylvania State University)","Empirical model of optical sensing via spectral shift of circular Bragg
  phenomenon",,"IEEE Photonics Journal 2 (2010), 92-101",,,"physics.optics","http://arxiv.org/licenses/nonexclusive-distrib/1.0/","  Setting up an empirical model of optical sensing to exploit the circular
Bragg phenomenon displayed by chiral sculptured thin films (CSTFs), we
considered a CSTF with and without a central twist defect of $\pi/2$ radians.
The circular Bragg phenomenon of the defect-free CSTF, and the spectral hole in
the co-polarized reflectance spectrum of the CSTF with the twist defect, were
both found to be acutely sensitive to the refractive index of a fluid which
infiltrates the void regions of the CSTF. These findings bode well for the
deployment of CSTFs as optical sensors.
","[{""version"":""v1"",""created"":""Mon, 21 Dec 2009 11:18:24 GMT""}]","2010-04-13"
"0912.4139","Konstantin Zloshchastiev","Konstantin G. Zloshchastiev","Spontaneous symmetry breaking and mass generation as built-in phenomena
  in logarithmic nonlinear quantum theory","Dedicated to memory of V. L. Ginzburg (1916-2009). Updates: (v2)
  chapter on BEC/fluid/gravity correspondence; (v3) comments on BEC-vacuum
  thermodynamics, induced relativity postulates, Mach's principle, Weyl
  curvature hypothesis, BEC-vacuum cosmology and origin of fundamental scalar
  field; (v4) appendix with quantum-informational arguments towards LogSE; (v5
  [pub]) refs about superfluid vacuum","Acta Phys.Polon.B42:261-292,2011","10.5506/APhysPolB.42.261",,"hep-ph cond-mat.other gr-qc hep-th quant-ph","http://arxiv.org/licenses/nonexclusive-distrib/1.0/","  Our primary task is to demonstrate that the logarithmic nonlinearity in the
quantum wave equation can cause the spontaneous symmetry breaking and mass
generation phenomena on its own, at least in principle. To achieve this goal,
we view the physical vacuum as a kind of the fundamental Bose-Einstein
condensate embedded into the fictitious Euclidean space. The relation of such
description to that of the physical (relativistic) observer is established via
the fluid/gravity correspondence map, the related issues, such as the induced
gravity and scalar field, relativistic postulates, Mach's principle and
cosmology, are discussed. For estimate the values of the generated masses of
the otherwise massless particles such as the photon, we propose few simple
models which take into account small vacuum fluctuations. It turns out that the
photon's mass can be naturally expressed in terms of the elementary electrical
charge and the extensive length parameter of the nonlinearity. Finally, we
outline the topological properties of the logarithmic theory and corresponding
solitonic solutions.
","[{""version"":""v1"",""created"":""Mon, 21 Dec 2009 11:56:02 GMT""},{""version"":""v2"",""created"":""Wed, 17 Feb 2010 07:43:21 GMT""},{""version"":""v3"",""created"":""Mon, 5 Jul 2010 11:25:32 GMT""},{""version"":""v4"",""created"":""Mon, 29 Nov 2010 06:47:52 GMT""},{""version"":""v5"",""created"":""Thu, 17 Feb 2011 12:04:57 GMT""}]","2011-02-23"
"0912.4140","Sanjay Khattri","Sanjay Kumar Khattri","How to increase convergence order of Newton's method to $2\times m$?","10 pages, 0 figures",,,,"math.NA math-ph math.MP","http://arxiv.org/licenses/nonexclusive-distrib/1.0/","  We present a simple yet powerful technique for forming iterative methods of
various convergence orders. Methods of various convergence orders (four, six,
eight and ten) are formed through a modest modification of the classical Newton
method. The technique can be easily implemented in existing software packages
as suggested by the presented C$^{++}$ algorithm. Finally some problems are
solved through the proposed algorithm.
","[{""version"":""v1"",""created"":""Mon, 21 Dec 2009 11:29:32 GMT""}]","2009-12-22"
"0912.4141","Felix Moya-Anegon Dr","Borja Gonzalez-Pereira (1), Vicente Guerrero-Bote (1) and Felix
  Moya-Anegon (2) ((1) University of Extremadura, Department of Information and
  Communication, Scimago Group, Spain (2) CSIC, CCHS, IPP, Scimago Group Spain)","The SJR indicator: A new indicator of journals' scientific prestige","21 pages with graphs and tables",,,,"cs.DL physics.soc-ph","http://arxiv.org/licenses/nonexclusive-distrib/1.0/","  This paper proposes an indicator of journals' scientific prestige, the SJR
indicator, for ranking scholarly journals based on citation weighting schemes
and eigenvector centrality to be used in complex and heterogeneous citation
networks such Scopus. Its computation methodology is described and the results
after implementing the indicator over Scopus 2007 dataset are compared to an
ad-hoc Journal Impact Factor both generally and inside specific scientific
areas. The results showed that SJR indicator and JIF distributions fitted well
to a power law distribution and that both metrics were strongly correlated,
although there were also major changes in rank. There was an observable general
trend that might indicate that SJR indicator values decreased certain JIF
values whose citedeness was greater than would correspond to their scientific
influence.
","[{""version"":""v1"",""created"":""Mon, 21 Dec 2009 11:32:08 GMT""}]","2009-12-22"
"0912.4142","Edo Berger","Edo Berger and Wen-fai Fong (Harvard/CfA)","The Galactic and Sub-Galactic Environments of Short-Duration Gamma-Ray
  Bursts: Implications for the Progenitors","Invited review at ""The Shocking Universe"" conference, Venice, Italy,
  September 2009; 19 pages",,,,"astro-ph.HE","http://arxiv.org/licenses/nonexclusive-distrib/1.0/","  The study of short-duration gamma-ray bursts (GRBs) has undergone a
revolution in recent years thanks to the discovery of the first afterglows and
host galaxies in May 2005. In this review we summarize our current knowledge of
the galactic and sub-galactic environments of short GRBs, and the implications
for the progenitor population. The most crucial results are: (i) some short
GRBs occur in elliptical galaxies; (ii) the majority of short GRBs occur in
star forming galaxies; (iii) the star forming hosts of short GRBs are distinct
from the host galaxies of long GRBs in terms of star formation rates,
luminosities, and metallicities, and instead appear to be drawn from the
general field galaxy population; (iv) the physical offsets of short GRBs
relative to their host galaxy centers are significantly larger than for long
GRBs; (v) the observed offset distribution agrees well with predictions for the
locations of NS-NS binary mergers; and (vi) unlike long GRBs, which tend to
occur in the brightest regions of their hosts, the environments of short GRBs
generally under-represent the light distribution of their host galaxies. Taken
together, these observations suggest that short GRB progenitors have a wide age
distribution and generally track stellar mass rather than star formation
activity. These results are fully consistent with NS-NS binary mergers, but
partial contribution from prompt or delayed magnetar formation is also
consistent with the data.
","[{""version"":""v1"",""created"":""Mon, 21 Dec 2009 11:33:20 GMT""}]","2009-12-22"
"0912.4143","Dmitry Demskoi","Dmitry K. Demskoi, Jyh-Hao Lee","On non-Abelian Toda $A_2^{(1)}$ model and related hierarchies","10 pages, LaTex 2e","JMP 50, 123516 (2009)","10.1063/1.3267864",,"nlin.SI","http://arxiv.org/licenses/nonexclusive-distrib/1.0/","  We study limiting cases of the two known integrable chiral-type models with
tree-dimensional configuration space. One of the initial models is the
non-Abelian Toda $A_2^{(1)}$ model and the other was found by means of the
symmetry approach by A.G. Meshkov and one of the authors. The C-integrability
of the reduced models is established by constructing their complete sets of
integrals and general solutions. A description of the generalized symmetry
algebras of these models is given in terms of operators mapping integrals into
symmetries. The integrals of the Liouville-type systems are known to define
Miura-type transformations for their generalized symmetries. This fact allowed
us to find a few new systems of the Yajima-Oikawa type. We present a recursion
operator for one them.
","[{""version"":""v1"",""created"":""Mon, 21 Dec 2009 11:37:05 GMT""}]","2015-05-14"
"0912.4144","Motomu Tsuda","Kazunari Shima and Motomu Tsuda","Super Yang-Mills theory from nonlinear supersymmetry","9 pages","Phys.Lett.B687:89-91,2010","10.1016/j.physletb.2010.03.003",,"hep-th","http://arxiv.org/licenses/nonexclusive-distrib/1.0/","  The relation between a nonlinear supersymmetic (NLSUSY) theory and a SUSY
Yang-Mills (SYM) theory is studied for N = 3 SUSY in two-dimensional
space-time. We explicitly show the NL/L SUSY relation for the (pure) SYM theory
by means of cancellations among Nambu-Goldstone fermion self-interaction terms.
","[{""version"":""v1"",""created"":""Mon, 21 Dec 2009 11:43:52 GMT""}]","2010-04-30"
"0912.4145","Dmitry Demskoi","Dmitry K. Demskoi","Integrals of open 2D lattices","8 pages, Latex 2e",,,,"nlin.SI","http://arxiv.org/licenses/nonexclusive-distrib/1.0/","  We present an explicit formula for integrals of the open 2D Toda lattice of
type $A_n$. This formula is applicable for various reductions of this lattice.
To illustrate the concept we find integrals of the Toda $G_2$ lattice. We also
reveal a connection between the open Toda $A_n$ and Shabat-Yamilov lattices.
","[{""version"":""v1"",""created"":""Mon, 21 Dec 2009 12:33:19 GMT""}]","2009-12-22"
"0912.4146","Peicheng Zhu","Shuichi Kawashima and Peicheng Zhu","Traveling waves for models of phase transitions of solids driven by
  configurational forces","16 pages, 1 figure",,,,"math.AP math.DS","http://arxiv.org/licenses/nonexclusive-distrib/1.0/","  This article is concerned with the existence of traveling wave solutions,
including standing waves, to some models based on configurational forces,
describing respectively the diffusionless phase transformations of solid
materials, e.g., Steel, and phase transitions due to interface motion by
interface diffusion, e.g., Sintering. These models are recently proposed by
Alber and Zhu. We consider both the order-parameter-conserved case and the
non-conserved one, under suitable assumptions. Also we compare our results with
the corresponding ones for the Allen-Cahn and the Cahn-Hilliard equations
coupled with linear elasticity, which are models for diffusion-dominated phase
transformations in elastic solids.
","[{""version"":""v1"",""created"":""Mon, 21 Dec 2009 11:57:21 GMT""}]","2009-12-22"
"0912.4147","Santanu Maiti Kumar","Santanu K. Maiti","Quantum Transport through Organic Molecules","11 pages, 8 figures","Chemical Physics, Volume 331, Issues 2-3, 8 January 2007, Pages
  254-260 [Erratum: Chemical Physics, Volume 345, Issue 1, 3 April 2008, Page
  130]","10.1016/j.chemphys.2006.10.013",,"cond-mat.mes-hall cond-mat.mtrl-sci","http://arxiv.org/licenses/nonexclusive-distrib/1.0/","  We explore electron transport properties for the model of benzene-1,
4-dithiolate (BDT) molecule and for some other geometric models of benzene
molecule attached to two semi-infinite one-dimensional metallic electrodes
using the Green's function formalism. An analytic approach, based on a simple
tight-binding framework, is presented to describe electron transport through
the molecular wires. Electronic transport in such molecular systems is strongly
affected by the geometry of the molecules as well as their coupling to the
side-attached electrodes. Conductance reveals resonant peaks associated with
the molecular energy eigenstates providing several complex spectra. Current
passing through the molecules shows staircase-like behavior with sharp steps in
the weak molecule-to-electrode coupling limit, while it varies quite
continuously with the applied bias voltage in the limit of strong molecular
coupling. In the presence of transverse magnetic field, conductance exhibits
oscillatory behavior with flux $\phi$, threaded by the molecular ring, showing
$\phi_0$ ($=ch/e$) flux-quantum periodicity. Though, conductance changes in the
presence of transverse magnetic field, but the current-voltage characteristics
are not significantly affected by this field.
","[{""version"":""v1"",""created"":""Mon, 21 Dec 2009 11:46:41 GMT""},{""version"":""v2"",""created"":""Thu, 24 Dec 2009 03:49:34 GMT""}]","2010-04-13"
