"0912.4086","Hajime Urakawa","Nabumitsu Nakauchi and Hajime Urakawa","Removable singularities and bubbling of harmonic maps and biharmonic
  maps",,,,,"math.DG math.AG","http://arxiv.org/licenses/nonexclusive-distrib/1.0/","  By using Moser's iteration technique, we show some removable singularity
theorem of the tension field for biharmonic maps into manifolds of non-positive
curvature, and the bubbling theorem of biharmonic maps and also harmonic maps.
","[{""version"":""v1"",""created"":""Mon, 21 Dec 2009 06:45:06 GMT""},{""version"":""v2"",""created"":""Mon, 17 Jan 2011 08:50:40 GMT""},{""version"":""v3"",""created"":""Tue, 31 Jan 2012 09:03:43 GMT""},{""version"":""v4"",""created"":""Mon, 23 Apr 2012 03:06:32 GMT""}]","2012-04-24"
"0912.4087","Wei Ren","Wei Ren, Qing Zhao, Ananthram Swami","On the Connectivity and Multihop Delay of Ad Hoc Cognitive Radio
  Networks","28 pages, 9 figures",,,,"cs.NI","http://arxiv.org/licenses/nonexclusive-distrib/1.0/","  We analyze the multihop delay of ad hoc cognitive radio networks, where the
transmission delay of each hop consists of the propagation delay and the
waiting time for the availability of the communication channel (i.e., the
occurrence of a spectrum opportunity at this hop). Using theories and
techniques from continuum percolation and ergodicity, we establish the scaling
law of the minimum multihop delay with respect to the source-destination
distance in cognitive radio networks. When the propagation delay is negligible,
we show the starkly different scaling behavior of the minimum multihop delay in
instantaneously connected networks as compared to networks that are only
intermittently connected due to scarcity of spectrum opportunities.
Specifically, if the network is instantaneously connected, the minimum multihop
delay is asymptotically independent of the distance; if the network is only
intermittently connected, the minimum multihop delay scales linearly with the
distance. When the propagation delay is nonnegligible but small, we show that
although the scaling order is always linear, the scaling rate for an
instantaneously connected network can be orders of magnitude smaller than the
one for an intermittently connected network.
","[{""version"":""v1"",""created"":""Mon, 21 Dec 2009 06:47:42 GMT""}]","2009-12-22"
"0912.4088","Biman J. Medhi","Biman J. Medhi (ARIES, Nainital), Maheswar. G (ARIES, Nainital), J. C.
  Pandey (ARIES, Nainital), Motohide Tamura (NAOJ, Japan), Ram Sagar (ARIES,
  Nainital)","Polarization in young open cluster NGC 6823","16 pages, 6 tables, 11 figures, Accepted for publication in MNRAS",,"10.1111/j.1365-2966.2010.16221.x",,"astro-ph.GA astro-ph.SR","http://arxiv.org/licenses/nonexclusive-distrib/1.0/","  We present multiwavelength linear polarimetric observations of 104 stars
towards the region of young open cluster NGC 6823. The polarization towards NGC
6823 is dominated by foreground dust grains and we found the evidence for the
presence of several layers of dust towards the line of sight. The first layer
of dust is located approximately within 200 pc towards the cluster, which is
much closer to the Sun than the cluster (~ 2.1 kpc). The radial distribution of
the position angles for the member stars are found to show a systematic change
while the polarization found to reduce towards the outer parts of the cluster
and the average position angle of coronal region of the cluster is very close
to the inclination of the Galactic parallel (~ 32 degree). The size
distribution of the grains within NGC 6823 is similar to those in general
interstellar medium. The patchy distribution of foreground dust grains are
suggested to be mainly responsible for the both differential reddening and
polarization towards NGC 6823. The majority of the observed stars do not show
the evidence of intrinsic polarization in their light.
","[{""version"":""v1"",""created"":""Mon, 21 Dec 2009 07:03:51 GMT""}]","2015-05-14"
"0912.4089","Santosh Das Kumar","Santosh K Das, Jan-e Alam and Payal Mohanty","Equilibration in Quark Gluon Plasma","To be published in the Quark Matter 2008 poster proceedings","Indian J.Phys.85:1149-1153,2011","10.1007/s12648-011-0115-6",,"nucl-th","http://arxiv.org/licenses/nonexclusive-distrib/1.0/","  The hydrodynamic expansion rate of quark gluon plasma (QGP) is evaluated and
compared with the scattering rate of quarks and gluons within the system.
Partonic scattering rates evaluated within the ambit of perturbative Quantum
Choromodynamics (pQCD) are found to be smaller than the expansion rate
evaluated with ideal equation of state (EoS) for the QGP. This indicate that
during the space-time evolution the system remains out of equilibrium.
Enhancement of pQCD cross sections and a more realistic EoS keep the partons
closer to the equilibrium.
","[{""version"":""v1"",""created"":""Mon, 21 Dec 2009 07:04:42 GMT""}]","2011-08-11"
"0912.4091","Yen-Chih Lin","Yen-Chih Lin, Ji-Ming Sun, Jen-Hao Hsiao, Yeukuang Hwu, C. L. Wang,
  Tzay-Ming Hong","The spontaneous emergence of ordered phases in crumpled sheets",,"Phys. Rev. Lett. 103, 263902 (2009)","10.1103/PhysRevLett.103.263902",,"cond-mat.soft cond-mat.mtrl-sci","http://arxiv.org/licenses/nonexclusive-distrib/1.0/","  X-ray tomography is performed to acquire 3D images of crumpled aluminum
foils. We develop an algorithm to trace out the labyrinthian paths in the three
perpendicular cross sections of the data matrices. The tangent-tangent
correlation function along each path is found to decay exponentially with an
effective persistence length that shortens as the crumpled ball becomes more
compact. In the mean time, we observed ordered domains near the crust, similar
to the lamellae phase mixed by the amorphous portion in lyotropic liquid
crystals. The size and density of these domains grow with further compaction,
and their orientation favors either perpendicular or parallel to the radial
direction. Ordering is also identified near the core with an arbitrary
orientation, exemplary of the spontaneous symmetry breaking.
","[{""version"":""v1"",""created"":""Mon, 21 Dec 2009 07:21:55 GMT""}]","2009-12-31"
"0912.4092","Rafal Demkowicz-Dobrzanski","Konrad Banaszek, Rafal Demkowicz-Dobrzanski, Ian A. Walmsley","Quantum states made to measure","4 pages, 3 figures, Commentary for Nature Photonics","Nature Photonics 3, 673 (2009)","10.1038/nphoton.2009.223",,"quant-ph","http://arxiv.org/licenses/nonexclusive-distrib/1.0/","  Recent progress in manipulating quantum states of light and matter brings
quantum-enhanced measurements closer to prospective applications. The current
challenge is to make quantum metrologic strategies robust against
imperfections.
","[{""version"":""v1"",""created"":""Mon, 21 Dec 2009 08:03:42 GMT""}]","2015-05-14"
"0912.4094","HongWei Ke","Hong-Wei Ke, Xue-Qian Li and Zheng-Tao Wei","Determining the $\eta-\eta'$ mixing by the newly measured
  $BR(D(D_s)\to\eta(\eta')+\bar l+\nu_l$","11 pages and 3 figures, some changes were made. Accepted by EPJC","Eur.Phys.J.C69:133-138,2010","10.1140/epjc/s10052-010-1383-6",,"hep-ph","http://arxiv.org/licenses/nonexclusive-distrib/1.0/","  The mixing of $\eta-\eta'$ or $\eta-\eta'-G$ is of a great theoretical
interest, because it concerns many aspects of the underlying dynamics and
hadronic structure of pseudoscalar mesons and glueball. Determining the mixing
parameters by fitting data is by no means trivial. In order to extract the
mixing parameters from the available processes where hadrons are involved,
theoretical evaluation of hadronic matrix elements is necessary. Therefore
model-dependence is somehow unavoidable. In fact, it is impossible to extract
the mixing angle from a unique experiment because the model parameters must be
obtained by fitting other experiments. Recently $BR(D\to\eta+\bar l+\nu_l)$ and
$BR(D_s\to\eta(\eta')+\bar l+\nu_l)$ have been measured, thus we are able to
determine the $\eta-\eta'$ mixing solely from the semileptonic decays of
D-mesons where contamination from the final state interactions is absent. Thus
we hope that the model-dependence of the extraction can be somehow alleviated.
Once $BR(D\to\eta'+\bar l+\nu_l)$ is measured, we can further determine all the
mixing parameters for $\eta-\eta'-G$. As more data are accumulated, the
determination will be more accurate. In this work, we obtain the transition
matrix elements of $D_{(s)}\to \eta^{(\prime)}$ using the light-front quark
model whose feasibility and reasonability for such processes have been tested.
","[{""version"":""v1"",""created"":""Mon, 21 Dec 2009 08:08:14 GMT""},{""version"":""v2"",""created"":""Thu, 17 Jun 2010 01:30:10 GMT""}]","2011-02-09"
"0912.4095","Jacopo Stoppa","Jacopo Stoppa, G\'abor Sz\'ekelyhidi","Relative K-stability of extremal metrics","10 pages",,,,"math.DG math.AG","http://arxiv.org/licenses/nonexclusive-distrib/1.0/","  We show that if a polarised manifold admits an extremal metric then it is
K-polystable relative to a maximal torus of automorphisms.
","[{""version"":""v1"",""created"":""Mon, 21 Dec 2009 08:18:51 GMT""}]","2009-12-22"
"0912.4096","Ke Deng","Zhaojian He, Han Jia, Chunyin Qiu, Shasha Peng, Xuefei Mei, Feiyan
  Cai, Pai Peng, Manzhu Ke, and Zhengyou Liu","Acoustic transmission enhancement through a periodically-structured
  stiff plate without any opening","11 pages, 4 figures",,"10.1103/PhysRevLett.105.074301",,"physics.class-ph","http://arxiv.org/licenses/nonexclusive-distrib/1.0/","  We report both experimentally and theoretically that the enhanced acoustic
transmission can occur in the subwavelength region through a thin but stiff
structured-plate without any opening. This exotic acoustic phenomenon is
essentially distinct from the previous related studies originated from, either
collectively or individually, the interaction of the incident wave with
openings in previous structures. It is attributed to the structure-induced
resonant excitation of the non-leaky Lamb modes that exist intrinsically in the
uniform elastic plate. Our finding should have impact on ultrasonic
applications.
","[{""version"":""v1"",""created"":""Mon, 21 Dec 2009 08:27:28 GMT""},{""version"":""v2"",""created"":""Thu, 21 Apr 2011 12:17:19 GMT""}]","2011-04-22"
"0912.4097","Yassemi Siamak","Hassan Haghighi, Rahim Zaare-Nahandi, and Siamak Yassemi","A generalization of $k$-Cohen-Macaulay complexes","8 pages",,,,"math.AC math.CO","http://arxiv.org/licenses/nonexclusive-distrib/1.0/","  For a positive integer $k$ and a non-negative integer $t$ a class of
simplicial complexes, to be denoted by $k$-${\rm CM}_t$, is introduced. This
class generalizes two notions for simplicial complexes: being
$k$-Cohen-Macaulay and $k$-Buchsbaum. In analogy with the Cohen-Macaulay and
Buchsbaum complexes, we give some characterizations of ${\rm CM}_t(=$1-${\rm
CM}_t)$ complexes, in terms of vanishing of some homologies of its links and,
in terms of vanishing of some relative singular homologies of the geometric
realization of the complex and its punctured space. We show that a complex is
$k$-${\rm CM}_t$ if and only if the links of its nonempty faces are $k$-${\rm
CM}_{t-1}$. We prove that for an integer $s\le d$, the $(d-s-1)$-skeleton of a
$(d-1)$-dimensional $k$-${\rm CM}_t$ complex is $(k+s)$-${\rm CM}_t$. This
result generalizes Hibi's result for Cohen-Macaulay complexes and Miyazaki's
result for Buchsbaum complexes.
","[{""version"":""v1"",""created"":""Mon, 21 Dec 2009 08:34:17 GMT""}]","2009-12-22"
"0912.4098","Emilio Santos Corchero","Emilio Santos","Realistic interpretation of quantum mechancis",,"Focus on Quantum Mechanics (Hathaway, D.E., Randolph, E.M. eds.),
  Nova Science Publishers, 2011, Pages 197-208",,,"quant-ph","http://arxiv.org/licenses/nonexclusive-distrib/1.0/","  It is argued that the usual postulates of quantum mechanics are too strong.
It is conjectured that it is possible to interpret all experiments if we
maintain the formalism of quantum theory without modification, but weaken the
postulates concerning the relation between the formalism and the experiments. A
set of postulates is proposed where realism is insured. Comments on the Bell
theorem are made on the light of the new postulates.
","[{""version"":""v1"",""created"":""Mon, 21 Dec 2009 08:35:14 GMT""}]","2020-11-03"
"0912.4099","Thomas Amthor","H. Schempp, G. G\""unter, C.S. Hofmann, C. Giese, S.D. Saliba, B.D.
  DePaola, T. Amthor, M. Weidem\""uller, S. Sevin\c{c}li, T. Pohl","Coherent Population Trapping with Controlled Interparticle Interactions",,,"10.1103/PhysRevLett.104.173602",,"physics.atom-ph","http://arxiv.org/licenses/nonexclusive-distrib/1.0/","  We investigate Coherent Population Trapping in a strongly interacting
ultracold Rydberg gas. Despite the strong van der Waals interactions and
interparticle correlations, we observe the persistence of a resonance with
subnatural linewidth at the single-particle resonance frequency as we tune the
interaction strength. This narrow resonance cannot be understood within a
meanfield description of the strong Rydberg--Rydberg interactions. Instead, a
many-body density matrix approach, accounting for the dynamics of interparticle
correlations, is shown to reproduce the observed spectral features.
","[{""version"":""v1"",""created"":""Mon, 21 Dec 2009 08:35:15 GMT""},{""version"":""v2"",""created"":""Mon, 1 Mar 2010 16:09:39 GMT""}]","2015-05-14"
"0912.4100","Cheng Yeaw Ku","Cheng Yeaw Ku and Kok Bin Wong","Properties of $\theta$-super positive graphs","13 pages, 6 figures",,,,"math.CO","http://arxiv.org/licenses/nonexclusive-distrib/1.0/","  Let the matching polynomial of a graph $G$ be denoted by $\mu (G,x)$. A graph
$G$ is said to be $\theta$-super positive if $\mu(G,\theta)\neq 0$ and
$\mu(G\setminus v,\theta)=0$ for all $v\in V(G)$. In particular, $G$ is 0-super
positive if and only if $G$ has a perfect matching. While much is known about
0-super positive graphs, almost nothing is known about $\theta$-super positive
graphs for $\theta \not = 0$. This motivates us to investigate the structure of
$\theta$-super positive graphs in this paper. Though a 0-super positive graph
may not contain any cycle, we show that a $\theta$-super positive graph with
$\theta \not = 0$ must contain a cycle. We introduce two important types of
$\theta$-super positive graphs, namely $\theta$-elementary and $\theta$-base
graphs. One of our main results is that any $\theta$-super positive graph $G$
can be constructed by adding certain type of edges to a disjoint union of
$\theta$-base graphs; moreover, these $\theta$-base graphs are uniquely
determined by $G$. We also give a characterization of $\theta$-elementary
graphs: a graph $G$ is $\theta$-elementary if and only if the set of all its
$\theta$-barrier sets form a partition of $V(G)$. Here, $\theta$-elementary
graphs and $\theta$-barrier sets can be regarded as $\theta$-analogue of
elementary graphs and Tutte sets in classical matching theory.
","[{""version"":""v1"",""created"":""Mon, 21 Dec 2009 08:36:26 GMT""}]","2009-12-22"
"0912.4101","Ognian Kassabov T","Ognian Kassabov","Submanifolds of a complex space form, whose geodesics lie in 1 -
  dimensional complex submanifolds","4 pages","Bull. Math. Soc. Sc. Math. Roumanie, Tome 39 (87) Nr. 1-4, 1996",,,"math.DG","http://arxiv.org/licenses/nonexclusive-distrib/1.0/","  It is proved, that if M is a connected, complete submanifold of a complex
space form N and each geodesic of M lies in an 1-dimensional totally geodesic
complex submanifold of N, then M is totally geodesic in N and is a real space
form or a complex space form.
","[{""version"":""v1"",""created"":""Mon, 21 Dec 2009 08:44:55 GMT""}]","2009-12-22"
"0912.4102","Osamu Narikiyo","Shiro Saito, Osamu Narikiyo","Scale-free dynamics of somatic adaptability in immune system","14 pages, 8 figures",,,,"physics.bio-ph q-bio.CB","http://arxiv.org/licenses/nonexclusive-distrib/1.0/","  The long-time dynamics of somatic adaptability in immune system is simulated
by a simple physical model. The immune system described by the model exhibits a
scale free behavior as is observed in living systems. The balance between the
positive and negative feedbacks of the model leads to a robust immune system
where the positive one corresponds to the formation of memory cells and the
negative one to immunosuppression. Also the immunosenescence of the system is
discussed based on the time-dependence of the epigenetic landscape of the
adaptive immune cells in the shape space.
","[{""version"":""v1"",""created"":""Mon, 21 Dec 2009 08:48:29 GMT""}]","2009-12-22"
"0912.4103","Sergio Sim\'on-D\'iaz","S. Sim\'on-D\'iaz","The chemical composition of the Orion star forming region: I.
  Homogeneity of O and Si abundances in B-type stars","18 tables, 10 figures, acepted to be published in A&A",,"10.1051/0004-6361/200913120",,"astro-ph.SR","http://arxiv.org/licenses/nonexclusive-distrib/1.0/","  Recent accurate abundance analyses of B-type main sequence stars in the solar
vicinity has shown that abundances derived from these stellar objects are more
homogeneous and metal-rich than previously thought. We investigate whether the
inhomogeneity of abundances previously found in B-type stars in the Ori OB1
association is real (hence a signature of enrichment of the newly formed stars
in an induced star formation scenario) or a consequence of intrinsic errors
induced by the use of photometric indices to establish the stellar parameters
prior to the abundance analysis. We obtained a new (improved) spectroscopic
data set comprising 13 B-type stars in the various Ori OB1 associations, and
performed a detailed, self-consistent spectroscopic abundance analysis by means
of the modern stellar atmosphere code FASTWIND. We detect systematic errors in
the stellar parameters determined previously which affect the derived
abundances. Once these errors are accounted for, we find a high degree of
homogeneity in the O and Si abundances for stars in the four Ori OB1 subgroups.
The derived abundances are in very good agreement with recent determinations in
other B-type stars in the solar vicinity. We also compare our results with
those obtained for the Sun during the epoch of the ""solar crisis"", and the
Orion nebula.
","[{""version"":""v1"",""created"":""Mon, 21 Dec 2009 08:55:36 GMT""}]","2015-05-14"
"0912.4104","Jin An","Lei Xu, Jin An, Chang-De Gong","Induced chiral Dirac fermions in graphene by a periodically modulated
  magnetic field","6 pages, 6 figures","Phys. Rev. B 81, 125424, 2010","10.1103/PhysRevB.81.125424",,"cond-mat.mes-hall","http://arxiv.org/licenses/nonexclusive-distrib/1.0/","  The effect of a modulated magnetic field on the electronic structure of
neutral graphene is examined in this paper. It is found that application of a
small staggered modulated magnetic field does not destroy the Dirac-cone
structure of graphene and so preserves its 4-fold zero-energy degeneracy. The
original Dirac points (DPs) are just shifted to other positions in k space. By
varying the staggered field gradually, new DPs with exactly the same
electron-hole crossing energy as that of the original DPs, are generated, and
both the new and original DPs are moving continuously. Once two DPs are shifted
to the same position, they annihilate each other and vanish. The process of
generation and evolution of these DPs with the staggered field is found to have
a very interesting patten, which is examined carefully. Generally, there exists
a corresponding branch of anisotropic massless fermions for each pair of DPs,
resulting in that each Landau level (LL) is still 4-fold degenerate except the
zeroth LL which has a robust $4n_t$-fold degeneracy with nt the number of pairs
of DPs. As a result, the Hall conductivity $\sigma_{xy}$ shows a step of size
$4n_te^2/h$ across zero energy.
","[{""version"":""v1"",""created"":""Mon, 21 Dec 2009 08:56:17 GMT""}]","2010-04-09"
"0912.4105","Jonay I. Gonzalez Hernandez","J. I. Gonz\'alez Hern\'andez, P. Bonifacio, E. Caffau, M. Steffen,
  H.-G. Ludwig, N. Behara, L. Sbordone, R. Cayrel, S. Zaggia","Main-Sequence and sub-giant stars in the Globular Cluster NGC6397: The
  complex evolution of the lithium abundance","Proceedings of the contributed talk presented at the IAU Symposium
  268",,"10.1017/S1743921310004217",,"astro-ph.GA","http://arxiv.org/licenses/nonexclusive-distrib/1.0/","  Thanks to the high multiplex and efficiency of Giraffe at the VLT we have
been able for the first time to observe the Li I doublet in the Main Sequence
(MS) stars of a Globular Cluster. At the same time we observed Li in a sample
of Sub-Giant (SG) stars of the same B-V colour. Our final sample is composed of
84 SG stars and 79 MS stars. In spite of the fact that SG and MS span the same
temperature range we find that the equivalent widths of the Li I doublet in SG
stars are systematically larger than those in MS stars, suggesting a higher Li
content among SG stars. This is confirmed by our quantitative analysis. We
derived the effective temperatures, from H$\alpha$ fitting, and NLTE Li
abundances of the stars in our the sample, using 3D and 1D models. We find that
SG stars have a mean Li abundance higher by 0.1dex than MS stars, using both 1D
and 3D models. We also detect a positive slope of Li abundance with effective
temperature. These results provide an unambiguous evidence that the Li
abundance changes with evolutionary status. The physical mechanisms responsible
for this behaviour are not yet clear, and none of the existing models seems to
describe accurately these observations. Based on these conclusions, we believe
that the cosmological lithium problem still remains an open question.
","[{""version"":""v1"",""created"":""Mon, 21 Dec 2009 09:00:55 GMT""}]","2015-05-14"
"0912.4106","Wolfgang Kalb","Wolfgang L. Kalb and Bertram Batlogg","Calculating the trap density of states in organic field-effect
  transistors from experiment: A comparison of different methods","14 pages, 7 figures","Phys. Rev. B 81, 035327 (2010)","10.1103/PhysRevB.81.035327",,"cond-mat.mtrl-sci","http://arxiv.org/licenses/nonexclusive-distrib/1.0/","  The spectral density of localized states in the band gap of pentacene (trap
DOS) was determined with a pentacene-based thin-film transistor from
measurements of the temperature dependence and gate-voltage dependence of the
contact-corrected field-effect conductivity. Several analytical methods to
calculate the trap DOS from the measured data were used to clarify, if the
different methods lead to comparable results. We also used computer simulations
to further test the results from the analytical methods. Most methods predict a
trap DOS close to the valence band edge that can be very well approximated by a
single exponential function with a slope in the range of 50-60 meV and a trap
density at the valence band edge of approx. 2x10E21 eV-1cm-3. Interestingly,
the trap DOS is always slightly steeper than exponential. An important finding
is that the choice of the method to calculate the trap DOS from the measured
data can have a considerable effect on the final result. We identify two
specific simplifying assumptions that lead to significant errors in the trap
DOS. The temperature-dependence of the band mobility should generally not be
neglected. Moreover, the assumption of a constant effective accumulation layer
thickness leads to a significant underestimation of the slope of the trap DOS.
","[{""version"":""v1"",""created"":""Mon, 21 Dec 2009 09:01:15 GMT""}]","2010-02-08"
"0912.4107","Axel Kohnert","Axel Kohnert","New [48,16,16] Optimal Linear Binary Block Code",,,,,"cs.IT math.IT","http://arxiv.org/licenses/nonexclusive-distrib/1.0/","  A new [48,16,16] optimal linear binary block code is given. To get this code
a general construction is used which is also described in this paper. The
construction of this new code settles an conjecture mentioned in a 2008 paper
by Janosov et al. where the authors found an new optimal [47,15,16]-code, which
is relevant to the applied construction.
","[{""version"":""v1"",""created"":""Mon, 21 Dec 2009 09:08:39 GMT""}]","2009-12-22"
