"0902.0765","Andrea Cappelli","Andrea Cappelli, Ivan D. Rodriguez","Matrix Effective Theories of the Fractional Quantum Hall effect","30 pages, 6 figures, to appear in the Al. Zamolodchikov memorial
  volume","J.Phys.A42:304006,2009","10.1088/1751-8113/42/30/304006","DFF 448/01/2009","hep-th cond-mat.mes-hall","http://arxiv.org/licenses/nonexclusive-distrib/1.0/","  The present understanding of nonperturbative ground states in the fractional
quantum Hall effect is based on effective theories of the Jain ""composite
fermion"" excitations. We review the approach based on matrix variables, i.e. D0
branes, originally introduced by Susskind and Polychronakos. We show that the
Maxwell-Chern-Simons matrix gauge theory provides a matrix generalization of
the quantum Hall effect, where the composite-fermion construction naturally
follows from gauge invariance. The matrix ground states obtained by suitable
projections of higher Landau levels are found to be in one-to-one
correspondence with the Laughlin and Jain hierarchical states. The matrix
theory possesses a physical limit for commuting matrices that could be
reachable while staying in the same phase.
","[{""version"":""v1"",""created"":""Wed, 4 Feb 2009 20:08:20 GMT""}]","2009-07-22"
"0902.0766","Jonathan Pridham","J. P. Pridham","Hodge structures on analytic moduli of real pluriharmonic bundles","18 pages",,,,"math.AG","http://arxiv.org/licenses/nonexclusive-distrib/1.0/","  We define and construct the real analytic moduli stack of pluriharmonic
bundles on a compact Kaehler manifold X, and show how this is equipped with
Hodge and quaternionic structures. This stack maps to the de Rham moduli stack,
giving rise to preferred sections of the Deligne-Hitchin twistor stack. We then
show how the non-abelian mixed Hodge structures on Malcev homotopy types X can
be extended to objects over the pluriharmonic moduli stack.
","[{""version"":""v1"",""created"":""Wed, 4 Feb 2009 18:54:23 GMT""}]","2009-02-05"
"0902.0767","Dmitri Vassilevich","D. V. Vassilevich","Towards noncommutative gravity","10p, Contribution to ""Fundamental Interactions - A Memorial Volume
  for Wolfgang Kummer"", to appear in World Scientific, v2: refs added",,"10.1142/9789814277839_0017",,"hep-th","http://arxiv.org/licenses/nonexclusive-distrib/1.0/","  In this short article accessible for non-experts I discuss possible ways of
constructing a non-commutative gravity paying special attention to
possibilities of realizing the full diffeomorphism symmetry and to relations
with 2D gravities.
","[{""version"":""v1"",""created"":""Wed, 4 Feb 2009 18:44:23 GMT""},{""version"":""v2"",""created"":""Tue, 17 Feb 2009 18:51:14 GMT""}]","2016-12-21"
"0902.0768","Michael Bonitz","D. Hochstuhl, K. Balzer, S. Bauch and M. Bonitz","Nonequilibrium Green function approach to photoionization processes in
  atoms","11 pages, 6 figures","Physica E 42, 513-519 (2010)","10.1016/j.physe.2009.06.044",,"physics.atom-ph","http://arxiv.org/licenses/nonexclusive-distrib/1.0/","  We present a quantum kinetic approach for the time-resolved description of
many-body effects in photoionization processes in atoms. The method is based on
the non-equilibrium Green functions formalism and solves the
Keldysh/Kadanoff-Baym equations in second Born approximation. An approximation
scheme is introduced and discussed, which provides a complete single-particle
description of the continuum, while the atom is treated fully correlated.
","[{""version"":""v1"",""created"":""Wed, 4 Feb 2009 18:45:58 GMT""}]","2015-05-13"
"0902.0769","Covi Laura","Laura Covi and Jihn E. Kim","Axinos as Dark Matter Particles","15 pages, 2 figures, invited contribution to NJP Focus Issue on 'Dark
  Matter and Particle Physics'","New J. Phys. 11 (2009) 105003","10.1088/1367-2630/11/10/105003","DESY 09-017, SNUTP 09-002","astro-ph.CO hep-ph","http://arxiv.org/licenses/nonexclusive-distrib/1.0/","  The identification of dark matter in our particle physics model is still a
very open question. Here we will argue that axinos can be successful dark
matter candidates in models with supersymmetry and the axion solution of the
strong CP problem. Axinos can be the lightest supersymmetric particle (LSP), or
can be heavier than the LSP. Axinos can be produced in the right abundance by
thermal scatterings and if they are the LSP also by out of equilibrium decays
of the lightest superpartner of SM fields (LSPSMs). On the other hand heavier
(not LSP) axinos can generate a part of the neutralino LSP dark matter.
Depending on the nature of the supersymmetric spectrum, and if R-parity is
strictly conserved or slightly broken, very different signals of the LSP axino
scenario can arise at colliders and in astrophysics.
","[{""version"":""v1"",""created"":""Wed, 4 Feb 2009 18:51:58 GMT""}]","2009-10-22"
"0902.0770","Jonathan Pridham","J. P. Pridham","Formality and splitting of real non-abelian mixed Hodge structures","This paper has been withdrawn by the author. Withdrawn - superseded
  by sections 1-10 of arXiv:1104.1409; 71 pages, supersedes arXiv:math/0611686;
  v2 overhauled, main new results are Thm 3.10, Sections 7 & 8, & parts of
  Section 2",,,,"math.AG math.AT","http://arxiv.org/licenses/nonexclusive-distrib/1.0/","  We define and construct mixed Hodge structures on real schematic homotopy
types of complex projective varieties, giving mixed Hodge structures on their
homotopy groups and pro-algebraic fundamental groups. We also show that these
split on tensoring with the ring R[x] equipped with the Hodge filtration given
by powers of (x-i), giving new results even for simply connected varieties.
Thus the mixed Hodge structures can be recovered from cohomology groups of
local systems, together with the monodromy action at the Archimedean place. As
the basepoint varies, these all become real variations of mixed Hodge
structure.
","[{""version"":""v1"",""created"":""Wed, 4 Feb 2009 18:48:22 GMT""},{""version"":""v2"",""created"":""Sat, 20 Mar 2010 17:55:03 GMT""},{""version"":""v3"",""created"":""Sun, 31 Aug 2014 16:23:04 GMT""}]","2014-09-02"
"0902.0771","Colin Bailey","Colin Bailey, Joseph Oliveira","Cubic algebras and Implication Algebras","24 pages",,,,"math.CO","http://arxiv.org/licenses/nonexclusive-distrib/1.0/","  We consider relationships between cubic algebras and implication algebras. We
first exhibit a functorial construction of a cubic algebra from an implication
algebra. Then we consider an collapse of a cubic algebra to an implication
algebra and the connection between these two operations. Finally we use the
ideas of the collapse to obtain a Stone-type representation theorem for a large
class of cubic algebras.
","[{""version"":""v1"",""created"":""Wed, 4 Feb 2009 18:49:49 GMT""}]","2009-02-05"
"0902.0772","Alberto Accardi","Alberto Accardi","Target mass corrections and beyond","4 pages, 1 figure. Talk given at ""SPIN2008"", University of Virginia,
  October 6-11 2008","AIP Conf.Proc.1149:349-352,2009","10.1063/1.3215662","JLAB-THY-08-930","hep-ph","http://arxiv.org/licenses/nonexclusive-distrib/1.0/","  I examine the uncertainty of perturbative QCD factorization for (un)polarized
hadron structure functions in deep inelastic scattering at a large value of the
Bjorken variable xB. The focus will be on Target Mass Corrections and Jet Mass
Corrections in the collinear factorization framework.
","[{""version"":""v1"",""created"":""Wed, 4 Feb 2009 18:55:14 GMT""}]","2009-08-24"
"0902.0773","Melahat Bayar","V. Bashiry, M. Bayar and K. Azizi","A comparative study on $B \rar K^\ast \ell^+ \ell^-$ and $B \rar
  K_0^\ast (1430) \ell^+ \ell^-$ decays in the Supersymmetric Models","12 Pages, 3 Figures, 5 Tables","Mod.Phys.Lett.A26:901-911,2011","10.1142/S0217732311035353",,"hep-ph","http://arxiv.org/licenses/nonexclusive-distrib/1.0/","  In this paper, we compare the branching ratio and rate difference of electron
channel to muon channel of $B \rar K_0^\ast (1430) \ell^+ \ell^-$ and $B \rar
K^\ast \ell^+ \ell^-$decays, where $K_0^\ast (1430)$ is the p--wave scalar
meson, in the supersymmetric models. MSSM with $R$ parity is considered since
considerable deviation from the standard model predictions can be obtained in
$B\rightarrow X_s \ell^-\ell^+$. Taking $C_{Q1}$ and $C_{Q2}$ about one which
is consistent with the $B\to K^\ast\mu^+\mu^-$ rate at low dileptonic invariant
mass region($1\leq q^2\leq 6$GeV$^2$). It is found that, firstly, the $B \rar
K_0^\ast (1430) \ell^+ \ell^-$ $(\ell = \mu,\, \tau)$ decay is measurable at
LHC, secondly, in comparison with $B \rar K^\ast \ell^+ \ell^-$ decay a greater
deviation in the $B \rar K_0^\ast (1430) \ell^+ \ell^-$ decay can be seen.
Measurement of these observables for the semileptonic rare $B \rar K_0^\ast
(1430) \ell^+ \ell^-$, in particular, at low $q^2$ region can give valuable
information about the nature of interactions within Standard Model or beyond.
","[{""version"":""v1"",""created"":""Wed, 4 Feb 2009 18:52:24 GMT""},{""version"":""v2"",""created"":""Wed, 9 Feb 2011 16:41:33 GMT""}]","2015-03-13"
"0902.0774","Corsin Battaglia","Corsin Battaglia, Katalin Gaal-Nagy, Giovanni Onida, Philipp Aebi","Structure and stability of the Si(331)-(12x1) surface reconstruction",,"Phys. Rev. B 80, 214102 (2009)","10.1103/PhysRevB.80.214102",,"cond-mat.mtrl-sci","http://arxiv.org/licenses/nonexclusive-distrib/1.0/","  We recently proposed a new structural model for the Si(331)-(12x1) surface
reconstruction containing silicon pentamers as elementary structural building
blocks. Using first-principles density-functional theory we here investigate
the stability of a variety of adatom configurations and determine the lowest
energy configuration. We also present a detailed comparison of the energetics
between our model for Si(331)-(12x1) and the adatom-tetramer-interstitial model
for Si(110)-(16x2), which shares the same structural building blocks.
","[{""version"":""v1"",""created"":""Wed, 4 Feb 2009 19:01:04 GMT""}]","2010-01-31"
"0902.0775","Greg Stinson","Greg Stinson (1), Julianne Dalcanton (2), Tom Quinn (2), Stephanie
  Gogarten (2), Tobias Kaufmann (3), James Wadsley (1) ((1) McMaster
  University, (2) University of Washington, (3) UC Irvine)","Feedback and the Formation of Dwarf Galaxy Stellar Halos","15 pages, 15 figures, accepted MNRAS","Mon.Not.Roy.Astron.Soc.395:1455-1466,2009","10.1111/j.1365-2966.2009.14555.x",,"astro-ph.CO astro-ph.GA","http://arxiv.org/licenses/nonexclusive-distrib/1.0/","  Stellar population studies show that low mass galaxies in all environments
exhibit stellar halos that are older and more spherically distributed than the
main body of the galaxy. In some cases, there is a significant intermediate age
component that extends beyond the young disk. We examine a suite of Smoothed
Particle Hydrodynamic (SPH) simulations and find that elevated early star
formation activity combined with supernova feedback can produce an extended
stellar distribution that resembles these halos for model galaxies ranging from
$v_{200}$ = 15 km s$^{-1}$ to 35 km s$^{-1}$, without the need for accretion of
subhalos.
","[{""version"":""v1"",""created"":""Wed, 4 Feb 2009 19:21:41 GMT""}]","2011-07-26"
"0902.0776","Massimo Auci","Massimo Auci","Self-gravitational red shift effect and micro-black holes production in
  dipolar electromagnetic sources","11 pages, 4 figures. SIF conference 2006, Torino (Italy). Submitted
  APJL",,,,"physics.gen-ph","http://arxiv.org/licenses/nonexclusive-distrib/1.0/","  Using Bridge Theory to describe the electromagnetic interactions occurring
between high energy pairs of particles, we predict an anomalous
self-gravitational red-shift in the frequency of the EM source produced during
the interaction. The extreme consequence is the introduction of an upper limit
in the electromagnetic spectrum. Hypothesizing a scattering energy greater than
5.55 10^22 Mev,the source collapses under his events horizon, becoming a
neutral spin less micro-black hole: perfect candidates to contribute to the
dark matter of the Universe.
","[{""version"":""v1"",""created"":""Wed, 4 Feb 2009 19:16:27 GMT""}]","2009-02-05"
"0902.0777","Mark Friesen","Mark Friesen and S. N. Coppersmith","Theory of valley-orbit coupling in a Si/SiGe quantum dot","18 pages, including 4 figures","Phys. Rev. B 81, 115324 (2010)","10.1103/PhysRevB.81.115324",,"cond-mat.mes-hall","http://arxiv.org/licenses/nonexclusive-distrib/1.0/","  Electron states are studied for quantum dots in a strained Si quantum well,
taking into account both valley and orbital physics. Realistic geometries are
considered, including circular and elliptical dot shapes, parallel and
perpendicular magnetic fields, and (most importantly for valley coupling) the
small local tilt of the quantum well interface away from the crystallographic
axes. In absence of a tilt, valley splitting occurs only between pairs of
states with the same orbital quantum numbers. However, tilting is ubiquitous in
conventional silicon heterostructures, leading to valley-orbit coupling. In
this context, ""valley splitting"" is no longer a well defined concept, and the
quantity of merit for qubit applications becomes the ground state gap. For
typical dots used as qubits, a rich energy spectrum emerges, as a function of
magnetic field, tilt angle, and orbital quantum number. Numerical and
analytical solutions are obtained for the ground state gap and for the mixing
fraction between the ground and excited states. This mixing can lead to valley
scattering, decoherence, and leakage for Si spin qubits.
","[{""version"":""v1"",""created"":""Wed, 4 Feb 2009 19:06:04 GMT""},{""version"":""v2"",""created"":""Sat, 5 Dec 2009 00:27:35 GMT""},{""version"":""v3"",""created"":""Mon, 29 Mar 2010 15:30:05 GMT""}]","2015-03-13"
"0902.0778","Nick Devereux","Nick Devereux, Paul Hriljac, S.P. Willner, M.L.N. Ashby, C.N.A.
  Willmer","The Morphological Type Dependence of K-band Luminosity Functions","To be published in Galaxy Evolution: Emerging Insights and Future
  Challenges, ed. S. Jogee et al. Astron. Soc. Pacific 2009. This conference
  proceeding summarizes Devereux et al., 2009, ApJ submitted. 4 pages, 1
  figure, requires asp2006.sty",,,,"astro-ph.CO","http://arxiv.org/licenses/nonexclusive-distrib/1.0/","  Differential 2.2um (K-band) luminosity functions are presented for a complete
sample of 1570 nearby Vgsr < 3000 km/s, where Vgsr is the velocity measured
with respect to the Galactic standard of rest), bright (K < 10 mag), galaxies
segregated by visible morphology. The K-band luminosity function for late-type
spirals follows a power law that rises towards low luminosities whereas the
K-band luminosity functions for ellipticals, lenticulars and bulge-dominated
spirals are peaked with a fall off at both high and low luminosities. However,
each morphological type (E, S0, S0/a-Sab, Sb-Sbc, Sc-Scd) contributes
approximately equally to the overall K-band luminosity density in the local
universe, and by inference, the stellar mass density as well.
","[{""version"":""v1"",""created"":""Wed, 4 Feb 2009 19:48:59 GMT""}]","2009-02-05"
"0902.0779","Mark Gross","Mark Gross, Rahul Pandharipande, Bernd Siebert","The tropical vertex","57 pages, 1 figure; some typoes corrected and additional references
  given. Example 1.11 added","Duke Math. J. 153, no. 2 (2010), 297-362","10.1215/00127094-2010-025",,"math.AG math.SG","http://arxiv.org/licenses/nonexclusive-distrib/1.0/","  Elements of the tropical vertex group, introduced by Kontsevich and
Soibelman, are formal families of symplectomorphisms of the 2-dimensional
algebraic torus. We prove ordered product factorizations in the tropical vertex
group are equivalent to calculations of certain genus 0 relative Gromov-Witten
invariants of toric surfaces. The relative invariants which arise have full
tangency to a toric divisor at a single unspecified point. The method uses
scattering diagrams, tropical curve counts, degeneration formulas, and exact
multiple cover calculations in orbifold Gromov-Witten theory.
","[{""version"":""v1"",""created"":""Wed, 4 Feb 2009 19:31:39 GMT""},{""version"":""v2"",""created"":""Thu, 27 Aug 2009 02:43:50 GMT""}]","2019-12-19"
"0902.0780","Vadim Guzey","V. Guzey (Jefferson Lab), A.W. Thomas (Jefferson Lab & William-Mary
  Coll.), K. Tsushima (Jefferson Lab)","Medium modifications of the bound nucleon GPDs and the quark
  contribution to the spin sum rule","14 pages, 4 figures. Matches published version, Phys. Rev. C 79,
  055205 (2009)","Phys.Rev.C79:055205,2009","10.1103/PhysRevC.79.055205","JLAB-THY-09-943","hep-ph nucl-th","http://arxiv.org/licenses/nonexclusive-distrib/1.0/","  We estimate the nuclear medium modifications of the quark contribution to the
bound nucleon spin sum rule, J^{q*}, as well as the separate helicity, \Delta
\Sigma*, and the angular momentum, L^{q*}, contributions to J^{q*}. For the
calculation of the bound nucleon generalized parton distributions (GPDs), we
use as input the bound nucleon elastic form factors predicted in the
quark-meson coupling model. Our model for the bound nucleon GPDs is relevant
for incoherent deeply virtual Compton scattering (DVCS) with nuclear targets.
We find that the m5Aedium modifications increase J^{q*} and L^{q*} and decrease
\Delta \Sigma* compared to the free nucleon case. The effect is large and
increases with increasing nuclear density \rho. For instance, at
\rho=\rho_0=0.15 fm^{-3}, J^{q*} increases by 7%, L^{q*} increases by 20%, and
\Delta \Sigma* decreases by 17%. These in-medium modifications of the bound
nucleon spin properties may be understood qualitatively in terms of the
enhancement of the lower component of the quark Dirac spinor in the nuclear
medium.
","[{""version"":""v1"",""created"":""Wed, 4 Feb 2009 19:35:30 GMT""},{""version"":""v2"",""created"":""Mon, 29 Jun 2009 13:33:13 GMT""}]","2009-06-30"
"0902.0781","Marc Schlegel","M. Schlegel, A. Metz","Two-Photon Exchange in (Semi-)Inclusive DIS","4 pages, 1 figure, Presented at the 18th International Symposium on
  Spin Physics (SPIN 2008), Oct. 6-11, 2008, Charlottesville, VA, USA","AIP Conf.Proc.1149:543-546,2009","10.1063/1.3215707",,"hep-ph","http://arxiv.org/licenses/nonexclusive-distrib/1.0/","  In this note we consider effects of a Two-Photon Exchange (TPE) in inclusive
DIS and semi-inclusive DIS (SIDIS). In particular, transverse single spin
asymmetries are generated in inclusive DIS if more than one photon is exchanged
between the lepton and the hadron. We briefly summarize the TPE in DIS in the
parton model and extend our approach to SIDIS, where a new leading twist
$\sin(2\phi)$ contribution to the longitudinal beam spin asymmetry shows up.
Possible TPE effects for the Sivers and the Collins asymmetries in SIDIS are
power-suppressed.
","[{""version"":""v1"",""created"":""Wed, 4 Feb 2009 19:38:29 GMT""}]","2009-08-24"
"0902.0782","Katia  Jaffres-Runser","Katia Jaffr\`es-Runser, Cristina Comaniciu, Jean-Marie Gorce","A Multiobjective Optimization Framework for Routing in Wireless Ad Hoc
  Networks",,"IEEE International Symposium on Conference Modeling and
  Optimization in Mobile, Ad Hoc, and Wireless Networks (WiOpt) 2010",,,"cs.NI cs.PF","http://arxiv.org/licenses/nonexclusive-distrib/1.0/","  Wireless ad hoc networks are seldom characterized by one single performance
metric, yet the current literature lacks a flexible framework to assist in
characterizing the design tradeoffs in such networks. In this work, we address
this problem by proposing a new modeling framework for routing in ad hoc
networks, which used in conjunction with metaheuristic multiobjective search
algorithms, will result in a better understanding of network behavior and
performance when multiple criteria are relevant. Our approach is to take a
holistic view of the network that captures the cross-interactions among
interference management techniques implemented at various layers of the
protocol stack. The resulting framework is a complex multiobjective
optimization problem that can be efficiently solved through existing
multiobjective search techniques. In this contribution, we present the Pareto
optimal sets for an example sensor network when delay, robustness and energy
are considered. The aim of this paper is to present the framework and hence for
conciseness purposes, the multiobjective optimization search is not developed
herein.
","[{""version"":""v1"",""created"":""Wed, 4 Feb 2009 19:48:42 GMT""},{""version"":""v2"",""created"":""Wed, 6 Jan 2010 11:15:29 GMT""}]","2010-08-17"
"0902.0783","Daniel Bemmerer","D Bemmerer, A Caciolli, R Bonetti, C Broggini, F Confortola, P
  Corvisiero, H Costantini, Z Elekes, A Formicola, Zs Fulop, G Gervino, A
  Guglielmetti, C Gustavino, Gy Gyurky, M Junker, B Limata, M Marta, R
  Menegazzo, P Prati, V Roca, C Rolfs, C Rossi Alvarez, E Somorjai, and O
  Straniero","Direct measurement of the 15N(p,gamma)16O total cross section at novae
  energies","LUNA collaboration; accepted by J. Phys. G","J.Phys.G36:045202,2009","10.1088/0954-3899/36/4/045202",,"nucl-ex astro-ph.SR","http://arxiv.org/licenses/nonexclusive-distrib/1.0/","  The 15N(p,gamma)16O reaction controls the passage of nucleosynthetic material
from the first to the second carbon-nitrogen-oxygen (CNO) cycle. A direct
measurement of the total 15N(p,gamma)16O cross section at energies
corresponding to hydrogen burning in novae is presented here. Data have been
taken at 90-230 keV center-of-mass energy using a windowless gas target filled
with nitrogen of natural isotopic composition and a bismuth germanate summing
detector. The cross section is found to be a factor two lower than previously
believed.
","[{""version"":""v1"",""created"":""Wed, 4 Feb 2009 19:58:24 GMT""}]","2009-04-21"
"0902.0784","Oleg Kirillov","Oleg N. Kirillov","Campbell diagrams of weakly anisotropic flexible rotors","20 pages, 8 figures;","Proceedings of the Royal Society A, 2009, Vol. 465, No. 2109, P.
  2703-2723","10.1098/rspa.2009.0055",,"math-ph astro-ph.EP math.MP nlin.PS physics.class-ph physics.flu-dyn physics.geo-ph physics.plasm-ph","http://arxiv.org/licenses/nonexclusive-distrib/1.0/","  We consider an axi-symmetric rotor perturbed by dissipative, conservative,
and non-conservative positional forces originated at the contact with the
anisotropic stator. The Campbell diagram of the unperturbed system is a
mesh-like structure in the frequency-speed plane with double eigenfrequencies
at the nodes. The diagram is convenient for the analysis of the traveling waves
in the rotating elastic continuum. Computing sensitivities of the doublets we
find that at every particular node the untwisting of the mesh into the branches
of complex eigenvalues in the first approximation is generically determined by
only four 2x2 sub-blocks of the perturbing matrix. Selection of the unstable
modes that cause self-excited vibrations in the subcritical speed range, is
governed by the exceptional points at the corners of the singular eigenvalue
surfaces--`double coffee filter' and `viaduct'--which are associated with the
crossings of the unperturbed Campbell diagram with the definite Krein
signature. The singularities connect the problems of wave propagation in the
rotating continua with that of electromagnetic and acoustic wave propagation in
non-rotating anisotropic chiral media. As mechanical examples a model of a
rotating shaft with two degrees of freedom and a continuous model of a rotating
circular string passing through the eyelet are studied in detail.
","[{""version"":""v1"",""created"":""Wed, 4 Feb 2009 20:02:48 GMT""},{""version"":""v2"",""created"":""Tue, 9 Jun 2009 09:32:44 GMT""}]","2016-09-08"
"0902.0785","Lucas Labadie","L. Labadie (MPIA), O. Wallner (Astrium)","Mid-infrared guided optics: a perspective for astronomical instruments","16 pages, published in OSA Optics Express (see
  http://www.opticsinfobase.org/oe/abstract.cfm?uri=oe-17-3-1947)","Opt.Express 17:1947-1962,2009","10.1364/OE.17.001947",,"astro-ph.IM","http://arxiv.org/licenses/nonexclusive-distrib/1.0/","  Research activities during the last decade have shown the strong potential of
photonic devices to greatly simplify ground based and space borne astronomical
instruments and to improve their performance. We focus specifically on the
mid-infrared wavelength regime (about 5-20 microns), a spectral range offering
access to warm objects (about 300 K) and to spectral features that can be
interpreted as signatures for biological activity (e.g. water, ozone, carbon
dioxide). We review the relevant research activities aiming at the development
of single-mode guided optics and the corresponding manufacturing technologies.
We evaluate the experimentally achieved performance and compare it with the
performance requirements for applications in various fields of astronomy. Our
goal is to show a perspective for future astronomical instruments based on
mid-infrared photonic devices.
","[{""version"":""v1"",""created"":""Wed, 4 Feb 2009 20:07:57 GMT""}]","2010-11-02"
