"0902.0889","Viet Nguyen H","Huy-Viet Nguyen and Stefano de Gironcoli","Efficient and accurate calculation of exact exchange and RPA correlation
  energies in the Adiabatic-Connection Fluctuation-Dissipation theory","12 pages, 6 figures. To appear in Phys. Rev. B","Phys. Rev. B 79, 205114 (2009)","10.1103/PhysRevB.79.205114",,"cond-mat.mtrl-sci","http://arxiv.org/licenses/nonexclusive-distrib/1.0/","  Recently there has been a renewed interest in the calculation of
exact-exchange and RPA correlation energies for realistic systems. These
quantities are main ingredients of the so-called EXX/RPA+ scheme which has been
shown to be a promising alternative approach to the standard LDA/GGA DFT for
weakly bound systems where LDA and GGA perform poorly. In this paper, we
present an efficient approach to compute the RPA correlation energy in the
framework of the Adiabatic-Connection Fluctuation-Dissipation formalism. The
method is based on the calculation of a relatively small number of eigenmodes
of RPA dielectric matrix, efficiently computed by iterative density response
calculations in the framework of Density Functional Perturbation Theory. We
will also discuss a careful treatment of the integrable divergence in the
exact-exchange energy calculation which alleviates the problem of its slow
convergence with respect to Brillouin zone sampling. As an illustration of the
method, we show the results of applications to bulk Si, Be dimer and atomic
systems.
","[{""version"":""v1"",""created"":""Thu, 5 Feb 2009 11:50:44 GMT""},{""version"":""v2"",""created"":""Mon, 20 Apr 2009 06:55:09 GMT""}]","2009-07-22"
"0902.0890","Ariel Amir","Ariel Amir, Yoav Lahini, Hagai B. Perets","Classical Diffusion of a quantum particle in a noisy environment",,"Phys. Rev. E 79, 050105(R) (2009)","10.1103/PhysRevE.79.050105",,"quant-ph cond-mat.other","http://arxiv.org/licenses/nonexclusive-distrib/1.0/","  We study the spreading of a quantum-mechanical wavepacket in a
one-dimensional tight-binding model with a noisy potential, and analyze the
emergence of classical diffusion from the quantum dynamics due to decoherence.
We consider a finite correlation time of the noisy environment, and treat the
system by utilizing the separation of fast (dephasing) and slow (diffusion)
processes. We show that classical diffusive behavior emerges at long times, and
we calculate analytically the dependence of the classical diffusion coefficient
on the noise magnitude and correlation time. This method provides a general
solution to this problem for arbitrary conditions of the noisy environment. The
results are relevant to a large variety of physical systems, from electronic
transport in solid state physics, to light transmission in optical devices,
diffusion of excitons, and quantum computation.
","[{""version"":""v1"",""created"":""Thu, 5 Feb 2009 11:56:34 GMT""}]","2015-05-13"
"0902.0891","Andrzej J. Maciejewski","Guillaume Duval, Andrzej J. Maciejewski","Jordan obstruction to the integrability of Hamiltonian systems with
  homogeneous potentials","36 pages","Annales de l'Institut Fourier, vol.59, No.7, pp. 2839-2890, (2009)",,,"math.DS math.SG","http://arxiv.org/licenses/nonexclusive-distrib/1.0/","  In this paper, we consider the natural complex Hamiltonian systems with
homogeneous potential $V(q)$, $q\in\C^n$, of degree $k\in\Z^\star$. The known
results of Morales and Ramis give necessary conditions for the complete
integrability of such systems. These conditions are expressed in terms of the
eigenvalues of the Hessian matrix $V""(c)$ calculated at a non-zero point
$c\in\C^n$, such that $V'(c)=c$. The main aim of this paper is to show that
there are other obstructions for the integrability which appear if the matrix
$V""(c)$ is not diagonalizable. We prove, among other things, that if $V""(c)$
contains a Jordan block of size greater than two, then the system is not
integrable in the Liouville sense. The main ingredient in the proof of this
result consists in translating some ideas of Kronecker about Abelian extensions
of number fields into the framework of differential Galois theory.
","[{""version"":""v1"",""created"":""Thu, 5 Feb 2009 12:01:10 GMT""}]","2010-04-19"
"0902.0892","Mark Flanagan","Mark F. Flanagan","A Unified Framework for Linear-Programming Based Communication Receivers","13 pages, 6 figures. To appear in the IEEE Transactions on
  Communications",,"10.1109/TCOMM.2011.100411.100417",,"cs.IT math.IT","http://arxiv.org/licenses/nonexclusive-distrib/1.0/","  It is shown that a large class of communication systems which admit a
sum-product algorithm (SPA) based receiver also admit a corresponding
linear-programming (LP) based receiver. The two receivers have a relationship
defined by the local structure of the underlying graphical model, and are
inhibited by the same phenomenon, which we call 'pseudoconfigurations'. This
concept is a generalization of the concept of 'pseudocodewords' for linear
codes. It is proved that the LP receiver has the 'maximum likelihood
certificate' property, and that the receiver output is the lowest cost
pseudoconfiguration. Equivalence of graph-cover pseudoconfigurations and
linear-programming pseudoconfigurations is also proved. A concept of 'system
pseudodistance' is defined which generalizes the existing concept of
pseudodistance for binary and nonbinary linear codes. It is demonstrated how
the LP design technique may be applied to the problem of joint equalization and
decoding of coded transmissions over a frequency selective channel, and a
simulation-based analysis of the error events of the resulting LP receiver is
also provided. For this particular application, the proposed LP receiver is
shown to be competitive with other receivers, and to be capable of
outperforming turbo equalization in bit and frame error rate performance.
","[{""version"":""v1"",""created"":""Thu, 5 Feb 2009 12:01:29 GMT""},{""version"":""v2"",""created"":""Thu, 15 Jul 2010 15:54:37 GMT""},{""version"":""v3"",""created"":""Tue, 16 Aug 2011 15:50:34 GMT""}]","2016-11-15"
"0902.0893","Paolo Gualtieri","P. Gualtieri, F. Picano, C.M. Casciola","Anisotropic clustering of inertial particles in homogeneous shear flow","To appear in Journal Fluid Mechanics 2009",,"10.1017/S002211200900648X",,"nlin.CD","http://arxiv.org/licenses/nonexclusive-distrib/1.0/","  Recently, clustering of inertial particles in turbulence has been thoroughly
analyzed for statistically homogeneous isotropic flows. Phenomenologically,
spatial homogeneity of particles configurations is broken by the advection of a
range of eddies determined by the Stokes relaxation time of the particles which
results in a multi-scale distribution of local concentrations and voids. Much
less is known concerning anisotropic flows. Here, by addressing direct
numerical simulations (DNS) of a statistically steady particle-laden
homogeneous shear flow, we provide evidence that the mean shear preferentially
orients particle patterns. By imprinting anisotropy on large scales velocity
fluctuations, the shear indirectly affects the geometry of the clusters.
Quantitative evaluation is provided by a purposely designed tool, the angular
distribution function of particle pairs (ADF), which allows to address the
anisotropy content of particles aggregates on a scale by scale basis. The data
provide evidence that, depending on the Stokes relaxation time of the
particles, anisotropic clustering may occur even in the range of scales where
the carrier phase velocity field is already recovering isotropy. The strength
of the singularity in the anisotropic component of the ADF quantifies the level
of fine scale anisotropy, which may even reach values of more than 30%
direction-dependent variation in the probability to find two close-by particles
at viscous scale separation.
","[{""version"":""v1"",""created"":""Thu, 5 Feb 2009 12:05:13 GMT""}]","2015-05-13"
"0902.0894","Florian Mehats","Mohammed Lemou, Florian Mehats, Pierre Raphael","Stable ground states for the relativistic gravitational Vlasov-Poisson
  system",,"Commun.Part.Diff.Eq.34:703-721,2009","10.1080/03605300902963369",,"math.AP astro-ph.GA gr-qc","http://arxiv.org/licenses/nonexclusive-distrib/1.0/","  We consider the three dimensional gravitational Vlasov-Poisson (GVP) system
in both classical and relativistic cases. The classical problem is subcritical
in the natural energy space and the stability of a large class of ground states
has been derived by various authors. The relativistic problem is critical and
displays finite time blow up solutions. Using standard concentration
compactness techniques, we however show that the breaking of the scaling
symmetry allows the existence of stable relativistic ground states. A new
feature in our analysis which applies both to the classical and relativistic
problem is that the orbital stability of the ground states does not rely as
usual on an argument of uniqueness of suitable minimizers --which is mostly
unknown-- but on strong rigidity properties of the transport flow, and this
extends the class of minimizers for which orbital stability is now proved.
","[{""version"":""v1"",""created"":""Thu, 5 Feb 2009 12:40:15 GMT""}]","2014-11-18"
"0902.0895","Oriana Mansutti","Marco Roncadelli, Alessandro De Angelis, Oriana Mansutti","Evidence for a New Light Boson from Cosmological Gamma-Ray Propagation?","11 pages, 2 figures, Proceeding of the Conference ""Frontiers of
  Fundamental and Computational Physics"", AIP Conference Proceedings 1018
  (2008)","AIP Conf.Proc.1018:147-156,2008","10.1063/1.2947673",,"astro-ph.CO astro-ph.HE hep-ph","http://arxiv.org/licenses/nonexclusive-distrib/1.0/","  An anomalously large transparency of the Universe to gamma rays has recently
been discovered by the Imaging Atmospheric Cherenkov Telescopes (IACTs)
H.E.S.S. and MAGIC. We show that observations can be reconciled with standard
blazar emission models provided photon oscillations into a very light
Axion-Like Particle occur in extragalactic magnetic fields. A quantitative
estimate of this effect is successfully applied to the blazar 3C279. Our
prediction can be tested with the satellite-borne Fermi/LAT detector as well as
with the ground-based IACTs H.E.S.S., MAGIC, CANGAROOIII, VERITAS and the
Extensive Air Shower arrays ARGO-YBJ andMILAGRO. Our result also offers an
important observational test for models of dark energy wherein quintessence is
coupled to the photon through an effective dimension-five operator.
","[{""version"":""v1"",""created"":""Thu, 5 Feb 2009 12:42:47 GMT""}]","2010-11-30"
"0902.0896","Thomas Vogel","Thomas Vogel, Thomas Neuhaus, Michael Bachmann, Wolfhard Janke","Thickness-dependent secondary structure formation of tubelike polymers",,"EPL 85 (2009) 10003","10.1209/0295-5075/85/10003",,"cond-mat.soft","http://arxiv.org/licenses/nonexclusive-distrib/1.0/","  By means of sophisticated Monte Carlo methods, we investigate the
conformational phase diagram of a simple model for flexible polymers with
explicit thickness. The thickness constraint, which is introduced geometrically
via the global radius of curvature of a polymer conformation, accounts for the
excluded volume of the polymer and induces cooperative effects supporting the
formation of secondary structures. In our detailed analysis of the temperature
and thickness dependence of the conformational behavior for classes of short
tubelike polymers, we find that known secondary-structure segments like helices
and turns, but also ringlike conformations and stiff rods are dominant
intrinsic topologies governing the phase behavior of such cooperative tubelike
objects. This shows that the thickness constraint is indeed a fundamental
physical parameter that allows for a classification of generic polymer
structures.
","[{""version"":""v1"",""created"":""Thu, 5 Feb 2009 13:03:16 GMT""}]","2009-02-06"
"0902.0897","Diego Garlaschelli","Diego Garlaschelli","The weighted random graph model","A Mathematica demonstration (by Tiziano Squartini) allowing to
  generate small weighted graphs according to the model is available online at
  http://demonstrations.wolfram.com/WeightedRandomGraph/","New Journal of Physics 11, 073005 (2009)","10.1088/1367-2630/11/7/073005",,"cond-mat.stat-mech cond-mat.dis-nn math-ph math.CO math.MP physics.soc-ph","http://arxiv.org/licenses/nonexclusive-distrib/1.0/","  We introduce the weighted random graph (WRG) model, which represents the
weighted counterpart of the Erdos-Renyi random graph and provides fundamental
insights into more complicated weighted networks. We find analytically that the
WRG is characterized by a geometric weight distribution, a binomial degree
distribution and a negative binomial strength distribution. We also
characterize exactly the percolation phase transitions associated with edge
removal and with the appearance of weighted subgraphs of any order and
intensity. We find that even this completely null model displays a percolation
behavior similar to what observed in real weighted networks, implying that edge
removal cannot be used to detect community structure empirically. By contrast,
the analysis of clustering successfully reveals different patterns between the
WRG and real networks.
","[{""version"":""v1"",""created"":""Thu, 5 Feb 2009 12:50:26 GMT""},{""version"":""v2"",""created"":""Mon, 6 Jul 2009 07:19:13 GMT""}]","2016-09-08"
"0902.0898","Bruce Gendre","A. Klotz (1, 2), M. Boer (1), J.L. Atteia (3), B. Gendre (4) ((1)
  Ohp/CNRS; (2) Cesr/CNRS/Ups; (3) Latt/CNRS/Ups; (4) Lam/CNRS/Universite de
  Provence)","Early optical observations of GRBs by the TAROT telescopes: period
  2001-2008","13 pages, 2 color figures, 5 b&w figures. Accepted for publication in
  Astronomical Journal",,"10.1088/0004-6256/137/5/4100",,"astro-ph.HE astro-ph.CO","http://arxiv.org/licenses/nonexclusive-distrib/1.0/","  The TAROT telescopes (Telescopes a Action Rapide pour les Objets
Transitoires) are two robotic observatories designed to observe the prompt
optical emission counterpart and the early afterglow of gamma ray bursts
(GRBs). We present data acquired between 2001 and 2008 and discuss the
properties of the optical emission of GRBs, noting various interesting results.
The optical emission observed during the prompt GRB phase is rarely very
bright: we estimate that 5% to 20% of GRBs exhibit a bright optical flash
(R<14) during the prompt gamma-ray emission, and that more than 50% of the GRBs
have an optical emission fainter than R=15.5 when the gamma-ray emission is
active. We study the apparent optical brightness distribution of GRBs at 1000 s
showing that our observations confirm the distribution derived by other groups.
The combination of these results with those obtained by other rapid slewing
telescopes allows us to better characterize the early optical emission of GRBs
and to emphasize the importance of very early multi-wavelength GRB studies for
the understanding of the physics of the ejecta.
","[{""version"":""v1"",""created"":""Thu, 5 Feb 2009 12:53:18 GMT""}]","2009-11-13"
"0902.0899","Camilla Schwind","R\'egis Alenda (LSIS), Nicola Olivetti (LSIS), Camilla Schwind (LIF)","Comparative concept similarity over Minspaces: Axiomatisation and
  Tableaux Calculus","25 pages",,,,"cs.AI","http://arxiv.org/licenses/nonexclusive-distrib/1.0/","  We study the logic of comparative concept similarity $\CSL$ introduced by
Sheremet, Tishkovsky, Wolter and Zakharyaschev to capture a form of qualitative
similarity comparison. In this logic we can formulate assertions of the form ""
objects A are more similar to B than to C"". The semantics of this logic is
defined by structures equipped by distance functions evaluating the similarity
degree of objects. We consider here the particular case of the semantics
induced by \emph{minspaces}, the latter being distance spaces where the minimum
of a set of distances always exists. It turns out that the semantics over
arbitrary minspaces can be equivalently specified in terms of preferential
structures, typical of conditional logics. We first give a direct
axiomatisation of this logic over Minspaces. We next define a decision
procedure in the form of a tableaux calculus. Both the calculus and the
axiomatisation take advantage of the reformulation of the semantics in terms of
preferential structures.
","[{""version"":""v1"",""created"":""Thu, 5 Feb 2009 12:55:42 GMT""}]","2009-02-06"
"0902.0900","R. Schumann","Rolf Schumann","Rigorous solution of a Hubbard model extended by nearest-neighbor
  Coulomb and isotropic exchange interaction on a triangle and tetrahedron","Please print pages 1-8 (article and figures) only, if you do not
  intend to use the analytical given eigensystem (110 pages)",,"10.1002/andp.200910347",,"cond-mat.str-el","http://arxiv.org/licenses/nonexclusive-distrib/1.0/","  In the preprint cond-mat/0701060 we detected a factor two error in the coding
of the Heisenberg term of the Hamiltonian. In the result the exchange term used
in the paper was that of an anisotropic Heisenberg model with $J_x=J_y=J$ and
$J_z=J/2$. Thus all results given for which J=0 was chosen, remain unchanged,
whereas all results containing the exchange parameter remain true for the
extended Hubbard model with anisotropic exchange. That model is of some
interest by itself, due to the relation to the XXZ model. The differing results
for isotropic exchange are given here.
","[{""version"":""v1"",""created"":""Thu, 5 Feb 2009 12:18:33 GMT""}]","2015-05-13"
"0902.0901","Lisa Brouwers","Lisa Brouwers, Martin Camitz, Baki Cakici, Kalle M\""akil\""a, Paul
  Saretok","MicroSim: Modeling the Swedish Population",,,,,"cs.OH","http://arxiv.org/licenses/nonexclusive-distrib/1.0/","  This article presents a unique, large-scale and spatially explicit
microsimulation model that uses official anonymized register data collected
from all individuals living in Sweden. Individuals are connected to households
and workplaces and represent crucial links in the Swedish social contact
network. This enables significant policy experiments in the domain of epidemic
outbreaks. Development of the model started in 2004 at the Swedish Institute
for Infectious Disease Control (SMI) in Solna, Sweden with the goal of creating
a tool for testing the effects of intervention policies. These interventions
include mass vaccination, targeted vaccination, isolation and social
distancing. The model was initially designed for simulating smallpox outbreaks.
In 2006, it was modified to support simulations of pandemic influenza. All nine
millions members of the Swedish population are represented in the model. This
article is a technical description of the simulation model; the input data, the
simulation engine and the basic object types.
","[{""version"":""v1"",""created"":""Thu, 5 Feb 2009 13:37:51 GMT""}]","2009-02-06"
"0902.0902","Adam Van Tuyl","Jing Jane He and Adam Van Tuyl","Algebraic properties of the path ideal of a tree","Added some additional hypotheses to old Theorem 3.6; now Lemma 3.6
  and Theorem 3.7",,,,"math.AC math.CO","http://arxiv.org/licenses/nonexclusive-distrib/1.0/","  The path ideal (of length t >=2) of a graph G is the monomial ideal, denoted
I_t(G), whose generators correspond to the directed paths of length t in G. We
study some of the algebraic properties of I_t(G) when G is a tree. We first
show that I_t(G) is the facet ideal of a simplicial tree. As a consequence, the
quotient ring R/I_t(G) is always sequentially Cohen-Macaulay, and the Betti
numbers of R/I_t(G) do not depend upon the characteristic of the field. We
study the case of the line graph in greater detail at the end of the paper.
","[{""version"":""v1"",""created"":""Thu, 5 Feb 2009 13:39:48 GMT""},{""version"":""v2"",""created"":""Wed, 22 Apr 2009 18:34:42 GMT""},{""version"":""v3"",""created"":""Tue, 6 Oct 2009 19:21:18 GMT""}]","2009-10-06"
"0902.0903","Lise Deharveng Mme","L. Deharveng, A. Zavagno, F. Schuller, J. Caplan, M. Pomar\`es, C. De
  Breuck","Star formation around RCW 120, the perfect bubble","14 pages, 17 figures",,"10.1051/0004-6361/200811337",,"astro-ph.GA","http://arxiv.org/licenses/nonexclusive-distrib/1.0/","  We take advantage of the very simple morphology of RCW 120 -- a perfect
bubble -- to understand the mechanisms triggering star formation around an HII
region and to establish what kind of stars are formed there. We present 870
microns observations of RCW 120, obtained with the APEX-LABOCA camera. These
show the distribution of cold dust, and thus of neutral material. We use
Spitzer-MIPS observations at 24 and 70 microns to detect the young stellar
objects (YSOs) present in this region and to estimate their evolutionary
stages.
  A layer of dense neutral material surrounds the HII region, having been swept
up during the region's expansion. This layer has a mass greater than 2000 solar
masses and is fragmented, with massive fragments elongated along the ionization
front (IF). We measured the 24 microns flux of 138 sources. Of these, 39 are
Class I or flat-spectrum YSOs observed in the direction of the collected layer.
We show that several triggering mechanisms are acting simultaneously in the
swept-up shell, where they form a second generation of stars. No massive YSOs
are detected. However, a massive, compact 870 microns core lies adjacent to the
IF. A 70 microns source with no 24 microns counterpart is detected at the same
position. This source is a likely candidate for a Class 0 YSO. Also at 24
microns, we detect a chain of about ten regularly spaced Class I or flat
spectrum sources, parallel to the IF, in the direction of the most massive
fragment. We suggest that the formation of these YSOs is the result of Jeans
gravitational instabilities in the collected layer. Finally, the 870 microns
emission, the 24 microns emission, and the Halpha emission show the existence
of an extended and partially ionized photodissociation region around RCW 120.
","[{""version"":""v1"",""created"":""Thu, 5 Feb 2009 13:44:51 GMT""}]","2009-11-13"
"0902.0904","David Horsell","D. W. Horsell, A. K. Savchenko, F. V. Tikhonenko, K. Kechedzhi, I. V.
  Lerner, V. I. Fal'ko","Mesoscopic conductance fluctuations in graphene","6 pages, 6 figures. Submitted to the proceedings of Graphene Week
  2008 (Trieste, Italy)",,"10.1016/j.ssc.2009.02.058",,"cond-mat.mes-hall cond-mat.mtrl-sci","http://arxiv.org/licenses/nonexclusive-distrib/1.0/","  We study fluctuations of the conductance of micron-sized graphene devices as
a function of the Fermi energy and magnetic field. The fluctuations are studied
in combination with analysis of weak localization which is determined by the
same scattering mechanisms. It is shown that the variance of conductance
fluctuations depends not only on inelastic scattering that controls dephasing
but also on elastic scattering. In particular, contrary to its effect on weak
localization, strong intervalley scattering suppresses conductance fluctuations
in graphene. The correlation energy, however, is independent of the details of
elastic scattering and can be used to determine the electron temperature of
graphene structures.
","[{""version"":""v1"",""created"":""Thu, 5 Feb 2009 13:45:39 GMT""}]","2015-05-13"
"0902.0905","Euro Spallucci","Patricio Gaete, Euro Spallucci","From screening to confinement in a Higgs-like model","14 pages, no figures. Inserted 2 new references and comments about
  the short-distance physical cut-off. Final version accepted for publication
  in PLB","Phys.Lett.B675:145-149,2009","10.1016/j.physletb.2009.03.061",,"hep-th hep-ph","http://arxiv.org/licenses/nonexclusive-distrib/1.0/","  We investigate a recently proposed Higgs-like model (arXiv:0811.4423
[hep-th]), in the framework of a gauge-invariant but path-dependent variables
formalism. We compute the static potential between test charges in a condensate
of scalars and fermions. In the case of charged massive scalar we recover the
screening potential. On the other hand, in the Higgs case, with a ""tachyonic""
mass term and a quartic potential in the Lagrangian, unexpected features are
found. It is observed that the interaction energy is the sum of an
effective-Yukawa and a linear potential, leading to the confinement of static
charges.
","[{""version"":""v1"",""created"":""Thu, 5 Feb 2009 15:41:08 GMT""},{""version"":""v2"",""created"":""Fri, 27 Mar 2009 08:20:47 GMT""}]","2010-03-26"
"0902.0906","Arnoldas Deltuva","A. Deltuva","Three-body direct nuclear reactions: Nonlocal optical potential","5 pages, 9 figures, submitted to Phys. Rev. C","Phys.Rev.C79:021602,2009","10.1103/PhysRevC.79.021602",,"nucl-th","http://arxiv.org/licenses/nonexclusive-distrib/1.0/","  The calculations of three-body direct nuclear reactions with nonlocal optical
potentials are performed for the first time using the framework of Faddeev-type
scattering equations. Important nonlocality effect is found for transfer
reactions like d+16O -> p + 17O often improving the description of the
experimental data.
","[{""version"":""v1"",""created"":""Thu, 5 Feb 2009 14:05:33 GMT""}]","2009-03-04"
"0902.0907","Stanislaw Mrowczynski","Radoslaw Maj and Stanislaw Mrowczynski","Test of Bowler-Sinyukov Treatment of Coulomb Interaction","6 pages, 2 figures, presented by R. Maj at the Fourth Workshop on
  Particle Correlations and Femtoscopy (WPCF2008), Cracow, Poland, September
  11-14, 2008","Acta Phys.Polon.B40:1231-1236,2009",,,"nucl-th hep-ph nucl-ex","http://arxiv.org/licenses/nonexclusive-distrib/1.0/","  The Bowler-Sinyukov method to eliminate Coulomb interaction from a
two-particle correlation function is discussed and tested.
","[{""version"":""v1"",""created"":""Thu, 5 Feb 2009 14:23:52 GMT""}]","2009-04-24"
