"0902.0828","Qin Xiaolin","Xiaolin Qin, Yong Feng, Jingwei Chen, Jingzhong Zhang","Finding Exact Minimal Polynomial by Approximations",,,,,"cs.CC cs.SC","http://arxiv.org/licenses/nonexclusive-distrib/1.0/","  We present a new algorithm for reconstructing an exact algebraic number from
its approximate value using an improved parameterized integer relation
construction method. Our result is consistent with the existence of error
controlling on obtaining an exact rational number from its approximation. The
algorithm is applicable for finding exact minimal polynomial by its approximate
root. This also enables us to provide an efficient method of converting the
rational approximation representation to the minimal polynomial representation,
and devise a simple algorithm to factor multivariate polynomials with rational
coefficients.
  Compared with other methods, this method has the numerical computation
advantage of high efficiency. The experimental results show that the method is
more efficient than \emph{identify} in \emph{Maple} 11 for obtaining an exact
algebraic number from its approximation. In this paper, we completely implement
how to obtain exact results by numerical approximate computations.
","[{""version"":""v1"",""created"":""Thu, 5 Feb 2009 00:49:13 GMT""}]","2009-02-06"
"0902.0829","Kenneth Bromberg","M. Bestvina, K. Bromberg, K. Fujiwara and J. Souto","Shearing coordinates and convexity of length functions on Teichmueller
  space",,,,,"math.GT","http://arxiv.org/licenses/nonexclusive-distrib/1.0/","  We prove that there are Fenchel-Nielsen coordinates for the Teichmueller
space of a finite area hyperbolic surface with respect to which the length
functions are convex.
","[{""version"":""v1"",""created"":""Thu, 5 Feb 2009 00:57:49 GMT""}]","2009-02-06"
"0902.0830","Yanqiu Li","Yanqiu Li, Qian Miao, Arto Nurmikko, Humphrey Maris","Picosecond Ultrasonic Measurements Using an Optical Cavity","30 pages, 13 figures, Picosecond Ultrasonics, Optical Cavity",,"10.1063/1.3095470",,"cond-mat.mtrl-sci","http://arxiv.org/licenses/nonexclusive-distrib/1.0/","  A detailed analysis of the use of an optical cavity to enhance picosecond
ultrasonic signals is presented. The optical cavity is formed between a
distributed Bragg reflector (DBR) and the metal thin film samples to be
studied. Experimental results for Al and Cu films show enhancement of acoustic
signals by up to two orders of magnitude and are in good agreement with
calculated results based on a previously established model. This technique
provides an efficient method for detecting sound in materials with small
piezo-optic coefficients and makes it possible to determine the actual pulse
shape of the returning acoustic echoes.
","[{""version"":""v1"",""created"":""Thu, 5 Feb 2009 02:35:17 GMT""}]","2015-05-13"
"0902.0831","Eyal Gruss","Eyal Gruss and Yaron Oz","Large Charge Four-Dimensional Extremal N=2 Black Holes with R^2-Terms","18 pages. v2,3: minor fixes","JHEP 0905:041,2009","10.1088/1126-6708/2009/05/041",,"hep-th","http://arxiv.org/licenses/nonexclusive-distrib/1.0/","  We consider N=2 supergravity in four dimensions with small R^2 curvature
corrections. We construct large charge extremal supersymmetric and
non-supersymmetric black hole solutions in all space, and analyze their
thermodynamic properties.
","[{""version"":""v1"",""created"":""Thu, 5 Feb 2009 01:27:31 GMT""},{""version"":""v2"",""created"":""Sun, 22 Feb 2009 15:19:43 GMT""},{""version"":""v3"",""created"":""Sun, 8 Nov 2009 13:15:07 GMT""}]","2010-01-15"
"0902.0832","Francesca Sammarruca","Francesca Sammarruca","Effects of $\Lambda$ hyperons on the nuclear equation of state in a
  Dirac-Brueckner-Hartree-Fock model","12 pages, 3 figures. Accepted for publication in Physical Review C","Phys.Rev.C79:034301,2009","10.1103/PhysRevC.79.034301",,"nucl-th","http://arxiv.org/licenses/nonexclusive-distrib/1.0/","  We predict the energy per baryon in nuclear matter with non-zero fraction of
$\Lambda$ hyperons. We include Dirac effects on the nucleons as well as the
$\Lambda$ and describe how the latter is implemented. We use the
nucleon-hyperon meson-exchange potentials from the Juelich group, the latest as
well as an earlier version. The dependence of the results on the many-body
framework and on the nucleon-hyperon interaction model is discussed.
","[{""version"":""v1"",""created"":""Thu, 5 Feb 2009 01:30:43 GMT""}]","2009-04-28"
"0902.0833","Tetsuya Ito","Tetsuya Ito","Finite Thurston type orderings on dual braid monoids","28pages, 5 figures","J. Knot Theory Ramifications 20 (2011), 995-1019","10.1142/S0218216511009078",,"math.GR","http://arxiv.org/licenses/nonexclusive-distrib/1.0/","  For a finite Thurston type ordering < of the braid group B_{n}, we introduce
a new normal form of a dual positive braid which we call the C-normal form.
This normal form extends Fromentin's rotating normal form and the author's
C-normal form of positive braids. Using the C-normal form, we give a
combinatorial description of the restriction of the ordering < to the dual
braid monoids B_{n}^{+*}. We prove that the restriction to the dual positive
monoid (B_{n}^{+*},<) is a well-ordered set of order type
\omega^{\omega^{n-2}}.
","[{""version"":""v1"",""created"":""Thu, 5 Feb 2009 03:10:16 GMT""},{""version"":""v2"",""created"":""Mon, 14 Dec 2009 03:11:59 GMT""}]","2011-07-25"
"0902.0834","Rabindra N. Mohapatra","R. N. Mohapatra","Neutron-Anti-Neutron Oscillation: Theory and Phenomenology","34 pages; 7 figures; Invited review for the issue on ""Fundamental
  Neutron Physics"" by J. Phys. G",,"10.1088/0954-3899/36/10/104006",,"hep-ph","http://arxiv.org/licenses/nonexclusive-distrib/1.0/","  The discovery of neutrino masses has provided strong hints in favor of the
possibility that B-L symmetry is an intimate feature of physics beyond the
standard model. I discuss how important information about this symmetry as well
as other scenarios for TeV scale new physics can be obtained from the baryon
number violating process, neutron-anti-neutron oscillation. This article
presents an overview of different aspects of neutron-anti-neutron oscillation
and is divided into the following parts : (i) the phenomenon; (ii) the physics,
(iii) plausible models and (iv) applications to cosmology. In particular, it is
argued how the discovery of $n-\bar{n}$ oscillation can significantly affect
our thinking about simple grand unified theory paradigms for physics beyond the
standard model, elucidate the nature of forces behind neutrino mass and provide
a new microphysical view of the origin of matter in the universe.
","[{""version"":""v1"",""created"":""Thu, 5 Feb 2009 01:47:33 GMT""}]","2015-05-13"
"0902.0835","Henri Moscovici","Henri Moscovici","Local index formula and twisted spectral triples","41 pages; minor changes; To appear in: CMI Proceedings of
  Noncommutative Geometry Conference in honor of Alain CONNES' 60th birthday",,,,"math.OA math.KT","http://arxiv.org/licenses/nonexclusive-distrib/1.0/","  We prove a local index formula for a class of twisted spectral triples of
type III modeled on the transverse geometry of conformal foliations with
locally constant transverse conformal factor. Compared with the earlier proof
of the untwisted case, the novel aspect resides in the fact that the twisted
analogues of the JLO entire cocycle and of its retraction are no longer
cocycles in their respective Connes bicomplexes. We show however that the
passage to the infinite temperature limit, respectively the integration along
the full temperature range against the Haar measure of the positive half-line,
has the remarkable effect of curing in both cases the deviations from the
cocycle identity.
","[{""version"":""v1"",""created"":""Thu, 5 Feb 2009 02:37:12 GMT""},{""version"":""v2"",""created"":""Mon, 14 Sep 2009 18:36:29 GMT""}]","2009-09-14"
"0902.0836","Rodrigo Pereira","Rodrigo G. Pereira, Steven R. White, Ian Affleck","Spectral function of spinless fermions on a one-dimensional lattice","30 pages, 18 figures","Phys. Rev. B 79, 165113 (2009)","10.1103/PhysRevB.79.165113",,"cond-mat.str-el","http://arxiv.org/licenses/nonexclusive-distrib/1.0/","  We study the spectral function of interacting one-dimensional fermions for an
integrable lattice model away from half-filling. The divergent power-law
singularity of the spectral function near the single-particle or single-hole
energy is described by an effective x-ray edge type model. At low densities and
for momentum near the zone boundary, we find a second divergent singularity at
higher energies which is associated with a two-particle bound state. We use the
Bethe ansatz solution of the model to calculate the exact singularity exponents
for any momentum and for arbitrary values of chemical potential and interaction
strength in the critical regime. We relate the singularities of the spectral
function to the long-time decay of the fermion Green's function and compare our
predictions with numerical results from the time-dependent density matrix
renormalization group (tDMRG). Our results show that the tDMRG method is able
to provide accurate time decay exponents in the cases of power-law decay of the
Green's function. Some implications for the line shape of the dynamical
structure factor away from half-filling are also discussed. In addition, the
spectral weight of the Luttinger liquid result for the dynamical structure
factor of the Heisenberg model at zero field is compared with the exact
two-spinon contribution.
","[{""version"":""v1"",""created"":""Thu, 5 Feb 2009 03:42:43 GMT""},{""version"":""v2"",""created"":""Thu, 12 Mar 2009 03:45:06 GMT""},{""version"":""v3"",""created"":""Fri, 24 Apr 2009 00:44:01 GMT""}]","2009-04-24"
"0902.0837","Dillon Mayhew","Dillon Mayhew, Gordon Royle, and Geoff Whittle","The internally 4-connected binary matroids with no M(K3,3)-minor","113 pages, 21 figures",,,,"math.CO","http://arxiv.org/licenses/nonexclusive-distrib/1.0/","  We give a characterization of the internally 4-connected binary matroids that
have no minor isomorphic to M(K3,3). Any such matroid is either cographic, or
is isomorphic to a particular single-element extension of the bond matroid of a
cubic or quartic Mobius ladder, or is isomorphic to one of eighteen sporadic
matroids.
","[{""version"":""v1"",""created"":""Thu, 5 Feb 2009 03:14:50 GMT""}]","2009-02-06"
"0902.0838","Syed Jafar","Syed A. Jafar","The Ergodic Capacity of Phase-Fading Interference Networks","19 pages","IEEE Transactions on Information Theory, Vol. 57, No. 12, Pages:
  7685-7694, December 2011","10.1109/TIT.2011.2169110",,"cs.IT math.IT","http://arxiv.org/licenses/nonexclusive-distrib/1.0/","  We identify the role of equal strength interference links as bottlenecks on
the ergodic sum capacity of a $K$ user phase-fading interference network, i.e.,
an interference network where the fading process is restricted primarily to
independent and uniform phase variations while the channel magnitudes are held
fixed across time. It is shown that even though there are $K(K-1)$ cross-links,
only about $K/2$ disjoint and equal strength interference links suffice to
determine the capacity of the network regardless of the strengths of the rest
of the cross channels. This scenario is called a \emph{minimal bottleneck
state}. It is shown that ergodic interference alignment is capacity optimal for
a network in a minimal bottleneck state. The results are applied to large
networks. It is shown that large networks are close to bottleneck states with a
high probability, so that ergodic interference alignment is close to optimal
for large networks. Limitations of the notion of bottleneck states are also
highlighted for channels where both the phase and the magnitudes vary with
time. It is shown through an example that for these channels, joint coding
across different bottleneck states makes it possible to circumvent the capacity
bottlenecks.
","[{""version"":""v1"",""created"":""Thu, 5 Feb 2009 03:17:44 GMT""},{""version"":""v2"",""created"":""Sat, 10 Mar 2012 13:02:29 GMT""}]","2016-11-17"
"0902.0839","Constantine Yannouleas","Ying Li, Constantine Yannouleas, Uzi Landman","Excitation spectra, spin structures, and entanglement characteristics of
  four-electron double-quantum-dot artificial molecules","Revtex 4. 15 pages with 13 figures. For related papers, see
  http://www.prism.gatech.edu/~ph274cy/",,,,"cond-mat.mes-hall cond-mat.str-el physics.atom-ph quant-ph","http://arxiv.org/licenses/nonexclusive-distrib/1.0/","  Energy spectra, spin configurations, and entanglement characteristics of a
system of four electrons in lateral double quantum dots are investigated using
exact diagonalization (EXD), as a function of interdot separation, applied
magnetic field, and strength of interelectron repulsion. A distinctly different
quantum behavior is found compared to that of circular single quantum dots. As
a function of the magnetic field, the energy spectra exhibit a low-energy band
consisting of a group of six states, with the number six being a consequence of
the conservation of the total spin of the four electrons and the ensuing spin
degeneracies. These six states appear to cross at a single value of the
magnetic field, with the crossing point becoming sharper for larger interdot
distances. As the strength of the Coulomb repulsion increases, the six states
tend to become degenerate and a well defined energy gap separates them from the
higher-in-energy excited states.
  The appearance of the low-energy band is a consequence of the formation of a
Wigner supermolecule, with the four electrons (two in each dot) being localized
at the vertices of a rectangular parallelogram. Using the spin-resolved
pair-correlation functions, one can map the EXD many-body wave functions onto
the spin functions associated with the four localized electrons. Analogies with
nanomagnets, such as finite Heisenberg clusters, are discussed. The ability to
determine associated spin functions enables investigations concerning
entanglement properties of the system of four electrons. In particular, the
formation of Wigner supermolecules generates EXD solutions belonging to the
class of strongly entangled states referred to as N-qubit Dicke states in the
quantum-information literature.
","[{""version"":""v1"",""created"":""Thu, 5 Feb 2009 03:23:05 GMT""}]","2009-02-12"
"0902.0840","Sergey Bastrukov","S. I. Bastrukov, H.-K. Chang, I. V. Molodtsova, E. H. Wu, G.-T. Chen,
  S.-H. Lan","Frequency spectrum of toroidal Alfv\'en mode in a neutron star with
  Ferraro's form of nonhomogeneous poloidal magnetic field","Accepted for publication in Astrophysics & Space Science",,"10.1007/s10509-009-0069-8",,"astro-ph.SR astro-ph.HE","http://arxiv.org/licenses/nonexclusive-distrib/1.0/","  Using the energy variational method of magneto-solid-mechanical theory of a
perfectly conducting elastic medium threaded by magnetic field, the frequency
spectrum of Lorentz-force-driven global torsional nodeless vibrations of a
neutron star with Ferraro's form of axisymmetric poloidal nonhomogeneous
internal and dipole-like external magnetic field is obtained and compared with
that for this toroidal Alfv\'en mode in a neutron star with homogeneous
internal and dipolar external magnetic field. The relevance of considered
asteroseismic models to quasi-periodic oscillations of the X-ray flux during
the ultra powerful outbursts of SGR 1806-20 and SGR 1900+14 is discussed.
","[{""version"":""v1"",""created"":""Thu, 5 Feb 2009 15:05:51 GMT""},{""version"":""v2"",""created"":""Fri, 6 Feb 2009 00:29:31 GMT""},{""version"":""v3"",""created"":""Tue, 24 Feb 2009 20:08:46 GMT""},{""version"":""v4"",""created"":""Wed, 25 Feb 2009 15:34:55 GMT""},{""version"":""v5"",""created"":""Thu, 11 Jun 2009 02:01:26 GMT""},{""version"":""v6"",""created"":""Fri, 12 Jun 2009 10:38:10 GMT""},{""version"":""v7"",""created"":""Wed, 15 Jul 2009 12:59:21 GMT""}]","2015-05-13"
"0902.0841","An-Ping Li","An-Ping Li","A note on the counterfeit coins problem","In the new version, there is Proposition 2 added, which is a result
  similar to Proposition 1 on the subject of sorting.",,,,"math.CO","http://arxiv.org/licenses/nonexclusive-distrib/1.0/","  In this paper, we will present an algorithm to resolve the counterfeit coins
problem in the case that the number of false coins is unknown in advance.
","[{""version"":""v1"",""created"":""Thu, 5 Feb 2009 06:40:10 GMT""},{""version"":""v10"",""created"":""Thu, 8 Oct 2009 07:25:20 GMT""},{""version"":""v11"",""created"":""Wed, 21 Oct 2009 01:43:33 GMT""},{""version"":""v12"",""created"":""Fri, 19 Mar 2010 00:45:35 GMT""},{""version"":""v13"",""created"":""Mon, 5 Apr 2010 00:50:53 GMT""},{""version"":""v2"",""created"":""Sun, 8 Feb 2009 10:46:00 GMT""},{""version"":""v3"",""created"":""Tue, 24 Feb 2009 03:24:25 GMT""},{""version"":""v4"",""created"":""Fri, 27 Feb 2009 00:56:54 GMT""},{""version"":""v5"",""created"":""Sun, 1 Mar 2009 17:07:02 GMT""},{""version"":""v6"",""created"":""Thu, 12 Mar 2009 02:06:40 GMT""},{""version"":""v7"",""created"":""Mon, 16 Mar 2009 02:51:08 GMT""},{""version"":""v8"",""created"":""Thu, 2 Apr 2009 11:20:12 GMT""},{""version"":""v9"",""created"":""Wed, 23 Sep 2009 07:10:09 GMT""}]","2010-04-06"
"0902.0842","Ehud Hrushovski","Ehud Hrushovski","On finite imaginaries","15pp",,,,"math.LO","http://arxiv.org/licenses/nonexclusive-distrib/1.0/","  We study finite imaginaries in certain valued fields, and prove a conjecture
of Cluckers and Denef.
","[{""version"":""v1"",""created"":""Thu, 5 Feb 2009 03:50:18 GMT""}]","2009-02-06"
"0902.0843","Daniel F. Agterberg","D. F. Agterberg, M. Sigrist, H. Tsunetsugu","Order parameter and vortices in the superconducting Q-phase of CeCoIn5","4 pages, 2 figures, 1 table",,"10.1103/PhysRevLett.102.207004",,"cond-mat.str-el cond-mat.supr-con","http://arxiv.org/licenses/nonexclusive-distrib/1.0/","  Recently, it has been reported that the low-temperature high-magnetic field
phase in CeCoIn5 (Q-phase), has spin-density wave (SDW) order that only exists
within this phase. This indicates that the SDW order is the result of the
development of pair density wave (PDW) order in the superconducting phase that
coexists with d-wave superconductivity. Here we develop a phenomenological
theory for these coexisting orders. This provides selection rules for the PDW
order and further shows that the detailed structure of this order is highly
constrained. We then apply our theory to the the vortex phase. This reveals
vortex phases in which the d-wave vortex cores exhibit charge density wave
(CDW) order and further reveals that the SDW order provides a unique probe of
the vortex phase.
","[{""version"":""v1"",""created"":""Thu, 5 Feb 2009 03:59:17 GMT""}]","2013-05-29"
"0902.0844","Zo\'e Chatzidakis","Zo\'e Chatzidakis, Ehud Hrushovski","An invariant for difference field extensions","After posting the previous version, we discovered the work of Willis
  on totally disconnected locally compact groups. Over a large area of overlap,
  our ""distant degree"" invariant of an automorphism agrees with Willis' {\em
  scale}. In the new version we describe the relations between the two
  frameworks. 14pp. July 2011: Small changes",,,,"math.LO","http://arxiv.org/licenses/nonexclusive-distrib/1.0/","  In this paper we introduce a new invariant (the distant degree) for
difference field extensions of finite transcendence degree, and we explore some
of its properties. We also discuss a generalisation of this invariant and of
the limit degree to groups with an automorphism.
","[{""version"":""v1"",""created"":""Thu, 5 Feb 2009 04:13:08 GMT""},{""version"":""v2"",""created"":""Thu, 12 Feb 2009 15:55:26 GMT""},{""version"":""v3"",""created"":""Thu, 24 Jun 2010 02:06:33 GMT""},{""version"":""v4"",""created"":""Mon, 1 Aug 2011 07:06:15 GMT""}]","2011-08-02"
"0902.0845","Ehud Hrushovski","Ehud Hrushovski, David Kazhdan","Motivic Poisson summation","46pp",,,,"math.LO math.AG","http://arxiv.org/licenses/nonexclusive-distrib/1.0/","  We develop a ""motivic integration"" version of the Poisson summation formula
for function fields, with values in the Grothendieck ring of definable
exponential sums. We also study division algebras over the function field, and
obtain relations among the motivic Fourier transforms of a test function at
different completions. We use these to prove, in a special case, a motivic
version of a theorem of Deligne-Kazhdan-Vigneras.
","[{""version"":""v1"",""created"":""Thu, 5 Feb 2009 04:17:11 GMT""}]","2009-02-06"
"0902.0846","Ross Church","Ross P. Church, Christopher A. Tout, and Jarrod R. Hurley","N-body Simulations with Live Stellar Evolution","13 pages, 8 figures. Accepted by PASA",,"10.1071/AS08062",,"astro-ph.SR","http://arxiv.org/licenses/nonexclusive-distrib/1.0/","  An N-body code containing live stellar evolution through combination of the
software packages NBODY6 and STARS is presented. Operational details of the two
codes are outlined and the changes that have been made to combine them
discussed. We have computed the evolution of clusters of 10 000 stars using the
combined code and we compare the results with those obtained using NBODY6 and
the synthetic stellar evolution code SSE. We find that, providing the physics
package within STARS is set up correctly to match the parameters of the models
used to construct SSE, the results are very similar. This provides a good
indication that the new code is working well. We also demonstrate how this
physics can be changed simply in the new code with convective overshooting as
an example. Similar changes in SSE would require considerable reworking of the
model fits. We conclude by outlining proposed future development of the code to
include more complete models of single stars and binary star systems.
","[{""version"":""v1"",""created"":""Thu, 5 Feb 2009 04:21:04 GMT""}]","2009-11-13"
"0902.0847","Dean Gull","C. G. Bailey (1), D. W. Gull (2), J. S. Oliveira (2) ((1) Victoria
  University Wellington, Wellington, NZ, (2) Pacific Northwest National
  Laboratory, WA, USA)","Hypergraphic Oriented Matroid Relational Dependency Flow Models of
  Chemical Reaction Networks","16 pages, 4 figures",,,,"math.CO q-bio.QM","http://arxiv.org/licenses/nonexclusive-distrib/1.0/","  In this paper we derive and present an application of hypergraphic oriented
matroids for the purpose of enumerating the variable interdependencies that
define the chemical complexes associated with the kinetics of non-linear
dynamical system representations of chemical kinetic reaction flow networks.
The derivation of a hypergraphic oriented matroid is obtained by defining a
closure operator on families of n-subsets of signed multi-sets from which a
""Z-module"" is obtained. It has been observed that every instantiation of the
closure operator on the signed multiset families define a matroid structure. It
is then demonstrated that these structures generate a pair of dual matroids
corresponding respectively to hyperspanning trees and hypercycles obtained from
the corresponding directed hypergraphs. These structures are next
systematically evaluated to obtain solution sets that satisfy systems of
non-linear chemical kinetic reaction flow networks in the MAP Kinase cascade
cell-signaling pathway.
","[{""version"":""v1"",""created"":""Thu, 5 Feb 2009 05:12:11 GMT""}]","2009-02-06"
"0902.0848","Nasser Metwally NM","F. N. M. Al-Showaikh, N. Metwally and M. Abdel-Aty","Entangled states generation of two atoms interacting with a cavity field",,"NeuroQuantology Vol 7 No 5 Page 382-389 (2009)",,,"quant-ph","http://arxiv.org/licenses/nonexclusive-distrib/1.0/","  We classify different classes of entangled states arise in a two-qubit
system. Some of these classes are of Bell's state types, while others are of
the Werner's state types. The degree of entanglement is quantified for
different values of the atomic and the cavity parameters. We show that it is
possible to generate entangled state with high degree of entanglement by
controlling the detuning and the number of photon inside the cavity.
","[{""version"":""v1"",""created"":""Thu, 5 Feb 2009 05:27:20 GMT""}]","2011-05-05"
"0902.0849","Adrian Wadsworth","J.-P. Tignol and A. R. Wadsworth","Valuations on Algebras with Involution","27 pages",,,,"math.RA","http://arxiv.org/licenses/nonexclusive-distrib/1.0/","  Let A be a central simple algebra with involution sigma of first or second
kind. Let v be a valuation on the sigma-fixed part F of Z(A). A sigma-special
v-gauge g on A is a kind of value function on A extending v on F, such that
g(sigma(x) x) = 2g(x) for all x in A. It is shown (under certain restrictions
if the residue characteristic is 2) that if v is Henselian, then there is a
sigma-special v-gauge g if and only if sigma is anisotropic, and g is unique.
If v is not Henselian, it is shown that there is a sigma-special v-gauge g if
and only if sigma remains anisotropic after scalar extension from F to the
Henselization of F re v; when this occurs, g is the unique sigma-invariant
v-gauge on A.
","[{""version"":""v1"",""created"":""Thu, 5 Feb 2009 05:50:41 GMT""}]","2009-02-06"
