"0902.2997","Samuli Kotiranta","M. Tuomi, S. Kotiranta","Bayesian analysis of the radial velocities of HD 11506 reveals another
  planetary companion","4 pages, 5 figures, to appear in A&A",,"10.1051/0004-6361/200811531",,"astro-ph.EP","http://arxiv.org/licenses/nonexclusive-distrib/1.0/","  We aim to demonstrate the efficiency of a Bayesian approach in analysing
radial velocity data by reanalysing a set of radial velocity measurements. We
present Bayesian analysis of a recently published set of radial velocity
measurements known to contain the signal of one extrasolar planetary candidate,
namely, HD 11506. The analysis is conducted using the Markov chain Monte Carlo
method and the resulting distributions of orbital parameters are tested by
performing direct integration of randomly selected samples with the
Bulirsch-Stoer method. The magnitude of the stellar radial velocity
variability, known as jitter, is treated as a free parameter with no
assumptions about its magnitude. We show that the orbital parameters of the
planet known to be present in the data correspond to a different solution when
the jitter is allowed to be a free parameter. We also show evidence of an
additional candidate, a 0.8 MJup planet with period of about 0.5 yr in orbit
around HD 11506. This second planet is inferred to be present with a high level
of confidence.
","[{""version"":""v1"",""created"":""Wed, 18 Feb 2009 21:07:50 GMT""}]","2009-11-13"
"0902.3009","Matthew Loth","M. S. Loth and B. I. Shklovskii","Non-mean-field screening by multivalent counterions","9 pages, 6 figures; v5: new section added to address bulk screening
  by monovalent salt","M S Loth and B I Shklovskii 2009 J. Phys.: Condens. Matter 21
  424104","10.1088/0953-8984/21/42/424104",,"cond-mat.soft","http://arxiv.org/licenses/nonexclusive-distrib/1.0/","  Screening of a strongly charged macroion by its multivalent counterions can
not be described in the framework of mean field Poisson-Boltzmann (PB) theory
because multivalent counterions form a strongly correlated liquid (SCL) on the
surface of the macroion. It was predicted that a distant counterion polarizes
the SCL as if it were a metallic surface and creates an electrostatic image.
The attractive potential energy of the image is the reason why the charge
density of counterions decreases faster with distance from the charged surface
than in PB theory. Using the Monte Carlo method to find the equilibrium
distribution of counterions around the macroion, we confirm the existence of
the image potential energy. It is also shown that due to the negative screening
length of the SCL, $-2\xi$, the effective metallic surface is actually above
the SCL by $|\xi|$.
","[{""version"":""v1"",""created"":""Wed, 18 Feb 2009 17:38:31 GMT""},{""version"":""v2"",""created"":""Tue, 24 Feb 2009 16:40:27 GMT""},{""version"":""v3"",""created"":""Wed, 4 Mar 2009 21:22:07 GMT""},{""version"":""v4"",""created"":""Fri, 6 Mar 2009 15:43:29 GMT""},{""version"":""v5"",""created"":""Sat, 21 Mar 2009 17:33:33 GMT""}]","2010-04-27"
"0902.3046","Yuri V. Kovchegov","Javier L. Albacete, Yuri V. Kovchegov, Anastasios Taliotis","Asymmetric Collision of Two Shock Waves in AdS_5","44 pages, 8 figures; v2: typos corrected, references added; v3: a
  subsection added, more typos corrected","JHEP 0905:060,2009","10.1088/1126-6708/2009/05/060",,"hep-th gr-qc hep-ph","http://arxiv.org/licenses/nonexclusive-distrib/1.0/","  We consider high energy collisions of two shock waves in AdS_5 as a model of
ultrarelativistic nucleus-nucleus collisions in the boundary theory. We first
calculate the graviton field produced in the collisions in the NLO and NNLO
approximations, corresponding to three- and four-graviton exchanges with the
shock waves. We then consider the asymmetric limit where the energy density in
one shock wave is much higher than in the other one. In the boundary theory
this setup corresponds to proton-nucleus collisions, with the nucleus being the
denser of the two shock waves and the proton being the less dense one.
Employing the eikonal approximation we find the exact high energy analytic
solution for the metric in AdS_5 for the asymmetric collision of two
delta-function shock waves. The solution resums all-order graviton exchanges
with the ""nucleus"" shock wave and a single-graviton exchange with the ""proton""
shock wave. Using the holographic renormalization prescription we read off the
energy-momentum tensor of the matter produced in proton-nucleus collisions. We
show in explicit detail that in the boundary theory the proton is completely
stopped by strong-coupling interactions with the nucleus, in agreement with our
earlier results. We also apply the eikonal technique to the asymmetric
collision of two unphysical delta-prime shock waves, which we introduced in an
earlier work as a means of modeling nuclear collisions with weak coupling
initial dynamics. We obtain a surprising result that, for delta-prime shock
waves, the multiple bulk graviton exchange series giving the leading
energy-dependent contribution to the energy-momentum tensor terminates at the
order of two graviton exchanges with the nucleus.
","[{""version"":""v1"",""created"":""Wed, 18 Feb 2009 20:57:59 GMT""},{""version"":""v2"",""created"":""Thu, 26 Feb 2009 14:49:24 GMT""},{""version"":""v3"",""created"":""Wed, 13 May 2009 14:11:27 GMT""}]","2009-11-19"
"0902.3059","Iosif Khriplovich","A.G. Grozin, I.B. Khriplovich, and A.S. Rudenko","Upper limits on electric dipole moments of tau-lepton, heavy quarks, and
  W-boson","8 pages, 7 figures; misprint corrected, results do not change","Nucl.Phys.B821:285-290,2009","10.1016/j.nuclphysb.2009.06.026",,"hep-ph","http://arxiv.org/licenses/nonexclusive-distrib/1.0/","  We discuss upper limits on the electric dipole moments (EDM) of the
tau-lepton, heavy quarks, and W-boson, which follow from the precision
measurements of the electron and neutron EDM.
","[{""version"":""v1"",""created"":""Wed, 18 Feb 2009 19:16:41 GMT""},{""version"":""v2"",""created"":""Wed, 4 Mar 2009 13:45:53 GMT""}]","2009-08-11"
"0902.3061","Nadir Matringe","Nadir Matringe","Distinction and Asai $L$-functions for generic representations of
  general linear groups over p-adic fields",,,,,"math.RT","http://arxiv.org/licenses/nonexclusive-distrib/1.0/","  Let $K/F$ be a quadratic extension of $p$-adic fields, and $n$ a positive
integer. A smooth irreducible representation of the group $GL(n,K)$ is said to
be distinguished, if it admits on its space a nonzero $GL(n,F)$-invariant
linear form. In the present work, we classify genric distinguished
representations of the group $GL(n,K)$ in terms of inducing
quasi-square-integrable representations. This has as a consequence the truth of
the expected equality between the Rankin-Selberg type Asai $L$-function of a
generic representation, and the Asai $L$-function of its Langlands parameter.
","[{""version"":""v1"",""created"":""Wed, 18 Feb 2009 19:57:05 GMT""},{""version"":""v2"",""created"":""Thu, 19 Feb 2009 16:28:42 GMT""},{""version"":""v3"",""created"":""Sat, 21 Feb 2009 07:13:14 GMT""},{""version"":""v4"",""created"":""Tue, 8 Dec 2009 19:50:18 GMT""}]","2009-12-08"
"0902.3089","Oleksandr Gromenko","Oleksandr Gromenko, Vladimir Privman","Random Sequential Adsorption of Oriented Superdisks",,"Phys. Rev. E 79, article 042103, 4 pages (2009)","10.1103/PhysRevE.79.042103",,"cond-mat.stat-mech","http://arxiv.org/licenses/nonexclusive-distrib/1.0/","  In this work we extend recent study of the properties of the dense packing of
""superdisks,"" by Y. Jiao, F. H. Stillinger and S. Torquato, Phys. Rev. Lett.
100, 245504 (2008), to the jammed state formed by these objects in random
sequential adsorption. The superdisks are two-dimensional shapes bound by the
curves of the form |x|^(2p) + |y|^(2p) = 1, with p > 0. We use Monte Carlo
simulations and theoretical arguments to establish that p = 1/2 is a special
point at which the jamming density has a discontinuous derivative as a function
of p. The existence of this point can be also argued for by geometrical
arguments.
","[{""version"":""v1"",""created"":""Wed, 18 Feb 2009 20:59:43 GMT""}]","2010-10-12"
"0902.3131","Nobuo Hinohara","Nobuo Hinohara, Takashi Nakatsukasa, Masayuki Matsuo, Kenichi
  Matsuyanagi","Microscopic description of oblate-prolate shape mixing in proton-rich Se
  isotopes","13 pages, 11 figures, Submitted to Phys. Rev. C; discussion expanded,
  figures enlarged","Phys.Rev.C80:014305,2009","10.1103/PhysRevC.80.014305","YITP-09-15, RIKEN-NC-NP-33","nucl-th","http://arxiv.org/licenses/nonexclusive-distrib/1.0/","  The oblate-prolate shape coexisting/mixing phenomena in proton-rich
68,70,72Se are investigated by means of the adiabatic self-consistent
collective coordinate (ASCC) method. The one-dimensional collective path and
the collective Hamiltonian describing the large-amplitude shape vibration are
derived in a fully microscopic way. The excitation spectra, B(E2) and
spectroscopic quadrupole moments are calculated by requantizing the collective
Hamiltonian and solving the collective Schroedinger equation. The basic
properties of the coexisting two rotational bands in low-lying states of these
nuclei are well reproduced. It is found that the oblate-prolate shape mixing
becomes weak as the rotational angular momentum increases. We point out that
the rotational energy plays a crucial role in causing the localization of the
collective wave function in the (beta,gamma) deformation space.
","[{""version"":""v1"",""created"":""Wed, 18 Feb 2009 16:56:42 GMT""},{""version"":""v2"",""created"":""Thu, 7 May 2009 03:18:50 GMT""}]","2009-07-13"
"0902.3168","S. T. Megeath","S. T. Megeath (1), E. Allgaier (1), E. Young (2), T. Allen (1,3), J.
  L. Pipher (3), T. L. Wilson (4) ((1) Ritter Observatory, MS-113, University
  of Toledo, (2) Steward Observatory, University of Arizona, (3) Department of
  Physics and Astronomy, University of Rochester, (4) European Southern
  Observatory)","Detection of Star Formation in the Unusually Cold Giant Molecular Cloud
  G216","Accepted to AJ. Full electronic version at:
  http://astro1.physics.utoledo.edu/~megeath/mt_stm.pdf tables on
  http://astro1.physics.utoledo.edu/~megeath/mt_stm_table.pdf",,"10.1088/0004-6256/137/4/4072",,"astro-ph.GA","http://arxiv.org/licenses/nonexclusive-distrib/1.0/","  The giant molecular cloud G216-2.5, also known as Maddalena's cloud or the
Maddalena-Thaddeus cloud, is distinguished by an unusual combination of high
gas mass (1-6 x 10^5) solar masses, low kinetic temperatures (10 K), and the
lack of bright far infrared emission. Although star formation has been detected
in neighboring satellite clouds, little evidence for star formation has been
found in the main body of this cloud. Using a combination of mid-infrared
observations with the IRAC and MIPS instruments onboard the Spitzer space
telescope, and near-IR images taken with the Flamingos camera on the KPNO
2.1-meter, we identify a population of 41 young stars with disks and 33
protostars in the center of the cloud. Most of the young stellar objects are
coincident with a filamentary structure of dense gas detected in CS (2-1).
These observations show that the main body of G216 is actively forming stars,
although at a low stellar density comparable to that found in the Taurus cloud.
","[{""version"":""v1"",""created"":""Wed, 18 Feb 2009 18:01:35 GMT""}]","2009-11-13"
"0902.3176","John Langford","Alina Beygelzimer, John Langford, and Pradeep Ravikumar","Error-Correcting Tournaments","Minor wording improvements",,,,"cs.AI cs.LG","http://arxiv.org/licenses/nonexclusive-distrib/1.0/","  We present a family of pairwise tournaments reducing $k$-class classification
to binary classification. These reductions are provably robust against a
constant fraction of binary errors. The results improve on the PECOC
construction \cite{SECOC} with an exponential improvement in computation, from
$O(k)$ to $O(\log_2 k)$, and the removal of a square root in the regret
dependence, matching the best possible computation and regret up to a constant.
","[{""version"":""v1"",""created"":""Wed, 18 Feb 2009 16:01:24 GMT""},{""version"":""v2"",""created"":""Sun, 12 Apr 2009 01:14:27 GMT""},{""version"":""v3"",""created"":""Mon, 16 Nov 2009 22:06:32 GMT""},{""version"":""v4"",""created"":""Wed, 3 Feb 2010 15:03:58 GMT""}]","2010-02-03"
"0902.3177","Christoph Keller","Ilka Brunner, Matthias R. Gaberdiel, Stefan Hohenegger, Christoph A.
  Keller","Obstructions and lines of marginal stability from the world-sheet","32 pages","JHEP 0905:007,2009","10.1088/1126-6708/2009/05/007",,"hep-th","http://arxiv.org/licenses/nonexclusive-distrib/1.0/","  The behaviour of supersymmetric D-branes under deformations of the closed
string background is studied using world-sheet methods. We explain how lines of
marginal stability and obstructions arise from this point of view. We also show
why N=2 B-type branes may be obstructed against (cc) perturbations, but why
such obstructions do not occur for N=4 superconformal branes at c=6, i.e. for
half-supersymmetric D-branes on K3. Our analysis is based on a field theory
approach in superspace, as well as on techniques from perturbed conformal field
theory.
","[{""version"":""v1"",""created"":""Wed, 18 Feb 2009 16:04:01 GMT""}]","2010-01-15"
"0902.3178","Deniz Gunduz","Deniz Gunduz, Osvaldo Simeone, Andrea J. Goldsmith, H. Vincent Poor
  and Shlomo Shamai (Shitz)","Multiple Multicasts with the Help of a Relay","Submitted to Transactions on Information Theory",,,,"cs.IT math.IT","http://arxiv.org/licenses/nonexclusive-distrib/1.0/","  The problem of simultaneous multicasting of multiple messages with the help
of a relay terminal is considered. In particular, a model is studied in which a
relay station simultaneously assists two transmitters in multicasting their
independent messages to two receivers. The relay may also have an independent
message of its own to multicast. As a first step to address this general model,
referred to as the compound multiple access channel with a relay (cMACr), the
capacity region of the multiple access channel with a ""cognitive"" relay is
characterized, including the cases of partial and rate-limited cognition. Then,
achievable rate regions for the cMACr model are presented based on
decode-and-forward (DF) and compress-and-forward (CF) relaying strategies.
Moreover, an outer bound is derived for the special case, called the cMACr
without cross-reception, in which each transmitter has a direct link to one of
the receivers while the connection to the other receiver is enabled only
through the relay terminal. The capacity region is characterized for a binary
modulo additive cMACr without cross-reception, showing the optimality of binary
linear block codes, thus highlighting the benefits of physical layer network
coding and structured codes. Results are extended to the Gaussian channel model
as well, providing achievable rate regions for DF and CF, as well as for a
structured code design based on lattice codes. It is shown that the performance
with lattice codes approaches the upper bound for increasing power, surpassing
the rates achieved by the considered random coding-based techniques.
","[{""version"":""v1"",""created"":""Wed, 18 Feb 2009 16:04:03 GMT""}]","2009-02-19"
"0902.3179","Chrysostomos Kalousios","Chrysostomos Kalousios, Marcus Spradlin, Anastasia Volovich","Dressed Giant Magnons on CP^3","13 pages, harvmac; v3: fixed misstatement of the dispersion
  relation(!), v3: typos fixed and a few clarifying remarks added","JHEP 0907:006,2009","10.1088/1126-6708/2009/07/006",,"hep-th","http://arxiv.org/licenses/nonexclusive-distrib/1.0/","  A new example of AdS/CFT duality relating IIA string theory on AdS_4 x CP^3
to N=6 superconformal Chern-Simons theory has recently been provided by ABJM.
By now a number of papers have considered particular giant magnon classical
string solutions in the CP^3 background, corresponding to excitations in the
spin chain picture of the dual field theory. In this paper we apply the CP^3 =
SU(4)/S(U(3) x U(1)) dressing method to the problem of constructing general
classical string solutions describing various configurations of giant magnons.
As a particular application we present a new giant magnon solution on CP^3.
Interestingly the dressed solution carries only a single SO(6) charge, in
contrast with the dyonic magnons found in previous applications of the dressing
method.
","[{""version"":""v1"",""created"":""Wed, 18 Feb 2009 16:48:14 GMT""},{""version"":""v2"",""created"":""Tue, 24 Feb 2009 20:02:41 GMT""},{""version"":""v3"",""created"":""Mon, 15 Jun 2009 02:27:56 GMT""}]","2009-07-22"
"0902.3180","Robert Singleton Jr. Dr.","Lowell S. Brown and Robert L. Singleton Jr","Temperature equilibration in a fully ionized plasma: electron-ion mass
  ratio effects","14 pages, 4 figures, small change in title","Phys. Rev. E 79 (2009) 066407","10.1103/PhysRevE.79.066407","LA-UR-08-2826","physics.plasm-ph","http://arxiv.org/licenses/nonexclusive-distrib/1.0/","  Brown, Preston, and Singleton (BPS) produced an analytic calculation for
energy exchange processes for a weakly to moderately coupled plasma: the
electron-ion temperature equilibration rate and the charged particle stopping
power. These precise calculations are accurate to leading and next-to-leading
order in the plasma coupling parameter, and to all orders for two-body quantum
scattering within the plasma. Classical molecular dynamics can provide another
approach that can be rigorously implemented. It is therefore useful to compare
the predictions from these two methods, particularly since the former is
theoretically based and the latter numerically. An agreement would provide both
confidence in our theoretical machinery and in the reliability of the computer
simulations. The comparisons can be made cleanly in the purely classical
regime, thereby avoiding the arbitrariness associated with constructing
effective potentials to mock up quantum effects. We present here the classical
limit of the general result for the temperature equilibration rate presented in
BPS. We examine the validity of the m_electron/m_ion --> 0 limit used in BPS to
obtain a very simple analytic evaluation of the long-distance, collective
effects in the background plasma.
","[{""version"":""v1"",""created"":""Wed, 18 Feb 2009 16:08:08 GMT""},{""version"":""v2"",""created"":""Thu, 25 Jun 2009 21:18:26 GMT""}]","2009-06-26"
"0902.3181","R Mittal","R. Mittal, L. Pintschovius, D. Lamago, R. Heid, K. P. Bohnen, D.
  Reznik, S. L. Chaplot, Y. Su, N. Kumar, S. K. Dhar, A. Thamizhavel, and Th.
  Brueckel","Anomalous Phonons in CaFe2As2","12 pages, 3 figues Revised version, Final version, Accepted for
  publication in Physical Review Letters","Physical Review Letters 102, 217001 (2009)",,,"cond-mat.supr-con cond-mat.mtrl-sci","http://arxiv.org/licenses/nonexclusive-distrib/1.0/","  Extensive inelastic neutron scattering measurements of phonons on a single
crystal of CaFe2As2 allowed us to establish a fairly complete picture of phonon
dispersions in the main symmetry directions. The phonon spectra were also
calculated by density functional theory (DFT) in the local density
approximation (LDA). There are serious discrepancies between calculations done
for the optimized structure and experiment, because the optimised structure is
not the ambient pressure structure but is very close to the collapsed structure
reached at p = 3.5 kbar. However, if the experimental crystal structure is used
the calculation gives correct frequencies of most phonons. The most important
new result is that linewidths/frequencies of certain modes are larger/softer
than predicted by DFT-LDA. We also observed strong temperature dependence of
some phonons near the structural phase transition near 173K. This behavior may
indicate anomalously strong electron phonon coupling and/or anharmonicity,
which may be important to the mechanism of superconductivity.
","[{""version"":""v1"",""created"":""Wed, 18 Feb 2009 16:08:24 GMT""},{""version"":""v2"",""created"":""Fri, 27 Feb 2009 13:11:52 GMT""},{""version"":""v3"",""created"":""Fri, 8 May 2009 11:10:44 GMT""}]","2009-05-27"
"0902.3182","Vitaly Volpert","Vitali Vougalter, Vitaly Volpert (ICJ)","Solvability Conditions for Some non Fredholm Operators",,,,,"math.AP","http://arxiv.org/licenses/nonexclusive-distrib/1.0/","  We obtain solvability conditions for some elliptic equations involving non
Fredholm operators with the methods of spectral theory and scattering theory
for Schrodinger type operators. Though the Fredholm property is not satisfied,
the solvability conditions are formulated in terms of orthogonality of the
right-hand side to solutions of the homogeneous adjoint equation.
","[{""version"":""v1"",""created"":""Wed, 18 Feb 2009 16:20:13 GMT""}]","2009-02-19"
"0902.3183","Matthias H. Hettler","Benjamin B. Schmidt, Matthias H. Hettler, and Gerd Sch\""on","Charge correlations in polaron hopping through molecules","13 pages, 10 figures, submitted to Phys. Rev. B",,"10.1103/PhysRevB.82.155113",,"cond-mat.mes-hall cond-mat.dis-nn","http://arxiv.org/licenses/nonexclusive-distrib/1.0/","  In many organic molecules the strong coupling of excess charges to
vibrational modes leads to the formation of polarons, i.e., a localized state
of a charge carrier and a molecular deformation. Incoherent hopping of polarons
along the molecule is the dominant mechanism of transport at room temperature.
We study the far-from-equilibrium situation where, due to the applied bias, the
induced number of charge carriers on the molecule is high enough such that
charge correlations become relevant. We develop a diagrammatic theory that
exactly accounts for all many-particle correlations functions for incoherent
transport through a finite system. We compute the transport properties of short
sequences of DNA by expanding the diagrammatic theory up to second order in the
hopping parameters. The correlations qualitatively modify the I-V
characteristics as compared to those approaches where correlations are dealt
with in a mean-field type approximation only.
","[{""version"":""v1"",""created"":""Wed, 18 Feb 2009 16:21:22 GMT""}]","2015-05-13"
"0902.3184","D\'ecio Krause","Decio Krause and Hercules de Araujo Feitosa","Algebraic aspects of quantum indiscernibility","Forthcoming in ""Many sides of logic"", 2009",,,,"quant-ph","http://arxiv.org/licenses/nonexclusive-distrib/1.0/","  Quasi-set theory was proposed as a mathematical context to investigate
collections of indistinguishable objects. After presenting an outline of this
theory, we define an algebra that has most of the standard properties of an
orthocomplete orthomodular lattice, which is the lattice of the closed
subspaces of a Hilbert space. We call the mathematical structure so obtained
$\mathfrak{I}$-lattice. After discussing, in a preliminary form, some aspects
of such a structure, we indicate the next problem of axiomatizing the
corresponding logic, that is, a logic which has $\mathfrak{I}$-lattices as its
algebraic models. We suggest that the intuitions that the `logic of quantum
mechanics' would be not classical logic (with its Boolean algebra), is
consonant with the idea of considering indistinguishability right from the
start, that is, as a primitive concept. In other words, indiscernibility seems
to lead `directly' to $\mathfrak{I}$-lattices. In the first sections, we
present the main motivations and a `classical' situation which mirrors that one
we focus on the last part of the paper. This paper is our first study of the
algebraic structure of indiscernibility within quasi-set theory.
","[{""version"":""v1"",""created"":""Wed, 18 Feb 2009 20:44:52 GMT""}]","2009-02-19"
"0902.3185","Gonzalo Alvarez","G. Alvarez","The Density Matrix Renormalization Group for Strongly Correlated
  Electron Systems: A Generic Implementation","2 figures, submitted to Computer Physics Communications","Computer Physics Communications 180 (2009) 1572-1578","10.1016/j.cpc.2009.02.016",,"cond-mat.str-el","http://arxiv.org/licenses/nonexclusive-distrib/1.0/","  The purpose of this paper is (i) to present a generic and fully functional
implementation of the density-matrix renormalization group (DMRG) algorithm,
and (ii) to describe how to write additional strongly-correlated electron
models and geometries by using templated classes. Besides considering general
models and geometries, the code implements Hamiltonian symmetries in a generic
way and parallelization over symmetry-related matrix blocks.
","[{""version"":""v1"",""created"":""Wed, 18 Feb 2009 16:28:41 GMT""}]","2015-05-13"
