"0902.3328","Ki Young Kim","Young Ki Cho, Jong-Ig Lee, and Ki Young Kim","On Electrical Equivalence of Aperture-Body and Transmission-Cavity
  Resonance Phenomena in Subwavelength Conducting Aperture Systems from an
  Equivalent Circuit Point of View","14 pages, 3 figures","Journal of Computational and Theoretical Nanoscience, vol. 6, no.
  11, pp. 2402-2406, November 2009","10.1166/jctn.2009.1297",,"physics.optics","http://arxiv.org/licenses/nonexclusive-distrib/1.0/","  For a narrow slit structure backed by a conducting strip which is taken as a
representative example of an aperture-body resonance (ABR) problem, the
transmission resonance condition (i.e., condition for maximum power
transmission) and the transmission width (i.e., normalized maximum transmitted
power through the slit) are found to be the same as those for narrow slit
coupling problem in a thick conducting screen, which is designated as a
transmission-cavity resonance (TCR) problem. From a viewpoint of equivalent
circuit representation for the transmission resonance condition and the
funneling mechanism, the ABR and the TCR problems are thought to be essentially
of the same nature.
","[{""version"":""v1"",""created"":""Thu, 19 Feb 2009 09:20:03 GMT""},{""version"":""v2"",""created"":""Wed, 30 Dec 2009 03:10:59 GMT""}]","2009-12-30"
"0902.3329","Zengru Di","Yanqing Hu, Ying Fan, Zengru Di","Orientation in Social Networks","10 pages, 4 figures",,,,"physics.soc-ph","http://arxiv.org/licenses/nonexclusive-distrib/1.0/","  Stanley Milgram's small world experiment presents ""six degrees of separation""
of our world. One phenomenon of the experiment still puzzling us is that how
individuals operating with the social network information with their
characteristics can be very adept at finding the short chains. The previous
works on this issue focus whether on the methods of navigation in a given
network structure, or on the effects of additional information to the searching
process. In this paper, we emphasize that the growth and shape of network
architecture is tightly related to the individuals' attributes. We introduce a
method to reconstruct nodes' intimacy degree based on local interaction. Then
we provide an intimacy based approach for orientation in networks. We find that
the basic reason of efficient search in social networks is that the degree of
""intimacy"" of each pair of nodes decays with the length of their shortest path
exponentially. Meanwhile, the model can explain the hubs limitation which was
observed in real-world experiment.
","[{""version"":""v1"",""created"":""Thu, 19 Feb 2009 09:21:01 GMT""}]","2009-02-20"
"0902.3330","Fei Liu","Fei Liu, Zhong-can Ou-Yang","A generalized integral fluctuation theorem for diffusion processes","Content was changed. We presented a generalized integral fluctuation
  theorem, and also discussed its origin",,"10.1103/PhysRevE.79.060107",,"cond-mat.stat-mech","http://arxiv.org/licenses/nonexclusive-distrib/1.0/","  We present a generalized integral fluctuation theorem (GIFT) for general
diffusion processes using the Feynman-Kac and Cameron-Martin-Girsanov formulas.
Existing IFTs can be thought of to be its specific cases. We interpret the
origin of this theorem in terms of time-reversal of stochastic systems.
","[{""version"":""v1"",""created"":""Thu, 19 Feb 2009 09:22:44 GMT""},{""version"":""v2"",""created"":""Mon, 13 Apr 2009 02:48:43 GMT""}]","2015-05-13"
"0902.3331","Zengru Di","Yanqing Hu, Yuchao Nie, Hua Yang, Jie Cheng, Ying Fan, Zengru Di","Measuring Significance of Community Structure in Complex Networks","6 pages, 4 figures, 1 table",,"10.1103/PhysRevE.82.066106",,"physics.soc-ph","http://arxiv.org/licenses/nonexclusive-distrib/1.0/","  Many complex systems can be represented as networks and separating a network
into communities could simplify the functional analysis considerably. Recently,
many approaches have been proposed for finding communities, but none of them
can evaluate the communities found are significant or trivial definitely. In
this paper, we propose an index to evaluate the significance of communities in
networks. The index is based on comparing the similarity between the original
community structure in network and the community structure of the network after
perturbed, and is defined by integrating all the similarities. Many artificial
networks and real-world networks are tested. The results show that the index is
independent from the size of network and the number of communities. Moreover,
we find the clear communities always exist in social networks, but don't find
significative communities in proteins interaction networks and metabolic
networks.
","[{""version"":""v1"",""created"":""Thu, 19 Feb 2009 09:28:58 GMT""}]","2015-05-13"
"0902.3332","Ramana Athreya","Ramana Athreya","A new approach to mitigation of radio frequency interference in
  interferometric data","Accepted for Publication in the Astrophysical Journal","Astrophys.J.696:885-890,2009","10.1088/0004-637X/696/1/885",,"astro-ph.IM","http://arxiv.org/licenses/nonexclusive-distrib/1.0/","  Radio frequency interference (RFI) is the principal factor limiting the
sensitivities of radio telescopes, particularly at frequencies below 1 GHz. I
present a conceptually new approach to mitigation of RFI in interferometric
data. This has been used to develop a software tool (RfiX) to remove RFI from
observations using the Giant Metrewave Radio Telescope, India. However, the
concept can be used to excise RFI in any interferometer. Briefly, the
fringe-stopped correlator output of an interferometer baseline oscillates with
the fringe-stop period in the presence of RFI. RfiX works by identifying such a
pattern and subtracting it from the data. It is perhaps the only purely
software technique which can salvage the true visibility value from
RFI-corrupted data. It neither requires high-speed hardware nor real-time
processing and works best on normal correlator output integrated for 1-10s. It
complements other mitigation schemes with its different approach and the regime
it addresses. Its ability to work with data integrated over many seconds gives
it an advantage while excising weak, persistent RFI unlike most other
techniques which use high-speed sampling to localise RFI in time-frequency
plane. RfiX is also different in that it does not require RFI-free data to
identify corrupted sections. Some results from the application of RfiX is
presented including an image at 240 MHz with a Peak/noise ratio of 43000, the
highest till date at wavelengths >1m.
","[{""version"":""v1"",""created"":""Thu, 19 Feb 2009 09:34:02 GMT""}]","2011-02-11"
"0902.3333","John Schliemann","John Schliemann","Spins coupled to a Spin Bath: From Integrability to Chaos","6 pages, 5 figures included, version to appear in Phys. Rev B (Rapid
  Comm.)","Phys. Rev. B 81, 081301(R) (2010)","10.1103/PhysRevB.81.081301",,"cond-mat.mes-hall cond-mat.stat-mech quant-ph","http://arxiv.org/licenses/nonexclusive-distrib/1.0/","  Motivated by the hyperfine interaction of electron spins with surrounding
nuclei, we investigate systems of central spins coupled to a bath of
noninteracting spins in the framework of random matrix theory. With increasing
number of central spins a transition from Poissonian statistics to the Gaussian
orthogonal ensemble occurs which can be described by a generalized Brody
distribution. These observations are unaltered upon applying an external
magnetic field. In the transition region, the classical counterparts of the
models studied have mixed phase space.
","[{""version"":""v1"",""created"":""Thu, 19 Feb 2009 09:43:30 GMT""},{""version"":""v2"",""created"":""Thu, 14 Jan 2010 13:46:31 GMT""}]","2010-02-02"
"0902.3334","Claudio Landim","M. Jara, C. Landim, A. Teixeira","Quenched scaling limits of trap models",,,,,"math.PR","http://arxiv.org/licenses/nonexclusive-distrib/1.0/","  Fix a strictly positive measure $W$ on the $d$-dimensional torus
  $\bb T^d$. For an integer $N\ge 1$, denote by $W^N_x$, $x=(x_1,
  ..., x_d)$, $0\le x_i <N$, the $W$-measure of the cube $[x/N,
  (x+\mb 1)/N)$, where $\mb 1$ is the vector with all components equal to 1. In
dimension 1, we prove that the hydrodynamic behavior of a superposition of
independent random walks, in which a particle jumps from $x/N$ to one of its
neighbors at rate $(N W^N_x)^{-1}$, is described in the diffusive scaling by
the linear differential equation $\partial_t \rho = (d/dW)(d/dx) \rho$. In
dimension $d>1$, if $W$ is a finite discrete measure, $W=\sum_{i\ge 1} w_i
\delta_{x_i}$, we prove that the random walk which jumps from $x/N$ uniformly
to one of its neighbors at rate $(W^N_x)^{-1}$ has a metastable behavior, as
defined in \cite{bl1}, described by the $K$-process introduced in \cite{fm1}.
","[{""version"":""v1"",""created"":""Thu, 19 Feb 2009 10:33:29 GMT""}]","2009-02-20"
"0902.3335","Vladimir Hinkov","D. Haug, V. Hinkov, A. Suchaneck, D. S. Inosov, N. B. Christensen, Ch.
  Niedermayer, P. Bourges, Y. Sidis, J. T. Park, A. Ivanov, C. T. Lin, J.
  Mesot, B. Keimer","Magnetic-field-enhanced incommensurate magnetic order in the underdoped
  high-temperature superconductor YBa(2)Cu(3)O(6.45)","4 pages, 3 figures. Version 2 as accepted by PRL, contains updated
  reference list and improved comparison to similar effects in the La-214
  system","Phys. Rev. Lett. 103, 017001 (2009)","10.1103/PhysRevLett.103.017001",,"cond-mat.str-el cond-mat.supr-con","http://arxiv.org/licenses/nonexclusive-distrib/1.0/","  We present a neutron-scattering study of the static and dynamic spin
correlations in the underdoped high-temperature superconductor
YBa(2)Cu(3)O(6.45) in magnetic fields up to 15 T. The field strongly enhances
static incommensurate magnetic order at low temperatures and induces a
spectral-weight shift in the magnetic-excitation spectrum. A reconstruction of
the Fermi surface driven by the field-enhanced magnetic superstructure may thus
be responsible for the unusual Fermi surface topology revealed by recent
quantum-oscillation experiments.
","[{""version"":""v1"",""created"":""Thu, 19 Feb 2009 10:28:38 GMT""},{""version"":""v2"",""created"":""Mon, 29 Jun 2009 20:53:25 GMT""}]","2009-06-29"
"0902.3336","Sergiy Mankovsky","S. Mankovsky, S. Bornemann, J. Min\'ar, S. Polesya, H. Ebert, J. B.
  Staunton, A. I. Lichtenstein","Spin-orbit induced non-collinear spin structure in deposited transition
  metal clusters","11 pages, 4 figures",,,,"cond-mat.mtrl-sci","http://arxiv.org/licenses/nonexclusive-distrib/1.0/","  The influence of the spin-orbit coupling on the magnetic structure of
deposited transition metal nanostructure systems has been studied by fully
relativistic electronic structure calculations. The interplay of exchange
coupling and magnetic anisotropy was monitored by studying the corresponding
magnetic torque calculated within ab-initio and model approaches. It is found
that a spin-orbit induced Dzyaloshinski-Moriya interaction can stabilise a
non-collinear spin structure even if there is a pronounced isotropic
ferromagnetic exchange interaction between the magnetic atoms.
","[{""version"":""v1"",""created"":""Thu, 19 Feb 2009 10:29:57 GMT""}]","2009-02-20"
"0902.3337","Mikhail Yurishchev","S.M.Aldoshin, E.B.Feldman, and M.A.Yurishchev","Quantum Entanglement in Nitrosyl Iron Complexes","8 pages","Zh. Eksp. Teor. Fiz. (ZhETF) 134 (2008) 940-948; J. Exp. Theor.
  Phys. (JETP) 107 (2008) 804-811","10.1134/S1063776108110101",,"quant-ph","http://arxiv.org/licenses/nonexclusive-distrib/1.0/","  Recent magnetic susceptibility measurements for polycrystalline samples of
binuclear nitrosyl iron complexes [Fe_2(C_3H_3N_2S)_2(NO)_4] (I) and
[Fe_2(SC_3H_5N_2)_2(NO)_4] (II), suggest that quantum-mechanical entanglement
of the spin degrees of freedom exists in these compounds. Entanglement E exists
below the temperature T_E that we have estimated for complexes I and II to be
80-90 and 110-120 K, respectively. Using an expression of entanglement in terms
of magnetic susceptibility for a Heisenberg dimer, we find the temperature
dependence of the entanglement for complex II. Having arisen at the temperature
T_E, the entanglement increases monotonically with decreasing temperature and
reaches 90-95% in this complex at T=25 K, when the subordinate effects are
still small.
","[{""version"":""v1"",""created"":""Thu, 19 Feb 2009 10:30:40 GMT""}]","2009-11-13"
"0902.3338","Dominic Joyce","Dominic Joyce, Yng-Ing Lee and Richard Schoen","On the existence of Hamiltonian stationary Lagrangian submanifolds in
  symplectic manifolds","25 pages. (v2) minor changes, final version to appear in American
  Journal of Mathematics","American Journal of Mathematics 133 (2011), 1067-1092",,,"math.DG math.SG","http://arxiv.org/licenses/nonexclusive-distrib/1.0/","  Let (M,w) be a compact symplectic 2n-manifold, and g a Riemannian metric on M
compatible with w. For instance, g could be Kahler, with Kahler form w.
Consider compact Lagrangian submanifolds L of M. We call L Hamiltonian
stationary, or H-minimal, if it is a critical point of the volume functional
under Hamiltonian deformations. It is called Hamiltonian stable if in addition
the second variation of volume under Hamiltonian deformations is nonnegative.
  Our main result is that if L is a compact, Hamiltonian stationary Lagrangian
in C^n satisfying the extra condition of being Hamiltonian rigid, then for any
M,w,g as above there exist compact Hamiltonian stationary Lagrangians L' in M
contained in a small ball about some p in M and locally modelled on tL for
small t>0, identifying M near p with C^n near 0. If L is Hamiltonian stable, we
can take L' to be Hamiltonian stable.
  Applying this to known examples L in C^n shows that there exist families of
Hamiltonian stable, Hamiltonian stationary Lagrangians diffeomorphic to T^n,
and to (S^1 x S^{n-1})/{1,-1}, and with other topologies, in every compact
symplectic 2n-manifold (M,w) with compatible metric g.
","[{""version"":""v1"",""created"":""Thu, 19 Feb 2009 10:34:02 GMT""},{""version"":""v2"",""created"":""Wed, 28 Jul 2010 09:26:05 GMT""}]","2015-10-08"
"0902.3339","Gesualdo Delfino","Gesualdo Delfino","Field theory of Ising percolating clusters","19 pages, 8 figures","Nucl.Phys.B818:196-211,2009","10.1016/j.nuclphysb.2009.04.002",,"hep-th cond-mat.stat-mech","http://arxiv.org/licenses/nonexclusive-distrib/1.0/","  The clusters of up spins of a two-dimensional Ising ferromagnet undergo a
second order percolative transition at temperatures above the Curie point. We
show that in the scaling limit the percolation threshold is described by an
integrable field theory and identify the non-perturbative mechanism which
allows the percolative transition in absence of thermodynamic singularities.
The analysis is extended to the Kertesz line along which the Coniglio-Klein
droplets percolate in a positive magnetic field.
","[{""version"":""v1"",""created"":""Thu, 19 Feb 2009 10:35:19 GMT""}]","2009-08-11"
"0902.3340","Monika Pogorzelska","R. Alicki, M. Fannes and M. Pogorzelska","Quantum Generalized Subsystems","21 pages",,"10.1103/PhysRevA.79.052111",,"quant-ph","http://arxiv.org/licenses/nonexclusive-distrib/1.0/","  We propose a new formalism of quantum subsystems which allows to unify the
existing and new methods of reduced description of quantum systems. The main
mathematical ingredients are completely positive maps and correlation
functions. In this formalism generalized quantum systems can be composed and
there is a notion of generalized entanglement. Models of fermionic and bosonic
systems and also quantum systems described by the SU(2) symmetry are studied.
","[{""version"":""v1"",""created"":""Thu, 19 Feb 2009 10:56:57 GMT""}]","2015-05-13"
"0902.3341","Luigi Spinoglio","Luigi Spinoglio, Silvia Tommasin, Matthew A. Malkan, Kevin Hainline","Spitzer spectra of Seyfert galaxies","to appear in the proceedings of ""The Starburst-AGN Connection
  Conference"", Shanghai, China, 27 Oct - 1 Nov 2008, ASP Conference Series",,,,"astro-ph.GA astro-ph.CO","http://arxiv.org/licenses/nonexclusive-distrib/1.0/","  The Spitzer IRS high resolution spectra of about 90 Seyfert galaxies from the
12um Galaxy Sample are presented and discussed. These represent about 70% of
the total complete sample of local Seyfert galaxies. The presence of starburst
components in these galaxies can be quantified by powerful mid-IR diagnostics
tools (i.e. 11.25um PAH feature equivalent width and the H_2 emission line
intensity) as well as the AGN dominance can be measured by specific fine
structure line ratios (e.g. [NeV]/[NeII], [NeV]/[SiII], etc.). The observed
line ratios are compared to the results of semianalytical models, which can be
used to compute the AGN and starburst contributions to the total luminosity of
the galaxies. The results are also discussed in the light of unification and
evolution models.
","[{""version"":""v1"",""created"":""Thu, 19 Feb 2009 15:29:39 GMT""}]","2009-02-20"
"0902.3342","Burra Sidharth Gautam","Burra G.Sidharth","Mass Generation and Noncommutative Spacetime","8 pages; latex; Invited talk at Physics 2009",,,"IIAMIS TR-09021","physics.gen-ph","http://arxiv.org/licenses/nonexclusive-distrib/1.0/","  In this paper we show how it is possible to obtain mass generation in the
context of non Abelian gauge field theory, using a non commutative spacetime.
This is further confirmed by the modified dispersion relation that results from
such a geometry.
","[{""version"":""v1"",""created"":""Thu, 19 Feb 2009 10:55:40 GMT""},{""version"":""v2"",""created"":""Mon, 23 Feb 2009 12:57:14 GMT""}]","2009-02-23"
"0902.3343","Sarjinder Singh","Sarjinder Singh, Raghunath Arnab","On calibration of design weights","Submitted to the Test Annals of Probability
  (http://www.imstat.org/aap/) by the Institute of Mathematical Statistics
  (http://www.imstat.org)",,,"T-TEST-SS_2009_42","stat.ME","http://arxiv.org/licenses/nonexclusive-distrib/1.0/","  In the present investigation, we build a bridge between the generalized
regression (GREG) estimator due to Deville and Sarndal (1992) and the linear
regression estimator due to Hansen, Hurwitz and Madow (1953) in the presence of
single auxiliary variable. The bridge confirms that the sum of calibrated
weights should be equal to sum of design weights as pointed out by Singh (2003,
2004, 2006) and Stearns and Singh (2008). An important modification in the
statistical packages such as GES, SUDAAN etc. has been suggested.
","[{""version"":""v1"",""created"":""Thu, 19 Feb 2009 10:58:15 GMT""}]","2009-02-20"
"0902.3344","Nadezhda Gribova","N. Gribova, H. Maleki, A. Arnold, C. Holm, T. Schilling","2D versus 3D Freezing of a Lennard-Jones Fluid in a Slit Pore: A
  Molecular Dynamics Study","submitter to J. Phys.: Condens. Matter",,,,"cond-mat.soft cond-mat.stat-mech","http://arxiv.org/licenses/nonexclusive-distrib/1.0/","  We present a computer simulation study of a (6,12)-Lennard-Jones fluid
confined to a slit pore, formed by two uniform planes. These interact via
(3,9)-Lennard-Jones potential with the fluid particles. When the fluid
approaches the liquid-to-solid transition we first observe layering parallel to
the walls. In order to investigate the nature of the freezing transition we
performed a detailed analysis of the bond-orientational order parameter in the
layers. We found no signs of hexatic order which would indicate a melting
scenario of the Kosterlitz-Thouless type. An analysis of the mean-square
displacement shows that the particles can easily move between the layers,
making the crystallization a 3d-like process. This is consistent with the fact
that we observe a considerable hysteresis in the heating-freezing curves,
showing that the crystallization transition proceeds as an activated process.
","[{""version"":""v1"",""created"":""Thu, 19 Feb 2009 11:13:01 GMT""}]","2009-02-20"
"0902.3345","Tim Netzer","Tim Netzer, Daniel Plaumann, Markus Schweighofer","Exposed faces of semidefinitely representable sets",,,,,"math.OC math.AG","http://arxiv.org/licenses/nonexclusive-distrib/1.0/","  A linear matrix inequality (LMI) is a condition stating that a symmetric
matrix whose entries are affine linear combinations of variables is positive
semidefinite. Motivated by the fact that diagonal LMIs define polyhedra, the
solution set of an LMI is called a spectrahedron. Linear images of spectrahedra
are called semidefinite representable sets. Part of the interest in
spectrahedra and semidefinite representable sets arises from the fact that one
can efficiently optimize linear functions on them by semidefinite programming,
like one can do on polyhedra by linear programming.
  It is known that every face of a spectrahedron is exposed. This is also true
in the general context of rigidly convex sets. We study the same question for
semidefinite representable sets. Lasserre proposed a moment matrix method to
construct semidefinite representations for certain sets. Our main result is
that this method can only work if all faces of the considered set are exposed.
This necessary condition complements sufficient conditions recently proved by
Lasserre, Helton and Nie.
","[{""version"":""v1"",""created"":""Thu, 19 Feb 2009 11:11:00 GMT""},{""version"":""v2"",""created"":""Fri, 18 Dec 2009 06:59:07 GMT""}]","2009-12-18"
"0902.3346","Antonio Vairo","Antonio Vairo","Non-relativistic bound states: the long way back from the Bethe-Salpeter
  to the Schroedinger equation","Contribution to ""Fundamental Interactions - A Memorial Volume for
  Wolfgang Kummer"", D. Grumiller, A. Rebhan, D.V. Vassilevich (eds.); 17 pages,
  6 figures; references added",,"10.1142/9789814277839_0002",,"hep-ph nucl-th","http://arxiv.org/licenses/nonexclusive-distrib/1.0/","  I review, in a personal perspective, the history of the theory of
non-relativistic bound states in QED and QCD from the Bethe-Salpeter equation
to the construction of effective field theories.
","[{""version"":""v1"",""created"":""Thu, 19 Feb 2009 11:25:26 GMT""},{""version"":""v2"",""created"":""Mon, 6 Apr 2009 12:48:39 GMT""}]","2016-12-21"
"0902.3347","Nicole Kraemer","Nicole Kraemer, Masashi Sugiyama, Mikio Braun","Lanczos Approximations for the Speedup of Kernel Partial Least Squares
  Regression","to appear in Proceedings of the 12th International Conference on
  Artificial Intelligence and Statistics (AISTATS 09)","JMLR Workshop and Conference Proceedings 5 (AISTATS 2009), p
  288-295, 2009",,,"stat.ML","http://arxiv.org/licenses/nonexclusive-distrib/1.0/","  The runtime for Kernel Partial Least Squares (KPLS) to compute the fit is
quadratic in the number of examples. However, the necessity of obtaining
sensitivity measures as degrees of freedom for model selection or confidence
intervals for more detailed analysis requires cubic runtime, and thus
constitutes a computational bottleneck in real-world data analysis. We propose
a novel algorithm for KPLS which not only computes (a) the fit, but also (b)
its approximate degrees of freedom and (c) error bars in quadratic runtime. The
algorithm exploits a close connection between Kernel PLS and the Lanczos
algorithm for approximating the eigenvalues of symmetric matrices, and uses
this approximation to compute the trace of powers of the kernel matrix in
quadratic runtime.
","[{""version"":""v1"",""created"":""Thu, 19 Feb 2009 11:28:20 GMT""}]","2010-08-13"
"0902.3348","Justyna Kosakowska","Stanis{\l}aw Kasjan and Justyna Kosakowska","On Lie algebras associated with representation directed algebras","17 pages","Journal of Pure and Applied Algebra 214(2010), 678-688",,,"math.RT","http://arxiv.org/licenses/nonexclusive-distrib/1.0/","  Let $B$ be a representation-finite $\mathbb{C}$-algebra.
  The $\mathbb{Z}$-Lie algebra $L(B)$ associated with $B$ has been defined by
Ch. Riedtmann.
  If $B$ is representation-directed there is another $\mathbb{Z}$-Lie algebra
associated with $B$ defined by C. M. Ringel and denoted by $\CK(B)$. We prove
that the Lie algebras $L(B)$ and $\CK(B)$ are isomorphic for any
representation-directed $\mathbb{C}$-algebra $B$.
","[{""version"":""v1"",""created"":""Thu, 19 Feb 2009 11:31:42 GMT""}]","2013-06-26"
"0902.3349","Neal A. Miller","Neal A. Miller, Ann E. Hornschemeier, Bahram Mobasher","A Deep VLA Radio Continuum Study of the Core and Outskirts of the Coma
  Cluster","26 pages, accepted for publication in AJ",,"10.1088/0004-6256/137/5/4436",,"astro-ph.CO astro-ph.GA","http://arxiv.org/licenses/nonexclusive-distrib/1.0/","  We present deep 1.4GHz Very Large Array (VLA) radio continuum observations of
two ~half square degree fields in the Coma cluster of galaxies. The two fields,
""Coma 1"" and ""Coma 3,"" correspond to the cluster core and southwest infall
region and were selected on account of abundant pre-existing multiwavelength
data. In their most sensitive regions the radio data reach 22 uJy rms per 4.4""
beam, sufficient to detect (at 5-sigma) Coma member galaxies with log(L) =
20.11 W/Hz. The full catalog of radio detections is presented herein and
consists of 1030 sources detected at >=5 sigma, 628 of which are within the
combined Coma 1 and Coma 3 area. We also provide optical identifications of the
radio sources using data from the Sloan Digital Sky Survey (SDSS). The depth of
the radio observations allows us to detect AGN in cluster elliptical galaxies
with Mr < -20.5 (AB magnitudes), including radio detections for all cluster
ellipticals with Mr < -21.8. At fainter optical magnitudes (-20.5 < Mr <~ -19)
the radio sources are associated with star-forming galaxies with star formation
rates as low as 0.1 solar masses per year.
","[{""version"":""v1"",""created"":""Thu, 19 Feb 2009 15:32:06 GMT""}]","2009-11-13"
