"0902.3286","Arunkumar Subramanian","Arunkumar Subramanian, Steven W. McLaughlin","MDS codes on the erasure-erasure wiretap channel","Submitted to the 2009 IEEE International Symposium on Information
  Theory",,,,"cs.IT math.IT","http://arxiv.org/licenses/nonexclusive-distrib/1.0/","  This paper considers the problem of perfectly secure communication on a
modified version of Wyner's wiretap channel II where both the main and
wiretapper's channels have some erasures. A secret message is to be encoded
into $n$ channel symbols and transmitted. The main channel is such that the
legitimate receiver receives the transmitted codeword with exactly $n - \nu$
erasures, where the positions of the erasures are random. Additionally, an
eavesdropper (wire-tapper) is able to observe the transmitted codeword with $n
- \mu$ erasures in a similar fashion. This paper studies the maximum achievable
information rate with perfect secrecy on this channel and gives a coding scheme
using nested codes that achieves the secrecy capacity.
","[{""version"":""v1"",""created"":""Thu, 19 Feb 2009 02:28:23 GMT""}]","2009-09-30"
"0902.3287","Gottfried Lechner","Ingmar Land, Gottfried Lechner, Lars K. Rasmussen","Adaptive Decoding of LDPC Codes with Binary Messages","5 pages, 4 figures, to be published at ISIT 2009",,,,"cs.IT math.IT","http://arxiv.org/licenses/nonexclusive-distrib/1.0/","  A novel adaptive binary decoding algorithm for LDPC codes is proposed, which
reduces the decoding complexity while having a comparable or even better
performance than corresponding non-adaptive alternatives. In each iteration the
variable node decoders use the binary check node decoders multiple times; each
single use is referred to as a sub-iteration. To process the sequences of
binary messages in each iteration, the variable node decoders employ
pre-computed look-up tables. These look-up tables as well as the number of
sub-iterations per iteration are dynamically adapted during the decoding
process based on the decoder state, represented by the mutual information
between the current messages and the syndrome bits. The look-up tables and the
number of sub-iterations per iteration are determined and optimized using
density evolution. The performance and the complexity of the proposed adaptive
decoding algorithm is exemplified by simulations.
","[{""version"":""v1"",""created"":""Thu, 19 Feb 2009 03:19:50 GMT""},{""version"":""v2"",""created"":""Fri, 24 Apr 2009 01:38:16 GMT""}]","2009-04-24"
"0902.3288","Pisin Chen","Pisin Chen and K. D. Hoffman (editors for interested physicists from
  the IceCube and ANITA Collaborations)","Origin and evolution of cosmic accelerators - the unique discovery
  potential of an UHE neutrino telescope: Astronomy Decadal Survey (2010-2020)
  Science White Paper","7 pages, 3 figures, submitted to US Astronomy Decadal Survey
  (2010-2020)","US Astronomy Decadal Survey (2010-2020)",,,"astro-ph.CO astro-ph.HE","http://arxiv.org/licenses/nonexclusive-distrib/1.0/","  One of the most tantalizing questions in astronomy and astrophysics, namely
the origin and the evolution of the cosmic accelerators that produce the
highest energy cosmic rays (UHECR), may be best addressed through the
observation of ultra high energy (UHE) cosmogenic neutrinos. Neutrinos travel
from their source undeflected by magnetic fields and unimpeded by interactions
with the cosmic microwave background. At high energies, neutrinos could be
detected in dense, radio frequency (RF) transparent media via the Askaryan
effect. The abundant cold ice covering the geographic South Pole, with its
exceptional RF clarity, has been host to several pioneering efforts to develop
this approach, including RICE and ANITA. Building on the expertise gained in
these efforts, and the infrastructure developed in the construction of the
IceCube optical Cherenkov observatory, a low-cost array of radio frequency
antenna stations could be deployed near the Pole to efficiently detect a
significant number of UHE neutrinos with degree scale angular resolution within
the next decade. Such an array, if installed in close proximity to IceCube,
could allow cross-calibration on a small but invaluable subset of neutrino
events detected by both the optical and radio methods. In addition to providing
critical information in the identification of the source of UHECRs, such an
observatory could also provide a unique probe of long baseline high energy
neutrino interactions unattainable in any man-made neutrino beam.
","[{""version"":""v1"",""created"":""Thu, 19 Feb 2009 03:03:43 GMT""}]","2014-04-29"
"0902.3289","Christoph Sachse","Christoph Sachse","Global Analytic Approach to Super Teichmueller Spaces","PhD thesis, 173 pages",,,,"math.AG math.DG math.QA","http://arxiv.org/licenses/nonexclusive-distrib/1.0/","  In this thesis we investigate a new formalism for supergeometry which focuses
on the categorical properties of the theory. This approach is our main tool in
the subsequent investigation of a global analytic approach to the construction
of super Teichmueller spaces. These results should be of importance to various
other fields, in particular, superstring theory and superconformal field
theory.
  This new approach, which was actually first proposed by Molotkov and Schwarz
and Voronov already in the mid-80s, is based on a consequent use of the functor
of points. Apart from clarifying various issues of supergeometry which
sometimes remain obscure in the standard (ringed-space) approach, its main
achievement is that it makes infinite-dimensional supermanifolds available.
  We use this to define the supermanifold of all almost complex structures on a
given finite-dimensional supermanifold and show that it actually carries a
complex structure itself. Moreover we succeed in giving an explicit definition
and construction of the diffeomorphism supergroup of a finite-dimensional
supermanifold.
  We then combine these results to show that one can construct a slice for the
action of the diffeomorphism supergroup on the subspace of integrable almost
complex structures on a smooth closed oriented 2|2-dimensional supersurface.
This slice represents a local patch of super Teichmueller space. We also
investigate how this construction changes if one instead looks at N=1
superconformal structures on such a surface and show that one obtains an
analogous result.
","[{""version"":""v1"",""created"":""Thu, 19 Feb 2009 03:08:09 GMT""}]","2009-02-20"
"0902.3290","Daniele Fargion","D.Fargion, D. D'Armiento, P. Paggi, S. Patri'","Lightest Nuclei in UHECR versus Tau Neutrino Astronomy","5 pages, 5 figures, CRIS 2008","Nucl.Phys.Proc.Suppl.190:162-166,2009","10.1016/j.nuclphysbps.2009.03.083",,"astro-ph.HE astro-ph.CO","http://arxiv.org/licenses/nonexclusive-distrib/1.0/","  UHECR may be either nucleons or nuclei; in the latter case the Lightest
Nuclei, as He, Li, Be, explains at best the absence of Virgo signals and the
crowding of events around Cen-A bent by galactic magnetic fields. This model
fit the observed nuclear mass composition discovered in AUGER. However UHECR
nucleons above GZK produce EeV neutrinos while Heavy Nuclei, as Fe UHECR do not
produce much. UHECR He nuclei at few tens EeV suffer nuclear fragmentation
(producing low energetic neutrino at tens PeVs) but it suffer anyway photo-pion
GZK suppression (leading to EeV neutrinos) once above one-few 10^{20} eV. Both
these cosmogenic UHE secondary neutrinos signals may influence usual predicted
GZK Tau Neutrino Astronomy in significant and detectable way; the role of
resonant antineutrino electron-electron leading to Tau air-shower may also
rise.
","[{""version"":""v1"",""created"":""Thu, 19 Feb 2009 15:48:42 GMT""}]","2010-12-13"
"0902.3291","Run-Hui Li","Run-Hui Li, Cai-Dian L\""u and Wei Wang","Branching Ratios, Forward-backward Asymmetry and Angular Distributions
  of $B\to K_1l^+l^-$ Decays","14 pages, 6 figures, version appears in PRD","Phys.Rev.D79:094024,2009","10.1103/PhysRevD.79.094024",,"hep-ph","http://arxiv.org/licenses/nonexclusive-distrib/1.0/","  Using the $B\to K_1$ form factors evaluated in the perturbative QCD approach,
we study semileptonic $B\to K_1(1270)l^+l^-$ and $B\to K_1(1400)l^+l^-$ decays,
where $K_1(1270)$ and $K_1(1400)$ are mixtures of $K_{1A}$ and $K_{1B}$ which
are $^3P_1$ and $^1P_1$ states, respectively. Using the technique of helicity
amplitudes, we express the decay amplitudes in terms of several independent and
Lorentz invariant pieces. We study the dilepton invariant mass distributions,
branching ratios, polarizations and forward-backward asymmetries of $ B\to
K_1l^+l^-$ decays. The ambiguity in the sign of the mixing angle will induce
much large differences to branching ratios of semileptonic B decays: branching
ratios without resonant contributions either have the order of $10^{-6}$ or
$10^{-8}$. But the polarizations and the forward-backward asymmetries are not
sensitive to the mixing angles. We find that the resonant contributions will
dramatically change the dilepton invariant mass distributions in the resonant
region. We also provide the angular distributions of $ B\to K_1l^+l^-\to
(K\pi\pi)l^+l^-$ decays.
","[{""version"":""v1"",""created"":""Thu, 19 Feb 2009 03:11:52 GMT""},{""version"":""v2"",""created"":""Fri, 22 May 2009 07:43:03 GMT""}]","2009-07-30"
"0902.3292","Akinori Awazu","Akinori Awazu and Kunihiko Kaneko","Discreteness-Induced Criticality in Random Catalytic Reaction Networks",,,,,"cond-mat.stat-mech cond-mat.dis-nn","http://arxiv.org/licenses/nonexclusive-distrib/1.0/","  Universal intermittent dynamics in a random catalytic reaction network,
induced by smallness in the molecule number is reported. Stochastic simulations
for a random catalytic reaction network subject to a flow of chemicals show
that the system undergoes a transition from a stationary to an intermittent
reaction phase when the flow rate is decreased. In the intermittent reaction
phase, two temporal regimes with active and halted reactions alternate. The
number frequency of reaction events at each active regime and its duration time
are shown to obey a universal power laws with the exponents 4/3 and 3/2,
respectively. These power laws are explained by a one-dimensional random walk
representation of the number of catalytically active chemicals. Possible
relevance of the result to intra-cellular reaction dynamics is also discussed.
","[{""version"":""v1"",""created"":""Thu, 19 Feb 2009 03:19:39 GMT""}]","2009-02-20"
"0902.3293","Daniele Fargion","D.Fargion, D. D'Armiento","Beaming Selection and SN-GRB-Jets Evolution","8 pages, 10 figures; white pages 2009",,,,"astro-ph.HE astro-ph.CO","http://arxiv.org/licenses/nonexclusive-distrib/1.0/","  After a decade of Fireball reign there is a hope for thin collimated Jet to
solve the Supernova-GRB mystery
","[{""version"":""v1"",""created"":""Thu, 19 Feb 2009 03:25:32 GMT""}]","2009-02-20"
"0902.3295","M. K. Vemuri","Amritanshu Prasad, M. K. Vemuri","Inductive algebras and homogeneous shifts",,"Complex Analysis and Operator Theory, Volume 4, Number 4,
  1015-1027, 2010","10.1007/s11785-009-0020-6",,"math.FA math.RT","http://arxiv.org/licenses/nonexclusive-distrib/1.0/","  Inductive algebras for the irreducible unitary representations of the
universal cover of the group of unimodular two by two matrices are classified.
The classification of homogeneous shift operators is obtained as a direct
consequence. This gives a new approach to the results of Bagchi and Misra.
","[{""version"":""v1"",""created"":""Thu, 19 Feb 2009 04:31:23 GMT""}]","2010-11-11"
"0902.3296","Jiangang Ying","Ping He, Jiangang Ying","Irreducibility and uniqueness of stationary distribution","5 pages",,,,"math.PR","http://arxiv.org/licenses/nonexclusive-distrib/1.0/","  In this paper, we shall prove that the irreducibility in the sense of fine
topology implies the uniqueness of invariant probability measures. It is also
proven that this irreducibility is strictly weaker than the strong Feller
property plus irreducibility in the sense of original topology, which is the
usual uniqueness condition.
","[{""version"":""v1"",""created"":""Thu, 19 Feb 2009 05:25:59 GMT""}]","2009-02-20"
"0902.3297","Jian-Rong Zhang","Jian-Rong Zhang and Ming-Qiu Huang","Deciphering triply heavy baryons in terms of QCD sum rules","9 pages with 8 eps figures, accepted for publication in Phys. Lett. B","Phys.Lett.B674:28-35,2009","10.1016/j.physletb.2009.02.056",,"hep-ph","http://arxiv.org/licenses/nonexclusive-distrib/1.0/","  The mass spectra of ground-state triply heavy baryons are systematically
unscrambled and computed in QCD sum rules. With a tentative $(QQ)-(Q')$
configuration for $QQQ'$, the interpolating currents representing the triply
heavy baryons are proposed. Technically, contributions of the operators up to
dimension six are included in operator product expansion (OPE). The numerical
results are presented in comparison with other theoretical predictions.
","[{""version"":""v1"",""created"":""Thu, 19 Feb 2009 05:28:50 GMT""}]","2009-04-17"
"0902.3298","Feng Qi","Feng Qi and Bai-Ni Guo","Sharpening and generalizations of Shafer's inequality for the arc
  tangent function",,"Feng Qi, Shi-Qin Zhang and Bai-Ni Guo, Sharpening and
  generalizations of Shafer's inequality for the arc tangent function, Journal
  of Inequalities and Applications 2009 (2009), Article ID 930294, 9 pages","10.1155/2009/930294",,"math.CA","http://arxiv.org/licenses/nonexclusive-distrib/1.0/","  In this paper, we sharpen and generalize Shafer's inequality for the arc
tangent function. From this, some known results are refined.
","[{""version"":""v1"",""created"":""Thu, 19 Feb 2009 05:50:55 GMT""}]","2010-07-12"
"0902.3299","Sanefumi Moriyama","Takuya Matsumoto, Sanefumi Moriyama","Serre Relation and Higher Grade Generators of the AdS/CFT Yangian
  Symmetry","24 pages, 1 figure, v2: on exceptional superalgebra, previous
  incorrect comments removed and new sections added, v3: clarifications added","JHEP 0909:097,2009","10.1088/1126-6708/2009/09/097",,"hep-th","http://arxiv.org/licenses/nonexclusive-distrib/1.0/","  It was shown that the spin chain model coming from AdS/CFT correspondence
satisfies the Yangian symmetry if we assume evaluation representation, though
so far there is no explicit proof that the evaluation representation satisfies
the Serre relation, which is one of the defining equations of the Yangian
algebra imposing constraints on the whole algebraic structure. We prove
completely that the evaluation representation adopted in the model satisfies
the Serre relation by introducing a three-dimensional gamma matrix. After
studying the Serre relation, we proceed to the whole Yangian algebraic
structure, where we find that the conventional construction of higher grade
generators is singular and we propose an alternative construction. In the
discussion of the higher grade generators, a great simplification for the proof
of the Serre relation is found. Using this expression, we further show that the
proof is lifted to the exceptional superalgebra, which is a non-degenerate
deformation of the original superalgebra.
","[{""version"":""v1"",""created"":""Thu, 19 Feb 2009 05:52:40 GMT""},{""version"":""v2"",""created"":""Tue, 26 May 2009 07:06:35 GMT""},{""version"":""v3"",""created"":""Thu, 6 Aug 2009 07:03:58 GMT""}]","2009-10-02"
"0902.3300","Albert Chau","Albert Chau, Jingyi Chen, Weiyong He","Lagrangian Mean Curvature flow for entire Lipschitz graphs","22 pages",,,,"math.DG","http://arxiv.org/licenses/nonexclusive-distrib/1.0/","  We consider the mean curvature flow of entire Lagrangian graphs with
Lipschitz continuous initial data. Assuming only a certain bound on the
Lipschitz norm of an initial entire Lagrangian graph in $\R^{2n}$, we show that
the parabolic equation \eqref{PMA} for the Lagrangian potential has a longtime
solution which is smooth for all positive time and satisfies uniform estimates
away from time $t=0$. In particular, under the mean curvature flow the graph
immediately becomes smooth and the solution exists for all time such that the
second fundamental form decays uniformly to 0 on the graph as $t\to \infty$.
Our assumption on the Lipschitz norm is equivalent to the assumption that the
underlying Lagrangian potential $u$ is uniformly convex with its Hessian
bounded in $L^\infty$. We apply this result to prove a Bernstein type theorem
for translating solitons, namely that if such an entire Lagrangian graph is a
smooth translating soliton, then it must be a flat plane. We also prove
convergence of the evolving graphs under additional conditions.
","[{""version"":""v1"",""created"":""Thu, 19 Feb 2009 06:17:08 GMT""}]","2009-02-20"
"0902.3301","Yunxin Zhang","Yunxin Zhang","A general two-cycle network model of molecular motors",,"Physica A 388 (2009) 3465-3474","10.1016/j.physa.2009.04.039",,"physics.bio-ph cond-mat.soft q-bio.SC","http://arxiv.org/licenses/nonexclusive-distrib/1.0/","  Molecular motors are single macromolecules that generate forces at the
piconewton range and nanometer scale. They convert chemical energy into
mechanical work by moving along filamentous structures. In this paper, we study
the velocity of two-head molecular motors in the framework of a mechanochemical
network theory. The network model, a generalization of the recently work of
Liepelt and Lipowsky (PRL 98, 258102 (2007)), is based on the discrete
mechanochemical states of a molecular motor with multiple cycles. By
generalizing the mathematical method developed by Fisher and Kolomeisky for
single cycle motor (PNAS(2001) 98(14) P7748-7753), we are able to obtain an
explicit formula for the velocity of a molecular motor.
","[{""version"":""v1"",""created"":""Thu, 19 Feb 2009 06:16:59 GMT""},{""version"":""v2"",""created"":""Fri, 24 Apr 2009 00:44:26 GMT""}]","2011-05-06"
"0902.3302","Ki Young Kim","Ki Young Kim, Boyang Liu, Yingyan Huang, and Seng-Tiong Ho","Simulation of photodetection using finite-difference time-domain method
  with application to near-field subwavelength imaging based on nanoscale
  semiconductor photodetector array","7 pages, 4 figures","Optical and Quantum Electronics, vol. 40, no. 5-6, pp. 343-347,
  Apr. 2008","10.1007/s11082-008-9190-0",,"physics.optics physics.comp-ph","http://arxiv.org/licenses/nonexclusive-distrib/1.0/","  Simulation of detecting photoelectrons using multi-level multi-electron
(MLME) finite-difference time-domain (FDTD) method with an application to
near-field subwavelength imaging based on semiconductor nanophotodetector (NPD)
array is reported. The photocurrents from the photodiode pixels are obtained to
explore the resolution of this novel NPD device for subwavelength imaging. One
limiting factor of the NPD device is the optical power coupling between
adjacent detector pixels. We investigate such power coupling in the presence of
absorbing media as well as the spatial distributions of the electric field and
photoelectron density using the MLME FDTD simulation. Our results show that the
detection resolution is about one tenth of the operating wavelength, which is
comparable to that of a near-field scanning optical microscope based on metal
clad tapered fiber.
","[{""version"":""v1"",""created"":""Thu, 19 Feb 2009 06:27:33 GMT""}]","2009-02-20"
"0902.3303","Alexander I. Bufetov","Alexander I. Bufetov","Finitely-additive measures on the asymptotic foliations of a Markov
  compactum","29 pages","Moscow Math. Journal. 2014. 14(2). pp. 205-224",,,"math.DS math.PR","http://arxiv.org/licenses/nonexclusive-distrib/1.0/","  An asymptotic expansion is established for time averages of translation flows
on flat surfaces. This result, which extends earlier work of A.Zorich and
G.Forni, yields limit theorems for translation flows.
  The argument, close in spirit to that of G.Forni, uses the approximation of
ergodic integrals by holonomy-invariant Hoelder cocycles on trajectories of the
flows. The space of holonomy-invariant Hoelder cocycles is finite-dimensional,
and is given by an explicit construction. First, a symbolic representation for
a uniquely ergodic translation flow is obtained following S.Ito and A.M.
Vershik, and then, the space of cocycles is constructed using a family of
finitely-additive complex-valued holonomy-invariant measures on the asymptotic
foliations of a Markov compactum.
","[{""version"":""v1"",""created"":""Thu, 19 Feb 2009 06:36:53 GMT""}]","2014-07-28"
"0902.3304","Richard Leroy","Saugata Basu, Richard Leroy, Marie-Francoise Roy","A bound on the minimum of a real positive polynomial over the standard
  simplex",,,,,"cs.SC","http://arxiv.org/licenses/nonexclusive-distrib/1.0/","  We consider the problem of bounding away from 0 the minimum value m taken by
a polynomial P of Z[X_1,...,X_k] over the standard simplex, assuming that m>0.
Recent algorithmic developments in real algebraic geometry enable us to obtain
a positive lower bound on m in terms of the dimension k, the degree d and the
bitsize of the coefficients of P. The bound is explicit, and obtained without
any extra assumption on P, in contrast with previous results reported in the
literature.
","[{""version"":""v1"",""created"":""Thu, 19 Feb 2009 15:52:58 GMT""}]","2009-02-20"
"0902.3305","Vikram Deshpande","Vikram V. Deshpande, Scott Hsieh, Adam W. Bushmaker, Marc Bockrath and
  Stephen B. Cronin","Spatially-Resolved Temperature Measurements of Electrically-Heated
  Carbon Nanotubes","To appear in Phys. Rev. Lett",,"10.1103/PhysRevLett.102.105501",,"cond-mat.mes-hall","http://arxiv.org/licenses/nonexclusive-distrib/1.0/","  Spatially-resolved Raman spectra of individual pristine suspended carbon
nanotubes are observed under electrical heating. The Raman G+ and G- bands show
unequal temperature profiles. The preferential heating is more pronounced in
short nanotubes (2 um) than in long nanotubes (5 um). These results are
understood in terms of the decay and thermalization of non-equilibrium phonons,
revealing the mechanism of thermal transport in these devices. The measurements
also enable a direct estimate of thermal contact resistances and the spatial
variation of thermal conductivity.
","[{""version"":""v1"",""created"":""Thu, 19 Feb 2009 06:47:13 GMT""}]","2009-11-13"
"0902.3306","Tibor K. Pog\'any","Tibor K. Pog\'any, Saralees Nadarajah","Explicit expressions for the variogram of first--order intrinsic
  autoregressions","Submitted to the Electronic Journal of Statistics
  (http://www.i-journals.org/ejs/) by the Institute of Mathematical Statistics
  (http://www.imstat.org)",,,"IMS-EJS-EJS_2009_380","math.ST stat.TH","http://arxiv.org/licenses/nonexclusive-distrib/1.0/","  Exact and explicit expressions for the variogram of first--order intrinsic
autoregressions have not been known. Various asymptotic expansions and
approximations have been used to compute the variogram. In this note, an exact
and explicit expression applicable for all parameter values is derived. The
expression involves Appell's hypergeometric function of the fourth kind.
Various particular cases of the expression are also derived.
","[{""version"":""v1"",""created"":""Thu, 19 Feb 2009 06:48:01 GMT""}]","2009-02-20"
"0902.3307","Satoshi Eguchi","Satoshi Eguchi, Yoshihiro Ueda, Yuichi Terashima, Richard Mushotzky,
  Jack Tueller","Suzaku View of the Swift/BAT Active Galactic Nuclei (I): Spectral
  Analysis of Six AGNs and Evidence for Two Types of Obscured Population","11 pages, 6 figures, accepted for publication in The Astrophysical
  Journal","Astrophys.J.696:1657-1667,2009","10.1088/0004-637X/696/2/1657",,"astro-ph.GA","http://arxiv.org/licenses/nonexclusive-distrib/1.0/","  We present a systematic spectral analysis with Suzaku of six AGNs detected in
the Swift/BAT hard X-ray (15--200 keV) survey, Swift J0138.6-4001,
J0255.2-0011, J0350.1-5019, J0505.7-2348, J0601.9-8636, and J1628.1-5145. This
is considered to be a representative sample of new AGNs without X-ray spectral
information before the BAT survey. We find that the 0.5--200 keV spectra of
these sources can be uniformly fit with a base model consisting of heavily
absorbed (log $N_{\rm{H}} > 23.5 \rm{cm}^{-2}$) transmitted components,
scattered lights, a reflection component, and an iron-K emission line. There
are two distinct groups, three ""new type"" AGNs (including the two sources
reported by \citealt{Ueda2007}) with an extremely small scattered fraction
($f_{\rm{scat}} < 0.5%$) and strong reflection component ($R = \Omega / 2 \pi
\gtrsim 0.8$ where $\Omega$ is the solid angle of the reflector), and three
""classical type"" ones with $f_{\rm{scat}} > 0.5%$ and $R \lesssim 0.8$. The
spectral parameters suggest that the new type has an optically thick torus for
Thomson scattering ($N_{\rm{H}} \sim 10^{25} \rm{cm}^{-2}$) with a small
opening angle $\theta \sim 20^{\circ}$ viewed in a rather face-on geometry,
while the classical type has a thin torus ($N_{\rm{H}} \sim 10^{23-24} \
\rm{cm}^{-2}$) with $\theta \gtrsim 30^{\circ}$. We infer that a significant
number of new type AGNs with an edge-on view is missing in the current all-sky
hard X-ray surveys.
","[{""version"":""v1"",""created"":""Thu, 19 Feb 2009 06:50:50 GMT""}]","2011-02-11"
