"0902.3224","Jonathan Ziprick","J. Ziprick, G. Kunstatter","Dynamical Singularity Resolution in Spherically Symmetric Black Hole
  Formation","10 pages, 5 figures","Phys.Rev.D80:024032,2009","10.1103/PhysRevD.80.024032",,"gr-qc","http://arxiv.org/licenses/nonexclusive-distrib/1.0/","  We study numerically the effects of loop quantum gravity motivated
corrections on massless scalar field collapse in Painlev\'e-Gullstrand
coordinates. Near criticality, the system exhibits Choptuik scaling with the
added features of a mass gap and a new scaling relationship dependant upon the
quantum length scale. The quantum corrected collapse exhibits a radiation-like
phase which resolves the singularity: the black hole consists of a compact
region of space-time bounded by a single, smooth trapping horizon. The
""evaporation"" is not complete but leaves behind an outward moving remnant.
","[{""version"":""v1"",""created"":""Wed, 18 Feb 2009 19:32:06 GMT""}]","2009-08-11"
"0902.3225","Luis Gregorio Dias da Silva","Luis G. Dias da Silva, Elbio Dagotto","Phonon-assisted tunneling and two-channel Kondo physics in molecular
  junctions","5 pages, 4 figures; to appear in Phys. Rev. B","Phys. Rev. B 79 155302 (2009)","10.1103/PhysRevB.79.155302",,"cond-mat.mes-hall cond-mat.str-el","http://arxiv.org/licenses/nonexclusive-distrib/1.0/","  The interplay between vibrational modes and Kondo physics is a fundamental
aspect of transport properties of correlated molecular conductors. We present
theoretical results for a single molecule in the Kondo regime connected to left
and right metallic leads, creating the usual coupling to a conduction channel
with left-right parity (""even""). A center-of-mass vibrational mode introduces
an additional, phonon-assisted, tunneling through the antisymmetric (""odd"")
channel. A non-Fermi liquid fixed point, reminiscent of the two-channel Kondo
effect, appears at a critical value of the phonon-mediated coupling strength.
Our numerical renormalization-group calculations for this system reveal
non-Fermi-liquid behavior at low temperatures over lines of critical points.
Signatures of this strongly correlated state are prominent in the thermodynamic
properties and in the linear conductance.
","[{""version"":""v1"",""created"":""Wed, 18 Feb 2009 19:28:48 GMT""},{""version"":""v2"",""created"":""Fri, 20 Feb 2009 15:29:29 GMT""}]","2009-05-18"
"0902.3226","Luis Raul Abramo","L. Raul Abramo, Ronaldo C. Batista, Rogerio Rosenfeld","The signature of dark energy perturbations in galaxy cluster surveys","5 pages, 4 figures","JCAP 0907:040,2009","10.1088/1475-7516/2009/07/040",,"astro-ph.CO","http://arxiv.org/licenses/nonexclusive-distrib/1.0/","  All models of dynamical dark energy possess fluctuations, which affect the
number of galaxy clusters in the Universe. We have studied the impact of dark
energy clustering on the number of clusters using a generalization of the
spherical collapse model and the Press-Schechter formalism. Our statistical
analysis is performed in a 7-parameter space using the Fisher matrix method,
for several hypothetical Sunyaev-Zel'dovich and weak lensing (shear maps)
surveys. In some scenarios, the impact of these fluctuations is large enough
that their effect could already be detected by existing instruments such as the
South Pole Telescope, when its data is combined with WMAP and SDSS. Future
observations could go much further and probe the nature of dark energy by
distinguishing between different models on the basis of their perturbations,
not only their expansion histories.
","[{""version"":""v1"",""created"":""Wed, 18 Feb 2009 19:32:11 GMT""}]","2009-08-05"
"0902.3227","Saar Rahav","Saar Rahav, Shaul Mukamel","Gaussian phase-space representation of Fermion dynamics; Beyond the
  time-dependent-Hartree-Fock approximation","12 pages. Minor revision, reference added","Phys. Rev. B 79, 165103 (2009)","10.1103/PhysRevB.79.165103",,"cond-mat.other cond-mat.stat-mech","http://arxiv.org/licenses/nonexclusive-distrib/1.0/","  A Gaussian operator representation for the many body density matrix of
fermionic systems, developed by Corney and Drummond [Phys. Rev. Lett, v93,
260401 (2004)], is used to derive approximate decoupling schemes for their
dynamics. In this approach the reduced single electron density matrix elements
serve as stochastic variables which satisfy an exact Fokker-Planck equation.
The number of variables scales as ~N^2 rather than ~exp(N) with the basis set
size, and the time dependent Hartree Fock approximation (TDHF) is recovered in
the ""classical"" limit. An approximate closed set of equations of motion for the
one and two-particle reduced density matrices, provides a direct generalization
of the TDHF.
","[{""version"":""v1"",""created"":""Wed, 18 Feb 2009 19:37:53 GMT""},{""version"":""v2"",""created"":""Mon, 1 Jun 2009 19:03:56 GMT""}]","2009-06-01"
"0902.3228","Nathan Goldman","N. Goldman, A. Kubasiak, P. Gaspard and M. Lewenstein","Ultracold atomic gases in non-Abelian gauge potentials: The case of
  constant Wilson loop","12 pages, 2 appendices, 7 figures, extended version of
  arXiv:0712.2571","Phys.Rev.A79:023624,2009","10.1103/PhysRevA.79.023624",,"cond-mat.mes-hall hep-th quant-ph","http://arxiv.org/licenses/nonexclusive-distrib/1.0/","  Nowadays it is experimentally feasible to create artificial, and in
particular, non-Abelian gauge potentials for ultracold atoms trapped in optical
lattices. Motivated by this fact, we investigate the fundamental properties of
an ultracold Fermi gas in a non-Abelian U(2) gauge potential characterized by a
constant Wilson loop. Under this specific condition, the energy spectrum
exhibits a robust band structure with large gaps and reveals a new fractal
figure. The transverse conductivity is related to topological invariants and is
shown to be quantized when the Fermi energy lies inside a gap of the spectrum.
We demonstrate that the analogue of the integer quantum Hall effect for neutral
atoms survives the non-Abelian coupling and leads to a striking fractal phase
diagram. Moreover, this coupling induces an anomalous Hall effect as observed
in graphene.
","[{""version"":""v1"",""created"":""Wed, 18 Feb 2009 19:54:33 GMT""},{""version"":""v2"",""created"":""Fri, 27 Feb 2009 14:02:31 GMT""}]","2009-04-28"
"0902.3229","Jan Strube","Jan Strube and Marcel Stanitzki","Analysis of the Decay $e^{+} e^{-} \to \text{invisible} + H(\to \mu
  \mu)$ at a Collision Energy of 500 GeV","4 pages, presented at LCWS08 in Chicago",,,,"hep-ex","http://creativecommons.org/licenses/by/3.0/","  The analysis of $e^{+} e^{-} \to \text{invisible} + H(\to \mu \mu)$ at a next
generation linear collider presents an opportunity to study the coupling of the
Yukawa couplings of the second generation in a clean environment. We give an
overview over the experimental challenges of this analysis at a collision
energy of 500 GeV and present an outlook to the results of the analysis at a
collision energy of 250 GeV.
","[{""version"":""v1"",""created"":""Wed, 18 Feb 2009 20:04:17 GMT""}]","2009-02-19"
"0902.3230","Thierry Bastin","T. Bastin, S. Krins, P. Mathonet, M. Godefroid, L. Lamata, and E.
  Solano","Operational Families of Entanglement Classes for Symmetric $N$-Qubit
  States","Published version. Phys. Rev. Lett. 103, 070503 (2009)",,"10.1103/PhysRevLett.103.070503",,"quant-ph","http://arxiv.org/licenses/nonexclusive-distrib/1.0/","  We solve the entanglement classification under stochastic local operations
and classical communication (SLOCC) for all multipartite symmetric states in
the general $N$-qubit case. For this purpose, we introduce 2 parameters playing
a crucial role, namely the \emph{diversity degree} and the \emph{degeneracy
configuration} of a symmetric state. Those parameters give rise to a simple
method of identifying operational families of SLOCC entanglement classes of all
symmetric $N$-qubit states, where the number of families grows as the partition
function of the number of qubits.
","[{""version"":""v1"",""created"":""Wed, 18 Feb 2009 20:20:44 GMT""},{""version"":""v2"",""created"":""Thu, 30 Jul 2009 16:44:23 GMT""},{""version"":""v3"",""created"":""Wed, 2 Sep 2009 12:55:38 GMT""}]","2015-05-13"
"0902.3231","Bernhard Lauss","Bernhard Lauss","Fundamental measurements with muons - View from PSI","7 pages, 4 Figures Proceedings of the PANIC'08 Conference, Eilat,
  Israel, (invited talk)","Nucl.Phys.A827:401c-407c,2009","10.1016/j.nuclphysa.2009.05.086",,"nucl-ex hep-ex","http://arxiv.org/licenses/nonexclusive-distrib/1.0/","  Muons can serve as probes to precisely determine fundamental parameters of
the Standard Model or search for `new physics'. The high intensity muon beams
at the Paul Scherrer Institut (PSI) allow for precision measurements and
searches for rare or forbidden processes. Both types of experiments challenge
the Standard Model in a way complementary to high energy physics. We give a
short overview of recent results and ongoing experiments at PSI, and of ideas
for the future.
","[{""version"":""v1"",""created"":""Wed, 18 Feb 2009 20:14:46 GMT""}]","2010-02-25"
"0902.3232","Christos Tsagas","Christos G Tsagas","Large-scale peculiar motions and cosmic acceleration","Revised approach, discussion and references. To appear in MNRAS","Mon.Not.Roy.Astron.Soc.405:503, 2010","10.1111/j.1365-2966.2010.16460.x",,"astro-ph.CO gr-qc","http://arxiv.org/licenses/nonexclusive-distrib/1.0/","  Recent surveys seem to support bulk peculiar velocities well in excess of
those anticipated by the standard cosmological model. In view of these results,
we consider here some of the theoretical implications of large-scale drift
motions. We find that observers with small, but finite, peculiar velocities
have generally different expansion rates than the smooth Hubble flow. In
particular, it is possible for observers with larger than the average volume
expansion at their location, to experience apparently accelerated expansion
when the universe is actually decelerating. Analogous results have been
reported in studies of inhomogeneous (nonlinear) cosmologies and within the
context of the Lemaitre-Tolman-Bondi models. Here, they are obtained within the
linear regime of a perturbed, dust-dominated Friedmann-Robertson-Walker
cosmology.
","[{""version"":""v1"",""created"":""Wed, 18 Feb 2009 20:09:46 GMT""},{""version"":""v2"",""created"":""Thu, 25 Feb 2010 16:41:48 GMT""}]","2015-05-13"
"0902.3233","M. O. Goerbig","Z. Papi\'c, M. O. Goerbig, N. Regnault","Theoretical expectations for a fractional quantum Hall effect in
  graphene","6 pages, 1 figure; review article for Solid State Comm. (Graphene
  Week 2008)","Solid State Comm. 149, 1056 (2009)","10.1016/j.ssc.2009.02.050",,"cond-mat.mes-hall cond-mat.mtrl-sci","http://arxiv.org/licenses/nonexclusive-distrib/1.0/","  Due to its fourfold spin-valley degeneracy, graphene in a strong magnetic
field may be viewed as a four-component quantum Hall system. We investigate the
consequences of this particular structure on a possible, yet unobserved,
fractional quantum Hall effect in graphene within a trial-wavefunction approach
and exact-diagonalisation calculations. This trial-wavefunction approach
generalises an original idea by Halperin to account for the SU(2) spin in
semiconductor heterostructures with a relatively weak Zeeman effect. Whereas
the four-component structure at a filling factor nu=1/3 adds simply a
SU(4)-ferromagnetic spinor ordering to the otherwise unaltered Laughlin state,
the system favours a valley-unpolarised state at nu=2/5 and a completely
unpolarised state at nu=4/9. Due to the similar behaviour of the interaction
potential in the zero-energy graphene Landau level and the first excited one,
we expect these states to be present in both levels.
","[{""version"":""v1"",""created"":""Wed, 18 Feb 2009 20:11:26 GMT""}]","2009-06-08"
"0902.3234","Miguel Martin","Domingo Garcia (Valencia), Bogdan Grecu (Belfast), Manuel Maestre
  (Valencia), Miguel Martin (Granada), and Javier Meri (Granada)","Two-dimensional Banach spaces with Polynomial numerical index zero","12 pages, to appear in Linear Algebra Appl",,"10.1016/j.laa.2008.12.020",,"math.FA","http://arxiv.org/licenses/nonexclusive-distrib/1.0/","  We study two-dimensional Banach spaces with polynomial numerical indices
equal to zero.
","[{""version"":""v1"",""created"":""Wed, 18 Feb 2009 20:14:24 GMT""}]","2009-02-19"
"0902.3235","Diego Dalvit","Riccardo Messina, Diego A. R. Dalvit, Paulo A. Maia Neto, Astrid
  Lambrecht, and Serge Reynaud","Dispersive interactions between atoms and non planar surfaces","10 pages, 4 figures","Phys. Rev. A 80, 022119 (2009)","10.1103/PhysRevA.80.022119",,"quant-ph","http://arxiv.org/licenses/nonexclusive-distrib/1.0/","  We calculate the dispersive force between a ground state atom and a non
planar surface. We present explicit results for a corrugated surface, derived
from the scattering approach at first order in the corrugation amplitude. A
variety of analytical results are derived in different limiting cases,
including the van der Waals and Casimir-Polder regimes. We compute numerically
the exact first-order dispersive potential for arbitrary separation distances
and corrugation wavelengths, for a Rubidium atom on top of a silicon or gold
corrugated surface. We discuss in detail the inadequacy of the proximity force
approximation, and present a simple but adequate approximation for computing
the potential.
","[{""version"":""v1"",""created"":""Wed, 18 Feb 2009 20:30:22 GMT""},{""version"":""v2"",""created"":""Tue, 24 Feb 2009 18:13:11 GMT""}]","2015-05-13"
"0902.3236","Luis F. Rodriguez","Yolanda Gomez, Luis F. Rodriguez","A VLA Archive Observation of the Youngest Known Galactic Supernova
  Remnant G1.9+0.3","5 pages, 2 figures",,,,"astro-ph.GA astro-ph.HE","http://arxiv.org/licenses/nonexclusive-distrib/1.0/","  We present the analysis of an unpublished VLA archive observation made at
1.49 GHz in 1989 toward the supernova remnant G1.9+0.3, the youngest such
Galactic object known. This observation agrees with the time evolution in
angular size previously reported. We derive an expansion rate of 0.46 +- 0.11 %
per year and an age of 220+45-70 yr for the remnant by comparing the 1985 and
1989 images.
","[{""version"":""v1"",""created"":""Wed, 18 Feb 2009 20:48:56 GMT""}]","2009-02-19"
"0902.3237","Jean-Rene Gauthier","Jean-Rene Gauthier (1), Hsiao-Wen Chen (1), Jeremy L. Tinker (1,2)
  ((1) KICP/UChicago, (2) BCCP UC Berkeley)","The Clustering of MgII Absorption Systems at z=0.5 and Detection of Cold
  Gas in Massive Halos","15 pages, 7 figures, Accepted by ApJ","Astrophys.J.702:50-62,2009","10.1088/0004-637X/702/1/50",,"astro-ph.CO","http://arxiv.org/licenses/nonexclusive-distrib/1.0/","  We measure the large-scale clustering of MgII \lambda\lambda 2796,2803
absorbers with respect to a population of luminous red galaxies (LRGs) at z
\sim 0.5. From the cross-correlation measurements between MgII absorbers and
LRGs, we calculate the mean bias of the dark matter halos in which the
absorbers reside. We investigate systematic uncertainties in the clustering
measurements due to the sample selection of LRGs and due to uncertainties in
photometric redshifts. First, we compare the cross-correlation amplitudes
determined using a it flux-limited LRG sample and a volume-limited one. The
comparison shows that the relative halo bias of MgII absorbers using a
flux-limited LRG sample can be overestimated by as much as \approx 20%. Next,
we assess the systematic uncertainty due to photometric redshift errors using a
mock galaxy catalog with added redshift uncertainties comparable to the data.
We show that the relative clustering amplitude measured without accounting for
photometric redshift uncertainties is overestimated by \approx 10%. After
accounting for these two main uncertainties, we find a 1-\sigma
anti-correlation between mean halo bias and absorber strength that translates
into a 1-\sigma anti-correlation between mean galaxy mass and W_r(2796). The
results indicate that a significant fraction of the MgII absorber population of
W_r(2796)=1-1.5 \AA are found in group-size dark matter halos of log M_h <
13.4, whereas absorbers of W_r(2796)>1.5 \AA are seen in halos of log M_h
<12.7. A larger dataset would improve the precision of the clustering
measurements and the relationship between W_r and halo mass. Finally, the
strong clustering of MgII absorbers down to \sim 0.3 h^{-1} Mpc indicates the
presence of cool gas inside the virial radii of the halos hosting the LRGs.
","[{""version"":""v1"",""created"":""Wed, 18 Feb 2009 20:48:08 GMT""},{""version"":""v2"",""created"":""Tue, 30 Jun 2009 17:23:22 GMT""}]","2009-08-11"
"0902.3238","Mladen Georgiev","Mladen Georgiev","Transient and quantal nucleation in solids: a statistical approach","6 pages including 3 figures, all pdf",,,,"cond-mat.mtrl-sci","http://arxiv.org/licenses/nonexclusive-distrib/1.0/","  In a recent arXiv preprint we proposed a statistical approach to the quantal
effects in nucleation rate, addressed particularly to solid state physics. We
now turn to transient nucleation rates incorporating either classical or
quantal statistics. A similar method may be applied to tackle nucleation
problems in anyon systems in 2D solids.
","[{""version"":""v1"",""created"":""Wed, 18 Feb 2009 20:36:35 GMT""}]","2009-02-19"
"0902.3239","Simon Donaldson","Simon Donaldson and Ed Segal","Gauge Theory in higher dimensions, II",,,,,"math.DG","http://arxiv.org/licenses/nonexclusive-distrib/1.0/","  The main aim of the paper is to develop the ""Floer theory"" associated to
Calabi-Yau 3-folds, exending the analogy of Thomas' ""holomorphic Casson
invariant"". The treatment in the body of the paper is largely formal, assuming
appropriate compactness properties of moduli spaces of $G_{2}$-instantons, but
in the last section we make some remarks about these compactness isssues.
Section 3 of the paper contains a general dscussion of deformations of the
equations, for gauge field and submanifolds, associated to manifolds with
exceptional holonomy.
","[{""version"":""v1"",""created"":""Wed, 18 Feb 2009 20:40:33 GMT""}]","2009-02-19"
"0902.3240","Raymond Atta-Fynn","Raymond Atta-Fynn and Asok K. Ray","Does hybrid density functional theory predict a non-magnetic ground
  state for delta-Plutonium?","24 pages (double spaced), 5 figures, 1 table","Europhysics Letters 85, 27008 (2009)","10.1209/0295-5075/85/27008",,"cond-mat.mtrl-sci cond-mat.str-el","http://arxiv.org/licenses/nonexclusive-distrib/1.0/","  Hybrid density functionals, which replaces a fraction of density functional
theory (DFT) exchange with exact Hartree-Fock (HF) exchange, have been used to
study the structural, magnetic, and electronic properties of delta-Plutonium.
The fractions of exact Hartree-Fock exchange used were 25%, 40%, and 55%.
Compared to the pure PBE functional, the lattice constants expanded with
respect to the experimental value when the PBE-HF hybrid functionals were
applied. A non-magnetic ground state was realized for 55% HF contribution;
otherwise the ground state was anti-ferromagnetic. The 5f electrons tend to
exhibit slight delocalization or itinerancy for the pure PBE functional and
well-defined localization for the hybrid functionals, with the degree of 5f
electron localization increasing with the amount of HF exchange. Overall, the
performance of the hybrid density functionals do not seem superior to pure
density functionals for delta-Plutonium.
","[{""version"":""v1"",""created"":""Wed, 18 Feb 2009 20:53:37 GMT""}]","2009-11-13"
"0902.3241","Hubert  Bray","Hubert L. Bray","The Penrose inequality in general relativity and volume comparison
  theorems involving scalar curvature (thesis)","(111 pages, 8 figures) This posting is my thesis (Stanford, 1997). I
  have not gotten around to publishing these results as of 2009, although I
  have always had the intention to do so. Since multiple papers have cited this
  thesis, I am posting it here","H. L. Bray, ""The Penrose inequality in general relativity and
  volume comparison theorems involving scalar curvature,"" thesis, Stanford
  University (1997)",,,"math.DG math-ph math.MP","http://arxiv.org/licenses/nonexclusive-distrib/1.0/","  In this thesis we describe how minimal surface techniques can be used to
prove the Penrose inequality in general relativity for two classes of
3-manifolds. We also describe how a new volume comparison theorem involving
scalar curvature for 3-manifolds follows from these same techniques.
","[{""version"":""v1"",""created"":""Wed, 18 Feb 2009 23:10:41 GMT""}]","2009-02-20"
"0902.3242","Ka-Ming Tam","Shi-Quan Su, Ka-Ming Tam, Hai-Qing Lin","Evolution of pairing from weak to strong coupling on a honeycomb lattice","5 pages","Phys. Rev. B 80, 104517 (2009)","10.1103/PhysRevB.80.104517",,"cond-mat.str-el","http://arxiv.org/licenses/nonexclusive-distrib/1.0/","  We study the evolution of the pairing from weak to strong coupling on a
honeycomb lattice by Quantum Monte Carlo. We show numerical evidence of the
BCS-BEC crossover as the coupling strength increases on a honeycomb lattice
with small fermi surface by measuring a wide range of observables: double
occupancy, spin susceptibility, local pair correlation, and kinetic energy.
Although at low energy, the model sustains Dirac fermions, we do not find
significant qualitative difference in the BCS-BEC crossover as compared to
those with an extended Fermi surface, except at weak coupling, BCS regime.
","[{""version"":""v1"",""created"":""Wed, 18 Feb 2009 21:00:38 GMT""},{""version"":""v2"",""created"":""Thu, 27 Aug 2009 21:53:06 GMT""}]","2011-06-07"
"0902.3243","Vladimir Privman","Vyacheslav Gorshkov, Alexandr Zavalov, Vladimir Privman","Shape Selection in Diffusive Growth of Colloids and Nanoparticles","PDF, 37 pages, 16 figures","Langmuir 25, 7940-7953 (2009)","10.1021/la900613p",,"cond-mat.stat-mech cond-mat.soft","http://arxiv.org/licenses/nonexclusive-distrib/1.0/","  We report numerical investigations of a three-dimensional model of diffusive
growth of fine particles, the internal structure of which corresponds to
different crystal lattices. A growing cluster (particle) is immersed in, and
exchanges monomer building blocks with a surrounding medium of diffusing
(off-lattice) monomers. On-surface dynamics of the latter is accounted for by
allowing, in addition to detachment, monomer motion to the neighboring vacant
crystal sites, according to probabilistic rules mimicking local thermalization.
The key new feature of our model is the focus on the growth of a single
cluster, emerging as a crystalline core, without development of defects that
can control large-scale growth modes. This single, defect-free core growth is
imposed by the specific dynamical rules assumed. Our results offer a possible
explanation of the experimentally observed shape uniformity, i.e., fixed,
approximately even-sized proportions, in synthesis of uniform colloids and
nanoparticles. We demonstrate the basic principles of well-defined particle
shape emergence in such growth. Specifically, several shapes are possible for a
given crystal structure. Formation of shapes that follow the crystal symmetry
and are uniform, can be a result of the nonequilibrium nature of the growth
process. The shape of a growing particle can be controlled by varying the
relative rates of kinetic processes, as well as by adjusting the concentration
of monomers in the surrounding medium.
","[{""version"":""v1"",""created"":""Wed, 18 Feb 2009 21:00:39 GMT""},{""version"":""v2"",""created"":""Sat, 23 May 2009 14:21:02 GMT""}]","2010-10-12"
"0902.3244","Antonio H. Castro Neto","A. H. Castro Neto and F. Guinea","Impurity induced spin-orbit coupling in graphene","4 pages, 6 figures","Phys. Rev. Lett. 103, 026804 (2009)","10.1103/PhysRevLett.103.026804",,"cond-mat.mtrl-sci","http://arxiv.org/licenses/nonexclusive-distrib/1.0/","  We study the effect of impurities in inducing spin-orbit coupling in
graphene. We show that the sp3 distortion induced by an impurity can lead to a
large increase in the spin-orbit coupling with a value comparable to the one
found in diamond and other zinc-blende semiconductors. The spin-flip scattering
produced by the impurity leads to spin scattering lengths of the order found in
recent experiments. Our results indicate that the spin-orbit coupling can be
controlled via the impurity coverage.
","[{""version"":""v1"",""created"":""Thu, 19 Feb 2009 13:35:47 GMT""}]","2013-05-29"
