"0902.4787","Gian Luigi Alberghi","G.L.Alberghi","CMB: A Look Inside the Inflaton","4 figures",,,,"gr-qc","http://arxiv.org/licenses/nonexclusive-distrib/1.0/","  We show that if the field seeding the formation of the cosmic structures is a
dynamically arising bosonic condensate, the features we observe in the CMB
might be interpreted as a manifestation of its compositeness.
","[{""version"":""v1"",""created"":""Fri, 27 Feb 2009 10:02:55 GMT""}]","2009-03-02"
"0902.4788","Evert Stenlund","P. Christiansen, E.Haslum and E. Stenlund","On number-ratio fluctuations in high-energy particle-production","14 pages with 4 figures",,"10.1103/PhysRevC.80.034903",,"hep-ex","http://arxiv.org/licenses/nonexclusive-distrib/1.0/","  In this paper we will discuss the previously proposed quantity nu_dyn[1], as
a measure of the number-ratio fluctuations in high-energy particle-production.
We will show that nu_dyn has pleasing mathematical properties making it ideal
for the purpose. We will demonstrate its relation to two-particle correlations
and how this measure can be generalized to higher order correlations.
","[{""version"":""v1"",""created"":""Fri, 27 Feb 2009 10:06:26 GMT""}]","2015-05-13"
"0902.4789","Kai Johannes Keller","Kai Johannes Keller","Euclidean Epstein-Glaser Renormalization","30 pages, 1 figure, to be published in JMP, relation to standard
  approach added, appendix added, proofs enhanced, typos corrected","J. Math. Phys. 50:103503 (2009)","10.1063/1.3202415","DESY 09-031, ZMP-HH/09-6","math-ph hep-th math.MP","http://arxiv.org/licenses/nonexclusive-distrib/1.0/","  In the framework of perturbative Algebraic Quantum Field Theory (pAQFT),
recently introduced by Brunetti, Duetsch and Fredenhagen, I give a general
construction of so-called ""Euclidean time-ordered products"", i.e. algebraic
versions of the Schwinger functions, for scalar quantum field theories on
spaces of Euclidean signature. This is done by generalizing the recursive
construction of time-ordered products by Epstein and Glaser, originally
formulated for quantum field theories on Minkowski space (MQFT). An essential
input of Epstein-Glaser renormalization is the causal structure of Minkowski
space. The absence of this causal structure in the Euclidean framework makes it
necessary to modify the original construction of Epstein and Glaser at two
points. First, the whole construction has to be performed with an only
partially defined product on (interaction-) functionals. This is due to the
fact that the fundamental solutions of the Helmholtz operator of EQFT have a
unique singularity structure, i.e. they are unique up to a smooth part. Second,
one needs to (re-)introduce a (rather natural) ""Euclidean causality"" condition
for the recursion of Epstein and Glaser to be applicable.
","[{""version"":""v1"",""created"":""Fri, 27 Feb 2009 11:25:41 GMT""},{""version"":""v2"",""created"":""Mon, 21 Sep 2009 09:19:42 GMT""}]","2010-02-26"
"0902.4790","Angom Dilip Singh","K. V. P. Latha, D. Angom, B. P. Das and D. Mukherjee","Probing CP violation with the electric dipole moment of atomic mercury","4 pages and 1 figure","Phys. Rev. Lett. 103, 083001 (2009).","10.1103/PhysRevLett.103.083001",,"physics.atom-ph hep-ph physics.chem-ph physics.comp-ph","http://arxiv.org/licenses/nonexclusive-distrib/1.0/","  The electric dipole moment of atomic $^{199}$Hg induced by the nuclear Schiff
moment and tensor-pseudotensor electron-nucleus interactions has been
calculated. For this, we have developed and employed a novel method based on
the relativistic coupled-cluster theory. The results of our theoretical
calculations combined with the latest experimental result of $^{199}$Hg
electric dipole moment, provide new bounds on the T reversal or CP violation
parameters $\theta_{\rm QCD}$, the tensor-pseudotensor coupling constant $C_T$
and $(\widetilde{d}_u - \widetilde{d}_d)$. This is the most accurate
calculation of these parameters to date. We highlight the the crucial role of
electron correlation effects in their interplay with the P,T violating
interactions. Our results demonstrate substantial changes in the results of
earlier calculations of these parameters which can be attributed to the more
accurate inclusion of important correlation effects in the present work.
","[{""version"":""v1"",""created"":""Fri, 27 Feb 2009 13:59:52 GMT""}]","2009-12-29"
"0902.4791","Diego Gotz","D. Gotz, N. Rea, S. Zane, R. Turolla, M. Lyutikov","Modelling magnetars' high energy emission through Resonant Cyclotron
  Scattering","12 pages, 4 figures, presented at the 7th INTEGRAL Workshop ""An
  INTEGRAL View of Compact Objects"", 8-11 September 2008, to be published by
  PoS","PoS Integral08:102,2008",,,"astro-ph.HE","http://arxiv.org/licenses/nonexclusive-distrib/1.0/","  We present a systematic fit of a model of resonant cyclotron scattering (RCS)
to the X and soft gamma-ray data of four magnetars, including anomalous X-ray
pulsars, and soft gamma repeaters. In this scenario, non-thermal magnetar
spectra in the soft X-rays result from resonant cyclotron scattering of the
thermal surface emission by hot magnetospheric plasma. We find that this model
can successfully account for the soft X-ray emission of magnetars, while an
additional component is still required to model the hard X-ray persistent
magnetar emission recently discovered by INTEGRAL. The latter is an important
component in terms of magnetars' luminosity, and cannot be neglected when
modelling the soft X-ray part of the spectrum.
","[{""version"":""v1"",""created"":""Fri, 27 Feb 2009 10:33:59 GMT""}]","2010-04-30"
"0902.4792","Yuki Endo","Yuki Endo and Tetsuro Nikuni","Population Dynamics of a Spin-1 Bose Gas Above the Bose-Einstein
  Transition Temperature","6pages,1figure",,"10.1143/JPSJ.78.094005",,"cond-mat.other","http://arxiv.org/licenses/nonexclusive-distrib/1.0/","  We study population dynamics of a trapped spin-1 Bose gas above the
Bose-Einstein transition temperature. Starting from the semiclassical kinetic
equation for a spin-1 gas, we derive a coupled rate equations for the
populations of internal states. Solving the rate equations, we discuss the
dynamical evolution of spin populations. We also estimate the characteristic
timescale in which the system reaches equilibrium. Finally, we briefly discuss
how the presence of the condensate will affect the population dynamics.
","[{""version"":""v1"",""created"":""Fri, 27 Feb 2009 10:46:30 GMT""}]","2015-05-13"
"0902.4793","Yuanbo Zhang","Yuanbo Zhang, Victor W. Brar, Caglar Girit, Alex Zettl, Michael F.
  Crommie","Origin of Spatial Charge Inhomogeneity in Graphene",,,"10.1038/nphys1365",,"cond-mat.mtrl-sci","http://arxiv.org/licenses/nonexclusive-distrib/1.0/","  In an ideal graphene sheet charge carriers behave as two-dimensional (2D)
Dirac fermions governed by the quantum mechanics of massless relativistic
particles. This has been confirmed by the discovery of a half-integer quantum
Hall effect in graphene flakes placed on a SiO2 substrate. The Dirac fermions
in graphene, however, are subject to microscopic perturbations that include
topographic corrugations and electron density inhomogeneities (i.e. charge
puddles). Such perturbations profoundly alter Dirac fermion behavior, with
implications for their fundamental physics as well as for future graphene
device applications. Here we report a new technique of Dirac point mapping that
we have used to determine the origin of charge inhomogeneities in graphene. We
find that fluctuations in graphene charge density are not caused by
topographical corrugations, but rather by charge-donating impurities below the
graphene. These impurities induce unexpected standing wave patterns due to
supposedly forbidden back-scattering of Dirac fermions. Such wave patterns can
be continuously modulated by electric gating. Our observations provide new
insight into impurity scattering of Dirac fermions and the microscopic
mechanisms limiting electronic mobility in graphene.
","[{""version"":""v1"",""created"":""Fri, 27 Feb 2009 10:32:25 GMT""}]","2015-05-13"
"0902.4794","Gabriele Anzolin","G. Anzolin, F. Tamburini, A. Bianchini, C. Barbieri","Method to measure off-axis displacements based on the analysis of the
  intensity distribution of a vortex beam","8 pages, 4 figures. Accepted for publication in PRA",,"10.1103/PhysRevA.79.033845",,"physics.optics","http://arxiv.org/licenses/nonexclusive-distrib/1.0/","  We study the properties of the Fraunhofer diffraction patterns produced by
Gaussian beams crossing spiral phase plates. We show, both analytically and
numerically, that off-axis displacements of the input beam produce asymmetric
diffraction patterns. The intensity profile along the direction of maximum
asymmetry shows two different peaks. We find that the intensity ratio between
these two peaks decreases exponentially with the off-axis displacement of the
incident beam, the decay being steeper for higher strengths of the optical
singularity of the spiral phase plate. We analyze how this intensity ratio can
be used to measure small misalignments of the input beam with a very high
precision.
","[{""version"":""v1"",""created"":""Fri, 27 Feb 2009 10:54:40 GMT""}]","2010-07-21"
"0902.4795","Roland Diehl","Roland Diehl","Particle Acceleration in Cosmic Sites - Astrophysics Issues in our
  Understanding of Cosmic Rays","accepted for publication in EPJD, topical issue on Fundamental
  physics and ultra-high laser fields. From review talk at ""Extreme Light
  Infrastructure"" workshop, Sep 2008. Version-2 May 2009: adjust some wordings
  and references at EPJD proofs stage","Eur.Phys.J.D55:509-518,2009","10.1140/epjd/e2009-00183-8",,"astro-ph.HE","http://arxiv.org/licenses/nonexclusive-distrib/1.0/","  Laboratory experiments to explore plasma conditions and stimulated particle
acceleration can illuminate aspects of the cosmic particle acceleration
process. Here we discuss the cosmic-ray candidate source object variety, and
what has been learned about their particle-acceleration characteristics. We
identify open issues as discussed among astrophysicists. -- The cosmic ray
differential intensity spectrum is a rather smooth power-law spectrum, with two
kinks at the ""knee"" (~10^15 eV) and at the ""ankle"" (~3 10^18 eV). It is unclear
if these kinks are related to boundaries between different dominating sources,
or rather related to characteristics of cosmic-ray propagation. We believe that
Galactic sources dominate up to 10^17 eV or even above, and the extragalactic
origin of cosmic rays at highest energies merges rather smoothly with Galactic
contributions throughout the 10^15--10^18 eV range. Pulsars and supernova
remnants are among the prime candidates for Galactic cosmic-ray production,
while nuclei of active galaxies are considered best candidates to produce
ultrahigh-energy cosmic rays of extragalactic origin. Acceleration processes
are related to shocks from violent ejections of matter from energetic sources
such as supernova explosions or matter accretion onto black holes. Details of
such acceleration are difficult, as relativistic particles modify the structure
of the shock, and simple approximations or perturbation calculations are
unsatisfactory. This is where laboratory plasma experiments are expected to
contribute, to enlighten the non-linear processes which occur under such
conditions.
","[{""version"":""v1"",""created"":""Fri, 27 Feb 2009 10:58:35 GMT""},{""version"":""v2"",""created"":""Wed, 10 Jun 2009 17:35:33 GMT""}]","2009-12-15"
"0902.4796","S. N. Lahiri","S. N. Lahiri, S. Sun","A Berry--Esseen theorem for sample quantiles under weak dependence","Published in at http://dx.doi.org/10.1214/08-AAP533 the Annals of
  Applied Probability (http://www.imstat.org/aap/) by the Institute of
  Mathematical Statistics (http://www.imstat.org)","Annals of Applied Probability 2009, Vol. 19, No. 1, 108-126","10.1214/08-AAP533","IMS-AAP-AAP533","math.PR","http://arxiv.org/licenses/nonexclusive-distrib/1.0/","  This paper proves a Berry--Esseen theorem for sample quantiles of
strongly-mixing random variables under a polynomial mixing rate. The rate of
normal approximation is shown to be $O(n^{-1/2})$ as $n\to\infty$, where $n$
denotes the sample size. This result is in sharp contrast to the case of the
sample mean of strongly-mixing random variables where the rate $O(n^{-1/2})$ is
not known even under an exponential strong mixing rate. The main result of the
paper has applications in finance and econometrics as financial time series
data often are heavy-tailed and quantile based methods play an important role
in various problems in finance, including hedging and risk management.
","[{""version"":""v1"",""created"":""Fri, 27 Feb 2009 10:48:27 GMT""}]","2009-03-02"
"0902.4797","Arnau Riera","J. I. Latorre, V. Pic\'o and A. Riera","Quantum algorithm for the Laughlin wave function","4 pages, 5 figures",,"10.1103/PhysRevA.81.060309",,"quant-ph cond-mat.mes-hall hep-th","http://arxiv.org/licenses/nonexclusive-distrib/1.0/","  We construct a quantum algorithm that creates the Laughlin state for an
arbitrary number of particles $n$ in the case of filling fraction one. This
quantum circuit is efficient since it only uses $n(n-1)/2$ local qudit gates
and its depth scales as $2n-3$. We further prove the optimality of the circuit
using permutation theory arguments and we compute exactly how entanglement
develops along the action of each gate. Finally, we discuss its experimental
feasibility decomposing the qudits and the gates in terms of qubits and two
qubit-gates as well as the generalization to arbitrary filling fraction.
","[{""version"":""v1"",""created"":""Fri, 27 Feb 2009 10:56:13 GMT""}]","2013-05-29"
"0902.4798","Paul de Jong","P. de Jong","Top Physics at the LHC","6 pages, 8 figures. Contribution to the proceedings of Heavy Quarks
  and Leptons, Melbourne, 2008",,,,"hep-ex","http://arxiv.org/licenses/nonexclusive-distrib/1.0/","  The LHC will be a top quark factory. In this note, the central role of the
top quark for LHC physics will be discussed, and an overview will be given of
the studies of top quark properties in preparation, with an emphasis on the
systematic uncertainties that will dominate most measurements.
","[{""version"":""v1"",""created"":""Fri, 27 Feb 2009 11:03:09 GMT""}]","2009-03-02"
"0902.4799","Burkhard Kleihaus","Burkhard Kleihaus, Jutta Kunz, Claus Laemmerzahl, Meike List","Charged Boson Stars and Black Holes","13 pages, 5 figures","Phys.Lett.B675:102-115,2009","10.1016/j.physletb.2009.03.066",,"gr-qc","http://arxiv.org/licenses/nonexclusive-distrib/1.0/","  We consider boson stars and black holes in scalar electrodynamics with a
V-shaped scalar potential. The boson stars come in two types, having either
ball-like or shell-like charge density. We analyze the properties of these
solutions and determine their domains of existence. When mass and charge become
equal, the space-times develop a throat. The shell-like solutions need not be
globally regular, but may possess a horizon. The space-times then consist of a
Schwarzschild-type black hole in the interior, surrounded by a shell of charged
matter, and thus a Reissner-Nordstroem-type space-time in the exterior. These
solutions violate black hole uniqueness. The mass of the black hole solutions
is related to the mass of the regular shell-like solutions by a mass formula of
the type first obtained within the isolated horizon framework.
","[{""version"":""v1"",""created"":""Fri, 27 Feb 2009 11:07:47 GMT""}]","2010-11-22"
"0902.4800","Sergey Ivashkovich","S. Ivashkovich, J.-P. Rosay","Boundary Values and Boundary Uniqueness of $J$-Holomorphic Mapping",,,,,"math.CV math.SG","http://arxiv.org/licenses/nonexclusive-distrib/1.0/","  We establish a Fatou-type Theorem for $J$-holomorphic mappings that are
bounded in an appropriate sense and we prove the Blaschke condition for their
zero sets. We also prove a Privalov-type uniqueness Theorem for pairs of
$J$-holomorphic mappings.
","[{""version"":""v1"",""created"":""Fri, 27 Feb 2009 11:15:56 GMT""}]","2009-03-02"
"0902.4801","Yashwant Singh Prof.","Swarn Lata Singh and Yashwant Singh","Crystallization of Simple Fluids: Relative Stability of f.c.c. and b.c.c
  Structures","9 pages, 2 figures","Europhys. Lett. 88,16005 (2009)","10.1209/0295-5075/88/16005",,"cond-mat.soft cond-mat.stat-mech","http://arxiv.org/licenses/nonexclusive-distrib/1.0/","  A free-energy functional for a crystal that contains both the symmetry
conserved and symmetry broken parts of the direct pair correlation function is
developed. The free-energy functional is used to investigate the
crystallization of fluids interacting via the inverse power potential ;
$u(r)=\epsilon {(\sigma/r)}^n$. In agreement with simulation results we find
that for $n=12$ the freezing is into close packed f.c.c structure while for
soft repulsions $(n\leq 6)$ b.c.c phase is more stable.
","[{""version"":""v1"",""created"":""Fri, 27 Feb 2009 11:17:25 GMT""}]","2015-05-13"
"0902.4802","Alessandro Sozzetti","A. Sozzetti (1,2), G. Torres (1), D.W. Latham (1), R.P. Stefanik (1),
  S.G. Korzennik (1), A.P. Boss (3), B.W. Carney (4), J.B. Laird (5) ((1)
  Harvard-Smithsonian Center for Astrophysics, (2) INAF - Osservatorio
  Astronomico di Torino, (3) Carnegie Institution of Washington, (4) University
  of North Carolina at Chapel Hill, (5) Bowling Green State University)","A Keck HIRES Doppler Search for Planets Orbiting Metal-Poor Dwarfs. II.
  On the Frequency of Giant Planets in the Metal-Poor Regime","59 pages, 7 tables, 8 figures. Accepted for publication in the
  Astrophysical Journal","Astrophys.J.697:544-556,2009","10.1088/0004-637X/697/1/544",,"astro-ph.EP","http://arxiv.org/licenses/nonexclusive-distrib/1.0/","  We present an analysis of three years of precision radial velocity
measurements of 160 metal-poor stars observed with HIRES on the Keck 1
telescope. We report on variability and long-term velocity trends for each star
in our sample. We identify several long-term, low-amplitude radial-velocity
variables worthy of follow-up with direct imaging techniques. We place lower
limits on the detectable companion mass as a function of orbital period. Our
survey would have detected, with a 99.5% confidence level, over 95% of all
companions on low-eccentricity orbits with velocity semi-amplitude K > 100 m/s,
or M_p*sin(i) > 3.0 M_JUP*(P/yr)^(1/3), for orbital periods P< 3 yr. None of
the stars in our sample exhibits radial-velocity variations compatible with the
presence of Jovian planets with periods shorter than the survey duration. The
resulting average frequency of gas giants orbiting metal-poor dwarfs with -2.0
< [Fe/H] < -0.6 is f_p<0.67% (at the 1-sigma confidence level). We examine the
implications of this null result in the context of the observed correlation
between the rate of occurrence of giant planets and the metallicity of their
main-sequence solar-type stellar hosts. By combining our dataset with the
Fischer & Valenti (2005) uniform sample, we confirm that the likelihood of a
star to harbor a planet more massive than Jupiter within 2 AU is a steeply
rising function of the host's metallicity. However, the data for stars with
-1.0 < [Fe/H] < 0.0 are compatible, in a statistical sense, with a constant
occurrence rate f_p~1%. Our results can usefully inform theoretical studies of
the process of giant planet formation across two orders of magnitude in
metallicity.
","[{""version"":""v1"",""created"":""Fri, 27 Feb 2009 11:32:54 GMT""}]","2011-02-11"
"0902.4803","Steven Gratton","George Efstathiou, Steven Gratton and Francesco Paci","Impact of Galactic polarized emission on B-mode detection at low
  multipoles","20 pages, 10 figures",,"10.1111/j.1365-2966.2009.14995.x",,"astro-ph.CO","http://arxiv.org/licenses/nonexclusive-distrib/1.0/","  We use a model of polarized Galactic emission developed by the the Planck
collaboration to assess the impact of foregrounds on B-mode detection at low
multipoles. Our main interest is to applications of noisy polarization data and
in particular to assessing the feasibility of B-mode detection by Planck. This
limits the complexity of foreground subtraction techniques that can be applied
to the data. We analyze internal linear combination techniques and show that
the offset caused by the dominant E-mode polarization pattern leads to a
fundamental limit of r approximately 0.1 for the tensor-scalar ratio even in
the absence of instrumental noise. We devise a simple, robust, template fitting
technique using multi-frequency polarization maps. We show that template
fitting using Planck data alone offers a feasible way of recovering primordial
B-modes from dominant foreground contamination, even in the presence of noise
on the data and templates. We implement and test a pixel-based scheme for
computing the likelihood function of cosmological parameters at low multipoles
that incorporates foreground subtraction of noisy data.
","[{""version"":""v1"",""created"":""Fri, 27 Feb 2009 11:36:58 GMT""}]","2015-05-13"
"0902.4804","Hong Tu","H. TU, R. Gavazzi, M. Limousin, R. Cabanac, P. J. Marshall, B. Fort,
  T. Treu, R. P\'ello, E. Jullo, J. -P. Kneib, J. -F. Sygnet","The mass profile of early-type galaxies in overdense environments: the
  case of the double source plane gravitational lens SL2SJ02176-0513","10 pages, 6 figures, submitted to A&A",,"10.1051/0004-6361/200911963",,"astro-ph.CO","http://arxiv.org/licenses/nonexclusive-distrib/1.0/","  SL2SJ02176-0513 is a remarkable lens for the presence of two multiply-imaged
systems at different redshifts lensed by a foreground massive galaxy at $z_{\rm
lens}=0.656$: a bright cusp arc at $z_{\rm arc}=1.847$ and an additional
double-image system at an estimated redshift of $z_{\rm dbl}\sim2.9$ based on
photometry and lensing geometry. The system is located about 400 kpc away from
the center of a massive group of galaxies. Mass estimates for the group are
available from X-ray observations and satellite kinematics. Multicolor
photometry provides an estimate of the stellar mass of the main lens galaxy.
The lensing galaxy is modeled with two components (stars and dark matter), and
we include the perturbing effect of the group environment, and all available
constraints. We find that classic lensing degeneracies, e.g. between external
convergence and mass density slope, are significantly reduced with respect to
standard systems and infer tight constraints on the mass density profile: (i)
the dark matter content of the main lens galaxy is in line with that of typical
galaxies $f_{\rm dm}(<R_{\rm e})=0.41^{+0.09}_{-0.06}$; (ii) the required mass
associated with the dark matter halo of the nearby group is consistent with
X-ray and weak-lensing estimates ($\sigma_{\rm grp}=550^{+130}_{-240}$); (iii)
accounting for the group contribution in the form of an external convergence,
the slope of the mass density profile of the main lens galaxy alone is found to
be $\alpha=-1.03^{+0.22}_{-0.16}$, consistent with the isothermal ($\alpha=-1$)
slope. We demonstrate that multiple source plane systems together with good
ancillary dataset can be used to disentangle local and environmental effects.
","[{""version"":""v1"",""created"":""Fri, 27 Feb 2009 11:37:48 GMT""}]","2015-05-13"
"0902.4805","Nikolaos Stefanis","N. G. Stefanis","Taming Landau singularities in QCD perturbation theory: The analytic
  approach 2.0","v3: 23 pages, 7 figures, Invited topical article published in
  Particles and Nuclei with update using the CERN Higgs discovery. Abridged
  version presented as plenary talk at International Conference on
  Renormalization Group and Related Topics (RG 2008), Dubna, Russia, September
  1 - 5, 2008. v4 typo in Eq. (3) corrected","Physics of Particles and Nuclei, Vol. 44, No. 3, pp. 494-509
  (2013)","10.1134/S1063779613030155","RUB-TPII-01/09/2012","hep-ph hep-th","http://arxiv.org/licenses/nonexclusive-distrib/1.0/","  The aim of this topical article is to outline the fundamental ideas
underlying the recently developed Fractional Analytic Perturbation Theory
(FAPT) of QCD and present its main calculational tools together with key
applications. For this, it is first necessary to review previous methods to
apply QCD perturbation theory at low spacelike momentum scales, where the
influence of the Landau singularities becomes inevitable. Several concepts are
considered and their limitations are pointed out. The usefulness of FAPT is
discussed in terms of two characteristic hadronic quantities: the
perturbatively calculable part of the pion's electromagnetic form factor in the
spacelike region and the Higgs-boson decay into a $b\bar b$ pair in the
timelike region. In the first case, the focus is on the optimization of the
prediction with respect to the choice of the renormalization scheme and the
dependence on the renormalization and the factorization scales. The second case
serves to show that the application of FAPT to this reaction reaches already at
the four-loop level an accuracy of the order of 1%, avoiding difficulties
inherent in the standard perturbative expansion. The obtained results are
compared with estimates from fixed-order and contour-improved QCD perturbation
theory. Using the brand-new Higgs mass value of about 125 GeV, measured at the
Large Hadron Collider (CERN), a prediction for $\Gamma_{H\to b\bar{b}}=2.4 \pm
0.15 {\rm MeV}$ is extracted.
","[{""version"":""v1"",""created"":""Fri, 27 Feb 2009 14:54:51 GMT""},{""version"":""v2"",""created"":""Sat, 7 Mar 2009 17:21:17 GMT""},{""version"":""v3"",""created"":""Thu, 9 May 2013 16:33:55 GMT""},{""version"":""v4"",""created"":""Wed, 10 Feb 2016 11:01:35 GMT""}]","2016-02-11"
