"0902.4668","Victor Przyjalkowski","Victor Przyjalkowski","Weak Landau-Ginzburg models for smooth Fano threefolds","The paper is joined with arXiv:0911.5428 and improved. For the
  previous version of the paper see arXiv:0902.4668v2. The polynomial for
  double Veronese cone is corrected. The paper is dedicated to the memory of my
  teacher V. A. Iskovskikh","Izv. Math., 77:4 (2013), 772-794",,,"math.AG","http://arxiv.org/licenses/nonexclusive-distrib/1.0/","  The paper is joined with arXiv:0911.5428 and improved.
  We prove that Landau-Ginzburg models for all 17 smooth Fano threefolds with
Picard rank 1 can be represented as Laurent polynomials in 3 variables
exhibiting them case by case. We check that these Landau-Ginzburg models can be
compactified to open Calabi-Yau varieties. In the spirit of L. Katzarkov's
program we prove that numbers of irreducible components of the central fibers
of compactifications of these pencils are dimensions of intermediate Jacobians
of Fano varieties plus 1. In particular these numbers do not depend on
compactifications. We state most of known methods of finding Landau-Ginzburg
models in terms of Laurent polynomials. We discuss Laurent polynomial
representation of Landau-Ginzburg models of Fano varieties and state some
problems related to it.
","[{""version"":""v1"",""created"":""Thu, 26 Feb 2009 19:05:24 GMT""},{""version"":""v2"",""created"":""Wed, 17 Jun 2009 20:10:37 GMT""},{""version"":""v3"",""created"":""Tue, 23 Oct 2012 17:52:58 GMT""}]","2018-08-07"
"0902.4669","Nicolas Yunes","Nicolas Yunes and Frans Pretorius","Dynamical Chern-Simons Modified Gravity I: Spinning Black Holes in the
  Slow-Rotation Approximation","13 pages, no figures, replaced with version accepted for publication
  in Phys. Rev. D. This version corrects a minor typo in Eq. 1 of the published
  version","Phys.Rev.D79:084043,2009","10.1103/PhysRevD.79.084043",,"gr-qc astro-ph.CO astro-ph.HE hep-th","http://arxiv.org/licenses/nonexclusive-distrib/1.0/","  The low-energy limit of string theory contains an anomaly-canceling
correction to the Einstein-Hilbert action, which defines an effective theory:
Chern-Simons (CS) modified gravity. The CS correction consists of the product
of a scalar field with the Pontryagin density, where the former can be treated
as a background field (non-dynamical formulation) or as an evolving field
(dynamical formulation). Many solutions of general relativity persist in the
modified theory; a notable exception is the Kerr metric, which has sparked a
search for rotating black hole solutions. Here, for the first time, we find a
solution describing a rotating black hole within the dynamical framework, and
in the small-coupling/slow-rotation limit. The solution is axisymmetric and
stationary, constituting a deformation of the Kerr metric with dipole scalar
""hair,"" whose effect on geodesic motion is to weaken the frame-dragging effect
and shift the location of the inner-most stable circular orbit outwards
(inwards) relative to Kerr for co-rotating (counter-rotating) geodesics. We
further show that the correction to the metric scales inversely with the fourth
power of the radial distance to the black hole, suggesting it will escape any
meaningful bounds from weak-field experiments. For example, using binary pulsar
data we can only place an initial bound on the magnitude of the dynamical
coupling constant of $\xi^{1/4} \lesssim 10^{4} {\textrm{km}}$. More stringent
bounds will require observations of inherently strong-field phenomena.
","[{""version"":""v1"",""created"":""Thu, 26 Feb 2009 19:18:59 GMT""},{""version"":""v2"",""created"":""Wed, 22 Apr 2009 15:40:21 GMT""},{""version"":""v3"",""created"":""Sun, 16 Aug 2009 13:30:37 GMT""}]","2009-10-29"
"0902.4670","Andrew Sutherland","Gaetan Bisson and Andrew V. Sutherland","Computing the endomorphism ring of an ordinary elliptic curve over a
  finite field","16 pages (minor edits)","Journal of Number Theory 113 (2011), 815-831","10.1016/j.jnt.2009.11.003",,"math.NT","http://arxiv.org/licenses/nonexclusive-distrib/1.0/","  We present two algorithms to compute the endomorphism ring of an ordinary
elliptic curve E defined over a finite field F_q. Under suitable heuristic
assumptions, both have subexponential complexity. We bound the complexity of
the first algorithm in terms of log q, while our bound for the second algorithm
depends primarily on log |D_E|, where D_E is the discriminant of the order
isomorphic to End(E). As a byproduct, our method yields a short certificate
that may be used to verify that the endomorphism ring is as claimed.
","[{""version"":""v1"",""created"":""Thu, 26 Feb 2009 19:01:16 GMT""},{""version"":""v2"",""created"":""Tue, 17 Mar 2009 15:49:49 GMT""}]","2012-06-26"
"0902.4671","Julia C. Lee","Julia C. Lee (Harvard), Randall K. Smith (SAO), C.R.Canizares,
  E.Costantini, C.de Vries, J. Drake, E.Dwek, R.Edgar, A.M.Juett, A.Li,
  C.Lisse, F.Paerels, D.Patnaude, B.Ravel, N.S. Schulz, T.P.Snow, L.A.Valencic,
  J.Wilms, J.Xiang","Solid State Astrophysics: Probing Interstellar Dust and Gas Properties
  with X-rays","8 pages, 6 figures. White paper submitted to the Astro2010 Decadal
  survey for Astronomy and Astrophysics",,,,"astro-ph.HE astro-ph.GA astro-ph.IM","http://arxiv.org/licenses/nonexclusive-distrib/1.0/","  The abundances of gas and dust (solids and complex molecules) in the
interstellar medium (ISM) as well as their composition and structures impact
practically all of astrophysics. Fundamental processes from star formation to
stellar winds to galaxy formation all scale with the number of metals. However,
significant uncertainties remain in both absolute and relative abundances, as
well as how these vary with environment, e.g., stellar photospheres versus the
interstellar medium (ISM). While UV, optical, IR, and radio studies have
considerably advanced our understanding of ISM gas and dust, they cannot
provide uniform results over the entire range of column densities needed. In
contrast, X-rays will penetrate gas and dust in the cold (3K) to hot
(100,000,000K) Universe over a wide range of column densities (log NH=20-24
cm^-2), imprinting spectral signatures that reflect the individual atoms which
make up the gas, molecule or solid. *X-rays therefore are a powerful and viable
resource for delving into a relatively unexplored regime for determining gas
abundances and dust properties such as composition, charge state, structure,
and quantity via absorption studies, and distribution via scattering halos.*
","[{""version"":""v1"",""created"":""Thu, 26 Feb 2009 20:26:37 GMT""}]","2009-02-27"
"0902.4672","Yongseok Oh","K. Nakayama, Yongseok Oh, H. Haberzettl","Combined analysis of eta and eta-prime hadro- and photo-production off
  nucleons","8 pages, Presented at the International Symposium on Meson Physics,
  Oct. 1-4, 2008, Krakow, Poland","Acta Phys.Polon.Supp.2:23-30,2009",,,"nucl-th","http://arxiv.org/licenses/nonexclusive-distrib/1.0/","  The production of $\eta$ and $\eta^\prime$ mesons in photon- and
hadron-induced reactions are studied in a combined analysis based on an
effective Lagrangian approach in order to learn about the relevant production
mechanisms and the possible role of nucleon resonances in these reactions.
","[{""version"":""v1"",""created"":""Thu, 26 Feb 2009 19:09:22 GMT""}]","2009-05-07"
"0902.4673","Thilo Kopp","Thilo Kopp and Jochen Mannhart","Calculation of the Capacitances of Conductors -- Perspectives for the
  Optimization of Electronic Devices",,"J. Appl. Phys. 106, 064504 (2009)","10.1063/1.3197246",,"cond-mat.mtrl-sci","http://arxiv.org/licenses/nonexclusive-distrib/1.0/","  The equation describing the capacitance of capacitors is determined. It is
shown that by optimizing the material of the conducting electrodes, the
capacitance of capacitors reaching the quantum regime can be substantially
enhanced or reduced. Dielectric capacitors with negative total capacitances are
suggested and their properties analyzed. Resulting perspectives to enhance the
performance of electronic devices are discussed.
","[{""version"":""v1"",""created"":""Thu, 26 Feb 2009 18:05:19 GMT""},{""version"":""v2"",""created"":""Tue, 9 Jun 2009 13:10:58 GMT""}]","2015-05-13"
"0902.4674","Jos\'e M. Figueroa-O'Farrill","Paul de Medeiros, Jos\'e Figueroa-O'Farrill, Elena M\'endez-Escobar
  and Patricia Ritter","Metric 3-Lie algebras for unitary Bagger-Lambert theories","38 pages","JHEP 0904:037,2009","10.1088/1126-6708/2009/04/037","EMPG-09-02","hep-th math.RA math.RT","http://arxiv.org/licenses/nonexclusive-distrib/1.0/","  We prove a structure theorem for finite-dimensional indefinite-signature
metric 3-Lie algebras admitting a maximally isotropic centre. This algebraic
condition indicates that all the negative-norm states in the associated
Bagger-Lambert theory can be consistently decoupled from the physical Hilbert
space. As an immediate application of the theorem, new examples beyond index 2
are constructed. The lagrangian for the Bagger-Lambert theory based on a
general physically admissible 3-Lie algebra of this kind is obtained. Following
an expansion around a suitable vacuum, the precise relationship between such
theories and certain more conventional maximally supersymmetric gauge theories
is found. These typically involve particular combinations of N=8 super
Yang-Mills and massive vector supermultiplets. A dictionary between the 3-Lie
algebraic data and the physical parameters in the resulting gauge theories will
thereby be provided.
","[{""version"":""v1"",""created"":""Thu, 26 Feb 2009 19:19:01 GMT""}]","2009-05-07"
"0902.4675","Donald James Priour jr","D. J. Priour Jr","A Convenient Alternative for Series Manipulation via the Translation
  Operator","6 pages, 1 figure",,,,"math-ph math.MP","http://arxiv.org/licenses/nonexclusive-distrib/1.0/","  We derive and discuss a technique for manipulating power series which is
complementary to standard procedures. We begin with the translation operator,
but we express the operator as an infinite product instead of expanding it as a
series and we apply combinatorial arguments to generate the terms in the series
in an efficient manner with a minimum of clutter and intermediate calculations.
The method is effective for developing multivariate expansions, and may also be
used to manipulate series, e.g. in operations where one must take the
reciprocal of a power series or raise it to a power that may be fractional or
irrational. In the case of two component perturbations, we obtain analytic
expressions for the expansion coefficients. We use our technique to generate an
electrostatic multipole expansion as a demonstration of its utility in
producing coefficients of special functions such as the Legendre and Hermite
polynomials.
","[{""version"":""v1"",""created"":""Thu, 26 Feb 2009 19:22:29 GMT""}]","2009-02-27"
"0902.4676","Gabriel Germ\'an","Graham G Ross, Gabriel German","Hybrid natural inflation from non Abelian discrete symmetry","Accepted for publication in Phys. Lett. B","Phys.Lett.B684:199-204,2010","10.1016/j.physletb.2010.01.003",,"hep-ph astro-ph.CO gr-qc","http://arxiv.org/licenses/nonexclusive-distrib/1.0/","  A spontaneously broken global discrete symmetry may have pseudo Goldstone
modes associated with the spontaneous breaking of the approximate continuous
symmetry of the low dimension terms in the Lagrangian. These provide natural
candidates for an inflaton that can generate slow roll inflation. We show that,
in the case of a non Abelian discrete symmetry, the pseudo Goldstone modes
readily couple to further scalar fields in a manner that the end of inflation
is determined by these additional scalar fields, generating hybrid inflation.
We give a simple parameterisation of the inflationary potential in this case,
determine the inflationary parameters resulting, and show that phenomenological
successful inflation is possible while keeping the scale of symmetry breaking
sub-Plankian. Unlike natural inflation the inflation scale can be very low. We
construct two simple hybrid inflation models, one non supersymmetric and one
supersymmetric. In the latter case no parameters need be chosen anomalously
small.
","[{""version"":""v1"",""created"":""Thu, 26 Feb 2009 19:23:40 GMT""},{""version"":""v2"",""created"":""Wed, 6 Jan 2010 18:20:24 GMT""}]","2014-11-18"
"0902.4677","Jon M. Miller","J. M. Miller (1), P. Uttley (2), K. Nandra (3), D. Barret (4), G. Matt
  (5), F. Paerels (6), M. Mendez (7), M. Diaz Trigo (8), M. Cappi (9), S.
  Kitamoto (10), M. Nowak (11), J. Wilms (12), R. Rothschild (13), R. Smith
  (14), M. Weisskopf (15), Y. Terashima (16), Y. Ueda (17) ((1) University of
  Michigan, (2) University of Southampton, (3) Imperial College London, (4)
  CESR Toulouse, (5) Universita degli Studi Roma Tre, (6) Columbia University,
  (7) University of Groningen, (8) ESA/ESAC, (9) INAF-IASF Bologna, (10) Rikkyo
  University, (11) MIT, (12) Dr. Karl-Remeis-Sternwarte, Bamberg, and Erlangen
  Center for Astroparticle Physics, (13) UCSD, (14) Harvard-Smithsonian CfA,
  (15) NASA/MSFC, (16) ISAS, (17) University of Kyoto)","Stellar-Mass Black Holes and Their Progenitors","Astro 2010 Science White Paper",,,,"astro-ph.HE astro-ph.SR","http://arxiv.org/licenses/nonexclusive-distrib/1.0/","  If a black hole has a low spin value, it must double its mass to reach a high
spin parameter. Although this is easily accomplished through mergers or
accretion in the case of supermassive black holes in galactic centers, it is
impossible for stellar-mass black holes in X-ray binaries. Thus, the spin
distribution of stellar-mass black holes is almost pristine, largely reflective
of the angular momentum imparted at the time of their creation. This fact can
help provide insights on two fundamental questions: What is the nature of the
central engine in supernovae and gamma-ray bursts? and What was the spin
distribution of the first black holes in the universe?
","[{""version"":""v1"",""created"":""Thu, 26 Feb 2009 19:31:55 GMT""}]","2009-02-27"
"0902.4678","Fabio Riccioni","Fabio Riccioni and Peter West","Local E(11)","LaTeX file, 71 pages, 5 figures, references added, typos corrected","JHEP 0904:051,2009","10.1088/1126-6708/2009/04/051","KCL-MTH-09-02","hep-th","http://arxiv.org/licenses/nonexclusive-distrib/1.0/","  We give a method of deriving the field-strengths of all massless and massive
maximal supergravity theories in any dimension starting from the Kac-Moody
algebra $E_{11}$. Considering the subalgebra of $E_{11}$ that acts on the
fields in the non-linear realisation as a global symmetry, we show how this is
promoted to a gauge symmetry enlarging the algebra by the inclusion of
additional generators. We show how this works in eleven dimensions, and we call
the resulting enlarged algebra $E_{11}^{local}$. Torus reduction to $D$
dimensions corresponds to taking a subalgebra of $E_{11}^{local}$, called
$E_{11,D}^{local}$, that encodes the full gauge algebra of the corresponding
$D$-dimensional massless supergravity. We show that each massive maximal
supergravity in $D$ dimensions is a non-linear realisation of an algebra
$\tilde{E}_{11,D}^{local}$. We show how this works in detail for the case of
Scherk-Schwarz reduction of IIB to nine dimensions, and in particular we show
how $\tilde{E}_{11,9}^{local}$ arises as a subalgebra of the algebra
$E_{11,10B}^{local}$ associated to the ten-dimensional IIB theory. This
subalgebra corresponds to taking a combination of generators which is different
to the massless case. We then show that $\tilde{E}_{11,D}^{local}$ appears as a
deformation of the massless algebra $E_{11,D}^{local}$ in which the commutation
relations between the $E_{11}$ and the additional generators are modified. We
explicitly illustrate how the deformed algebra is constructed in the case of
massive IIA and of gauged five-dimensional supergravity. These results prove
the naturalness and power of the method.
","[{""version"":""v1"",""created"":""Thu, 26 Feb 2009 19:37:30 GMT""},{""version"":""v2"",""created"":""Mon, 16 Mar 2009 17:52:43 GMT""}]","2009-05-07"
"0902.4679","Caterina Stoppato","G. Gentili, C. Stoppato","Power series and analyticity over the quaternions","18 pages, 3 figures","Math. Ann., 352(1): 113--131 (online 2011)","10.1007/s00208-010-0631-2",,"math.CV","http://arxiv.org/licenses/nonexclusive-distrib/1.0/","  We study power series and analyticity in the quaternionic setting. We first
consider a function f defined as the sum of a quaternionic power series
centered at 0 in its domain of convergence (which is a ball B(0,R) centered at
0). At each point p of this ball, f admits expansions in terms of appropriately
defined 'regular power series centered at p'. The expansion holds in a ball
Sigma(p, R-|p|), defined with respect to a (non-Euclidean) distance sigma. We
thus say that f is 'sigma-analytic' in B(0,R). Furthermore, we remark that
Sigma(p, R-|p|) is not always an Euclidean neighborhood of p; when it is, we
say that f is 'quaternionic analytic' at p. It turns out that f is quaternionic
analytic only near the real axis.
  We then relate these notions of anayticity to the class of regular
quaternionic functions introduced in Adv. Math. 216 (2007), 279-301, and
recently extended. Indeed, sigma-analyticity proves equivalent to regularity,
in the same way as complex analyticity is equivalent to holomorphy. Hence the
theory of regular quaternionic functions, which is quickly developing, reveals
a new feature that reminds the nice properties of holomorphic complex
functions.
","[{""version"":""v1"",""created"":""Thu, 26 Feb 2009 19:47:09 GMT""},{""version"":""v2"",""created"":""Mon, 7 Sep 2009 17:24:56 GMT""}]","2012-02-03"
"0902.4680","Martin White","David Schlegel, Martin White, Daniel Eisenstein (with input from the
  SDSS-III collaboration)","The Baryon Oscillation Spectroscopic Survey: Precision measurements of
  the absolute cosmic distance scale","Unpublished SDSS-III white paper for the US Decadal Survey. See
  http://www.sdss3.org for details of the international SDSS-III project",,,,"astro-ph.CO astro-ph.GA","http://arxiv.org/licenses/nonexclusive-distrib/1.0/","  BOSS, the Baryon Oscillation Spectroscopic Survey, is a 5-year program to
measure the absolute cosmic distance scale and expansion rate with
percent-level precision at redshifts z<0.7 and z~2.5. BOSS uses the ""standard
ruler"" provided by baryon acoustic oscillations (BAO). BOSS will achieve a near
optimal measurement of the BAO scale at z<0.7, with a redshift survey of 1.5
million luminous galaxies. It will pioneer a new method of BAO measurement at
high redshift, using the LyA forest to 160,000 QSOs in the redshift range
2.1<z<3.0. The forecast measurement precision for angular diameter distance d_A
is 1.0%, 1.0%, and 1.5% at z=0.35, 0.6, and 2.5, respectively, and the forecast
precision for the Hubble parameter H(z) is 1.8%, 1.7%, and 1.2% at the same
redshifts. These measurements will provide powerful constraints on the nature
of dark energy and the curvature of space, complementing the constraints
obtained from other probes. BOSS will also provide a superb data set for
studying large- and small-scale clustering, the evolution of massive galaxies
and the luminosity function and clustering of QSOs at 2.3 < z < 6.5. BOSS is
one of four surveys that comprise SDSS-III (the Sloan Digital Sky Survey III),
a 6-year program that will use highly multiplexed spectrographs on the 2.5-m
Sloan Foundation Telescope to investigate cosmological parameters, the history
and structure of the Milky Way galaxy, and the population of giant planet
systems.
","[{""version"":""v1"",""created"":""Thu, 26 Feb 2009 19:41:42 GMT""}]","2009-02-27"
"0902.4681","Farid Salama","AAS WGLA: Nancy Brickhouse, John Cowan, Paul Drake, Steven Federman,
  Gary Ferland, Adam Frank, Eric Herbst, Keith Olive, Farid Salama, Daniel Wolf
  Savin, Lucy Ziurys","New Discoveries in Galaxies across Cosmic Time through Advances in
  Laboratory Astrophysics","White paper submitted by the AAS Working Group on Laboratory
  Astrophysics (WGLA) to the GCT SFP of the Astronomy and Astrophysics Decadal
  Survey (Astro2010)",,,,"astro-ph.IM astro-ph.GA","http://arxiv.org/licenses/nonexclusive-distrib/1.0/","  As the Galaxies across Cosmic Time (GCT) panel is fully aware, the next
decade will see major advances in our understanding of these areas of research.
To quote from their charge, these advances will occur in studies of the
formation, evolution, and global properties of galaxies and galaxy clusters, as
well as active galactic nuclei and QSOs, mergers, star formation rate, gas
accretion, and supermassive black holes. Central to the progress in these areas
are the corresponding advances in laboratory astrophysics that are required for
fully realizing the GCT scientific opportunities within the decade 2010-2020.
Laboratory astrophysics comprises both theoretical and experimental studies of
the underlying physics that produce the observed astrophysical processes. The 5
areas of laboratory astrophysics that we have identified as relevant to the CFP
panel are atomic, molecular, solid matter, plasma, nuclear, and particle
physics. In this white paper, we describe in Section 2 some of the new
scientific opportunities and compelling scientific themes that will be enabled
by advances in laboratory astrophysics. In Section 3, we provide the scientific
context for these opportunities. Section 4 briefly discusses some of the
experimental and theoretical advances in laboratory astrophysics required to
realize the GCT scientific opportunities of the next decade. As requested in
the Call for White Papers, Section 5 presents four central questions and one
area with unusual discovery potential. Lastly, we give a short postlude in
Section 6.
","[{""version"":""v1"",""created"":""Thu, 26 Feb 2009 19:41:45 GMT""}]","2012-08-27"
"0902.4682","Claus-Peter Wirth","Claus-Peter Wirth, Joerg Siekmann, Christoph Benzmueller, Serge
  Autexier","Lectures on Jacques Herbrand as a Logician","ii + 82 pages",,,"SEKI Report SR-2009-01","cs.LO cs.AI","http://arxiv.org/licenses/nonexclusive-distrib/1.0/","  We give some lectures on the work on formal logic of Jacques Herbrand, and
sketch his life and his influence on automated theorem proving. The intended
audience ranges from students interested in logic over historians to logicians.
Besides the well-known correction of Herbrand's False Lemma by Goedel and
Dreben, we also present the hardly known unpublished correction of Heijenoort
and its consequences on Herbrand's Modus Ponens Elimination. Besides Herbrand's
Fundamental Theorem and its relation to the Loewenheim-Skolem-Theorem, we
carefully investigate Herbrand's notion of intuitionism in connection with his
notion of falsehood in an infinite domain. We sketch Herbrand's two proofs of
the consistency of arithmetic and his notion of a recursive function, and last
but not least, present the correct original text of his unification algorithm
with a new translation.
","[{""version"":""v1"",""created"":""Thu, 26 Feb 2009 19:59:17 GMT""},{""version"":""v2"",""created"":""Fri, 27 Feb 2009 18:29:54 GMT""},{""version"":""v3"",""created"":""Tue, 12 May 2009 19:09:43 GMT""},{""version"":""v4"",""created"":""Thu, 30 Jun 2011 18:43:12 GMT""},{""version"":""v5"",""created"":""Tue, 27 May 2014 08:58:06 GMT""}]","2014-05-28"
"0902.4683","Jon M. Miller","J. M. Miller (1), M. Nowak (2), K. Nandra (3), W. N. Brandt (4), G.
  Matt (5), M. Cappi (6), G. Risaliti (7), S. Kitamoto (8), F. Paerels (9), M.
  Watson (10), R. Smith (11), M. Weisskopf (12), Y. Terashima (13), Y. Ueda
  (14) ((1) University of Michigan, (2) MIT, (3) Imperial College London, (4)
  Pennsylvania State University, (5) Universita degli Studi Roma Tre, (6)
  INAF-IASF Bologna, (7) INAF Arcetri, (8) Rikkyo University, (9) Columbia
  University, (10) University of Leicester, (11) Harvard-Smithsonian CfA, (12)
  NASA/MSFC, (13) ISAS, (14) University of Kyoto)","Fundamental Accretion and Ejection Astrophysics","Astro 2010 Science White Paper",,,,"astro-ph.HE astro-ph.CO","http://arxiv.org/licenses/nonexclusive-distrib/1.0/","  Disk accretion may be the fundamental astrophysical process. Stars and
planets form through the accretion of gas in a disk. Black holes and galaxies
co-evolve through efficient disk accretion onto the central supermassive black
hole. Indeed, approximately 20 percent of the ionizing radiation in the
universe is supplied by disk accretion onto black holes. And large-scale
structures - galaxy clusters - are dramatically affected by the relativistic
jets that result from accretion onto black holes. Yet, we are still searching
for observational answers to some very basic questions that underlie all
aspects of the feedback between black holes and their host galaxies: How do
disks transfer angular momentum to deliver gas onto compact objects? How do
accretion disks launch winds and jets?
","[{""version"":""v1"",""created"":""Thu, 26 Feb 2009 19:50:33 GMT""}]","2009-02-27"
