"0902.4720","Richard Wilman","R. J. Wilman, A. C. Edge, A. M. Swinbank","Integral field spectroscopy of ionized and molecular gas in cool cluster
  cores: evidence for cold feedback?","16 pages, 16 figures, accepted by MNRAS",,"10.1111/j.1365-2966.2009.14674.x",,"astro-ph.GA","http://arxiv.org/licenses/nonexclusive-distrib/1.0/","  We present VLT-SINFONI K-band IFU spectroscopy of the central galaxies in the
cool core clusters A1664, A2204 and PKS 0745-191, to probe the Pa-alpha and
ro-vibrational H2 line emission. In A1664 the two emission-line velocity
systems seen in our previous H-alpha data appear in both Pa-alpha and H2
emission, with notable morphological differences. The recession velocity of the
red component of Pa-alpha increases linearly with decreasing radius,
particularly along an 8 kpc filament aligned with the major axis of the
underlying galaxy and the cluster X-ray emission. These kinematics are modelled
as gravitational free-fall as gas cools rapidly out of the hot phase. In A2204
the gas shows 3 or 4 filaments reaching 10 kpc, three of which lie towards
`ghost bubbles' seen in X-ray imaging. For PKS 0745-191, we confirm the
twin-arm morphology of previous narrow-band images; the Pa-alpha kinematics
suggest rotational motion about an axis aligned with the kpc-scale radio jet;
on nucleus, we find a broad Pa-alpha component (FWHM 1700 km/s) and a secondary
H2 system redshifted by +500 km/s.
  The H2 v=1-0 S(3)/Pa-alpha ratio is highest in isolated and extended regions
where it matches the levels in the NGC 1275 filaments as modelled by Ferland et
al. Regions with lower ratios highlight active star formation and are often
kinematically quiescent (FWHM < 200 km/s). Our findings suggest that these
clusters may be captured in different stages of the `cold feedback' cycle of
Pizzolato & Soker, with A1664 in a brief phase of extreme cooling and star
formation prior to an AGN heating event; PKS 0745-191 in outburst with the AGN
accreting from a cool gas disk, and A2204 in a later phase where cool gas is
dragged out of the galaxy by the buoyant rise of old radio bubbles (abridged).
","[{""version"":""v1"",""created"":""Thu, 26 Feb 2009 22:46:41 GMT""}]","2009-11-13"
"0902.4721","Daniel Lenski","Daniel R. Lenski, Adrian Southard, Michael S. Fuhrer","Frequency-dependent complex conductivity of an organic thin-film
  transistor","13 pages, 4 figures","Appl. Phys. Lett. 94, 232103 (2009)","10.1063/1.3153159",,"cond-mat.mtrl-sci","http://arxiv.org/licenses/nonexclusive-distrib/1.0/","  We measure the complex impedance between source/drain electrodes and the gate
electrode of a pentacene thin-film transistor (TFT) at frequencies 50 Hz <
omega/2pi < 20 kHz. Modeling the TFT as a distributed RC network (RC
transmission line), we find that the data cannot be explained by a model
including only a real, frequency-independent sheet conductivity. Instead, we
use the RC transmission line model to extract the frequency-dependent complex
sheet conductivity sigma(omega) = sigma'(omega) + jsigma""(omega) of the
pentacene film. At high frequencies, sigma(omega) increases with frequency,
sigma'(omega) and sigma""(omega) become similar in magnitude, and the on/off
ratio is significantly reduced.
","[{""version"":""v1"",""created"":""Thu, 26 Feb 2009 23:00:09 GMT""},{""version"":""v2"",""created"":""Mon, 30 Mar 2009 23:02:46 GMT""},{""version"":""v3"",""created"":""Mon, 18 May 2009 21:27:46 GMT""}]","2009-06-10"
"0902.4722","Richard Bouzerar","Richard Bouzerar and Georges Bouzerar","On the reliability of recent Monte Carlo studies of dilute systems of
  localized spins interacting with itinerant carriers","11 figures, submitted to Phys. Rev",,"10.1088/1367-2630/12/5/053042",,"cond-mat.dis-nn cond-mat.str-el","http://arxiv.org/licenses/nonexclusive-distrib/1.0/","  In this paper, we discuss magnetic properties of dilute systems of localized
spins interacting with itinerant carriers. More precisely, we compare recent
available Monte Carlo results with our two step approach (TSA) calculations.
The TSA consists first on the determination of the magnetic couplings and then
on a proper treatment of the resulting effective dilute Heisenberg Hamiltonian.
We show important disagreement between the Monte Carlo results (in principle
exact) and our TSA calculations. We analyze the origins and shed light on the
reasons of those dissensions. In contrast to one could expect, we demonstrate
that the available MC calculations suffer from severe numerical shortcomings.
More precisely, (i) the finite size effects appear to be huge in dilute
systems, (ii) the statistical sampling (disorder configurations) was far too
small, and (iii) the determination of the Curie temperature was too rough. In
addition, we provide new arguments to explain a recent disagreement between the
Monte Carlo simulations and TSA for the model study of the well known III-V
diluted magnetic semiconductor Ga$_{1-x}$Mn$_{x}$As. We hope that this work
will motivate new systematic large scale Monte Carlo calculations.
","[{""version"":""v1"",""created"":""Thu, 26 Feb 2009 22:58:11 GMT""},{""version"":""v2"",""created"":""Fri, 12 Jun 2009 11:11:35 GMT""}]","2015-05-13"
"0902.4723","Joerg Endrullis","Joerg Endrullis, Herman Geuvers, Hans Zantema","Degrees of Undecidability in Rewriting",,,,,"cs.LO cs.CC","http://arxiv.org/licenses/nonexclusive-distrib/1.0/","  Undecidability of various properties of first order term rewriting systems is
well-known. An undecidable property can be classified by the complexity of the
formula defining it. This gives rise to a hierarchy of distinct levels of
undecidability, starting from the arithmetical hierarchy classifying properties
using first order arithmetical formulas and continuing into the analytic
hierarchy, where also quantification over function variables is allowed.
  In this paper we consider properties of first order term rewriting systems
and classify them in this hierarchy. Weak and strong normalization for single
terms turn out to be Sigma-0-1-complete, while their uniform versions as well
as dependency pair problems with minimality flag are Pi-0-2-complete. We find
that confluence is Pi-0-2-complete both for single terms and uniform.
Unexpectedly weak confluence for ground terms turns out to be harder than weak
confluence for open terms. The former property is Pi-0-2-complete while the
latter is Sigma-0-1-complete (and thereby recursively enumerable).
  The most surprising result is on dependency pair problems without minimality
flag: we prove this to be Pi-1-1-complete, which means that this property
exceeds the arithmetical hierarchy and is essentially analytic.
","[{""version"":""v1"",""created"":""Thu, 26 Feb 2009 22:59:29 GMT""}]","2009-03-02"
"0902.4725","Nikolaj Thomas Zinner","C. \""Ozen and N. T. Zinner","Mapping the Two-Component Atomic Fermi Gas to the Nuclear Shell-Model","13 pages, 3 figures. Final version","Eur. Phys. J. D (2014) 68: 225","10.1140/epjd/e2014-40687-4",,"nucl-th cond-mat.str-el","http://arxiv.org/licenses/nonexclusive-distrib/1.0/","  The physics of a two-component cold fermi gas is now frequently addressed in
laboratories. Usually this is done for large samples of tens to hundreds of
thousands of particles. However, it is now possible to produce few-body systems
(1-100 particles) in very tight traps where the shell structure of the external
potential becomes important. A system of two-species fermionic cold atoms with
an attractive zero-range interaction is analogous to a simple model of nucleus
in which neutrons and protons interact only through a residual pairing
interaction. In this article, we discuss how the problem of a two-component
atomic fermi gas in a tight external trap can be mapped to the nuclear shell
model so that readily available many-body techniques in nuclear physics, such
as the Shell Model Monte Carlo (SMMC) method, can be directly applied to the
study of these systems. We demonstrate an application of the SMMC method by
estimating the pairing correlations in a small two-component Fermi system with
moderate-to-strong short-range two-body interactions in a three-dimensional
harmonic external trapping potential.
","[{""version"":""v1"",""created"":""Thu, 26 Feb 2009 23:31:15 GMT""},{""version"":""v2"",""created"":""Tue, 31 Jul 2012 09:25:05 GMT""},{""version"":""v3"",""created"":""Thu, 14 Aug 2014 14:52:43 GMT""}]","2014-08-15"
"0902.4726","Alvaro Bustinduy","Alvaro Bustinduy","Complete holomorphic vector fields on C^2 whose underlying foliation is
  polynomial","The original publication is available at this http URL:
  http://www.worldscinet.com/ijm/21/2103/S0129167X102103.html","Int. J. Math. 21(3) (2010), 333--347","10.1142/S0129167X10006057",,"math.CV math.AG","http://arxiv.org/licenses/nonexclusive-distrib/1.0/","  We extend the classification of complete polynomial vector fields on C^2
given by Marco Brunella (Topology 43(2): 433-445, 2004) to cover the case of
holomorphic (non-polynomial) vector fields whose underlying foliation is
however still polynomial.
","[{""version"":""v1"",""created"":""Thu, 26 Feb 2009 23:36:52 GMT""},{""version"":""v2"",""created"":""Fri, 29 Oct 2010 16:18:48 GMT""}]","2010-11-13"
"0902.4727","Paul Cally","Paul S. Cally","Magnetic and Thermal Phase Shifts in the Local Helioseismology of
  Sunspots","11 pages, 11 figures (3 colour), 1 table. Accepted by MNRAS",,"10.1111/j.1365-2966.2009.14708.x",,"astro-ph.SR","http://arxiv.org/licenses/nonexclusive-distrib/1.0/","  Phase perturbations due to inclined surface magnetic field of active region
strength are calculated numerically in quiet Sun and simple sunspot models in
order to estimate and compare the direct and indirect (thermal) effects of the
fields on helioseismic waves. It is found that the largest direct effects occur
in highly inclined field characteristic of penumbrae, and scale roughly
linearly with magnetic field strength. The combined effects of sunspot magnetic
and thermal anomalies typically yield negative travel-time perturbations in
penumbrae. Travel-time shifts in umbrae depend on details of how the thermal
and density structure differs from the quiet Sun. The combined shifts are
generally not well approximated by the sum of the thermal and magnetic effects
applied separately, except at low field strengths of around 1 kG or less, or if
the thermal shift is small. A useful rule-of-thumb appears to be that
travel-time perturbations in umbrae are predominantly thermal, whereas in
penumbrae they are mostly magnetic.
","[{""version"":""v1"",""created"":""Thu, 26 Feb 2009 23:37:46 GMT""}]","2009-11-13"
"0902.4728","Boyd Blackwell","B.D. Blackwell, D.G. Pretty, J. Howard, R. Nazikian, S.T.A. Kumar, D.
  Oliver, D. Byrne, J.H. Harris, C.A. Nuhrenberg, M. McGann, R.L. Dewar, F.
  Detering, M. Hegland, G.I. Potter, J.W. Read","Configurational Effects on Alfvenic modes and Confinement in the H-1NF
  Heliac","Expanded form of paper Ex/P9-11 presented at the 22nd IAEA Fusion
  Energy Conference, Geneva, Switzerland, 2008, and submitted to Nuclear Fusion
  for Publication",,,,"physics.plasm-ph physics.data-an","http://arxiv.org/licenses/nonexclusive-distrib/1.0/","  The flexible Heliac coil set of helical axis stellarator H-1 (R=1m,
<r>~0.15-0.2 m) permits access to a wide range of magnetic configurations.
Surprisingly, in the absence of any obvious population of energetic particles,
Alfven modes normally associated with energetic populations in larger fusion
experiments are observed. Using H-1's unique combination of flexibility and
advanced diagnostics, RF-generated plasma in H-1 is shown to have a very
complex dependence on configuration of both the electron density and
fluctuations in the MHD Alfven range. Magnetic fluctuations range from highly
coherent, often multi-frequency, to approaching broad-band (df/f ~ 0.02-0.5),
in the range 1-200 kHz. Application of datamining techniques to a wide range of
configurations classifies these fluctuations and extracts poloidal and toroidal
mode numbers, revealing that a significant class of fluctuations exhibit
scaling which is i) Alfvenic with electron density (within a constant factor)
and ii) shear Alfvenic in rotational transform. This is confirmed by scans
within a single pulse, which can follow mode conversions. An array of optical
and interferometric diagnostics is combined with the magnetic probe arrays to
provide initial information on the internal structure of the MHD modes, and
associated 3D effects. The configurational dependence is closely related to the
presence of low order rational surfaces; density falls to very low values near,
but not precisely at these rational values. Results from a uniquely accurate
magnetic field mapping system, combined with a comprehensive model of the
vacuum magnetic field in H-1 show that magnetic islands should not dominate the
confinement of the configuration, and indicate that the dependence of density
on configuration may be attributable to plasma generation effects.
","[{""version"":""v1"",""created"":""Fri, 27 Feb 2009 07:58:11 GMT""}]","2009-09-30"
"0902.4729","Gregory Norgard","Gregory Norgard and Kamran Mohseni","An Examination of Homentropic Euler Equations with Averaged
  Characteristics",,,,,"physics.flu-dyn","http://arxiv.org/licenses/nonexclusive-distrib/1.0/","  This paper examines the properties of the homentropic Euler equations when
the characteristics of the equations have been spatially averaged. The new
equations are referred to as the characteristically averaged homentropic Euler
(CAHE) equations. An existence and uniqueness proof for the modified equations
is given. The speed of shocks for the CAHE equations are determined. The
Riemann problem is examined and a general form of the solutions is presented.
Finally, numerically simulations on the homentropic Euler and CAHE equations
are conducted and the behaviors of the two sets of equations are compared.
","[{""version"":""v1"",""created"":""Thu, 26 Feb 2009 23:48:41 GMT""},{""version"":""v2"",""created"":""Thu, 30 Apr 2009 19:46:45 GMT""}]","2009-04-30"
"0902.4730","Saul Youssef","Saul Youssef, John Brunelle, John Huth, David C. Parkes, Margo Seltzer
  and Jim Shank","Minimal Economic Distributed Computing",,,,,"cs.DC","http://arxiv.org/licenses/nonexclusive-distrib/1.0/","  In an ideal distributed computing infrastructure, users would be able to use
diverse distributed computing resources in a simple coherent way, with
guaranteed security and efficient use of shared resources in accordance with
the wishes of the owners of the resources. Our strategy for approaching this
ideal is to first find the simplest structure within which these goals can
plausibly be achieved. This structure, we find, is given by a particular
recursive distributive lattice freely constructed from a presumed partially
ordered set of all data in the infrastructure. Minor syntactic adjustments to
the resulting algebra yields a simple language resembling a UNIX shell, a
concept of execution and an interprocess protocol. Persons, organizations and
servers within the system express their interests explicitly via a hierarchical
currency. The currency provides a common framework for treating authentication,
access control and resource sharing as economic problems while also introducing
a new dimension for improving the infrastructure over time by designing system
components which compete with each other to earn the currency. We explain these
results, discuss experience with an implementation called egg and point out
areas where more research is needed.
","[{""version"":""v1"",""created"":""Fri, 27 Feb 2009 00:00:55 GMT""}]","2009-03-02"
"0902.4731","Robert Brandenberger","Robert H. Brandenberger (McGill and IHEP)","Alternatives to Cosmological Inflation","14 pages, 5 figures, to be published in the proceedings of CosPA08",,"10.1142/S2010194511000109",,"hep-th astro-ph.CO gr-qc hep-ph","http://arxiv.org/licenses/nonexclusive-distrib/1.0/","  The inflationary paradigm, although very successful phenomenologically,
suffers from several conceptual problems which motivate the search for
alternative scenarios of early universe cosmology. Here, two possible
alternatives will be reviewed. - ""string gas cosmology"" and the ""matter
bounce"". Their successes and problems will be pointed out.
","[{""version"":""v1"",""created"":""Fri, 27 Feb 2009 00:07:05 GMT""}]","2015-05-13"
"0902.4732","Gutnik Leonid","L.A.Gutnik","On the number zeta(3)",,,,,"math.NT","http://arxiv.org/licenses/nonexclusive-distrib/1.0/","  New expansions of the number zeta(3) in continuous fractions are found.
","[{""version"":""v1"",""created"":""Fri, 27 Feb 2009 00:51:11 GMT""},{""version"":""v2"",""created"":""Mon, 10 Aug 2009 02:07:37 GMT""},{""version"":""v3"",""created"":""Sun, 6 Sep 2009 11:58:08 GMT""}]","2009-09-06"
"0902.4733","Xiaoyu Chen","Xiao-yu Chen","Perturbation theory of von Neumann Entropy","7 pages","Chin. Phys. B Vol. 19, No. 4 (2010) 040308","10.1088/1674-1056/19/4/040308",,"quant-ph","http://arxiv.org/licenses/nonexclusive-distrib/1.0/","  In quantum information theory, von Neumann entropy plays an important role.
The entropies can be obtained analytically only for a few states. In continuous
variable system, even evaluating entropy numerically is not an easy task since
the dimension is infinite. We develop the perturbation theory systematically
for calculating von Neumann entropy of non-degenerate systems as well as
degenerate systems. The result turns out to be a practical way of the expansion
calculation of von Neumann entropy.
","[{""version"":""v1"",""created"":""Fri, 27 Feb 2009 01:01:33 GMT""}]","2015-05-13"
"0902.4734","Andrea Trombettoni","E. Fersino, B.A. Malomed, G. Mussardo, A. Trombettoni","Ultracold Bosons with 3-Body Attractive Interactions in an Optical
  Lattice","Special issue of European Physical Journal B on the conference
  ""Theory of Quantum Gases and Quantum Coherence"" held in Grenoble, 2008",,"10.1140/epjb/e2009-00055-1",,"cond-mat.stat-mech","http://arxiv.org/licenses/nonexclusive-distrib/1.0/","  We study the effect of an optical lattice (OL) on the ground-state properties
of one-dimensional ultracold bosons with three-body attraction and two-body
repulsion, which are described by a cubic-quintic Gross-Pitaevskii equation
with a periodic potential. Without the OL and with a vanishing two-body
interaction term, soliton solutions of the Townes type are possible only at a
critical value of the three-body interaction strength, at which an infinite
degeneracy of the ground-state occurs; a repulsive two-body interaction makes
such localized solutions unstable. We show that the OL opens a stability window
around the critical point when the strength of the periodic potential is above
a critical threshold. We also consider the effect of an external parabolic
trap, studying how the stability of the solitons depends on matching between
minima of the periodic potential and the minimum of the parabolic trap.
","[{""version"":""v1"",""created"":""Fri, 27 Feb 2009 01:11:49 GMT""}]","2009-11-13"
"0902.4735","Pierre Martin","Pierre Martin, Zlatan Aksamija, Eric Pop, and Umberto Ravaioli","Impact of Phonon Surface Roughness Scattering on Thermal Conductivity of
  Thin Si Nanowires","12 pages, 4 figures",,"10.1103/PhysRevLett.102.125503",,"cond-mat.other cond-mat.mes-hall","http://arxiv.org/licenses/nonexclusive-distrib/1.0/","  We present a novel approach for computing the surface roughness-limited
thermal conductivity of silicon nanowires with diameter D < 100 nm. A
frequency-dependent phonon scattering rate is computed from perturbation theory
and related to a description of the surface through the root-mean-square
roughness height Delta and autocovariance length L. Using a full-phonon
dispersion relation, we find a quadratic dependence of thermal conductivity on
diameter and roughness as (D/\Delta)^2. Computed results show excellent
agreement with experimental data for a wide diameter and temperature range
(25-350 K), and successfully predict the extraordinarily low thermal
conductivity of 2 W.m^{-1}.K^{-1} at room temperature in rough-etched 50 nm
silicon nanowires.
","[{""version"":""v1"",""created"":""Fri, 27 Feb 2009 01:19:44 GMT""}]","2009-11-13"
"0902.4736","Jose Edgar Madriz Aguilar","L. M. Reyes and Jose Edgar Madriz Aguilar","Embedding General Relativity with varying cosmological constant term in
  five-dimensional Brans-Dicke theory of gravity in vacuum","8 pages, no figures",,,,"gr-qc","http://arxiv.org/licenses/nonexclusive-distrib/1.0/","  We investigate the possibility to recover a four-dimensional (4D) general
theory of relativity, as embedded in a 5D spacetime where gravity is governed
by a five-dimensional (5D) Brans-Dicke (BD) theory of gravity. Employing the
Gauss-Codazzi-Ricci equations and some ideas of the induced matter theory, we
obtain that when the 5D BD scalar field is only depending of the extra
coordinate, it is possible to recover on every generic 4D hypersurface the
usual Einstein field equations plus a cosmological constant term, with matter
sources described by the energy-momentum tensor of induced matter and where the
cosmological constant under certain conditions can vary with time. Finally to
illustrate the formalism, we give an example in which we induced a cosmological
constant from warped product spaces.
","[{""version"":""v1"",""created"":""Fri, 27 Feb 2009 01:21:33 GMT""}]","2009-03-02"
"0902.4737","Chyh-Hong Chern","Awadhesh Mani, T. Geetha Kumary, Daniel Hsu, J. G. Lin, and Chyh-Hong
  Chern","Modulation of superconductivity by spin canting in a hybrid
  antiferromagnet/superconductor oxide",,"Appl. Phys. Lett. 94, 072509 (2009)","10.1063/1.3087000",,"cond-mat.supr-con","http://arxiv.org/licenses/nonexclusive-distrib/1.0/","  The proximity effect of a C-type antiferromagnet (C-AFM) with the spin
canting at low temperature is investigated in the hybrid
Nd0.35Sr0.65MnO3(NSCO)/YBa2Cu3O7(YBCO) oxide system through magnetic and
transport measurements. It is found that the onset of a spin-canted state
destroys partially the superconducting order parameter. Interestingly, due to
the instability of this spin-canted state, zero-resistivity recovers at the
offset of spin canting. Our result demonstrates clearly the high sensitivity of
superconducting order parameter to a modulation of internal field.
","[{""version"":""v1"",""created"":""Fri, 27 Feb 2009 01:25:02 GMT""}]","2009-11-13"
"0902.4738","Hyerim Noh","Jai-chan Hwang and Hyerim Noh","Axion as a Cold Dark Matter candidate","4 pages, no figure","Phys.Lett.B680:1-3,2009","10.1016/j.physletb.2009.08.031",,"astro-ph.CO gr-qc hep-ph hep-th","http://arxiv.org/licenses/nonexclusive-distrib/1.0/","  Here we generally prove that the axion as a coherently oscillating scalar
field acts as a cold dark matter in nearly all cosmologically relevant scales.
The proof is made in the linear perturbation order. Compared with our previous
proof based on solutions, here we compare the equations in the axion with the
ones in the cold dark matter, thus expanding the valid range of the proof.
Deviation from purely pressureless medium appears in very small scale where
axion reveals a peculiar equation of state. Our analysis is made in the
presence of the cosmological constant, and our conclusions are valid in the
presence of other fluid and field components.
","[{""version"":""v1"",""created"":""Fri, 27 Feb 2009 01:41:09 GMT""}]","2009-09-28"
"0902.4739","Z.K.-H. Chu","Chu Z. K. Hua","Note on ""Anomalous Hydrodynamic Drafting of Interacting Flapping Flags""","1 figure",,,,"physics.gen-ph","http://arxiv.org/licenses/nonexclusive-distrib/1.0/","  We make remarks on Ristroph and Zhang's [{\it Phys. Rev. Lett.} 101, 194502
(2008)] paper.
","[{""version"":""v1"",""created"":""Fri, 27 Feb 2009 01:53:39 GMT""},{""version"":""v2"",""created"":""Wed, 1 Apr 2009 01:11:07 GMT""},{""version"":""v3"",""created"":""Thu, 9 Apr 2009 03:37:03 GMT""}]","2009-04-09"
"0902.4740","Edison Liang","Edison Liang","Dissipation of Nonlinear Alfven Waves with Current Sheets in
  Relativistic Plasmas","13 pages. 16 figures",,,,"astro-ph.HE","http://arxiv.org/licenses/nonexclusive-distrib/1.0/","  We present results from 2.5-dimensional Particle-in-Cell simulations of the
interaction of nonlinear Alfven waves with thin current sheets in relativistic
plasmas. We find that the Alfven waves cause the current sheet to bend and kink
and increase its dissipation. The electrons are eventually heated to form a
double Maxwellian, with the hotter Maxwellian caused by the current sheet
dissipation and cooler Maxwellian caused by the Alfven turbulence cascade.
These results may have important implications for the kinetic dissipation of
MHD turbulence in which both nonlinear Alfven waves and current sheets are
present, such as turbulence in accretion flows driven by the saturated
magnetorotational instability (MRI).
","[{""version"":""v1"",""created"":""Fri, 27 Feb 2009 02:11:34 GMT""}]","2009-03-02"
"0902.4741","Pierluigi Colli","Pierluigi Colli, Gianni Gilardi, Paolo Podio-Guidugli, Juergen
  Sprekels","Global solution and long-time behavior for a problem of phase
  segregation of the Allen-Cahn type",,,,,"math.AP","http://arxiv.org/licenses/nonexclusive-distrib/1.0/","  In this paper we study a model for phase segregation consisting in a sistem
of a partial and an ordinary differential equation. By a careful definition of
maximal solution to the latter equation, this system reduces to an Allen-Cahn
equation with a memory term. Global existence and uniqueness of a smooth
solution are proven and a characterization of the omega-limit set is given.
","[{""version"":""v1"",""created"":""Fri, 27 Feb 2009 14:46:54 GMT""}]","2009-03-02"
