"0904.2563","Pappas","T. Chinburg, G. Pappas, M. Taylor","K_1 of a p-adic group ring I. The determinantal image","39 pp",,,,"math.KT math.RA","http://arxiv.org/licenses/nonexclusive-distrib/1.0/","  We study the K-group K_1 of the group ring of a finite group over a
coefficient ring which is p-adically complete and admits a lift of Frobenius.
In this paper, we consider the image of K_1 under the determinant map; the
central tool is the group logarithm which we can define using the Frobenius
lift. Using this we prove a fixed point theorem for the determinantal image of
K_1.
","[{""version"":""v1"",""created"":""Thu, 16 Apr 2009 19:23:23 GMT""}]","2009-04-17"
"0904.2564","Emanuel Henn","E.A.L. Henn, J.A.Seman, G.Roati, K.M.F. Magalhaes and V.S. Bagnato","Emergence of turbulence in an oscillating Bose-Einstein condensate","accepted for Phys. Rev. Lett","Phys. Rev. Lett. 103, 045301 (2009)","10.1103/PhysRevLett.103.045301",,"cond-mat.quant-gas cond-mat.mes-hall","http://arxiv.org/licenses/nonexclusive-distrib/1.0/","  We report on the experimental observation of vortices tangle in an atomic BEC
of Rb-87 atoms when an external oscillatory perturbation is introduced in the
trap. The vortices tangle configuration is a signature of the presence of a
turbulent regime in the cloud. We also show that this turbulent cloud has
suppression of the aspect ratio inversion typically observed in quantum
degenerate bosonic gases during free expansion. Instead, the cloud expands
keeping the ratio between their axis constant. Turbulence in atomic superfluids
may constitute an alternative system to investigate decay mechanisms as well as
to test fundamental theoretical aspects in this field.
","[{""version"":""v1"",""created"":""Thu, 16 Apr 2009 19:29:06 GMT""},{""version"":""v2"",""created"":""Thu, 11 Jun 2009 13:46:54 GMT""}]","2009-08-07"
"0904.2565","David Kipping Mr","David M. Kipping","Transit timing effects due to an exomoon II","Accepted for publication in MNRAS","Mon. Not. R. Astron. Soc., 2009, Volume 396, Issue 3, pp.
  1797-1804","10.1111/j.1365-2966.2009.14869.x",,"astro-ph.EP","http://arxiv.org/licenses/nonexclusive-distrib/1.0/","  In our previous paper, we evaluated the transit duration variation (TDV)
effect for a co-aligned planet-moon system at an orbital inclination of i=90
degrees. Here, we will consider the effect for the more general case of i <= 90
degrees and an exomoon inclined from the planet-star plane by Euler rotation
angles $\alpha$, $\beta$ and $\gamma$. We find that the TDV signal has two
major components, one due to the velocity variation effect described in our
first paper and one new component due to transit impact parameter variation. By
evaluating the dominant terms, we find the two effects are additive for
prograde exomoon orbits, and deductive for retrograde orbits. This asymmetry
could allow for future determination of the orbital sense of motion. We
re-evaluate the ratio of TDV and TTV effects, $\eta$, in the more general case
of an inclined planetary orbit with a circular orbiting moon and find that it
is still possible to directly determine the moon's orbital separation from just
the ratio of the two amplitudes, as first proposed in our previous paper.
","[{""version"":""v1"",""created"":""Thu, 16 Apr 2009 19:47:49 GMT""}]","2015-05-13"
"0904.2566","Limin Xiao","Limin Xiao and Bradley E. Schaefer","Are Swift Long-Lag Gamma-Ray Bursts in the Local Supercluster?","14 pages, 1 figure, ApJ accepted","Astrophys.J.698:803-807,2009","10.1088/0004-637X/698/1/803",,"astro-ph.CO","http://arxiv.org/licenses/nonexclusive-distrib/1.0/","  A sample of 18 long-lag (tau_{lag} > 1 s) Gamma-Ray Bursts (GRBs) has been
drawn from our catalog of all Swift long GRBs. Four different tests are done on
this sample to test the prediction that a large fraction of long-lag GRBs are
from our Local Supercluster. The results of these four tests come out that: (1)
the distribution of these GRBs shows no tendency towards the Supergalactic
plane; (2) the distribution shows no tendency towards the Virgo or Coma
Cluster; (3) no associated bright host galaxies (m <=15) in the Local
Supercluster are found for any of the 18 GRBs; (4) 17 of these 18 GRBs have
redshifts of z>0.5, which are too far to be in the Local Supercluster. All
these results disproved the hypothesis that any significant fraction of
long-lag GRBs are from Local Supercluster. Hence these long-lag GRBs can not be
counted in the calculation of LIGO detection rates. An explanation of why we
can detect long-lag GRBs at high redshift is presented.
","[{""version"":""v1"",""created"":""Thu, 16 Apr 2009 19:59:57 GMT""}]","2014-11-18"
"0904.2568","Stephen Gwyn","Stephen D.J. Gwyn","MegaPipe: the MegaCam image stacking pipeline","4 pages. To appear in the procedings of ADASS 2008. 1500 square
  degrees of calibrated and stacked ugriz data publicly available at:
  http://www.cadc.hia.nrc.gc.ca/gsky/mdata.html and
  http://www.cadc.hia.nrc.gc.ca/megapipe/",,,,"astro-ph.IM astro-ph.CO astro-ph.GA","http://arxiv.org/licenses/nonexclusive-distrib/1.0/","  This paper describes the MegaPipe image processing pipeline at the Canadian
Astronomical Data Centre (CADC). The pipeline takes multiple images from the
MegaCam mosaic camera on CFHT and combines them into a single output image.
MegaPipe takes as input detrended MegaCam images and does a careful astrometric
and photometric calibration on them. The calibrated images are then resampled
and combined into image stacks. MegaPipe is run on PI data by request, data
from large surveys (the CFHT Legacy Survey and the Next Generation Virgo
Survey) and all non-proprietary MegaCam data in the CFHT archive. The stacked
images and catalogs derived from these images are available through the CADC
website. Currently, 1500 square degrees have been processed.
","[{""version"":""v1"",""created"":""Thu, 16 Apr 2009 20:05:18 GMT""}]","2009-04-20"
"0904.2569","Alessandro Baldi","A. Baldi (1), W. Forman (1), C. Jones (1), R. Kraft (1), P. Nulsen
  (1), E. Churazov (2), L. David (1), S.Giacintucci (1) ((1)
  Harvard-Smithsonian Center for Astrophysics, (2) Max-Planck-Institute fur
  Astrophysik)","The unusual X-ray morphology of NGC4636 revealed by deep Chandra
  observations: cavities and shocks created by past AGN outbursts","15 pages, 13 figures, revised version (minor changes) accepted by the
  Astrophysical Journal","Astrophys.J.707:1034-1043,2009","10.1088/0004-637X/707/2/1034","arXiv:0904:Baldi","astro-ph.CO astro-ph.HE","http://arxiv.org/licenses/nonexclusive-distrib/1.0/","  We present Chandra ACIS-I and ACIS-S observations (~200ks in total) of the
X-ray luminous elliptical galaxy NGC4636, located in the outskirts of the Virgo
cluster. A soft band (0.5-2 keV) image shows the presence of a bright core in
the center surrounded by an extended X-ray corona and two pronounced
quasi-symmetric, 8 kpc long, arm-like features. Each of this features defines
the rim of an ellipsoidal bubble. An additional bubble-like feature, whose
northern rim is located ~2 kpc south of the north-eastern arm, is detected as
well. We present surface brightness and temperature profiles across the rims of
the bubbles, showing that their edges are sharp and characterized by
temperature jumps of about 20-25%. Through a comparison of the observed
profiles with theoretical shock models, we demonstrate that a scenario where
the bubbles were produced by shocks, probably driven by energy deposited
off-center by jets, is the most viable explanation to the X-ray morphology
observed in the central part of NGC4636. As a confirmation to this scenario,
radio jets extending towards the bubbles and a central weak X-ray and radio
source are detected and are most likely the signs of AGN activity which was
more intense in the past. A bright dense core of ~1 kpc radius is observed at
the center of NGC4636. A sharp decline in surface brightness from the core to
the ambient gas is observed and is not accompanied by a variation in the
temperature and thus could not be in thermal pressure equilibrium. However the
bright core could be a long lived feature if the radio jets are acting as a
balancing factor to thermal pressure or if the bright core is produced by steep
abundance gradients.
","[{""version"":""v1"",""created"":""Thu, 16 Apr 2009 20:16:39 GMT""},{""version"":""v2"",""created"":""Mon, 2 Nov 2009 14:19:23 GMT""}]","2009-12-07"
"0904.2570","Hideki Takami","Hideki Takami, Miwa Goto, Wolfgang Gaessler, Yutaka Hayano, Masanori
  Iye, Yukiko Kamata, Tomio Kanzawa, Naoto Kobayashi, Yosuke Minowa, Shin Oya,
  Tae-Soo Pyo, David Saint-Jacques, Naruhisa Takato, Hiroshi Terada, Alan T.
  Tokunaga, and Takashi Tsuji","Direct Observation of the Extended Molecular Atmosphere of o Cet by
  Differential Spectral Imaging with an Adaptive Optics System","6 pages, 3 figures, accepted for publication in PASJ",,"10.1093/pasj/61.4.623",,"astro-ph.SR astro-ph.IM","http://arxiv.org/licenses/nonexclusive-distrib/1.0/","  We present new measurements of the diameter of o Cet (Mira) as a function of
wavelength in the 2.2 micron atmospheric window using the adaptive optics
system and the infrared camera and spectrograph mounted on the Subaru
Telescope. We found that the angular size of the star at the wavelengths of CO
and H2O absorption lines were up to twice as large as the continuum
photosphere. This size difference is attributable to the optically thick CO and
H2O molecular layers surrounding the photosphere. This measurement is the first
direct differential spectroscopic imaging of stellar extension that resolves
individual molecular lines with high spectral-resolution observations. This
observation technique is extremely sensitive to differences in spatial profiles
at different wavelengths; we show that a difference in diameter much smaller
than the point spread function can be measured.
","[{""version"":""v1"",""created"":""Thu, 16 Apr 2009 20:01:16 GMT""}]","2015-05-13"
"0904.2571","Peter Williams","Peter K. G. Williams, Eric Huff, Holly Maness, Maryam Modjaz, Kristen
  L. Shapiro, Jeffrey M. Silverman, Linda Strubbe, Betsey Adams, Katherine
  Alatalo, Kuenley Chiu, Mark Claire, Bethany Cobb, Kelle Cruz, Louis-Benoit
  Desroches, Melissa Enoch, Chat Hull, Hannah Jang-Condell, Casey Law, Nicholas
  McConnell, Rowin Meijerink, Stella Offner, John K. Parejko, Jonathan Pober,
  Klaus Pontoppidan, Dovi Poznanski, Anil Seth, Steven Stahler, Lucianne
  Walkowicz, Andrew A. West, Andrew Wetzel, David Whysong","Training the Next Generation of Astronomers","9 pp + cover page; position paper submitted to the Astro2010 Decadal
  Survey Subcommittee on the State of the Profession; small typographical
  corrections made; submitted version at
  http://www8.nationalacademies.org/astro2010/DetailFileDisplay.aspx?id=460",,,,"astro-ph.IM","http://arxiv.org/licenses/nonexclusive-distrib/1.0/","  While both society and astronomy have evolved greatly over the past fifty
years, the academic institutions and incentives that shape our field have
remained largely stagnant. As a result, the astronomical community is faced
with several major challenges, including: (1) the training that we provide does
not align with the skills that future astronomers will need, (2) the
postdoctoral phase is becoming increasingly demanding and demoralizing, and (3)
our jobs are increasingly unfriendly to families with children. Solving these
problems will require conscious engineering of our profession. Fortunately,
this Decadal Review offers the opportunity to revise outmoded practices to be
more effective and equitable. The highest priority of the Subcommittee on the
State of the Profession should be to recommend specific, funded activities that
will ensure the field meets the challenges we describe.
","[{""version"":""v1"",""created"":""Thu, 16 Apr 2009 20:01:24 GMT""}]","2009-04-20"
"0904.2574","Andrey Beresnyak R","A. Beresnyak, A. Lazarian","Structure of Stationary Strong Imbalanced Turbulence","13 pages, 13 figs, ApJ accepted","Astrophys.J.702:460-471,2009","10.1088/0004-637X/702/1/460",,"astro-ph.SR astro-ph.GA","http://arxiv.org/licenses/nonexclusive-distrib/1.0/","  In this paper we systematically study the spectrum and structure of
incompressible MHD turbulence by means of high resolution direct numerical
simulations. We considered both balanced and imbalanced (cross-helical) cases
and simulated sub-Alfvenic as well as trans-Alfvenic turbulence. This paper
extends numerics preliminarily reported in Beresnyak & Lazarian (2008). We
confirm that driven imbalanced turbulence has a stationary state even for high
degrees of imbalance. Our major finding is that the structure of the dominant
and subdominant Alfvenic components are notably different. Using the most
robust observed quantities, such as the energy ratio, we were able to reject
several existing models of strong imbalanced turbulence.
","[{""version"":""v1"",""created"":""Thu, 16 Apr 2009 22:39:14 GMT""},{""version"":""v2"",""created"":""Thu, 16 Jul 2009 06:04:31 GMT""}]","2009-08-17"
"0904.2575","Douglas Natelson","G. D. Scott, Z. K. Keane, J. W. Ciszek, J. M. Tour, and D. Natelson","Universal Scaling of Nonequilibrium Transport in the Kondo Regime of
  Single Molecule Devices","4.5 pages, 3 figures","Phys. Rev. B 79, 165413 (2009)","10.1103/PhysRevB.79.165413",,"cond-mat.mes-hall cond-mat.str-el","http://arxiv.org/licenses/nonexclusive-distrib/1.0/","  Scaling laws and universality are often associated with systems exhibiting
emergent phenomena possessing a characteristic energy scale. We report
nonequilibrium transport measurements on two different types of single-molecule
transistor (SMT) devices in the Kondo regime. The conductance at low bias and
temperature adheres to a scaling function characterized by two parameters. This
result, analogous to that reported recently in semiconductor dots with Kondo
temperatures two orders of magnitude lower, demonstrates the universality of
this scaling form. We compare the extracted values of the scaling coefficients
to previous experimental and theoretical results.
","[{""version"":""v1"",""created"":""Thu, 16 Apr 2009 20:09:27 GMT""}]","2009-04-20"
"0904.2576","Anna Adamaszek","Anna Adamaszek, Artur Czumaj, Andrzej Lingas","PTAS for k-tour cover problem on the plane for moderately large values
  of k","11 pages, 2 figures",,,,"cs.DS","http://arxiv.org/licenses/nonexclusive-distrib/1.0/","  Let P be a set of n points in the Euclidean plane and let O be the origin
point in the plane. In the k-tour cover problem (called frequently the
capacitated vehicle routing problem), the goal is to minimize the total length
of tours that cover all points in P, such that each tour starts and ends in O
and covers at most k points from P.
  The k-tour cover problem is known to be NP-hard. It is also known to admit
constant factor approximation algorithms for all values of k and even a
polynomial-time approximation scheme (PTAS) for small values of k, i.e.,
k=O(log n / log log n).
  We significantly enlarge the set of values of k for which a PTAS is provable.
We present a new PTAS for all values of k <= 2^{log^{\delta}n}, where \delta =
\delta(\epsilon). The main technical result proved in the paper is a novel
reduction of the k-tour cover problem with a set of n points to a small set of
instances of the problem, each with O((k/\epsilon)^O(1)) points.
","[{""version"":""v1"",""created"":""Thu, 16 Apr 2009 20:12:33 GMT""}]","2009-04-20"
"0904.2577","Enrico Barausse","Enrico Barausse (UMD), Luciano Rezzolla (AEI)","Predicting the direction of the final spin from the coalescence of two
  black holes","5 pages, 3 figures. Significant changes to text and figures to match
  version accepted for publication in ApJ Letters","Astrophys.J.Lett.704:L40-L44,2009; Astrophys.J.704:L40-L44,2009","10.1088/0004-637X/704/1/L40",,"gr-qc astro-ph.CO astro-ph.GA","http://arxiv.org/licenses/nonexclusive-distrib/1.0/","  Knowledge of the spin of the black hole resulting from the merger of a
generic black-hole binary is of great importance for studying the cosmological
evolution of supermassive black holes. Several attempts have been made to model
the spin via simple expressions exploiting the results of numerical-relativity
simulations. While these expressions are in reasonable agreement with the
simulations, they neglect the precession of the binary's orbital plane, and
cannot therefore be applied directly -- i.e., without evolving the system to
small separations using post-Newtonian theory -- to binaries with separations
larger than a few hundred gravitational radii. While not a problem in
principle, this may be impractical if the formulas are employed in cosmological
merger-trees or N-body simulations, which provide the spins and angular
momentum of the two black holes when their separation is of hundreds or
thousands of gravitational radii. The formula that we propose is instead built
on improved assumptions and gives, for any separation, a very accurate
prediction both for the norm of the final spin and for its direction. By
comparing with the numerical data, we also show that the final-spin direction
is very accurately aligned with the binary's total angular momentum at large
separation. Hence, observations of the final-spin direction (e.g. via a jet)
can provide information on the binary's orbital plane at large separations and
could be relevant, for instance, for studying X-shaped radio sources.
","[{""version"":""v1"",""created"":""Thu, 16 Apr 2009 22:16:20 GMT""},{""version"":""v2"",""created"":""Mon, 14 Sep 2009 16:57:19 GMT""}]","2011-05-24"
"0904.2578","Slawomir Dinew","Slawomir Dinew","H\""older continuous potentials on manifolds with partially positive
  curvature","11 pages",,,,"math.CV math.DG","http://arxiv.org/licenses/nonexclusive-distrib/1.0/","  It is proved that solutions of the complex Monge-Amp\`ere equation on compact
K\""ahler manifolds with right hand side in $L^p, p>1$ are uniformly H\""older
continuous under the assumption on non-negative orthogonal bisectional
curvature.
","[{""version"":""v1"",""created"":""Thu, 16 Apr 2009 20:28:14 GMT""}]","2009-04-20"
"0904.2579","Jong-Hak Woo","Yun-Young Choi (Sejong Univ.), Jong-Hak Woo (UCLA), Changbum Park
  (KIAS)","Environmental dependence of AGN activity. I.: the effects of host galaxy","ApJ accepted,12 pages, 12 figures. A high resolution version can be
  found at http://www.astro.ucla.edu/~woo/choietal.pdf","Astrophys.J.699:1679-1689,2009","10.1088/0004-637X/699/2/1679",,"astro-ph.CO astro-ph.GA","http://arxiv.org/licenses/nonexclusive-distrib/1.0/","  Using a large sample of local galaxies (144,940) with -17.5< Mr <-22 and
0.025< z <0.107, selected from SDSS DR5, we compare AGN host galaxies with
non-AGN galaxies at matched luminosity, velocity dispersion, color, color
gradient, or concentration index, to investigate how AGN activity is related
with galaxy properties. The AGN sample is composed of Type II AGNs identified
with flux ratios of narrow-emission lines with S/N > 6. We find that the
fraction of galaxies hosting an AGN (f_AGN) depends strongly on morphology
together with color, and very weakly on luminosity or velocity dispersion of
host galaxies. In particular, f_AGN of early-type galaxies is almost
independent of luminosity nor velocity dispersion when color is fixed. The host
galaxy color preferred by AGNs is u-r ~2.0 for early-type hosts and u-r=2.0-2.4
for late-type hosts. This trend suggests that AGNs are dominantly hosted by
intermediate-mass late-type galaxies. We also investigate how the accretion
power varies with galaxy properties. While the Eddington ratio ([OIII] line
luminosity normalized by black hole mass) ranges over three orders of magnitude
for both morphological types, late-type galaxies are the dominant hosts over
all AGN power. Among late-type galaxies, bluer color galaxies host higher power
AGNs. These results are consistent with a scenario that more massive and redder
galaxies are harder to host AGNs since these galaxiesalready consumed gas at
the center or do not have sufficient gas supply to feed the black hole. In
contrast, intermediate-mass, intermediate-color, and more concentrated
late-type galaxies are more likely to host AGNs, implying that perhaps some
fraction of low-mass, blue, and less concentrated lat e-type galaxiesmay not
host massive black holes or may host very low-power AGNs.
","[{""version"":""v1"",""created"":""Thu, 16 Apr 2009 20:28:56 GMT""},{""version"":""v2"",""created"":""Sun, 19 Apr 2009 18:39:22 GMT""}]","2014-11-18"
"0904.2580","David Vaknin","Jiying Li, Wei Tian, Ying Chen, Jerel L. Zarestky, Jeffrey W. Lynn,
  and David Vaknin","Antiferromagnetism in the magnetoelectric effect single crystal
  LiMnPO$_4$",,"Phys. Rev. B 79, 144410 (2009)","10.1103/PhysRevB.79.144410",,"cond-mat.str-el","http://arxiv.org/licenses/nonexclusive-distrib/1.0/","  Elastic and inelastic neutron scattering studies reveal details of the
antiferromagnetic tansition and intriguing spin-dynamics in the
magneto-electric effect single crystal LiMnPO$_4$. The elastic scattering
studies confirm the system is antiferromagnetic (AFM) below $T_N$=33.75 K with
local magnetic moments (Mn$^{2+}$; $S = 5/2$) that are aligned along the
crystallographic a-axis. The spin-wave dispersion curves propagating along the
three principal axes, determined by inelastic scattering, are adequately
modeled in the linear spin-wave framework assuming a spin-Hamiltonian that is
parameterized by inter- and in-plane nearest- and next-nearest-neighbor
interactions, and by easy-plane anisotropy. The temperature dependence of the
spin dynamics makes this an excellent model many-body spin system to address
the question of the relationship between spin-wave excitations and the order
parameter.
","[{""version"":""v1"",""created"":""Thu, 16 Apr 2009 20:31:30 GMT""}]","2015-05-13"
"0904.2581","Duane Loh","Duane Ne-Te Loh and Veit Elser","A reconstruction algorithm for single-particle diffraction imaging
  experiments","52 pages, 17 figures and uses algorithm2e package v4: split first
  section into 2. Updated figure captions and specific definition of resolution","Phys. Rev. E 80, 026705 (2009)","10.1103/PhysRevE.80.026705",,"physics.data-an","http://arxiv.org/licenses/nonexclusive-distrib/1.0/","  We introduce the EMC algorithm for reconstructing a particle's 3D diffraction
intensity from very many photon shot-noise limited 2D measurements, when the
particle orientation in each measurement is unknown. The algorithm combines a
maximization step (M) of the intensity's likelihood function, with expansion
(E) and compression (C) steps that map the 3D intensity model to a redundant
tomographic representation and back again. After a few iterations of the EMC
update rule, the reconstructed intensity is given to the difference-map
algorithm for reconstruction of the particle contrast. We demonstrate
reconstructions with simulated data and investigate the effects of particle
complexity, number of measurements, and the number of photons per measurement.
The relatively transparent scaling behavior of our algorithm provides a first
estimate of the data processing resources required for future single-particle
imaging experiments.
","[{""version"":""v1"",""created"":""Thu, 16 Apr 2009 22:03:18 GMT""},{""version"":""v2"",""created"":""Mon, 27 Apr 2009 18:47:39 GMT""},{""version"":""v3"",""created"":""Mon, 4 May 2009 17:10:38 GMT""},{""version"":""v4"",""created"":""Tue, 14 Jul 2009 21:15:52 GMT""}]","2010-03-04"
"0904.2582","Jared C. Bronski","Jared C. Bronski, Zoi Rapti","Dislocation Defects and Diophantine Approximation","27 Pages, 1 figure",,,,"math-ph math.MP","http://arxiv.org/licenses/nonexclusive-distrib/1.0/","  In this paper we consider a Schrodinger eigenvalue problem with a potential
consisting of a periodic part together with a compactly supported defect
potential. Such problems arise as models in condensed matter to describe color
in crystals as well as in engineering to describe optical photonic structures.
We are interested in studying the existence of point eigenvalues in gaps in the
essential spectrum, and in particular in counting the number of such
eigenvalues. We use a homotopy argument in the width of the potential to count
the eigenvalues as they are created. As a consequence of this we prove the
following significant generalization of Zheludev's theorem: the number of point
eigenvalues in a gap in the essential spectrum is exactly one for sufficiently
large gap number unless a certain Diophantine approximation problem has
solutions, in which case there exists a subsequence of gaps containing 0,1 or 2
eigenvalues. We state some conditions under which the solvability of the
Diophantine approximation problem can be established.
","[{""version"":""v1"",""created"":""Thu, 16 Apr 2009 20:47:11 GMT""}]","2009-04-20"
