"0904.2387","Juan Antonio Aguilar-Saavedra","J. A. Aguilar-Saavedra","A minimal set of top-Higgs anomalous couplings","LaTeX 16 pages, 2 PS figures. Typos corrected. Final version which
  appeared on the journal","Nucl.Phys.B821:215-227,2009","10.1016/j.nuclphysb.2009.06.022",,"hep-ph","http://arxiv.org/licenses/nonexclusive-distrib/1.0/","  We use the equations of motion to simplify the general form of
fermion-fermion-Higgs interactions generated by dimension-six gauge-invariant
effective operators. After removing redundant operators it is found that the
most general H f_i f_j vertex for off-shell fermions f_i, f_j and an off-shell
Higgs boson only involves scalar and pseudo-scalar terms, without derivatives.
Examples are presented for the Htt and Htq interactions, where q=u,c, giving
the explicit expressions of the vertices in terms of gauge-invariant operators.
The new operator equalities obtained here also reduce the number of operators
relevant for the Ztq vertices, although the general form of these interactions
is not simplified with respect to previous results.
","[{""version"":""v1"",""created"":""Thu, 16 Apr 2009 17:22:46 GMT""},{""version"":""v2"",""created"":""Mon, 5 Oct 2009 17:39:52 GMT""}]","2009-10-05"
"0904.2400","Patrick Briest","Patrick Briest, Shuchi Chawla, Robert Kleinberg, and S. Matthew
  Weinberg","Pricing Randomized Allocations",,,,,"cs.GT cs.DS","http://arxiv.org/licenses/nonexclusive-distrib/1.0/","  Randomized mechanisms, which map a set of bids to a probability distribution
over outcomes rather than a single outcome, are an important but ill-understood
area of computational mechanism design. We investigate the role of randomized
outcomes (henceforth, ""lotteries"") in the context of a fundamental and
archetypical multi-parameter mechanism design problem: selling heterogeneous
items to unit-demand bidders. To what extent can a seller improve her revenue
by pricing lotteries rather than items, and does this modification of the
problem affect its computational tractability? Our results show that the
answers to these questions hinge on whether consumers can purchase only one
lottery (the buy-one model) or purchase any set of lotteries and receive an
independent sample from each (the buy-many model). In the buy-one model, there
is a polynomial-time algorithm to compute the revenue-maximizing envy-free
prices (thus overcoming the inapproximability of the corresponding item pricing
problem) and the revenue of the optimal lottery system can exceed the revenue
of the optimal item pricing by an unbounded factor as long as the number of
item types exceeds 4. In the buy-many model with n item types, the profit
achieved by lottery pricing can exceed item pricing by a factor of O(log n) but
not more, and optimal lottery pricing cannot be approximated within a factor of
O(n^eps) for some eps>0, unless NP has subexponential-time randomized
algorithms. Our lower bounds rely on a mixture of geometric and algebraic
techniques, whereas the upper bounds use a novel rounding scheme to transform a
mechanism with randomized outcomes into one with deterministic outcomes while
losing only a bounded amount of revenue.
","[{""version"":""v1"",""created"":""Thu, 16 Apr 2009 16:30:59 GMT""}]","2009-04-17"
"0904.2407","Cristian Lenart","Cristian Lenart","Haglund-Haiman-Loehr Type Formulas for Hall-Littlewood Polynomials of
  Type B and C",,,,,"math.CO math.RT","http://arxiv.org/licenses/nonexclusive-distrib/1.0/","  In previous work we showed that two apparently unrelated formulas for the
Hall-Littlewood polynomials of type A are, in fact, closely related. The first
is the tableau formula obtained by specializing q=0 in the Haglund-Haiman-Loehr
formula for Macdonald polynomials. The second is the type $A$ instance of
Schwer's formula (rephrased and rederived by Ram) for Hall-Littlewood
polynomials of arbitrary finite type; Schwer's formula is in terms of so-called
alcove walks, which originate in the work of Gaussent-Littelmann and of the
author with Postnikov on discrete counterparts to the Littelmann path model. We
showed that the tableau formula follows by ""compressing"" Ram's version of
Schwer's formula. In this paper, we derive tableau formulas for the
Hall-Littlewood polynomials of type B and C by compressing the corresponding
instances of Schwer's formula.
","[{""version"":""v1"",""created"":""Thu, 16 Apr 2009 16:41:47 GMT""}]","2009-04-17"
"0904.2495","Fabien Crauste","Fabien Crauste (LMA-Pau)","Global Asymptotic Stability and Hopf Bifurcation for a Blood Cell
  Production Model",,"Mathematical Biosciences and Engineering 3, 2 (2006) 325-346",,,"math.AP q-bio.CB q-bio.TO","http://arxiv.org/licenses/nonexclusive-distrib/1.0/","  We analyze the asymptotic stability of a nonlinear system of two differential
equations with delay describing the dynamics of blood cell production. This
process takes place in the bone marrow where stem cells differentiate
throughout divisions in blood cells. Taking into account an explicit role of
the total population of hematopoietic stem cells on the introduction of cells
in cycle, we are lead to study a characteristic equation with delay-dependent
coefficients. We determine a necessary and sufficient condition for the global
stability of the first steady state of our model, which describes the
population's dying out, and we obtain the existence of a Hopf bifurcation for
the only nontrivial positive steady state, leading to the existence of periodic
solutions. These latter are related to dynamical diseases affecting blood cells
known for their cyclic nature.
","[{""version"":""v1"",""created"":""Thu, 16 Apr 2009 16:00:35 GMT""}]","2009-04-17"
"0904.2530","Yifan Yang","Yifan Yang","Congruences of the partition function","19 pages",,,,"math.NT","http://arxiv.org/licenses/nonexclusive-distrib/1.0/","  Let $p(n)$ denote the partition function. In this article, we will show that
congruences of the form $$ p(m^j\ell^kn+B)\equiv 0\mod m \text{for all} n\ge 0
$$ exist for all primes $m$ and $\ell$ satisfying $m\ge 13$ and $\ell\neq
2,3,m$. Here the integer $k$ depends on the Hecke eigenvalues of a certain
invariant subspace of $S_{m/2-1}(\Gamma_0(576),\chi_{12})$ and can be
explicitly computed. More generally, we will show that for each integer $i>0$
there exists an integer $k$ such that for every non-negative integers $j\ge i$
with a properly chosen $B$ the congruence $$ p(m^j\ell^kn+B)\equiv 0\mod m^i $$
holds for all integers $n$ not divisible by $\ell$.
","[{""version"":""v1"",""created"":""Thu, 16 Apr 2009 16:00:24 GMT""}]","2009-04-17"
"0904.2531","Miroslava Dessauges-Zavadsky Dr","Miroslava Dessauges-Zavadsky (Geneva Observatory, University of
  Geneva), Sara L. Ellison (Department of Physics and Astronomy, University of
  Victoria), Michael T. Murphy (Centre for Astrophysics and Supercomputing,
  Swinburne University of Technology)","Revisiting the origin of the high metallicities of sub-damped
  Lyman-alpha systems","6 pages, 3 figures, MNRAS, in press",,"10.1111/j.1745-3933.2009.00662.x",,"astro-ph.CO","http://arxiv.org/licenses/nonexclusive-distrib/1.0/","  Sub-damped Lyman-alpha systems (sub-DLAs) have previously been found to
exhibit a steeper metallicity evolution than the classical damped Lyman-alpha
systems (DLAs), evolving to close to solar metallicity by z~1. From new
high-resolution spectra of 17 sub-DLAs we have increased the number of
measurements of [Fe/H] at z<1.7 by 25% and compiled the most complete
literature sample of sub-DLA and DLA abundances to date. We find that sub-DLAs
are indeed significantly more metal-rich than DLAs, but only at z<1.7; the
metallicity distributions of sub-DLAs and DLAs at z>1.7 are statistically
consistent. We also present the first evidence that sub-DLAs follow a velocity
width-metallicity correlation over the same velocity range as DLAs, but the
relation is offset to higher metallicities than the DLA relation. On the basis
of these results, we revisit the previous explanation that the systematically
higher metallicities observed in sub-DLAs are indicative of higher host galaxy
masses. We discuss the various problems that this interpretation encounters and
conclude that in general sub-DLAs are not uniquely synonymous with massive
galaxies. We rule out physically related sources of bias (dust, environment,
ionization effects) and examine systematics associated with the selection and
analysis of low-redshift sub-DLAs. We propose that the high metallicities of
sub-DLAs at z<1.7 that drives an apparently steep evolution may be due to the
selection of most low-redshift sub-DLAs based on their high MgII equivalent
widths.
","[{""version"":""v1"",""created"":""Thu, 16 Apr 2009 16:06:18 GMT""}]","2009-11-13"
"0904.2532","Niels Boon","N. Boon, E. Carvajal Gallardo, S. Zheng, E. Eggen, M. Dijkstra, R. van
  Roij","Screening of heterogeneous surfaces: charge renormalization of Janus
  particles","2 figures",,,,"cond-mat.soft","http://arxiv.org/licenses/nonexclusive-distrib/1.0/","  Nonlinear ionic screening theory for heterogeneously charged spheres is
developed in terms of a mode-decomposition of the surface charge. A far-field
analysis of the resulting electrostatic potential leads to a natural
generalization of charge renormalization from purely monopolar to dipolar,
quadropolar, etc., including mode-couplings. Our novel scheme is generally
applicable to large classes of surface heterogeneities, and is explicitly
applied here to Janus spheres with differently charged upper and lower
hemispheres, revealing strong renormalization effects for all multipoles.
","[{""version"":""v1"",""created"":""Thu, 16 Apr 2009 16:08:43 GMT""},{""version"":""v2"",""created"":""Thu, 17 Dec 2009 09:43:39 GMT""}]","2009-12-17"
"0904.2533","Mauricio Valenzuela","Xavier Bekaert, Michel Rausch de Traubenberg, Mauricio Valenzuela","An infinite supermultiplet of massive higher-spin fields","29 pages, references [30] added. To appear in JHEP","JHEP 0905:118,2009","10.1088/1126-6708/2009/05/118",,"hep-th","http://arxiv.org/licenses/nonexclusive-distrib/1.0/","  The representation theory underlying the infinite-component relativistic wave
equation written by Majorana is revisited from a modern perspective. On the one
hand, the massless solutions of this equation are shown to form a
supermultiplet of the superPoincare algebra with tensorial central charges; it
can also be obtained as the infinite spin limit of massive solutions. On the
other hand, the Majorana equation is generalized for any space-time dimension
and for arbitrary Regge trajectories. Inspired from these results, an infinite
supermultiplet of massive fields of all spins and of equal mass is constructed
in four dimensions and proved to carry an irreducible representation of the
orthosymplectic group OSp(1|4) and of the superPoincare group with tensorial
charges.
","[{""version"":""v1"",""created"":""Thu, 16 Apr 2009 16:10:28 GMT""},{""version"":""v2"",""created"":""Tue, 28 Apr 2009 15:34:38 GMT""},{""version"":""v3"",""created"":""Wed, 29 Apr 2009 11:53:38 GMT""},{""version"":""v4"",""created"":""Thu, 14 May 2009 12:24:35 GMT""}]","2011-04-14"
"0904.2534","Thomas G. Rizzo","Thomas G. Rizzo","Indirect Searches for $Z'$-like Resonances at the LHC","18 pages, 6 figs, discussion and reference added","JHEP 0908:082,2009","10.1088/1126-6708/2009/08/082","SLAC-PUB-13572","hep-ph","http://arxiv.org/licenses/nonexclusive-distrib/1.0/","  We explore the possibility of indirectly observing the effects of $Z'$-like
particles with electroweak strength couplings in the Drell-Yan channel at the
LHC with masses above the resonance direct search reach. We find that, mostly
due to statistical limitations, this is very unlikely in almost all classes of
models independently of the spin of the resonance. Not unexpectedly, the one
possible exception to this general result is the case of degenerate
Kaluza-Klein (KK) excitations of the photon and $Z$ that occur in some
extra-dimensional models. In this special case, the strong destructive
interference with the Standard Model (SM) exchanges below the resonance mass
leads to a well-known significant suppression of the cross section and thus
increased sensitivity to this particular new physics scenario.
","[{""version"":""v1"",""created"":""Thu, 16 Apr 2009 16:11:39 GMT""},{""version"":""v2"",""created"":""Thu, 18 Jun 2009 18:50:42 GMT""},{""version"":""v3"",""created"":""Fri, 19 Jun 2009 14:13:36 GMT""},{""version"":""v4"",""created"":""Mon, 3 Aug 2009 14:06:47 GMT""},{""version"":""v5"",""created"":""Mon, 3 Aug 2009 23:13:18 GMT""}]","2009-09-28"
"0904.2535","Nat\'alia Landin Rezende","N. R. Landin, L. T. S. Mendes, L. P. R. Vaz","Combined effects of tidal and rotational distortions on the equilibrium
  configuration of low-mass, pre-main sequence stars",,"Astron.Astrophys.494:209-227,2009","10.1051/0004-6361:20078403",,"astro-ph.SR","http://arxiv.org/licenses/nonexclusive-distrib/1.0/","  In close binary systems, rotation and tidal forces of the component stars
deform each other and destroy their spherical symmetry. We present new models
for low-mass, pre-main sequence stars that include the combined distortion
effects of tidal and rotational forces on the equilibrium configuration of
stars. We investigate the effects of interaction between tides and rotation on
the stellar structure and evolution. The Kippenhahn & Thomas (1970)
approximation, along with the Clairaut-Legendre expansion for the gravitational
potential of a self-gravitating body, is used to take the distortion effects
into account. We obtained values of internal structure constants for low-mass,
pre-main sequence stars from stellar evolutionary models that consider the
combined effects of rotation and tidal forces due to a companion star. We also
derived a new expression for the rotational inertia of a tidally and
rotationally distorted star. Our distorted models were successfully used to
analyze the eclipsing binary system EK Cep, reproducing the stellar radii,
effective temperature ratio, lithium depletion, rotational velocities, and the
apsidal motion rate in the age interval of 15.5-16.7 Myr. In the low-mass
range, the assumption that harmonics greater than j=2 can be neglected seems
not to be fully justified, although it is widely used when analyzing the
apsidal motion of binary systems. The non-standard evolutionary tracks are
cooler than the standard ones, mainly for low-mass stars. Distorted models
predict more mass-concentrated stars at the zero-age main-sequence than
standard models.
","[{""version"":""v1"",""created"":""Thu, 16 Apr 2009 16:24:59 GMT""}]","2010-11-02"
"0904.2536","William Horowitz","W. A. Horowitz and Yuri V. Kovchegov","Shock Treatment: Heavy Quark Drag in a Novel AdS Geometry","17 pages, 4 figures. Added a clarifying figure in the Appendix and
  made some slight textual changes. This is an expanded version of the letter
  to be published in Physics Letters B","Phys.Lett.B680:56-61,2009","10.1016/j.physletb.2009.07.077",,"hep-th hep-ph nucl-th","http://arxiv.org/licenses/nonexclusive-distrib/1.0/","  We calculate the drag force on a heavy quark hit by a shock wave, thus
generalizing the strongly coupled AdS/CFT heavy quark drag calculations to both
hot and cold nuclear matter. The derivation employs the trailing string
configuration, similar to that used in the literature for a quark moving
through a thermal medium, though in the shock metric the string profile is
described by a much simpler analytic function. Our expression for the drag
depends on the typical transverse momentum scale of the matter in the shock.
For a thermal medium this scale becomes proportional to the temperature, making
our drag coefficient and momentum limit of applicability identical to those
found previously. As the shock wave can be composed of either thermalized or
non-thermalized media, our derivation extends the existing drag calculations to
the case of arbitrarily distributed matter.
","[{""version"":""v1"",""created"":""Thu, 16 Apr 2009 19:11:57 GMT""},{""version"":""v2"",""created"":""Fri, 28 Aug 2009 13:55:48 GMT""}]","2010-04-15"
"0904.2537","Marco Serone","Diego Gallego and Marco Serone","An Effective Description of the Landscape - II","20 pages","JHEP 0906:057,2009","10.1088/1126-6708/2009/06/057","SISSA-19/2009/EP","hep-th hep-ph","http://arxiv.org/licenses/nonexclusive-distrib/1.0/","  We continue our analysis of establishing the reliability of ""simple""
effective theories where massive fields are ""frozen"" rather than integrated
out, in a wide class of four dimensional theories with global or local N=1
supersymmetry. We extend our previous work by adding gauge fields and O(1)
Yukawa-like terms for the charged fields in the superpotential. For generic
Kaehler potentials, a meaningful freezing is allowed for chiral multiplets
only, whereas in general heavy vector fields have to properly be integrated
out. Heavy chiral fields can be frozen if they approximately sit to
supersymmetric solutions along their directions and, in supergravity, if the
superpotential at the minimum is small, so that a mass hierarchy between heavy
and light fields is ensured. When the above conditions are met, we show that
the simple effective theory is generally a reliable truncation of the full one.
","[{""version"":""v1"",""created"":""Thu, 16 Apr 2009 16:35:44 GMT""}]","2011-04-14"
"0904.2538","German Drazer","John Herrmann, Michael Karweit, German Drazer","Separation of suspended particles in microfluidic systems by
  directional-locking in periodic fields",,,"10.1103/PhysRevE.79.061404",,"cond-mat.soft","http://arxiv.org/licenses/nonexclusive-distrib/1.0/","  We investigate the transport and separation of overdamped particles under the
action of a uniform external force in a two-dimensional periodic energy
landscape. Exact results are obtained for the deterministic transport in a
square lattice of parabolic, repulsive centers that correspond to a
piecewise-continuous linear-force model. The trajectories are periodic and
commensurate with the obstacle lattice and exhibit phase-locking behavior in
that the particle moves at the same average migration angle for a range of
orientation of the external force. The migration angle as a function of the
orientation of the external force has a Devil's staircase structure. The first
transition in the migration angle was analyzed in terms of a Poincare map,
showing that it corresponds to a tangent bifurcation. Numerical results show
that the limiting behavior for impenetrable obstacles is equivalent to the high
Peclet number limit in the case of transport of particles in a periodic pattern
of solid obstacles. Finally, we show how separation occurs in these systems
depending on the properties of the particles.
","[{""version"":""v1"",""created"":""Thu, 16 Apr 2009 16:54:04 GMT""}]","2013-05-29"
"0904.2539","Paolo Gauzzi","KLOE Collaboration: F. Ambrosino, A. Antonelli, M. Antonelli, F.
  Archilli, C. Bacci, P. Beltrame, G. Bencivenni, S. Bertolucci, C. Bini, C.
  Bloise, S. Bocchetta, F. Bossi, P. Branchini, P. Campana, G. Capon, T.
  Capussela, F. Ceradini, S. Chi, G. Chiefari, P. Ciambrone, F. Crucianelli, E.
  De Lucia, A. De Santis, P. De Simone, G. De Zorzi, A. Denig, A. Di Domenico,
  C. Di Donato, B. Di Micco, A. Doria, M. Dreucci, G. Felici, A. Ferrari, M. L.
  Ferrer, S. Fiore, C. Forti, P. Franzini, C. Gatti, P. Gauzzi, S. Giovannella,
  E. Gorini, E. Graziani, W. Kluge, V. Kulikov, F. Lacava, G. Lanfranchi, J.
  Lee-Franzini, D. Leone, M. Martini, P. Massarotti, W. Mei, S. Meola, S.
  Miscetti, M. Moulson, S. M\""uller, F. Murtas, M. Napolitano, F. Nguyen, M.
  Palutan, E. Pasqualucci, A. Passeri, V. Patera, F. Perfetto, M. Primavera, P.
  Santangelo, G. Saracino, B. Sciascia, A. Sciubba, A. Sibidanov, T. Spadaro,
  M. Testa, L. Tortora, P. Valente, G. Venanzoni, R. Versaci, R. Volpe, G. Xu","Study of the a_0(980) meson via the radiative decay phi->eta pi^0 gamma
  with the KLOE detector","17 pages, 6 figures, submitted to Physics Letters B. Corrected typos
  in eq.9","Phys.Lett.B681:5-13,2009","10.1016/j.physletb.2009.09.022",,"hep-ex","http://arxiv.org/licenses/nonexclusive-distrib/1.0/","  We have studied the phi->a_0(980) gamma process with the KLOE detector at the
Frascati phi-factory DAPhNE by detecting the phi->eta pi^0 gamma decays in the
final states with eta->gamma gamma and eta->pi^+ pi^- pi^0. We have measured
the branching ratios for both final states: Br(phi->eta pi^0 gamma)=(7.01 +/-
0.10 +/- 0.20)x10^-5 and (7.12 +/- 0.13 +/- 0.22)x10^-5 respectively. We have
also extracted the a_0(980) mass and its couplings to eta pi^0, K^+ K^-, and to
the phi meson from the fit of the eta pi^0 invariant mass distributions using
different phenomenological models.
","[{""version"":""v1"",""created"":""Thu, 16 Apr 2009 16:49:16 GMT""},{""version"":""v2"",""created"":""Tue, 21 Apr 2009 09:30:17 GMT""}]","2010-04-27"
"0904.2540","David Wolpert","David H. Wolpert Gregory Benford","What does Newcomb's paradox teach us?","Revised version with analysis extended and clarified; 22 pages, 1
  table",,,,"cs.GT","http://arxiv.org/licenses/nonexclusive-distrib/1.0/","  In Newcomb's paradox you choose to receive either the contents of a
particular closed box, or the contents of both that closed box and another one.
Before you choose though, an antagonist uses a prediction algorithm to deduce
your choice, and fills the two boxes based on that deduction. Newcomb's paradox
is that game theory's expected utility and dominance principles appear to
provide conflicting recommendations for what you should choose. A recent
extension of game theory provides a powerful tool for resolving paradoxes
concerning human choice, which formulates such paradoxes in terms of Bayes
nets. Here we apply this to ol to Newcomb's scenario. We show that the
conflicting recommendations in Newcomb's scenario use different Bayes nets to
relate your choice and the algorithm's prediction. These two Bayes nets are
incompatible. This resolves the paradox: the reason there appears to be two
conflicting recommendations is that the specification of the underlying Bayes
net is open to two, conflicting interpretations. We then show that the accuracy
of the prediction algorithm in Newcomb's paradox, the focus of much previous
work, is irrelevant. We similarly show that the utility functions of you and
the antagonist are irrelevant. We end by showing that Newcomb's paradox is
time-reversal invariant; both the paradox and its resolution are unchanged if
the algorithm makes its `prediction' \emph{after} you make your choice rather
than before.
","[{""version"":""v1"",""created"":""Thu, 16 Apr 2009 16:50:22 GMT""},{""version"":""v2"",""created"":""Fri, 26 Feb 2010 18:53:17 GMT""},{""version"":""v3"",""created"":""Thu, 30 Sep 2010 16:29:44 GMT""}]","2010-10-01"
"0904.2541","Heidi Gebauer","Heidi Gebauer","Disproof of the Neighborhood Conjecture with Implications to SAT","12 pages, 1 figure",,,,"cs.GT","http://arxiv.org/licenses/nonexclusive-distrib/1.0/","  We study a Maker/Breaker game described by Beck. As a result we disprove a
conjecture of Beck on positional games, establish a connection between this
game and SAT and construct an unsatisfiable k-CNF formula with few occurrences
per variable, thereby improving a previous result by Hoory and Szeider and
showing that the bound obtained from the Lovasz Local Lemma is tight up to a
constant factor. The Maker/Breaker game we study is as follows. Maker and
Breaker take turns in choosing vertices from a given n-uniform hypergraph F,
with Maker going first. Maker's goal is to completely occupy a hyperedge and
Breaker tries to avoid this. Beck conjectures that if the maximum neighborhood
size of F is at most 2^(n-1) then Breaker has a winning strategy. We disprove
this conjecture by establishing an n-uniform hypergraph with maximum
neighborhood size 3*2^(n - 3) where Maker has a winning strategy. Moreover, we
show how to construct an n-uniform hypergraph with maximum degree (2^(n-1))/n
where maker has a winning strategy. Finally, we establish a connection between
SAT and the Maker/Breaker game we study. We can use this connection to derive
new results in SAT. Kratochvil, Savicky and Tuza showed that for every k >= 3
there is an integer f(k) such that every (k,f(k))-formula is satisfiable, but
(k,f(k) + 1)-SAT is already NP-complete (it is not known whether f(k) is
computable). Kratochvil, Savicky and Tuza also gave the best known lower bound
f(k) = Omega(2^k/k), which is a consequence of the Lovasz Local Lemma. We prove
that, in fact, f(k) = Theta(2^k/k), improving upon the best known upper bound
O((log k) * 2^k/k) by Hoory and Szeider.
","[{""version"":""v1"",""created"":""Thu, 16 Apr 2009 17:04:21 GMT""},{""version"":""v2"",""created"":""Thu, 7 May 2009 21:25:14 GMT""},{""version"":""v3"",""created"":""Fri, 15 May 2009 07:59:53 GMT""}]","2009-05-15"
