"0904.2689","Oleksiy Khorunzhiy","S. Ayadi and O. Khorunzhiy","Asymptotic properties of resolvents of large dilute Wigner matrices","37 pages; corrected and imroved version","Reports on Mathematical Physics, Vol. 65 (2010) 297-335","10.1016/S0034-4877(10)00016-9",,"math-ph math.MP math.PR","http://arxiv.org/licenses/nonexclusive-distrib/1.0/","  We study the spectral properties of the dilute Wigner random real symmetric
n-dimensional matrices H such that the entries H(i,j) take zero value with
probability 1-p/n. We prove that under rather general conditions on the
probability distribution of H(i,j) the semicircle law is valid for the dilute
Wigner ensemble in the limit of infinite n and p. In the second part of the
paper we study the leading term of the correlation function of the resolvent
G(z) of H with large enough Im z in the limit of infinite n and p such that 3/5
log n <log p < log n. We show that this leading term, when considered on the
local spectral scale, converges to the same limit as that of the resolvent
correlation function of the Wigner ensemble of random matrices. This shows that
the moderate dilution of the Wigner ensemble does not alter its universality
class.
","[{""version"":""v1"",""created"":""Fri, 17 Apr 2009 12:39:16 GMT""},{""version"":""v2"",""created"":""Fri, 22 May 2009 12:46:42 GMT""}]","2015-05-13"
"0904.2690","Jill Jordan","Jill Jordan, Lisa Traynor","Generating family invariants for Legendrian links of unknots","This is the version published by Algebraic & Geometric Topology on 24
  July 2006","Algebr. Geom. Topol. 6 (2006) 895-933","10.2140/agt.2006.6.895",,"math.GT","http://arxiv.org/licenses/nonexclusive-distrib/1.0/","  Theory is developed for linear-quadratic at infinity generating families for
Legendrian knots in R^3. It is shown that the unknot with maximal
Thurston--Bennequin invariant of -1 has a unique linear-quadratic at infinity
generating family, up to fiber-preserving diffeomorphism and stabilization.
  From this, invariant generating family polynomials are constructed for
2-component Legendrian links where each component is a maximal unknot.
Techniques are developed to compute these polynomials, and computations are
done for two families of Legendrian links: rational links and twist links. The
polynomials allow one to show that some topologically equivalent links with the
same classical invariants are not Legendrian equivalent. It is also shown that
for these families of links the generating family polynomials agree with the
polynomials arising from a linearization of the differential graded algebra
associated to the links.
","[{""version"":""v1"",""created"":""Fri, 17 Apr 2009 12:42:57 GMT""}]","2009-04-20"
"0904.2691","Jianhua Xing","Jianhua Xing","Mori-Zwanzig projection formalism: from linear to nonlinear","3 pages",,,,"cond-mat.stat-mech","http://arxiv.org/licenses/nonexclusive-distrib/1.0/","  The Mori-Zwanzig projection formalism is widely used in studying systems with
many degrees of freedom. We used a system-bath Hamiltonian system to show that
the Mori's and Zwanzig's projection procedures are mutual limiting cases of
each other depending on the size of the projected Hilbert space. We also
derived the dynamic equations of collective coordinates of a Hamiltonian
system.
","[{""version"":""v1"",""created"":""Fri, 17 Apr 2009 12:44:12 GMT""}]","2009-04-20"
"0904.2692","Vladimir Turaev","Vladimir Turaev","Sections of fiber bundles over surfaces","38 pages",,,,"math.GT math.QA","http://arxiv.org/licenses/nonexclusive-distrib/1.0/","  We study the existence problem and the enumeration problem for sections of
Serre fibrations over compact orientable surfaces. When the fundamental group
of the fiber is finite, a complete solution is given in terms of 2-dimensional
cohomology classes associated with certain irreducible representations of this
group. The proofs are based on Topological Quantum Field Theory.
","[{""version"":""v1"",""created"":""Fri, 17 Apr 2009 12:58:47 GMT""}]","2009-04-20"
"0904.2693","Lars Allermann","Lars Allermann","Tropical intersection products on smooth varieties","17 pages, 3 figures; some corrections in version 2",,,,"math.AG math.CO","http://arxiv.org/licenses/nonexclusive-distrib/1.0/","  In analogy to chapter 9 of arXiv:0709.3705 we define an intersection product
of tropical cycles on tropical linear spaces L^n_k, i.e. on tropical fans of
the type max{0,x_1,...,x_n}^(n-k)*R^n. Afterwards we use this result to obtain
an intersection product of cycles on every smooth tropical variety, i.e. on
every tropical variety that arises from gluing such tropical linear spaces. In
contrast to classical algebraic geometry these products always yield
well-defined cycles, not cycle classes only. Using these intersection products
we are able to define the pull-back of a tropical cycle along a morphism
between smooth tropical varieties. In the present article we stick to the
definitions, notions and concepts introduced in arXiv:0709.3705.
","[{""version"":""v1"",""created"":""Fri, 17 Apr 2009 13:04:26 GMT""},{""version"":""v2"",""created"":""Fri, 5 Mar 2010 16:30:02 GMT""}]","2010-03-05"
"0904.2694","Juliette Venel","Juliette Venel (LAMAV)","Numerical scheme for a whole class of sweeping process","27 pages",,,,"math.NA","http://arxiv.org/licenses/nonexclusive-distrib/1.0/","  The aim of this paper is to study a whole class of first order differential
inclusions, which fit into the framework of perturbed sweeping process by
uniformly prox-regular sets. After obtaining well-posedness results, we propose
a numerical scheme based on a prediction-correction algorithm and we prove its
convergence. Finally we apply these results to a problem coming from modelling
of crowd motion.
","[{""version"":""v1"",""created"":""Fri, 17 Apr 2009 13:07:33 GMT""},{""version"":""v2"",""created"":""Wed, 14 Oct 2009 14:28:57 GMT""}]","2009-10-14"
"0904.2695","Lianlin Li Dr","Lianlin Li, Wenji Zhang, Fang Li","Compressive Diffraction Tomography for Weakly Scattering",,,,,"cs.CE cs.IT math.IT","http://creativecommons.org/licenses/by/3.0/","  An appealing requirement from the well-known diffraction tomography (DT)
exists for success reconstruction from few-view and limited-angle data.
Inspired by the well-known compressive sensing (CS), the accurate
super-resolution reconstruction from highly sparse data for the weakly scatters
has been investigated in this paper. To realize the compressive data
measurement, in particular, to obtain the super-resolution reconstruction with
highly sparse data, the compressive system which is realized by surrounding the
probed obstacles by the random media has been proposed and empirically studied.
Several interesting conclusions have been drawn: (a) if the desired resolution
is within the range from to, the K-sparse N-unknowns imaging can be obtained
exactly bymeasurements, which is comparable to the required number of
measurement by the Gaussian random matrix in the literatures of compressive
sensing. (b) With incorporating the random media which is used to enforce the
multi-path effect of wave propagation, the resulting measurement matrix is
incoherence with wavelet matrix, in other words, when the probed obstacles are
sparse with the framework of wavelet, the required number of measurements for
successful reconstruction is similar as above. (c) If the expected resolution
is lower than, the required number of measurements of proposed compressive
system is almost identical to the case of free space. (d) There is also a
requirement to make the tradeoff between the imaging resolutions and the number
of measurements. In addition, by the introduction of complex Gaussian variable
the kind of fast sparse Bayesian algorithm has been slightly modified to deal
with the complex-valued optimization with sparse constraints.
","[{""version"":""v1"",""created"":""Fri, 17 Apr 2009 13:19:50 GMT""}]","2009-04-20"
"0904.2696","Tigran Arshakian Dr","Tigran G. Arshakian and Rainer Beck","Exploring weak magnetic fields with LOFAR and SKA","6 pages, 2 figures; to appear in proceedings of ""Low Frequency Radio
  Universe"" conference (Pune, India, 8-12 December 2008)",,,,"astro-ph.CO astro-ph.GA","http://arxiv.org/licenses/nonexclusive-distrib/1.0/","  Regular magnetic field structures can be derived from the Faraday rotation
measures (RM) of polarized background sources observable at 1.4 GHz with the
SKA. At lower frequencies ($<250$ MHz) polarimetry of radio sources with the
Low Frequency Array (LOFAR) will allow the investigation of extremely small RM,
to detect and map weak regular fields in halos and outer parts of spiral
galaxies, and in the interstellar and intergalactic medium. Very little is
known yet about the number density of polarized sources at low frequencies.
Observed distributions of polarized sources at 350 MHz and 1.4 GHz and
perspectives to detect weak magnetic fields with LOFAR are presented. Test
observations of polarized radio sources with the Westerbork Synthesis Radio
Telescope (WSRT) and the Giant Metrewave Radio Telescope (GMRT) are discussed.
","[{""version"":""v1"",""created"":""Fri, 17 Apr 2009 13:24:59 GMT""}]","2009-04-20"
"0904.2697","Krzysztof Kulakowski","Joanna Tomkowicz and Krzysztof Kulakowski","Scaling of spin avalanches in growing networks","10 pages, 9 figures. More data in Fig. 7",,"10.1103/PhysRevE.81.052101",,"cond-mat.dis-nn cond-mat.stat-mech","http://arxiv.org/licenses/nonexclusive-distrib/1.0/","  Growing networks decorated with antiferromagnetically coupled spins are
archetypal examples of complex systems due to the frustration and the
multivalley character of their energy landscapes. Here we use the damage
spreading method (DS) to investigate the cohesion of spin avalanches in the
exponential networks and the scale-free networks. On the contrary to the
conventional methods, the results obtained from DS suggest that the avalanche
spectra are characterized by the same statistics as the degree distribution in
their home networks. Further, the obtained mean range $Z$ of an avalanche, i.e.
the maximal distance reached by an avalanche from the damaged site, scales with
the avalanche size $s$ as $Z/N^\beta =f(s/N^{\alpha})$, where $\alpha=0.5$ and
$\beta=0.33$. These values are true for both kinds of networks for the number
$M$ of nodes to which new nodes are attached between 4 and 10; a check for M=25
confirms these values as well.
","[{""version"":""v1"",""created"":""Fri, 17 Apr 2009 15:09:54 GMT""},{""version"":""v2"",""created"":""Tue, 21 Apr 2009 08:41:42 GMT""}]","2015-05-13"
"0904.2698","Frederic Haglund","Frederic Haglund","Commensurability and separability of quasiconvex subgroups","This is the version published by Algebraic & Geometric Topology on 9
  August 2006","Algebr. Geom. Topol. 6 (2006) 949-1024","10.2140/agt.2006.6.949",,"math.GR math.GT","http://arxiv.org/licenses/nonexclusive-distrib/1.0/","  We show that two uniform lattices of a regular right-angled Fuchsian building
are commensurable, provided the chamber is a polygon with at least six edges.
We show that in an arbitrary Gromov-hyperbolic regular right-angled building
associated to a graph product of finite groups, a uniform lattice is
commensurable with the graph product provided all of its quasiconvex subgroups
are separable. We obtain a similar result for uniform lattices of the Davis
complex of Gromov-hyperbolic two-dimensional Coxeter groups. We also prove that
every extension of a uniform lattice of a CAT(0) square complex by a finite
group is virtually trivial, provided each quasiconvex subgroup of the lattice
is separable.
","[{""version"":""v1"",""created"":""Fri, 17 Apr 2009 13:36:05 GMT""}]","2009-04-20"
"0904.2699","Bo Hoistad","S. Keleta, Chr. Bargholtz, M. Bashkanov, M. Berlowski, D. Bogoslawsky,
  H. Calen, H. Clement, L. Demirors, C. Ekstrom, K. Fransson, L. Geren, L.
  Gustafsson, B. Hoistad, G. Ivanov, M. Jacewicz, E. Jiganov, T. Johansson, O.
  Khakimova, F. Kren, S. Kullander, A. Kupsc, A. Kuzmin, K. Lindberg, P.
  Marciniewski, B. Morosov, W. Oelert, C. Pauly, H. Petren, Y. Petukhov, A.
  Povtorejko, A. Pricking, R.J.M.Y. Ruber, K. Schonning, W. Scobel, R.
  Shafigullin, B. Shwartz, T. Skorodko, V. Sopov, J. Stepaniak, P.-E. Tegner,
  P. Thorngren Engblom, V. Tikhomirov, A. Turowiecki, G.J. Wagner, C. Wilkin,
  M. Wolke, J. Zabierowski, I. Zartova, J. Zlomanczuk","Exclusive measurement of two-pion production in the dd --> 4Hepipi
  reaction","20 pages including 18 figures","Nucl.Phys.A825:71-90,2009","10.1016/j.nuclphysa.2009.04.008",,"nucl-ex","http://arxiv.org/licenses/nonexclusive-distrib/1.0/","  The results from the first kinematically complete measurement of the dd -->
4Hepipi reaction are reported. The aim was to investigate a long standing
puzzle regarding the origin of the peculiar pipi-invariant mass distributions
appearing in double pion production in light ion collisions, the so-called ABC
effect. The measurements were performed at the incident deuteron energies of
712 MeV and 1029 MeV, with the WASA detector assembly at CELSIUS in Uppsala,
Sweden. We report the observation of a characteristic enhancement at low
pipi-invariant mass at 712 MeV, the lowest energy yet. At the higher energy, in
addition to confirming previous experimental observations, our results reveal a
strong angular dependence of the pions in the overall centre of mass system.
The results are qualitatively reproduced by a theoretical model, according to
which the ABC effect is described as resulting from a kinematical enhancement
in the production of the pion pairs from two parallel and independent NN--> dpi
sub-processes.
","[{""version"":""v1"",""created"":""Fri, 17 Apr 2009 13:40:12 GMT""}]","2009-06-25"
"0904.2700","Christian Fischer","Christian S. Fischer","Deconfinement phase transition and the quark condensate","4 pages, 3 figures, v2: minor changes, typos corrected, version
  accepted by PRL","Phys.Rev.Lett.103:052003,2009","10.1103/PhysRevLett.103.052003",,"hep-ph","http://arxiv.org/licenses/nonexclusive-distrib/1.0/","  We study the dual quark condensate as a signal for the
confinement-deconfinement phase transition of QCD. This order parameter for
center symmetry has been defined recently by Bilgici et al. within the
framework of lattice QCD. In this work we determine the ordinary and the dual
quark condensate with functional methods using a formulation of the
Dyson-Schwinger equations for the quark propagator on a torus. The temperature
dependence of these condensates serves to investigate the interplay between the
chiral and deconfinement transitions of quenched QCD.
","[{""version"":""v1"",""created"":""Fri, 17 Apr 2009 13:42:11 GMT""},{""version"":""v2"",""created"":""Mon, 27 Jul 2009 11:41:52 GMT""}]","2010-04-15"
"0904.2701","Holger Then","J.T. Mendon\c{c}a, B. Thid\'e, and H. Then","Stimulated Raman and Brillouin backscattering of collimated beams
  carrying orbital angular momentum",,"Phys. Rev. Lett. 102, 185005 (2009)","10.1103/PhysRevLett.102.185005",,"physics.plasm-ph physics.space-ph","http://arxiv.org/licenses/nonexclusive-distrib/1.0/","  We study theoretically the exchange of angular momentum between
electromagnetic and electrostatic waves in a plasma, due to the stimulated
Raman and Brillouin backscattering processes. Angular momentum states for
plasmon and phonon fields are introduced for the first time. We demonstrate
that these states can be excited by nonlinear wave mixing, associated with the
scattering processes. This could be relevant for plasma diagnostics, both in
laboratory and in space. Nonlinearly coupled paraxial equations and instability
growth rates are derived.
","[{""version"":""v1"",""created"":""Fri, 17 Apr 2009 13:49:02 GMT""}]","2015-05-13"
"0904.2702","Vassilios Karakostas Dr.","Vassilios Karakostas","Humean Supervenience in the Light of Contemporary Science","33 pages","Metaphysica (2009) 10: 1-26",,,"physics.hist-ph quant-ph","http://arxiv.org/licenses/nonexclusive-distrib/1.0/","  It is shown that Lewis' ontological doctrine of Humean supervenience
incorporates at its foundation the so-called separability principle of
classical physics. In view of the systematic violation of the latter within
quantum mechanics, the claim that contemporary physical science may posit
non-supervenient relations beyond the spatiotemporal ones is reinforced on a
foundational basis concerning constraints on the state-representation of
physical systems. Depending on the mode of assignment of states to physical
systems, unit state vectors versus statistical density operators, we
distinguish between strongly and weakly non-Humean, non-supervenient relations.
It is demonstrated that in either case the relations of quantum entanglement
constitute prototypical examples of irreducible physical relations that do not
supervene upon a spatiotemporal arrangement of Humean qualities, weakening,
thereby, the thesis of Humean supervenience. It is examined, in this respect,
the status of Lewis' recombination principle, whereas his conception of lawhood
is critically investigated. It is concluded that the assumption of ontological
reductionism, as expressed in Lewis' Humean doctrine, cannot be regarded as a
reliable code of the nature of the physical world and its contents. It is
proposed instead that, due to the undeniable existence of non-supervenient
relations, a metaphysic of relations of a moderate kind ought to be
acknowledged as an indispensable part of our understanding of the natural world
at a fundamental level.
","[{""version"":""v1"",""created"":""Fri, 17 Apr 2009 13:50:54 GMT""}]","2009-04-20"
"0904.2703","Cui Jian","Jian Cui and Heng Fan","Correlations in Grover search","9 pages, 11 figures, summary is revised, more contents are added","Jian Cui and Heng Fan 2010 J. Phys. A: Math. Theor. 43 045305","10.1088/1751-8113/43/4/045305","Volume 43, Number 4","quant-ph","http://arxiv.org/licenses/nonexclusive-distrib/1.0/","  Grover search is a well-known quantum algorithm that outperforms any
classical search algorithm. It is known that quantum correlations such as
entanglement are necessary for the power of quantum computation. But
entanglement is not the only kind of quantum correlations. Other quantum
correlations such as quantum discord are also useful to capture some aspects of
the nonclassical correlation. We investigate several kinds of correlations
including both quantum and classical in the whole process of Grover search
algorithm. These correlations are the concurrence, entanglement of formation,
quantum discord, classical correlation and mutual information. The behaviors of
quantum discord, classical correlation and mutual information are almost the
same while the concurrence is different. When the search is over, all kinds of
correlations are zero, we argue that this is necessary for the final step in
the search.
","[{""version"":""v1"",""created"":""Fri, 17 Apr 2009 13:52:39 GMT""},{""version"":""v2"",""created"":""Tue, 21 Apr 2009 02:16:32 GMT""},{""version"":""v3"",""created"":""Thu, 30 Apr 2009 09:31:25 GMT""},{""version"":""v4"",""created"":""Fri, 4 Sep 2009 07:37:34 GMT""},{""version"":""v5"",""created"":""Thu, 22 Oct 2009 02:39:46 GMT""}]","2010-01-05"
"0904.2704","Jose Luis Toca-Herrera","Susana Moreno-Flores, Rafael Benitez, Maria dM Vivanco, and Jose Luis
  Toca-Herrera","Stress relaxation microscopy (STREM): Imaging mechanical force decay in
  cells","13 pages, 4 figures",,,,"physics.bio-ph","http://arxiv.org/licenses/nonexclusive-distrib/1.0/","  We have developed a novel scanning probe-based methodology to study cell
biomechanics. The time dependence of the force exerted by the cell surface on a
scanning probe at constant local deformation has been used to extract local
relaxational responses. The generalized Maxwell viscoelastic model that
accounts for multi relaxations fully describes the mechanical behaviour of the
cell surface that exhibits a bimodal relaxation. Within the range of tested
forces (0.1-4 nN) a slow and a fast relaxation with characteristic times of 0.1
and 1s have been detected and assigned to rearrangements in the cell membrane
and cytoskeleton cortex, respectively. Relaxation time mapping allows to
simultaneously detect non-uniformities in membrane and cytoskeletal mechanical
behaviour and can be used as both identifying and diagnosing tools for cell
type and cell disease.
","[{""version"":""v1"",""created"":""Fri, 17 Apr 2009 13:52:40 GMT""}]","2009-04-20"
"0904.2705","Marco Piani","M. Piani","Relative Entropy of Entanglement and Restricted Measurements","5 pages; see arXiv:0904.0281 for a different proof of the strict
  positiveness of the regularized relative entropy of entanglement on every
  entangled state","Phys. Rev. Lett. 103, 160504 (2009)","10.1103/PhysRevLett.103.160504",,"quant-ph","http://arxiv.org/licenses/nonexclusive-distrib/1.0/","  We introduce variants of relative entropy of entanglement based on the
optimal distinguishability from unentangled states by means of restricted
measurements. In this way, we are able to prove that the standard regularized
entropy of entanglement is strictly positive for all multipartite entangled
states. In particular, this implies that the asymptotic creation of a
multipartite entangled state by means of local operations and classical
communication always requires the consumption of a non-local resource at a
strictly positive rate.
","[{""version"":""v1"",""created"":""Fri, 17 Apr 2009 14:02:08 GMT""}]","2010-01-29"
"0904.2706","Thomas Fennel","Th. Fennel, K.-H. Meiwes-Broer, J. Tiggesbaumker, P.-G. Reinhard, P.
  M. Dinh, E. Suraud","Laser-driven nonlinear cluster dynamics","text and figures revised","Rev. Mod. Phys. 82:1793, 2010","10.1103/RevModPhys.82.1793",,"physics.atm-clus","http://arxiv.org/licenses/nonexclusive-distrib/1.0/","  Laser excitation of nanometer-sized atomic and molecular clusters offers
various opportunities to explore and control ultrafast many-particle dynamics.
Whereas weak laser fields allow the analysis of photoionization, excited-state
relaxation, and structural modifications on these finite quantum systems,
large-amplitude collective electron motion and Coulomb explosion can be induced
with intense laser pulses. This review provides an overview of key phenomena
arising from laser-cluster interactions with focus on nonlinear optical
excitations and discusses the underlying processes according to the current
understanding. A brief general survey covers basic cluster properties and
excitation mechanisms relevant for laser-driven cluster dynamics. Then, after
an excursion in theoretical and experimental methods, results for single- and
multiphoton excitations are reviewed with emphasis on signatures from time- and
angular resolved photoemission. A key issue of this review is the broad
spectrum of phenomena arising from clusters exposed to strong fields, where the
interaction with the laser pulse creates short-lived and dense nanoplasmas. The
implications for technical developments include the controlled generation of
ion, electron, and radiation pulses, as will be addressed along with
corresponding examples. Finally, future prospects of laser-cluster research as
well as experimental and theoretical challenges are discussed.
","[{""version"":""v1"",""created"":""Fri, 17 Apr 2009 13:17:43 GMT""},{""version"":""v2"",""created"":""Wed, 11 Nov 2009 12:44:46 GMT""},{""version"":""v3"",""created"":""Wed, 16 Dec 2009 16:27:49 GMT""}]","2010-06-15"
"0904.2707","Jan-Willem van de Meent","Jan-Willem van de Meent, Andy J. Sederman, Lynn F. Gladden and Raymond
  E. Goldstein","Measurement of Cytoplasmic Streaming in Chara Corallina by Magnetic
  Resonance Velocimetry","5 pages, 3 figures",,"10.1017/S0022112009992187",,"physics.bio-ph cond-mat.soft","http://arxiv.org/licenses/nonexclusive-distrib/1.0/","  In aquatic plants such as the Characean algae, the force generation that
drives cyclosis is localized within the cytoplasm, yet produces fluid flows
throughout the vacuole. For this to occur the tonoplast must transmit
hydrodynamic shear efficiently. Here, using magnetic resonance velocimetry, we
present the first whole-cell measurements of the cross-sectional longitudinal
velocity field in Chara corallina and show that it is in quantitative agreement
with a recent theoretical analysis of rotational cytoplasmic streaming driven
by bidirectional helical forcing in the cytoplasm, with direct shear
transmission by the tonoplast.
","[{""version"":""v1"",""created"":""Fri, 17 Apr 2009 14:02:53 GMT""}]","2015-05-13"
