"0904.2626","Matthew G. Brin","Matthew G. Brin","The Free Group of Rank 2 is a Limit of Thompson's Group F","19 pages, 19 figures",,"10.4171/GGD/90",,"math.GR","http://arxiv.org/licenses/nonexclusive-distrib/1.0/","  We show that the free group of rank 2 is a limit of 2-markings of Thompson's
group F in the space of all 2-marked groups. More specifically, we find a
sequence of generating pairs for F so that as one goes out the sequence, the
length of the shortest relation satisfied by the generating pair goes to
infinity.
","[{""version"":""v1"",""created"":""Fri, 17 Apr 2009 04:05:10 GMT""},{""version"":""v2"",""created"":""Tue, 21 Apr 2009 17:47:03 GMT""}]","2013-09-04"
"0904.2627","Akira Kinjo","Akira R. Kinjo","Profile Conditional Random Fields for Modeling Protein Families with
  Structural Information","11 pages (two column), 1 figure, 1 table, revised","BIOPHYSICS, Vol. 5, pp.37-44 (2009)","10.2142/biophysics.5.37",,"q-bio.BM","http://arxiv.org/licenses/nonexclusive-distrib/1.0/","  A statistical model of protein families, called profile conditional random
fields (CRFs), is proposed. This model may be regarded as an integration of the
profile hidden Markov model (HMM) and the Finkelstein-Reva (FR) theory of
protein folding. While the model structure of the profile CRF is almost
identical to the profile HMM, it can incorporate arbitrary correlations in the
sequences to be aligned to the model. In addition, like in the FR theory, the
profile CRF can incorporate long-range pairwise interactions between model
states via mean-field-like approximations. We give the detailed formulation of
the model, self-consistent approximations for treating long-range interactions,
and algorithms for computing partition functions and marginal probabilities. We
also outline the methods for the global optimization of model parameters as
well as a Bayesian framework for parameter learning and selection of optimal
alignments.
","[{""version"":""v1"",""created"":""Fri, 17 Apr 2009 06:31:13 GMT""},{""version"":""v2"",""created"":""Sat, 18 Apr 2009 01:18:21 GMT""},{""version"":""v3"",""created"":""Mon, 11 May 2009 02:46:45 GMT""}]","2009-06-01"
"0904.2628","Han Zhang  Dr","H. Zhang, D. Y. Tang, L. M. Zhao, X. Wu, Q. L Bao, K. P. Loh","Trapping of dark vector solitons in a fiber laser","17 pages, 4 figures. Submitted to Optics Express",,,,"physics.optics","http://arxiv.org/licenses/nonexclusive-distrib/1.0/","  We report on the experimental observation of incoherently coupled dark vector
soliton trapping in a fiber laser. Dark vector solitons along the two
orthogonal polarization directions though with large difference in central
frequency, energy and darkness could be still synchronously trapped as a group
velocity locked dark vector soliton in virtue of the incoherent interactions.
Our numerical simulation could well rebirth the experimental observations and
confirm the existence of incoherently coupled dark vector soliton under certain
conditions.
","[{""version"":""v1"",""created"":""Fri, 17 Apr 2009 04:30:48 GMT""},{""version"":""v2"",""created"":""Mon, 4 May 2009 10:02:56 GMT""},{""version"":""v3"",""created"":""Tue, 5 May 2009 01:59:48 GMT""},{""version"":""v4"",""created"":""Thu, 7 May 2009 09:32:50 GMT""}]","2009-05-07"
"0904.2629","K. Suresh Kumar","K. Suresh Kumar","A Class of degenerate Stochastic differential equations with
  non-Lipschitz coefficients","13 pages",,,,"math.PR","http://arxiv.org/licenses/nonexclusive-distrib/1.0/","  We obtain sufficient condition for SDEs to evolve in the positive orthant. We
use comparison theorem arguments to achieve this. As a result we prove the
existence of a unique strong solution for a class of multidimensional
degenerate SDEs with non-Lipschitz diffusion coefficients.
","[{""version"":""v1"",""created"":""Fri, 17 Apr 2009 04:31:42 GMT""}]","2009-04-20"
"0904.2630","Lan Yin","Kun Huang, Zeng-Qiang Yu, Lan Yin","Ginzburg-Landau theory of a trapped Fermi gas with a BEC-BCS crossover","16 pages, 2 figures, to be published in PRA","Phys. Rev. A 79, 053602 (2009)","10.1103/PhysRevA.79.053602",,"cond-mat.quant-gas cond-mat.supr-con","http://arxiv.org/licenses/nonexclusive-distrib/1.0/","  The Ginzburg-Landau theory of a trapped Fermi gas with a BEC-BCS crossover is
derived by the path-integral method. In addition to the standard
Ginzburg-Landau equation, a second equation describing the total atom density
is obtained. These two coupled equations are necessary to describe both
homogeneous and inhomogeneous systems. The Ginzburg-Landau theory is valid near
the transition temperature $T_c$ on both sides of the crossover. In the
weakly-interacting BEC region, it is also accurate at zero temperature where
the Ginzburg-Landau equation can be mapped onto the Gross-Pitaevskii (GP)
equation. The applicability of GP equation at finite temperature is discussed.
On the BEC side, the fluctuation of the order parameter is studied and the
renormalization to the molecule coupling constant is obtained.
","[{""version"":""v1"",""created"":""Fri, 17 Apr 2009 04:32:53 GMT""}]","2015-05-13"
"0904.2631","Hiroshi Ohki","Hiroyuki Abe, Kang-Sin Choi, Tatsuo Kobayashi, Hiroshi Ohki","Non-Abelian Discrete Flavor Symmetries from Magnetized/Intersecting
  Brane Models","20 pages","Nucl.Phys.B820:317-333,2009","10.1016/j.nuclphysb.2009.05.024","WU-HEP-09-01, KUNS-2202, YITP-09-29","hep-ph hep-th","http://arxiv.org/licenses/nonexclusive-distrib/1.0/","  We study non-abelian discrete flavor symmetries, which can appear in
magnetized brane models. For example, $D_4$, $\Delta(27)$ and $\Delta(54)$ can
appear and matter fields with several representations can appear. We also study
the orbifold background, where non-abelian flavor symmetries are broken in a
certain way.
","[{""version"":""v1"",""created"":""Fri, 17 Apr 2009 04:34:06 GMT""}]","2009-07-22"
"0904.2633","Jasjeet Singh Bagla","J. S. Bagla (Harish-Chandra Res. Inst.)","Hubble, Hubble's law and the expanding universe","10 pages, 1 figure","Resonance 14, 216 (2009)",,,"physics.pop-ph","http://arxiv.org/licenses/nonexclusive-distrib/1.0/","  Hubble's name is associated closely with the idea of an expanding universe as
he discovered the relation between the recession velocity and distances of
galaxies. Hubble also did a lot of pioneering work on the distribution of
galaxies in the universe. In this article we take a look at Hubble's law and
discuss how it relates with models of the universe. We also give a historical
perspective of the discoveries that led to the Hubble's law.
","[{""version"":""v1"",""created"":""Fri, 17 Apr 2009 05:18:38 GMT""}]","2009-04-20"
"0904.2634","Hongbin Guo","Hongbin Guo, Rosemary A Renaut, Kewei Chen and Eric M Reiman,","Model Error Correction for Linear Methods of Reversible Radioligand
  Binding Measurements in PET Studies",,,,,"q-bio.QM","http://arxiv.org/licenses/nonexclusive-distrib/1.0/","  Graphical analysis methods are widely used in positron emission tomography
quantification because of their simplicity and model independence. But they
may, particularly for reversible kinetics, lead to bias in the estimated
parameters. The source of the bias is commonly attributed to noise in the data.
Assuming a two-tissue compartmental model, we investigate the bias that
originates from model error. This bias is an intrinsic property of the
simplified linear models used for limited scan durations, and it is exaggerated
by random noise and numerical quadrature error. Conditions are derived under
which Logan's graphical method either over- or under-estimates the distribution
volume in the noise-free case. The bias caused by model error is quantified
analytically. The presented analysis shows that the bias of graphical methods
is inversely proportional to the dissociation rate. Furthermore, visual
examination of the linearity of the Logan plot is not sufficient for
guaranteeing that equilibrium has been reached. A new model which retains the
elegant properties of graphical analysis methods is presented, along with a
numerical algorithm for its solution. We perform simulations with the fibrillar
amyloid-beta radioligand [11C] benzothiazole-aniline using published data from
the University of Pittsburgh and Rotterdam groups. The results show that the
proposed method significantly reduces the bias due to model error. Moreover,
the results for data acquired over a 70 minutes scan duration are at least as
good as those obtained using existing methods for data acquired over a 90
minutes scan duration.
","[{""version"":""v1"",""created"":""Fri, 17 Apr 2009 05:25:12 GMT""}]","2009-04-20"
"0904.2635","Dr. Alok Banerjee","Archana Lakhani, Pallavi Kushwaha, R. Rawat, Kranti Kumar, A. Banerjee
  and P. Chaddah","Variation of T$_g$ with magnetic field in a magnetic glass",,,,,"cond-mat.stat-mech cond-mat.str-el","http://arxiv.org/licenses/nonexclusive-distrib/1.0/","  Glass-like arrest has recently been reported in various magnetic materials.
As in structural glasses, the kinetics of a first-order transformation is
arrested while retaining the higher-entropy phase as a non-ergodic state. We
show visual mesoscopic evidence of the irreversible devitrification of the
arrested antiferromagnetic-insulating phase in
$Pr_{0.5}Ca_{0.5}Mn_{0.975}Al_{0.025}O_3$ to its equilibrium
ferromagnetic-metallic phase with isothermal increase of magnetic field,
similar to its iso-field devitrification on warming. The slope of $T_g$ vs
magnetic field in half-doped manganites is shown to have a sign governed by Le
Chatelier's Principle.
","[{""version"":""v1"",""created"":""Fri, 17 Apr 2009 06:31:02 GMT""}]","2009-04-20"
"0904.2637","Hongbin Guo","Hongbin Guo, Kewei Chen, Rosemary A Renaut, Eric M Reiman","Reducing the noise effects in Logan graphic analysis for PET receptor
  measurements",,,,,"q-bio.QM","http://arxiv.org/licenses/nonexclusive-distrib/1.0/","  Logan's graphical analysis (LGA) is a widely-used approach for quantification
of biochemical and physiological processes from Positron emission tomography
(PET) image data. A well-noted problem associated with the LGA method is the
bias in the estimated parameters. We recently systematically evaluated the bias
associated with the linear model approximation and developed an alternative to
minimize the bias due to model error. In this study, we examined the noise
structure in the equations defining linear quantification methods, including
LGA. The noise structure conflicts with the conditions given by the
Gauss-Markov theorem for the least squares (LS) solution to generate the best
linear unbiased estimator. By carefully taking care of the data error
structure, we propose to use structured total least squares (STLS) to obtain
the solution using a one-dimensional optimization problem. Simulations of PET
data for [11C] benzothiazole-aniline (Pittsburgh Compound-B [PIB]) show that
the proposed method significantly reduces the bias. We conclude that the bias
associated with noise is primarily due to the unusual structure of he
correlated noise and it can be reduced with the proposed STLS method.
","[{""version"":""v1"",""created"":""Fri, 17 Apr 2009 05:44:16 GMT""}]","2009-04-20"
"0904.2638","Krishnendu Chatterjee","Roderick Bloem, Krishnendu Chatterjee, Thomas A. Henzinger and Barbara
  Jobstmann","Better Quality in Synthesis through Quantitative Objectives",,,,,"cs.LO cs.GT","http://arxiv.org/licenses/nonexclusive-distrib/1.0/","  Most specification languages express only qualitative constraints.
  However, among two implementations that satisfy a given specification, one
may be preferred to another. For example, if a specification asks that every
request is followed by a response, one may prefer an implementation that
generates responses quickly but does not generate unnecessary responses. We use
quantitative properties to measure the ""goodness"" of an implementation. Using
games with corresponding quantitative objectives, we can synthesize ""optimal""
implementations, which are preferred among the set of possible implementations
that satisfy a given specification. In particular, we show how automata with
lexicographic mean-payoff conditions can be used to express many interesting
quantitative properties for reactive systems. In this framework, the synthesis
of optimal implementations requires the solution of lexicographic mean-payoff
games (for safety requirements), and the solution of games with both
lexicographic mean-payoff and parity objectives (for liveness requirements). We
present algorithms for solving both kinds of novel graph games.
","[{""version"":""v1"",""created"":""Fri, 17 Apr 2009 05:56:33 GMT""},{""version"":""v2"",""created"":""Fri, 17 May 2013 06:17:49 GMT""},{""version"":""v3"",""created"":""Tue, 28 May 2013 07:13:59 GMT""}]","2013-05-29"
"0904.2639","Hongbin Guo","Hongbin Guo, Rosemary Renaut, Kewei Chen, Eric Reiman","FDG-PET Parametric Imaging by Total Variation Minimization",,,,,"q-bio.QM","http://arxiv.org/licenses/nonexclusive-distrib/1.0/","  Parametric imaging of the cerebral metabolic rate for glucose (CMRGlc) using
[18F]-fluorodeoxyglucose positron emission tomography is considered.
Traditional imaging is hindered due to low signal to noise ratios at individual
voxels. We propose to minimize the total variation of the tracer uptake rates
while requiring good fit of traditional Patlak equations. This minimization
guarantees spatial homogeneity within brain regions and good distinction
between brain regions. Brain phantom simulations demonstrate significant
improvement in quality of images by the proposed method as compared to Patlak
images with post-filtering using Gaussian or median filters.
","[{""version"":""v1"",""created"":""Fri, 17 Apr 2009 06:05:56 GMT""}]","2009-04-20"
"0904.2640","Ann Sophie Rittner","Ann Sophie C. Rittner, Wonsuk Choi, Erich J. Mueller, and John D.
  Reppy","Absence of Pressure-Driven Supersolid Flow at Low Frequency","6 pages, 5 figures","Phys. Rev. B 80, 224516 (2009)","10.1103/PhysRevB.80.224516",,"cond-mat.other cond-mat.stat-mech","http://arxiv.org/licenses/nonexclusive-distrib/1.0/","  An important unresolved question in supersolid research is the degree to
which the non-classical rotational inertia (NCRI) phenomenon observed in the
torsional oscillator experiments of Kim and Chan, is evidence for a
Bose-condensed supersolid state with superfluid-like properties. In an open
annular geometry, Kim and Chan found that a fraction of the solid moment of
inertia is decoupled from the motion of the oscillator; however, when the
annulus is blocked by a partition, the decoupled supersolid fraction is locked
to the oscillator being accelerated by an AC pressure gradient generated by the
moving partition. These observations are in accord with superfluid
hydrodynamics. We apply a low frequency AC pressure gradient in order to search
for a superfluid-like response in a supersolid sample. Our results are
consistent with zero supersolid flow in response to the imposed low frequency
pressure gradient. A statistical analysis of our data sets a bound, at the 68%
confidence level, of 9.6$\times 10^{-4}$ nm/s for the mass transport velocity
carried by a possible supersolid flow. In terms of a simple model for the
supersolid, an upper bound of 3.3$\times 10^{-6}$ is set for the supersolid
fraction at 25 mK, at this same confidence level. These findings force the
conclusion that the NCRI observed in the torsional oscillator experiments is
not evidence for a frequency independent superfluid-like state. Supersolid
behavior is a frequency-dependent phenomenon, clearly evident in the frequency
range of the torsional oscillator experiments, but undetectably small at
frequencies approaching zero.
","[{""version"":""v1"",""created"":""Fri, 17 Apr 2009 06:29:08 GMT""},{""version"":""v2"",""created"":""Thu, 27 Aug 2009 03:42:54 GMT""}]","2010-12-06"
"0904.2641","Francois Boue","Fran\c{c}ois Bou\'e (LLB), Marie Noelle Spiteri (LLB), Claudine
  Williams (LPMC, LPFO)","Pearlnecklacelike chain conformation of hydrophobic polyelectrolyte: a
  SANS study of partially sulfonated polystyrene in water",,"Macromolecules / J Macromolecules 40 (2007) 6679-6691","10.1021/ma060896d",,"cond-mat.soft","http://arxiv.org/licenses/nonexclusive-distrib/1.0/","  The form factor of partially sulfonated polystyrene PSSNa (degree of
sulfonation f =1, 0.72, 0.64 and 0.36), at polymer concentration 0.17M and
0.34M, without or with added salt (0 M, 0.34M, & 0.68M), is measured by Small
Angle Neutron Scattering using the Zero Average Contrast method. The total
scattering function is also measured, allowing extracting the distinct
interchain function and an apparent structure factor. The main result is the
behavior of the form factor which shows contributions of spherical entities as
well as extended chain parts. This is striking for 0.64, while for f = 0.36 the
sphere contribution is more dominant. The conformation does not depend on
polymer concentration. When salt is added, the sphere sizes do not vary, but
the contribution attributed to the stretched parts does vary very much like for
fully sulfonated PSSNa. Discussion of the interchain contribution establishes
that chains are interpenetrated for f= 0.64, and at the overlap limit for
f=0.36. The pearl necklace model appears very suitable. Comparisons are made
with analytical calculation and simulation data. While the roles of Rayleigh
transition, heterogeneous architecture, and strong hydrophobicity of non
sulfonated PS monomers remain to discuss, data give an accurate 3 d image of
the pearl necklace.
","[{""version"":""v1"",""created"":""Fri, 17 Apr 2009 13:46:38 GMT""}]","2009-04-20"
"0904.2642","Paola Cappellaro","Paola Cappellaro and Mikhail D. Lukin","Quantum correlation in disordered spin systems: entanglement and
  applications to magnetic sensing","8 pages, 5 figures","Phys. Rev. A 80, 032311 (2009)","10.1103/PhysRevA.80.032311",,"quant-ph","http://arxiv.org/licenses/nonexclusive-distrib/1.0/","  We propose a strategy to generate a many-body entangled state in a collection
of randomly placed, dipolarly coupled electronic spins in the solid state. By
using coherent control to restrict the evolution into a suitable collective
subspace, this method enables the preparation of GHZ-like and spin-squeezed
states even for randomly positioned spins, while in addition protecting the
entangled states against decoherence. We consider the application of this
squeezing method to improve the sensitivity of nanoscale magnetometer based on
Nitrogen-Vacancy spin qubits in diamond.
","[{""version"":""v1"",""created"":""Fri, 17 Apr 2009 13:11:10 GMT""}]","2009-09-12"
"0904.2643","Paddy Royall","Takehiro Ohtsuka, C. Patrick Royall and Hajime Tanaka","Local structure and dynamics in colloidal fluids and gels","6 pages","Europhysics letters 84 (2008) 46002","10.1209/0295-5075/84/46002",,"cond-mat.soft","http://arxiv.org/licenses/nonexclusive-distrib/1.0/","  Gels in soft-matter systems are an important nonergodic state of matter. We
study a colloid-polymer mixture which is quenched by increasing the polymer
concentration, from a fluid to a gel. Using confocal microscopy, we study both
the static structure and dynamics in three dimensions (3D). Between the
dynamically arrested gel and ergodic fluid comprised of isolated particles we
find an intermediate 'cluster fluid' state, where the 'bonds' between the
colloidal particles have a finite lifetime. The local dynamics are reminiscent
of a fluid, while the local structure is almost identical to that of the gel.
Simultaneous real-time local structural analysis and particle tracking in 3D at
the single-particle level yields the following interesting information.
Particles in the clusters move in a highly correlated manner, but, at the same
time, exhibit significant dynamical heterogeneity, reflecting the enhanced
mobility near the free surface. Deeper quenching eventually leads to a gel
state where the 'bond' lifetime exceeds that of the experiment, although the
local structure is almost identical to that of the 'cluster fluid'.
","[{""version"":""v1"",""created"":""Fri, 17 Apr 2009 11:36:01 GMT""}]","2009-04-20"
"0904.2644","Yohei Tutiya","J. Shiraishi and Y. Tutiya","Periodic ILW equation with discrete Laplacian","17 pages. To appear in J. Phys. A: Math. Theor",,"10.1088/1751-8113/42/40/404018",,"nlin.SI nlin.PS","http://arxiv.org/licenses/nonexclusive-distrib/1.0/","  We study an integro-differential equation which generalizes the periodic
intermediate long wave (ILW) equation. The kernel of the singular integral
involved is an elliptic function written as a second order difference of the
Weierstrass zeta-function. Using Sato's formulation, we show the integrability
and construct some special solutions. An elliptic solution is also obtained. We
present a conjecture based on a Poisson structure that it gives an alternative
description of this integrable hierarchy. We note that this Poisson algebra in
turn is related to a quantum algebra related with the family of Macdonald
difference operators.
","[{""version"":""v1"",""created"":""Fri, 17 Apr 2009 07:13:00 GMT""}]","2015-05-13"
"0904.2645","Jenny Ollars","Laurent Chupin (ICJ)","Fokker-Planck equation in bounded domain",,,,,"math.CA math.AP math.FA","http://arxiv.org/licenses/nonexclusive-distrib/1.0/","  We study the existence and the uniqueness of a solution $\fy$ to the linear
Fokker-Planck equation $-\Delta \fy + \div(\fy \F) = f$ in a bounded domain of
$\R^d$ when $\F$ is a ""confinement"" vector field acting for instance like the
inverse of the distance to the boundary. An illustration of the obtained
results is given within the framework of fluid mechanics and polymer flows.
","[{""version"":""v1"",""created"":""Fri, 17 Apr 2009 07:13:27 GMT""}]","2009-04-20"
"0904.2646","Fernand Renard M","M. Beccaria, F.M. Renard, C. Verzegnassi","A peculiar property of SUSY amplitudes at high energy","23 pqges, 4 eps figures","Int.J.Mod.Phys.A24:6123-6140,2009","10.1142/S0217751X09047569",,"hep-ph","http://arxiv.org/licenses/nonexclusive-distrib/1.0/","  We observe that the electroweak one loop correction to the quark+gluon to
quark+Higgs amplitude at high energy involves both single and quadratic
logarithms of the energy in the SM case but only quadratic logarithms in the
MSSM case. We explore the origin of this special SUSY cancellation, both in a
diagrammatic way and through the splitting+Parameter Renormalization procedure.
We show that it is not an accident but a remarkableand general SUSY property of
the renormalized Higgs-fermion-fermion and Higgsino-sfermion-fermion vertices
which directly reflects in such processes, for example in $bg\to tH^-$, $bg\to
bH^0$, $bg\to bh^0$, $bg\to bA^0$, and through equivalence in $bg\to
tW^-_{long}$, $bg\to bZ_{long}$, as well as in $bg\to \tilde{t}\chi^-$,
$bg\to\tilde{b}\chi^0$. This simplification of the high energy behaviour (which
only leaves quadratic logarithms involving pure gauge couplings without any
free parameter) allows to write simple relations among these various processes
which constitute genuine tests of the assumed SUSY model.
","[{""version"":""v1"",""created"":""Fri, 17 Apr 2009 07:22:03 GMT""},{""version"":""v2"",""created"":""Wed, 2 Sep 2009 10:08:05 GMT""}]","2010-01-21"
"0904.2647","Alexander  Shames","A. I. Shames, E. A. Katz, A. M.Panich, D. Mogilyansky, E. Mogilko, J.
  Grinblat, V. P. Belousov, I. M. Belousova, and A. N. Ponomarev","Closed pi-electron Network in Large Polyhedral Multi-shell Carbon
  Nanoparticles","32 pages, 5 figures",,,,"cond-mat.mes-hall","http://arxiv.org/licenses/nonexclusive-distrib/1.0/","  High Resolution Transmission Electron Microscopy (HRTEM), X-ray Diffraction
(XRD) and Raman spectroscopy reveal a polyhedral multi-shell fullerene-like
structure of astralen carbon nanoparticles. The polyhedra consist of large flat
graphitic faces connected by defective edge regions with presumably
pentagon-like structure. The faces comprise a stacking of 20-50 planar graphene
sheets with inter-sheet distance of ~ 0.340 nm. Average sizes of the particles
and their flat faces are ~ 40 nm and ~ 15 nm, respectively. The astralen
particles are suggested to have defect-free sp^2 flat faces and all defects
condense at their polyhedral edges. Electron Paramagnetic Resonance (EPR)
spectra of polycrystalline astralen samples reveal two components: a very broad
signal with DHpp > 1 T and an asymmetric narrow one centered close to g = 2.00.
The latter consists of two overlapping Lorentzian lines. All spectral
components are independent of ambient pressure. The intensities of all EPR
signals show no changes on decreasing temperature from T = 300 K down to 4 K
demonstrating the Pauli paramagnetism. Electron spin-lattice relaxation times
T1e remain very short within the same temperature range. Temperature dependent
13C Nuclear Magneti? Resonance (NMR) measurements yield nuclear spin-lattice
relaxation times T1n ~ T^-0.612. The exponent in the T1n(T)-dependence for
astralen falls between the metallic behavior, T1n ~ T^-1 (Korringa relation),
and the semiconductor behavior, T1n ~T^-0.5. All unusual magnetic resonance
features of astralen are attributed to delocalized charge carriers which amount
considerably exceeds that of spins localized in defects on multi-shell
polyhedra edges.
","[{""version"":""v1"",""created"":""Fri, 17 Apr 2009 07:33:19 GMT""}]","2009-04-20"
