"0904.2771","Christopher Laumann","Alexei Kitaev, Chris Laumann","Topological phases and quantum computation","31 pages. Lectures given by Alexei Kitaev at the 2008 Les Houches
  Summer School ""Exact methods in low-dimensional physics and quantum
  computing""",,,,"cond-mat.mes-hall quant-ph","http://arxiv.org/licenses/nonexclusive-distrib/1.0/","  This is a collection of lecture notes from three lectures given by Alexei
Kitaev at the 2008 Les Houches summer school ""Exact methods in low-dimensional
physics and quantum computing."" They provide a pedagogical introduction to
topological phenomena in 1-D superconductors and in the 2-D topological phases
of the toric code and honeycomb model.
","[{""version"":""v1"",""created"":""Mon, 20 Apr 2009 16:49:28 GMT""}]","2009-04-21"
"0904.2833","Ichiro Oda","Ichiro Oda","Renormalizability of Massive Gravity in Three Dimensions","13 pages, no figures","JHEP 0905:064,2009","10.1088/1126-6708/2009/05/064","DPUR/TH/16","hep-th","http://arxiv.org/licenses/nonexclusive-distrib/1.0/","  We discuss renormalizability of a recently established, massive gravity
theory with particular higher derivative terms in three space-time dimensions.
It is shown that this massive gravity is certainly renormalizable as well as
unitary, so it gives us a physically interesting toy model of perturbative
quantum gravity in three dimensions.
","[{""version"":""v1"",""created"":""Mon, 20 Apr 2009 19:51:05 GMT""},{""version"":""v2"",""created"":""Mon, 20 Apr 2009 20:54:19 GMT""}]","2009-05-29"
"0904.2873","Nikolay Bobev","Nikolay Bobev and Arnab Kundu","Deformations of Holographic Duals to Non-Relativistic CFTs","34 pages, 1 figure, LaTeX","JHEP 0907:098,2009","10.1088/1126-6708/2009/07/098","NSF-KITP-09-49","hep-th","http://arxiv.org/licenses/nonexclusive-distrib/1.0/","  We construct the non-relativistic counterparts of some well-known
supergravity solutions dual to relevant and marginal deformations of N=4 super
Yang-Mills. The main tool we use is the null Melvin twist and we apply it to
the N=1 and N=2* Pilch-Warner RG flow solutions as well as the Lunin-Maldacena
solution dual to beta-deformations of N=4 super Yang-Mills. We also obtain a
family of supergravity solutions with Schrodinger symmetry interpolating
between the non-relativistic version of the N=1 Pilch-Warner and
Klebanov-Witten fixed points. A generic feature of these non-relativistic
backgrounds is the presence of non-vanishing internal fluxes. We also find the
most general, three-parameter, null Melvin twist of the AdS_5xS^5 black hole.
We briefly comment on the field theories dual to these supergravity solutions.
","[{""version"":""v1"",""created"":""Mon, 20 Apr 2009 16:39:00 GMT""}]","2010-01-15"
"0904.2930","Marcin Ku\'zniak Dr.","P.-A. Amaudruz, M. Batygov, B. Beltran, J. Bonatt, K. Boudjemline,
  M.G. Boulay, B. Broerman, J.F. Bueno, A. Butcher, B. Cai, T. Caldwell, M.
  Chen, R. Chouinard, B.T. Cleveland, D. Cranshaw, K. Dering, F. Duncan, N.
  Fatemighomi, R. Ford, R. Gagnon, P. Giampa, F. Giuliani, M. Gold, V.V.
  Golovko, P. Gorel, E. Grace, K. Graham, D.R. Grant, R. Hakobyan, A.L. Hallin,
  M. Hamstra, P. Harvey, C. Hearns, J. Hofgartner, C.J. Jillings, M. Ku\'zniak,
  I. Lawson, F. La Zia, O. Li, J.J. Lidgard, P. Liimatainen, W.H. Lippincott,
  R. Mathew, A.B. McDonald, T. McElroy, K. McFarlane, R. Mehdiyev, D.N.
  McKinsey, J. Monroe, A. Muir, C. Nantais, K. Nicolics, J. Nikkel, A.J. Noble,
  E. O'Dwyer, K. Olsen, C. Ouellet, P. Pasuthip, S.J.M. Peeters, T. Pollmann,
  W. Rau, F. Reti\`ere, M. Ronquest, N. Seeburn, P. Skensved, B. Smith, T.
  Sonley, J. Tang, E. V\'azquez-J\'auregui, L. Veloce, J. Walding, M. Ward","Measurement of the scintillation time spectra and pulse-shape
  discrimination of low-energy beta and nuclear recoils in liquid argon with
  DEAP-1","Accepted for publication in Astroparticle Physics","Astroparticle Physics 85 (2016) 1-23","10.1016/j.astropartphys.2016.09.002",,"astro-ph.IM","http://arxiv.org/licenses/nonexclusive-distrib/1.0/","  The DEAP-1 low-background liquid argon detector was used to measure
scintillation pulse shapes of electron and nuclear recoil events and to
demonstrate the feasibility of pulse-shape discrimination (PSD) down to an
electron-equivalent energy of 20 keV.
  In the surface dataset using a triple-coincidence tag we found the fraction
of beta events that are misidentified as nuclear recoils to be $<1.4\times
10^{-7}$ (90% C.L.) for energies between 43-86 keVee and for a nuclear recoil
acceptance of at least 90%, with 4% systematic uncertainty on the absolute
energy scale. The discrimination measurement on surface was limited by nuclear
recoils induced by cosmic-ray generated neutrons. This was improved by moving
the detector to the SNOLAB underground laboratory, where the reduced background
rate allowed the same measurement with only a double-coincidence tag.
  The combined data set contains $1.23\times10^8$ events. One of those, in the
underground data set, is in the nuclear-recoil region of interest. Taking into
account the expected background of 0.48 events coming from random pileup, the
resulting upper limit on the electronic recoil contamination is
$<2.7\times10^{-8}$ (90% C.L.) between 44-89 keVee and for a nuclear recoil
acceptance of at least 90%, with 6% systematic uncertainty on the absolute
energy scale.
  We developed a general mathematical framework to describe PSD parameter
distributions and used it to build an analytical model of the distributions
observed in DEAP-1. Using this model, we project a misidentification fraction
of approx. $10^{-10}$ for an electron-equivalent energy threshold of 15 keV for
a detector with 8 PE/keVee light yield. This reduction enables a search for
spin-independent scattering of WIMPs from 1000 kg of liquid argon with a
WIMP-nucleon cross-section sensitivity of $10^{-46}$ cm$^2$, assuming
negligible contribution from nuclear recoil backgrounds.
","[{""version"":""v1"",""created"":""Mon, 20 Apr 2009 19:49:09 GMT""},{""version"":""v2"",""created"":""Wed, 14 Sep 2016 17:01:40 GMT""}]","2016-09-29"
"0904.2934","Paul Frampton","Paul H. Frampton","Desperately Seeking Intermediate-Mass Black Holes","Two typos",,,,"hep-th","http://arxiv.org/licenses/nonexclusive-distrib/1.0/","  Observational searches for Intermediate Mass Black Holes (IMBHs), defined to
have masses between 30 and 300,000 solar masses, provide limits which allow up
to ten percent of what is presently identified as halo dark matter to be in the
form of IMBHs. These concentrate entropy so efficiently that the halo
contribution can be bigger than the core supermassive black hole. Formation of
IMBHs is briefly discussed.
","[{""version"":""v1"",""created"":""Mon, 20 Apr 2009 18:49:53 GMT""},{""version"":""v2"",""created"":""Tue, 21 Apr 2009 23:46:05 GMT""}]","2009-04-22"
"0904.3000","Pierre Patie","Pierre Patie","Law of the exponential functional of one-sided L\'evy processes and
  Asian options",,"C. R. Acad. Sci. Paris, Ser. I 347, 407-411, 2009","10.1016/j.crma.2009.02.013",,"math.PR q-fin.PR","http://arxiv.org/licenses/nonexclusive-distrib/1.0/","  The purpose of this note is to describe, in terms of a power series, the
distribution function of the exponential functional, taken at some independent
exponential time, of a spectrally negative L\'evy process \xi with unbounded
variation. We also derive a Geman-Yor type formula for Asian options prices in
a financial market driven by e^\xi.
","[{""version"":""v1"",""created"":""Mon, 20 Apr 2009 16:31:12 GMT""}]","2009-04-22"
"0904.3002","David Seery","Philippe Brax, Clare Burrage, Anne-Christine Davis, David Seery and
  Amanda Weltman","Collider constraints on interactions of dark energy with the Standard
  Model","39 pages, 8 figures, uses ioplatex.sty and feynmp. v2: Matches
  version accepted by JHEP; extended discussion of straight corrections,
  summarized in the text and described in detail in a new Appendix A.
  Conclusions unchanged","JHEP 0909:128,2009","10.1088/1126-6708/2009/09/128","DESY 08-207","hep-ph astro-ph.CO hep-th","http://arxiv.org/licenses/nonexclusive-distrib/1.0/","  We study models in which a light scalar dark energy particle couples to the
gauge fields of the electroweak force, the photon, Z and W bosons. Our analysis
applies to a large class of interacting dark energy models, including those in
which the dark energy mass can be adjusted to evade fifth-force bounds by the
so-called chameleon mechanism. We conclude that--with the usual choice of Higgs
sector--electroweak precision observables are screened from the indirect
effects of dark energy, making such corrections effectively unobservable at
present-day colliders, and limiting the dark energy discovery potential of any
future International Linear Collider. We show that a similar screening effect
applies to processes mediated by flavour-changing neutral currents, which can
be traced to the Glashow-Iliopoulos-Maiani mechanism. However, Higgs boson
production at the Large Hadron Collider via weak boson fusion may receive
observable corrections.
","[{""version"":""v1"",""created"":""Mon, 20 Apr 2009 19:48:24 GMT""},{""version"":""v2"",""created"":""Tue, 8 Dec 2009 18:05:21 GMT""}]","2009-12-08"
"0904.3014","Paul F. Harrison","P. F. Harrison, D. R. J. Roythorne and W. G. Scott","Is the Unitarity Triangle Right?","Talk given at the International Conference on Particles And Nuclei
  (PANIC08), Eilat, Israel, 13th November 2008. 4 pages",,,,"hep-ph","http://arxiv.org/licenses/nonexclusive-distrib/1.0/","  The latest fits to the CKM matrix indicate that alpha=(90.7+4.5-2.9) degrees.
The proximity of alpha to a right-angle raises the question: is it merely
accidental or is it due to some physics beyond the Standard Model? In the
framework of our recently-proposed flavour permutation symmetry, we consider
the similarities between the quark and lepton mixing matrices, V and U, arguing
that the relative smallness of one element in each suggests common constraints.
These constraints link the smallness of V_ub and U_e3 with each other, and with
the approximate mu-tau symmetry observed in leptonic mixing, together with a
prediction of a large Dirac CP phase in both the quark and lepton sectors. In
the quark case, we predict alpha=(89.0\pm 0.2) degrees, in agreement with data
and suggesting that the unitarity triangle is in fact very nearly, but not
exactly right.
","[{""version"":""v1"",""created"":""Mon, 20 Apr 2009 19:21:47 GMT""}]","2009-04-21"
"0904.3049","Elsa Xiao","Y.-F. Xiao, T.Q. Nhan, M.W.B. Wilson, and J.M. Fraser","Photoluminescence clamping with few excitons in a single-walled carbon
  nanotube","4 pages, 3 figures","Phys. Rev. Lett. 104, 017401 (2010) [4 pages]","10.1103/PhysRevLett.104.017401",,"cond-mat.mtrl-sci","http://arxiv.org/licenses/nonexclusive-distrib/1.0/","  Single air-suspended carbon nanotubes (length 2 - 5 microns) exhibit high
optical quantum efficiency (7 - 20%) for resonant pumping at low intensities.
Under ultrafast excitation, the photoluminescence dramatically saturates for
very low injected exciton numbers (2 to 6 excitons per pulse per SWCNT). This
PL clamping is attributed to highly efficient exciton-exciton annihilation over
micron length scales. Stochastic modeling of exciton dynamics and femtosecond
excitation correlation spectroscopy allow determination of nanotube absorption
(2 - 6%) and exciton lifetime (85 +- 20 ps).
","[{""version"":""v1"",""created"":""Mon, 20 Apr 2009 19:54:32 GMT""}]","2010-01-14"
"0904.3064","Piotr Su{\l}kowski","Piotr Su{\l}kowski","Matrix models for 2* theories","20 pages, 5 figures","Phys.Rev.D80:086006,2009","10.1103/PhysRevD.80.086006",,"hep-th math-ph math.CO math.MP","http://arxiv.org/licenses/nonexclusive-distrib/1.0/","  We show how to represent a class of expressions involving discrete sums over
partitions as matrix models. We apply this technique to the partition functions
of 2* theories, i.e. Seiberg-Witten theories with the massive hypermultiplet in
the adjoint representation. We consider theories in four, five and six
dimensions, and obtain new matrix models respectively of rational,
trigonometric and elliptic type. The matrix models for five- and
six-dimensional U(1) theories are derived from the topological vertex
construction related to curves of genus one and two.
","[{""version"":""v1"",""created"":""Mon, 20 Apr 2009 19:39:33 GMT""}]","2009-10-29"
"0904.3065","Nuria Barberan","D. Dagnino, N. Barberan, M. Lewenstein, and J. Dalibard","Vortex nucleation as a case study of symmetry breaking in quantum
  systems","Minor changes","Nature Physics 5, 431 (2009)","10.1038/nphys1277",,"cond-mat.quant-gas","http://arxiv.org/licenses/nonexclusive-distrib/1.0/","  Mean-field methods are a very powerful tool for investigating weakly
interacting many-body systems in many branches of physics. In particular, they
describe with excellent accuracy trapped Bose-Einstein condensates. A generic,
but difficult question concerns the relation between the symmetry properties of
the true many-body state and its mean-field approximation. Here, we address
this question by considering, theoretically, vortex nucleation in a rotating
Bose-Einstein condensate. A slow sweep of the rotation frequency changes the
state of the system from being at rest to the one containing one vortex. Within
the mean-field framework, the jump in symmetry occurs through a turbulent phase
around a certain critical frequency. The exact many-body ground state at the
critical frequency exhibits strong correlations and entanglement. We believe
that this constitutes a paradigm example of symmetry breaking in - or change of
the order parameter of - quantum many-body systems in the course of adiabatic
evolution.
","[{""version"":""v1"",""created"":""Mon, 20 Apr 2009 16:00:38 GMT""},{""version"":""v2"",""created"":""Wed, 9 Dec 2009 10:41:43 GMT""},{""version"":""v3"",""created"":""Mon, 21 Dec 2009 10:33:43 GMT""}]","2009-12-21"
"0904.3066","Irina Marinova","I. Marinova (UT Austin), S. Jogee (UT Austin), A. Heiderman (UT
  Austin), F. D. Barazza (EPFL), M. E. Gray (Nottingham), M. Barden
  (Innsbruck), C. Wolf (Oxford), C. Y. Peng (NRC HIA, STScI), D. Bacon
  (Portsmouth), M. Balogh (Waterloo), E. F. Bell (MPIA), A. Bohm (AIP,
  Innsbruck), J. A. R. Caldwell (UT McDonald), B. Haussler (Nottingham), C.
  Heymans (UBC, IAP), K. Jahnke (MPIA), E. van Kampen (Innsbruck), S. Koposov
  (MPIA), K. Lane (Nottingham), D. H. McIntosh (Missouri, UMass), K.
  Meisenheimer (MPIA), H.-W. Rix (MPIA), S. F. Sanchez (CAHA), A. Taylor
  (SUPA), L. Wisotzki (AIP), X. Zheng (PMO)","Barred Galaxies in the Abell 901/2 Supercluster with STAGES","accepted for publication in ApJ, abstract abridged, for high
  resolution figures see
  http://www.as.utexas.edu/~marinova/STAGES/STAGES_bars.pdf","Astrophys.J.698:1639-1658,2009","10.1088/0004-637X/698/2/1639",,"astro-ph.CO astro-ph.GA","http://arxiv.org/licenses/nonexclusive-distrib/1.0/","  We present a study of bar and host disk evolution in a dense cluster
environment, based on a sample of ~800 bright (MV <= -18) galaxies in the Abell
901/2 supercluster at z~0.165. We use HST ACS F606W imaging from the STAGES
survey, and data from Spitzer, XMM-Newton, and COMBO-17. We identify and
characterize bars through ellipse-fitting, and other morphological features
through visual classification. (1) We explore three commonly used methods for
selecting disk galaxies. We find 625, 485, and 353 disk galaxies, respectively,
via visual classification, a single component S'ersic cut (n <= 2.5), and a
blue-cloud cut. In cluster environments, the latter two methods miss 31% and
51%, respectively, of visually-identified disks. (2) For moderately inclined
disks, the three methods of disk selection yield a similar global optical bar
fraction (f_bar-opt) of 34% +10%/-3%, 31% +10%/-3%, and 30% +10%/-3%,
respectively. (3) f_bar-opt rises in brighter galaxies and those which appear
to have no significant bulge component. Within a given absolute magnitude bin,
f_bar-opt is higher in visually-selected disk galaxies that have no bulge as
opposed to those with bulges. For a given morphological class, f_bar-opt rises
at higher luminosities. (4) For bright early-types, as well as faint late-type
systems with no evident bulge, the optical bar fraction in the Abell 901/2
clusters is comparable within a factor of 1.1 to 1.4 to that of field galaxies
at lower redshifts (5) Between the core and the virial radius of the cluster at
intermediate environmental densities, the optical bar fraction does not appear
to depend strongly on the local environment density and varies at most by a
factor of ~1.3. We discuss the implications of our results for the evolution of
bars and disks in dense environments.
","[{""version"":""v1"",""created"":""Mon, 20 Apr 2009 16:04:02 GMT""}]","2014-11-18"
"0904.3067","Leonid Glozman","L. Ya. Glozman, A. V. Nefediev","Chiral symmetry, the angular content of the vector current in QED and
  QCD, and the holographic description of hadrons","4 pp. The title has been changed. Implications for OPE and
  holographic description of mesons have been added. To appear in PRD","Phys.Rev.D80:057901,2009","10.1103/PhysRevD.80.057901",,"hep-ph hep-lat hep-th nucl-th","http://arxiv.org/licenses/nonexclusive-distrib/1.0/","  We perform a general chiral symmetry and unitarity based analysis of a local
process of the fermion-antifermion creation from the vacuum by a high-energy
photon as well as an explicit partial wave analysis of the vector current in
QED and QCD. It turns out that such a local process proceeds necessarily via a
certain superposition of the $S$- and $D$-wave contributions. These constraints
from chiral symmetry and unitarity are confronted then with the well-known
theoretical and experimental results on $e^+e^-\to\gamma\to e^+e^-$,
$e^+e^-\to\gamma\to \mu^+\mu^-$, and $e^+e^-\to\gamma\to q\bar{q}$ in the
ultrarelativistic limit. It is shown that these well-known results are
consistent with the $S+D$-wave structure of the vertex and are inconsistent
with the pure $S$-wave interpretation of the vertex. Then a free quark loop in
the $1^{--}$ channel, representing the leading term in the Operator Product
Expansion, contains both $S$-wave and $D$-wave contributions. This fact rules
out the possibility that there is only one radial trajectory for the
$\rho$-mesons with the fixed $S$-wave content. It also implies that all
holographic models that assume a pure $S$-wave content of the $\rho$-meson have
to fail to satisfy the matching conditions at the ultraviolet border $z=0$.
","[{""version"":""v1"",""created"":""Mon, 20 Apr 2009 16:10:00 GMT""},{""version"":""v2"",""created"":""Fri, 24 Apr 2009 16:40:22 GMT""},{""version"":""v3"",""created"":""Fri, 4 Sep 2009 09:21:58 GMT""}]","2009-11-06"
"0904.3068","Matteo Correnti","M. Correnti, M. Bellazzini and F.R. Ferraro","Red Clump stars in the Bootes III stellar system","5 pages, 3 figures, accepted for publication in MNRAS Letters",,"10.1111/j.1745-3933.2009.00677.x",,"astro-ph.GA astro-ph.SR","http://arxiv.org/licenses/nonexclusive-distrib/1.0/","  We report on the detection of a population of Red Clump (RC) stars probably
associated with the recently discovered stellar system Bootes III. The RC is
identified as a 3 sigma peak in the Luminosity Function (LF) of colour-selected
stars extracted from the SDSS database. The peak is consistently detected in
the g,r,i and z LFs at the expected luminosity of a typical RC at the distance
of Bootes III. Moreover the stars around the LF peak show a maximum of surface
density nearly coincident with the reported center of the system. Assuming that
the detected feature is the genuine RC of Bootes III, we find that the system
has the HB morphology typical of old and metal-poor dwarf spheroidals, it has
an integrated magnitude M_V=-5.8 pm 0.5 and an ellipticity epsilon about 0.5,
quite typical of the recently identified new class of very faint dwarf
galaxies.
","[{""version"":""v1"",""created"":""Mon, 20 Apr 2009 16:17:33 GMT""}]","2015-05-13"
"0904.3069","Michel Gross","Philippe Goy (LKB - Lhomond), Sylvain Caroopen (LKB - Lhomond), Michel
  Gross (LKB - Lhomond)","Quasi-Optical Characterization of Dielectric and Ferrite Materials","17th International Symposium on Space THz Technology, Paris : France
  (2006)",,,,"physics.optics physics.ins-det","http://arxiv.org/licenses/nonexclusive-distrib/1.0/","  Quasi-Optical Characterization of Dielectric and Ferrite Materials are made
in the millimeter-submillimeter range by using a Quasi-Optical (QO) benches
that can be relatively compact, typically of the order 10cm wide and 1m long.
","[{""version"":""v1"",""created"":""Mon, 20 Apr 2009 16:19:34 GMT""}]","2009-04-21"
"0904.3070","Randall D. Peters","Randall D. Peters, Sheng-Chiang ""John"" Lee","Pendulum Sensor using an Optical Mouse","7 pages, 6 figures",,,,"physics.gen-ph physics.class-ph","http://arxiv.org/licenses/nonexclusive-distrib/1.0/","  An optical mouse that is in common use with personal computers is employed to
measure the motion of a pendulum. The pendulum can be monitored (i) realtime
only, or (ii) also with data storage for later detailed analysis using Excel.
The software developed for this purpose is a LabView executable algorithm. It
allows the user to select among several modes that include filtering
operations. The limiting resolution of this position sensor, which is in the
neighborhood of 50 micrometers, is determined by the 'dpi' specification of the
mouse.
","[{""version"":""v1"",""created"":""Mon, 20 Apr 2009 17:18:51 GMT""}]","2009-04-21"
"0904.3071","Gary Goldstein","Gary R. Goldstein (Tufts U.) and Simonetta Liuti (U. Virginia)","Exclusive Meson Electroproduction: GPDs, Regge and Dispersion Relations","5 pages, 4 figures, Spin 2008 contribution, to be published in
  Proceedings","AIP Conf.Proc.1149:527-532,2009","10.1063/1.3215704",,"hep-ph","http://arxiv.org/licenses/nonexclusive-distrib/1.0/","  Exclusive pi0 electroproduction from nucleons at large photon virtuality can
be described in terms of Generalized Parton Distributions, particularly the
chiral odd subset. Chiral odd GPDs are related to transversity and can be
accessed experimentally for various special choices of observables. This is
accomplished by choosing C-parity odd and chiral odd combinations of t-channel
exchange quantum numbers. These GPDs are calculated in a spectator model, and
are constrained by boundary functions. Alternatively, the production amplitudes
correspond to C-odd Regge exchanges with final state interactions. The helicity
structure of the virtual photoproduction amplitudes provides relations between
the partonic description via GPDs and the hadronic, Regge description of C-odd
processes, all via quark helicity flip. GPDs, in general, are analytic
functions of energy variables. Their integrals over unobservable parton momenta
thereby satisfy Dispersion Relations (DR). Using DR's could allow the real part
of the amplitudes, the integrated GPDs, to be extracted from the more easily
measured imaginary parts. However, at non-zero momentum transfer DRs require
integration over unphysical regions of the variables. We show that the relevant
unphysical region of the non-forward DRs is considerable. This will vitiate the
efforts to avoid the actual measurement of the real parts more directly.
","[{""version"":""v1"",""created"":""Mon, 20 Apr 2009 16:32:36 GMT""}]","2009-08-24"
"0904.3072","Lasse Rempe","Lasse Rempe and Gwyneth M. Stallard","Hausdorff dimensions of escaping sets of transcendental entire functions","9 pages","Proc. Amer. Math. Soc. 138 (2010), 1657-1665.","10.1090/S0002-9939-09-10104-1",,"math.DS math.CV","http://arxiv.org/licenses/nonexclusive-distrib/1.0/","  Let $f$ and $g$ be transcendental entire functions, each with a bounded set
of singular values, and suppose that $f$ and $g$ are affinely equivalent (that
is, $g \circ \phi= \psi\circ f$, where $\phi,\psi:\C\to\C$ are affine). We show
that the escaping sets of $f$ and $g$ have the same Hausdorff dimension.
  Using a result of the second author, we deduce that there exists a family of
transcendental entire functions for which the escaping set has Hausdorff
dimension equal to one.
","[{""version"":""v1"",""created"":""Mon, 20 Apr 2009 16:34:38 GMT""}]","2010-04-08"
"0904.3073","Jens Pruschke","J. Berges, J. Pruschke, A. Rothkopf","Instability-induced fermion production in quantum field theory","19 pages, 16 figures, Phys.Rev.D version, minor corrections","Phys.Rev.D80:023522,2009","10.1103/PhysRevD.80.023522",,"hep-ph astro-ph.CO hep-th nucl-th","http://arxiv.org/licenses/nonexclusive-distrib/1.0/","  Nonequilibrium instabilities are known to lead to exponential amplification
of boson occupation numbers for low momentum modes on time scales much shorter
than the asymptotic thermal equilibration time. We show for Yukawa-type
interactions that this growth induces very efficient fermion production, which
proceeds with the maximum primary boson growth rate. The description is based
on a 1/N expansion of the 2PI effective action to NLO including boson-fermion
loops, which are crucial to observe this phenomenon. For long enough
amplification in the boson sector, fermion production terminates when the
thermal occupancy is reached in the infrared. At higher momenta, where boson
occupation numbers are low, the fermion modes exhibit a power-law regime with
exponent two.
","[{""version"":""v1"",""created"":""Mon, 20 Apr 2009 18:19:44 GMT""},{""version"":""v2"",""created"":""Tue, 25 Aug 2009 11:41:51 GMT""}]","2009-09-02"
"0904.3074","Misha Popov A","Michael A. Popov","P vs NP Problem in the field anthropology",,,,,"cs.OH","http://creativecommons.org/licenses/by-nc-sa/3.0/","  An attempt of a new kind of complexity anthropology is considered.
","[{""version"":""v1"",""created"":""Mon, 20 Apr 2009 17:16:06 GMT""}]","2009-04-21"
