"0904.3093","Petteri Kaski","Andreas Bj\""orklund and Thore Husfeldt and Petteri Kaski and Mikko
  Koivisto","Counting Paths and Packings in Halves",,,,,"cs.DS cs.DM","http://arxiv.org/licenses/nonexclusive-distrib/1.0/","  It is shown that one can count $k$-edge paths in an $n$-vertex graph and
$m$-set $k$-packings on an $n$-element universe, respectively, in time ${n
\choose k/2}$ and ${n \choose mk/2}$, up to a factor polynomial in $n$, $k$,
and $m$; in polynomial space, the bounds hold if multiplied by $3^{k/2}$ or
$5^{mk/2}$, respectively. These are implications of a more general result:
given two set families on an $n$-element universe, one can count the disjoint
pairs of sets in the Cartesian product of the two families with $\nO(n \ell)$
basic operations, where $\ell$ is the number of members in the two families and
their subsets.
","[{""version"":""v1"",""created"":""Mon, 20 Apr 2009 19:46:39 GMT""}]","2009-04-21"
"0904.3094","Hung Tran","Hung Vinh Tran","Adjoint methods for static Hamilton-Jacobi equations","final version","Calc. Var. (2011) 41:301-319","10.1007/s00526-010-0363-x",,"math.AP","http://arxiv.org/licenses/nonexclusive-distrib/1.0/","  We use the adjoint methods to study the static Hamilton-Jacobi equations and
to prove the speed of convergence for those equations. The main new ideas are
to introduce adjoint equations corresponding to the formal linearizations of
regularized equations of vanishing viscosity type, and from the solutions
$\sigma^{\epsilon}$ of those we can get the properties of the solutions $u$ of
the Hamilton-Jacobi equations. We classify the static equations into two types
and present two new ways to deal with each type. The methods can be applied to
various static problems and point out the new ways to look at those PDE.
","[{""version"":""v1"",""created"":""Mon, 20 Apr 2009 23:14:06 GMT""},{""version"":""v2"",""created"":""Mon, 26 Oct 2009 22:28:36 GMT""},{""version"":""v3"",""created"":""Mon, 2 Jan 2012 16:44:45 GMT""}]","2012-01-04"
"0904.3095","Tereasa G. Brainerd","Tereasa G. Brainerd, Ingolfur Agustsson, Chad A. Madsen, and Jeffrey
  A. Edmonds","Large-Scale Intrinsic Alignment of Galaxy Images","23 pages, 6 figures, 1 table, submitted to ApJ",,,,"astro-ph.CO","http://arxiv.org/licenses/nonexclusive-distrib/1.0/","  We compute the two-point image correlation function for bright galaxies in
the seventh data release of the Sloan Digital Sky Survey (SDSS) over angular
scales 0.01' <= \theta <= 120' and projected separations 0.01 Mpc <= r <= 10
Mpc. We restrict our analysis to SDSS galaxies with accurate spectroscopic
redshifts, and we find strong evidence for intrinsic alignment of the galaxy
images. On scales greater than r ~ 40 kpc, the intrinsic alignment of the SDSS
galaxy images compares well with the intrinsic alignment of galaxy images in a
Lambda-CDM universe, provided we impose Gaussian-random errors on the position
angles of the theoretical galaxies with a dispersion of 25 degrees. Without the
inclusion of these errors, the amplitude of the two-point image correlation
function for the theoretical galaxies is a factor of ~2 higher than it is for
the SDSS galaxies. We interpret this as a combination of modest position angle
errors for the SDSS galaxies, as well as a need for modest misalignment of mass
and light in the theoretical galaxies. The intrinsic alignment of the SDSS
galaxies shows no dependence on the specific star formation rates of the
galaxies and, at most, a very weak dependence on the colors and stellar masses
of the galaxies. At the ~3-sigma level, however, we find an indication that the
images of the most luminous SDSS galaxies are more strongly aligned with each
other than are the images of the least luminous SDSS galaxies.
","[{""version"":""v1"",""created"":""Mon, 20 Apr 2009 20:03:12 GMT""}]","2009-04-22"
"0904.3096","Ewan Cameron Mr","Ewan Cameron, Simon P. Driver, Alister W. Graham, Jochen Liske","The Millennium Galaxy Catalogue: Exploring the Color-Concentration
  Bimodality via Bulge-Disc Decomposition","14 pages, 8 figures, accepted for publication in ApJ (18 April 2009).
  High resolution version available at
  http://www-star.st-and.ac.uk/~ec60/mgc.pdf","Astrophys.J.699:105-117,2009","10.1088/0004-637X/699/1/105",,"astro-ph.CO astro-ph.GA","http://arxiv.org/licenses/nonexclusive-distrib/1.0/","  We investigate the origin of the galaxy color-concentration bimodality at the
bright-end of the luminosity function (M(B) - 5 log h < -18 mag) with regard to
the bulge-disc nature of galaxies. Via (2D) surface brightness profile modeling
with GIM2D, we subdivide the local galaxy population in the Millennium Galaxy
Catalogue into one-component and two-component systems. We reveal that
one-component (elliptical and disc-only) systems define the two peaks of the
galaxy color-concentration distribution (with total stellar mass densities of
0.7 +/- 0.1 and 1.3 +/- 0.1 x 10^8 h Msol Mpc^-3 respectively), while
two-component systems contribute to both a bridging population and the red,
concentrated peak (with total stellar mass densities of 1.1 +/- 0.1 and 1.8 +/-
0.2 x 10^8 h Msun Mpc^-3 respectively). Moreover, luminous, `bulge-less, red
discs' and `disc-less, blue bulges' (blue ellipticals) are exceptionally rare
(with volume-densities of 1.7 +/- 0.3 and 1.1 \pm 0.1 x 10^-4 h^3 Mpc^-3
respectively). Finally, within the two-component population we confirm a
previously-reported correlation between bulge and disc color (with a mean
offset of only <(u-r)_bulge-(u-r)_disc> = 0.22 +/- 0.02 mag).
","[{""version"":""v1"",""created"":""Mon, 20 Apr 2009 20:00:08 GMT""}]","2009-06-25"
"0904.3097","Gunnar M\""oller","Gunnar Moller and Nigel R. Cooper","Composite Fermion Theory for Bosonic Atoms in Optical Lattices","4 pages, 2 figures","Phys. Rev. Lett. 103, 105303 (2009)","10.1103/PhysRevLett.103.105303",,"cond-mat.mes-hall cond-mat.quant-gas","http://arxiv.org/licenses/nonexclusive-distrib/1.0/","  We study the groundstates of cold atomic gases on rotating optical lattices,
as described by the Bose-Hubbard model in a uniform effective magnetic field.
Mapping the bosons to composite fermions leads to the prediction of quantum
Hall fluids that have no counterpart in the continuum. We construct trial
wavefunctions for these phases, and perform numerical tests of the predictions
of the composite fermion model. Our results establish the existence of strongly
correlated phases beyond those in the continuum limit, and provide evidence for
a wider scope of the composite fermion approach beyond its application to the
lowest Landau-level.
","[{""version"":""v1"",""created"":""Mon, 20 Apr 2009 20:06:42 GMT""}]","2009-09-04"
"0904.3098","Yen-Ting Lin","Yen-Ting Lin (1,2,3), Jeremiah P. Ostriker (1), and Christopher J.
  Miller (4) ((1) Princeton University Observatory, (2) Pontificia Universidad
  Catolica de Chile, (3) Institute for the Physics and Mathematics of the
  Universe, the University of Tokyo, (4) Michigan)","A New Test of the Statistical Nature of the Brightest Cluster Galaxies","12 pages, 8 figures, 4 tables; published in ApJ","Astrophys.J.715:1486-1496,2010","10.1088/0004-637X/715/2/1486",,"astro-ph.CO","http://arxiv.org/licenses/nonexclusive-distrib/1.0/","  A novel statistic is proposed to examine the hypothesis that all cluster
galaxies are drawn from the same luminosity distribution (LD). In such a
""statistical model"" of galaxy LD, the brightest cluster galaxies (BCGs) are
simply the statistical extreme of the galaxy population. Using a large sample
of nearby clusters, we show that BCGs in high luminosity clusters (e.g., L_tot
> 4x10^11 L_sun) are unlikely (probability <3x10^-4) to be drawn from the LD
defined by all red cluster galaxies more luminous than M_r=-20. On the other
hand, BCGs in less luminous clusters are consistent with being the statistical
extreme. Applying our method to the second brightest galaxies, we show that
they are consistent with being the statistical extreme, which implies that the
BCGs are also distinct from non-BCG luminous, red, cluster galaxies. We point
out some issues with the interpretation of the classical tests proposed by
Tremaine & Richstone (1977) that are designed to examine the statistical nature
of BCGs, investigate the robustness of both our statistical test and those of
TR against difficulties in photometry of galaxies of large angular size, and
discuss the implication of our findings on surveys that use the luminous red
galaxies to measure the baryon acoustic oscillation features in the galaxy
power spectrum.
","[{""version"":""v1"",""created"":""Mon, 20 Apr 2009 20:00:27 GMT""},{""version"":""v2"",""created"":""Sun, 13 Jun 2010 02:11:58 GMT""}]","2010-06-15"
"0904.3099","Christopher S. Reynolds","Christopher S. Reynolds, Andrew C. Fabian, Laura W. Brenneman,
  Giovanni Miniutti, Phil Uttley, Luigi C. Gallo","Constraints on the absorption-dominated model for the X-ray spectrum of
  MCG-6-30-15","Accepted for publication in MNRAS Letters. 5 pages with 1 figure",,"10.1111/j.1745-3933.2009.00676.x",,"astro-ph.HE astro-ph.CO","http://arxiv.org/licenses/nonexclusive-distrib/1.0/","  Complexities in the X-ray spectrum of the nearby Seyfert 1.2 galaxy
MCG-6-30-15 are commonly interpreted in terms of a broad iron line and the
associated Compton reflection hump from the innermost relativistic regions of
an accretion disk around a rapidly spinning black hole. However, an alternative
model has recently been proposed in which these spectral features are caused
entirely by complex (ionized and partial-covering) absorption. By considering
the fluorescent emission that must accompany photoelectric absorption, we show
that the absorption-dominated model over-predicts the 6.4keV iron line flux
unless the marginally Compton-thick absorber responsible for the hard X-ray
hump satisfies very restrictive geometric constraints. In the absence of a
specific model that both obeys these geometrical constraints and is
physically-plausible, the relativistic-reflection model is favoured.
","[{""version"":""v1"",""created"":""Mon, 20 Apr 2009 20:05:56 GMT""}]","2015-05-13"
"0904.3100","Alexander Weisse","Alexander Wei{\ss}e","Green-Function-Based Monte Carlo Method for Classical Fields Coupled to
  Fermions","4 pages, 3 figures","Phys.Rev.Lett.102:150604,2009","10.1103/PhysRevLett.102.150604",,"cond-mat.stat-mech","http://arxiv.org/licenses/nonexclusive-distrib/1.0/","  Microscopic models of classical degrees of freedom coupled to non-interacting
fermions occur in many different contexts. Prominent examples from solid state
physics are descriptions of colossal magnetoresistance manganites and diluted
magnetic semiconductors, or auxiliary field methods for correlated electron
systems. Monte Carlo simulations are vital for an understanding of such
systems, but notorious for requiring the solution of the fermion problem with
each change in the classical field configuration. We present an efficient,
truncation-free O(N) method on the basis of Chebyshev expanded local Green
functions, which allows us to simulate systems of unprecedented size N.
","[{""version"":""v1"",""created"":""Mon, 20 Apr 2009 20:01:09 GMT""}]","2009-06-16"
"0904.3104","Paolo Lipparini","Paolo Lipparini","Combinatorial and model-theoretical principles related to regularity of
  ultrafilters and compactness of topological spaces. VI","9 pages",,,,"math.LO math.GN","http://arxiv.org/licenses/nonexclusive-distrib/1.0/","  We discuss the existence of complete accumulation points of sequences in
products of topological spaces. Then we collect and generalize many of the
results proved in Parts I, II and IV.
  The present Part VI is complementary to Part V to the effect that here we
deal, say, with uniformity, complete accumulation points and $ \kappa
$-$(\lambda)$-compactness, rather than with regularity, $[ \lambda, \mu
]$-compactness and $ \kappa $-$ (\lambda, \mu)$-compactness. Of course, if we
restrict ourselves to regular cardinals, Parts V (for $ \lambda = \mu$) and
Part VI essentially coincide.
","[{""version"":""v1"",""created"":""Tue, 21 Apr 2009 09:00:11 GMT""}]","2009-04-22"
"0904.3105","Ian Roederer","Ian U. Roederer (University of Texas), Karl-Ludwig Kratz
  (Max-Planck-Institut fur Chemie), Anna Frebel (Harvard-Smithsonian Center for
  Astrophysics), Norbert Christlieb (Zentrum fur Astronomie der Universitat
  Heidelberg), Bernd Pfeiffer (Max-Planck-Institut fur Chemie), John J. Cowan
  (University of Oklahoma), Christopher Sneden (University of Texas)","The End of Nucleosynthesis: Production of Lead and Thorium in the Early
  Galaxy","Accepted for publication in the Astrophysical Journal. 22 pages, 10
  figures","Astrophys.J.698:1963-1980,2009","10.1088/0004-637X/698/2/1963",,"astro-ph.SR astro-ph.GA","http://arxiv.org/licenses/nonexclusive-distrib/1.0/","  We examine the Pb and Th abundances in 27 metal-poor stars (-3.1 < [Fe/H] <
-1.4) whose very heavy metal (Z > 56) enrichment was produced only by the rapid
(r-) nucleosynthesis process. New abundances are derived from HST/STIS,
Keck/HIRES, and VLT/UVES spectra and combined with other measurements from the
literature to form a more complete picture of nucleosynthesis of the heaviest
elements produced in the r-process. In all cases, the abundance ratios among
the rare earth elements and the 3rd r-process peak elements considered (La, Eu,
Er, Hf, and Ir) are constant and equivalent to the scaled solar system
r-process abundance distribution. We compare the stellar observations with
r-process calculations within the classical ""waiting-point"" approximation. In
these computations a superposition of 15 weighted neutron-density components in
the range 23 < log(n_n) < 30 is fit to the r-process abundance peaks to
successfully reproduce both the stable solar system isotopic distribution and
the stable heavy element abundance pattern between Ba and U in low-metallicity
stars. Under these astrophysical conditions, which are typical of the ""main""
r-process, we find very good agreement between the stellar Pb r-process
abundances and those predicted by our model. For stars with anomalously high
Th/Eu ratios (the so-called actinide boost), our observations demonstrate that
any nucleosynthetic deviations from the main r-process affect--at most--only
the elements beyond the 3rd r-process peak, namely Pb, Th, and U. Our
theoretical calculations also indicate that possible r-process abundance
""losses"" by nuclear fission are negligible for isotopes along the r-process
path between Pb and the long-lived radioactive isotopes of Th and U.
","[{""version"":""v1"",""created"":""Mon, 20 Apr 2009 20:06:31 GMT""}]","2011-02-11"
"0904.3106","Jose Juan Blanco-Pillado","Jose J. Blanco-Pillado, Delia Schwartz-Perlov and Alexander Vilenkin","Quantum Tunneling in Flux Compactifications","40 pages, 8 figures","JCAP 0912:006,2009","10.1088/1475-7516/2009/12/006",,"hep-th","http://arxiv.org/licenses/nonexclusive-distrib/1.0/","  We identify instantons representing vacuum decay in a 6-dimensional toy model
for string theory flux compactifications, with the two extra dimensions
compactified on a sphere. We evaluate the instanton action for tunneling
between different flux vacua, as well as for the decompactification decay
channel. The bubbles resulting from flux tunneling have an unusual structure.
They are bounded by two-dimensional branes, which are localized in the extra
dimensions. This has important implications for bubble collisions.
","[{""version"":""v1"",""created"":""Mon, 20 Apr 2009 20:07:32 GMT""},{""version"":""v2"",""created"":""Thu, 5 Nov 2009 21:48:17 GMT""}]","2009-12-15"
"0904.3107","Thomas Schaefer","Thomas Schaefer (North Carolina State University), Derek Teaney (SUNY
  Stony Brook and Riken-BNL)","Nearly Perfect Fluidity: From Cold Atomic Gases to Hot Quark Gluon
  Plasmas","76 pages, 11 figures, review article, extensive revisions","Rept.Prog.Phys.72:126001,2009","10.1088/0034-4885/72/12/126001",,"hep-ph cond-mat.quant-gas hep-lat hep-th nucl-th","http://arxiv.org/licenses/nonexclusive-distrib/1.0/","  Shear viscosity is a measure of the amount of dissipation in a simple fluid.
In kinetic theory shear viscosity is related to the rate of momentum transport
by quasi-particles, and the uncertainty relation suggests that the ratio of
shear viscosity eta to entropy density s in units of hbar/k_B is bounded by a
constant. Here, hbar is Planck's constant and k_B is Boltzmann's constant. A
specific bound has been proposed on the basis of string theory where, for a
large class of theories, one can show that eta/s is greater or equal to hbar/(4
pi k_B). We will refer to a fluid that saturates the string theory bound as a
perfect fluid. In this review we summarize theoretical and experimental
information on the properties of the three main classes of quantum fluids that
are known to have values of eta/s that are smaller than hbar/k_B. These fluids
are strongly coupled Bose fluids, in particular liquid helium, strongly
correlated ultracold Fermi gases, and the quark gluon plasma. We discuss the
main theoretical approaches to transport properties of these fluids: kinetic
theory, numerical simulations based on linear response theory, and holographic
dualities. We also summarize the experimental situation, in particular with
regard to the observation of hydrodynamic behavior in ultracold Fermi gases and
the quark gluon plasma.
","[{""version"":""v1"",""created"":""Tue, 21 Apr 2009 01:15:58 GMT""},{""version"":""v2"",""created"":""Fri, 17 Jul 2009 01:25:01 GMT""}]","2009-11-18"
"0904.3108","Ashley Ruiter","Ashley J. Ruiter (NMSU/CfA), Krzysztof Belczynski (LANL), Chris L.
  Fryer (LANL)","Rates and Delay Times of Type Ia Supernovae","14 pages, 2 tables, 3 figures, submitted to ApJ","Astrophys.J.699:2026-2036,2009","10.1088/0004-637X/699/2/2026","LA-UR 08-07009","astro-ph.SR astro-ph.GA","http://arxiv.org/licenses/nonexclusive-distrib/1.0/","  We analyze the evolution of binary stars to calculate synthetic rates and
delay times of the most promising Type Ia Supernovae progenitors. We present
and discuss evolutionary scenarios in which a white dwarf reaches the
Chandrasekhar-mass and potentially explodes in a Type Ia supernova. We
consider: Double Degenerate (DDS), Single Degenerate (SDS), and AM Canum
Venaticorum scenarios. The results are presented for two different star
formation histories; burst (elliptical-like galaxies) and continuous
(spiral-like galaxies). It is found that delay times for the DDS in our
standard model (with common envelope efficiency alpha = 1) follow a power-law
distribution. For the SDS we note a wide range of delay times, while AM CVn
progenitors produce a short burst of SNe Ia at early times. We point out that
only the rates for two merging carbon-oxygen white dwarfs, the only systems
found in the DDS, are consistent with the observed rates for typical Milky
Way-like spirals. We also note that DDS progenitors are the dominant population
in elliptical galaxies. The fact that the delay time distribution for the DDS
follows a power-law implies more Type Ia supernovae (per unit mass) in young
rather than in aged populations. Our results do not exclude other scenarios,
but strongly indicate that the DDS is the dominant channel generating SNe Ia in
spiral galaxies, at least in the framework of our adopted evolutionary models.
Since it is believed that white dwarf mergers cannot produce a thermonuclear
explosion given the current understanding of accreting white dwarfs, either the
evolutionary calculations along with accretion physics are incorrect, or the
explosion calculations are inaccurate and need to be revisited (Abridged).
","[{""version"":""v1"",""created"":""Tue, 21 Apr 2009 03:42:00 GMT""}]","2010-05-27"
"0904.3110","Achill Sch\""urmann","Wolfgang Keller, Jacques Martinet and Achill Sch\""urmann (with an
  appendix by Mathieu Dutour Sikiri\'c)","On classifying Minkowskian sublattices","34 pages; incorporated referee comments","Mathematics of Computation, 81 (2012), 1063-1092","10.1090/S0025-5718-2011-02528-7",,"math.NT math.MG","http://arxiv.org/licenses/nonexclusive-distrib/1.0/","  Let $\Lambda$ be a lattice in an $n$-dimensional Euclidean space $E$ and let
$\Lambda'$ be a Minkowskian sublattice of $\Lambda$, that is, a sublattice
having a basis made of representatives for the Minkowski successive minima of
$\Lambda$. We extend the classification of possible $\Z/d\Z$-codes of the
quotients $\Lambda/\Lambda'$ to dimension~$9$, where $d\Z$ is the annihilator
of $\Lambda/\Lambda'$.
","[{""version"":""v1"",""created"":""Mon, 20 Apr 2009 20:19:37 GMT""},{""version"":""v2"",""created"":""Sat, 31 Jul 2010 16:11:46 GMT""},{""version"":""v3"",""created"":""Wed, 2 Feb 2011 20:37:41 GMT""}]","2015-03-13"
"0904.3111","Frederick W. Cummings","Frederick W. Cummings","On Pattern and Evolution","38 pages, seven figures",,,,"q-bio.TO q-bio.OT","http://arxiv.org/licenses/nonexclusive-distrib/1.0/","  A model of pattern formation in living systems is presented. The pattern is
achieved by the sequential interaction of two signaling pathways. The coupling
of the pattern to the (thick) epithelial sheet changes is given, when the Gauss
curvature'K'enters. The model suggests a novel point-like placement for organs
such as eyes, antennae, limbs, and wings. In the case of plant patterns, 'leaf'
outgrowths from a stem are predicted to be under the control of a yet to be
discovered ""master regulatiory gene"", analogous to the animal case, when
various outgrowths from the animal body are generally accompanied by activation
of the 'distal-less' (Dll) gene.
","[{""version"":""v1"",""created"":""Mon, 20 Apr 2009 20:22:53 GMT""},{""version"":""v2"",""created"":""Sun, 10 May 2009 21:49:30 GMT""}]","2009-05-11"
"0904.3112","Carlos Munoz","J. Fidalgo, D.E. Lopez-Fogliani, C. Munoz, R. Ruiz de Austri,","Neutrino Physics and Spontaneous CP Violation in the $\mu\nu$SSM","32 pages, 8 figures, version to appear in JHEP, a discussion on EDMs
  added","JHEP 0908:105,2009","10.1088/1126-6708/2009/08/105","FTUAM 09/06, IFT-UAM/CSIC-09-20","hep-ph","http://arxiv.org/licenses/nonexclusive-distrib/1.0/","  The $\mu\nu$SSM provides a solution to the $\mu$ problem of the MSSM and
explains the origin of neutrino masses by simply using right-handed neutrino
superfields. We have completed the analysis of the vacua in this model,
studying the possibility of spontaneous CP violation through complex Higgs and
sneutrino vacuum expectation values. As a consequence of this process, a
complex MNS matrix can be present. Besides, we have discussed the neutrino
physics and the associated electroweak seesaw mechanism in the $\mu\nu$SSM,
including also phases. Current data on neutrino masses and mixing angles can
easily be reproduced.
","[{""version"":""v1"",""created"":""Mon, 20 Apr 2009 20:36:56 GMT""},{""version"":""v2"",""created"":""Mon, 4 May 2009 18:26:08 GMT""},{""version"":""v3"",""created"":""Wed, 22 Jul 2009 23:17:46 GMT""}]","2009-09-28"
"0904.3113","Andre Diatta Dr","Andre Diatta and Brendan Foreman","Lattices in contact Lie groups and 5-dimensional contact solvmanifolds","V3: 19 pages. Latex. Former Section 5 from V1 and V2 has now been
  removed. We thank Dr Chris Wendl and Prof. Patrick Massot for constructive
  remarks that have led to some reconsiderations on former Section 5 of V2.
  Last version appeared at Kodai Mathematical Journal","Kodai Math. J. 38 (2015), no. 1, 228-248","10.2996/kmj/1426684452",,"math.DG","http://arxiv.org/licenses/nonexclusive-distrib/1.0/","  This paper investigates the geometry of compact contact manifolds that are
uniformized by contact Lie groups, i.e., compact manifolds that are the
quotient of some Lie group G with a left invariant contact structure and a
uniform lattice subgroup. We re-examine Alexander's criteria for existence of
lattices on solvable Lie groups and apply them, along with some other well
known tools, and use these results to prove that, in dimension 5, there are
exactly seven connected and simply connected contact Lie groups with uniform
lattices, all of which are solvable. Issues of symplectic boundaries are
explored, as well. It is also shown that the special affine group has no
uniform lattice.
","[{""version"":""v1"",""created"":""Mon, 20 Apr 2009 20:37:57 GMT""},{""version"":""v2"",""created"":""Fri, 24 Oct 2014 16:23:05 GMT""},{""version"":""v3"",""created"":""Tue, 28 Apr 2015 15:55:48 GMT""}]","2015-04-29"
"0904.3114","Chih-Chun Chien","Dan Wulin, Yan He, Chih-Chun Chien, Dirk K. Morr, K.Levin","Quasiparticle Interference in STM As a Function of Temperature:
  Signatures of Coherence","4 pages, 3 figures","Phys. Rev. B 80, 134504 (2009)","10.1103/PhysRevB.80.134504",,"cond-mat.supr-con cond-mat.str-el","http://arxiv.org/licenses/nonexclusive-distrib/1.0/","  In this paper we explore the behavior of the quasi-particle interference
pattern (QPI) of scanning tunneling microscopy as a function of temperature,
$T$. After insuring a minimal consistency with photoemission, we find that the
QPI pattern is profoundly sensitive to quasi-particle coherence and that it
manifests two energy gap scales. The nearly dispersionless QPI pattern above
$T_c$ is consistent with data on moderately underdoped cuprates. To illustrate
the important two energy scale physics we present predictions of the
QPI--inferred energy gaps as a function of $T$ for future experiments on
moderately underdoped cuprates.
","[{""version"":""v1"",""created"":""Mon, 20 Apr 2009 21:01:35 GMT""},{""version"":""v2"",""created"":""Thu, 2 Jul 2009 16:33:05 GMT""}]","2009-10-19"
