"0904.3213","Fabio Bagarello","F. Bagarello","Simplified stock markets described by number operators","Rep. on Math. Phys., in press",,"10.1016/S0034-4877(09)90010-6",,"q-fin.TR","http://arxiv.org/licenses/nonexclusive-distrib/1.0/","  In this paper we continue our systematic analysis of the operatorial approach
previously proposed in an economical context and we discuss a {\em mixed} toy
model of a simplified stock market, i.e. a model in which the price of the
shares is given as an input. We deduce the time evolution of the portfolio of
the various traders of the market, as well as of other {\em observable}
quantities. As in a previous paper, we solve the equations of motion by means
of a {\em fixed point like} approximation.
","[{""version"":""v1"",""created"":""Tue, 21 Apr 2009 10:27:09 GMT""}]","2015-05-13"
"0904.3214","Veer Awana Dr","Anand Pal, Arpita Vajpayee, R. S. Meena, H. Kishan and V. P. S. Awana
  (National Physical Laboratory, New Delhi, India)","Single step synthesis of Sr4V2O6Fe2As2: The blocking layer based
  potential future superconductor","10 pages of text + Figs: comments welcome
  (awana@mail.nplindia.ernet.in)","J. Sup. & Novel Magnetisim 22, L619-L621 (2009)",,,"cond-mat.supr-con cond-mat.str-el","http://arxiv.org/licenses/nonexclusive-distrib/1.0/","  We report synthesis, structural details and transport measurements on
Sr4V2O6Fe2As2. Namely the stoichiometric amounts of V2O5 + SrO2 + Sr + 2FeAs
are weighed mixed, ground thoroughly and palletized in rectangular form in a
glove box in high purity Ar atmosphere. The pellet is further sealed in an
evacuated (10-5 Torr) quartz tube and put for heat treatments at 750 and 1150
0C in a single step for 12 and 36 hours respectively. Finally the quartz
ampoule is allowed to cool naturally to room temperature. The as synthesized
sample is black in color. The compound crystallized in P4/nmm space group with
lattice parameters a = b = 3.925A and c = 15.870A. Also seen are some small
impurity lines. The compound did not exhibit superconductivity but instead a
spin density wave (SDW) like metallic step at around 175 K is seen in R(T)
measurements
","[{""version"":""v1"",""created"":""Tue, 21 Apr 2009 10:28:18 GMT""},{""version"":""v2"",""created"":""Mon, 23 Jan 2012 09:07:40 GMT""}]","2012-01-24"
"0904.3215","Cl\'emence Magnien","Oussama Allali (1), Matthieu Latapy (1) and Clemence Magnien (1) ((1)
  LIP6 (CNRS - UPMC))","Measurement of eDonkey Activity with Distributed Honeypots","Hot-P2P Sixth International Workshop on Hot Topics in Peer-to-Peer
  Systems (Hot-P2P 2009), May 29, 2009, Rome, Italy",,,,"cs.NI","http://arxiv.org/licenses/nonexclusive-distrib/1.0/","  Collecting information about user activity in peer-to-peer systems is a key
but challenging task. We describe here a distributed platform for doing so on
the eDonkey network, relying on a group of honeypot peers which claim to have
certain files and log queries they receive for these files. We then conduct
some measurements with typical scenarios and use the obtained data to analyze
the impact of key parameters like measurement duration, number of honeypots
involved, and number of advertised files. This illustrates both the possible
uses of our measurement system, and the kind of data one may collect using it.
","[{""version"":""v1"",""created"":""Tue, 21 Apr 2009 10:36:17 GMT""}]","2009-04-22"
"0904.3216","Aldo  Lazar","Aldo J. Lazar","The space of ideals in the minimal tensor product of $C^*$-algebras","9 pages, minor mistakes were corrected",,"10.1017/S0305004109990351",,"math.OA","http://arxiv.org/licenses/nonexclusive-distrib/1.0/","  For $C^*$-algebras $A_1, A_2$ the map $(I_1,I_2)\to ker(q_{I_1}\otimes
q_{I_2})$ from $Id^{\prime}(A_1)\times Id^{\prime}(A_2)$ into
$Id^{\prime}(A_1\otimes_{\mathrm{min}} A_2) is a homeomorphism onto its image
which is dense in the range. Here, for a $C^*$-algebra $A$, the space of all
proper closed two sided ideals endowed with an adequate topology is denoted
$Id^{\prime}(A)$ and $q_I$ is the quotient map of $A$ onto $A/I$. New proofs of
the equivalence of the property (F) of Tomiyama for $A_1\otimes_{\mathrm{min}}
A_2$ with certain other properties are presented.
","[{""version"":""v1"",""created"":""Tue, 21 Apr 2009 10:40:00 GMT""},{""version"":""v2"",""created"":""Wed, 6 May 2009 09:00:11 GMT""}]","2017-05-24"
"0904.3217","Dawood Kothawala","Dawood Kothawala, L. Sriramkumar, S. Shankaranarayanan and T.
  Padmanabhan","Path integral duality modified propagators in spacetimes with constant
  curvature","v1. 10 pages, no figures; v2. 11 pages, acknowledgments added","Phys.Rev.D80:044005,2009","10.1103/PhysRevD.80.044005",,"hep-th gr-qc","http://arxiv.org/licenses/nonexclusive-distrib/1.0/","  The hypothesis of path integral duality provides a prescription to evaluate
the propagator of a free, quantum scalar field in a given classical background,
taking into account the existence of a fundamental length, say, the Planck
length, $\lp$, in a {\it locally Lorentz invariant manner}. We use this
prescription to evaluate the duality modified propagators in spacetimes with
{\it constant curvature} (exactly in the case of one spacetime, and in the
Gaussian approximation for another two), and show that: (i) the modified
propagators are ultra violet finite, (ii) the modifications are {\it
non-perturbative} in $\lp$, and (iii) $\lp$ seems to behave like a `zero point
length' of spacetime intervals such that $\l< \sigma^2(x,x')\r> =
\l[\sigma^{2}(x,x')+ {\cal O}(1) \lp^2 \r]$, where $\sigma(x,x')$ is the
geodesic distance between the two spacetime points $x$ and $x'$, and the
angular brackets denote (a suitable) average over the quantum gravitational
fluctuations. We briefly discuss the implications of our results.
","[{""version"":""v1"",""created"":""Tue, 21 Apr 2009 10:47:54 GMT""},{""version"":""v2"",""created"":""Tue, 28 Apr 2009 08:07:38 GMT""}]","2009-09-02"
"0904.3218","Nurhana Tajuddin","Ayres Freitas, Frank Daniel Steffen, Nurhana Tajuddin, Daniel Wyler","Upper Limits on the Peccei-Quinn Scale and on the Reheating Temperature
  in Axino Dark Matter Scenarios","10 pages, 5 figures; small additions and minor changes, matches
  published version","Phys.Lett.B679:270-277,2009","10.1016/j.physletb.2009.07.047","MPP-2009-12, ZU-TH 06/09","hep-ph astro-ph.CO","http://arxiv.org/licenses/nonexclusive-distrib/1.0/","  Considering axino cold dark matter scenarios with a long-lived charged
slepton, we study constraints on the Peccei-Quinn scale f_a and on the
reheating temperature T_R imposed by the dark matter density and by big bang
nucleosynthesis (BBN). For an axino mass compatible with large-scale structure,
m_axino \gtrsim 100 keV, temperatures above 10^9 GeV become viable for f_a >
3x10^12 GeV. We calculate the slepton lifetime in hadronic axion models. With
the dominant decay mode being two-loop suppressed, this lifetime can be
sufficiently large to allow for primordial bound states leading to catalyzed
BBN of Lithium-6 and Beryllium-9. This implies new upper limits on f_a and on
T_R that depend on quantities which will be probed at the Large Hadron
Collider.
","[{""version"":""v1"",""created"":""Tue, 21 Apr 2009 10:55:33 GMT""},{""version"":""v2"",""created"":""Fri, 21 Aug 2009 11:32:26 GMT""}]","2009-09-28"
"0904.3219","Jiezhu Lin","Jiezhu Lin","Some Constraints on Frobenius Manifolds with a TT*-Structure",,,,,"math.DG","http://arxiv.org/licenses/nonexclusive-distrib/1.0/","  The article gives a necessary and sufficient condition for a Frobenius
manifold to be a CDV-structure. We show that there exists a positive definite
CDV-structure on any semi-simple Frobenius manifold. We also compare three
natural connections on a CDV-structure and conclude that the underlying
Hermitian manifold of a non-trivial CDV-structure is not a Kahler manifold.
Finally, we compute the harmonic potential of a harmonic Frobenius manifolds.
","[{""version"":""v1"",""created"":""Tue, 21 Apr 2009 10:46:29 GMT""}]","2009-04-22"
"0904.3220","Alexander Gruneis","Alexander Gr\""uneis, Kurt Kummer and Denis V. Vyalikh","Dynamics of graphene growth on a metal surface: a time-dependent
  photoemission study",,,"10.1088/1367-2630/11/7/073050",,"cond-mat.mtrl-sci cond-mat.str-el","http://arxiv.org/licenses/nonexclusive-distrib/1.0/","  Applying time-dependent photoemission we unravel the graphene growth process
on a metallic surface by chemical vapor deposition (CVD). Graphene CVD growth
is in stark contrast to the standard growth process of two--dimensional films
because it is self-limiting and stops as soon as a monolayer graphene has been
synthesized. Most importantly, a novel phase of metastable graphene was
discovered that is characterized by permanent and simultaneous construction and
deconstruction. The high quality and large area graphene flakes are
characterized by angle-resolved photoemission proofing that they are indeed
monolayer and cover the whole 1$\times$1 cm Nickel substrate. These findings
are of high relevance to the intensive search for reliable synthesis methods
for large graphene flakes of controlled layer number.
","[{""version"":""v1"",""created"":""Tue, 21 Apr 2009 10:50:52 GMT""},{""version"":""v2"",""created"":""Thu, 7 May 2009 13:05:39 GMT""}]","2015-05-13"
"0904.3221","Vladimir Gritsev","Vladimir Gritsev, Timofei Rostunov, Eugene Demler","Exact methods in analysis of nonequilibrium dynamics of integrable
  models: application to the study of correlation functions in nonequilibrium
  1D Bose gas","27 pages, 7 figures, minor corrections, refs added","J. Stat. Mech. (2010) P05012","10.1088/1742-5468/2010/05/P05012",,"cond-mat.quant-gas cond-mat.other math-ph math.MP quant-ph","http://arxiv.org/licenses/nonexclusive-distrib/1.0/","  In this paper we study nonequilibrium dynamics of one dimensional Bose gas
from the general perspective of dynamics of integrable systems. After outlining
and critically reviewing methods based on inverse scattering transform,
intertwining operators, q-deformed objects, and extended dynamical conformal
symmetry, we focus on the form-factor based approach. Motivated by possible
applications in nonlinear quantum optics and experiments with ultracold atoms,
we concentrate on the regime of strong repulsive interactions. We consider
dynamical evolution starting from two initial states: a condensate of particles
in a state with zero momentum and a condensate of particles in a gaussian
wavepacket in real space. Combining the form-factor approach with the method of
intertwining operator we develop a numerical procedure which allows explicit
summation over intermediate states and analysis of the time evolution of
non-local density-density correlation functions. In both cases we observe a
tendency toward formation of crystal-like correlations at intermediate time
scales.
","[{""version"":""v1"",""created"":""Tue, 21 Apr 2009 10:51:15 GMT""},{""version"":""v2"",""created"":""Thu, 6 Aug 2009 14:43:19 GMT""},{""version"":""v3"",""created"":""Tue, 18 May 2010 10:06:59 GMT""}]","2010-05-19"
"0904.3222","Cl\'emence Magnien","Fabien Tarissan (1), Matthieu Latapy (2) and Christophe Prieur (3)
  ((1) ISC (CNRS - Ecole Polytechnique), (2) LIP6 (CNRS - UPMC), (3) LIAFA
  (Universite Paris Diderot))","Efficient Measurement of Complex Networks Using Link Queries","Proceedings of the IEEE International Workshop on Network Science For
  Communication Networks (NetSciCom'09)",,,,"cs.NI","http://arxiv.org/licenses/nonexclusive-distrib/1.0/","  Complex networks are at the core of an intense research activity. However, in
most cases, intricate and costly measurement procedures are needed to explore
their structure. In some cases, these measurements rely on link queries: given
two nodes, it is possible to test the existence of a link between them. These
tests may be costly, and thus minimizing their number while maximizing the
number of discovered links is a key issue. This paper studies this problem: we
observe that properties classically observed on real-world complex networks
give hints for their efficient measurement; we derive simple principles and
several measurement strategies based on this, and experimentally evaluate their
efficiency on real-world cases. In order to do so, we introduce methods to
evaluate the efficiency of strategies. We also explore the bias that different
measurement strategies may induce.
","[{""version"":""v1"",""created"":""Tue, 21 Apr 2009 13:41:47 GMT""}]","2009-04-22"
"0904.3223","Jadran Vrabec","Bernhard Eckl, Jadran Vrabec, Hans Hasse","A set of molecular models based on quantum mechanical ab initio
  calculations and thermodynamic data",,"J. Phys. Chem. B 112: 12710-12721 (2008)",,,"physics.chem-ph physics.comp-ph","http://arxiv.org/licenses/nonexclusive-distrib/1.0/","  A parameterization strategy for molecular models on the basis of force fields
is proposed, which allows a rapid development of models for small molecules by
using results from quantum mechanical (QM) ab initio calculations and
thermodynamic data. The geometry of the molecular models is specified according
to the atom positions determined by QM energy minimization. The electrostatic
interactions are modeled by reducing the electron density distribution to point
dipoles and point quadrupoles located in the center of mass of the molecules.
Dispersive and repulsive interactions are described by Lennard-Jones sites, for
which the parameters are iteratively optimized to experimental vapor-liquid
equilibrium (VLE) data, i.e. vapor pressure, saturated liquid density, and
enthalpy of vaporization of the considered substance. The proposed modeling
strategy was applied to a sample set of ten molecules from different substance
classes. New molecular models are presented for iso-butane, cyclohexane,
formaldehyde, dimethyl ether, sulfur dioxide, dimethyl sulfide, thiophene,
hydrogen cyanide, acetonitrile, and nitromethane. Most of the models are able
to describe the experimental VLE data with deviations of a few percent.
","[{""version"":""v1"",""created"":""Tue, 21 Apr 2009 11:02:50 GMT""}]","2009-04-22"
"0904.3225","Markus Schlapps","Markus Schlapps, Teresa Lermer, Stefan Geissler, Daniel Neumaier,
  Janusz Sadowski, Dieter Schuh, Werner Wegscheider, Dieter Weiss","Transport through (Ga,Mn)As nanoislands: Coulomb-blockade and
  temperature dependence of the conductance","5 pages, 3 figures, completed affiliations and corrected typos",,"10.1103/PhysRevB.80.125330",,"cond-mat.mes-hall","http://arxiv.org/licenses/nonexclusive-distrib/1.0/","  We report on magnetotransport measurements of nanoconstricted (Ga,Mn)As
devices showing very large resistance changes that can be controlled by both an
electric and a magnetic field. Based on the bias voltage and temperature
dependent measurements down to the millikelvin range we compare the models
currently used to describe transport through (Ga,Mn)As nanoconstrictions. We
provide an explanation for the observed spin-valve like behavior during a
magnetic field sweep by means of the magnetization configurations in the
device. Furthermore, we prove that Coulomb-blockade plays a decisive role for
the transport mechanism and show that modeling the constriction as a granular
metal describes the temperature and bias dependence of the conductance
correctly and allows to estimate the number of participating islands located in
the constriction.
","[{""version"":""v1"",""created"":""Tue, 21 Apr 2009 14:36:33 GMT""},{""version"":""v2"",""created"":""Mon, 14 Sep 2009 17:52:12 GMT""}]","2015-05-13"
"0904.3226","Daniel Salloch","D. Salloch, U. Wieser, U. Kunze and T. Hackbarth","Thermopower-enhanced efficiency of Si/SiGe ballistic rectifiers",,,"10.1063/1.3140439",,"cond-mat.mes-hall","http://arxiv.org/licenses/nonexclusive-distrib/1.0/","  Injection-type ballistic rectifiers on Si/SiGe are studied with respect to
the influence of gate voltage on the transfer resistance RT (output voltage
divided by input current) for different positions of a local gate electrode.
The rectifiers are trifurcated quantum wires with straight voltage stem and
oblique current-injecting leads. Depending on the gate configuration,
thermopower contributions arise from nearly-pinched stem regions which either
cancel each other or impose upon the ballistic signal with same or opposite
polarity. At best, this enhances RT to a maximum value of 470 Ohm close to
threshold voltage.
","[{""version"":""v1"",""created"":""Tue, 21 Apr 2009 11:24:53 GMT""}]","2015-05-13"
"0904.3227","Vladimir Sudilovsky Mr.","Vladimir Sudilovsky (MPE & Guilford College), Donald Smith (Guilford
  College), Sandra Savaglio (MPE)","Dusty MgII Absorbers: Implications for the GRB/Quasar Incidence
  Discrepancy","11 pages (including 4 figures). ApJ Accepted Revision: Corrected
  author list",,"10.1088/0004-637X/699/1/56",,"astro-ph.CO astro-ph.HE","http://arxiv.org/licenses/nonexclusive-distrib/1.0/","  There is nearly a factor of four difference in the number density of
intervening MgII absorbers as determined from gamma-ray burst (GRB) and quasar
lines of sight. We use a Monte-Carlo simulation to test if a dust extinction
bias can account for this discrepancy. We apply an empirically determined
relationship between dust column density and MgII rest equivalent width to
simulated quasar sight-lines and model the underlying number of quasars that
must be present to explain the published magnitude distribution of SDSS
quasars. We find that an input MgII number density dn/dz of 0.273 +- 0.002 over
the range 0.4 <= z <= 2.0 and with MgII equivalent width W_0 >= 1.0 angstroms
accurately reproduces observed distributions. From this value, we conclude that
a dust obstruction bias cannot be the sole cause of the observed discrepancy
between GRB and quasar sight-lines: this bias is likely to reduce the
discrepancy only by ~10%.
","[{""version"":""v1"",""created"":""Tue, 21 Apr 2009 11:41:58 GMT""},{""version"":""v2"",""created"":""Wed, 22 Apr 2009 07:34:53 GMT""},{""version"":""v3"",""created"":""Mon, 4 May 2009 08:57:19 GMT""}]","2015-05-13"
"0904.3228","Rezs\H{o} L. Lovas","R. L. Lovas, J. Szilasi","Homotheties of Finsler manifolds","13 pages",,,,"math.DG","http://arxiv.org/licenses/nonexclusive-distrib/1.0/","  We give a new and complete proof of the following theorem, discovered by
Detlef Laugwitz: (forward) complete and connected finite dimensional Finsler
manifolds admitting a proper homothety are Minkowski vector spaces. More
precisely, we show that under these hypotheses the Finsler manifold is
isometric to the tangent Minkowski vector space of the fixed point of the
homothety via the exponential map of the canonical spray of the Finsler
manifold.
","[{""version"":""v1"",""created"":""Tue, 21 Apr 2009 11:40:14 GMT""}]","2009-04-22"
"0904.3229","Takayuki Miyadera","Takayuki Miyadera, Hideki Imai","No-Cloning Theorem on Quantum Logics","To appear in J. Math. Phys","J. Math. Phys. 50, 102107 (2009)","10.1063/1.3245811",,"quant-ph","http://arxiv.org/licenses/nonexclusive-distrib/1.0/","  This paper discusses the no-cloning theorem in a logico-algebraic approach.
In this approach, an orthoalgebra is considered as a general structure for
propositions in a physical theory. We proved that an orthoalgebra admits
cloning operation if and only if it is a Boolean algebra. That is, only
classical theory admits the cloning of states. If unsharp propositions are to
be included in the theory, then a notion of effect algebra is considered. We
proved that an atomic Archimedean effect algebra admitting cloning operation is
a Boolean algebra. This paper also presents a partial result indicating a
relation between cloning on effect algebras and hidden variables.
","[{""version"":""v1"",""created"":""Tue, 21 Apr 2009 11:52:05 GMT""},{""version"":""v2"",""created"":""Fri, 8 May 2009 06:59:42 GMT""},{""version"":""v3"",""created"":""Fri, 4 Sep 2009 07:32:13 GMT""}]","2009-10-21"
"0904.3230","Jan P{\ke}kala","J. Pekala, P. Homola, B. Wilczynska, H. Wilczynski","Atmospheric multiple scattering of fluorescence and Cherenkov light
  emitted by extensive air showers","27 pages, 18 figures, accepted for publication in NIM A","Nucl.Instrum.Meth.A605:388-398,2009","10.1016/j.nima.2009.03.244",,"astro-ph.HE","http://arxiv.org/licenses/nonexclusive-distrib/1.0/","  Atmospheric scattering of light emitted by an air shower not only attenuates
direct fluorescence light from the shower, but also contributes to the observed
shower light. So far only direct and singly-scattered Cherenkov photons have
been taken into account in routine analyses of the observed optical image of
air showers. In this paper a Monte Carlo method of evaluating the contribution
of multiply scattered light to the optical air shower image is presented, as
well as results of simulations and a parameterization of scattered light
contribution to measured shower signal.
","[{""version"":""v1"",""created"":""Tue, 21 Apr 2009 12:14:01 GMT""}]","2009-06-25"
"0904.3231","Arthur Marshall Stoneham","A M Stoneham","Why dream? A Conjecture on Dreaming","7 pages",,,,"q-bio.NC","http://arxiv.org/licenses/nonexclusive-distrib/1.0/","  I propose that the need for sleep and the occurrence of dreams are intimately
linked to the physical processes underlying the continuing replacement of cells
and renewal of biomolecules during the lives of higher organisms. Since one
major function of our brains is to enable us to react to attack, there must be
truly compelling reasons for us to take them off-line for extended periods, as
during sleep. I suggest that most replacements occur during sleep. Dreams are
suggested as part of the means by which the new neural circuitry (I use the
word in an informal sense) is checked.
","[{""version"":""v1"",""created"":""Tue, 21 Apr 2009 12:12:50 GMT""}]","2009-04-22"
"0904.3232","Robert Buenker Joseph","Robert J. Buenker","Comparison of the Phenomena of Light Refraction and Gravitational
  Bending","13 pages 2 figures","Khim. Fys. 24(4), 29-35 (2005)",,,"physics.gen-ph physics.optics","http://arxiv.org/licenses/nonexclusive-distrib/1.0/","  The properties of light in the presence of electromagnetic and gravitational
fields are compared. Once one takes account of the fact that clock rates vary
with distance from a massive object, it is argued that in an absolute sense
light frequencies remain constant in both interactions. It is also pointed out
that the criterion used by Einstein for the angle of curvature of light rays
passing close to the sun is not their actual trajectory but rather Huygens'
Principle. The latter only requires that the speed of light vary with distance
from a gravitational source in order to produce a measurable effect. As a
result, the observed displacement of star images during solar eclipses can be
explained on the basis of a rotation of the wave front of light without
assuming that individual photons are actually deflected by the sun. A
calculation reported by Schiff in 1960 based on the assumption that light
travels in a straight line for all local observers obtains the same closed
expression for the angle of displacement of star images as in Einstein's
original work, in support of this interpretation. Since light is believed to
follow a straight-line trajectory within any given homogeneous transparent
medium, it is argued that light refraction and gravitational bending have more
in common than is generally realized.
","[{""version"":""v1"",""created"":""Tue, 21 Apr 2009 12:13:00 GMT""}]","2009-04-22"
"0904.3233","Thomas R. Weikl","Thomas R. Weikl","Transition states in protein folding","Review, 9 pages, 9 figures",,"10.4208/cicp.2009.08.202",,"q-bio.BM","http://arxiv.org/licenses/nonexclusive-distrib/1.0/","  The folding dynamics of small single-domain proteins is a current focus of
simulations and experiments. Many of these proteins are 'two-state folders',
i.e. proteins that fold rather directly from the denatured state to the native
state, without populating metastable intermediate states. A central question is
how to characterize the instable, partially folded conformations of two-state
proteins, in particular the rate-limiting transition-state conformations
between the denatured and the native state. These partially folded
conformations are short-lived and cannot be observed directly in experiments.
However, experimental data from detailed mutational analyses of the folding
dynamics provide indirect access to transition states. The interpretation of
these data, in particular the reconstruction of transition-state conformations,
requires simulation and modeling. The traditional interpretation of the
mutational data aims to reconstruct the degree of structure formation of
individual residues in the transition state, while a novel interpretation aims
at degrees of structure formation of cooperative substructures such as
alpha-helices and beta-hairpins. By splitting up mutation-induced free energy
changes into secondary and tertiary structural components, the novel
interpretation resolves some of the inconsistencies of the traditional
interpretation.
","[{""version"":""v1"",""created"":""Tue, 21 Apr 2009 12:23:38 GMT""}]","2020-01-08"
