"0903.5142","Ian Wanless","Ian M. Wanless","Transversals in Latin Squares","22 page survey article","Quasigroups Related Systems 15, (2007) 169-190. A much updated
  version of this survey was published in Surveys in Combinatorics 2011, London
  Math. Soc. Lecture Note Series 392, Cambridge University Press, 2011,
  pp403-437",,,"math.CO","http://arxiv.org/licenses/nonexclusive-distrib/1.0/","  A latin square of order $n$ is an $n\times n$ array of $n$ symbols in which
each symbol occurs exactly once in each row and column. A transversal of such a
square is a set of $n$ entries such that no two entries share the same row,
column or symbol. Transversals are closely related to the notions of complete
mappings and orthomorphisms in (quasi)groups, and are fundamental to the
concept of mutually orthogonal latin squares.
  Here we provide a brief survey of the literature on transversals. We cover
(1) existence and enumeration results, (2) generalisations of transversals
including partial transversals and plexes, (3) the special case when the latin
square is a group table, (4) a connection with covering radii of sets of
permutations. The survey includes a number of conjectures and open problems.
","[{""version"":""v1"",""created"":""Mon, 30 Mar 2009 07:50:11 GMT""}]","2015-10-27"
"0903.5143","Benoit Collins","Beno\^it Collins and Sho Matsumoto","On some properties of orthogonal Weingarten functions","18 pages, 0 figure","Journal of Mathematical Physics 50 (2009), no. 11, 113516","10.1063/1.3251304",,"math-ph math.MP math.RT","http://arxiv.org/licenses/nonexclusive-distrib/1.0/","  We give a Fourier-type formula for computing the orthogonal Weingarten
formula. The Weingarten calculus was introduced as a systematic method to
compute integrals of polynomials with respect to Haar measure over classical
groups. Although a Fourier-type formula was known in the unitary case, the
orthogonal counterpart was not known. It relies on the Jack polynomial
generalization of both Schur and zonal polynomials. This formula substantially
reduces the complexity involved in the computation of Weingarten formulas. We
also describe a few more new properties of the Weingarten formula, state a
conjecture and give a table of values.
","[{""version"":""v1"",""created"":""Mon, 30 Mar 2009 07:50:41 GMT""}]","2019-02-27"
"0903.5144","Oskari Miettinen M.Sc.","O. Miettinen, J. Harju, L. K. Haikala, J. Kainulainen, L. E. B.
  Johansson","Prestellar and protostellar cores in Ori B9","17 pages, 8 figures, 9 tables. Revised version accepted for
  publication in A&A (Figs. 1, 3, and 7 revised, minor revisions in Sect. 5.2,
  updated reference information)","Astronomy & Astrophysics 500 (2009) p.845-860","10.1051/0004-6361/200811534",,"astro-ph.SR","http://arxiv.org/licenses/nonexclusive-distrib/1.0/","  The aims of this study are to determine the properties and spatial
distribution of dense cores in Ori B9, and to estimate their ages and dynamical
timescales. The cloud was mapped in the 870 micron continuum with APEX/LABOCA,
and selected positions were observed in the lines of N2H+ and N2D+ using
IRAM-30m. These were used together with our previous H2D+ observations.
Moreover, archival FIR Spitzer/MIPS maps were combined with the LABOCA map to
distinguish between pre- and protostellar cores, and to estimate the
evolutionary stages of protostars. Twelve dense cores were detected at 870
micron in the Ori B9 cloud. The submm cores constitute ~4% of the total mass of
the Ori B9 region. There is an equal number of pre- and protostellar cores. Two
of the submm sources, which we call SMM 3 and SMM 4, are previously unknown
Class 0 candidates. We found a moderate degree of deuteration in N2H+
(0.03-0.04). There is, furthermore, evidence for N2H+ depletion in the core SMM
4. We derive a relatively high degree of ionization (~10^-7) in the clump
associated with IRAS 05405-0117. The ambipolar diffusion timescales for two of
the cores are ~70-100 times longer than the free-fall time. The distribution
and masses of dense cores in Ori B9 are similar to those observed in more
active regions in Orion, where the statistical core properties have been
explained by turbulent fragmentation. The 50/50 proportions of pre- and
protostellar cores suggest that duration of the prestellar phase is comparable
to the free-fall time. This timescale can be questioned, however, on the basis
of chemical data on the IRAS 05405-0117 region. A possible explanation is that
this survey samples only the densest, i.e., dynamically most advanced cores.
","[{""version"":""v1"",""created"":""Mon, 30 Mar 2009 07:52:01 GMT""},{""version"":""v2"",""created"":""Mon, 6 Apr 2009 07:44:37 GMT""}]","2009-11-17"
"0903.5145","Ranjan Gupta","Archana Bora, Ranjan Gupta, Harinder P. Singh, K. Duorah","Automated star-galaxy segregation using spectral and integrated band
  data for TAUVEX/ASTROSAT satellite data pipeline","5 pages, 6 figures, To appear in New Astronomy 2009","New Astronomy 14 (2009) 649 to 653","10.1016/j.newast.2009.03.005",,"astro-ph.GA","http://arxiv.org/licenses/nonexclusive-distrib/1.0/","  We employ an Artificial Neural Network (ANN) based technique to develop a
pipeline for automated segregation of stars from the galaxies to be observed by
Tel-Aviv University Ultra-Violet Experiment (TAUVEX). We use synthetic spectra
of stars from UVBLUE library and selected International Ultraviolet Explorer
(IUE) low resolution spectra for galaxies in the ultraviolet (UV) region from
1250 to 3220\AA as the training set and IUE low-resolution spectra for both the
stars and the galaxies as the test set. All the data sets have been
pre-processed to get band integrated fluxes so as to mimic the observations of
the TAUVEX UV imager. We also perform the ANN based segregation scheme using
the full length spectral features (which will also be useful for the ASTROSAT
mission). Our results suggest that, in the case of the non-availability of full
spectral features, the limited band integrated features can be used to
segregate the two classes of objects; although the band data classification is
less accurate than the full spectral data classification.
","[{""version"":""v1"",""created"":""Mon, 30 Mar 2009 07:52:31 GMT""}]","2015-05-13"
"0903.5146","Mustapha Rais","Mustapha Ra\""is","Les invariants polyn\^omes de la repr\'esentation coadjointe de groupes
  inhomog\`enes",,,,,"math.RT","http://arxiv.org/licenses/nonexclusive-distrib/1.0/","  Explicit generators are given for the ring of invariant polynomials under the
coadjoint representation of certain inhomogeneous groups.
","[{""version"":""v1"",""created"":""Mon, 30 Mar 2009 08:44:53 GMT""}]","2009-03-31"
"0903.5147","T. Tony Cai","T. Tony Cai, Harrison H. Zhou","A data-driven block thresholding approach to wavelet estimation","Published in at http://dx.doi.org/10.1214/07-AOS538 the Annals of
  Statistics (http://www.imstat.org/aos/) by the Institute of Mathematical
  Statistics (http://www.imstat.org)","Annals of Statistics 2009, Vol. 37, No. 2, 569-595","10.1214/07-AOS538","IMS-AOS-AOS538","math.ST stat.TH","http://arxiv.org/licenses/nonexclusive-distrib/1.0/","  A data-driven block thresholding procedure for wavelet regression is proposed
and its theoretical and numerical properties are investigated. The procedure
empirically chooses the block size and threshold level at each resolution level
by minimizing Stein's unbiased risk estimate. The estimator is sharp adaptive
over a class of Besov bodies and achieves simultaneously within a small
constant factor of the minimax risk over a wide collection of Besov Bodies
including both the ``dense'' and ``sparse'' cases. The procedure is easy to
implement. Numerical results show that it has superior finite sample
performance in comparison to the other leading wavelet thresholding estimators.
","[{""version"":""v1"",""created"":""Mon, 30 Mar 2009 08:14:37 GMT""}]","2009-03-31"
"0903.5148","Israfil Guseinov","I.I.Guseinov","Evaluation of potential energy of interaction between molecules using
  one-range addition theorems for Slater type orbitals and Coulomb-Yukawa like
  correlated interaction potentials","8 pages",,,,"math-ph math.MP physics.chem-ph","http://arxiv.org/licenses/nonexclusive-distrib/1.0/","  Using one-range addition theorems for noninteger n Slater type orbitals and
Coulomb-Yukawa like correlated interaction potentials with noninteger indices
obtained by the author with the help of complete orthonormal sets of
exponential type orbitals, the series of expansion formulas are established for
the potential produced by molecule, and the potential energy of interaction
between molecules through the radius vectors of nuclei of molecules, and the
linear combination coefficients of molecular orbitals. The formulae obtained
are useful especially for the study of interaction between atomic-molecular
systems containing any number of closed and open shells when the
Hartree-Fock-Roothaan and explicitly correlated methods are employed. The
relationships obtained are valid for the arbitrary values of indices and
screening constants of orbitals and correlated interaction potentials.
","[{""version"":""v1"",""created"":""Mon, 30 Mar 2009 08:21:00 GMT""}]","2009-03-31"
"0903.5149","Edoardo Sernesi","Giorgio Ottaviani, Edoardo Sernesi","On the hypersurface of Luroth quartics","Final version to appear in Michigan Math. Journal. The last section
  of v1 has been removed and expanded in the paper ""On singular Luroth
  quartics"", arXiv:0911.2101v1",,,,"math.AG","http://arxiv.org/licenses/nonexclusive-distrib/1.0/","  The hypersurface of Luroth quartic curves inside the projective space of
plane quartics has degree 54. We give a proof of this fact along the lines
outlined in a paper by Morley, published in 1919. Another proof has been given
by Le Potier and Tikhomirov in 2001, in the setting of moduli spaces of vector
bundles on the projective plane. Morley's proof uses the description of plane
quartics as branch curves of Geiser involutions and gives new geometrical
interpretations of the 36 planes associated to the Cremona hexahedral
representations of a nonsingular cubic surface.
","[{""version"":""v1"",""created"":""Mon, 30 Mar 2009 08:26:11 GMT""},{""version"":""v2"",""created"":""Wed, 11 Nov 2009 10:50:43 GMT""}]","2009-11-11"
"0903.5150","Takashi Shioya","Kazuhiro Kuwae and Takashi Shioya","A topological splitting theorem for weighted Alexandrov spaces","20 pages to appear in Tohoku Mathematical Journal",,,,"math.DG math.MG","http://arxiv.org/licenses/nonexclusive-distrib/1.0/","  Under an infinitesimal version of the Bishop-Gromov relative volume
comparison condition for a measure on an Alexandrov space, we prove a
topological splitting theorem of Cheeger-Gromoll type. As a corollary, we prove
an isometric splitting theorem for Riemannian manifolds with singularities of
nonnegative (Bakry-Emery) Ricci curvature.
","[{""version"":""v1"",""created"":""Mon, 30 Mar 2009 08:49:51 GMT""},{""version"":""v2"",""created"":""Thu, 30 Sep 2010 01:57:18 GMT""}]","2010-10-01"
"0903.5152","Jan Schepers","Jan Schepers","Stringy Hodge numbers of strictly canonical nondegenerate singularities","23 pages",,,,"math.AG math.CO","http://arxiv.org/licenses/nonexclusive-distrib/1.0/","  We describe a class of isolated nondegenerate hypersurface singularities that
give a polynomial contribution to Batyrev's stringy E-function. These
singularities are obtained by imposing a natural condition on the facets of the
Newton polyhedron, and they are strictly canonical. We prove that Batyrev's
conjecture concerning the nonnegativity of stringy Hodge numbers is true for
complete varieties with such singularities, under some additional hypotheses on
the defining polynomials (e.g. convenient or weighted homogeneous). The proof
uses combinatorics on lattice polytopes. The results form a strong
generalisation of previously obtained results for Brieskorn singularities.
","[{""version"":""v1"",""created"":""Mon, 30 Mar 2009 08:45:42 GMT""}]","2009-03-31"
"0903.5153","Ettore Vicari","Massimo Campostrini and Ettore Vicari","Critical behavior and scaling in trapped systems","4 pages, 6 figs, minor corrections","Phys. Rev. Lett. 102, 240601 (2009)","10.1103/PhysRevLett.102.240601",,"cond-mat.stat-mech gr-qc hep-lat","http://arxiv.org/licenses/nonexclusive-distrib/1.0/","  We study the scaling properties of critical particle systems confined by a
potential. Using renormalization-group arguments, we show that their critical
behavior can be cast in the form of a trap-size scaling, resembling finite-size
scaling theory, with a nontrivial trap critical exponent theta, which describes
how the correlation length scales with the trap size l, i.e., $\xi\sim
l^\theta$ at the critical point. theta depends on the universality class of the
transition, the power law of the confining potential, and on the way it is
coupled to the critical modes. We present numerical results for two-dimensional
lattice gas (Ising) models with various types of harmonic traps, which support
the trap-size scaling scenario.
","[{""version"":""v1"",""created"":""Mon, 30 Mar 2009 08:57:38 GMT""},{""version"":""v2"",""created"":""Sat, 4 Apr 2009 08:32:03 GMT""},{""version"":""v3"",""created"":""Sat, 9 May 2009 07:47:52 GMT""},{""version"":""v4"",""created"":""Sat, 12 Dec 2009 10:43:56 GMT""}]","2013-05-29"
"0903.5154","Ross Duncan","Ross Duncan","Generalised Proof-Nets for Compact Categories with Biproducts","77 pages, many figures. To appear in CUP volume, ""Semantics of
  Quantum Computation""",,,,"math.CT cs.LO","http://arxiv.org/licenses/nonexclusive-distrib/1.0/","  Just as conventional functional programs may be understood as proofs in an
intuitionistic logic, so quantum processes can also be viewed as proofs in a
suitable logic. We describe such a logic, the logic of compact closed
categories and biproducts, presented both as a sequent calculus and as a system
of proof-nets. This logic captures much of the necessary structure needed to
represent quantum processes under classical control, while remaining agnostic
to the fine details. We demonstrate how to represent quantum processes as
proof-nets, and show that the dynamic behaviour of a quantum process is
captured by the cut-elimination procedure for the logic. We show that the cut
elimination procedure is strongly normalising: that is, that every legal way of
simplifying a proof-net leads to the same, unique, normal form. Finally, taking
some initial set of operations as non-logical axioms, we show that that the
resulting category of proof-nets is a representation of the free compact closed
category with biproducts generated by those operations.
","[{""version"":""v1"",""created"":""Mon, 30 Mar 2009 09:59:53 GMT""}]","2009-03-31"
"0903.5155","Abhay Shukla","Abhay Shukla, Rakesh Kumar, Javed Mazher and Adrian Balan","Graphene made easy: high quality, large-area samples","11 pages, 4 figures,Solid State Communications, In press","Solid State Communications 149 (2009), pp. 718-721","10.1016/j.ssc.2009.02.007",,"cond-mat.mtrl-sci cond-mat.mes-hall","http://arxiv.org/licenses/nonexclusive-distrib/1.0/","  We show that by using an original method, bulk graphite can be bonded onto
borosilicate glass or potentially any insulating substrate with ionic
conductivity and then cleaved off to leave single or few layer graphene on the
substrate, identified optically and with Raman spectroscopy. This simple,
inexpensive and fast method leads to the preparation of large area graphene and
single or few-layer films of layered materials in general. We have prepared mm
size few-layer graphene samples and also measured I-V characteristics in a FET.
This opens up perspectives both for fundamental research as well as for
applications.
","[{""version"":""v1"",""created"":""Mon, 30 Mar 2009 09:05:14 GMT""}]","2009-04-06"
"0903.5156","Lawrence Ioannou","Lawrence M. Ioannou and Michele Mosca","Public-key cryptography based on bounded quantum reference frames","v3: added proof that individual attacks on protocol rounds are
  sufficient; to appear in Theoretical Computer Science (special issue on QKD)",,,,"quant-ph","http://arxiv.org/licenses/nonexclusive-distrib/1.0/","  We demonstrate that the framework of bounded quantum reference frames has
application to building quantum-public-key cryptographic protocols and proving
their security. Thus, the framework we introduce can be seen as a public-key
analogue of the framework of Bartlett et al. (Phys. Rev. A 70, 032307), where a
private shared reference frame is shown to have cryptographic application. The
protocol we present in this paper is an identification scheme, which, like a
digital signature scheme, is a type of authentication scheme. We prove that our
protocol is both reusable and secure under the honest-verifier assumption.
Thus, we also demonstrate that secure reusable quantum-public-key
authentication is possible to some extent.
","[{""version"":""v1"",""created"":""Mon, 30 Mar 2009 09:15:39 GMT""},{""version"":""v2"",""created"":""Wed, 28 Oct 2009 02:11:58 GMT""},{""version"":""v3"",""created"":""Sun, 14 Aug 2011 15:50:36 GMT""}]","2011-08-16"
"0903.5157","Liliana Formiggini","Liliana Formiggini and Elia M. Leibowitz (The School of Physics and
  Astronomy, Tel Aviv University, Israel)","Discovery of the 1.80 hr Spin Period of the White Dwarf of the Symbiotic
  System BF Cyg","7 pages, 5 figures, accepted for publication in MNRAS",,"10.1111/j.1365-2966.2009.14835.x",,"astro-ph.SR","http://arxiv.org/licenses/nonexclusive-distrib/1.0/","  We report on the discovery of a coherent periodicity in the B light curve of
the symbiotic star BF Cyg. The signal was detected in some sections of the
light curve of the star recorded in the year 2003 as double hump periodic
variations with an amplitude of ~7 mmag.
  In the year 2004 the signal was also present in only a subsection of the
light curve. In that year, the system was about twice as bright and the
amplitude of the oscillations was about half of what it was in 2003. In 2004
the cycle structure was of a single hump, the phase of which coincided with the
phase of one of the humps in the 2003 cycle. No periodic signal was detected in
a third, short series of observations performed in the year 2007, when the star
was three magnitudes brighter than in 2003.
  We interpret the periodicity as the spin period of the white dwarf component
of this interacting binary system. We suggest that the signal in 2003
originated in two hot spots on or near the surface of the white dwarf, most
likely around the two antipodes of an oblique dipole magnetic field of this
star. Magnetic field lines funneled accreted matter from the wind of the cool
component to the pole areas, where the falling material created the hot spots.
This process is apparently intermittent in its nature. In 2004, the activity
near only one pole was enhanced enough to raise the signal above the threshold
of our detection ability.
","[{""version"":""v1"",""created"":""Mon, 30 Mar 2009 10:01:58 GMT""}]","2015-05-13"
"0903.5158","Anthony Challinor","Anthony Challinor and Hiranya Peiris","Lecture notes on the physics of cosmic microwave background anisotropies","55 pages, 11 figures. To appear in Proc. XIII Brazilian School of
  Cosmology and Gravitation","AIP Conf.Proc.1132:86-140,2009","10.1063/1.3151849",,"astro-ph.CO","http://arxiv.org/licenses/nonexclusive-distrib/1.0/","  We review the theory of the temperature anisotropy and polarization of the
cosmic microwave background (CMB) radiation, and describe what we have learned
from current CMB observations. In particular, we discuss how the CMB is being
used to provide precise measurements of the composition and geometry of the
observable universe, and to constrain the physics of the early universe. We
also briefly review the physics of the small-scale CMB fluctuations generated
during and after the epoch of reionization, and which are the target of a new
breed of arcminute-resolution instruments.
","[{""version"":""v1"",""created"":""Mon, 30 Mar 2009 09:36:14 GMT""}]","2010-02-22"
"0903.5159","Mathies Lucassen","M.E. Lucassen, H.J. van Driel, C. Morais Smith and R.A. Duine","Current-driven and field-driven domain walls at nonzero temperature",,,"10.1103/PhysRevB.79.224411",,"cond-mat.other","http://arxiv.org/licenses/nonexclusive-distrib/1.0/","  We present a model for the dynamics of current- and field-driven domain-wall
lines at nonzero temperature. We compute thermally-averaged drift velocities
from the Fokker-Planck equation that describes the nonzero-temperature dynamics
of the domain wall. As special limits of this general description, we describe
rigid domain walls as well as vortex domain walls. In these limits, we
determine also depinning times of the domain wall from an extrinsic pinning
potential. We compare our theory with previous theoretical and experimental
work.
","[{""version"":""v1"",""created"":""Mon, 30 Mar 2009 09:13:01 GMT""}]","2013-05-29"
"0903.5160","Helmut Friedrich","Helmut Friedrich","Initial boundary value problems for Einstein's field equations and
  geometric uniqueness","19 pages","Gen.Rel.Grav.41:1947-1966,2009","10.1007/s10714-009-0800-3",,"gr-qc","http://arxiv.org/licenses/nonexclusive-distrib/1.0/","  While there exist now formulations of initial boundary value problems for
Einstein's field equations which are well posed and preserve constraints and
gauge conditions, the question of geometric uniqueness remains unresolved. For
two different approaches we discuss how this difficulty arises under general
assumptions. So far it is not known whether it can be overcome without imposing
conditions on the geometry of the boundary. We point out a natural and
important class of initial boundary value problems which may offer
possibilities to arrive at a fully covariant formulation.
","[{""version"":""v1"",""created"":""Mon, 30 Mar 2009 09:20:55 GMT""}]","2009-09-28"
"0903.5161","Helmut Finner","Helmut Finner, Thorsten Dickhaus, Markus Roters","On the false discovery rate and an asymptotically optimal rejection
  curve","Published in at http://dx.doi.org/10.1214/07-AOS569 the Annals of
  Statistics (http://www.imstat.org/aos/) by the Institute of Mathematical
  Statistics (http://www.imstat.org)","Annals of Statistics 2009, Vol. 37, No. 2, 596-618","10.1214/07-AOS569","IMS-AOS-AOS569","math.ST stat.TH","http://arxiv.org/licenses/nonexclusive-distrib/1.0/","  In this paper we introduce and investigate a new rejection curve for
asymptotic control of the false discovery rate (FDR) in multiple hypotheses
testing problems. We first give a heuristic motivation for this new curve and
propose some procedures related to it. Then we introduce a set of possible
assumptions and give a unifying short proof of FDR control for procedures based
on Simes' critical values, whereby certain types of dependency are allowed.
This methodology of proof is then applied to other fixed rejection curves
including the proposed new curve. Among others, we investigate the problem of
finding least favorable parameter configurations such that the FDR becomes
largest. We then derive a series of results concerning asymptotic FDR control
for procedures based on the new curve and discuss several example procedures in
more detail. A main result will be an asymptotic optimality statement for
various procedures based on the new curve in the class of fixed rejection
curves. Finally, we briefly discuss strict FDR control for a finite number of
hypotheses.
","[{""version"":""v1"",""created"":""Mon, 30 Mar 2009 09:21:28 GMT""}]","2009-03-31"
"0903.5162","Maria Isabel Garcia de Soria","J. Javier Brey, P. Maynar, M. I. Garcia de Soria","Fluctuating hydrodynamics for dilute granular gases",,,"10.1103/PhysRevE.79.051305",,"cond-mat.stat-mech","http://arxiv.org/licenses/nonexclusive-distrib/1.0/","  Starting from the kinetic equations for the fluctuations and correlations of
a dilute gas of inelastic hard spheres or disks, a Boltzmann-Langevin equation
for the one-particle distribution function of the homogeneous cooling state is
constructed. This equation is the linear Boltzmann equation with a fluctuating
white noise term. Balance equations for the fluctuating hydrodynamic fields are
derived. New fluctuating forces appear as compared with the elastic limit. The
particular case of the transverse velocity field is investigated in detail. Its
fluctuations can be described by means of a Langevin equation, but exhibiting
two main differences with the Landau-Lifshitz theory: the noise is not white,
and its second moment is not determined by the shear viscosity. This shows that
the fluctuation-dissipation relations for molecular fluids do not
straightforwardly carry over to inelastic gases. The theoretical predictions
are shown to be in good agreement with molecular dynamics simulation results.
","[{""version"":""v1"",""created"":""Mon, 30 Mar 2009 09:31:11 GMT""}]","2015-05-13"
