"0903.5206","Hiroshi Takatsu","Hiroshi Takatsu, Hideki Yoshizawa, Shingo Yonezawa, Yoshiteru Maeno","Critical behavior of the metallic triangular-lattice Heisenberg
  antiferromagnet PdCrO2","7 pages, 6 figures","Phys. Rev. B 79, 104424 (2009)","10.1103/PhysRevB.79.104424",,"cond-mat.str-el","http://arxiv.org/licenses/nonexclusive-distrib/1.0/","  We report physical properties of the conductive magnet PdCrO2 consisting of a
layered structure with a triangular lattice of Cr3+ ions (S=3/2). We confirmed
an antiferromagnetic transition at TN=37.5K by means of specific heat,
electrical resistivity, magnetic susceptibility, and neutron scattering
measurements. The critical behavior in the specific heat persists in an
unusually wide temperature range above TN. This fact implies that spin
correlations develop even at much higher temperature than TN. The observed
sub-linear temperature dependence of the resistivity above TN is also
attributed to the short-range correlations among the frustrated spins. While
the critical exponent for the magnetization agrees reasonably with the
prediction of the relevant model, that for the specific heat evaluated in the
wide temperature range differs substantially from the prediction.
","[{""version"":""v1"",""created"":""Mon, 30 Mar 2009 12:28:19 GMT""},{""version"":""v2"",""created"":""Tue, 31 Mar 2009 15:29:15 GMT""}]","2009-03-31"
"0903.5207","Victor Jose Vasquez Otoya","J.L. Boldo, J.A. Helayel-Neto, L.M. de Moraes, C.A.G. Sasaki and V.J.
  Vasquez Otoya","Graviton Excitations and Lorentz-Violating Gravity with Cosmological
  Constant",,"Phys.Lett.B689:112-115,2010","10.1016/j.physletb.2010.04.059",,"hep-th gr-qc","http://arxiv.org/licenses/nonexclusive-distrib/1.0/","  Motivated by the interest raised by the problem of Lorenz-symmetry violating
gauge theories in connetion with gravity models, this contribution sets out to
provide a general method to systematically study the excitation spectrum of
gravity actions which include a Lorentz-symmetry breaking Chern-Simons-type
action term for the spin connection. A complete set of spin-type operators is
found which accounts for the (Lorentz) violation parameter to all orders and
graviton propagators are worked out in a number of different situations.
","[{""version"":""v1"",""created"":""Mon, 30 Mar 2009 12:37:22 GMT""},{""version"":""v2"",""created"":""Wed, 14 Oct 2009 14:18:32 GMT""}]","2010-05-25"
"0903.5208","Mohsen Ghaffari","M. Ghaffari, B. Hariri and S. Shirmohammadi","On the Necessary and Sufficient Condition of Greedy Routing Supporting
  Geographical Data Networks",,,,,"cs.CG cs.NI","http://arxiv.org/licenses/nonexclusive-distrib/1.0/","  Large scale decentralized communication systems have introduced the new trend
towards online routing where routing decisions are performed based on a limited
and localized knowledge of the network. Geometrical greedy routing has been
among the simplest and most common online routing schemes. A perfect
geometrical routing scheme is expected to deliver each packet to the point in
the network that is closest to the packet destination. However greedy routing
fails to guarantee such delivery as the greedy forwarding decision sometimes
leads the packets to localized minimums. This article investigates the
necessary and sufficient properties of the greedy supporting graphs that
provide the guaranteed delivery of packets when acting as a routing substrate.
","[{""version"":""v1"",""created"":""Mon, 30 Mar 2009 12:37:56 GMT""}]","2009-03-31"
"0903.5209","Stefan Strau{\ss}","S.Strauss, S.Mattiello, and M.Beyer","Light-front Nambu--Jona-Lasinio model at finite temperature and density","16 pages, 6 figures","J.Phys.G36:085006,2009","10.1088/0954-3899/36/8/085006",,"hep-ph","http://arxiv.org/licenses/nonexclusive-distrib/1.0/","  In recent years light-front quantisation has been extended to allow for a
consistent treatment of systems at finite temperature and density. This is in
particular interesting for an investigation of the processes in nuclear matter
under extreme condition as occurring, e.g., during a heavy ion collision.
Utilising a Dyson expansion to the N-point Green functions at finite
temperature and density we focus on the occurrence of pionic and scalar diquark
dynamics in quark matter and compute the masses and the Mott dissociation using
a separable t-matrix approach. For the scalar quark-quark correlation we
determine the critical temperature of colour superconductivity using the
Thouless criterion. On the same footing the properties of the nucleon in a
medium of quark matter are computed within a Faddeev approach. Critical lines
for nucleon breakup are given. Presently, we use a light-front
Nambu--Jona-Lasinio model that allows us to compare these results of this novel
approach to the more traditional instant form approach, where applicable.
","[{""version"":""v1"",""created"":""Mon, 30 Mar 2009 12:45:45 GMT""}]","2009-07-22"
"0903.5210","Plamen Djakov B","Plamen Djakov and Boris Mityagin","Spectral gaps of Schr\""odinger operators with periodic singular
  potentials",,,,,"math.SP","http://arxiv.org/licenses/nonexclusive-distrib/1.0/","  By using quasi--derivatives we develop a Fourier method for studying the
spectral gaps of one dimensional Schr\""odinger operators with periodic singular
potentials $v.$ Our results reveal a close relationship between smoothness of
potentials and spectral gap asymptotics under a priori assumption $v \in
H^{-1}_{loc} (\mathbb{R}).$ They extend and strengthen similar results proved
in the classical case $v \in L^2_{loc}(\mathbb{R}).$
","[{""version"":""v1"",""created"":""Mon, 30 Mar 2009 13:11:17 GMT""}]","2009-03-31"
"0903.5211","Graham Kells","G. Kells, J. K. Slingerland and J. Vala","A Description of Kitaev's Honeycomb Model with Toric-Code Stabilizers","10 pages, 4 figures","Phys. Rev. B 80, 125415 (2009)","10.1103/PhysRevB.80.125415",,"cond-mat.mes-hall cond-mat.str-el cond-mat.supr-con","http://arxiv.org/licenses/nonexclusive-distrib/1.0/","  We present a solution of Kitaev's spin model on the honeycomb lattice and of
related topologically ordered spin models. We employ a Jordan-Wigner type
fermionization and find that the Hamiltonian takes a BCS type form, allowing
the system to be solved by Bogoliubov transformation. Our fermionization does
not employ non-physical auxiliary degrees of freedom and the eigenstates we
obtain are completely explicit in terms of the spin variables. The ground-state
is obtained as a BCS condensate of fermion pairs over a vacuum state which
corresponds to the toric code state with the same vorticity. We show in detail
how to calculate all eigenstates and eigenvalues of the model on the torus. In
particular, we find that the topological degeneracy on the torus descends
directly from that of the toric code, which now supplies four vacua for the
fermions, one for each choice of periodic vs. anti-periodic boundary
conditions. The reduction of the degeneracy in the non-Abelian phase of the
model is seen to be due to the vanishing of one of the corresponding candidate
BCS ground-states in that phase. This occurs in particular in the fully
periodic vortex-free sector. The true ground-state in this sector is exhibited
and shown to be gapped away from the three partially anti-periodic
ground-states whenever the non-Abelian phase is gapped.
","[{""version"":""v1"",""created"":""Mon, 30 Mar 2009 12:56:45 GMT""},{""version"":""v2"",""created"":""Sat, 13 Jun 2009 00:39:42 GMT""}]","2009-10-08"
"0903.5212","Michael Kowalski","Michael P. Kowalski (NRL), Martin Barstow (UL), Frederick Bruhweiler
  (CUA), Raymond Cruddace (NRL), Andrea Dupree (SAO), Jay Holberg (UA/LPL),
  Steve Howell (NOAO), J. Martin Laming (NRL), Jeffrey Linsky (JILA), Edward
  Sion (VU), Tod Strohmayer (NASA-GSFC), Paula Szkody (UW), Barry Welsh (UCB),
  Michael Wolff (NRL), Kent Wood (NRL)","Million Degree Plasmas in Extreme Ultraviolet (EUV) Astrophysics","8 pages, 3 figures; Science White Paper for the Astro2010 decadal
  review",,,"NRL 7650-09-109","astro-ph.GA astro-ph.SR","http://creativecommons.org/licenses/publicdomain/","  Million degree plasmas are ubiquitous in the Universe, and examples include
the atmospheres of white dwarfs; accretion phenomena in young stars,
cataclysmic variables and active galactic nuclei; the coronae of stars; and the
interstellar medium of our own galaxy and of others. The bulk of radiation from
million degree plasmas is emitted at extreme ultraviolet (EUV) wavelengths,
which includes critical spectral features containing diagnostic information
often not available at other wavelengths. With underpinning by a mature
instrument technology, there is great opportunity here for exciting
discoveries.
","[{""version"":""v1"",""created"":""Mon, 30 Mar 2009 13:03:31 GMT""}]","2009-03-31"
"0903.5213","Jan Cuypers","J. Cuypers, C. Aerts, P. De Cat, J. De Ridder, K. Goossens, C.
  Schoenaers, K. Uytterhoeven, B. Acke, G. Davignon, J. Debosscher, L. Decin,
  W. De Meester, P. Deroo, R. Drummond, K. Kolenberg, K. Lefever, G. Raskin, M.
  Reyniers, S. Saesen, B. Vandenbussche, R. Van Malderen, T. Verhoelst, H. Van
  Winckel, and C. Waelkens","Long-term photometric monitoring with the Mercator telescope.
  Frequencies and multicolour amplitudes of $\gamma$ Doradus stars","Electronic tables (5 to 25) not included in this version",,"10.1051/0004-6361/200911691",,"astro-ph.GA","http://arxiv.org/licenses/nonexclusive-distrib/1.0/","  Gamma Doradus stars are excellent targets for asteroseismology since the
gravity modes present in these stars probe the deep stellar interiors. Mode
identification will improve the knowledge of these stars considerably. A
selected group of Gamma Doradus stars and some candidates were observed with
the Mercator telescope to find and/or confirm the periodicities in the light
variations and to derive reliable amplitude ratios in different pass bands. A
frequency analysis was performed on all new data obtained in the Geneva
photometric system. In order to have more reliable and accurate frequencies,
the new data were combined with similar data from the literature and with
Hipparcos observations. A set of frequencies that minimized the the residuals
in a harmonic fit was searched for while allowing means and amplitudes to vary
from one observation set to another. Frequencies and amplitudes in the
photometric passbands of the Geneva system are given for 21 Gamma Doradus
stars. We report the discovery of HD 74504 as a newly found Gamma Doradus star.
Our study provides the first extensive multicolour database for the
understanding of gravity modes in F-type stars.
","[{""version"":""v1"",""created"":""Mon, 30 Mar 2009 13:20:59 GMT""}]","2015-05-13"
"0903.5214","Miguel Angel Garcia","A. Serrano, E. Fernandez Pinel, A. Quesada, I. Lorite, M. Plaza, L.
  Perez, F. Jimenez-Villacorta, J. de la Venta, M. S. Martin-Gonzalez, J. L.
  Costa-Kramer, J. F. Fernandez, J. Llopis, M. A. Garcia","Room-temperature ferromagnetism in the mixtures of the TiO2 and Co3O4
  powders","17 pages, 8 figures",,"10.1103/PhysRevB.79.144405",,"cond-mat.mtrl-sci","http://arxiv.org/licenses/nonexclusive-distrib/1.0/","  We report here the observation of ferromagnetism (FM) at 300 K in mixtures of
TiO2 and Co3O4 powders despite the antiferromagnetic and diamagnetic character
of both oxides respectively. The ferromagnetic behavior is found in the early
stages of reaction and only for TiO2 in anatase structure; no FM is found for
identical samples prepared with rutile-TiO2. Optical spectroscopy and X-ray
absorption spectra confirm a surface reduction of octahedral Co+3->Co+2 in the
mixtures which is in the origin of the observed magnetism
","[{""version"":""v1"",""created"":""Mon, 30 Mar 2009 13:12:05 GMT""}]","2009-11-13"
"0903.5215","Santanu Maiti Kumar","Shreekantha Sil, Santanu K. Maiti and Arunava Chakrabarti","Flux induced semiconducting behavior of a quantum network","4 pages, 7 figures","Physical Review B, Volume 79, Page 193309 (2009)","10.1103/PhysRevB.79.193309",,"cond-mat.mes-hall cond-mat.mtrl-sci","http://arxiv.org/licenses/nonexclusive-distrib/1.0/","  We show that a diamond shaped periodic network, recently proposed as a model
of a spin filter (A. Aharony {\em et al.} \cite{aharon08}) is capable of
behaving as a p-type or an n-type semiconductor depending on a suitable choice
of the on-site potentials of the atoms occupying the vertices of the lattice,
and the strength of the magnetic flux threading each plaquette of the network.
A detailed study of the density of states of an infinite network is made
together with the conductance of finite sized system to establish the idea.
","[{""version"":""v1"",""created"":""Mon, 30 Mar 2009 13:12:25 GMT""}]","2009-05-20"
"0903.5216","Thomas Maier","T.A. Maier, S. Graser, D.J. Scalapino, P.J. Hirschfeld","Origin of Gap Anisotropy in Spin Fluctuation Models of the Fe-pnictides","6 pages, 7 figures","Phys. Rev. B 79, 224510 (2009)","10.1103/PhysRevB.79.224510",,"cond-mat.supr-con cond-mat.str-el","http://arxiv.org/licenses/nonexclusive-distrib/1.0/","  We discuss the large gap anisotropy found for the A1g (s-wave) state in RPA
spin-fluctuation and functional renormalization group calculations and show how
the simple arguments leading to isotropic sign-switched s-wave states in these
systems need to be supplemented by a consideration of pair scattering within
Fermi surface sheets and between the individual electron sheets as well. In
addition, accounting for the orbital makeup of the states on the Fermi surface
is found to be crucial.
","[{""version"":""v1"",""created"":""Mon, 30 Mar 2009 13:17:21 GMT""}]","2009-09-10"
"0903.5218","Sinead McGlynn","S. McGlynn (1,2), S. Foley (2), B. McBreen (2), L. Hanlon (2), S.
  McBreen (2,3), D. J. Clark (4), A. J. Dean (4), A. Martin-Carrillo (2) and R.
  O'Connor (2) ((1) Royal Institute of Technology (KTH), Stockholm (2)
  University College Dublin, (3) MPE Garching, (4) University of Southampton)","High energy emission and polarisation limits for the INTEGRAL burst GRB
  061122","9 pages, 6 figures, accepted for publication in Astronomy &
  Astrophysics",,"10.1051/0004-6361/200810920",,"astro-ph.CO","http://arxiv.org/licenses/nonexclusive-distrib/1.0/","  (Abridged) GRB 061122 is one of the brightest GRBs detected within INTEGRAL's
field of view to date. The two gamma-ray detectors on INTEGRAL were used to
investigate the spectral characteristics of GRB 061122. A search for linear
polarisation in the prompt emission was carried out using the SPI multiple
event data in the energy range 100 keV-1 MeV.
  The prompt spectrum was best fit by a combination of a blackbody and a
power--law model (the quasithermal model), with evidence for high energy
emission continuing above 8 MeV. A pseudo-redshift value of pz = 0.95 +/- 0.18
was determined using the spectral fit parameters. The isotropic energy at this
pseudo-redshift is 8.5 x 10^{52} erg. The jet opening angle was estimated to be
smaller than 2.8 deg or larger than 11.9 deg from the X-ray lightcurve. An
upper limit of 60% polarisation was determined for the prompt emission of GRB
061122, using the multiple event data.
  The high energy emission observed in the spectrum may be due to the reverse
shock interacting with the GRB ejecta when it is decelerated by the circumburst
medium. This behaviour has been observed in a small fraction of GRBs to date,
but is expected to be more commonly observed by the Fermi Gamma-ray Space
Telescope. The conditions for polarisation are met if the jet opening angle is
less than 2.8 deg, but further constraints on the level of polarisation are not
possible.
","[{""version"":""v1"",""created"":""Mon, 30 Mar 2009 13:35:24 GMT""}]","2015-05-13"
"0903.5219","Stephen Fletcher Dr","A-M. Broomhall, W. J. Chaplin, G. R. Davies, Y. Elsworth, S. T.
  Fletcher, S. J. Hale, B. Miller and R. New","Definitive Sun-as-a-star p-mode frequencies: 23 years of BiSON
  observations","Accepted for publication in MNRAS; 5 pages, 3 tables",,"10.1111/j.1745-3933.2009.00672.x",,"astro-ph.SR","http://arxiv.org/licenses/nonexclusive-distrib/1.0/","  We present a list of ""best possible"" estimates of low-degree p-mode
frequencies, from 8640 days of observations made by the Birmingham
Solar-Oscillations Network (BiSON). This is the longest stretch of helioseismic
data ever used for this purpose, giving exquisite precision in the estimated
frequencies. Every effort has been made in the analysis to ensure that the
frequency estimates are also accurate. In addition to presenting the raw
best-fitting frequencies from our ""peak bagging"" analysis, we also provide
tables of corrected frequencies pertinent to the quiet-Sun and an intermediate
level of solar activity.
","[{""version"":""v1"",""created"":""Mon, 30 Mar 2009 14:07:14 GMT""}]","2015-05-13"
"0903.5220","Mahdou Najib","N. Mahdou and K. Ouarghi","On G-$(n,d)$-rings",,,,,"math.AC","http://arxiv.org/licenses/nonexclusive-distrib/1.0/","  The main aim of this paper is to investigate new class of rings called, for
positive integers $n$ and $d$, $G-(n,d)-$rings, over which every $n$-presented
module has a Gorenstein projective dimension at most $d$. Hence we characterize
$n$-coherent $G-(n,0)-$rings. We conclude by various examples of
$G-(n,d)-$rings.
","[{""version"":""v1"",""created"":""Mon, 30 Mar 2009 13:25:05 GMT""}]","2009-03-31"
"0903.5221","Changbo Chen","Changbo Chen (1), Marc Moreno Maza (1), Bican Xia (2), Lu Yang (3)
  ((1) ORCCA, University of Western Ontario (UWO), London, Ontario, Canada, (2)
  School of Mathematical Sciences, Peking University, Beijing, China, (3)
  Shanghai Key Laboratory of Trustworthy Computing, East China Normal
  University, Shanghai, China)","Computing Cylindrical Algebraic Decomposition via Triangular
  Decomposition","10 pages",,,,"cs.SC","http://arxiv.org/licenses/nonexclusive-distrib/1.0/","  Cylindrical algebraic decomposition is one of the most important tools for
computing with semi-algebraic sets, while triangular decomposition is among the
most important approaches for manipulating constructible sets. In this paper,
for an arbitrary finite set $F \subset {\R}[y_1, ..., y_n]$ we apply
comprehensive triangular decomposition in order to obtain an $F$-invariant
cylindrical decomposition of the $n$-dimensional complex space, from which we
extract an $F$-invariant cylindrical algebraic decomposition of the
$n$-dimensional real space. We report on an implementation of this new approach
for constructing cylindrical algebraic decompositions.
","[{""version"":""v1"",""created"":""Mon, 30 Mar 2009 13:26:43 GMT""}]","2009-03-31"
"0903.5222","Azamat Valeev","A.F. Valeev (1), O. Sholukhova (1), S. Fabrika (1) ((1)Special
  Astrophysical Observatory, Nizhnij Arkhyz, Russia)","A new Luminous Variable in M33","5 pages, 6 figures; MNRAS Letter accepted",,"10.1111/j.1745-3933.2009.00654.x",,"astro-ph.CO","http://arxiv.org/licenses/nonexclusive-distrib/1.0/","  We present a new luminous star in M33 located in the nuclear region. The star
shows strong FeII and [FeII] forest, hydrogen emissions in the spectrum, as
well as nebular lines. TiII and SiII lines were detected in absorption, their
radial velocity shifted by ~ -30km/s relative to emission lines. The star is
variable over seven years with 0.5 mag variations over a year. We studied its
spectral energy distribution together with five confirmed Luminous Blue
Variables and Var A in M33 using homogeneous data and methods. We found the
star's bolometric luminosity to be log(L/Lsun)~6.27, a surface temperature of
T~16000K and black body temperatures of two dust components of T~900 and 420K.
The new star has properties intermediate between the LBVs and VarA (probable
cool hypergiant). In the same time it has a hot photosphere, LBV-like
luminosity and an extensive circumstellar material (strong [CaII] lines). In
these seven luminous variables in M33 we find the total range of the hot
component luminosities is 1.0 dex, but that of the dust componets is 2.0 dex.
We conclude that the dust phenomenon in the luminous variables is temporary and
variable, and that dust activity may follow strong eruptions.
","[{""version"":""v1"",""created"":""Mon, 30 Mar 2009 13:47:10 GMT""}]","2009-11-13"
"0903.5223","Alexander Barvinok","Alexander Barvinok and John Hartigan","Maximum entropy Gaussian approximation for the number of integer points
  and volumes of polytopes","44 pages, results sharpened, new examples added",,,,"math.CO math.MG math.PR","http://arxiv.org/licenses/nonexclusive-distrib/1.0/","  We describe a maximum entropy approach for computing volumes and counting
integer points in polyhedra. To estimate the number of points from a particular
set X in R^n in a polyhedron P in R^n, by solving a certain entropy
maximization problem, we construct a probability distribution on the set X such
that a) the probability mass function is constant on the intersection of P and
X and b) the expectation of the distribution lies in P. This allows us to apply
Central Limit Theorem type arguments to deduce computationally efficient
approximations for the number of integer points, volumes, and the number of 0-1
vectors in the polytope. As an application, we obtain asymptotic formulas for
volumes of multi-index transportation polytopes and for the number of multi-way
contingency tables.
","[{""version"":""v1"",""created"":""Mon, 30 Mar 2009 13:28:09 GMT""},{""version"":""v2"",""created"":""Wed, 15 Jul 2009 14:43:38 GMT""}]","2009-07-15"
"0903.5224","Andrea Lapi","A. Cavaliere (1,2), A. Lapi (1,3), R. Fusco-Femiano (4) (1-Univ. ""Tor
  Vergata"", Roma, Italy; 2-Accademia Lincei, Roma, Italy; 3-SISSA/ISAS,
  Trieste, Italy; 4-INAF/IASF, Roma, Italy)","Galaxy Clusters, a Novel Look at Diffuse Baryons Withstanding Dark
  Matter Gravity","13 pages, 8 figures, uses RevTeX4 + emulateapj.cls and apjfonts.sty.
  Typos corrected. Accepted by ApJ","Astrophys. J.698:580, 2009; Astrophys.J.698:580-593,2009","10.1088/0004-637X/698/1/580",,"astro-ph.CO","http://arxiv.org/licenses/nonexclusive-distrib/1.0/","  [abridged] The equilibria of the intracluster plasma (ICP) and of the
gravitationally dominant dark matter (DM) are governed by the hydrostatic and
the Jeans equation. Jeans, with the DM `entropy' set to K ~ r^\alpha and \alpha
~ 1.25 - 1.3 applying from groups to rich clusters, yields our radial
\alpha-profiles. In the ICP the entropy run k(r) is mainly shaped by shocks, as
steadily set by supersonic accretion of gas at the cluster boundary, and
intermittently driven from the center by merging events or by AGNs; the
resulting equilibrium is described by the exact yet simple formalism
constituting our ICP Supermodel. With a few parameters, this accurately
represents the runs of density n(r) and temperature T(r) as required by recent
X-ray data on surface brightness and spectroscopy for both cool core (CC) and
non cool core (NCC) clusters; the former are marked by a middle temperature
peak, whose location is predicted from rich clusters to groups. The Supermodel
inversely links the inner runs of n(r) and T(r), and highlights their central
scaling with entropy n_c ~ k_c^-1 and T_c ~ k_c^0.35, to yield radiative
cooling times t_c ~ 0.3 (k_c/15 keV cm^2)^1.2 Gyr. We discuss the stability of
the central values so focused either in CC and NCC clusters. From the
Supermodel we derive as limiting cases the classic polytropic \beta-models, and
the `mirror' model with T(r) ~ \sigma^2(r) suitable for NCC and CC clusters,
respectively; these highlight how the ICP temperature T(r) tends to mirror the
DM velocity dispersion \sigma^2(r) away from entropy injections. Finally, we
discuss how the Supermodel connects information derived from X-ray and
gravitational lensing observations.
","[{""version"":""v1"",""created"":""Mon, 30 Mar 2009 13:49:10 GMT""}]","2011-02-11"
"0903.5225","Maurice Dupre","Maurice J. Dupr\'e","The Fully Covariant Energy Momentum Stress Tensor For Gravity and the
  Einstein Equation in General Relativity","preprint",,,,"gr-qc","http://arxiv.org/licenses/nonexclusive-distrib/1.0/","  We give a fully covariant energy momentum stress tensor for the gravitational
field which is easily physically motivated, and which leads to a very general
derivation of the Einstein equation for gravity. We do not need to assume any
property of the surce matter fields' energy momentum stress tensor other than
symmetry. We give a physical motivation for this choice using laser light
pressure. As a consequence of our derivation, the energy momentum stress tensor
for the total source matter and fields must be divergence free, when spacetime
is 4 dimensional. Moreoverr, if the total source matter fields are assumed to
be divergence free, then either spacetime is dimension 4 or the spacetime has
constant scalar curvature.
","[{""version"":""v1"",""created"":""Mon, 30 Mar 2009 13:53:46 GMT""}]","2009-03-31"
