"0903.5084","Pavel Etingof","Pavel Etingof","A uniform proof of the Macdonald-Mehta-Opdam identity for finite Coxeter
  groups","10 pages, latex",,,,"math.RT math.CO","http://arxiv.org/licenses/nonexclusive-distrib/1.0/","  We give a new proof of the Macdonald-Mehta-Opdam integral identity for finite
Coxeter groups. This identity was conjectured by Macdonald and proved by Opdam
in 1993 using the theory of multivariable Bessel functions, but in
non-crystallographic cases the proof relied on a computer calculation by F.
Garvan. Our proof is somewhat more elementary (in particular, it does not use
multivariable Bessel functions), and uniform (does not refer to the
classification of finite Coxeter groups and does not use computers).
","[{""version"":""v1"",""created"":""Sun, 29 Mar 2009 19:27:44 GMT""}]","2009-03-31"
"0903.5085","Max-K. von Renesse","Sebastian Andres and Max-K. von Renesse","Regularity Properties for a System of Interacting Bessel Processes",,,,,"math.PR math.AP","http://arxiv.org/licenses/nonexclusive-distrib/1.0/","  We study the regularity of a diffusion on a simplex with singular drift and
reflecting boundary condition which describes a finite system of particles on
an interval with Coulomb interaction and reflection between nearest neighbors.
  As our main result we establish the Feller property for the process in both
cases of repulsion and attraction. In particular the system can be started from
any initial state, including multiple point configurations. Moreover we show
that the process is a Euclidean semi-martingale if and only if the interaction
is repulsive. Hence, contrary to classical results about reflecting Brownian
motion in smooth domains, in the attractive regime a construction via a system
of Skorokhod SDEs is impossible. Finally, we establish exponential heat kernel
gradient estimates in the repulsive regime.
  The main proof for the attractive case is based on potential theory in
Sobolev spaceswith Muckenhoupt weights.
","[{""version"":""v1"",""created"":""Sun, 29 Mar 2009 19:48:05 GMT""}]","2009-03-31"
"0903.5086","Ning Jiang","Ning Jiang, C. David Levermore, Nader Masmoudi","Remarks on the Acoustic Limit for the Boltzmann Equation","17 pages","Communications in Partial Differential Equations 2010",,,"math.AP math-ph math.MP","http://arxiv.org/licenses/nonexclusive-distrib/1.0/","  We use some new nonlinear estimates found in \cite {LM} to improve the
results of \cite{GL} that establish the acoustic limit for DiPerna-Lions
solutions of Boltzmann equation in three ways. First, we enlarge the class of
collision kernels treated to that found in \cite{LM}, thereby treating all
classical collision kernels to which the DiPerna-Lions theory applies. Second,
we improve the scaling of the kinetic density fluctuations with Knudsen number
from $O(\epsilon^m)$ for some $m>\frac12$ to $O(\epsilon^\frac12)$. Third, we
extend the results from periodic domains to bounded domains with impermeable
boundaries, deriving the boundary condition for the acoustic system.
","[{""version"":""v1"",""created"":""Sun, 29 Mar 2009 19:30:51 GMT""},{""version"":""v2"",""created"":""Tue, 25 May 2010 00:02:44 GMT""}]","2010-05-26"
"0903.5087","Oleg Shro","O. I. Shro","The path integral of Feynman and ""information modelling"" of processes
  and systems",,"Proceedings of the SPIE, Volume 7024, pp. 70240Y-70240Y-6 (2008)",,,"physics.gen-ph","http://creativecommons.org/licenses/by-nc-sa/3.0/","  The given article example of physical analogies to be entered information
space-time. The opportunity of Poincare group use is shown for transition from
one frame in another, for this purpose is entered invariant velocity of
transition of the information. For calculation of information processes
probability amplitudes is offered using path integral of Feynman.
","[{""version"":""v1"",""created"":""Sun, 29 Mar 2009 19:35:01 GMT""}]","2009-03-31"
"0903.5088","Andre Lukas","Lara B. Anderson, James Gray, Andre Lukas, Burt Ovrut","The Edge Of Supersymmetry: Stability Walls in Heterotic Theory","12 pages, Latex, 2 eps figures. Figure 2 has been replaced in v2.
  Minor typos corrected","Phys.Lett.B677:190-194,2009","10.1016/j.physletb.2009.05.025",,"hep-th","http://arxiv.org/licenses/nonexclusive-distrib/1.0/","  We explicitly describe, in the language of four-dimensional N=1
supersymmetric field theory, what happens when the moduli of a heterotic
Calabi-Yau compactification change so as to make the internal non-Abelian gauge
fields non-supersymmetric. At the edge of the region in Kahler moduli space
where supersymmetry can be preserved, an additional anomalous U(1) gauge
symmetry appears in the four-dimensional theory. The D-term contribution to the
scalar potential associated to this U(1) attempts to force the system back into
a supersymmetric configuration and provides a consistent low-energy description
of gauge bundle stability.
","[{""version"":""v1"",""created"":""Mon, 30 Mar 2009 11:13:03 GMT""},{""version"":""v2"",""created"":""Tue, 15 Dec 2009 21:54:52 GMT""}]","2009-12-15"
"0903.5089","Edoardo Milotti","Edoardo Milotti, Alessio Del Fabbro, Roberto Chignola","Precision and Stability Issues in VBL, the Virtual Biophysics Lab
  simulation program","presented by Edoardo Milotti at the ECOBIOSYS 2009 conference
  (Milano-Italy)",,,,"physics.bio-ph physics.comp-ph","http://arxiv.org/licenses/nonexclusive-distrib/1.0/","  The network of biochemical reactions inside living organisms is characterized
by an overwhelming complexity which stems from the sheer number of reactions
and from the complicated topology of biochemical cycles. However the high speed
of computers and the sophisticated computational methods that are available
today are powerful tools that allow the numerical exploration of these
exceedingly interesting dynamical systems. We are now developing a program, the
Virtual Biophysics Lab (VBL), that simulates tumor spheroids, and which
includes a reduced - but still quite complex - description of the biochemistry
of individual cells, plus many diffusion processes that bring oxygen and
nutrients into cells and metabolites into the environment. Each simulation step
requires the integration of nonlinear differential equations that describe the
individual cell's clockwork and the integration of the diffusion equations.
These integrations are carried out under widely different conditions, in a
changing environment, and for this reason they need integrators that are both
unconditionally stable and that do not display unwanted algorithmic artifacts.
These conditions are not always fulfilled in the existing literature, and we
feel that a review of the underlying mathematical principles may be important
not just for us but for other workers in the field of system biology as well.
","[{""version"":""v1"",""created"":""Sun, 29 Mar 2009 20:15:16 GMT""},{""version"":""v2"",""created"":""Fri, 30 Oct 2009 19:13:47 GMT""}]","2009-10-30"
"0903.5090","Biao Wang","Biao Wang","Minimal Surfaces in Quasi-Fuchsian 3-Manifolds","12 pages",,,,"math.DG math.GT","http://arxiv.org/licenses/nonexclusive-distrib/1.0/","  In this paper, we prove that if a quasi-Fuchsian 3-manifold $M$ contains a
simple closed geodesic with complex length $\Lscr=l+i\theta$ such that
$\theta/l\gg{}1$, then it contains at least two minimal surfaces which are
incompressible in $M$.
","[{""version"":""v1"",""created"":""Sun, 29 Mar 2009 20:17:03 GMT""}]","2009-03-31"
"0903.5091","Daniel Waltner","Daniel Waltner, Stefan Heusler, Juan Diego Urbina, and Klaus Richter","The semiclassical origin of curvature effects in universal spectral
  statistics",,"J. Phys. A: Math. Theor. 42 292001 (2009)","10.1088/1751-8113/42/29/292001",,"nlin.CD","http://arxiv.org/licenses/nonexclusive-distrib/1.0/","  We consider the energy averaged two-point correlator of spectral determinants
and calculate contributions beyond the diagonal approximation using
semiclassical methods. Evaluating the contributions originating from
pseudo-orbit correlations in the same way as in [S. Heusler {\textit {et al.}}\
2007 Phys. Rev. Lett. {\textbf{98}}, 044103] we find a discrepancy between the
semiclassical and the random matrix theory result. A complementary analysis
based on a field-theoretical approach shows that the additional terms occurring
in semiclassics are cancelled in field theory by so-called curvature effects.
We give the semiclassical interpretation of the curvature effects in terms of
contributions from multiple transversals of periodic orbits around shorter
periodic orbits and discuss the consistency of our results with previous
approaches.
","[{""version"":""v1"",""created"":""Sun, 29 Mar 2009 20:18:41 GMT""}]","2015-05-13"
"0903.5092","Beatrix Hiesmayr C.","Beatrix C. Hiesmayr, Marcus Huber, and Philipp Krammer","Two computable sets of multipartite entanglement measures","3 figures, 21 pages","Phys. Rev. A 79, 062308 (2009)","10.1103/PhysRevA.79.062308",,"quant-ph","http://arxiv.org/licenses/nonexclusive-distrib/1.0/","  We present two sets of computable entanglement measures for multipartite
systems where each subsystem can have different degrees of freedom (so-called
qudits). One set, called 'separability' measure, reveals which of the
subsystems are separable/entangled. For that we have to extend the concept of
k-separability for multipartite systems to a novel unambiguous separability
concept which we call \gamma_k-separability. The second set of entanglement
measures reveals the 'kind' of entanglement, i.e. if it is bipartite,
tripartite, ..., n-partite entangled and is denoted as the 'physical' measure.
We show how lower bounds on both sets of measures can be obtained by the
observation that any entropy may be rewritten via operational expressions known
as m-concurrences. Moreover, for different classes of bipartite or multipartite
qudit systems we compute the bounds explicitly and discover that they are often
tight or equivalent to positive partial transposition (PPT).
","[{""version"":""v1"",""created"":""Sun, 29 Mar 2009 21:13:30 GMT""}]","2009-06-10"
"0903.5093","Lisa C. Jeffrey","Lisa Jeffrey, Brendan McLellan","Nonabelian localization for U(1) Chern-Simons theory","14 pages; for conference in honour of Hans Duistermaat's 65th
  birthday",,,,"math.DG math.QA","http://arxiv.org/licenses/nonexclusive-distrib/1.0/","  This article studies the nonabelian localization results of Beasley and
Witten, and considers the analogue of these results when the gauge group is
U(1). It compares these results with results of Manoliu on abelian Chern-Simons
theory, showing that the dependence on the coupling constant is the same.
","[{""version"":""v1"",""created"":""Sun, 29 Mar 2009 21:18:52 GMT""}]","2009-03-31"
"0903.5094","Giuseppe Rodriguez","Michela Redivo-Zaglia and Giuseppe Rodriguez","smt: a Matlab structured matrices toolbox","19 pages, 1 figure, 1 typo corrected in the abstract","Numer. Algorithms 59 (2012) 639-659","10.1007/s11075-011-9527-9",,"math.NA","http://arxiv.org/licenses/nonexclusive-distrib/1.0/","  We introduce the smt toolbox for Matlab. It implements optimized storage and
fast arithmetics for circulant and Toeplitz matrices, and is intended to be
transparent to the user and easily extensible. It also provides a set of test
matrices, computation of circulant preconditioners, and two fast algorithms for
Toeplitz linear systems.
","[{""version"":""v1"",""created"":""Mon, 30 Mar 2009 15:21:53 GMT""}]","2019-10-16"
"0903.5095","Jounghun Lee","Hyunmi Song, Jounghun Lee (Seoul Nat'l Univ.)","Probing the Warm Dark Matter with High-z Quasar Luminosity Function","ApJL in press, revised version, figure 1 replotted correctly,
  discussion improved, 4 pages, 2 figures","Astrophys.J.703:L14-L17,2009","10.1088/0004-637X/703/1/L14",,"astro-ph.CO","http://arxiv.org/licenses/nonexclusive-distrib/1.0/","  In a warm dark matter (WDM) cosmology, the first objects to form at z>=20 are
one dimensional filaments with mean length on the order of the WDM
free-streaming scale. Gao and Theuns recently claimed by using high-resolution
hydrodynamic simulations that the eventual collapse of these WDM filaments
along their longest axes may seed the supermassive black holes that power
high-z quasars. In this picture, it is supposed that the high-z quasar
luminosity function should reflect how abundant the WDM filaments are in the
early universe. We derive analytically the mass function of early-universe
filaments with the help of the Zel'dovich approximation. Then, we determine the
rate of its decrease in the mass section corresponding to the free streaming
scale of a WDM particle of mass m_v. Adjusting the value of m_v, we fit the
slope of the analytic model to that of the high-z quasar luminosity function
measured from the Sloan Digital Sky Survey DR3. A new WDM constraint from this
feasibility study is found to be consistent with the lightest super-symmetric
partner.
","[{""version"":""v1"",""created"":""Sun, 29 Mar 2009 21:54:50 GMT""},{""version"":""v2"",""created"":""Thu, 6 Aug 2009 18:24:00 GMT""}]","2009-09-28"
"0903.5096","Michael Martin Nieto","Peter W. Milonni and Michael Martin Nieto","Coherent States","To appear in: Compendium of Quantum Physics: Concepts, Experiments,
  History and Philosophy, eds. D. Greenberger, K. Hentschel, and F. Weinert
  (Springer, New York, 2009), pp. 106-108",,,"LA-UR-09-01081","quant-ph","http://arxiv.org/licenses/nonexclusive-distrib/1.0/","  We concisely review the history, physics and significance of coherent states.
","[{""version"":""v1"",""created"":""Sun, 29 Mar 2009 22:22:23 GMT""}]","2009-03-31"
"0903.5097","Charles M. Marcus","D. T. McClure, Yiming Zhang, B. Rosenow, E. M. Levenson-Falk, C. M.
  Marcus, L. N. Pfeiffer, K. W. West","Edge-State Velocity and Coherence in a Quantum Hall Fabry-Perot
  Interferometer","related papers at http://marcuslab.harvard.edu","Phys. Rev. Lett. 103 206806 (2009).","10.1103/PhysRevLett.103.206806",,"cond-mat.mes-hall","http://arxiv.org/licenses/nonexclusive-distrib/1.0/","  We investigate nonlinear transport in electronic Fabry-Perot interferometers
in the integer quantum Hall regime. For interferometers sufficiently large that
Coulomb blockade effects are absent, a checkerboard-like pattern of conductance
oscillations as a function of dc bias and perpendicular magnetic field is
observed. Edge-state velocities extracted from the checkerboard data are
compared to model calculations and found to be consistent with a crossover from
skipping orbits at low fields to E x B drift at high fields. Suppression of
visibility as a function of bias and magnetic field is accounted for by
including energy- and field-dependent dephasing of edge electrons.
","[{""version"":""v1"",""created"":""Sun, 29 Mar 2009 22:34:45 GMT""}]","2009-11-14"
"0903.5098","Guo-Qing Zheng","K. Matano, G.L. Sun, D.L. Sun, C.T. Lin, M. Ichioka, Guo-qing Zheng","Anisotropic spin fluctuations and multiple superconducting gaps in
  hole-doped Ba_0.7K_0.3Fe_2As_2: NMR in a single crystal",,"EPL 87 (2009) 27012","10.1209/0295-5075/87/27012",,"cond-mat.supr-con cond-mat.str-el","http://arxiv.org/licenses/nonexclusive-distrib/1.0/","  We report the first ^{75}As-NMR study on a single crystal of the hole-doped
iron-pnictide superconductor Ba_{0.7}K_{0.3}Fe_2As_{2} (T_c = 31.5 K). We find
that the Fe antiferromagnetic spin fluctuations are anisotropic and are weaker
compared to underdoped copper-oxides or cobalt-oxide superconductors. The spin
lattice relaxation rate 1/T_1 decreases below T_c with no coherence peak and
shows a step-wise variation at low temperatures, which is indicative of
multiple superconducting gaps, as in the electron-doped
Pr(La)FeAsO$_{1-x}$F$_{x}$. Furthermore, no evidence was obtained for a
microscopic coexistence of a long-range magnetic and superconductivity.
","[{""version"":""v1"",""created"":""Sun, 29 Mar 2009 22:55:05 GMT""},{""version"":""v2"",""created"":""Tue, 18 Aug 2009 11:41:21 GMT""}]","2015-05-13"
"0903.5099","Francesco Zamponi","Indaco Biazzo, Francesco Caltagirone, Giorgio Parisi, Francesco
  Zamponi","A theory of amorphous packings of binary mixtures of hard spheres","10 pages, 3 figures","Phys.Rev.Lett. 102, 195701 (2009)","10.1103/PhysRevLett.102.195701",,"cond-mat.dis-nn cond-mat.stat-mech","http://arxiv.org/licenses/nonexclusive-distrib/1.0/","  We extend our theory of amorphous packings of hard spheres to binary mixtures
and more generally to multicomponent systems. The theory is based on the
assumption that amorphous packings produced by typical experimental or
numerical protocols can be identified with the infinite pressure limit of long
lived metastable glassy states. We test this assumption against numerical and
experimental data and show that the theory correctly reproduces the variation
with mixture composition of structural observables, such as the total packing
fraction and the partial coordination numbers.
","[{""version"":""v1"",""created"":""Sun, 29 Mar 2009 22:57:32 GMT""}]","2015-05-13"
"0903.5100","Boris Ivlev","B. Ivlev","Underbarrier interference","15 pages, 12 figures",,,,"quant-ph","http://arxiv.org/licenses/nonexclusive-distrib/1.0/","  Quantum tunneling through a two-dimensional static barrier becomes unusual
when a momentum of an electron has a tangent component with respect to a border
of the prebarrier region. If the barrier is not homogeneous in the direction
perpendicular to tunneling a fraction of the electron state is waves
propagating away from the barrier. When the tangent momentum is zero a mutual
interference of the waves results in an exponentially small outgoing flux. The
finite tangent momentum destroys the interference due to formation of caustics
by the waves. As a result, a significant fraction of the prebarrier density is
carried away from the barrier providing a not exponentially small penetration
even through an almost classical barrier. The total electron energy is well
below the barrier.
","[{""version"":""v1"",""created"":""Sun, 29 Mar 2009 23:16:54 GMT""},{""version"":""v2"",""created"":""Fri, 3 Jul 2009 23:34:44 GMT""},{""version"":""v3"",""created"":""Tue, 3 Nov 2009 20:54:16 GMT""}]","2009-11-03"
"0903.5101","Shu Zhang","Shu Zhang, Leilei Yin and Nicholas Fang","Focusing Ultrasound with Acoustic Metamaterial Network",,,,,"physics.class-ph","http://arxiv.org/licenses/nonexclusive-distrib/1.0/","  We present the first experimental demonstration of focusing ultrasound waves
through a flat acoustic metamaterial lens composed of a planar network of
subwavelength Helmholtz resonators. We observed a tight focus of
half-wavelength in width at 60.5 KHz by imaging a point source. This result is
in excellent agreement with the numerical simulation by transmission line model
in which we derived the effective mass density and compressibility. This
metamaterial lens also displays variable focal length at different frequencies.
Our experiment shows the promise of designing compact and light-weight
ultrasound imaging elements.
","[{""version"":""v1"",""created"":""Sun, 29 Mar 2009 23:39:48 GMT""}]","2009-03-31"
"0903.5102","Anton Vorontsov","A.B.Vorontsov","Broken translational and time-reversal symmetry in superconducting films","4+ pages, 4 figures, to appear in PRL","Phys. Rev. Lett. 102, 177001 (2009)","10.1103/PhysRevLett.102.177001",,"cond-mat.supr-con","http://arxiv.org/licenses/nonexclusive-distrib/1.0/","  We demonstrate that films of unconventional (d-wave) superconductor at
temperatures $T\lesssim 0.43 T_c$ can exhibit unusual superconducting phases.
The new ground states beside the broken gauge and the point group symmetries
can spontaneously break (i) continuous translational symmetry and form periodic
order parameter structures in the plane of the film, or (ii) time-reversal
symmetry and develop supercurrent flowing along the film. These states are
result of the strong transverse inhomogeniety present in films with thickness
of several coherence lengths. We show a natural similarity between formation of
these states and the Fulde-Ferrell-Larkin-Ovchinnikov state.
","[{""version"":""v1"",""created"":""Sun, 29 Mar 2009 23:57:15 GMT""}]","2009-04-30"
"0903.5103","Julio Jos\'e Moyano-Fern\'andez","J. J. Moyano-Fern\'andez","On Weierstra{\ss} semigroups at one and two points and their
  corresponding Poincar\'e series","Beginning of Section 3 and Subsection 3.1 were modified","Abhandlungen aus dem mathematischen Seminar der Universit\""at
  Hamburg, Volume 81, Number 1 (2011), 115-127","10.1007/s12188-011-0055-2",,"math.AG","http://arxiv.org/licenses/nonexclusive-distrib/1.0/","  The aim of this paper is to introduce and investigate the Poincar\'e series
associated with the Weierstra{\ss} semigroup of one and two rational points at
a (not necessarily irreducible) non-singular projective algebraic curve defined
over a finite field, as well as to describe their functional equations in the
case of an affine complete intersection.
","[{""version"":""v1"",""created"":""Mon, 30 Mar 2009 01:01:55 GMT""},{""version"":""v2"",""created"":""Wed, 29 Jun 2011 22:46:43 GMT""}]","2011-07-01"
"0903.5104","Grigor Mamniashvili I","M.M. Nadareishvili, K.A. Kvavadze, G.I. Mamniashvili, T.N. Khoperia,
  T.I. Zedgenidze","The vacuum thermal treatment effect on the optical absorption spectra of
  the TiO2 coated by Ni-B nano-clasters photocatalyst powders","8 pages, 4 figures",,,,"cond-mat.mtrl-sci cond-mat.other","http://arxiv.org/licenses/nonexclusive-distrib/1.0/","  The thermal vacuum treatment effect on the optical absorption spectra of the
TiO2 nanopowders, both pure and coated by the Ni-B clasters with the original
electroless method was investigated. It was observed that the thermal treatment
of pure TiO2 nanopowders does not change their optical absorption spectrum
while after the coating of these powder particles by the Ni-B clasters the
thermal treatment results in the increase of the optical light absorption in
the visual region of spectrum. This points to the possibility of the
significant improvement of the photocatalist efficiency of TiO2 nanopowders
coated by the Ni-B clasters using the thermal treatment.
","[{""version"":""v1"",""created"":""Mon, 30 Mar 2009 01:47:13 GMT""}]","2009-03-31"
"0903.5105","Jae-Wook Chung","Jae-Wook Chung","The invariant of n-punctured ball tangles","40 pages, 14 figures, appendix",,,,"math.GT","http://arxiv.org/licenses/nonexclusive-distrib/1.0/","  Based on the Kauffman bracket at $A=e^{i \pi/4}$, we defined an invariant for
a special type of $n$-punctured ball tangles. The invariant $F^n$ takes values
in the set $PM_{2\times2^n}(\mathbb Z)$ of $2\times 2^n$ matrices over $\mathbb
Z$ modulo the scalar multiplication of $\pm1$. We provide the formula to
compute the invariant of the $k_1 + ... + k_n$-punctured ball tangle composed
of given $n,k_1,...,k_n$-punctured ball tangles. Also, we define the horizontal
and the vertical connect sums of punctured ball tangles and provide the
formulas for their invariants from those of given punctured ball tangles. In
addition, we introduce the elementary operations on the class
$\textbf{\textit{ST}}$ of 1-punctured ball tangles, called spherical tangles.
The elementary operations on $\textbf{\textit{ST}}$ induce the operations on
$PM_{2\times2}(\mathbb Z)$, also called the elementary operations. We show that
the group generated by the elementary operations on $PM_{2\times2}(\mathbb Z)$
is isomorphic to a Coxeter group.
","[{""version"":""v1"",""created"":""Mon, 30 Mar 2009 00:45:12 GMT""}]","2009-03-31"
"0903.5106","Alberto Castro","Alberto Castro and E. K. U. Gross","Acceleration of quantum optimal control theory algorithms with mixing
  strategies",,,,,"physics.comp-ph","http://arxiv.org/licenses/nonexclusive-distrib/1.0/","  We propose the use of mixing strategies to accelerate the convergence of the
common iterative algorithms utilized in Quantum Optimal Control Theory (QOCT).
We show how the non-linear equations of QOCT can be viewed as a ""fixed-point""
non-linear problem. The iterative algorithms for this class of problems may
benefit from mixing strategies, as it happens, e.g. in the quest for th
ground-state density in Kohn-Sham density functional theory. We demonstrate,
with some numerical examples, how the same mixing schemes utilized in this
latter non-linear problem, may significantly accelerate the QOCT iterative
procedures.
","[{""version"":""v1"",""created"":""Mon, 30 Mar 2009 00:56:50 GMT""}]","2009-03-31"
"0903.5107","Massimo Rontani","Andrea Secchi, Massimo Rontani","Coulomb versus spin-orbit interaction in few-electron carbon-nanotube
  quantum dots","RevTeX 4.0, 4 pages, 4 postscript figures. New Fig. 4 on two-electron
  wave functions was added, and more insight was given on the Wigner molecule
  state. A mechanical error affecting the value of the dielectric constant was
  corrected","Physical Review B 80, 041404(R) (2009)","10.1103/PhysRevB.80.041404",,"cond-mat.mes-hall cond-mat.str-el","http://arxiv.org/licenses/nonexclusive-distrib/1.0/","  Few-electron states in carbon-nanotube quantum dots are studied by means of
the configuration-interaction method. The peculiar non-interacting feature of
the tunneling spectrum for two electrons, recently measured by Kuemmeth et al.
[Nature 452, 448 (2008)], is explained by the splitting of a low-lying isospin
multiplet due to spin-orbit interaction. Nevertheless, the strongly-interacting
ground state forms a `Wigner molecule' made of electrons localized in space.
Signatures of the electron molecule may be seen in tunneling spectra by varying
the tunable dot confinement potential.
","[{""version"":""v1"",""created"":""Mon, 30 Mar 2009 00:57:09 GMT""},{""version"":""v2"",""created"":""Mon, 25 May 2009 18:31:41 GMT""}]","2009-07-18"
