"0903.4891","Ond\v{r}ej Pejcha","Ondrej Pejcha","The time-dependent rebrightenings in classical novae outbursts: a
  late-time episodic fuel burning?","5 pages, 3 figures, accepted to ApJL","Astrophys.J.701:L119-L122,2009","10.1088/0004-637X/701/2/L119",,"astro-ph.SR astro-ph.HE","http://arxiv.org/licenses/nonexclusive-distrib/1.0/","  A significant fraction of novae exhibit a series of rebrightenings on the
decline branch of their light curves. We use visual observations to study this
phase in several well-observed novae. We find that these rebrightenings are
isolated flare-like events on otherwise smooth light curves and we show that in
most novae in our sample the time intervals between consecutive flares
gradually increase as a geometric series; rebrightenings are equally spaced in
logarithmic time. We also find a correlation between the rate of increase in
the time between rebrightenings with the speed class of the nova in the sense
that slower novae tend to increase the time intervals faster. We attribute
these rebrightenings to instabilities in the envelope hydrogen burning and we
mention other cases of such timing pattern in astronomy and natural sciences in
general.
","[{""version"":""v1"",""created"":""Mon, 30 Mar 2009 00:14:13 GMT""},{""version"":""v2"",""created"":""Mon, 10 Aug 2009 17:37:29 GMT""}]","2009-08-12"
"0903.4893","Martti Raidal","Yuji Kajiyama and Martti Raidal","Higgs-dependent Leptogenesis","Withdrawn by authors",,,,"hep-ph","http://arxiv.org/licenses/nonexclusive-distrib/1.0/","  Withdrawn by authors
","[{""version"":""v1"",""created"":""Mon, 30 Mar 2009 15:45:47 GMT""},{""version"":""v2"",""created"":""Tue, 16 Nov 2010 12:04:53 GMT""}]","2010-11-17"
"0903.4903","Matt Kerr","Matt Kerr and Gregory Pearlstein","An Exponential History of Functions with Logarithmic Growth","97 pages, 10 figures; to appear in Proceedings of MSRI Conference on
  Topology of Stratified Spaces; substantial revisions with new results on
  Neron models included",,,,"math.AG","http://arxiv.org/licenses/nonexclusive-distrib/1.0/","  We survey recent work on normal functions, including limits and singularities
of admissible normal functions, the Griffiths-Green approach to the Hodge
conjecture, algebraicity of the zero-locus of a normal function, Neron models,
and Mumford-Tate groups. Some of the material and many of the examples, esp. in
sec. 5-6, are original. The first two sections should be easily accessible to
graduate students.
","[{""version"":""v1"",""created"":""Mon, 30 Mar 2009 10:13:22 GMT""},{""version"":""v2"",""created"":""Wed, 26 Aug 2009 22:10:55 GMT""}]","2009-08-27"
"0903.4953","Manh-Ha Nguyen","Ha M. Nguyen and Pai-Yi Hsiao","Comment on ""Critical and slow dynamics in a bulk metallic glass
  exhibiting strong random magnetic anisotropy"" [Appl. Phys. Lett. 92, 011923
  (2008)]","2 pages, 2 figures, accepted for publication in Applied Physics
  Letters Volume 94, Issue 15, Issue date 13 April 2009","Appl. Phys. Lett. 94, 186101 (2009)","10.1063/1.3119632",,"cond-mat.mtrl-sci cond-mat.stat-mech","http://arxiv.org/licenses/nonexclusive-distrib/1.0/","  In this comment, by using Monte Carlo simulation, we show that the
perpendicular shift of hysteresis loops reported in the commented work is
nothing special but simply due to the fact that the range of field does not
surpass the reversible field beyond which the two branches of the loop merge.
If the reversible field is exceeded, the shift is no longer observed. Moreover,
we point out that even using a small range of field, the shift will not be
observed if the observation time is long enough for the reversible field to
drop within the range.
","[{""version"":""v1"",""created"":""Mon, 30 Mar 2009 05:39:23 GMT""}]","2009-10-27"
"0903.4958","Ruiming Zhang Dr.","Ruiming Zhang","On Generalized Hilbert Matrices","15 pages",,,,"math.CA","http://arxiv.org/licenses/nonexclusive-distrib/1.0/","  In this note, we present a systematic method to explicitly compute the
determinants and inverses for some generalized Hilbert matrices associated with
orthogonal systems with explicit representations. We expressed the determinant,
the inverse and a lower bound for the smallest eigenvalue of such matrix in
terms of the explicit orthogonal system.
","[{""version"":""v1"",""created"":""Mon, 30 Mar 2009 10:16:19 GMT""},{""version"":""v2"",""created"":""Tue, 9 Jun 2009 06:16:14 GMT""},{""version"":""v3"",""created"":""Wed, 10 Jun 2009 06:56:02 GMT""},{""version"":""v4"",""created"":""Thu, 11 Jun 2009 01:07:27 GMT""},{""version"":""v5"",""created"":""Fri, 12 Jun 2009 00:31:58 GMT""}]","2009-06-12"
"0903.4965","Valery A. Liskovets","Valery A. Liskovets","A multivariate arithmetic function of combinatorial and topological
  significance","17 pages; new Remark 3.10 and Concluding remarks; additional
  references; minor improvements. Final version to appear in INTEGERS","Integers, 10 (2010), A12, 155-177 (the last remark has been
  strengthened)","10.1515/INTEG.2010.012",,"math.NT math.AT math.CO","http://arxiv.org/licenses/nonexclusive-distrib/1.0/","  We investigate properties of a multivariate function $E(m_1,m_2,...,m_r)$,
called {\it orbicyclic}, that arises in enumerative combinatorics in counting
non-isomorphic maps on orientable surfaces. $E(m_1,m_2,...,m_r)$ proves to be
multiplicative, and a simple formula for its calculation is provided. It is
shown that the necessary and sufficient conditions for this function to vanish
is equivalent to familiar Harvey's conditions that characterize possible
branching data of finite cyclic automorphism groups of Riemann surfaces.
","[{""version"":""v1"",""created"":""Mon, 30 Mar 2009 13:28:10 GMT""},{""version"":""v2"",""created"":""Fri, 27 Nov 2009 14:26:20 GMT""}]","2010-03-17"
"0903.4974","Sofia Wechsler","Sofia Wechsler","What is realism and how can it be non-local?","11 pages and 4 figures. This is a new version that replaced the proof
  in the former version which was non-satisfactory",,,,"quant-ph","http://creativecommons.org/licenses/by/4.0/","  The concept of realism in quantum mechanics means that results of measurement
are caused by physical variables, hidden or observable. Local hidden variables
were proved unable to explain results of measurements on entangled particles
tested far away from one another. Then, some physicists embraced the idea of
nonlocal hidden variables. The present article proves that this idea is
problematic, that it runs into an impasse vis-\`a-vis the special relativity.
","[{""version"":""v1"",""created"":""Sun, 29 Mar 2009 17:53:20 GMT""},{""version"":""v2"",""created"":""Tue, 31 Mar 2009 01:55:24 GMT""},{""version"":""v3"",""created"":""Fri, 20 Nov 2015 11:27:20 GMT""},{""version"":""v4"",""created"":""Sat, 11 Sep 2021 17:05:03 GMT""}]","2021-09-14"
"0903.4985","Alexander S. Sakharov","Alexander Sakharov, Nick Mavromatos, Anselmo Meregaglia, Andre Rubbia,
  Sarben Sarkar","Exploration of Possible Quantum Gravity Effects with Neutrinos I:
  Decoherence in Neutrino Oscillations Experiments","9 pages, 4 figures, proceedings for invited talk by A.Sakharov at
  DISCRETE'08, Valencia, Spain; December 2008","J.Phys.Conf.Ser.171:012038,2009","10.1088/1742-6596/171/1/012038","CERN-TH-PH/2009-033","hep-ph","http://arxiv.org/licenses/nonexclusive-distrib/1.0/","  Quantum gravity may involve models with stochastic fluctuations of the
associated metric field, around some fixed background value. Such stochastic
models of gravity may induce decoherence for matter propagating in such
fluctuating space time. In most cases, this leads to fewer neutrinos of all
active flavours being detected in a long baseline experiment as compared to
three-flavour standard neutrino oscillations. We discuss the potential of the
CNGS and J-PARC beams in constraining models of quantum-gravity induced
decoherence using neutrino oscillations as a probe. We use as much as possible
model-independent parameterizations, even though they are motivated by specific
microscopic models, for fits to the expected experimental data which yield
bounds on quantum-gravity decoherence parameters.
","[{""version"":""v1"",""created"":""Sun, 29 Mar 2009 20:53:16 GMT""}]","2009-07-22"
"0903.5012","Doron Gazit","Doron Gazit","Correlation between Charge Inhomogeneities and Structure in Graphene and
  Other Electronic Crystalline Membranes","Accepted for publication in PRB as Rapid Communication","Phys. Rev. B 80, 161406(R) (2009)","10.1103/PhysRevB.80.161406","INT-PUB-09-012","cond-mat.mtrl-sci cond-mat.mes-hall cond-mat.supr-con hep-th nucl-th","http://arxiv.org/licenses/nonexclusive-distrib/1.0/","  Only one atom thick and not inclined to lattice defects, graphene represents
the ultimate crystalline membrane. However, its structure reveals unique
features not found in other crystalline membranes, in particular the existence
of ripples with wavelength of 100-300 Angstroms. Here, I trace the origin of
this difference to the free electrons in the membrane. The deformation energy
of the lattice creates a coupling between charge fluctuations and the
structure, resulting in ripples on the membrane, correlated with charge
inhomogeneities. In graphene this mechanism reproduces the experimental result
for both charge puddles and ripples.
","[{""version"":""v1"",""created"":""Sun, 29 Mar 2009 18:49:52 GMT""},{""version"":""v2"",""created"":""Mon, 30 Mar 2009 20:58:57 GMT""},{""version"":""v3"",""created"":""Mon, 20 Jul 2009 17:24:44 GMT""},{""version"":""v4"",""created"":""Mon, 5 Oct 2009 19:55:34 GMT""}]","2016-09-08"
"0903.5020","Xiao-Bo Dong Dr.","Xiaobo Dong (1 and 2), Jianguo Wang (3 and 1), Luis C. Ho (2), Tinggui
  Wang (1), Xiaohui Fan (4), Huiyuan Wang (1), Hongyan Zhou (1), and Weimin
  Yuan (5) ((1) Univ. of Sci. & Tech. of China, (2) Carnegie Observatories, (3)
  Yunnan Observatory, China, (4) Steward Observatory, (5) National Astronomical
  Observatories, China)","What controls the Fe II strength in active galactic nuclei?","V3: to match the ApJ version scheduled to publish in June 2011.
  Electronic tables are also available at
  http://staff.ustc.edu.cn/~xbdong/Data_Release/ell_effect/","Astrophys.J.736: 86,2011","10.1088/0004-637X/736/2/86",,"astro-ph.GA astro-ph.CO","http://arxiv.org/licenses/nonexclusive-distrib/1.0/","  We used a large, homogeneous sample of 4178 z <= 0.8 Seyfert 1 galaxies and
QSOs selected from the Sloan Digital Sky Survey to investigate the strength of
Fe II emission and its correlation with other emission lines and physical
parameters of active galactic nuclei. We find that the strongest correlations
of almost all the emission-line intensity ratios and equivalent widths (EWs)
are with the Eddington ratio (L/L_{Edd}), rather than with the continuum
luminosity at 5100\AA\ (L_{5100}) or black hole mass (M_{BH}); the only
exception is the EW of ultraviolet Fe II emission, which does not correlate at
all with broad-line width, L_{5100}, M_{BH}, or L/L_{Edd}. By contrast, the
intensity ratios of both the ultraviolet and optical Fe II emission to Mg II
\lambda 2800 correlate quite strongly with L/L_{Edd}. Interestingly, among all
the emission lines in the near-UV and optical, the EW of narrow optical Fe II
emission has the strongest correlation with L/L_{Edd}. We suggest that the
variation of the emission-line strength in active galaxies is regulated by
L/L_{Edd} because it governs the global distribution of the column density of
the clouds gravitationally bound in the line-emitting region, as well as its
overall gas supply. The systematic dependence on L/L_{Edd} must be corrected
when using the FeII/MgII intensity ratio as a measure of the Fe/Mg abundance
ratio to study the history of chemical evolution in QSO environments.
","[{""version"":""v1"",""created"":""Sun, 29 Mar 2009 16:19:57 GMT""},{""version"":""v2"",""created"":""Thu, 17 Feb 2011 09:44:09 GMT""},{""version"":""v3"",""created"":""Sun, 29 May 2011 02:59:09 GMT""}]","2011-07-25"
"0903.5035","Reza Asgari","Mehdi Neek-Amal, Reza Asgari","Nano-indentation of circular graphene flakes","4 pages, 4 figures, High quality figures can be requested to the
  authors",,"10.1016/j.spmi.2011.11.019",,"cond-mat.mtrl-sci cond-mat.mes-hall","http://arxiv.org/licenses/nonexclusive-distrib/1.0/","  Nano-indentation of circular graphene flakes are studied by using Molecular
Dynamics simulation. We show that the theory of continuum elasticity based on
nonlinear F\""{o}pple-Hencky equations is applicable on a circular suspended
graphene flake. Our simulation results are plenty compatible to those results
calculated by the nonlinear elasticity theory. We find the force-displacement
curves in good agreement with the recent experimental measurements and conclude
they are temperature independent. In addition, we find the vibration frequency
for such a system and monitor that it behaves as a sinusoidal manner at small
circular graphene size.
","[{""version"":""v1"",""created"":""Mon, 30 Mar 2009 07:49:21 GMT""}]","2011-12-07"
"0903.5040","Timothy Clifton","Chris Clarkson, Timothy Clifton and Sean February","Perturbation Theory in Lemaitre-Tolman-Bondi Cosmology","15 pages, no figures","JCAP 06 (2009) 025","10.1088/1475-7516/2009/06/025",,"astro-ph.CO gr-qc","http://arxiv.org/licenses/nonexclusive-distrib/1.0/","  The Lemaitre-Tolman-Bondi solution has received much attention as a possible
alternative to Dark Energy, as it is able to account for the apparent
acceleration of the Universe without any exotic matter content. However, in
order to make rigorous comparisons between these models and cosmological
observations, such as the integrated Sachs-Wolfe effect, baryon acoustic
oscillations and the observed matter power spectrum, it is absolutely necessary
to have a proper understanding of the linear perturbation theory about them.
Here we present this theory in a fully general, and gauge-invariant form. It is
shown that scalar, vector and tensor perturbations interact, and that the
natural gauge invariant variables in Lemaitre-Tolman-Bondi cosmology do not
correspond straightforwardly to the usual Bardeen variables, in the limit of
spatial homogeneity. We therefore construct new variables that reduce to pure
scalar, vector and tensor modes in this limit.
","[{""version"":""v1"",""created"":""Sun, 29 Mar 2009 17:19:14 GMT""},{""version"":""v2"",""created"":""Thu, 18 Jun 2009 14:10:14 GMT""}]","2015-05-13"
"0903.5045","Amelia Sparavigna","Amelia Sparavigna","Digital Restoration of Ancient Papyri",,,,,"cs.CV","http://arxiv.org/licenses/nonexclusive-distrib/1.0/","  Image processing can be used for digital restoration of ancient papyri, that
is, for a restoration performed on their digital images. The digital
manipulation allows reducing the background signals and enhancing the
readability of texts. In the case of very old and damaged documents, this is
fundamental for identification of the patterns of letters. Some examples of
restoration, obtained with an image processing which uses edges detection and
Fourier filtering, are shown. One of them concerns 7Q5 fragment of the Dead Sea
Scrolls.
","[{""version"":""v1"",""created"":""Mon, 30 Mar 2009 06:00:15 GMT""}]","2009-03-31"
"0903.5048","Alexander S. Sakharov","Alexander Sakharov, John Ellis, Nicholas Harries, Anselmo Meregaglia,
  Andre Rubbia","Exploration of Possible Quantum Gravity Effects with Neutrinos II:
  Lorentz Violation in Neutrino Propagation","8 pages, 6 figures, proceedings for invited talk by A.Sakharov at
  DISCRETE'08, Valencia, Spain; December 2008","J.Phys.Conf.Ser.171:012039,2009","10.1088/1742-6596/171/1/012039","CERN-TH-PH/2009-034","hep-ph","http://arxiv.org/licenses/nonexclusive-distrib/1.0/","  It has been suggested that the interactions of energetic particles with the
foamy structure of space-time thought to be generated by quantum-gravitational
(QG) effects might violate Lorentz invariance, so that they do not propagate at
a universal speed of light. We consider the limits that may be set on a linear
or quadratic violation of Lorentz invariance in the propagation of energetic
neutrinos, v/c=[1 +- (E/M_\nuQG1)] or [1 +- (E/M_\nu QG2}^2], using data from
supernova explosions and the OPERA long-baseline neutrino experiment.
","[{""version"":""v1"",""created"":""Sun, 29 Mar 2009 20:30:30 GMT""}]","2009-07-22"
"0903.5050","Luigi Cantini","Luigi Cantini","qKZ equations and ground state of the O(1) loop model with open boundary
  conditions","29 pages; 20 figures",,,,"math-ph math.MP","http://arxiv.org/licenses/nonexclusive-distrib/1.0/","  We consider the qKZ equations based on the two boundaries Temperley Lieb
algebra. We construct their solution in the case $s=q^{-3/2}$ using a recursion
relation. At the combinatorial point $q^{1/2}= e^{-2\pi i/3}$ the solution
reduces to the ground state of the dense O(1) loop model on a strip with open
boundary conditions. We present an alternative construction of such ground
state based on the knowledge of the ground state of the same model with mixed
boundary conditions and prove that the sum rule as of its components is given
by the product of four symplectic characters.
","[{""version"":""v1"",""created"":""Mon, 30 Mar 2009 08:49:27 GMT""}]","2009-03-31"
"0903.5051","Alessandro Nigro","Alessandro Nigro","Integrals of Motion for Critical Dense Polymers and Symplectic Fermions","53 pages, version accepted for publishing on JSTAT","J. Stat. Mech. (2009) P10007","10.1088/1742-5468/2009/10/P10007",,"hep-th cond-mat.stat-mech math-ph math.MP","http://arxiv.org/licenses/nonexclusive-distrib/1.0/","  We consider critical dense polymers ${\cal L}(1,2)$. We obtain for this model
the eigenvalues of the local integrals of motion of the underlying Conformal
Field Theory by means of Thermodynamic Bethe Ansatz. We give a detailed
description of the relation between this model and Symplectic Fermions
including the indecomposable structure of the transfer matrix. Integrals of
motion are defined directly on the lattice in terms of the Temperley Lieb
Algebra and their eigenvalues are obtained and expressed as an infinite sum of
the eigenvalues of the continuum integrals of motion. An elegant decomposition
of the transfer matrix in terms of a finite number of lattice integrals of
motion is obtained thus providing a reason for their introduction.
","[{""version"":""v1"",""created"":""Sun, 29 Mar 2009 21:48:18 GMT""},{""version"":""v2"",""created"":""Wed, 1 Apr 2009 12:01:57 GMT""},{""version"":""v3"",""created"":""Wed, 20 May 2009 15:19:34 GMT""},{""version"":""v4"",""created"":""Mon, 7 Sep 2009 13:49:07 GMT""}]","2015-05-13"
"0903.5058","Pilar Carrasco","P. Carrasco, A.M. Cegarra and A.R. Garz\'on","Nerves and classifying spaces for bicategories","42 pages","Algebr. Geom. Topol. 10 (2010) 219-274","10.2140/agt.2010.10.219",,"math.AT math.CT","http://arxiv.org/licenses/nonexclusive-distrib/1.0/","  This paper explores the relationship amongst the various simplicial and
pseudo-simplicial objects characteristically associated to any bicategory C. It
proves the fact that the geometric realizations of all of these possible
candidate `nerves of C' are homotopy equivalent. Any one of these realizations
could therefore be taken as the classifying space BC of the bicategory. Its
other major result proves a direct extension of Thomason's `Homotopy Colimit
Theorem' to bicategories: When the homotopy colimit construction is carried out
on a diagram of spaces obtained by applying the classifying space functor to a
diagram of bicategories, the resulting space has the homotopy type of a certain
bicategory, called the `Grothendieck construction on the diagram'. Our results
provide coherence for all reasonable extensions to bicategories of Quillen's
definition of the `classifying space' of a category as the geometric
realization of the category's Grothendieck nerve, and they are applied to
monoidal (tensor) categories through the elemental `delooping' construction.
","[{""version"":""v1"",""created"":""Mon, 30 Mar 2009 15:40:03 GMT""}]","2014-10-01"
"0903.5059","Enrico Lunghi","E. Lunghi, A. Soni","Hints for the scale of new CP-violating physics from B-CP anomalies","25 pages, references added, typos corrected, version accepted for
  publication on JHEP","JHEP 0908:051,2009","10.1088/1126-6708/2009/08/051",,"hep-ph","http://arxiv.org/licenses/nonexclusive-distrib/1.0/","  We consider several hints for new physics involving CP-asymmetries in
B-decays and interpret them in terms of generic contributions to effective
Wilson coefficients. The effects we focus on are: the differences in the fitted
value of sin(2 beta) versus the ones directly measured via the time dependent
CP asymmetries in B -> J/psi K or via B -> (phi,eta') K; the difference between
the direct CP asymmetries in B- -> K- pi0 and B0 -> K- pi+ and the ~2.2 sigma
indications for the CP-asymmetry in Bs -> J/psi phi. To alleviate concerns
regarding the disagreement between inclusive and exclusive Vub, we show that
our results hold even without the inclusion of Vub in the analysis. We find
that no matter what kind of new physics (NP) is invoked to explain these
effects, its effective scale is bounded from above from a few hundred GeV to a
few TeV depending on specific assumptions regarding the type of new physics.
The only exception to this is when the NP contribution is assumed to reside
entirely in LR operators in K mixing, then the scale of NP can be as high as
around 24 TeV; however, this case cannot account for CP asymmetry in Bs ->
J/psi phi or a difference in sin(2 beta) from penguin modes compared to that
from J/psi K or for that matter the large difference seen between direct CP
asymmetries in K- pi+ and in K- pi0.
","[{""version"":""v1"",""created"":""Sun, 29 Mar 2009 16:22:24 GMT""},{""version"":""v2"",""created"":""Thu, 20 Aug 2009 20:08:34 GMT""},{""version"":""v3"",""created"":""Fri, 21 Aug 2009 21:30:46 GMT""}]","2009-08-22"
"0903.5060","Ana Agore","A.L. Agore and G. Militaru","Schreier type theorems for bicrossed products","21 pages, final version to appear in Central European J. Math","Cent. Eur. J. Math. 2 (2012), 722-739","10.2478/s11533-011-0128-6",,"math.GR","http://arxiv.org/licenses/nonexclusive-distrib/1.0/","  We prove that the bicrossed product of two groups is a quotient of the
pushout of two semidirect products. A matched pair of groups $(H, G, \alpha,
\beta)$ is deformed using a combinatorial datum $(\sigma, v, r)$ consisting of
an automorphism $\sigma$ of $H$, a permutation $v$ of the set $G$ and a
transition map $r: G\to H$ in order to obtain a new matched pair $\bigl(H,
(G,*), \alpha', \beta' \bigl)$ such that there exist an $\sigma$-invariant
isomorphism of groups $H {}_{\alpha} \bowtie_{\beta} G \cong H {}_{\alpha'}
\bowtie_{\beta'} (G,*)$. Moreover, if we fix the group $H$ and the automorphism
$\sigma \in \Aut(H)$ then any $\sigma$-invariant isomorphism $H {}_{\alpha}
\bowtie_{\beta} G \cong H {}_{\alpha'} \bowtie_{\beta'} G'$ between two
arbitrary bicrossed product of groups is obtained in a unique way by the above
deformation method. As applications two Schreier type classification theorems
for bicrossed product of groups are given.
","[{""version"":""v1"",""created"":""Sun, 29 Mar 2009 16:05:28 GMT""},{""version"":""v2"",""created"":""Tue, 18 Oct 2011 15:24:06 GMT""},{""version"":""v3"",""created"":""Wed, 19 Oct 2011 07:01:22 GMT""}]","2014-03-18"
"0903.5061","Yury Kutoyants","Reinhard Hoepfner and Yury Kutoyants","Estimating discontinuous periodic signals in a non-time homogeneous
  diffusion process","42 pages",,,,"math.ST stat.TH","http://arxiv.org/licenses/nonexclusive-distrib/1.0/","  We consider a diffusion $(\xi_t)_{t\ge 0}$ with some $T$-periodic time
dependent input term contained in the drift: under an unknown parameter
$\vth\in\Theta$, some discontinuity - an additional periodic signal - occurs at
times $kT{+}\vth$, $k\in\bbn$. Assuming positive Harris recurrence of
$(\xi_{kT})_{k\in\bbn_0}$ and exploiting the periodicity structure, we prove
limit theorems for certain martingales and functionals of the process
$(\xi_t)_{t\ge 0}$. They allow to consider the statistical model parametrized
by $\vth\in\Theta$ locally in small neighbourhoods of some fixed $\vth$, with
radius $1/n$ as $\nto$. We prove convergence of local models to a limit
experiment studied by Ibragimov and Khasminskii [IH 81] and discuss the
behaviour of estimators under contiguous alternatives.
","[{""version"":""v1"",""created"":""Sun, 29 Mar 2009 16:11:41 GMT""},{""version"":""v2"",""created"":""Wed, 17 Mar 2010 12:06:42 GMT""}]","2010-03-18"
"0903.5062","Maciej Trzetrzelewski","M. Trzetrzelewski, A. A. Zheltukhin","Exact solutions for U(1) globally invariant membranes","16 pages, published in PLB","Phys.Lett.B679:523-528,2009","10.1016/j.physletb.2009.07.072",,"hep-th","http://arxiv.org/licenses/nonexclusive-distrib/1.0/","  The exact solvability problem of the nonlinear equations describing the U(1)
invariant membranes is studied and the general solution for the static membrane
in D=2N+1-dimensional Minkowski space-time, including M-theory case D=11, is
obtained. The time-dependent Jacobi elliptic function solution describing a
family of contracting tori is also found, together with the solution
corresponding to a spinning torus characterized by the presence of the critical
rotation frequency Omega=T^{1/3}/pi^{1/2} expressed via the membrane tension T.
","[{""version"":""v1"",""created"":""Sun, 29 Mar 2009 16:37:51 GMT""},{""version"":""v2"",""created"":""Sun, 30 Aug 2009 22:13:26 GMT""}]","2009-09-28"
