"0905.3660","Goran Gligoric","G. Gligoric, A. Maluckov, Lj. Hadzievski, and B. A. Malomed","Collapse instability of solitons in the nonpolynomial Schr\""{o}dinger
  equation with dipole-dipole interactions","6 figures",,"10.1088/0953-4075/42/14/145302",,"cond-mat.quant-gas","http://arxiv.org/licenses/nonexclusive-distrib/1.0/","  A model of the Bose-Einstein condensate (BEC) of dipolar atoms, confined in a
combination of a cigar-shaped trap and optical lattice acting in the axial
direction, is studied in the framework of the one-dimensional (1D)
nonpolynomial Schr\""{o}dinger equation (NPSE) with additional terms describing
long-range dipole-dipole (DD) interactions. The NPSE makes it possible to
describe the collapse of localized modes, which was experimentally observed in
the self-attractive BEC confined in tight traps, in the framework of the 1D
description. We study the influence of the DD interactions on the dynamics of
bright solitons, especially as concerns their collapse-induced instability.
Both attractive and repulsive contact and DD interactions are considered. The
results are summarized in the form of stability/collapse diagrams in a
respective parametric space. In particular, it is shown that the attractive DD
interactions may prevent the collapse instability in the condensate with
attractive contact interactions.
","[{""version"":""v1"",""created"":""Fri, 22 May 2009 10:56:15 GMT""}]","2015-05-13"
"0905.3661","Gilles Vertongen","G. Vertongen","Can LHC disprove Leptogenesis ?","To appear in the Proceedings for XLIVth Rencontres de Moriond,
  Electroweak Interactions And Unified Theories, La Thuile, Aosta Valley,
  Italy, 7-14 Mar 2007",,,"ULB-TH/09-13","hep-ph","http://arxiv.org/licenses/nonexclusive-distrib/1.0/","  Among the mechanisms which successfully explain the generation of the Baryon
Asymmetry of the Universe, Leptogenesis through right-handed neutrino decays is
especially attractive. Unfortunately, this theory suffers from a lack of
testability. Indeed, the high energy relevant ingredients in the asymmetry
creation are either indirectly linked to low energy observables or unreachable
by our present experiments. We propose here to take the problem the other way
around by studying whether this mechanism could at least be disproved. We argue
that the observation of a right handed gauge boson W_R at future colliders
could play this role.
","[{""version"":""v1"",""created"":""Fri, 22 May 2009 13:52:03 GMT""}]","2009-05-25"
"0905.3662","Jeff Viaclovsky","Lev Borisov, Simon Salamon and Jeff Viaclovsky","Twistor geometry and warped product orthogonal complex structures","39 pages","Duke Math. J. 156, no. 1 (2011), 125-166","10.1215/00127094-2010-068",,"math.DG math.AG","http://arxiv.org/licenses/nonexclusive-distrib/1.0/","  The twistor space of the sphere S^{2n} is an isotropic Grassmannian that
fibers over S^{2n}. An orthogonal complex structure on a subdomain of S^{2n} (a
complex structure compatible with the round metric) determines a section of
this fibration with holomorphic image. In this paper, we use this
correspondence to prove that any finite energy orthogonal complex structure on
R^6 must be of a special warped product form, and we also prove that any
orthogonal complex structure on R^{2n} that is asymptotically constant must
itself be constant. We will also give examples defined on R^{2n} which have
infinite energy, and examples of non-standard orthogonal complex structures on
flat tori in complex dimension three and greater.
","[{""version"":""v1"",""created"":""Fri, 22 May 2009 12:23:39 GMT""}]","2019-12-19"
"0905.3663","Qingwen Wu","Qingwen Wu (KASI)","The black hole mass, Eddington ratio, and M_bh-\sigma_[O III] relation
  in young radio galaxies","Accepted for pubblication in MNRAS, 10 pages, 8 figures",,"10.1111/j.1365-2966.2009.15127.x",,"astro-ph.GA astro-ph.HE","http://arxiv.org/licenses/nonexclusive-distrib/1.0/","  The BH masses and the Eddington ratios for a sample of 65 young radio
galaxies [27 GPS and 38 CSS sources] are estimated by various methods. We find
that the average BH mass of these young radio galaxies is <log M_bh>=8.3, which
is less than that of radio loud QSOs and low redshift radio galaxies(<log
M_bh>=9.0). The CSS/GPS sources have relatively high Eddington ratios with
average ratio <log L_bol/L_Edd>=-0.56, which are similar to those of narrow
line Seyfert 1 galaxies (NLS1s). It suggests that the CSS/GPS sources may not
only be in the early stage of radio activities, but also in the early stage of
their accretion activities.
  We find that the young radio galaxies as a class deviate systematically from
the M_bh-\sigma_* relation defined by nearby inactive galaxies, when using
\sigma_[O III] as a surrogate for the stellar velocity dispersion \sigma_*.
There is no significant correlation between the deviation of the [O III]
emission line width, $\Delta\sigma$=\sigma_[O III]-\sigma_[pred], and the
jet/accretion power, where \sigma_[pred] are calculated from the Tremaine et
al. relation using the estimated BH masses. However, we find that the deviation
$\Delta\sigma$ in young radio galaxies is well correlated with the Eddington
ratio, and this correlation is found to be similar to that of radio quiet AGN
(QSOs/NLS1s) where the radio jet is absent or weak. We suggest that the
accretion activities may still play an important role in shaping the kinematics
of [O III] narrow line in these young radio galaxies.
","[{""version"":""v1"",""created"":""Fri, 22 May 2009 11:15:31 GMT""}]","2015-05-13"
"0905.3664","Mercedes Molla","M. Molla, M.L. Garcia-Vargas, and A. Bressan","PopStar I: Evolutionary synthesis models description","21 pages, 29 figures, to be published by MNRAS",,"10.1111/j.1365-2966.2009.15160.x",,"astro-ph.CO","http://arxiv.org/licenses/nonexclusive-distrib/1.0/","  We present new evolutionary synthesis models for Simple Stellar Populations
for a wide range of ages and metallicities. The models are based on the Padova
isochrones. The core of the spectral library is provided by the medium
resolution Lejeune et al. atmosphere models. These spectra are complemented by
NLTE atmosphere models for hot stars that have an important impact in the
stellar cluster's ionizing spectra: O, B and WR stellar spectra at the early
ages, and spectra of post-AGB stars and planetary nebulae, at intermediate and
old ages. At young ages, our models compare well with other existing models but
we find that, the inclusion of the nebular continuum, not considered in several
other models, reddens significantly the integrated colours of very young
stellar populations. This is consistent with the results of spectral synthesis
codes particularly devised for the study of starburst galaxies. At intermediate
and old ages, the agreement with literature model is good and, in particular,
we reproduce well the observed colours of star clusters in LMC. Given the
ability to produce good integrated spectra from the far-UV to the infrared at
any age, we consider that our models are particularly suited for the study of
high redshift galaxies. These models are available on the web site
{http://www.fractal-es.com/SEDmod.htm} and also through the Virtual Observatory
Tools on the PopStar server.
","[{""version"":""v1"",""created"":""Fri, 22 May 2009 12:18:29 GMT""}]","2015-05-13"
"0905.3665","Sofia Lambropoulou","Jes\'us Juyumaya and Sofia Lambropoulou","An invariant for singular knots","14 pages, 8 figures. To appear in the journal of Knot Theory and its
  Ramifications",,,,"math.GT","http://arxiv.org/licenses/nonexclusive-distrib/1.0/","  In this paper we introduce a Jones-type invariant for singular knots, using a
Markov trace on the Yokonuma--Hecke algebras ${\rm Y}_{d,n}(u)$ and the theory
of singular braids. The Yokonuma--Hecke algebras have a natural topological
interpretation in the context of framed knots. Yet, we show that there is a
homomorphism of the singular braid monoid $SB_n$ into the algebra ${\rm
Y}_{d,n}(u)$. Surprisingly, the trace does not normalize directly to yield a
singular link invariant, so a condition must be imposed on the trace variables.
Assuming this condition, the invariant satisfies a skein relation involving
singular crossings, which arises from a quadratic relation in the algebra ${\rm
Y}_{d,n}(u)$.
","[{""version"":""v1"",""created"":""Fri, 22 May 2009 11:47:58 GMT""},{""version"":""v2"",""created"":""Fri, 17 Jul 2009 12:53:37 GMT""}]","2009-07-17"
"0905.3666","Alexander W. Holleitner","Simone Kaniber, Friedrich Simmel, Alexander Holleitner and Itai
  Carmeli","Optoelectronic properties of a photosystem I - carbon nanotube hybrid
  system",,,"10.1088/0957-4484/20/34/345701",,"cond-mat.mtrl-sci cond-mat.mes-hall","http://arxiv.org/licenses/nonexclusive-distrib/1.0/","  The photoconductance properties of photosystem I (PSI) covalently bound to
carbon nanotubes (CNTs) are measured. We demonstrate that the PSI forms active
electronic junctions with the CNTs enabling control of the CNTs
photoconductance by the PSI. In order to electrically contact the photoactive
proteins, a cysteine mutant is generated at one end of the PSI by genetic
engineering. The CNTs are covalently bound to this reactive group using
carbodiimide chemistry. We detect an enhanced photoconductance signal of the
hybrid material at photon wavelengths resonant to the absorption maxima of the
PSI compared to nonresonant wavelengths. The measurements prove that it is
feasible to integrate photosynthetic proteins into optoelectronic circuits at
the nanoscale.
","[{""version"":""v1"",""created"":""Fri, 22 May 2009 11:49:32 GMT""}]","2015-05-13"
"0905.3667","Wolfgang Haeusler","Wolfgang H\""ausler (1 and 2) and Reinhold Egger (1) ((1) University of
  D\""usseldorf, Germany, (2) University of Freiburg, Germany)","Artifical atoms in interacting graphene quantum dots","4+ pages, 2 figures","Phys. Rev. B 80, 161402(R) (2009)","10.1103/PhysRevB.80.161402",,"cond-mat.mes-hall cond-mat.str-el","http://arxiv.org/licenses/nonexclusive-distrib/1.0/","  We describe the theory of few Coulomb-correlated electrons in a magnetic
quantum dot formed in graphene. While the corresponding nonrelativistic
(Schr\""odinger) problem is well understood, a naive generalization to
graphene's ""relativistic"" (Dirac-Weyl) spectrum encounters divergencies and is
ill-defined. We employ Sucher's projection formalism to overcome these
problems. Exact diagonalization results for the two-electron quantum dot, i.e.,
the artificial helium atom in graphene, are presented.
","[{""version"":""v1"",""created"":""Fri, 22 May 2009 11:58:22 GMT""}]","2009-10-08"
"0905.3668","Balder ten Cate","Johan van Benthem, Balder ten Cate, Jouko Vaananen","Lindstrom theorems for fragments of first-order logic","Appears in Logical Methods in Computer Science (LMCS)","Logical Methods in Computer Science, Volume 5, Issue 3 (August 3,
  2009) lmcs:895","10.2168/LMCS-5(3:3)2009",,"cs.LO","http://arxiv.org/licenses/nonexclusive-distrib/1.0/","  Lindstr\""om theorems characterize logics in terms of model-theoretic
conditions such as Compactness and the L\""owenheim-Skolem property. Most
existing characterizations of this kind concern extensions of first-order
logic. But on the other hand, many logics relevant to computer science are
fragments or extensions of fragments of first-order logic, e.g., k-variable
logics and various modal logics. Finding Lindstr\""om theorems for these
languages can be challenging, as most known techniques rely on coding arguments
that seem to require the full expressive power of first-order logic. In this
paper, we provide Lindstr\""om theorems for several fragments of first-order
logic, including the k-variable fragments for k>2, Tarski's relation algebra,
graded modal logic, and the binary guarded fragment. We use two different proof
techniques. One is a modification of the original Lindstr\""om proof. The other
involves the modal concepts of bisimulation, tree unraveling, and finite depth.
Our results also imply semantic preservation theorems.
","[{""version"":""v1"",""created"":""Fri, 22 May 2009 12:10:07 GMT""},{""version"":""v2"",""created"":""Tue, 4 Aug 2009 09:39:35 GMT""}]","2015-07-01"
"0905.3669","Valerio Lucarini","Valerio Lucarini, Klaus Fraedrich, Frank Lunkeit","Thermodynamic Analysis of Snowball Earth Hysteresis Experiment:
  Efficiency, Entropy Production, and Irreversibility","31 pages, 5 figures; improved version","Q. J. R. Meterol. Soc., 136, 2-11 (2010)","10.1002/qj.543",,"physics.ao-ph cond-mat.stat-mech physics.comp-ph physics.flu-dyn physics.geo-ph","http://arxiv.org/licenses/nonexclusive-distrib/1.0/","  We present an extensive thermodynamic analysis of a hysteresis experiment
performed on a simplified yet Earth-like climate model. We slowly vary the
solar constant by 20% around the present value and detect a substantial
bistability: for a large range of values the realization of snowball (SB) or of
warm (W) climate conditions depend on the history of the system. Using recent
results on the global climate thermodynamics, we show that that the two regimes
feature radically different properties. The efficiency of the climate machine
increases with decreasing solar constant in W climate conditions, whereas the
opposite takes place in the SB regime. Instead, entropy production is
increasing with the solar constant in both branches of climate conditions, and
its value is about 4 times as large in the W branch than in the corresponding C
state. Finally, the degree of irreversibility of the system is much higher in
the W conditions, with an explosive growth in the upper range of the considered
values of solar constants. Whereas in the SB regime a dominating role is played
by changes in the meridional albedo contrast, in the W climate regime changes
in the intensity of latent heat fluxes are crucial for determining the observed
properties. This substantiates the importance of addressing correctly the
variations of the hydrological cycle in a changing climate. An interpretation
of the transitions at the boundary of the bistable region based upon
macro-scale thermodynamic properties is also proposed. Our results support the
adoption of a new generation of diagnostic tools based on the 2nd law of
thermodynamics for auditing climate model and outline a set of
parameterizations to be used in conceptual and intermediate complexity models
or for the reconstruction of the past climate conditions.
","[{""version"":""v1"",""created"":""Fri, 22 May 2009 12:19:00 GMT""},{""version"":""v2"",""created"":""Mon, 7 Sep 2009 13:27:15 GMT""}]","2011-10-11"
"0905.3670","Dragan Vukoti\'c","Alexandru Aleman, Dragan Vukoti\'c","On Blaschke products with derivatives in Bergman spaces with normal
  weights",,"Journal of Mathematical Analysis and Applications, Volume 361,
  Issue 2, 15 January 2010, Pages 492-505","10.1016/j.jmaa.2009.07.030",,"math.CV math.FA","http://arxiv.org/licenses/nonexclusive-distrib/1.0/","  We generalize a well-known sufficient condition for interpolating sequences
for the Hilbert Bergman spaces to other Bergman spaces with normal weights (as
defined by Shields and Williams) and obtain new results regarding the
membership of the derivative of a Blashke product or a general inner function
in such spaces. We also apply duality techniques to obtain further results of
this type and obtain new results about interpolating Blaschke products.
","[{""version"":""v1"",""created"":""Fri, 22 May 2009 12:32:39 GMT""}]","2016-11-07"
"0905.3671","Sergi Lozano","Dirk Helbing and Sergi Lozano","On Phase Transitions to Cooperation in the Prisoner's Dilemma","For related work see http://www.soms.ethz.ch/",,"10.1103/PhysRevE.81.057102",,"physics.soc-ph","http://arxiv.org/licenses/nonexclusive-distrib/1.0/","  Game theory formalizes certain interactions between physical particles or
between living beings in biology, sociology, and economics, and quantifies the
outcomes by payoffs. The prisoner's dilemma (PD) describes situations in which
it is profitable if everybody cooperates rather than defects (free-rides or
cheats), but as cooperation is risky and defection is tempting, the expected
outcome is defection. Nevertheless, some biological and social mechanisms can
support cooperation by effectively transforming the payoffs. Here, we study the
related phase transitions, which can be of first order (discontinous) or of
second order (continuous), implying a variety of different routes to
cooperation. After classifying the transitions into cases of equilibrium
displacement, equilibrium selection, and equilibrium creation, we show that a
transition to cooperation may take place even if the stationary states and the
eigenvalues of the replicator equation for the PD stay unchanged. Our example
is based on adaptive group pressure, which makes the payoffs dependent on the
endogeneous dynamics in the population. The resulting bistability can invert
the expected outcome in favor of cooperation.
","[{""version"":""v1"",""created"":""Fri, 22 May 2009 12:48:27 GMT""},{""version"":""v2"",""created"":""Wed, 5 May 2010 13:43:38 GMT""}]","2015-05-13"
"0905.3672","Mogens Jensen","Mogens H. Jensen, Sandeep Krishna and Simone Pigolotti","The Repressor-Lattice: Feed-Back, Commensurability, and Dynamical
  Frustration","4 pages, 5 figures","Phys. Rev. Lett. 103, 118101 (2009)","10.1103/PhysRevLett.103.118101",,"nlin.CD q-bio.MN","http://arxiv.org/licenses/nonexclusive-distrib/1.0/","  A repressilator consists of a loop made up of three repressively interacting
genes. We construct a hexagonal lattice with repressilators on each triangle,
and use this as a model system for multiple interacting feedback loops. Using
symmetry arguments and stability analysis we argue that the repressor-lattice
can be in a non-frustrated oscillating state with only three distinct phases.
If the system size is not commensurate with three, oscillating solutions of
several different phases are possible. As the strength of the interactions
between the nodes increases, the system undergoes many transitions, breaking
several symmetries. Eventually dynamical frustrated states appear, where the
temporal evolution is chaotic, even though there are no built-in frustrations.
Applications of the repressor-lattice to real biological systems, such as
tissues or biofilms, are discussed.
","[{""version"":""v1"",""created"":""Fri, 22 May 2009 12:43:16 GMT""},{""version"":""v2"",""created"":""Tue, 22 Sep 2009 11:00:50 GMT""}]","2009-09-22"
"0905.3673","Santiago Esteban Perez Bergliaffa","Erico Goulart de Oliveira Costa, Santiago Esteban Perez Bergliaffa","A classification of the effective metric in nonlinear electrodynamics","Accepted for publication in Classical & Quantum Gravity","Class.Quant.Grav.26:135015,2009","10.1088/0264-9381/26/13/135015",,"gr-qc hep-th physics.optics","http://arxiv.org/licenses/nonexclusive-distrib/1.0/","  We show that only two types of effective metrics are possible in certain
nonlinear electromagnetic theories. This is achieved by using the dependence of
the effective metric on the energy-momentum tensor of the background along with
the Segr\`e classification of the latter. Each of these forms is completely
determined by single scalar function, which characterizes the light cone of the
nonlinear theory. We compare this light cone with that of Minkowski in two
examples.
","[{""version"":""v1"",""created"":""Fri, 22 May 2009 12:49:40 GMT""}]","2010-04-14"
"0905.3674","Christopher Wilson","C.M. Wilson, G. Johansson, T. Duty, F. Persson, M. Sandberg, P.
  Delsing","Dressed Relaxation and Dephasing in a Strongly Driven Two-Level system","5 pages, 2 figures","PHYSICAL REVIEW B 81, 024520 (2010)","10.1103/PhysRevB.81.024520",,"quant-ph","http://arxiv.org/licenses/nonexclusive-distrib/1.0/","  We study relaxation and dephasing in a strongly driven two-level system
interacting with its environment. We develop a theory which gives a
straightforward physical picture of the complex dynamics of the system in terms
of dressed states. In addition to the dressing of the energy diagram, we
describe the dressing of relaxation and dephasing. We find a good quantitative
agreement between the theoretical calculations and measurements of a
superconducting qubit driven by an intense microwave field. The competition of
various processes leads to a rich structure in the observed behavior, including
signatures of population inversion.
","[{""version"":""v1"",""created"":""Fri, 22 May 2009 13:14:37 GMT""}]","2010-03-09"
"0905.3676","Juan Jose Sanz-Cillero","J.J. Sanz-Cillero","Renormalization group equations in resonance chiral theory","6 pages, 3 figures. Final version as published. References added.
  Extended explanations. The interrelation between the IR fixed point and the
  UV constraints has been further studied","Phys.Lett.B681:100-104,2009","10.1016/j.physletb.2009.09.044",,"hep-ph","http://arxiv.org/licenses/nonexclusive-distrib/1.0/","  The use of the equations of motion and meson field redefinitions allows the
development of a simplified resonance chiral theory lagrangian: terms including
resonance fields and a large number of derivatives can be reduced into
corresponding O(p2) resonance operators, containing the lowest possible number
of derivatives. This is shown by means of the explicit computation of the pion
vector form-factor up to next-to-leading order in 1/Nc. The study of the
renormalization group equations for the corresponding couplings demonstrates
the existence of an infrared fixed point in the resonance theory. The
possibility of developing a perturbative 1/Nc expansion in the slow running
region around the fixed point is shown here.
","[{""version"":""v1"",""created"":""Fri, 22 May 2009 13:22:45 GMT""},{""version"":""v2"",""created"":""Wed, 14 Oct 2009 09:20:49 GMT""}]","2010-04-28"
"0905.3677","Werner Heil","C.Gemmel, W.Heil, K.Lenz, Ch.Ludwig, K.Thulley, Yu.Sobolev,
  M.Burghoff, S.Knappe-Grueneberg, W.Kilian, W.Mueller, A.Schnabel, F.Seifert,
  L.Trahms, St.Baessler","Ultra-sensitive magnetometry based on free precession of nuclear spins",,"Eur.Phys.J.D57:303-320,2010","10.1140/epjd/e2010-00044-5",,"physics.ins-det hep-ex physics.atom-ph","http://arxiv.org/licenses/nonexclusive-distrib/1.0/","  We discuss the design and performance of a very sensitive low-field
magnetometer based on the detection of free spin precession of gaseous, nuclear
polarized 3He or 129Xe samples with a SQUID as magnetic flux detector. The
device will be employed to control fluctuating magnetic fields and gradients in
a new experiment searching for a permanent electric dipole moment of the
neutron as well as in a new type of 3He/129Xe clock comparison experiment which
should be sensitive to a sidereal variation of the relative spin precession
frequency. Characteristic spin precession times T_2 of up to 60h could be
measured. In combination with a signal-to-noise ratio of > 5000:1, this leads
to a sensitivity level of deltaB= 1fT after an integration time of 220s and to
deltaB= 10^(-4)fT after one day. Even in that sensitivity range, the
magnetometer performance is statistically limited, and noise sources inherent
to the magnetometer are not limiting. The reason is that free precessing 3He
(129Xe) nuclear spins are almost completely decoupled from the environment.
That makes this type of magnetometer in particular attractive for precision
field measurements where a long-term stability is required.
","[{""version"":""v1"",""created"":""Fri, 22 May 2009 13:38:49 GMT""}]","2014-11-20"
"0905.3678","Vadim Madgazin","Vadim R. Madgazin","Major and minor. The formula of musical emotions","22 pages, 3 figures, in Russian, added figures, changed content",,,,"cs.SD q-bio.NC","http://arxiv.org/licenses/nonexclusive-distrib/1.0/","  The new formulas, which determine sign and amplitude of utilitarian emotions,
are proposed on the basis of the information theory of emotions. In area of
perception of musical chords the force of emotions depends on the relative
pitch of sounds of major and minor chords.
  Is advanced hypothesis that in the perception of a musical chord in the
psyche caused by the subject value of some objective function L. This function
is expressed directly through the proportion of the pitch of chord. Major
chords are expressed as the straight proportions, which generate idea about an
increase in the objective function (L>1) and are caused positive utilitarian
emotions. Minor chords are expressed as the inverse proportion, which generate
idea about the decrease of objective function (L<1) and are caused negative
utilitarian emotions.
  The formula of musical emotions is advanced: Pwe = log(L) =
(1/M)*log(n1*n2*n3* ... *nM), where M is a quantity of voices of chord, ni -
integer number (or reciprocal fraction) from the pitch proportion, which
corresponds to the i-th voice of chord.
  Confined experimental check is produced. The limits of the applicability of
the formula of musical emotions are investigated.
  Keywords: sound, music, chord, major, minor, emotions, the formula of musical
emotions, the information theory of emotions.
","[{""version"":""v1"",""created"":""Fri, 22 May 2009 13:40:36 GMT""},{""version"":""v2"",""created"":""Wed, 15 Jul 2009 10:57:50 GMT""},{""version"":""v3"",""created"":""Tue, 1 Sep 2009 11:19:59 GMT""}]","2009-09-01"
