"0905.3603","David Brooks","David H. Brooks, Harry P. Warren, David R. Williams, Tetsuya Watanabe","Hinode/Extreme-Ultraviolet Imaging Spectrometer Observations of the
  Temperature Structure of the Quiet Corona","Version accepted by ApJ and published in ApJ 705. Abridged abstract","Astrophys.J.705:1522-1532,2009","10.1088/0004-637X/705/2/1522",,"astro-ph.SR","http://arxiv.org/licenses/nonexclusive-distrib/1.0/","  We present a Differential Emission Measure (DEM) analysis of the quiet solar
corona on disk using data obtained by the Extreme-ultraviolet Imaging
Spectrometer (EIS) on {\it Hinode}. We show that the expected quiet Sun DEM
distribution can be recovered from judiciously selected lines, and that their
average intensities can be reproduced to within 30%. We present a subset of
these selected lines spanning the temperature range $\log$ T = 5.6 to 6.4 K
that can be used to derive the DEM distribution reliably. The subset can be
used without the need for extensive measurements and the observed intensities
can be reproduced to within the estimated uncertainty in the pre-launch
calibration of EIS. Furthermore, using this subset, we also demonstrate that
the quiet coronal DEM distribution can be recovered on size scales down to the
spatial resolution of the instrument (1$""$ pixels). The subset will therefore
be useful for studies of small-scale spatial inhomogeneities in the coronal
temperature structure, for example, in addition to studies requiring multiple
DEM derivations in space or time. We apply the subset to 45 quiet Sun datasets
taken in the period 2007 January to April, and show that although the absolute
magnitude of the coronal DEM may scale with the amount of released energy, the
shape of the distribution is very similar up to at least $\log$ T $\sim$ 6.2 K
in all cases. This result is consistent with the view that the {\it shape} of
the quiet Sun DEM is mainly a function of the radiating and conducting
properties of the plasma and is fairly insensitive to the location and rate of
energy deposition. This {\it universal} DEM may be sensitive to other factors
such as loop geometry, flows, and the heating mechanism, but if so they cannot
vary significantly from quiet Sun region to region.
","[{""version"":""v1"",""created"":""Fri, 22 May 2009 04:22:54 GMT""},{""version"":""v2"",""created"":""Wed, 28 Oct 2009 01:52:22 GMT""}]","2009-11-09"
"0905.3604","Jacob Mostovoy","J.Mostovoy, J.M.P\'erez-Izquierdo","Formal multiplications, bialgebras of distributions and non-associative
  Lie theory",,,,,"math.RA math.RT","http://arxiv.org/licenses/nonexclusive-distrib/1.0/","  We describe the general non-associative version of Lie theory that relates
unital formal multiplications (formal loops), Sabinin algebras and
non-associative bialgebras. Starting with a formal multiplication we construct
a non-associative bialgebra, namely, the bialgebra of distributions with the
convolution product. Considering the primitive elements in this bialgebra gives
a functor from formal loops to Sabinin algebras. We compare this functor to
that of Mikheev and Sabinin and show that although the brackets given by both
constructions coincide, the multioperator does not. We also show how identities
in loops produce identities in bialgebras. While associativity in loops
translates into associativity in algebras, other loop identities (such as the
Moufang identity) produce new algebra identities. Finally, we define a class of
unital formal multiplications for which Ado's theorem holds and give examples
of formal loops outside this class. A by-product of the constructions of this
paper is a new identity on Bernoulli numbers. We give two proofs: one coming
from the formula for the non-associative logarithm, and the other (due to D.
Zagier) using generating functions.
","[{""version"":""v1"",""created"":""Fri, 22 May 2009 04:30:01 GMT""}]","2009-05-25"
"0905.3605","Ritam Mallick","Ritam Mallick, Abhijit Bhattacharyya, Sanjay K. Ghosh, Sibaji Raha","General Relativistic effect on the energy deposition rate for neutrino
  pair annihilation above the equatorial plane along the symmetry axis near a
  rotating neutron star","17 pages, 5 figures","International Journal of Modern Physics E Vol. 22, No. 2 (2013)
  1350008","10.1142/S0218301313500080",,"astro-ph.HE","http://arxiv.org/licenses/nonexclusive-distrib/1.0/","  The estimate of the energy deposition rate (EDR) for neutrino pair
annihilation has been carried out. The EDR for the neutrinos coming from the
equatorial plane of a rotating neutron star is calculated along the rotation
axis using the Cook-Shapiro-Teukolsky (CST) metric. The neutrino trajectories
and hence the neutrino emitted from the disk is affected by the redshift due to
disk rotation and gravitation. The EDR is very sensitive to the value of the
temperature and its variation along the disk. The rotation of the star has a
negative effect on the EDR; it decreases with increase in rotational velocity.
","[{""version"":""v1"",""created"":""Fri, 22 May 2009 04:54:03 GMT""},{""version"":""v2"",""created"":""Mon, 4 Oct 2010 04:36:18 GMT""},{""version"":""v3"",""created"":""Fri, 10 May 2013 08:31:04 GMT""}]","2013-05-13"
"0905.3606","Klaus Halterman","R. Steven Kurti, Klaus Halterman, Ramesh K. Shori, and Michael J.
  Wardlaw","Discrete Cylindrical Vector Beam Generation from an Array of Optical
  Fibers",,"Opt. Express 17, 13982-13988 (2009)","10.1364/OE.17.013982",,"physics.optics","http://creativecommons.org/licenses/publicdomain/","  A novel method is presented for the beam shaping of far field intensity
distributions of coherently combined fiber arrays. The fibers are arranged
uniformly on the perimeter of a circle, and the linearly polarized beams of
equal shape are superimposed such that the far field pattern represents an
effective radially polarized vector beam, or discrete cylindrical vector (DCV)
beam. The DCV beam is produced by three or more beams that each individually
have a varying polarization vector. The beams are appropriately distributed in
the near field such that the far field intensity distribution has a central
null. This result is in contrast to the situation of parallel linearly
polarized beams, where the intensity peaks on axis.
","[{""version"":""v1"",""created"":""Fri, 22 May 2009 05:00:01 GMT""}]","2009-07-28"
"0905.3607","Xin Wan","Hua Chen, Zi-Xiang Hu, Kun Yang, E. H. Rezayi, Xin Wan","Quasiparticle tunneling in the Moore-Read fractional quantum Hall State","9 pages, 6 figures; v2: expanded to include 3 more figures, minor
  corrections, references updated","Phys. Rev. B 80, 235305 (2009)","10.1103/PhysRevB.80.235305",,"cond-mat.mes-hall","http://arxiv.org/licenses/nonexclusive-distrib/1.0/","  In fractional quantum Hall systems, quasiparticles of fractional charge can
tunnel between the edges at a quantum point contact. Such tunneling (or
backscattering) processes contribute to charge transport, and provide
information on both the charge and statistics of the quasiparticles involved.
Here we study quasiparticle tunneling in the Moore-Read state, in which
quasiparticles of charge e/4 (non-Abelian) and e/2 (Abelian) may co-exist and
both contribute to edge transport. On a disk geometry, we calculate the matrix
elements for e/2 and e/4 quasiholes to tunnel through the bulk of the
Moore-Read state, in an attempt to understand their relative importance. We
find the tunneling amplitude for charge e/2 quasihole is exponentially smaller
than that for charge e/4 quasihole, and the ratio between them can be
(partially) attributed to their charge difference. We find that including
long-range Coulomb interaction only has a weak effect on the ratio. We discuss
briefly the relevance of these results to recent tunneling and interferometry
experiments at filling factor nu=5/2.
","[{""version"":""v1"",""created"":""Fri, 22 May 2009 06:34:10 GMT""},{""version"":""v2"",""created"":""Mon, 2 Nov 2009 02:59:11 GMT""}]","2009-12-04"
"0905.3608","Gert-Ludwig Ingold","Gert-Ludwig Ingold, Astrid Lambrecht, Serge Reynaud","Quantum dissipative Brownian motion and the Casimir effect","13 pages, 8 figures","Phys.Rev.E80:041113,2009","10.1103/PhysRevE.80.041113",,"quant-ph","http://arxiv.org/licenses/nonexclusive-distrib/1.0/","  We explore an analogy between the thermodynamics of a free dissipative
quantum particle and that of an electromagnetic field between two mirrors of
finite conductivity. While a free particle isolated from its environment will
effectively be in the high-temperature limit for any nonvanishing temperature,
a finite coupling to the environment leads to quantum effects ensuring the
correct low-temperature behavior. Even then, it is found that under appropriate
circumstances the entropy can be a nonmonotonic function of the temperature.
Such a scenario with its specific dependence on the ratio of temperature and
damping constant also appears for the transverse electric mode in the Casimir
effect. The limits of vanishing dissipation for the quantum particle and of
infinite conductivity of the mirrors in the Casimir effect both turn out to be
noncontinuous.
","[{""version"":""v1"",""created"":""Fri, 22 May 2009 05:59:53 GMT""}]","2010-03-26"
"0905.3609","Seung-il Nam","Seung-il Nam","An effective thermodynamic potential from the instanton with
  Polyakov-loop contributions","15 pages, 7 figures","J.Phys.G37:075002,2010","10.1088/0954-3899/37/7/075002","CYCU-HEP-09-09","hep-ph","http://arxiv.org/licenses/nonexclusive-distrib/1.0/","  We derive an effective thermodynamic potential (Omega_eff) at finite
temperature (T>0) and zero quark-chemical potential (mu_R=0), using the
singular-gauge instanton solution and Matsubara formula for N_c=3 and N_f=2 in
the chiral limit. The momentum-dependent constituent-quark mass is also
obtained as a function of T, employing the Harrington-Shepard caloron solution
in the large-N_c limit. In addition, we take into account the imaginary quark
chemical potential mu_I = A_4, translated as the traced Polayakov-loop (Phi) as
an order parameter for the Z(N_c) symmsetry, characterizing the confinement
(intact) and deconfinement (spontaneously broken) phases. As a result, we
observe the crossover of the chiral (chi) order parameter sigma^2 and Phi. It
also turns out that the critical temperature for the deconfinment phase
transition, T^Z_c is lowered by about (5-10)% in comparison to the case with a
constant constituent-quark mass. This behavior can be understood by
considerable effects from the partial chiral restoration and nontrivial QCD
vacuum on Phi. Numerical calculations show that the crossover transitions occur
at (T^chi_c,T^Z_c) ~ (216,227) MeV.
","[{""version"":""v1"",""created"":""Fri, 22 May 2009 06:01:18 GMT""},{""version"":""v2"",""created"":""Fri, 5 Feb 2010 21:17:32 GMT""}]","2010-05-28"
"0905.3610","Tatsuya Mori","T. Mori, S. Goshima, K. Iwamoto, S. Kushibiki, H. Matsumoto, N.
  Toyota, K. Suekuni, M.A. Avila, T. Takabatake, T. Hasegawa, N. Ogita, and M.
  Udagawa","Optical conductivity of rattling phonons in type-I clathrate
  Ba$_8$Ga$_{16}$Ge$_{30}$","4 pages, 4 figures",,"10.1103/PhysRevB.79.212301",,"cond-mat.mtrl-sci","http://arxiv.org/licenses/nonexclusive-distrib/1.0/","  A series of infrared-active optical phonons have been detected in type-I
clathrate Ba$_8$Ga$_{16}$Ge$_{30}$ by terahertz time-domain spectroscopy. The
conductivity spectra with the lowest-lying peaks at 1.15 and 1.80 THz are
identified with so-called rattling phonons, i.e., optical modes of the guest
ion Ba$^{2+}(2)$ with $T_{1u}$ symmetry in the oversized tetrakaidecahedral
cage. The temperature dependence of the spectra from these modes are totally
consistent with calculations based on a one-dimensional anharmonic potential
model that, with decreasing temperature, the shape becomes asymmetrically sharp
associated with a softening for the weight to shift to lower frequency. These
temperature dependences are determined, without any interaction effects, by the
Bose-factor for optical excitations of anharmonic phonons with the nonequally
spaced energy levels.
","[{""version"":""v1"",""created"":""Fri, 22 May 2009 06:01:49 GMT""}]","2015-05-13"
"0905.3611","Michael Livshits","Michael Livshits","You could simplify calculus","9 pages",,,,"math.HO","http://arxiv.org/licenses/nonexclusive-distrib/1.0/","  I explain a direct approach to differentiation and integration. Instead of
relying on the general notions of real numbers, limits and continuity, we treat
functions as the primary objects of our theory, and view differentiation as
division of f(x)-f(a) by x-a in a certain class of functions. When f is a
polynomial the division can be carried out explicitly. To see why a polynomial
with a positive derivative is increasing (the monotonicity theorem), we use the
estimate |f(x)-f(a)-f'(a)(x-a)|<=K(x-a)^2. By making it into a definition we
arrive at the notion of uniform Lipschitz differentiability (ULD), and see that
the derivative of a ULD function is Lipschitz. Taking different moduli of
continuity instead of |.|, we get different flavors of calculus, each rather
elementary, but all together covering the total range of continuously
differentiable functions. Using functions continuous at a, we recapture the
classical definition of differentiability at a point. We also see that ULD is
equivalent to divisibility of f(x)-f(a) by x-a in the class of Lipschitz
functions of two variables, x and a. The analogous fact is true for any
subadditive modulus of continuity. In this bottom-up, computational, one
modulus of continuity at a time approach, the monotonicity theorem takes the
central stage and provides the aspects of the subject important for practical
applications. The weighty ontological issues of compactness and completeness
can be treated lightly or postponed, since they are hardly used in this
streamlined approach that pretty much follows the Vladimir Arnold's ""principle
of minimal generality, according to which every idea should first be understood
in the simplest situation; only then can the method developed be applied to
more complicated cases."" I discuss a generalization to many variables briefly.
","[{""version"":""v1"",""created"":""Fri, 22 May 2009 08:27:07 GMT""}]","2009-05-25"
"0905.3612","Michael Maziashvili","Michael Maziashvili","Quantum-gravitational running/reduction of space-time dimension","4 pages; This essay received Honorable Mention in the 2009 Awards for
  Essays in Gravitation by the Gravity Research Foundation","Int.J.Mod.Phys.D18:2209-2213,2009","10.1142/S0218271809016028",,"hep-th gr-qc hep-ph quant-ph","http://arxiv.org/licenses/nonexclusive-distrib/1.0/","  Quantum-gravity renders the space-time dimension to depend on the size of
region; it monotonically increases with the size of region and asymptotically
approaches four for large distances. This effect was discovered in numerical
simulations of lattice quantum gravity in the framework of causal dynamical
triangulation [hep-th/0505113] as well as in renormalization group approach to
quantum gravity [hep-th/0508202]. However, along these approaches the
interpretation and the physical meaning of the effective change of dimension at
shorter scales is not clear. Without invoking particular models in this essay
we show that, box-counting dimension in face of finite resolution of space-time
(generally implied by quantum gravity) shows a simple way how both the
qualitative and the quantitative features of this effect can be understood. In
this way we derive a simple analytic expression of space-time dimension
running, which implies the modification of Newton's inverse square law in a
perfect agreement with the modification coming from one-loop gravitational
radiative corrections.
","[{""version"":""v1"",""created"":""Fri, 22 May 2009 06:27:29 GMT""}]","2010-02-17"
"0905.3613","Ahmet Seven","Ahmet Seven","Quivers of finite mutation type and skew-symmetric matrices","Minor corrections; final version to appear in Lin. Alg. App.",,,,"math.CO","http://arxiv.org/licenses/nonexclusive-distrib/1.0/","  In this paper, we study structural properties of finite mutation type
quivers. In particular, we obtain a characterization of finite mutation type
quivers that are associated with triangulations of surfaces and give a new
numerical invariant for their mutation classes.
","[{""version"":""v1"",""created"":""Fri, 22 May 2009 06:45:09 GMT""},{""version"":""v2"",""created"":""Tue, 2 Jun 2009 11:19:40 GMT""},{""version"":""v3"",""created"":""Fri, 9 Oct 2009 11:45:41 GMT""},{""version"":""v4"",""created"":""Sun, 25 Apr 2010 11:22:01 GMT""}]","2010-04-27"
"0905.3614","Hu Zou","H. Zou, Z. -Y. Wu, J. Ma and X. Zhou","The Tidal Tails of Globular Cluster Palomar 5 Based on Neural Networks
  Method","18 pages, published by RAA","Res.Astron.Astrophys.9:1131-1148,2009","10.1088/1674-4527/9/10/005","0905.3614","astro-ph.IM","http://arxiv.org/licenses/nonexclusive-distrib/1.0/","  The Sixth Data Release (DR6) in the Sloan Digital Sky Survey (SDSS) provides
more photometric regions, new features and more accurate data around globular
cluster Palomar 5. A new method, Back Propagation Neural Network (BPNN), is
used to estimate the probability of cluster member to detect its tidal tails.
Cluster and field stars, used for training the networks, are extracted over a
$40\times20$ deg$^2$ field by color-magnitude diagrams (CMDs). The best BPNNs
with two hidden layers and Levenberg-Marquardt (LM) training algorithm are
determined by the chosen cluster and field samples. The membership
probabilities of stars in the whole field are obtained with the BPNNs, and
contour maps of the probability distribution show that a tail extends $5.42\dg$
to the north of the cluster and a tail extends $3.77\dg$ to the south. The
whole tails are similar to those detected by \citet{od03}, but no longer debris
of the cluster is found to the northeast of the sky. The radial density
profiles are investigated both along the tails and near the cluster center.
Quite a few substructures are discovered in the tails. The number density
profile of the cluster is fitted with the King model and the tidal radius is
determined as $14.28'$. However, the King model cannot fit the observed profile
at the outer regions ($R > 8'$) because of the tidal tails generated by the
tidal force. Luminosity functions of the cluster and the tidal tails are
calculated, which confirm that the tails originate from Palomar 5.
","[{""version"":""v1"",""created"":""Fri, 22 May 2009 07:37:46 GMT""},{""version"":""v2"",""created"":""Sun, 31 May 2009 07:19:59 GMT""},{""version"":""v3"",""created"":""Fri, 2 Jul 2010 04:10:47 GMT""}]","2011-05-19"
"0905.3615","Eli Ben-Haim","The BABAR Collaboration: B. Aubert, et al","Time-dependent amplitude analysis of B0 --> K0S pi+ pi-","30 pages, 42 postscript figures, submitted to Phys. Rev. D","Phys.Rev.D80:112001,2009","10.1103/PhysRevD.80.112001","BABAR-PUB-09/001, SLAC-PUB-13640","hep-ex","http://arxiv.org/licenses/nonexclusive-distrib/1.0/","  We perform a time-dependent amplitude analysis of $B^0 \to K^0_S\pi^+\pi^-$
decays to extract the CP violation parameters of $f_0(980) K^0_S$ and
$\rho^0(770) K^0_S$ and the direct CP asymmetry of $K^{*+}(892) \pi^-$. The
results are obtained from a data sample of $(383 \pm 3) \times 10^6$ $B\bar{B}$
decays, collected with the BABAR detector at the PEP-II asymmetric-energy $B$
factory at SLAC. We find two solutions, with an equivalent goodness-of-fit.
Including systematic and Dalitz plot model uncertainties, the combined
confidence interval for values of the CP parameter $\beta_{eff}$ in $B^0$
decays to $f_0(980) K^0_S$ is $18^o < \beta_{eff} < 76^o$ at 95% confidence
level (C.L). CP conservation in $B^0$ decays to $f_0(980) K^0_S$ is excluded at
$3.5\sigma$ including systematic uncertainties. For $B^0$ decays to
$\rho^0(770) K^0_S$, the combined confidence interval is $-9^o < \beta_{eff} <
57^o$ at 95% C.L. In decays to $K^{*+}(892) \pi^-$ we measure the direct CP
asymmetry to be $A_{CP}=-0.20 \pm 0.10 \pm 0.01 \pm 0.02$. The measured phase
difference (including $B^0\bar{B}^0$ mixing) between decay amplitudes of $B^0
\to K^{*+}(892) \pi^-$ and $\bar{B}^0 \to K^{*-}(892) \pi^+$, excludes the
interval $-137^o < \Delta\Phi(K^{*+}(892) \pi^-) < -5^o$ at 95% C.L.
","[{""version"":""v1"",""created"":""Fri, 22 May 2009 07:29:27 GMT""}]","2010-04-12"
"0905.3616","Md  Mahbub","M.S. Mahbub, Alan \`O Cais, Waseem Kamleh, B.G. Lasscock, Derek B.
  Leinweber, Anthony G. Williams","Isolating Excited States of the Nucleon in Lattice QCD","May 2009.13pp, Minor changes and references added","Phys.Rev.D80:054507,2009","10.1103/PhysRevD.80.054507","ADP-09-09/T687","hep-lat","http://arxiv.org/licenses/nonexclusive-distrib/1.0/","  We discuss a robust projection method for the extraction of excited-state
masses of the nucleon from a matrix of correlation functions. To illustrate the
algorithm in practice, we present results for the positive parity excited
states of the nucleon in quenched QCD. Using eigenvectors obtained via the
variational method, we construct an eigenstate-projected correlation function
amenable to standard analysis techniques. The method displays its utility when
comparing results from the fit of the projected correlation function with those
obtained from the eigenvalues of the variational method. Standard nucleon
interpolators are considered, with $2\times 2$ and $3\times 3$ correlation
matrix analyses presented using various combinations of source-smeared,
sink-smeared and smeared-smeared correlation functions. Using these new robust
methods, we observe a systematic dependency of the nucleon excited-state masses
on source- and sink-smearing levels. To the best of our knowledge, this is the
first clear indication that a correlation matrix of standard nucleon
interpolators is insufficient to isolate the eigenstates of QCD.
","[{""version"":""v1"",""created"":""Fri, 22 May 2009 07:10:36 GMT""},{""version"":""v2"",""created"":""Wed, 30 Sep 2009 10:04:21 GMT""}]","2010-04-28"
"0905.3617","Sunil Kumar Mishra","Sunil Kumar Mishra","Memory and aging effects in antiferromagnetic nanoparticles",,"Eur. Phys. J. B 78, 65-73 (2010)","10.1140/epjb/e2010-00293-0",,"cond-mat.mes-hall","http://arxiv.org/licenses/nonexclusive-distrib/1.0/","  We investigate slow dynamics of collection of a few antiferromagnetic NiO
nanoparticles. The zero-field cooled magnetization exhibits size dependent
fluctuations. We find memory effects in field cooled magnetization, as well as
aging effects in thermoremenant magnetization of antiferromagnetic
nanoparticles. The antiferromagnetic nanoparticles show a stronger memory
effect than the corresponding effect in the ferromagnetic particles, when the
distribution of particles include very small sizes. The situation reverses for
bigger sizes. The relaxation of the magnetization after a sudden cooling,
heating and removal of fields reiterate the memory effects. We also see a weak
signature of size-dependent magnetization fluctuations in aging effect of
antiferromagnetic nanoparticles. We find a two-step relaxation of
thermoremenant magnetization in antiferromagnetic case, which differs
qualitatively from relaxation of ferromagnetic nanoparticles.
","[{""version"":""v1"",""created"":""Fri, 22 May 2009 07:09:44 GMT""},{""version"":""v2"",""created"":""Sun, 14 Feb 2010 07:05:55 GMT""}]","2011-01-18"
"0905.3618","Philip Pogorelov","Natalie E. Firsova, Sergey A. Ktitorov, Philip A. Pogorelov","Bound and resonance electron states in the monolayer graphene with the
  short-range impurities",,,,,"cond-mat.mes-hall","http://arxiv.org/licenses/nonexclusive-distrib/1.0/","  Bound and resonance electronic states in impure graphene are studied.
Short-range perturbations for defects and impurities of the types ""local
chemical potential"" and ""local gap"" are taken into account. Zero gap and
non-zero gap kinds of graphene are considered. A qualitative analysis of the
electronic spectrum general features and numeric calculations are presented. A
dependence of the resonance widths on the gap value, angular momentum values
and the perturbation amplitudes is investigated.
","[{""version"":""v1"",""created"":""Fri, 22 May 2009 07:10:07 GMT""},{""version"":""v2"",""created"":""Mon, 25 May 2009 11:43:25 GMT""}]","2009-05-25"
"0905.3619","Anne Gegout-Petit","Anne G\'egout-Petit (IMB, INRIA Bordeaux - Sud-Ouest), Daniel
  Commenges (ISPED)","A general definition of influence between stochastic processes",,,,,"math.ST stat.TH","http://arxiv.org/licenses/nonexclusive-distrib/1.0/","  We extend the study of weak local conditional independence (WCLI) based on a
measurability condition made by Commenges and G\'egout-Petit (2009) to a larger
class of processes that we call D'. We also give a definition related to the
same concept based on certain likelihood processes, using the Girsanov theorem.
Under certain conditions, the two definitions coincide on D'. These results may
be used in causal models in that we define what may be the largest class of
processes in which influences of one component of a stochastic process on
another can be described without ambiguity. From WCLI we can contruct a concept
of strong local conditional independence (SCLI). When WCLI does not hold, there
is a direct influence while when SCLI does not hold there is direct or indirect
influence. We investigate whether WCLI and SCLI can be defined via conventional
independence conditions and find that this is the case for the latter but not
for the former. Finally we recall that causal interpretation does not follow
from mere mathematical definitions, but requires working with a good system and
with the true probability.
","[{""version"":""v1"",""created"":""Fri, 22 May 2009 07:20:31 GMT""}]","2009-05-25"
