"0905.3550","M.P. Singh","M.P. Singh, K.D. Truong, S. Jandl, and P. Fournier","Long-range Ni/Mn structural order in epitaxial double perovskite
  La2NiMnO6 thin films","15 pages, 5 figs",,"10.1103/PhysRevB.79.224421",,"cond-mat.mtrl-sci","http://arxiv.org/licenses/nonexclusive-distrib/1.0/","  We report and compare the structural, magnetic, and optical properties of
ordered La2NiMnO6 thin films and its disordered LaNi0.5Mn0.5O3 counterpart. An
x-ray diffraction study reveals that the B-site Ni/Mn ordering induces
additional XRD reflections as the crystal symmetry is transformed from a
pseudocubic perovskite unit cell in the disordered phase to a monoclinic form
with larger lattice parameters for the ordered phase. Polarized Raman
spectroscopy studies reveal that the ordered samples are characterized by
additional phonon excitations that are absent in the disordered phase. The
appearance of these additional phonon excitations is interpreted as the
clearest signature of Brillouin zone folding as a result of the long-range
Ni/Mn ordering in La2NiMnO6. Both ordered and disordered materials display a
single ferromagnetic-to-paramagnetic transition. The ordered films display also
a saturation magnetization close to 4.8 mB/f.u. and a transition temperature
(FM-TC) around 270 K, while the disordered ones have only a 3.7 mB/f.u.
saturation magnetization and a FM-TC around 138 K. The differences in their
magnetic behaviours are understood based on the distinct local electronic
configurations of their Ni/Mn cations.
","[{""version"":""v1"",""created"":""Thu, 21 May 2009 22:15:23 GMT""}]","2015-05-13"
"0905.3551","Niayesh Afshordi","Chanda Prescod-Weinstein (Perimeter Institute/U-Waterloo), Niayesh
  Afshordi (Perimeter Institute), and Michael L. Balogh (U-Waterloo)","Stellar Black Holes and the Origin of Cosmic Acceleration","9 pages, 3 figures","Phys.Rev.D80:043513,2009","10.1103/PhysRevD.80.043513",,"astro-ph.CO astro-ph.HE gr-qc hep-th","http://arxiv.org/licenses/nonexclusive-distrib/1.0/","  The discovery of cosmic acceleration has presented a unique challenge for
cosmologists. As observational cosmology forges ahead, theorists have struggled
to make sense of a standard model that requires extreme fine tuning. This
challenge is known as the cosmological constant problem. The theory of
gravitational aether is an alternative to general relativity that does not
suffer from this fine-tuning problem, as it decouples the quantum field theory
vacuum from geometry, while remaining consistent with other tests of gravity.
In this paper, we study static black hole solutions in this theory and show
that it manifests a UV-IR coupling: Aether couples the spacetime metric close
to the black hole horizon, to metric at infinity. We then show that using the
Trans-Planckian ansatz (as a quantum gravity effect) close to the black hole
horizon, leads to an accelerating cosmological solution, far from the horizon.
Interestingly, this acceleration matches current observations for stellar mass
black holes. Based on our current understanding of the black hole accretion
history in the Universe, we then make a prediction for how the effective dark
energy density should evolve with redshift, which can be tested with future
dark energy probes.
","[{""version"":""v1"",""created"":""Fri, 22 May 2009 00:23:30 GMT""},{""version"":""v2"",""created"":""Sat, 25 Jul 2009 14:48:47 GMT""}]","2009-09-02"
"0905.3552","Franco Vazza","A. Bonafede, L. Feretti, G.Giovannini, F. Govoni, M. Murgia, G.B.
  Taylor, H. Ebeling, S. Allen, G. Gentile, Y. Pihlstrom","Revealing the magnetic field in a distant galaxy cluster: discovery of
  the complex radio emission from MACS J0717.5 +3745","14 pages, 13 figures, Astronomy and Astrophysics, accepted",,"10.1051/0004-6361/200912520",,"astro-ph.CO","http://arxiv.org/licenses/nonexclusive-distrib/1.0/","  Aims. To study at multiple frequencies the radio emission arising from the
massive galaxy cluster MACS J0717.5+3745 (z=0.55). Known to be an extremely
complex cluster merger, the system is uniquely suited for an investigation of
the phenomena at work in the intra-cluster medium (ICM) during cluster
collisions. Methods. We use multi-frequency and multi-resolution data obtained
with the Very Large Array radio telescope, and X-ray features revealed by
Chandra, to probe the non-thermal and thermal components of the ICM, their
relations and interactions. Results. The cluster shows highly complex radio
emission. A bright, giant radio halo is detected at frequencies as high as 4.8
GHz. MACS J0717.5+3745 is the most distant cluster currently known to host a
radio halo. This radio halo is also the most powerful ever observed, and the
second case for which polarized radio emission has been detected, indicating
that the magnetic field is ordered on large scales.
","[{""version"":""v1"",""created"":""Thu, 21 May 2009 20:00:11 GMT""},{""version"":""v2"",""created"":""Fri, 3 Jul 2009 16:36:57 GMT""}]","2015-05-13"
"0905.3553","Jose' P. S. Lemos","Jos\'e P. S. Lemos, Vilson T. Zanchin","Electrically charged fluids with pressure in Newtonian gravitation and
  general relativity in d spacetime dimensions: theorems and results for Weyl
  type systems","27 pages","Phys.Rev.D80:024010,2009","10.1103/PhysRevD.80.024010",,"gr-qc","http://arxiv.org/licenses/nonexclusive-distrib/1.0/","  Previous theorems concerning Weyl type systems, including Majumdar-Papapetrou
systems, are generalized in two ways, namely, we take these theorems into d
spacetime dimensions (${\rm d}\geq4$), and we also consider the very
interesting Weyl-Guilfoyle systems, i.e., general relativistic charged fluids
with nonzero pressure. In particular within Newton-Coulomb theory of charged
gravitating fluids, a theorem by Bonnor (1980) in three-dimensional space is
generalized to arbitrary $({\rm d}-1)>3$ space dimensions. Then, we prove a new
theorem for charged gravitating fluid systems in which we find the condition
that the charge density and the matter density should obey. Within general
relativity coupled to charged dust fluids, a theorem by De and Raychaudhuri
(1968) in four-dimensional spacetimes in rendered into arbitrary ${\rm d}>4$
dimensions. Then a theorem, new in ${\rm d}=4$ and ${\rm d}>4$ dimensions, for
Weyl-Guilfoyle systems, is stated and proved, in which we find the condition
that the charge density, the matter density, the pressure, and the
electromagnetic energy density should obey. This theorem comprises, as
particular cases, a theorem by Gautreau and Hoffman (1973) and results in four
dimensions by Guilfoyle (1999). Upon connection of an interior charged solution
to an exterior Tangherlini solution (i.e., a Reissner-Nordstr\""om solution in
d-dimensions), one is able to give a general definition for gravitational mass
for this kind of relativistic systems and find a mass relation with the several
quantities of the interior solution. It is also shown that for sources of
finite extent the mass is identical to the Tolman mass.
","[{""version"":""v1"",""created"":""Thu, 21 May 2009 20:00:57 GMT""}]","2009-09-02"
"0905.3554","Laura V. Sales","Laura V. Sales, Julio F. Navarro, Joop Schaye, Claudio Dalla Vecchia,
  Volker Springel, Marcel R. Haas and Amina Helmi","The Origin of Extended Disk Galaxies at z=2","5 pages, 4 figures. Accepted for publication in MNRAS Letters. Minor
  changes to match published version","MNRAS Letters (2009), Volume 399, Issue 1, pp. L64-L68","10.1111/j.1745-3933.2009.00725.x",,"astro-ph.CO","http://arxiv.org/licenses/nonexclusive-distrib/1.0/","  Galaxy formation models typically assume that the size and rotation speed of
galaxy disks are largely dictated by the mass, concentration, and spin of their
surrounding dark matter haloes. Equally important, however, are the fraction of
baryons in the halo that collect into the central galaxy, as well as the net
angular momentum that they are able to retain during its assembly process. We
explore the latter using a set of four large cosmological N-body/gasdynamical
simulations drawn from the OWLS (OverWhelmingly Large Simulations) project.
These runs differ only in their implementation of feedback from supernovae. We
find that, when expressed as fractions of their virial values, galaxy mass and
net angular momentum are tightly correlated. Galaxy mass fractions,
m_d=M_gal/M_vir, depend strongly on feedback, but only weakly on halo mass or
spin over the halo mass range explored here (M_vir>1e11 h^{-1}M_sun). The
angular momentum of a galaxy, j_d=J_gal/J_vir, correlates with m_d in a manner
that is insensitive to feedback and that deviates strongly from the simple j_d
= m_d assumption often adopted in semi-analytic models of galaxy formation. The
m_d-j_d correlation implies that, in a given halo, galaxy disk size is maximal
when the central galaxy makes up a substantial fraction (~20%-30%) of all
baryons within the virial radius. At z=2, such systems may host gaseous disks
with radial scale lengths as large as those reported for star-forming disks by
the SINS survey, even in moderately massive haloes of average spin. Extended
disks at z=2 may thus signal the presence of systems where galaxy formation has
been particularly efficient, rather than the existence of haloes with unusually
high spin parameter.
","[{""version"":""v1"",""created"":""Thu, 21 May 2009 20:01:53 GMT""},{""version"":""v2"",""created"":""Mon, 20 Jul 2009 06:59:06 GMT""}]","2009-10-06"
"0905.3555","Laura V. Sales","Julio F. Navarro, Laura V. Sales, Joop Schaye, Claudio Dalla Vecchia
  and Volker Springel","Disk galaxies at z=2 in OWLS","Conference Proceeding: ""Galaxy Evolution: Emerging Insights and
  Future Challenges"", November 11-14, 2008. The University of Texas at Austin.
  8 pages, 7 figures",,,,"astro-ph.CO","http://arxiv.org/licenses/nonexclusive-distrib/1.0/","  We use the OWLS (OverWhelmingly Large Simulations) set of cosmological
Nbody/gasdynamical simulations to study the properties of simulated galaxies at
z=2. We focus on the effect of supernova feedback from evolving stars on the
baryonic mass and angular momentum content of galaxies that assemble at the
center of 1e11-3e12 h^{-1}M_\odot halos. Our main finding is that the mass and
angular momentum of such galaxies are strongly coupled, in a way that is
approximately independent of feedback: varying the feedback implementation
leads, in a given halo, to large variations in galaxy mass but leaves the
galaxy mass-angular momentum correlation largely unaltered. In particular, the
ratio between the angular momentum of a galaxy and that of its surrounding halo
(j_d=J_gal/J_vir) correlates closely with the galaxy mass (expressed in units
of the virial mass of the halo; m_d=M_gal/M_vir). This correlation differs
substantially from the m_d=j_d assumption commonly adopted in semianalytic
models of galaxy formation. We use these results to infer the sizes of disk
galaxies at z=2 expected in the LCDM scenario and to interpret recent
observations of extended disks at z~2 by the SINS collaboration
","[{""version"":""v1"",""created"":""Thu, 21 May 2009 20:03:28 GMT""}]","2009-05-25"
"0905.3556","Glenn van de Ven","Glenn van de Ven (1 and 2), Kambiz Fathi (3 and 4) ((1) MPIA,
  Heidelberg, (2) IAS, Princeton, (3) Stockholm Observatory, (4) Oskar Klein
  Centre, Stockholm)","Kinematic analysis of nuclear spirals: feeding the black hole in NGC1097","16 pages, 5 figures, published in ApJ, 2010, 723, 767","Astrophys.J.723:767-780,2010","10.1088/0004-637X/723/1/767",,"astro-ph.GA astro-ph.CO","http://arxiv.org/licenses/nonexclusive-distrib/1.0/","  We present a harmonic expansion of the observed line-of-sight velocity field
as a method to recover and investigate spiral structures in the nuclear regions
of galaxies. We apply it to the emission-line velocity field within the
circumnuclear starforming ring of NGC1097, obtained with the GMOS-IFU
spectrograph. The radial variation of the third harmonic terms are well
described by a logarithmic spiral, from which we interpret that the
gravitational potential is weakly perturbed by a two-arm spiral density wave
with inferred pitch angle of of 52+/-4 degrees. This interpretation predicts a
two-arm spiral distortion in the surface brightness, as hinted by the dust
structures in central images of NGC1097, and predicts a combined one-arm and
three-arm spiral structure in the velocity field, as revealed in the
non-circular motions of the ionised gas within the circumnuclear region of this
galaxy. Next, we use a simple spiral perturbation model to constrain the
fraction of the measured non-circular motions that is due to radial inflow. We
combine the resulting inflow velocity with the gas density in the spiral arms,
inferred from emission line ratios, to estimate the mass inflow rate as a
function of radius, which reaches about 0.011 Msun/yr at a distance of 70 pc
from the center. This value corresponds to a fraction of about 4.2 x 10^{-3} of
the Eddington mass accretion rate onto the central black hole in this
LINER/Seyfert1 galaxy. We conclude that the line-of-sight velocity not only can
provide a cleaner view of nuclear spirals than the associated dust, but that
the presented method also allows the quantitative study of these possibly
important links in fueling the centers of galaxies, including providing a
handle on the mass inflow rate as a function of radius.
","[{""version"":""v1"",""created"":""Thu, 21 May 2009 20:57:42 GMT""},{""version"":""v2"",""created"":""Fri, 24 Dec 2010 09:55:58 GMT""}]","2010-12-27"
"0905.3557","David H. Cohen","David H. Cohen","X-ray Spectroscopy of the Radiation-Driven Winds of Massive Stars: Line
  Profile and Line Ratio Diagnostics","Invited talk presented at the 16th International Conference on Atomic
  Processes in Plasmas, Monterey, CA, March 2009; will appear in an
  AIP-published conference proceedings. 10 pages, 4 figures (2 color, but color
  not crucial)",,"10.1063/1.3241184",,"astro-ph.SR","http://arxiv.org/licenses/nonexclusive-distrib/1.0/","  Massive stars drive powerful, supersonic winds via the radiative momentum
associated with the thermal UV emission from their photospheres. Shock
phenomena are ubiquitous in these winds, heating them to millions, and
sometimes tens of millions, of degrees. The emission line spectra from the
shock-heated plasma provide powerful diagnostics of the winds' physical
conditions, which in turn provide constraints on models of wind shock heating.
Here I show how x-ray line transfer is affected by photoelectric absorption in
the partially ionized component of the wind and how it can be modeled to
determine the astrophysically important mass-loss rates of these stellar winds.
I also discuss how photoexcitation out of metastable excited levels of
helium-like ions can provide critical information about the location of the hot
plasma in magnetically channeled massive star winds.
","[{""version"":""v1"",""created"":""Thu, 21 May 2009 20:04:44 GMT""}]","2015-05-13"
"0905.3558","Tao Zhou","Linyuan Lv, Ci-Hang Jin, Tao Zhou","Effective and Efficient Similarity Index for Link Prediction of Complex
  Networks","8 pages, 5 figures, 3 tables","Physical Review E 80 (2009) 046122","10.1103/PhysRevE.80.046122",,"physics.data-an physics.soc-ph q-bio.QM","http://arxiv.org/licenses/nonexclusive-distrib/1.0/","  Predictions of missing links of incomplete networks like protein-protein
interaction networks or very likely but not yet existent links in evolutionary
networks like friendship networks in web society can be considered as a
guideline for further experiments or valuable information for web users. In
this paper, we introduce a local path index to estimate the likelihood of the
existence of a link between two nodes. We propose a network model with
controllable density and noise strength in generating links, as well as collect
data of six real networks. Extensive numerical simulations on both modeled
networks and real networks demonstrated the high effectiveness and efficiency
of the local path index compared with two well-known and widely used indices,
the common neighbors and the Katz index. Indeed, the local path index provides
competitively accurate predictions as the Katz index while requires much less
CPU time and memory space, which is therefore a strong candidate for potential
practical applications in data mining of huge-size networks.
","[{""version"":""v1"",""created"":""Thu, 21 May 2009 20:18:56 GMT""},{""version"":""v2"",""created"":""Wed, 26 Aug 2009 16:20:42 GMT""}]","2009-10-27"
"0905.3559","Collin Broholm","Yiming Qiu, Wei Bao, Yang Zhao, Collin Broholm, V. Stanev, Z.
  Tesanovic, Y. C. Gasparovic, S. Chang, Jin Hu, Bin Qian, Minghu Fang, and
  Zhiqiang Mao","Spin Gap and Resonance at the Nesting Wavevector in Superconducting
  FeSe0.4Te0.6","4 pages, 4 figures, Submitted to Phys. Rev. Lett","Physical Review Letters 103, 067008 (2009)","10.1103/PhysRevLett.103.067008",,"cond-mat.supr-con","http://arxiv.org/licenses/nonexclusive-distrib/1.0/","  Neutron scattering is used to probe magnetic excitations in
FeSe_{0.4}Te_{0.6} (T_c=14 K). Low energy spin fluctuations are found with a
characteristic wave vector $(0.5,0.5,L)$ that corresponds to Fermi surface
nesting and differs from Q_m=(\delta,0,0.5) for magnetic ordering in
Fe_{1+y}Te. A spin resonance with \hbar\Omega_0=6.5 meV \approx 5.3 k_BT_c and
\hbar\Gamma=1.25 meV develops in the superconducting state from a normal state
continuum. We show that the resonance is consistent with a bound state
associated with s+/- superconductivity and imperfect quasi-2D Fermi surface
nesting.
","[{""version"":""v1"",""created"":""Thu, 21 May 2009 21:44:22 GMT""}]","2009-08-10"
"0905.3560","Paramita Barai Dr.","Joel Germain, Paramita Barai, Hugo Martel (Universite Laval)","Anisotropic AGN Outflows and Enrichment of the Intergalactic Medium","19 pages, 16 figures, submitted. The version uploaded here does not
  contain Figs 5, 6 & 7, because of their large sizes. Those can be found along
  with the full paper at:
  http://www.astro.phy.ulaval.ca/staff/paramita/AllPages/Talks-Posters/Papers_Thesis/ms_AGNoutflow.pdf","Astrophys.J.704:1002-1020,2009","10.1088/0004-637X/704/2/1002",,"astro-ph.CO astro-ph.HE","http://arxiv.org/licenses/nonexclusive-distrib/1.0/","  We investigate the cosmological-scale influence of outflows driven by AGNs on
metal enrichment of the intergalactic medium. AGNs are located in dense
cosmological structures which tend to be anisotropic. We designed a
semi-analytical model for anisotropic AGN outflows which expand away along the
direction of least resistance. This model was implemented into a cosmological
numerical simulation algorithm for simulating the growth of large-scale
structure in the universe. Using this modified algorithm, we perform a series
of 9 simulations inside cosmological volumes of size $(128 h^{-1}{\rm Mpc})^3$,
in a concordance $\Lambda$CDM universe, varying the opening angle of the
outflows, the lifetimes of the AGNs, their kinetic fractions, and their level
of clustering. For each simulation, we compute the volume fraction of the IGM
enriched in metals by the outflows. The resulting enriched volume fractions are
relatively small at $z \gtrsim 2.5$, and then grow rapidly afterward up to $z =
0$. We find that AGN outflows enrich from 65% to 100% of the entire universe at
the present epoch, for different values of the model parameters. The enriched
volume fraction depends weakly on the opening angle of the outflows. However,
increasingly anisotropic outflows preferentially enrich underdense regions, a
trend found more prominent at higher redshifts and decreasing at lower
redshifts. The enriched volume fraction increases with increasing kinetic
fraction and decreasing AGN lifetime and level of clustering.
","[{""version"":""v1"",""created"":""Thu, 21 May 2009 20:28:30 GMT""}]","2009-10-02"
"0905.3561","Re Fiorentin Stefano","Stefano Re Fiorentin","Electrodynamics as a particular case of the most general relativistic
  force field","20 pages - Already published","Nuovo Cim.B123:N12,2008",,,"gr-qc","http://arxiv.org/licenses/nonexclusive-distrib/1.0/","  A new approach to classical electrodynamics is presented, showing that it can
be regarded as a particular case of the most general relativistic force field.
In particular, at first it is shown that the structure of the Lorentz force
comes directly from the structure of the three-force transformation law, and
that E and B fields can be defined, which in general will depend not only on
the space-time coordinate, but also on the velocity of the body acted upon.
Then it is proved that these fields become independent from the body velocity
if the force field propagates throughout space at the relativistic speed limit
c. Finally, field sources are introduced by defining them as perturbations of
the field itself, obtaining a generalization of Maxwell equations which allow
to express the field in terms sources, if these last are known a priori.
Electrodynamics follows simply assuming, in addition to the postulate of field
propagation at the speed c, that scalar sources of the B field are missing and
that electric charge is an invariant characteristic of matter, acting both as
source of the field and sensing property. The presented approach may have
valuable didactic effectiveness in showing that space-time structure, as
defined by Special Relativity postulates, is the ultimate responsible of the
structure of electrodynamics laws.
","[{""version"":""v1"",""created"":""Thu, 21 May 2009 20:33:52 GMT""}]","2009-07-14"
"0905.3562","Matthew R. Bate","Matthew R. Bate","The dependence of star formation on initial conditions and molecular
  cloud structure","Accepted for publication in MNRAS, 18 pages, 14 figures. Movies and
  paper with high-resolution figures available at
  http://www.astro.ex.ac.uk/people/mbate/Cluster/cluster4.html",,"10.1111/j.1365-2966.2009.14970.x",,"astro-ph.SR astro-ph.GA","http://arxiv.org/licenses/nonexclusive-distrib/1.0/","  We investigate the dependence of stellar properties on the initial kinematic
structure of the gas in star-forming molecular clouds. We compare the results
from two large-scale hydrodynamical simulations of star cluster formation that
resolve the fragmentation process down to the opacity limit, the first of which
was reported by Bate, Bonnell and Bromm. The initial conditions of the two
calculations are identical, but in the new simulation the power spectrum of the
velocity field imposed on the cloud initially and allowed to decay is biased in
favour of large-scale motions. Whereas the calculation of Bate et al. began
with a power spectrum P(k) ~ k^{-4} to match the Larson scaling relations for
the turbulent motions observed in molecular clouds, the new calculation begins
with a power spectrum P(k) ~ k^{-6}. Despite this change to the initial motions
in the cloud and the resulting density structure of the molecular cloud, the
resulting stellar properties resulting from the two calculations are
indistinguishable. This demonstrates that the results of such hydrodynamical
calculations of star cluster formation are relatively insensitive to the
initial conditions. It is also consistent with the fact that the statistical
properties of stars and brown dwarfs (e.g. the stellar initial mass function)
are observed to be relatively invariant within our Galaxy and do not appear to
depend on environment.
","[{""version"":""v1"",""created"":""Thu, 21 May 2009 20:52:05 GMT""}]","2015-05-13"
"0905.3564","Cristian Constantin Lalescu","Cristian Constantin Lalescu","Two hierarchies of spline interpolations. Practical algorithms for
  multivariate higher order splines",,,,,"cs.NA","http://arxiv.org/licenses/nonexclusive-distrib/1.0/","  A systematic construction of higher order splines using two hierarchies of
polynomials is presented. Explicit instructions on how to implement one of
these hierarchies are given. The results are limited to interpolations on
regular, rectangular grids, but an approach to other types of grids is also
discussed.
","[{""version"":""v1"",""created"":""Thu, 21 May 2009 20:58:46 GMT""}]","2009-05-25"
"0905.3565","Glenn Paquette","Glenn C. Paquette","Thermodynamics of non-equilibrium steady states",,,,,"cond-mat.stat-mech","http://arxiv.org/licenses/nonexclusive-distrib/1.0/","  We consider the problem of constructing a thermodynamic theory of
non-equilibrium steady states as a formal extension of the equilibrium theory.
Specifically, studying a particular system, we attempt to construct a
phenomenological theory describing the interplay between heat and mechanical
work that takes place during operations through which the system undergoes
transitions between non-equilibrium steady states. We find that, in contrast to
the case of the equilibrium theory, apparently, there exists no systematic way
within a phenomenological formulation to describe the work done by the system
during such operations. With this observation, we conclude that the attempt to
construct a thermodynamic theory of non-equilibrium steady states in analogy to
the equilibrium theory has limited prospects for success and that the pursuit
of such a theory should be directed elsewhere.
","[{""version"":""v1"",""created"":""Thu, 21 May 2009 20:50:16 GMT""},{""version"":""v2"",""created"":""Mon, 25 May 2009 01:24:19 GMT""},{""version"":""v3"",""created"":""Thu, 11 Jun 2009 05:53:22 GMT""}]","2009-06-11"
