"0906.0191","Francois Golse","Fran\c{c}ois Golse","Recent Results on the Periodic Lorentz Gas","62 pages. Course at the conference ""Topics in PDEs and applications
  2008"" held in Granada, April 7-11 2008; figure 13 and a misprint in Theorem
  4.6 corrected in the new version",,"10.1007/978-3-0348-0191-1_2",,"math-ph math.MP","http://arxiv.org/licenses/nonexclusive-distrib/1.0/","  The Drude-Lorentz model for the motion of electrons in a solid is a classical
model in statistical mechanics, where electrons are represented as point
particles bouncing on a fixed system of obstacles (the atoms in the solid).
Under some appropriate scaling assumption -- known as the Boltzmann-Grad
scaling by analogy with the kinetic theory of rarefied gases -- this system can
be described in some limit by a linear Boltzmann equation, assuming that the
configuration of obstacles is random [G. Gallavotti, [Phys. Rev. (2) vol. 185
(1969), 308]). The case of a periodic configuration of obstacles (like atoms in
a crystal) leads to a completely different limiting dynamics. These lecture
notes review several results on this problem obtained in the past decade as
joint work with J. Bourgain, E. Caglioti and B. Wennberg.
","[{""version"":""v1"",""created"":""Mon, 1 Jun 2009 00:02:32 GMT""},{""version"":""v2"",""created"":""Thu, 25 Jun 2009 23:37:42 GMT""}]","2016-06-29"
"0906.0192","Gregory Fleishman","Gregory D. Fleishman, Gelu M. Nita, Dale E. Gary","Dynamic Magnetography of Solar Flaring Loops","ApJ Letters, in press","Astrophys.J.698:L183-L187,2009","10.1088/0004-637X/698/2/L183",,"astro-ph.SR","http://arxiv.org/licenses/nonexclusive-distrib/1.0/","  We develop a practical forward fitting method based on the SIMPLEX algorithm
with shaking, which allows the derivation of the magnetic field and other
parameters along a solar flaring loop using microwave imaging spectroscopy of
gyrosynchrotron emission. We illustrate the method using a model loop with
spatially varying magnetic field, filled with uniform ambient density and an
evenly distributed fast electron population with an isotropic, power-law energy
distribution.
","[{""version"":""v1"",""created"":""Mon, 1 Jun 2009 00:28:59 GMT""}]","2011-02-11"
"0906.0193","Daniel M. Danchev","Daniel Dantchev, Joseph Rudnick, and M. Barmatz","Finite-size effects in presence of gravity: The behavior of the
  susceptibility in $^3He$ and $^4He$ films near the liquid-vapor critical
  point","pdflatex, 19 pages; some changes in the main text, including in few
  figures, and new references added; version to be published in PRE","Phys. Rev. E 80, 031119 (2009)","10.1103/PhysRevE.80.031119",,"cond-mat.stat-mech","http://arxiv.org/licenses/nonexclusive-distrib/1.0/","  We study critical point finite-size effects on the behavior of susceptibility
of a film placed in the Earth's gravitational field. The fluid-fluid and
substrate-fluid interactions are characterized by van der Waals-type power law
tails, and the boundary conditions are consistent with bounding surfaces that
strongly prefer the liquid phase of the system. Specific predictions are made
with respect to the behavior of $^3$He and $^4$He films in the vicinity of
their respective liquid-gas critical points. We find that for all film
thicknesses of current experimental interest the combination of van der Waals
interactions and gravity leads to substantial deviations from the behavior
predicted by models in which all interatomic forces are very short ranged and
gravity is absent. In the case of a completely short-ranged system exact
mean-field analytical expressions are derived, within the continuum approach,
for the behavior of both the local and the total susceptibilities.
","[{""version"":""v1"",""created"":""Mon, 1 Jun 2009 00:38:45 GMT""},{""version"":""v2"",""created"":""Tue, 15 Sep 2009 01:59:15 GMT""}]","2009-10-15"
"0906.0194","Yao Chen","Y. Chen, X. Li, H. Q. Song, Q. Q. Shi, S. W. Feng, and L. D. Xia","Intrinsic Instability of Coronal Streamers","7 pages, 3 figures","Astrophys.J.691:1936,2009","10.1088/0004-637X/691/2/1936",,"astro-ph.SR astro-ph.EP","http://arxiv.org/licenses/nonexclusive-distrib/1.0/","  Plasma blobs are observed to be weak density enhancements as radially
stretched structures emerging from the cusps of quiescent coronal streamers. In
this paper, it is suggested that the formation of blobs is a consequence of an
intrinsic instability of coronal streamers occurring at a very localized region
around the cusp. The evolutionary process of the instability, as revealed in
our calculations, can be described as follows: (1) through the localized cusp
region where the field is too weak to sustain the confinement, plasmas expand
and stretch the closed field lines radially outward as a result of the
freezing-in effect of plasma-magnetic field coupling; the expansion brings a
strong velocity gradient into the slow wind regime providing the free energy
necessary for the onset of a subsequent magnetohydrodynamic instability; (2)
the instability manifests itself mainly as mixed streaming sausage-kink modes,
the former results in pinches of elongated magnetic loops to provoke
reconnections at one or many locations to form blobs. Then, the streamer system
returns to the configuration with a lower cusp point, subject to another cycle
of streamer instability. Although the instability is intrinsic, it does not
lead to the loss of the closed magnetic flux, neither does it affect the
overall feature of a streamer. The main properties of the modeled blobs,
including their size, velocity profiles, density contrasts, and even their
daily occurrence rate, are in line with available observations.
","[{""version"":""v1"",""created"":""Mon, 1 Jun 2009 01:05:55 GMT""}]","2011-02-11"
"0906.0195","Hiroshi Nozaki","Hiroshi Nozaki","New upper bound for the cardinalities of $s$-distance sets on the unit
  sphere","5 pages",,,,"math.CO","http://arxiv.org/licenses/nonexclusive-distrib/1.0/","  We have the Fisher type inequality and the linear programming bound as upper
bounds for the cardinalities of $s$-distance sets on $S^{d-1}$. In this paper,
we give a new upper bound for the cardinalities of $s$-distance sets on
$S^{d-1}$ for any $s$. This upper bound improves the Fisher typer inequality
and is useful for $s$-distance sets which are not applicable to the linear
programming bound.
","[{""version"":""v1"",""created"":""Mon, 1 Jun 2009 01:48:18 GMT""},{""version"":""v2"",""created"":""Wed, 28 Apr 2010 16:14:15 GMT""}]","2010-04-29"
"0906.0196","Philip Metzger","Philip T. Metzger, Christopher D. Immer, Carly M. Donahue, Bruce M.
  Vu, Robert C. Latta III, and Matthew Deyo-Svendsen","Jet-induced cratering of a granular surface with application to lunar
  spaceports","13 pages, link to published version:
  http://cedb.asce.org/cgi/WWWdisplay.cgi?0900004","J. Aerospace Engineering Vol. 21, No. 1, January 2009, pp. 24-32,","10.1061/(ASCE)0893-1321(2009)22:1(24)",,"cond-mat.soft astro-ph.EP physics.flu-dyn","http://arxiv.org/licenses/nonexclusive-distrib/1.0/","  The erosion of lunar soil by rocket exhaust plumes is investigated
experimentally. This has identified the diffusion-driven flow in the bulk of
the sand as an important but previously unrecognized mechanism for erosion
dynamics. It has also shown that slow regime cratering is governed by the
recirculation of sand in the widening geometry of the crater. Scaling
relationships and erosion mechanisms have been characterized in detail for the
slow regime. The diffusion-driven flow occurs in both slow and fast regime
cratering. Because diffusion-driven flow had been omitted from the lunar
erosion theory and from the pressure cratering theory of the Apollo and Viking
era, those theories cannot be entirely correct.
","[{""version"":""v1"",""created"":""Mon, 1 Jun 2009 15:21:34 GMT""}]","2021-04-13"
"0906.0197","Hideki Kohri","H. Kohri, D.S. Ahn, J.K. Ahn, H. Akimune, W.C. Chang, S. Date', H.
  Ejiri, S. Fukui, H. Fujimura, M. Fujiwara, K. Hicks, A. Hosaka, T. Hotta, K.
  Imai, T. Ishikawa, T. Iwata, K. Kino, S. Makino, T. Matsuda, T. Matsumura T.
  Mibe, M. Miyabe, Y. Miyachi, N. Muramatsu, T. Nakano, S.i. Nam, M. Niiyama,
  M. Nomachi, Y. Ohashi, C. Rangacharyulu, A. Sakaguchi, H. Shimizu, Y. Sugaya,
  M. Sumihama, A.I. Titov, Y. Toi, K. Yonehara, T. Yorita, M. Yosoi, R.G.T.
  Zegers (LEPS Collaboration)","Near-threshold Lambda(1520) production by the gamma p -> K+Lambda(1520)
  reaction at forward K+ angles","5 pages, 4 figures, published in Phys. Rev. Lett","Phys.Rev.Lett.104:172001,2010","10.1103/PhysRevLett.104.172001",,"hep-ex","http://arxiv.org/licenses/nonexclusive-distrib/1.0/","  Differential cross sections and photon-beam asymmetries for the gamma p -> K+
Lambda(1520) reaction have been measured with linearly polarized photon beams
at energies from the threshold to 2.4 GeV at 0.6<cos(theta)<1. A new bump
structure was found at W=2.11 GeV in the cross sections. The bump is not well
reproduced by theoretical calculations introducing a nucleon resonance with
J<=3/2. This result suggests that the bump might be produced by a nucleon
resonance possibly with J>=5/2 or by a new reaction process, for example an
interference effect with the phi photoproduction having a similar bump
structure in the cross sections.
","[{""version"":""v1"",""created"":""Mon, 1 Jun 2009 02:16:11 GMT""},{""version"":""v2"",""created"":""Wed, 12 May 2010 09:51:45 GMT""}]","2015-03-13"
"0906.0198","Vartan Choulakian","Vartan Choulakian","Some Numerical Results on the Rank of Generic Three-Way Arrays over R","21 pages",,,,"stat.CO stat.AP","http://arxiv.org/licenses/nonexclusive-distrib/1.0/","  The aim of this paper is the introduction of a new method for the numerical
computation of the rank of a three-way array. We show that the rank of a
three-way array over R is intimately related to the real solution set of a
system of polynomial equations. Using this, we present some numerical results
based on the computation of Grobner bases.
  Key words: Tensors; three-way arrays; Candecomp/Parafac; Indscal; generic
rank; typical rank; Veronese variety; Segre variety; Grobner bases.
  AMS classification: Primary 15A69; Secondary 15A72, 15A18.
","[{""version"":""v1"",""created"":""Mon, 1 Jun 2009 15:11:28 GMT""}]","2009-06-02"
"0906.0199","Hiroshi Nozaki Dr.","Hiroshi Nozaki, Masashi Shinohara","On a generalization of distance sets","17 pages, 1 figure",,,,"math.CO","http://arxiv.org/licenses/nonexclusive-distrib/1.0/","  A subset $X$ in the $d$-dimensional Euclidean space is called a $k$-distance
set if there are exactly $k$ distinct distances between two distinct points in
$X$ and a subset $X$ is called a locally $k$-distance set if for any point $x$
in $X$, there are at most $k$ distinct distances between $x$ and other points
in $X$.
  Delsarte, Goethals, and Seidel gave the Fisher type upper bound for the
cardinalities of $k$-distance sets on a sphere in 1977. In the same way, we are
able to give the same bound for locally $k$-distance sets on a sphere. In the
first part of this paper, we prove that if $X$ is a locally $k$-distance set
attaining the Fisher type upper bound, then determining a weight function $w$,
$(X,w)$ is a tight weighted spherical $2k$-design. This result implies that
locally $k$-distance sets attaining the Fisher type upper bound are
$k$-distance sets. In the second part, we give a new absolute bound for the
cardinalities of $k$-distance sets on a sphere. This upper bound is useful for
$k$-distance sets for which the linear programming bound is not applicable. In
the third part, we discuss about locally two-distance sets in Euclidean spaces.
We give an upper bound for the cardinalities of locally two-distance sets in
Euclidean spaces. Moreover, we prove that the existence of a spherical
two-distance set in $(d-1)$-space which attains the Fisher type upper bound is
equivalent to the existence of a locally two-distance set but not a
two-distance set in $d$-space with more than $d(d+1)/2$ points. We also
classify optimal (largest possible) locally two-distance sets for dimensions
less than eight. In addition, we determine the maximum cardinalities of locally
two-distance sets on a sphere for dimensions less than forty.
","[{""version"":""v1"",""created"":""Mon, 1 Jun 2009 02:44:42 GMT""},{""version"":""v2"",""created"":""Thu, 10 Dec 2009 07:33:03 GMT""}]","2009-12-10"
"0906.0200","Mu-Tao Wang","Mu-Tao Wang and Shing-Tung Yau","Limit of quasilocal mass at spatial infinity","16 pages, a new section ``Review of the definition of quasilocal
  energy"" is added. Typos corrected",,"10.1007/s00220-010-0990-2",,"math.DG gr-qc math-ph math.MP","http://arxiv.org/licenses/nonexclusive-distrib/1.0/","  We study the limit of quasilocal mass defined in [4] and [5] for a family of
spacelike 2-surfaces in spacetime. In particular, we show the limit coincides
with the ADM mass at spatial infinity. The limit for coordinate spheres of a
boosted slice of the Schwarzchild solution is computed explicitly and shown to
give the expected energy-momentum four vector.
","[{""version"":""v1"",""created"":""Mon, 1 Jun 2009 02:49:57 GMT""},{""version"":""v2"",""created"":""Mon, 8 Jun 2009 18:32:43 GMT""}]","2015-05-13"
"0906.0201","Robert Gutermuth","R. A. Gutermuth, S. T. Megeath, P. C. Myers, L. E. Allen, J. L.
  Pipher, G. G. Fazio","A Spitzer Survey of Young Stellar Clusters within One Kiloparsec of the
  Sun: Cluster Core Extraction and Basic Structural Analysis","207 pages, 54 figures, 44 tables. Accepted to ApJ Supplements. Full
  resolution version at
  http://www.cfa.harvard.edu/~rgutermuth/preprints/gutermuth_clusters_survey.pdf","Astrophys.J.Suppl.184:18-83,2009","10.1088/0067-0049/184/1/18",,"astro-ph.SR","http://arxiv.org/licenses/nonexclusive-distrib/1.0/","  We present a uniform mid-infrared imaging and photometric survey of 36 young,
nearby, star-forming clusters and groups using {\it Spitzer} IRAC and MIPS. We
have confidently identified and classified 2548 young stellar objects using
recently established mid-infrared color-based methods. We have devised and
applied a new algorithm for the isolation of local surface density enhancements
from point source distributions, enabling us to extract the overdense cores of
the observed star forming regions for further analysis. We have compiled
several basic structural measurements of these cluster cores from the data,
such as mean surface densities of sources, cluster core radii, and aspect
ratios, in order to characterize the ranges for these quantities. We find that
a typical cluster core is 0.39 pc in radius, has 26 members with infrared
excess in a ratio of Class II to Class I sources of 3.7, is embedded in a
$A_K$=0.8 mag cloud clump, and has a surface density of 60 pc$^{-2}$. We
examine the nearest neighbor distances among the YSOs in several ways,
demonstrating similarity in the spacings between Class II and Class I sources
but large member clusters appear more dense than smaller clusters. We
demonstrate that near-uniform source spacings in cluster cores are common,
suggesting that simple Jeans fragmentation of parsec-scale cloud clumps may be
the dominant process governing star formation in nearby clusters and groups.
Finally, we compare our results to other similar surveys in the literature and
discuss potential biases in the data to guide further interpretation.
","[{""version"":""v1"",""created"":""Mon, 1 Jun 2009 15:52:58 GMT""}]","2009-08-25"
"0906.0202","Abedelaziz Mohaisen","Abedelaziz Mohaisen and Dowon Hong","Mitigating the ICA Attack against Rotation Based Transformation for
  Privacy Preserving Clustering","3 pages, 1 figure, appeared as a letter in ETRI journal","Abedelaziz Mohaisen, and Dowon Hong: Mitigating the ICA Attack
  against Rotation-Based Transformation for Privacy Preserving Clustering, ETRI
  Journal, vol.30, no.6, Dec. 2008, pp.868-870",,,"cs.CR","http://arxiv.org/licenses/nonexclusive-distrib/1.0/","  The rotation based transformation (RBT) for privacy preserving data mining
(PPDM) is vulnerable to the independent component analysis (ICA) attack. This
paper introduces a modified multiple rotation based transformation (MRBT)
technique for special mining applications mitigating the ICA attack while
maintaining the advantages of the RBT.
","[{""version"":""v1"",""created"":""Mon, 1 Jun 2009 03:31:26 GMT""}]","2009-06-02"
"0906.0203","Justin Holmer","Justin Holmer, Svetlana Roudenko","Divergence of infinite-variance nonradial solutions to the 3d NLS
  equation",,,,,"math.AP","http://arxiv.org/licenses/nonexclusive-distrib/1.0/","  We consider solutions $u(t)$ to the 3d NLS equation $i\partial_t u + \Delta u
+ |u|^2u=0$ such that $\|xu(t)\|_{L^2} = \infty$ and $u(t)$ is nonradial.
Denoting by $M[u]$ and $E[u]$, the mass and energy, respectively, of a solution
$u$, and by $Q(x)$ the ground state solution to $-Q+\Delta Q+|Q|^2Q=0$, we
prove the following: if $M[u]E[u]<M[Q]E[Q]$ and $\|u_0\|_{L^2}\|\nabla
u_0\|_{L^2}>\|Q\|_{L^2}\|\nabla Q\|_{L^2}$, then either $u(t)$ blows-up in
finite positive time or $u(t)$ exists globally for all positive time and there
exists a sequence of times $t_n\to +\infty$ such that $\|\nabla u(t_n)\|_{L^2}
\to \infty$. Similar statements hold for negative time.
","[{""version"":""v1"",""created"":""Mon, 1 Jun 2009 03:31:56 GMT""},{""version"":""v2"",""created"":""Mon, 25 Jan 2010 20:35:59 GMT""}]","2010-01-25"
"0906.0204","Anthony Hall","Anthony Hall","Supersymmetric Yang-Mills and Supergravity Amplitudes at One Loop","46 pages, 2 figures, additional references and clarifications
  included","Phys.Rev.D80:045004,2009","10.1103/PhysRevD.80.045004",,"hep-th","http://arxiv.org/licenses/nonexclusive-distrib/1.0/","  By applying the known expressions for SYM and SUGRA tree amplitudes, we write
generating functions for the NNMHV box coefficients of SYM as well as the MHV,
NMHV, and NNMHV box coefficients for SUGRA. The all-multiplicity generating
functions utilize covariant, on-shell superspace whereby the contribution from
arbitrary external states in the supermultiplet can be extracted by Grassmann
operators. In support of the relation between dual Wilson loops and SYM
scattering amplitudes at weak coupling, the SYM amplitudes are presented in a
manifestly dual superconformal form. We introduce ordered box coefficients for
calculating SUGRA quadruple cuts and prove that ordered coefficients generate
physical cut amplitudes after summing over permutations of the external legs.
The ordered box coefficients are produced by sewing ordered subamplitudes,
previously used in applying on-shell recursion relations at tree level. We
describe our verification of the results against the literature, and a formula
for extracting the contributions from external gluons or gravitons to NNMHV
superamplitudes is presented.
","[{""version"":""v1"",""created"":""Mon, 1 Jun 2009 03:53:13 GMT""},{""version"":""v2"",""created"":""Fri, 19 Jun 2009 00:07:03 GMT""}]","2009-09-02"
"0906.0205","Forrest Sheng Bao","Yuanlin Zhang and Forrest Sheng Bao","A Survey of Tree Convex Sets Test","13 pages, 5 figures, 2 tables",,,,"cs.DS cs.CC","http://creativecommons.org/licenses/by-nc-sa/3.0/","  Tree convex sets refer to a collection of sets such that each set in the
collection is a subtree of a tree whose nodes are the elements of these sets.
They extend the concept of row convex sets each of which is an interval over a
total ordering of the elements of those sets. They have been applied to
identify tractable Constraint Satisfaction Problems and Combinatorial Auction
Problems. Recently, polynomial algorithms have been proposed to recognize tree
convex sets. In this paper, we review the materials that are the key to a
linear recognition algorithm.
","[{""version"":""v1"",""created"":""Mon, 1 Jun 2009 03:54:42 GMT""}]","2009-06-03"
"0906.0206","Vincent Sacksteder IV","Vincent E. Sacksteder IV","The Mechanism of Localization in Weakly Coupled Disordered Grains","Submitted to PRL",,,,"cond-mat.dis-nn cond-mat.stat-mech","http://arxiv.org/licenses/nonexclusive-distrib/1.0/","  It is shown that the Wegner model of disorder contains a system of
constraints which is important whenever the disorder is not weak and which is
responsible for localization in D > 2 dimensions. When the disorder is strong
the constraints divide the phase space into an exponentially large number of
domains; the localized phase is a glass. This work is based on recently
developed field theories which are exactly equivalent to the Wegner model and
to an easier variant.
","[{""version"":""v1"",""created"":""Mon, 1 Jun 2009 03:57:46 GMT""}]","2009-06-02"
"0906.0207","Vincent Sacksteder IV","Vincent E. Sacksteder IV","A Mathematically Controlled Alternative to the Supersymmetric Sigma
  Model of Disorder","Submitted to PRB. 32 pages",,,,"cond-mat.dis-nn cond-mat.mes-hall cond-mat.stat-mech","http://arxiv.org/licenses/nonexclusive-distrib/1.0/","  This paper shows how to obtain non-rigorous mathematical control over models
of loosely coupled disordered grains; it provides new information about saddle
point structure and perturbative corrections. Both the Wegner model and a
variant due to Disertori are transformed to matrix models which are similar to
the supersymmetric model of disorder, having two matrices $Q^f$ and $Q^b$ which
correspond to the two bosonic sectors of the SUSY matrix. However the Grassman
(fermionic) sector of the SUSY matrix is omitted, and compensated by a spectral
determinant. The transformation is exact for Disertori's model, while for the
Wegner model it involves an integral which can be approximated while
maintaining mathematical control. Previous derivations of sigma models of
disorder assumed a spatially uniform saddle point independent of the Goldstone
bosons and found that corrections are well controlled in the large $N$ limit.
This paper takes into account spatial fluctuations of the Goldstone bosons and
finds that corrections to the sigma model approximation in extended systems are
controlled by powers of the inverse conductance $1/g$. In the weak localization
regime Disertori's model exhibits remarkable simplifications and is completely
controlled by perturbative expansions in various small parameters. The Wegner
model might also be controlled. The standard weak localization results of the
supersymmetric sigma model, including anomalously localized states, are
reproduced and extended.
","[{""version"":""v1"",""created"":""Mon, 1 Jun 2009 04:16:37 GMT""}]","2009-06-02"
"0906.0208","Gordan Zitkovic","Gordan Zitkovic","An example of a stochastic equilibrium with incomplete markets",,,,,"q-fin.GN","http://arxiv.org/licenses/nonexclusive-distrib/1.0/","  We prove existence and uniqueness of stochastic equilibria in a class of
incomplete continuous-time financial environments where the market participants
are exponential utility maximizers with heterogeneous risk-aversion
coefficients and general Markovian random endowments. The incompleteness
featured in our setting - the source of which can be thought of as a credit
event or a catastrophe - is genuine in the sense that not only the prices, but
also the family of replicable claims itself is determined as a part of the
equilibrium. Consequently, equilibrium allocations are not necessarily Pareto
optimal and the related representative-agent techniques cannot be used.
Instead, we follow a novel route based on new stability results for a class of
semilinear partial differential equations related to the
Hamilton-Jacobi-Bellman equation for the agents' utility-maximization problems.
This approach leads to a reformulation of the problem where the Banach fixed
point theorem can be used not only to show existence and uniqueness, but also
to provide a simple and efficient numerical procedure for its computation.
","[{""version"":""v1"",""created"":""Mon, 1 Jun 2009 04:17:44 GMT""},{""version"":""v2"",""created"":""Tue, 1 Jun 2010 11:41:21 GMT""}]","2010-06-02"
"0906.0209","Francisco Colomer","Francisco Colomer","Maser Studies in Evolved Stars","Review talk, to be published in the proceedings of ""The 9th European
  VLBI Network Symposium on The role of VLBI in the Golden Age for Radio
  Astronomy and EVN Users Meeting"", September 23-26, 2008, Bologna, Italy;
  Proceedings of Science, eds Mantovani et al.; 8 pages",,,,"astro-ph.SR astro-ph.GA","http://arxiv.org/licenses/nonexclusive-distrib/1.0/","  High resolution maps of maser emission provide very detailed information on
processes occurring in circumstellar envelopes of late-type stars. A
particularly detailed picture of the innermost shells around AGB stars is
provided by SiO masers. Considerable progress is being made to provide
astrometrically aligned multi-transition simultaneous observations of these
masers, which are needed to better constrain the models. In view of the large
amount of high quality data available, models should now be developed to fully
explain all maser characteristics together (spatial distribution, variability,
etc). New generation instruments (VERA, VSOP-2), new observational techniques
(frequency-phase transfer), and new models promise important improvements of
our knowledge on this topic.
","[{""version"":""v1"",""created"":""Mon, 1 Jun 2009 04:28:22 GMT""}]","2009-06-02"
