"0906.0230","Kang Xian-Wei","Xian-Wei Kang, Hai-Bo Li and Gong-Ru Lu","Study of $\Lambda - \Lambdabar$ Oscillation in quantum coherent
  $\Lambda\Lambdabar$ state by using J/\psi \to \Lambda \bar{\Lambda}$ decay","4 pages, no figure, minor corrections to improve grammar, published
  in Phys.Rev.D as Rapid Communication.","Phys.Rev.D81:051901,2010","10.1103/PhysRevD.81.051901",,"hep-ph hep-ex","http://arxiv.org/licenses/nonexclusive-distrib/1.0/","  We discuss the possibility of searching for the $\Lam - \Lamb$ oscillations
for coherent $\Lam\Lamb$ production in the J/$\psi \to \Lam \Lamb$ decay
process. The sensitivity of measurement of $\Lam -\Lamb$ oscillation in the
external field at BES-III experiment is considered. These considerations
indicate an alternative way to probe the $\Delta B =2$ amplitude in addition to
neutron oscillation experiments. Both coherent and time-dependent information
can be used to extract the $\Lam-\Lamb$ oscillation parameter. With one year's
luminosity at BES-III, we can set an upper limit of $\delta m_{\Lam \Lamb} <
10^{-15}$ MeV at 90% confidence level, corresponding to about $10^{-6}$ s of
$\Lam-\Lamb$ oscillation time.
","[{""version"":""v1"",""created"":""Mon, 1 Jun 2009 08:04:06 GMT""},{""version"":""v2"",""created"":""Fri, 26 Feb 2010 01:06:10 GMT""},{""version"":""v3"",""created"":""Mon, 15 Mar 2010 15:36:59 GMT""}]","2010-04-29"
"0906.0231","Kimikazu Kato","Kimikazu Kato and Tikara Hosino","Solving $k$-Nearest Neighbor Problem on Multiple Graphics Processors","5 pages, 8 figures, 1 table",,,,"cs.IR cs.DS cs.NE","http://creativecommons.org/licenses/by/3.0/","  The recommendation system is a software system to predict customers' unknown
preferences from known preferences. In the recommendation system, customers'
preferences are encoded into vectors, and finding the nearest vectors to each
vector is an essential part. This vector-searching part of the problem is
called a $k$-nearest neighbor problem. We give an effective algorithm to solve
this problem on multiple graphics processor units (GPUs).
  Our algorithm consists of two parts: an $N$-body problem and a partial sort.
For a algorithm of the $N$-body problem, we applied the idea of a known
algorithm for the $N$-body problem in physics, although another trick is need
to overcome the problem of small sized shared memory. For the partial sort, we
give a novel GPU algorithm which is effective for small $k$. In our partial
sort algorithm, a heap is accessed in parallel by threads with a low cost of
synchronization. Both of these two parts of our algorithm utilize maximal power
of coalesced memory access, so that a full bandwidth is achieved.
  By an experiment, we show that when the size of the problem is large, an
implementation of the algorithm on two GPUs runs more than 330 times faster
than a single core implementation on a latest CPU. We also show that our
algorithm scales well with respect to the number of GPUs.
","[{""version"":""v1"",""created"":""Mon, 1 Jun 2009 08:14:13 GMT""},{""version"":""v2"",""created"":""Tue, 2 Jun 2009 06:48:21 GMT""},{""version"":""v3"",""created"":""Thu, 15 Jul 2010 02:23:22 GMT""}]","2010-07-16"
"0906.0232","Emiliano Sefusatti","Emiliano Sefusatti, Michele Liguori, Amit P. S. Yadav, Mark G.
  Jackson, Enrico Pajer","Constraining Running Non-Gaussianity","37 pages, 14 figures","JCAP 0912:022,2009","10.1088/1475-7516/2009/12/022","NORDITA-2009-34, FERMILAB-PUB-09-016-A-T","astro-ph.CO hep-th","http://arxiv.org/licenses/nonexclusive-distrib/1.0/","  The primordial non-Gaussian parameter fNL has been shown to be
scale-dependent in several models of inflation with a variable speed of sound.
Starting from a simple ansatz for a scale-dependent amplitude of the primordial
curvature bispectrum for two common phenomenological models of primordial
non-Gaussianity, we perform a Fisher matrix analysis of the bispectra of the
temperature and polarization of the Cosmic Microwave Background (CMB) radiation
and derive the expected constraints on the parameter nNG that quantifies the
running of fNL(k) for current and future CMB missions such as WMAP, Planck and
CMBPol. We find that CMB information alone, in the event of a significant
detection of the non-Gaussian component, corresponding to fNL = 50 for the
local model and fNL = 100 for the equilateral model of non-Gaussianity, is able
to determine nNG with a 1-sigma uncertainty of Delta nNG = 0.1 and Delta nNG =
0.3, respectively, for the Planck mission. In addition, we consider a Fisher
matrix analysis of the galaxy power spectrum to determine the expected
constraints on the running parameter nNG for the local model and of the galaxy
bispectrum for the equilateral model from future photometric and spectroscopic
surveys. We find that, in both cases, large-scale structure observations should
achieve results comparable to or even better than those from the CMB, while
showing some complementarity due to the different distribution of the
non-Gaussian signal over the relevant range of scales. Finally, we compare our
findings to the predictions on the amplitude and running of non-Gaussianity of
DBI inflation, showing how the constraints on a scale-dependent fNL(k)
translate into constraints on the parameter space of the theory.
","[{""version"":""v1"",""created"":""Mon, 1 Jun 2009 08:16:18 GMT""}]","2010-01-06"
"0906.0233","DaeKil Park","DaeKil Park, Jin-Woo Son, Seong-Keuck Cha, Eun Deock Seo","Effect of Decoherence in Ekert-Protocol","11 pages, 2 figures",,,,"quant-ph","http://arxiv.org/licenses/nonexclusive-distrib/1.0/","  We have examined the effect of the decoherence in the Ekert91 quantum
cryptographic protocol. In order to explore this issue we have introduced two
major decoherences, the depolarizing channel and the generalized amplitude
damping, between the singlet source and one of the legitimate users. It is
shown that the depolarizing channel disentangles the quantum channel more
easily than the generalized amplitude damping. This fact indicates that the
Ekert protocol is more robust to the generalized amplitude damping. We also
have computed the Bell inequality to check the robustness or weakness of the
Ekert91 protocol. Computation of the Bell inequality also confirms the
robustness of the Ekert91 protocol to the generalized amplitude damping
compared to the depolarizing channel.
","[{""version"":""v1"",""created"":""Mon, 1 Jun 2009 08:17:34 GMT""}]","2009-06-02"
"0906.0234","Hiromi Seta","Hiromi Seta, Naoki Isobe, Makoto S. Tashiro, Yuichi Yaji, Akira Arai,
  Masayuki Fukuhara, Kotaro Kohno, Koichiro Nakanishi, Mahito Sasada, Yoshito
  Shimajiri, Tomoka Tosaki, Makoto Uemura, and MAGIC collaboration","Suzaku and Multi-wavelength Observations of OJ 287 during the Periodic
  Optical Outburst in 2007","22 pages, 8 figures; accepted for publication in PASJ",,"10.1093/pasj/61.5.1011",,"astro-ph.CO astro-ph.HE","http://arxiv.org/licenses/nonexclusive-distrib/1.0/","  Suzaku observations of the blazar OJ 287 were performed in 2007 April 10--13
and November 7--9. They correspond to a quiescent and a flaring state,
respectively. The X-ray spectra can be well described with single power-law
models in both exposures. The derived X-ray photon index and the flux density
at 1 keV were found to be Gamma = 1.65 +- 0.02 and S_{1 keV} = 215 +- 5 nJy, in
the quiescent state. In the flaring state, the source exhibited a harder X-ray
spectrum (Gamma = 1.50 +- 0.01) with a nearly doubled X-ray flux density S_{1
keV} = 404^{+6}_{-5} nJy. Moreover, significant hard X-ray signals were
detected up to ~ 27 keV. In cooperation with the Suzaku, simultaneous radio,
optical, and very-high-energy gamma-ray observations were performed with the
Nobeyama Millimeter Array, the KANATA telescope, and the MAGIC telescope,
respectively. The radio and optical fluxes in the flaring state (3.04 +- 0.46
Jy and 8.93 +- 0.05 mJy at 86.75 Hz and in the V-band, respectively) were found
to be higher by a factor of 2--3 than those in the quiescent state (1.73 +-
0.26 Jy and 3.03 +- 0.01 mJy at 86.75 Hz and in the V-band, respectively). No
notable gamma-ray events were detected in either observation. The spectral
energy distribution indicated that the X-ray spectrum was dominated by inverse
Compton radiation in both observations, while synchrotron radiation exhibited a
spectral cutoff around the optical frequency. Furthermore, no significant
difference in the synchrotron cutoff frequency was found between the quiescent
and flaring states. According to a simple synchrotron self-Compton model, the
change of the spectral energy distribution is due to an increase in the energy
density of electrons with small changes of both the magnetic field strength and
the maximum Lorentz factor of electrons.
","[{""version"":""v1"",""created"":""Mon, 1 Jun 2009 08:29:05 GMT""}]","2015-05-13"
"0906.0235","Branislav Cvetkovi\'c","M. Blagojevi\'c, B. Cvetkovi\'c and O. Miskovi\'c","Nonlinear electrodynamics in 3D gravity with torsion","LATEX, 16 pages, v2: minor corrections","Phys.Rev.D80:024043,2009","10.1103/PhysRevD.80.024043",,"gr-qc hep-th","http://arxiv.org/licenses/nonexclusive-distrib/1.0/","  We study exact solutions of nonlinear electrodynamics coupled to
three-dimensional gravity with torsion. We show that in any static and
spherically symmetric configuration, at least one component of the
electromagnetic field has to vanish. In the electric sector of the theory, we
construct an exact solution, characterized by the azimuthal electric field.
When the electromagnetic action is modified by a topological mass term, we find
two types of the self-dual solutions.
","[{""version"":""v1"",""created"":""Mon, 1 Jun 2009 08:29:19 GMT""},{""version"":""v2"",""created"":""Fri, 7 Aug 2009 22:46:44 GMT""}]","2009-09-02"
"0906.0236","Bizhu Jiang","Richard Lieu, Bizhu Jiang","The nature of intrinsic fluctuations in cosmic diffuse radiation","16 pages, 3 figures, submitted to ApJ",,,,"astro-ph.CO","http://arxiv.org/licenses/nonexclusive-distrib/1.0/","  The spatial and temporal noise properties of diffuse radiation is
investigated in the context of the cosmic microwave background (CMB), although
generic formulae that enable application to any other forms of incoherent light
of a prescribed energy spectrum are also provided. It is shown that the
variance of fluctuations in the density and flux consists of two parts. First
is a term from the spontaneous emission coefficient which is the contribution
from a random gas of classical particles representing the corpuscular (photon)
nature of light. Second is a term from the stimulated emission coefficient
which leads to a `wave noise', or more precisely the noise arising from the
superposition of many plane waves of arbitrary phase - the normal modes of the
radiation. The origin of this second term has never been elucidated before. We
discussed one application. In the spatially homogeneous post-inflationary
epochs when the universe was reheated to GUT temperatures, the thermal CMB
density fluctuations on the horizon scale is of order the WMAP measured value
of 10$^{-5}$. Beyond (larger than) the horizon, the power spectrum of
perturbations could moreover assume the observed form of $P(k) \sim k$ if
thermal diffusion to equilibrium does not merely involve classical particles,
but also non-localized wave components. The outcome of our study clearly
demonstrates that such components do indeed exist.
","[{""version"":""v1"",""created"":""Mon, 1 Jun 2009 08:31:16 GMT""}]","2009-06-02"
"0906.0237","Thomas Roche","Thomas Roche and C\'edric Tavernier","Multi-Linear cryptanalysis in Power Analysis Attacks MLPA","16 pages",,,,"cs.CR","http://arxiv.org/licenses/nonexclusive-distrib/1.0/","  Power analysis attacks against embedded secret key cryptosystems are widely
studied since the seminal paper of Paul Kocher, Joshua Ja, and Benjamin Jun in
1998 where has been introduced the powerful Differential Power Analysis. The
strength of DPA is such that it became necessary to develop sound and efficient
countermeasures. Nowadays embedded cryptographic primitives usually integrate
one or several of these countermeasures (e.g. masking techniques, asynchronous
designs, balanced dynamic dual-rail gates designs, noise adding, power
consumption smoothing, etc. ...). This document presents a simple, yet
interesting, countermeasure to DPA and HO-DPA attacks, called brutal
countermeasure and new power analysis attacks using multi-linear approximations
(MLPA attacks) based on very recent and still unpublished results of Tavernier
et al..
","[{""version"":""v1"",""created"":""Mon, 1 Jun 2009 08:34:50 GMT""}]","2009-06-02"
"0906.0238","Beatrix Hiesmayr C.","B.C. Hiesmayr and M. Huber","Two distinct classes of bound entanglement: PPT-bound and
  `multi-particle'-bound","4 figures, 4 pages",,,,"quant-ph","http://arxiv.org/licenses/nonexclusive-distrib/1.0/","  We introduce systematically with the help of Weyl operators novel classes of
multipartite and multidimensional states which are all bound entangled for
arbitrary dimension. We find that the entanglement is bound due to different
reasons: unlockable due to the multi--particle nature and some states are in
addition bound due the fact being positive under partial transposition (PPT).
By a general construction (W simplices) we obtain classes of states which have
the same geometry concerning separability and entanglement independent of the
number of involved particle pairs. Moreover, we introduce a distillation
protocol and demonstrate for d=3 that for a certain set of states the
entanglement can be increased only up to a certain amount.
","[{""version"":""v1"",""created"":""Mon, 1 Jun 2009 08:52:55 GMT""}]","2009-06-02"
"0906.0239","Alessandro Ardizzoni","Alessandro Ardizzoni, Margaret Beattie, Claudia Menini","Cocycle deformations for Hopf algebras with a coalgebra projection","J. Algebra, to appear",,"10.1016/j.jalgebra.2010.04.027",,"math.QA math.RA","http://arxiv.org/licenses/nonexclusive-distrib/1.0/","  Let $H$ be a Hopf algebra over a field $K$ of characteristic $0$ and let $A$
be a bialgebra or Hopf algebra such that $H$ is isomorphic to a sub-Hopf
algebra of $A$ and there is an $H$-bilinear coalgebra projection $\pi$ from $A$
to $H$ which splits the inclusion. Then $A \cong R \#_\xi H$ where $R$ is the
pre-bialgebra of coinvariants. In this paper we study the deformations of $A$
by an $H$-bilinear cocycle. If $\gamma$ is a cocycle for $A$, then $\gamma$ can
be restricted to a cocycle $\gamma_R$ for $R$, and $A^\gamma \cong R^{\gamma_R}
\#_{\xi_\gamma} H$. As examples, we consider liftings of $\mathcal{B}(V) \#
K[\Gamma]$ where $\Gamma$ is a finite abelian group, $V$ is a quantum plane and
$\mathcal{B}(V)$ is its Nichols algebra, and explicitly construct the cocycle
which twists the Radford biproduct into the lifting.
","[{""version"":""v1"",""created"":""Mon, 1 Jun 2009 08:59:50 GMT""},{""version"":""v2"",""created"":""Mon, 22 Jun 2009 13:14:48 GMT""},{""version"":""v3"",""created"":""Tue, 18 May 2010 14:22:19 GMT""}]","2010-08-27"
"0906.0240","Svante Linusson","Sven Erick Alm, Svante Linusson","A counter-intuitive correlation in a random tournament","11 pages, improved exposition of Section 4",,,,"math.PR math.CO","http://arxiv.org/licenses/nonexclusive-distrib/1.0/","  Consider a randomly oriented graph $G=(V,E)$ and let $a$, $s$ and $b$ be
three distinct vertices in $V$. We study the correlation between the events
$\{a\to s\}$ and $\{s\to b\}$. We show that, when $G$ is the complete graph
$K_n$, the correlation is negative for $n=3$, zero for $n=4$, and that,
counter-intuitively, it is positive for $n\ge 5$. We also show that the
correlation is always negative when $G$ is a cycle, $C_n$, and negative or zero
when $G$ is a tree (or a forest).
","[{""version"":""v1"",""created"":""Mon, 1 Jun 2009 09:10:28 GMT""},{""version"":""v2"",""created"":""Fri, 4 Sep 2009 09:00:46 GMT""}]","2009-09-04"
"0906.0241","Miroslav Pardy","Miroslav Pardy","The impact force in the ballistic oscillator","7 pages",,,,"physics.class-ph","http://arxiv.org/licenses/nonexclusive-distrib/1.0/","  We determine the impact force generated by the projectile penetrating the
body of the harmonic oscillator. We discuss the ballistic effect in connection
with the Compton effect.
  Key words: Mathematical pendulum, physical pendulum, ballistic pendulum,
harmonic oscillator.
","[{""version"":""v1"",""created"":""Mon, 1 Jun 2009 09:13:46 GMT""}]","2009-06-02"
"0906.0242","Carmela Aruta","C. Aruta, G. Ghiringhelli, V. Bisogni, L. Braicovich, N.B. Brookes, A.
  Tebano and G. Balestrino","Orbital occupation, atomic moments and magnetic ordering at interfaces
  of manganite thin films","18 pages, 7 figures","Phys. Rev. B 80, (2009) 014431",,,"cond-mat.str-el cond-mat.mtrl-sci","http://arxiv.org/licenses/nonexclusive-distrib/1.0/","  We have performed x-ray linear and circular magnetic dichroism experiments at
the Mn L2,3-edge of the La0.7Sr0.3MnO3 ultra thin films. Our measurements show
that the antiferromagnetic (AF) insulating phase is stabilized by the
interfacial rearrangement of the Mn 3d orbitals, despite the relevant
magnetostriction anisotropic effect on the double-exchange ferromagnetic (FM)
metallic phase. As a consequence, the Mn atomic magnetic moment orientation and
how it reacts to strain differ in the FM and AF phases. In some cases a FM
insulating (FMI) phase adds to the AF and FM. Its peculiar magnetic properties
include in-plane magnetic anisotropy and partial release of the orbital moment
quenching. Nevertheless the FMI phase appears little coupled to the other ones.
","[{""version"":""v1"",""created"":""Mon, 1 Jun 2009 09:19:58 GMT""}]","2009-07-29"
"0906.0243","Hans J. Haubold","A.M. Mathai, H.J. Haubold","Functions of Mittag-Leffler and Fox: The Pathway Model to Tsallis
  Statistics and Beck-Cohen Superstatistics","9 pages, TeX",,,,"cond-mat.stat-mech math.CA","http://arxiv.org/licenses/nonexclusive-distrib/1.0/","  In reaction rate theory, in production-destruction type models and in
reaction-diffusion problems when the total derivatives are replaced by
fractional derivatives the solutions are obtained in terms of Mittag-Leffler
functions and their generalizations. When fractional calculus enters into the
picture the solutions of these problems, usually available in terms of
generalized hypergeometric functions, switch to Mittag-Leffler functions and
their generalizations into Wright functions and subsequently into Fox
functions. In this paper, connections are established among generalized
Mittag-Leffler functions, Mathai's pathway model, Tsallis statistics,
Beck-Cohen superstatistics, and among corresponding entropic measures. The
Mittag-Leffler function, for large values of the parameter, approaches a
power-law. For values of the parameter close to zero, the Mittag-Leffler
function behaves like a stretched exponential. The Mittag-Leffler function is a
generalization of the exponential function and represents a deviation from the
exponential paradigm whenever it shows up in solution of physical problems. The
paper elucidates the relation between analytic representations of the
q-exponential function that is fundamental to Tsallis statistics,
Mittag-Leffler, Wright, and Fox functions, respectively, utilizing
Mellin-Barnes integral representations.
","[{""version"":""v1"",""created"":""Mon, 1 Jun 2009 09:31:57 GMT""}]","2009-06-02"
"0906.0244","Mustapha Azreg-A\""inou","M. Azreg-A\""inou","A developed new algorithm for evaluating Adomian polynomials","18 pages, LaTeX; Typos corrected","CMES: Computer Modeling in Engineering & Sciences, 42 (1), pp.
  1-18 (2009)",,,"math.CA","http://arxiv.org/licenses/nonexclusive-distrib/1.0/","  Adomian polynomials (AP's) are expressed in terms of new objects called
reduced polynomials (RP's). These new objects, which carry two subscripts, are
independent of the form of the nonlinear operator. Apart from the well-known
two properties of AP's, curiously enough no further properties are discussed in
the literature. We derive and discuss in full detail the properties of the RP's
and AP's. We focus on the case where the nonlinear operator depends on one
variable and construct the most general analytical expressions of the RP's for
small values of the difference of their subscripts. It is shown that each RP
depends on a number of functions equal to the difference of its subscripts plus
one. These new properties lead to implement a dramatically simple and compact
Mathematica program for the derivation of individual RP's and AP's in their
general forms and provide useful hints for elegant hand calculations of AP's.
Application of the program is considered.
","[{""version"":""v1"",""created"":""Mon, 1 Jun 2009 09:36:06 GMT""},{""version"":""v2"",""created"":""Wed, 10 Jun 2009 09:05:35 GMT""}]","2009-06-10"
"0906.0245","Gereon Quick","Gereon Quick","Continuous group actions on profinite spaces","26 pages; revision of the proof of the main theorem; final version to
  appear in JPAA; this time with a new file uploaded, so this is v4",,,,"math.AT math.AG","http://arxiv.org/licenses/nonexclusive-distrib/1.0/","  For a profinite group, we construct a model structure on profinite spaces and
profinite spectra with a continuous action. This yields descent spectral
sequences for the homotopy groups of homotopy fixed point space and for stable
homotopy groups of homotopy orbit spaces. Our main example is the Galois action
on profinite \'etale topological types of varieties over a field. One
motivation is to understand Grothendieck's section conjecture in terms of
homotopy fixed points.
","[{""version"":""v1"",""created"":""Mon, 1 Jun 2009 09:39:01 GMT""},{""version"":""v2"",""created"":""Thu, 12 Nov 2009 10:15:09 GMT""},{""version"":""v3"",""created"":""Tue, 2 Mar 2010 16:02:37 GMT""},{""version"":""v4"",""created"":""Wed, 27 Oct 2010 06:32:22 GMT""},{""version"":""v5"",""created"":""Thu, 4 Nov 2010 22:32:54 GMT""}]","2010-11-08"
"0906.0246","Denis Khomitsky","D.V. Khomitsky","Current-voltage characteristics of tunable
  ferromagnet-silicon-ferromagnet channels in the spin blockade regime","10 pages, 4 figures",,,,"cond-mat.mes-hall cond-mat.mtrl-sci","http://arxiv.org/licenses/nonexclusive-distrib/1.0/","  The steady current-voltage characteristics of ferromagnet-silicon-ferromagnet
channels with tunable emitter and collector polarizations are investigated in
the presence of spin blockade generalizing the model developed by Pershin Yu V
and Di Ventra M (2008 {\it Phys. Rev.} B {\bf 77} 073301). The dependence of
the critical current on both collector and emitter polarizations is obtained
analytically. It is found that the current amplitude in the channel can be
effectively tuned by varying the difference between the collector and emitter
ferromagnet polarizations which allows to perform the magnetic manipulation of
the electrical current in wide class of both n- and p-doped, low- and
high-Ohmic semiconductor channels coupled to ferromagnetic leads.
","[{""version"":""v1"",""created"":""Mon, 1 Jun 2009 09:43:28 GMT""}]","2009-06-02"
"0906.0247","Albert Guill\'en i F\`abregas","Tung T. Kim and Albert Guillen i Fabregas","Coded Modulation with Mismatched CSIT over Block-Fading Channels","submitted to the IEEE Transactions on Information Theory. To be
  presented (in part) at the 2009 IEEE International Symposium on Information
  Theory, Seoul, South Korea, June-July 2009",,,,"cs.IT math.IT","http://arxiv.org/licenses/nonexclusive-distrib/1.0/","  Reliable communication over delay-constrained block-fading channels with
discrete inputs and mismatched (imperfect) channel state information at the
transmitter (CSIT) is studied. The CSIT mismatch is modeled as Gaussian random
variables, whose variances decay as a power of the signal-to-noise ratio (SNR).
A special focus is placed on the large-SNR decay of the outage probability when
power control with long-term power constraints is used. Without explicitly
characterizing the corresponding power allocation algorithms, we derive the
outage exponent as a function of the system parameters, including the CSIT
noise variance exponent and the exponent of the peak power constraint. It is
shown that CSIT, even if noisy, is always beneficial and leads to important
gains in terms of exponents. It is also shown that when multidimensional
rotations or precoders are used at the transmitter, further exponent gains can
be attained, but at the expense of larger decoding complexity.
","[{""version"":""v1"",""created"":""Mon, 1 Jun 2009 09:57:18 GMT""}]","2009-06-02"
