"0906.0248","Jason Kirk","D. Ward-Thompson (1), A.K. Sen (2), J.M. Kirk (1), D. Nutter (1) ((1)
  Cardiff University, United Kingdom, (2) Assam University, India)","Optical and submillimetre observations of Bok globules -- tracing the
  magnetic field from low to high density","8 pages, 3 figures, accepted for publication in MNRAS",,"10.1111/j.1365-2966.2009.15159.x",,"astro-ph.GA astro-ph.SR","http://arxiv.org/licenses/nonexclusive-distrib/1.0/","  We present optical and submillimetre polarimetry data of the Bok globule CB3
and optical polarimetry data of the Bok globule CB246. We use each set of
polarimetry data to infer the B-field orientation in each of the clouds. The
optical data can only be used in the low density, low extinction edge regions
of clouds. The submillimetre data can only be used in the high column-density,
central regions of the clouds.
  It has previously been found that near-infrared polarisation mapping of
background stars does not accurately trace the magnetic field in dense cloud
regions. This may be due to a lack of aligned grains in dense regions. We test
this by comparing the field orientations measured by our two independent
polarimetry methods. We find that the field orientation deduced from the
optical data matches up well with the orientation estimated from the
submillimetre data. We therefore claim that both methods are accurately tracing
the same magnetic field in CB3. Hence, in this case, there must be significant
numbers of aligned dust grains in the high density region, and they do indeed
trace the magnetic field in the submillimetre.
  We find an offset of 40$\pm$14 degrees between the magnetic field orientation
and the short axis of the globule. This is consistent with the mean value of
31$\pm$3 degrees found in our previous work on prestellar cores, even though
CB3 is a protostellar core. Taken together, the six prestellar cores that we
have now studied in this way show a mean offset between magnetic field
orientation and core short axis of $\sim30\pm$3 degrees, in apparent
contradiction with some models of magnetically dominated star formation.
","[{""version"":""v1"",""created"":""Mon, 1 Jun 2009 10:01:36 GMT""}]","2015-05-13"
"0906.0249","Arash Ghasemmehdi","Arash Ghasemmehdi and Erik Agrell","Faster Projection in Sphere Decoding",,"IEEE Transactions on Information Theory, vol. 57, no. 6, pp.
  3530-3536, June 2011","10.1109/TIT.2011.2143830",,"cs.IT math.IT","http://arxiv.org/licenses/nonexclusive-distrib/1.0/","  Most of the calculations in standard sphere decoders are redundant, in the
sense that they either calculate quantities that are never used or calculate
some quantities more than once. A new method, which is applicable to lattices
as well as finite constellations, is proposed to avoid these redundant
calculations while still returning the same result. Pseudocode is given to
facilitate immediate implementation. Simulations show that the speed gain with
the proposed method increases linearly with the lattice dimension. At dimension
60, the new algorithms avoid about 75% of all floating-point operations.
","[{""version"":""v1"",""created"":""Mon, 1 Jun 2009 10:13:14 GMT""},{""version"":""v2"",""created"":""Wed, 1 Dec 2010 21:36:03 GMT""}]","2015-01-07"
"0906.0250","Wei Zhang","Wei Zhang, L.-M. Duan","Tomography of correlation functions for ultracold atoms via
  time-of-flight images","7 pages, 4 figures","Phys. Rev. A 80, 063614 (2009)","10.1103/PhysRevA.80.063614",,"cond-mat.quant-gas cond-mat.stat-mech","http://arxiv.org/licenses/nonexclusive-distrib/1.0/","  We propose to utilize density distributions from a series of time-of-flight
images of an expanding cloud to reconstruct single-particle correlation
functions of trapped ultra-cold atoms. In particular, we show how this
technique can be used to detect off-diagonal correlations of atoms in a
quasi-one-dimensional trap, where both real- and momentum- space correlations
are extracted at a quantitative level. The feasibility of this method is
analyzed with specific examples, taking into account finite temporal and
spatial resolutions in experiments.
","[{""version"":""v1"",""created"":""Mon, 1 Jun 2009 10:21:02 GMT""}]","2011-12-05"
"0906.0251","Arto Annila","Peter Wurtz and Arto Annila","Roots of diversity relations","10, 3 figures","Journal of Biophysics 2008, Article ID 654672","10.1155/2008/654672",,"q-bio.PE","http://arxiv.org/licenses/nonexclusive-distrib/1.0/","  The species-area relationship is one of the central generalizations in
ecology however its origin has remained a puzzle. Since ecosystems are
understood as energy transduction systems, the regularities in species richness
are considered to result from ubiquitous imperatives in energy transduction.
  From a thermodynamic point of view, organisms are transduction mechanisms
that distribute an influx of energy down along the steepest gradients to the
ecosystem's diverse repositories of chemical energy, i.e., populations of
species. Transduction machineries, i.e. ecosystems assembled from numerous
species, may emerge and evolve toward high efficiency on large areas that hold
more matter than small ones. This results in the well-known logistic-like
relationship between the area and the number of species. The species-area
relationship is understood, in terms of thermodynamics, to be the skewed
cumulative curve of chemical energy distribution that is commonly known as the
species-abundance relationship.
","[{""version"":""v1"",""created"":""Mon, 1 Jun 2009 10:22:08 GMT""}]","2009-06-02"
"0906.0252","Jeong Hoon Lee","Jeong-Hoon Lee, Kyu-Young Whang, Hyo-Sang Lim, Byung-Suk Lee, and
  Jun-Seok Heo","Progressive Processing of Continuous Range Queries in Hierarchical
  Wireless Sensor Networks","41 pages, 20 figures",,"10.1587/transinf.E93.D.1832",,"cs.DB","http://arxiv.org/licenses/nonexclusive-distrib/1.0/","  In this paper, we study the problem of processing continuous range queries in
a hierarchical wireless sensor network. Contrasted with the traditional
approach of building networks in a ""flat"" structure using sensor devices of the
same capability, the hierarchical approach deploys devices of higher capability
in a higher tier, i.e., a tier closer to the server. While query processing in
flat sensor networks has been widely studied, the study on query processing in
hierarchical sensor networks has been inadequate. In wireless sensor networks,
the main costs that should be considered are the energy for sending data and
the storage for storing queries. There is a trade-off between these two costs.
Based on this, we first propose a progressive processing method that
effectively processes a large number of continuous range queries in
hierarchical sensor networks. The proposed method uses the query merging
technique proposed by Xiang et al. as the basis and additionally considers the
trade-off between the two costs. More specifically, it works toward reducing
the storage cost at lower-tier nodes by merging more queries, and toward
reducing the energy cost at higher-tier nodes by merging fewer queries (thereby
reducing ""false alarms""). We then present how to build a hierarchical sensor
network that is optimal with respect to the weighted sum of the two costs. It
allows for a cost-based systematic control of the trade-off based on the
relative importance between the storage and energy in a given network
environment and application. Experimental results show that the proposed method
achieves a near-optimal control between the storage and energy and reduces the
cost by 0.989~84.995 times compared with the cost achieved using the flat
(i.e., non-hierarchical) setup as in the work by Xiang et al.
","[{""version"":""v1"",""created"":""Mon, 1 Jun 2009 11:04:04 GMT""}]","2015-05-13"
"0906.0254","Arto Annila","Salla Jaakkola, Vivek Sharma, Arto Annila","Cause of Chirality Consensus","8 pages, 2 figures","Current Chemical Biology, 2008, 2, 153-158","10.2174/187231308784220536",,"q-bio.PE q-bio.BM","http://arxiv.org/licenses/nonexclusive-distrib/1.0/","  Biological macromolecules, proteins and nucleic acids are composed
exclusively of chirally pure monomers. The chirality consensus appears vital
for life and it has even been considered as a prerequisite of life. However the
primary cause for the ubiquitous handedness has remained obscure. We propose
that the chirality consensus is a kinetic consequence that follows from the
principle of increasing entropy, i.e. the 2nd law of thermodynamics. Entropy
increases when an open system evolves by decreasing gradients in free energy
with more and more efficient mechanisms of energy transduction. The rate of
entropy increase is the universal fitness criterion of natural selection that
favors diverse functional molecules and drives the system to the chirality
consensus to attain and maintain high-entropy non-equilibrium states.
","[{""version"":""v1"",""created"":""Mon, 1 Jun 2009 10:30:35 GMT""}]","2009-06-02"
"0906.0255","Tommaso Spadaro","T. Spadaro","K->e nu decays and lepton flavor violation searches with Kaons","Contributed to Heavy Quarks and Leptons, Melbourne, Australia, 5-9
  Jun 2008",,,,"hep-ex","http://arxiv.org/licenses/nonexclusive-distrib/1.0/","  Recent Kaon decay studies seeking lepton-flavor violating (LFV) new-physics
effects are briefly discussed. The main focus is set on precise measurements of
rare or not-so-rare decays aiming at finding evidence of deviations from the SM
prediction rather than on the results from direct searches of LFV transitions
forbidden or ultra-rare in the SM.
","[{""version"":""v1"",""created"":""Mon, 1 Jun 2009 10:38:47 GMT""}]","2009-06-02"
"0906.0256","Alexander Derbin","A.V. Derbin, A.I. Egorov, I.A. Mitropol'sky, V.N. Muratova, D.A.
  Semenov, E.V. Unzhakov","Search for Resonant Absorption of Solar Axions Emitted in M1 Transition
  in $^{57}$Fe Nuclei","5 pages, 3 figures","Eur.Phys.J.C62:755-760,2009","10.1140/epjc/s10052-009-1095-y",,"hep-ex hep-ph","http://arxiv.org/licenses/nonexclusive-distrib/1.0/","  A search for resonant absorbtion of 14.4 keV solar axions by $^{57}$Fe target
was performed. The Si(Li) detector placed inside the low-background setup was
used to detect the $\gamma$-quanta appearing in the deexcitation of 14.4 keV
nuclear level: $A+\rm{^{57}Fe} \to \rm{^{57}Fe^{*}} \to \rm{^{57}Fe} + \gamma$.
The new upper limit for the hadronic axion mass have been obtained: $m_{A} \leq
151$ eV (90% C.L.) ($S$=0.5, $z$=0.56).
","[{""version"":""v1"",""created"":""Mon, 1 Jun 2009 10:44:25 GMT""}]","2009-08-24"
"0906.0257","Vladimir Dobrev","N. Aizawa, V.K. Dobrev","Intertwining Operator Realization of Non-Relativistic Holography","15 pages, LATEX; Published version","Nucl.Phys.B828:581-593,2010","10.1016/j.nuclphysb.2009.10.019",,"hep-th","http://arxiv.org/licenses/nonexclusive-distrib/1.0/","  We give a group-theoretic interpretation of non-relativistic holography as
equivalence between representations of the Schrodinger algebra describing bulk
fields and boundary fields. Our main result is the explicit construction of the
boundary-to-bulk operators in the framework of representation theory (without
specifying any action). Further we show that these operators and the
bulk-to-boundary operators are intertwining operators. In analogy to the
relativistic case, we show that each bulk field has two boundary fields with
conjugated conformal weights. These fields are related by another intertwining
operator given by a two-point function on the boundary. Analogously to the
relativistic result of Klebanov-Witten we give the conditions when both
boundary fields are physical. Finally, we recover in our formalism earlier
non-relativistic results for scalar fields by Son and others.
","[{""version"":""v1"",""created"":""Mon, 1 Jun 2009 10:48:44 GMT""},{""version"":""v2"",""created"":""Mon, 8 Jun 2009 12:17:34 GMT""},{""version"":""v3"",""created"":""Fri, 25 Dec 2009 02:08:31 GMT""}]","2010-01-06"
"0906.0258","Brijesh Kumar","Rakesh Kumar, Dushyant Kumar, and Brijesh Kumar","Honeycomb antiferromagnet with a triply degenerate dimer ground state","6+ pages, 10 figures, submitted to Phys. Rev. B","Phys. Rev. B 80, 214428 (2009)","10.1103/PhysRevB.80.214428",,"cond-mat.str-el","http://arxiv.org/licenses/nonexclusive-distrib/1.0/","  We present an antiferromagnetic quantum spin-1/2 model on honeycomb lattice.
It has two parts, one of which is the usual nearest-neighbor Heisenberg model.
The other part is a certain multiple spin interaction term, introduced by us,
which is exactly solvable for the ground state. Without the Heisenberg part,
the model has an exact threefold degenerate dimer ground state. This exact
ground state is also noted to exist for the general spin-S case. For the
spin-1/2 case, we further carry out the triplon analysis in the ground state,
to study the competition between the Heisenberg and the multiple spin
interactions. This approximate calculation exhibits a continuous quantum phase
transition from the dimer order to N\'eel order.
","[{""version"":""v1"",""created"":""Mon, 1 Jun 2009 10:49:42 GMT""}]","2015-05-13"
"0906.0259","Ioannis Kontoyiannis","Ioannis Kontoyiannis, Sean P. Meyn","Approximating a Diffusion by a Hidden Markov Model","28 pages",,,,"math.PR","http://arxiv.org/licenses/nonexclusive-distrib/1.0/","  For a wide class of continuous-time Markov processes, including all
irreducible hypoelliptic diffusions evolving on an open, connected subset of
$\RL^d$, the following are shown to be equivalent: (i) The process satisfies (a
slightly weaker version of) the classical Donsker-Varadhan conditions; (ii) The
transition semigroup of the process can be approximated by a finite-state
hidden Markov model, in a strong sense in terms of an associated operator norm;
(iii) The resolvent kernel of the process is `$v$-separable', that is, it can
be approximated arbitrarily well in operator norm by finite-rank kernels. Under
any (hence all) of the above conditions, the Markov process is shown to have a
purely discrete spectrum on a naturally associated weighted $L_\infty$ space.
","[{""version"":""v1"",""created"":""Mon, 1 Jun 2009 10:53:28 GMT""},{""version"":""v2"",""created"":""Mon, 25 Apr 2016 20:59:26 GMT""}]","2016-04-27"
"0906.0260","Ian Morris","Ian D. Morris","A rapidly-converging lower bound for the joint spectral radius via
  multiplicative ergodic theory",,,,,"math.DS math.NA","http://arxiv.org/licenses/nonexclusive-distrib/1.0/","  We use ergodic theory to prove a quantitative version of a theorem of M. A.
Berger and Y. Wang, which relates the joint spectral radius of a set of
matrices to the spectral radii of finite products of those matrices. The proof
rests on a theorem asserting the existence of a continuous invariant splitting
for certain matrix cocycles defined over a minimal homeomorphism and having the
property that all forward products are uniformly bounded.
","[{""version"":""v1"",""created"":""Mon, 1 Jun 2009 11:01:24 GMT""}]","2009-06-02"
"0906.0261","Oscar Varela","Eoin 'O Colgain, Oscar Varela and Hossein Yavartanoo","Non-relativistic M-Theory solutions based on Kaehler-Einstein spaces","1+12 pages. v2: minor typos corrected. v3: Minor typos corrected and
  some more details given in section 3. To appear in JHEP","JHEP 0907:081,2009","10.1088/1126-6708/2009/07/081","AEI-2009-052, KIAS-P09035","hep-th","http://arxiv.org/licenses/nonexclusive-distrib/1.0/","  We present new families of non-supersymmetric solutions of D=11 supergravity
with non-relativistic symmetry, based on six-dimensional Kaehler-Einstein
manifolds. In constructing these solutions, we make use of a consistent
reduction to a five-dimensional gravity theory coupled to a massive scalar and
vector field. This theory admits a non-relativistic CFT dual with dynamical
exponent z=4, which may be uplifted to D=11 supergravity. Finally, we
generalise this solution and find new solutions with various z, including z=2.
","[{""version"":""v1"",""created"":""Mon, 1 Jun 2009 11:05:02 GMT""},{""version"":""v2"",""created"":""Tue, 2 Jun 2009 14:03:16 GMT""},{""version"":""v3"",""created"":""Tue, 21 Jul 2009 20:43:14 GMT""}]","2014-11-20"
"0906.0262","Senthilkumar Vijayan","D. V. Senthilkumar, J. Kurths and M. Lakshmanan","Stability of synchronization in coupled time-delay systems using
  Krasovskii-Lyapunov theory","Accepted for Publication in Physical Review E",,"10.1103/PhysRevE.79.066208",,"nlin.CD","http://arxiv.org/licenses/nonexclusive-distrib/1.0/","  Stability of synchronization in unidirectionally coupled time-delay systems
is studied using the Krasovskii-Lyapunov theory. We have shown that the same
general stability condition is valid for different cases, even for the general
situation (but with a constraint) where all the coefficients of the error
equation corresponding to the synchronization manifold are time-dependent.
These analytical results are also confirmed by numerical simulation of
paradigmatic examples.
","[{""version"":""v1"",""created"":""Mon, 1 Jun 2009 11:20:03 GMT""}]","2015-05-13"
"0906.0263","Oksana Chubykalo-Fesenko","R.Yanes, R.Rozada, F.Garcia-Sanchez, O.Chubykalo-Fesenko, P.Martin
  Pimentel, B.Leven, B.Hillebrands","Modeling of microwave-assisted switching in micron-sized magnetic
  ellipsoids",,,"10.1103/PhysRevB.79.224427",,"cond-mat.mtrl-sci","http://arxiv.org/licenses/nonexclusive-distrib/1.0/","  The microwave assisted magnetisation reversal is modelled in a permalloy
micron-sized magnetic ellipsoid. Our simulations confirm that this process
requires less field than magnetisation reversal under a static field. This is
due to a different reversal mode which in case of the microwave-assisted
process is always a ripple structure. During the magnetisation reversal two
stages: nucleation and relaxation are distinguished. The nucleation process is
governed by spinwave instabilities. The relaxation process is related to the
domain expansion through domain wall propagation determined by the precessional
motion of magnetic moments in the center of the domain walls. As a consequence,
the switching time is a complex oscillating function of the microwave
frequency.
","[{""version"":""v1"",""created"":""Mon, 1 Jun 2009 12:22:48 GMT""}]","2015-05-13"
"0906.0264","Umpei Miyamoto","Gary W. Gibbons, Kei-ichi Maeda, Umpei Miyamoto","The Bernstein Conjecture, Minimal Cones, and Critical Dimensions","19 pages, no figure; v2: comments added in footnote 1 and 2","Class.Quant.Grav.26:185008,2009","10.1088/0264-9381/26/18/185008","DAMTP-2009-43, WU-AP/300/09","hep-th gr-qc","http://arxiv.org/licenses/nonexclusive-distrib/1.0/","  Minimal surfaces and domain walls play important roles in various contexts of
spacetime physics as well as material science. In this paper, we first review
the Bernstein conjecture, which asserts that a plane is the only globally well
defined solution of the minimal surface equation which is a single valued graph
over a hyperplane in flat spaces, and its failure in higher dimensions. Then,
we review how minimal cones in four- and higher-dimensional spacetimes, which
are curved and even singular at the apex, may be used to provide
counterexamples to the conjecture. The physical implications of these
counterexamples in curved spacetimes are discussed from various points of view,
ranging from classical general relativity, brane physics, and holographic
models of fundamental interactions.
","[{""version"":""v1"",""created"":""Mon, 1 Jun 2009 12:09:14 GMT""},{""version"":""v2"",""created"":""Sun, 2 Aug 2009 22:08:00 GMT""}]","2009-09-28"
"0906.0265","Myungho Kim","Dimitar Grantcharov, Ji Hye Jung, Seok-Jin Kang, Myungho Kim","Highest weight modules over quantum queer Lie superalgebra U_q(q(n))","Definition 1.5 and Definition 6.1 are changed, and a remark is added
  in the new version",,"10.1007/s00220-009-0962-6",,"math.RT math.QA","http://arxiv.org/licenses/nonexclusive-distrib/1.0/","  In this paper, we investigate the structure of highest weight modules over
the quantum queer superalgebra $U_q(q(n))$. The key ingredients are the
triangular decomposition of $U_q(q(n))$ and the classification of finite
dimensional irreducible modules over quantum Clifford superalgebras. The main
results we prove are the classical limit theorem and the complete reducibility
theorem for $U_q(q(n))$-modules in the category $O_q^{\geq 0}$.
","[{""version"":""v1"",""created"":""Mon, 1 Jun 2009 12:00:00 GMT""},{""version"":""v2"",""created"":""Thu, 24 Dec 2009 10:07:16 GMT""},{""version"":""v3"",""created"":""Sun, 9 Jan 2011 14:47:33 GMT""}]","2021-03-24"
"0906.0266","Alexei Voronin","O.D. Dalkarov, P.A. Khakhulin, A.Yu. Voronin","On the electromagnetic form factors of hadrons in the time-like region
  near threshold","17 pages 6 figures","Nucl.Phys.A833:104-118,2010","10.1016/j.nuclphysa.2009.11.015",,"nucl-th","http://arxiv.org/licenses/nonexclusive-distrib/1.0/","  Hadron electromagnetic form factor in the time-like region at the boundary of
the physical region is considered. The energy behavior of the form factor is
shown to be determined by the strong hadron-antihadron interaction. Imaginary
parts of the scattering lengths for $p\bar{p}$, $\Lambda\bar{\Lambda}$,
$\Lambda\bar{\Sigma}^0 (\bar{\Lambda}{\Sigma}^0)$ and
${\Sigma}^0\bar{\Sigma}^0$ are estimated. Developed approach enables us to
estimate imaginary part of the scattering volume from $D^*\bar{D^*}$
experimental data. The form factor energy behavior away from the threshold is
obtained within a semiphenomenological model of hadron-antihadron interaction.
","[{""version"":""v1"",""created"":""Mon, 1 Jun 2009 14:24:14 GMT""}]","2010-01-26"
"0906.0267","Pierre Le Doussal","Pierre Le Doussal","Sinai model in presence of dilute absorbers","21 pages, 2 figures",,"10.1088/1742-5468/2009/07/P07032",,"cond-mat.dis-nn cond-mat.stat-mech","http://arxiv.org/licenses/nonexclusive-distrib/1.0/","  We study the Sinai model for the diffusion of a particle in a one dimension
random potential in presence of a small concentration $\rho$ of perfect
absorbers using the asymptotically exact real space renormalization method. We
compute the survival probability, the averaged diffusion front and return
probability, the two particle meeting probability, the distribution of total
distance traveled before absorption and the averaged Green's function of the
associated Schrodinger operator. Our work confirms some recent results of
Texier and Hagendorf obtained by Dyson-Schmidt methods, and extends them to
other observables and in presence of a drift. In particular the power law
density of states is found to hold in all cases. Irrespective of the drift, the
asymptotic rescaled diffusion front of surviving particles is found to be a
symmetric step distribution, uniform for $|x| < {1/2} \xi(t)$, where $\xi(t)$
is a new, survival length scale ($\xi(t)=T \ln t/\sqrt{\rho}$ in the absence of
drift). Survival outside this sharp region is found to decay with a larger
exponent, continuously varying with the rescaled distance $x/\xi(t)$. A simple
physical picture based on a saddle point is given, and universality is
discussed.
","[{""version"":""v1"",""created"":""Mon, 1 Jun 2009 12:08:05 GMT""}]","2015-05-13"
"0906.0268","Vincent N\'elis","Vincent Nelis and Joel Goossens","MORA: an Energy-Aware Slack Reclamation Scheme for Scheduling Sporadic
  Real-Time Tasks upon Multiprocessor Platforms","11 pages",,,,"cs.OS","http://arxiv.org/licenses/nonexclusive-distrib/1.0/","  In this paper, we address the global and preemptive energy-aware scheduling
problem of sporadic constrained-deadline tasks on DVFS-identical multiprocessor
platforms. We propose an online slack reclamation scheme which profits from the
discrepancy between the worst- and actual-case execution time of the tasks by
slowing down the speed of the processors in order to save energy. Our algorithm
called MORA takes into account the application-specific consumption profile of
the tasks. We demonstrate that MORA does not jeopardize the system
schedulability and we show by performing simulations that it can save up to 32%
of energy (in average) compared to execution without using any energy-aware
algorithm.
","[{""version"":""v1"",""created"":""Mon, 1 Jun 2009 12:10:10 GMT""}]","2009-06-02"
"0906.0269","Ioannis Deretzis","A. La Magna, I. Deretzis, V. Privitera","Insulator-metal transition in biased finite polyyne systems","to appear at EPJB","Eur. Phys. J. B 70, 311-316 (2009)","10.1140/epjb/e2009-00220-6",,"cond-mat.mes-hall cond-mat.mtrl-sci","http://arxiv.org/licenses/nonexclusive-distrib/1.0/","  A method for the study of the electronic transport in strongly coupled
electron-phonon systems is formalized and applied to a model of polyyne chains
biased through metallic Au leads. We derive a stationary non equilibrium
polaronic theory in the general framework of a variational formulation. The
numerical procedure we propose can be readily applied if the electron-phonon
interaction in the device hamiltonian can be approximated as an effective
single particle electron hamiltonian. Using this approach, we predict that
finite polyyne chains should manifest an insulator-metal transition driven by
the non-equilibrium charging which inhibits the Peierls instability
characterizing the equilibrium state.
","[{""version"":""v1"",""created"":""Mon, 1 Jun 2009 12:12:28 GMT""}]","2009-09-09"
