"0906.5027","Kenta Esaki","Kenta Esaki, Masatoshi Sato, Mahito Kohmoto, and Bertrand I. Halperin","Zero modes, energy gap, and edge states of anisotropic honeycomb lattice
  in a magnetic field","36 pages, 20 figures; added discussion on experiments in Sec.VI,
  cited Refs.[35]-[40], and reworded Sec.IV D","Phys. Rev. B 80, 125405 (2009)","10.1103/PhysRevB.80.125405",,"cond-mat.mes-hall","http://arxiv.org/licenses/nonexclusive-distrib/1.0/","  We present systematic study of zero modes and gaps by introducing effects of
anisotropy of hopping integrals for a tight-binding model on the honeycomb
lattice in a magnetic field. The condition for the existence of zero modes is
analytically derived. From the condition, it is found that a tiny anisotropy
for graphene is sufficient to open a gap around zero energy in a magnetic
field. This gap behaves as a non-perturbative and exponential form as a
function of the magnetic field. The non-analytic behavior with respect to the
magnetic field can be understood as tunneling effects between energy levels
around two Dirac zero modes appearing in the honeycomb lattice, and an explicit
form of the gap around zero energy is obtained by the WKB method near the
merging point of these Dirac zero modes. Effects of the anisotropy for the
honeycomb lattices with boundaries are also studied. The condition for the
existence of zero energy edge states in a magnetic field is analytically
derived. On the basis of the condition, it is recognized that anisotropy of the
hopping integrals induces abrupt changes of the number of zero energy edge
states, which depend on the shapes of the edges sensitively.
","[{""version"":""v1"",""created"":""Mon, 29 Jun 2009 05:42:33 GMT""},{""version"":""v2"",""created"":""Mon, 10 Aug 2009 05:24:57 GMT""}]","2009-09-10"
"0906.5062","Simant Dube","Simant Dube","Geometrical Interpretation of the Master Theorem for Divide-and-conquer
  Recurrences","11 pages, 6 figures",,,,"cs.DS","http://arxiv.org/licenses/nonexclusive-distrib/1.0/","  We provide geometrical interpretation of the Master Theorem to solve
divide-and-conquer recurrences. We show how different cases of the recurrences
correspond to different kinds of fractal images. Fractal dimension and
Hausdorff measure are shown to be closely related to the solution of such
recurrences.
","[{""version"":""v1"",""created"":""Mon, 29 Jun 2009 04:43:17 GMT""},{""version"":""v2"",""created"":""Wed, 1 Jul 2009 10:34:53 GMT""}]","2016-09-08"
"0906.5065","Aoife Bharucha","Patricia Ball and Aoife Bharucha","Constraining New Physics in B-->pi+pi- with Reparametrization Invariance
  and QCD Factorization","8 pages, 2 figures","Phys.Lett.B681:264-268,2009","10.1016/j.physletb.2009.10.022","IPPP/08/29, DCPT/08/58","hep-ph","http://arxiv.org/licenses/nonexclusive-distrib/1.0/","  Usually, B->pi+pi- decays are expressed in terms of weak amplitudes
explicitly dependent on the CKM weak phase alpha or gamma. In this letter, we
show that the weak amplitudes can be rewritten such that a manifest dependence
on beta emerges instead. Based on this, we constrain new-physics contributions
to the CP-violating phase phi_d in B_0 anti-B_0 mixing. Further, we apply
reparametrization invariance and use QCD factorization predictions to
investigate the bounds on an additional new-physics amplitude in B->pi+pi-.
","[{""version"":""v1"",""created"":""Mon, 29 Jun 2009 14:12:33 GMT""}]","2009-11-05"
"0906.5069","Shinji Mukohyama","Shinji Mukohyama","Caustic avoidance in Horava-Lifshitz gravity","19 pages; extended to general z \geq 3, typos corrected (v2); version
  accepted for publication in JCAP (v3)","JCAP 0909:005,2009","10.1088/1475-7516/2009/09/005","IPMU09-0081","hep-th astro-ph.CO gr-qc hep-ph","http://arxiv.org/licenses/nonexclusive-distrib/1.0/","  There are at least four versions of Horava-Lishitz gravity in the literature.
We consider the version without the detailed balance condition with the
projectability condition and address one aspect of the theory: avoidance of
caustics for constant time hypersurfaces. We show that there is no caustic with
plane symmetry in the absence of matter source if \lambda\ne 1. If \lambda=1 is
a stable IR fixed point of the renormalization group flow then \lambda is
expected to deviate from 1 near would-be caustics, where the extrinsic
curvature increases and high-energy corrections become important. Therefore,
the absence of caustics with \lambda\ne 1 implies that caustics cannot form
with this symmetry in the absence of matter source. We argue that inclusion of
matter source will not change the conclusion. We also argue that caustics with
codimension higher than one will not form because of repulsive gravity
generated by nonlinear higher curvature terms. These arguments support our
conjecture that there is no caustic for constant time hypersurfaces. Finally,
we discuss implications to the recently proposed scenario of ``dark matter as
integration constant''.
","[{""version"":""v1"",""created"":""Mon, 29 Jun 2009 02:55:17 GMT""},{""version"":""v2"",""created"":""Thu, 2 Jul 2009 19:13:47 GMT""},{""version"":""v3"",""created"":""Sun, 16 Aug 2009 01:40:10 GMT""}]","2009-09-28"
"0906.5091","Partha Goswami","Partha Goswami","On Nernst effect and quantum oscillations in NCCO","11 pages, 10 figures",,,,"cond-mat.supr-con","http://arxiv.org/licenses/nonexclusive-distrib/1.0/","  We start with a mean field Hamiltonian in momentum space for NCCO to
investigate the magnetic quantum oscillations (MQO) exhibited by this system in
the normal state. We first obtain an expression for the entropy of the system
which is useful to explain the Nernst effect. We next derive the density of
states at Fermi energy and the longitudinal electrical conductivity expression
to explore the possibility of MQO. We find that the slow (1/B)-oscillations,
with frequency nearly 330 T, arise from the hole pockets at the optimal doping.
The faster oscillations at slightly higher doping level is found to have the
frequency nearly equal to 900 T.
","[{""version"":""v1"",""created"":""Mon, 29 Jun 2009 14:22:51 GMT""}]","2009-06-30"
"0906.5103","Carlo Morpurgo","Luigi Fontana, Carlo Morpurgo","Adams inequalities on measure spaces","To appear in Advances in Mathematics. 54 Pages, minor changes and
  corrections in v2 (page 1, proof of Corollary 13, some typos). In v3 the more
  relevant changes/corrections were made on pages 9, 10, 27, 32, 34, 36, 40,
  41, 47. Minor corrections in v4",,,,"math.AP","http://arxiv.org/licenses/nonexclusive-distrib/1.0/","  In 1988 Adams obtained sharp Moser-Trudinger inequalities on bounded domains
of R^n. The main step was a sharp exponential integral inequality for
convolutions with the Riesz potential. In this paper we extend and improve
Adams' results to functions defined on arbitrary measure spaces with finite
measure. The Riesz fractional integral is replaced by general integral
operators, whose kernels satisfy suitable and explicit growth conditions, given
in terms of their distribution functions; natural conditions for sharpness are
also given. Most of the known results about Moser-Trudinger inequalities can be
easily adapted to our unified scheme. We give some new applications of our
theorems, including: sharp higher order Moser-Trudinger trace inequalities,
sharp Adams/Moser-Trudinger inequalities for general elliptic differential
operators (scalar and vector-valued), for sums of weighted potentials, and for
operators in the CR setting.
","[{""version"":""v1"",""created"":""Mon, 29 Jun 2009 07:53:22 GMT""},{""version"":""v2"",""created"":""Sat, 8 Aug 2009 10:53:09 GMT""},{""version"":""v3"",""created"":""Thu, 8 Jul 2010 14:14:10 GMT""},{""version"":""v4"",""created"":""Sat, 22 Jan 2011 23:11:15 GMT""}]","2011-01-25"
"0906.5104","Hans Christian Schneider","Michael Krauss, Tobias Roth, Sabine Alebrand, Daniel Steil, Mirko
  Cinchetti, Martin Aeschlimann, Hans Christian Schneider","Ultrafast demagnetization of ferromagnetic transition metals: The role
  of the Coulomb interaction","6 pages, 3 figures",,"10.1103/PhysRevB.80.180407",,"cond-mat.mtrl-sci cond-mat.other","http://arxiv.org/licenses/nonexclusive-distrib/1.0/","  The Elliott-Yafet mechanism is arguably the most promising candidate to
explain the ultrafast demagnetization dynamics in ferromagnetic transition
metals on timescales on the order of 100 femtoseconds. So far, only
electron-phonon scattering has been analyzed as the scattering process needed
to account for the demagnetization due to the Elliott-Yafet mechanism. We show
for the first time that the electron-electron scattering contribution to the
Elliott-Yafet mechanism has the potential to explain time-resolved
magneto-optical Kerr effect measurements on thin magnetic cobalt and nickel
films, without reference to a phononic ""spin bath.""
","[{""version"":""v1"",""created"":""Sun, 28 Jun 2009 20:25:19 GMT""}]","2015-05-13"
"0906.5106","Shmuel Onn","Raymond Hemmecke, Shmuel Onn, Robert Weismantel","Multicommodity Flow in Polynomial Time",,"Optimization Letters, 5:13--25, 2011",,,"math.CO cs.DM cs.DS math.OC","http://arxiv.org/licenses/nonexclusive-distrib/1.0/","  The multicommodity flow problem is NP-hard already for two commodities over
bipartite graphs. Nonetheless, using our recent theory of n-fold integer
programming and extensions developed herein, we are able to establish the
surprising polynomial time solvability of the problem in two broad situations.
","[{""version"":""v1"",""created"":""Sun, 28 Jun 2009 23:56:05 GMT""},{""version"":""v2"",""created"":""Mon, 13 Jul 2009 14:29:56 GMT""}]","2011-01-18"
"0906.5112","Javaid Aslam","Javaid Aslam","Response to Refutation of Aslam's Proof that NP = P","Total 9 pages, including the figures. Have further minimized the
  overlap, with only references to the main paper",,,,"cs.CC","http://arxiv.org/licenses/nonexclusive-distrib/1.0/","  This paper provides a further refinement to the previous response by
introducing new structures and algorithms for counting VMPs of common
\emph{Edge Requirement} (ER) and hence for counting the perfect matchings.
","[{""version"":""v1"",""created"":""Sun, 28 Jun 2009 16:07:06 GMT""},{""version"":""v2"",""created"":""Fri, 23 Jan 2015 20:54:52 GMT""},{""version"":""v3"",""created"":""Sun, 15 Mar 2015 00:58:51 GMT""},{""version"":""v4"",""created"":""Sat, 7 Oct 2017 03:38:30 GMT""}]","2017-10-10"
"0906.5129","Takafumi Shibuta","Takafumi Shibuta","Toric ideals for high Veronese subrings of toric algebras","9 pages, v2: Observation 3.16 added and typos corrected, v3: typos
  corrected",,,,"math.AC math.AG","http://arxiv.org/licenses/nonexclusive-distrib/1.0/","  We prove that the defining ideal of a sufficiently high Veronese subring of a
toric algebra admits a quadratic Gr\""obner basis consisting of binomials. More
generally, we prove that the defining ideal of a sufficiently high Veronese
subring of a standard graded ring admits a quadratic Gr\""obner basis. We give a
lower bound on $d$ such that the defining ideal of $d$-th Veronese subring
admits a quadratic Gr\""obner basis. Eisenbud--Reeves--Totaro stated the same
theorem without a proof with some lower bound on $d$. In many cases, our lower
bound is less than Eisenbud--Reeves--Totaro's lower bound.
","[{""version"":""v1"",""created"":""Mon, 29 Jun 2009 13:42:17 GMT""},{""version"":""v2"",""created"":""Wed, 13 Jan 2010 11:40:34 GMT""},{""version"":""v3"",""created"":""Fri, 19 Nov 2010 03:51:52 GMT""}]","2010-11-22"
"0906.5138","Anatoli Vankov A","Anatoli Andrei Vankov","Quantum bouncer: theory and experiment","13 pages, 4 figures",,,,"quant-ph","http://arxiv.org/licenses/nonexclusive-distrib/1.0/","  The quantum bouncer (QB) concept is a known QM textbook example of confined
particle, namely, a solution to the 1D Schroedinger equation for a linear
potential (the so-called Airy equation). It would be a great methodological
challenge to create such a QM object in laboratory. An attempt of observation
of the QB ``running'' in the horizontal direction was recently made by the
international team at the Laue-Langevin Institute, Grenoble. The experiment was
performed with ultra-cold neutrons. In this paper, the experiment is analyzed
in view of the authors' claim that ``neutron quantum states in Earth
gravitational field'' are observed. The experimental apparatus is designed for
measurements of horizontal flux of neutrons passing through an absorbing wave
guide with a variable height of absorber. From our analysis, it follows,
however, that in such a layout measured data are not sensitive to quantum
probability density in the vertical direction. The overall conclusion is made
that the experimental data do not contain sufficient information to justify the
claim.
","[{""version"":""v1"",""created"":""Sun, 28 Jun 2009 21:40:54 GMT""}]","2009-06-30"
"0906.5144","Dr. W. B. Vasantha Kandasamy","W.B.Vasantha Kandasamy, Florentin Smarandache","Groups as Graphs","168 pages, 154 figures; Published by Editura CuArt, Romania in 2009",,,,"math.GM","http://arxiv.org/licenses/nonexclusive-distrib/1.0/","  For the first time we represent every finite group in the form of a graph in
this book. The authors choose to call these graphs as identity graph, since the
main role in obtaining the graph is played by the identity element of the
group.
  This study is innovative because through this description one can immediately
look at the graph and say the number of elements in the group G which are
self-inversed. Also study of different properties, like the subgroups of a
group, normal subgroups of a group, p-sylow subgroups of a group and conjugate
elements of a group are carried out using the identity graph of the group in
this book.
  This book has four chapters. The first chapter is introductory. The second
chapter represents groups as graphs. In the third chapter, we have defined
similar types of graphs for algebraic structures like commutative semigroups,
loops, commutative groupoids and commutative rings. The final chapter poses 52
problems.
","[{""version"":""v1"",""created"":""Sun, 28 Jun 2009 16:06:18 GMT""}]","2009-06-30"
"0906.5145","Larry Goldstein","Larry Goldstein","Bounds on the constant in the mean central limit theorem","Published in at http://dx.doi.org/10.1214/10-AOP527 the Annals of
  Probability (http://www.imstat.org/aop/) by the Institute of Mathematical
  Statistics (http://www.imstat.org)","Annals of Probability 2010, Vol. 38, No. 4, 1672-1689","10.1214/10-AOP527","IMS-AOP-AOP527","math.PR","http://arxiv.org/licenses/nonexclusive-distrib/1.0/","  Let $X_1,\...,X_n$ be independent with zero means, finite variances
$\sigma_1^2,\...,\sigma_n^2$ and finite absolute third moments. Let $F_n$ be
the distribution function of $(X_1+\...+X_n)/\sigma$, where
$\sigma^2=\sum_{i=1}^n\sigma_i^2$, and $\Phi$ that of the standard normal. The
$L^1$-distance between $F_n$ and $\Phi$ then satisfies \[\Vert
F_n-\Phi\Vert_1\le\frac{1}{\sigma^3}\sum_{i=1}^nE|X_i|^3.\] In particular, when
$X_1,\...,X_n$ are identically distributed with variance $\sigma^2$, we have
\[\Vert F_n-\Phi\Vert_1\le\frac{E|X_1|^3}{\sigma^3\sqrt{n}}\qquad for all
$n\in\mathbb{N}$,\] corresponding to an $L^1$-Berry--Esseen constant of 1.
","[{""version"":""v1"",""created"":""Sun, 28 Jun 2009 16:42:23 GMT""},{""version"":""v2"",""created"":""Tue, 19 Oct 2010 14:08:05 GMT""}]","2010-10-20"
"0906.5146","Giovanni Curi","Giovanni Curi","On the existence of Stone-Cech compactification",,,,,"math.LO math.GN","http://arxiv.org/licenses/nonexclusive-distrib/1.0/","  In [G. Curi, ""Exact approximations to Stone-Cech compactification'', Ann.
Pure Appl. Logic, 146, 2-3, 2007, pp. 103-123] a characterization is obtained
of the locales of which the Stone-Cech compactification can be defined in
constructive type theory CTT, and in the formal system CZF+uREA+DC, a natural
extension of Aczel's system for constructive set theory CZF by a strengthening
of the Regular Extension Axiom REA and the principle of dependent choice. In
this paper I show that this characterization continues to hold over the
standard system CZF plus REA, thus removing in particular any dependency from a
choice principle. This will follow by a result of independent interest, namely
the proof that the class of continuous mappings from a compact regular locale X
to a regular a set-presented locale Y is a set in CZF, even without REA. It is
then shown that the existence of Stone-Cech compactification of a
non-degenerate Boolean locale is independent of the axioms of CZF (+REA), so
that the obtained characterization characterizes a proper subcollection of the
collection of all locales. The same also holds for several, even impredicative,
extensions of CZF+REA, as well as for CTT. This is in contrast with what
happens in the context of Higher-order Heyting arithmetic HHA - and thus in any
topos-theoretic universe: by constructions of Johnstone, Banaschewski and
Mulvey, within HHA Stone-Cech compactification can be defined for every locale.
","[{""version"":""v1"",""created"":""Sun, 28 Jun 2009 16:36:28 GMT""},{""version"":""v2"",""created"":""Tue, 12 Jan 2010 18:08:41 GMT""}]","2010-01-12"
"0906.5147","Ljubinko Ignjatovic","A. A. Mihajlov, Y. Vitel and Lj. M. Ignjatovic","The new screening characteristics of strongly non-ideal and dusty
  plasmas. Part 1: Single-component systems","22 pages (preprint style), 4 figures","High Temperature, vol. 46, No. 6, pp. 737-745, (2008)","10.1134/S0018151X08060011",,"physics.plasm-ph","http://arxiv.org/licenses/nonexclusive-distrib/1.0/","  In this paper a new model method for describing of the electrostatic
screening in single-component systems which is free of Debye-Huckel's
non-physical properties is presented. The method is appropriate for the
determination of screening parameters in the case of the systems of higher
non-ideality degree. The obtained screening characteristics are presented in a
simple analytic form. The presented results make basic elements of a method for
determination of screening characteristics in dense two-component plasmas,
which are discussed in Part2 and Part 3 of this work.
","[{""version"":""v1"",""created"":""Sun, 28 Jun 2009 17:12:02 GMT""}]","2009-06-30"
"0906.5148","Tijl De Bie","Tijl De Bie","Explicit probabilistic models for databases and networks","Submitted",,,,"cs.AI cs.DB cs.IT math.IT","http://arxiv.org/licenses/nonexclusive-distrib/1.0/","  Recent work in data mining and related areas has highlighted the importance
of the statistical assessment of data mining results. Crucial to this endeavour
is the choice of a non-trivial null model for the data, to which the found
patterns can be contrasted. The most influential null models proposed so far
are defined in terms of invariants of the null distribution. Such null models
can be used by computation intensive randomization approaches in estimating the
statistical significance of data mining results.
  Here, we introduce a methodology to construct non-trivial probabilistic
models based on the maximum entropy (MaxEnt) principle. We show how MaxEnt
models allow for the natural incorporation of prior information. Furthermore,
they satisfy a number of desirable properties of previously introduced
randomization approaches. Lastly, they also have the benefit that they can be
represented explicitly. We argue that our approach can be used for a variety of
data types. However, for concreteness, we have chosen to demonstrate it in
particular for databases and networks.
","[{""version"":""v1"",""created"":""Mon, 29 Jun 2009 07:55:41 GMT""}]","2009-06-30"
"0906.5149","Ljubinko Ignjatovic","A. A. Mihajlov, Y. Vitel and Lj. M. Ignjatovic","The new screening characteristics of strongly non-ideal and dusty
  plasmas. Part 2: Two-Component Systems","26 pages (preprint style), 5 figures","High Temperature, vol. 47, No. 1, pp. 1-12, (2009)","10.1134/S0018151X09010015",,"physics.plasm-ph","http://arxiv.org/licenses/nonexclusive-distrib/1.0/","  A new model method for describing of the electrostatic screening in
two-component systems (electron-ion plasmas, dusty plasmas, electrolytes, etc)
is developed. The method is applicable to the systems of higher non-ideality
degree. The expressions for all the screening parameters introduced in the
previous paper (Part 1) of this work, as well as for an additional parameter
characteristic for multi-component systems, are obtained. All these parameters
are presented in a simple analytic form suitable for operative laboratory
usage, especially for theoretical interpretation of experimental data.
","[{""version"":""v1"",""created"":""Sun, 28 Jun 2009 17:28:20 GMT""}]","2009-06-30"
"0906.5150","Roberto Tauraso","Roberto Tauraso","Congruences involving the reciprocals of central binomial coefficients",,,,,"math.NT","http://arxiv.org/licenses/nonexclusive-distrib/1.0/","  We present several congruences modulo a power of prime $p$ concerning sums of
the following type $\sum_{k=1}^{p-1}{m^k\over k^r}{2k\choose k}^{-1}$ which
reveal some interesting connections with the analogous infinite series.
","[{""version"":""v1"",""created"":""Sun, 28 Jun 2009 17:42:36 GMT""},{""version"":""v2"",""created"":""Sun, 20 Dec 2009 01:29:07 GMT""}]","2009-12-20"
"0906.5151","Hal Daum\'e III","Hal Daum\'e III","Unsupervised Search-based Structured Prediction",,"Proceedings of the International Conference on Machine Learning,
  2009",,,"cs.LG","http://arxiv.org/licenses/nonexclusive-distrib/1.0/","  We describe an adaptation and application of a search-based structured
prediction algorithm ""Searn"" to unsupervised learning problems. We show that it
is possible to reduce unsupervised learning to supervised learning and
demonstrate a high-quality unsupervised shift-reduce parsing model. We
additionally show a close connection between unsupervised Searn and expectation
maximization. Finally, we demonstrate the efficacy of a semi-supervised
extension. The key idea that enables this is an application of the predict-self
idea for unsupervised learning.
","[{""version"":""v1"",""created"":""Sun, 28 Jun 2009 17:47:22 GMT""}]","2009-06-30"
"0906.5152","Ljubinko Ignjatovic","A. A. Mihajlov, Y. Vitel and Lj. M. Ignjatovic","The New Screening Characteristics of Strongly Non-ideal and Dusty
  Plasmas. Part 3: Properties and Applications","26 pages (preprint style), 10 figures","High Temperature, vol. 47, No. 2, pp. 147-157, (2009)","10.1134/S0018151X09020011",,"physics.plasm-ph","http://arxiv.org/licenses/nonexclusive-distrib/1.0/","  The physical sense and the properties of a group screening parameters which
are determined in the previous papers (Part~1 and Part~2) for single- and
two-component systems is discussed in this paper. On the base of data from the
mentioned papers are determined two new characteristic lengths which complete a
new hierarchy system of screening lengths in plasma. It was shown that the
methods developed in Part~1 and Part~2 generates results which are applicable
to the strongly non-ideal gaseous and dusty plasmas, and manifest a very good
agreement with the existing experimental data.
","[{""version"":""v1"",""created"":""Sun, 28 Jun 2009 18:02:05 GMT""}]","2009-06-30"
"0906.5153","Lee Lindblom","Lee Lindblom","Optimal Calibration Accuracy for Gravitational Wave Detectors","v2: minor changes, updated to version accepted in Phys. Rev. D",,"10.1103/PhysRevD.80.042005",,"gr-qc","http://arxiv.org/licenses/nonexclusive-distrib/1.0/","  Calibration errors in the response function of a gravitational wave detector
degrade its ability to detect and then to measure the properties of any
detected signals. This paper derives the needed levels of calibration accuracy
for each of these data-analysis tasks. The levels derived here are optimal in
the sense that lower accuracy would result in missed detections and/or a loss
of measurement precision, while higher accuracy would be made irrelevant by the
intrinsic noise level of the detector. Calibration errors affect the
data-analysis process in much the same way as errors in theoretical waveform
templates. The optimal level of calibration accuracy is expressed therefore as
a joint limit on modeling and calibration errors: increased accuracy in one
reduces the accuracy requirement in the other.
","[{""version"":""v1"",""created"":""Sun, 28 Jun 2009 18:19:58 GMT""},{""version"":""v2"",""created"":""Wed, 5 Aug 2009 20:35:00 GMT""}]","2015-05-13"
