"0906.5262","Jean-Philippe Mandallena","Omar Anza Hafsa, Jean-Philippe Mandallena","Relaxation and 3d-2d passage with determinant type constraints: an
  outline",,,,,"math.AP math.CA","http://arxiv.org/licenses/nonexclusive-distrib/1.0/","  We outline our work (see [1,2,3,4]) on relaxation and 3d-2d passage with
determinant type constraints. Some open questions are addressed. This
outline-paper comes as a companion to [5].
","[{""version"":""v1"",""created"":""Mon, 29 Jun 2009 13:29:54 GMT""}]","2009-06-30"
"0906.5263","Kai Puolamaki","Sami Hanhij\""arvi, Kai Puolam\""aki, Gemma C. Garriga","Multiple Hypothesis Testing in Pattern Discovery","28 pages",,,,"stat.ML stat.CO","http://arxiv.org/licenses/nonexclusive-distrib/1.0/","  The problem of multiple hypothesis testing arises when there are more than
one hypothesis to be tested simultaneously for statistical significance. This
is a very common situation in many data mining applications. For instance,
assessing simultaneously the significance of all frequent itemsets of a single
dataset entails a host of hypothesis, one for each itemset. A multiple
hypothesis testing method is needed to control the number of false positives
(Type I error). Our contribution in this paper is to extend the multiple
hypothesis framework to be used with a generic data mining algorithm. We
provide a method that provably controls the family-wise error rate (FWER, the
probability of at least one false positive) in the strong sense. We evaluate
the performance of our solution on both real and generated data. The results
show that our method controls the FWER while maintaining the power of the test.
","[{""version"":""v1"",""created"":""Mon, 29 Jun 2009 13:31:07 GMT""}]","2009-06-30"
"0906.5264","Remigiusz Augusiak","Remigiusz Augusiak, Maciej Lewenstein","Towards measurable bounds on entanglement measures","15 pages, 2 fig, small corrections, published version","Quantum Information Processing 8, 493-521 (2009)",,,"quant-ph","http://arxiv.org/licenses/nonexclusive-distrib/1.0/","  While the experimental detection of entanglement provides already quite a
difficult task, experimental quantification of entanglement is even more
challenging, and has not yet been studied thoroughly. In this paper we discuss
several issues concerning bounds on concurrence measurable collectively on
copies of a given quantum state. Firstly, we concentrate on the recent bound on
concurrence by Mintert--Buchleitner [F. Mintert and A. Buchleitner, Phys. Rev.
Lett. 98, 140505 (2007)]. Relating it to the reduction criterion for
separability we provide yet another proof of the bound and point out some
possibilities following from the proof which could lead to improvement of the
bound. Then, relating concurrence to the generalized robustness of
entanglement, we provide a method allowing for construction of lower bounds on
concurrence from any positive map (not only the reduction one). All these
quantities can be measured as mean values of some two--copy observables. In
this sense the method generalizes the Mintert--Buchleitner bound and recovers
it when the reduction map is used. As a particular case we investigate the
bound obtained from the transposition map. Interestingly, comparison with MB
bound performed on the class of 4\otimes 4 rotationally invariant states shows
that the new bound is positive in regions in which the MB bound gives zero.
Finally, we provide measurable upper bounds on the whole class of concurrences.
","[{""version"":""v1"",""created"":""Mon, 29 Jun 2009 13:31:20 GMT""},{""version"":""v2"",""created"":""Tue, 6 Oct 2009 15:38:08 GMT""},{""version"":""v3"",""created"":""Wed, 25 Nov 2009 13:45:00 GMT""}]","2009-11-25"
"0906.5265","Bogdan Wojtsekhowski","B. Wojtsekhowski","Searching for a U-boson with a positron beam","6 pages, 5 figures, proceedings JPOS 2009 workshop",,,"JLAB-PHY-09-1010","hep-ex","http://arxiv.org/licenses/nonexclusive-distrib/1.0/","  A high sensitivity search for a light \Ub{} by means of a positron beam
incident on a hydrogen target is proposed. We described a concept of the
experiment and two possible realizations. The projected result of this
experiment corresponds to an upper limit on the square of coupling constant $
|f_{_{eU}}|^2 = 3 \times 10^{-9}$ with a signal to noise ratio of five.
","[{""version"":""v1"",""created"":""Mon, 29 Jun 2009 13:52:57 GMT""}]","2009-06-30"
"0906.5266","Binhe Wu","B. H. Wu, and J. C. Cao","Noise of Kondo dot with ac gate: Floquet-Green's function and
  Noncrossing Approximation Approach",,,"10.1103/PhysRevB.81.085327",,"cond-mat.mes-hall","http://arxiv.org/licenses/nonexclusive-distrib/1.0/","  The transport properties of an ac-driving quantum dot in the Kondo regime are
studied by the Floquet-Green's function method with slave-boson infinite-$U$
noncrossing approximation. Our results show that the Kondo peak of the local
density of states is robust against weak ac gate modulation. Significant
suppression of the Kondo peak can be observed when the ac gate field becomes
strong. The photon-assisted noise of Kondo resonance as a function of dc
voltage does not show singularities which are expected for noninteracting
resonant quantum dot. These findings suggest that one may make use of the
photon-assisted noise measurement to tell apart whether the resonant transport
is via noninteracting resonance or strongly-correlated Kondo resonance.
","[{""version"":""v1"",""created"":""Mon, 29 Jun 2009 14:28:40 GMT""}]","2015-05-13"
"0906.5267","Pablo San-Jose","Elsa Prada, Pablo San-Jose, Gladys Le\'on, Michael M. Fogler,
  Francisco Guinea","Singular elastic strains and magnetoconductance of suspended graphene","4 pages, 3 figures. Published version.","Phys. Rev. B 81, 161402(R) (2010)","10.1103/PhysRevB.81.161402",,"cond-mat.mes-hall","http://arxiv.org/licenses/nonexclusive-distrib/1.0/","  Graphene membranes suspended off electric contacts or other rigid supports
are prone to elastic strain, which is concentrated at the edges and corners of
the samples. Such a strain leads to an algebraically varying effective magnetic
field that can reach a few Tesla in sub-micron wide flakes. In the quantum Hall
regime the interplay of the effective and the physical magnetic fields causes
backscattering of the chiral edge channels, which can destroy the quantized
conductance plateaus.
","[{""version"":""v1"",""created"":""Mon, 29 Jun 2009 13:48:42 GMT""},{""version"":""v2"",""created"":""Mon, 30 Nov 2009 17:03:02 GMT""},{""version"":""v3"",""created"":""Wed, 7 Apr 2010 10:51:22 GMT""}]","2010-04-08"
"0906.5268","Ferran Valdez","Piotr Przytycki, Gabriela Schmithuesen, Ferran Valdez","Veech groups of Loch Ness monsters","15 pages","Algebr. Geom. Topol. 17 (2017) 529-560","10.2140/agt.2017.17.529",,"math.DG math.GR","http://creativecommons.org/licenses/by/3.0/","  We classify Veech groups of tame non-compact flat surfaces. In particular we
prove that all countable subgroups of $\mathbf{GL}_+(2,\R)$ avoiding the set of
mappings of norm less than 1 appear as Veech groups of tame non-compact flat
surfaces which are Loch Ness monsters. Conversely, a Veech group of any tame
flat surface is either countable, or one of three specific types.
","[{""version"":""v1"",""created"":""Mon, 29 Jun 2009 14:00:13 GMT""}]","2017-02-08"
"0906.5269","Luca Fossati","L. Fossati, T. Ryabchikova, S. Bagnulo, E. Alecian, J. Grunhut, O.
  Kochukhov, G. Wade","The chemical abundance analysis of normal early A- and late B-type stars","Accepted for publication on Astronomy and Astrophysics",,"10.1051/0004-6361/200811561",,"astro-ph.SR","http://arxiv.org/licenses/nonexclusive-distrib/1.0/","  Modern spectroscopy of early-type stars often aims at studying complex
physical phenomena. Comparatively less attention is paid to identifying and
studying the ""normal"" A- and B-type stars and testing how the basic atomic
parameters and standard spectral analysis allow one to fit the observations. We
wish to stablish whether the chemical composition of the solar photosphere can
be regarded as a reference for early A- and late B-type stars. We have obtained
optical high-resolution, high signal-to-noise ratio spectra of three slowly
rotating early-type stars (HD 145788, 21 Peg and pi Cet) that show no obvious
sign of chemical peculiarity, and performed a very accurate LTE abundance
analysis of up to 38 ions of 26 elements (for 21 Peg), using a vast amount of
spectral lines visible in the spectral region covered by our spectra. We
provide an exhaustive description of the abundance characteristics of the three
analysed stars with a critical review of the line parameters used to derive the
abundances. We compiled a table of atomic data for more than 1100 measured
lines that may be used in the future as a reference. The abundances we obtained
for He, C, Al, S, V, Cr, Mn, Fe, Ni, Sr, Y, and Zr are compatible with the
solar ones derived with recent 3D radiative-hydrodynamical simulations of the
solar photosphere. The abundances of the remaining studied elements show some
degree of discrepancy compared to the solar photosphere. Those of N, Na, Mg,
Si, Ca, Ti, and Nd may well be ascribed to non-LTE effects; for P, Cl, Sc and
Co, non-LTE effects are totally unknown; O, Ne, Ar, and Ba show discrepancies
that cannot be ascribed to non-LTE effects. The discrepancies obtained for O
(in two stars) and Ne agree with very recent non-LTE abundance analysis of
early B-type stars in the solar neighbourhood.
","[{""version"":""v1"",""created"":""Mon, 29 Jun 2009 13:54:21 GMT""}]","2015-05-13"
"0906.5270","Kentaro Saji","Kentaro Saji","Criteria for D_4 singularities of wave fronts","11 pages with 4 figures",,,,"math.GT","http://arxiv.org/licenses/nonexclusive-distrib/1.0/","  We give useful and simple criteria for determining D_4 singularities of wave
fronts. As an application, we investigate behaviors of singular curvatures of
cuspidal edges near D_4^+ singularities.
","[{""version"":""v1"",""created"":""Mon, 29 Jun 2009 13:55:44 GMT""},{""version"":""v2"",""created"":""Sun, 4 Jul 2010 16:27:53 GMT""}]","2010-07-06"
"0906.5271","Kalliopi Maria Dasyra","Kalliopi M. Dasyra, Lin Yan, George Helou, Anna Sajina, Dario Fadda,
  Michel Zamojski, Lee Armus, Bruce Draine, David Frayer","The ~0.9 mJy sample: A mid-infrared spectroscopic catalog of 150
  infrared-luminous, 24 micron selected galaxies at 0.3<z<3.5","accepted for publication in the Astrophysical Journal","Astrophys.J.701:1123-1146,2009","10.1088/0004-637X/701/2/1123",,"astro-ph.CO","http://arxiv.org/licenses/nonexclusive-distrib/1.0/","  We present a catalog of mid-infrared (MIR) spectra of 150 infrared (IR)
luminous galaxies in the Spitzer extragalactic first look survey obtained with
IRS on board Spitzer. The sample is selected to be brighter than ~0.9 mJy at 24
micron and it has a z distribution in the range [0.3,3.5] with a peak at z=1.
It primarily comprises ultraluminous IR galaxies at z>1 and luminous IR
galaxies at z<1, as estimated from their monochromatic 14 micron luminosities.
The number of sources with spectra that are dominated by an active galactic
nucleus (AGN) continuum is 49, while 39 sources have strong, star-formation
related features. For this classification, we used the equivalent width (EW) of
the 11.3 micron polycyclic aromatic hydrocarbon (PAH) feature. Several
intermediate/high z starbursts have higher PAH EW than local ULIRGs. An
increase in the AGN activity is observed with increasing z and luminosity,
based on the decreasing EW of PAHs and the increasing [NeIII]/[NeII] ratio.
Spectral stacking leads to the detection of the 3.3 micron PAH, the H2 0-0 S(1)
and S(3) lines, and the [NeV] line. We observe differences in the flux ratios
of PAHs in the stacked spectra of IR-luminous galaxies with z or luminosity,
which are not due to extinction effects. When placing the observed galaxies on
IR color-color diagrams, we find that the wedge defining AGN comprises most
sources with continuum-dominated spectra, but also contains many starbursts.
The comparison of the 11.3 micron PAH EW and the H-band effective radius,
measured from HST data, indicates that sources with EW>2 micron, are typically
more extended than ~3 kpc. However, there is no strong correlation between the
MIR spectral type and the near-IR extent of the sources. [Abridged].
","[{""version"":""v1"",""created"":""Mon, 29 Jun 2009 13:58:01 GMT""}]","2009-08-05"
"0906.5272","Jaan Einasto","Jaan Einasto","Large scale structure of the Universe","10 pages, 9 figures; The Sun, the Stars, the Universe and General
  Relativity, International conference in honor of Ya. B. Zeldovich 95th
  Anniversary, April 20 - 23, 2009, Minsk; Eds. R. Ruffini, G. Vereshchagin","AIP Conf.Proc.1205:72-81,2010","10.1063/1.3382336",,"astro-ph.CO","http://arxiv.org/licenses/nonexclusive-distrib/1.0/","  A short overview is given on the development of our present paradigm of the
large scale structure of the Universe with emphasis on the role of Ya. B.
Zeldovich. Next we use the Sloan Digital Sky Survey data and show that the
distribution of phases of density waves of various scale in the present-day
Universe are correlated. Using numerical simulations of structure evolution we
show that the skeleton of the cosmic web was present already in an early stage
of the evolution of structure. The positions of maxima and minima of density
waves (their phases) are the more stable, the larger is the wavelength. The
birth of the first generation of stars occured most probably in the central
regions of rich proto-superclusters where the density was highest in the early
Universe.
","[{""version"":""v1"",""created"":""Mon, 29 Jun 2009 14:34:55 GMT""}]","2010-04-28"
"0906.5273","Ulrich Langenfeld","U. Langenfeld, S. Moch, P. Uwer","Measuring the running top-quark mass","22 pages, 10 figures, 5 tables, final version to appear in PRD","Phys.Rev.D80:054009,2009","10.1103/PhysRevD.80.054009","DESY 09-097, HU-EP-09/27, SFB/CPP-09-55","hep-ph","http://arxiv.org/licenses/nonexclusive-distrib/1.0/","  We present the first direct determination of the running top-quark mass based
on the total cross section of top-quark pair-production as measured at the
Tevatron. Our theory prediction for the cross section includes various
next-to-next-to-leading order QCD contributions, in particular all
logarithmically enhanced terms near threshold, the Coulomb corrections at two
loops and all explicitly scale dependent terms at NNLO accuracy. The result
allows for an exact and independent variation of the renormalization and
factorization scales. For Tevatron and LHC we study its dependence on all
scales, on the parton luminosity and on the top-quark mass using both the
conventional pole mass definition as well as the running mass in the MSbar
scheme. We extract for the top-quark an MSbar mass of m(mu=m) = 160.0 +3.3 -3.2
GeV, which corresponds to a pole mass of m_t = 168.9 +3.5 -3.4 GeV.
","[{""version"":""v1"",""created"":""Mon, 29 Jun 2009 14:12:23 GMT""},{""version"":""v2"",""created"":""Thu, 3 Sep 2009 08:08:24 GMT""}]","2009-09-24"
"0906.5274","Chantal Valeriani","C. Valeriani, E. Sanz and D. Frenkel","Rate of Homogeneous Crystal Nucleation in molten NaCl",,"J. Chem. Phys. 122, 194501 (2005)","10.1063/1.1896348",,"physics.chem-ph cond-mat.soft","http://arxiv.org/licenses/nonexclusive-distrib/1.0/","  We report a numerical simulation of the rate of crystal nucleation of sodium
chloride from its melt at moderate supercooling. In this regime nucleation is
too slow to be studied with ""brute-force"" Molecular Dynamics simulations. The
melting temperature of (""Tosi-Fumi"") NaCl is $\sim 1060$K. We studied crystal
nucleation at $T$=800K and 825K. We observe that the critical nucleus formed
during the nucleation process has the crystal structure of bulk NaCl.
Interestingly, the critical nucleus is clearly faceted: the nuclei have a
cubical shape. We have computed the crystal-nucleation rate using two
completely different approaches, one based on an estimate of the rate of
diffusive crossing of the nucleation barrier, the other based on the Forward
Flux Sampling and Transition Interface Sampling (FFS-TIS) methods. We find that
the two methods yield the same result to within an order of magnitude. However,
when we compare the extrapolated simulation data with the only available
experimental results for NaCl nucleation, we observe a discrepancy of nearly 5
orders of magnitude. We discuss the possible causes for this discrepancy.
","[{""version"":""v1"",""created"":""Mon, 29 Jun 2009 14:13:13 GMT""}]","2009-06-30"
"0906.5275","Francis W. Starr","Francis W. Starr and Jack F. Douglas","Influence of Nanoparticle Additives on the Fragility of Polymer Glass
  Formation and the Buchenau Relation",,,,,"cond-mat.mtrl-sci cond-mat.stat-mech","http://arxiv.org/licenses/nonexclusive-distrib/1.0/","  We investigate the impact of the addition of nanoparticles (NP) on the
fragility of a model glass-forming polymer melt by molecular dynamics
simulations. We find significant changes in fragility for nanoparticle volume
fractions $\phi$ exceeding $\approx$ 5%, where fragility changes correlate with
the inverse variance of the magnitude of the Debye-Waller factor $<u^2>$, a
measure of local ""stiffness"" fluctuations. We also confirm the validity of the
Buchenau relationship between $<u^2>$ and the structural relaxation time $\tau$
for all $\phi$ and polymer-NP interaction types.
","[{""version"":""v1"",""created"":""Mon, 29 Jun 2009 14:14:49 GMT""}]","2009-06-30"
"0906.5276","Steven Longmore N","S. N. Longmore (1), M. G. Burton (2), E. Keto (1), S. Kurtz (3), A. J.
  Walsh (4) ((1) Harvard-Smithsonian Center for Astrophysics, (2) University of
  New South Wales, (3) CRyA, Universidad Nacional Autonoma de Mexico, (4) James
  Cook University)","Too large and overlooked? Extended free-free emission towards massive
  star formation regions","Accepted MNRAS. 22 pages, 13 figures, 5 tables",,"10.1111/j.1365-2966.2009.15320.x",,"astro-ph.GA astro-ph.SR","http://arxiv.org/licenses/nonexclusive-distrib/1.0/","  We present Australia Telescope Compact Array observations towards 6 massive
star formation regions which, from their strong 24 GHz continuum emission but
no compact 8 GHz continuum emission, appeared good candidates for hyper-compact
HII regions. However, the properties of the ionised gas derived from the 19 to
93 GHz continuum emission and H70 alpha + H57 alpha radio recombination line
data show the majority of these sources are, in fact, regions of
spatially-extended, optically-thin free-free emission. These extended sources
were missed in the previous 8 GHz observations due to a combination of
spatial-filtering, poor surface brightness sensitivity and primary beam
attenuation.
  We consider the implications that a significant number of these extended HII
regions may have been missed by previous surveys of massive star formation
regions. If the original sample of 21 sources is representative of the
population as a whole, the fact that 6 contain previously undetected extended
free-free emission suggests a large number of regions have been mis-classified.
Rather than being very young objects prior to UCHII region formation, they are,
in fact, associated with extended HII regions and thus significantly older. In
addition, inadvertently ignoring a potentially substantial flux contribution
(up to ~0.5Jy) from free-free emission has implications for dust masses derived
from sub-mm flux densities. The large spatial scales probed by single-dish
telescopes, which do not suffer from spatial filtering, are particularly
susceptible and dust masses may be overestimated by up to a factor of ~2.
","[{""version"":""v1"",""created"":""Mon, 29 Jun 2009 14:20:37 GMT""}]","2015-05-13"
"0906.5277","Julien Grivaux","Julien Grivaux","Topological properties of punctual Hilbert schemes of symplectic
  4-dimensional manifolds","This paper is withdrawn",,,,"math.AG math.SG","http://creativecommons.org/licenses/by-nc-sa/3.0/","  This paper has been replaced by the papers arXiv:1001.0114 and
arXiv:1001.0119
","[{""version"":""v1"",""created"":""Mon, 29 Jun 2009 15:44:03 GMT""},{""version"":""v2"",""created"":""Thu, 31 Dec 2009 11:14:59 GMT""},{""version"":""v3"",""created"":""Mon, 9 Oct 2017 12:46:21 GMT""}]","2017-10-10"
"0906.5278","Nikolaos Vasiloglou","Nikolaos Vasiloglou and Petros Maragos","Spectrum of Fractal Interpolation Functions",,,,,"cs.IT math.IT","http://creativecommons.org/licenses/by-nc-sa/3.0/","  In this paper we compute the Fourier spectrum of the Fractal Interpolation
Functions FIFs as introduced by Michael Barnsley. We show that there is an
analytical way to compute them. In this paper we attempt to solve the inverse
problem of FIF by using the spectrum
","[{""version"":""v1"",""created"":""Mon, 29 Jun 2009 14:43:15 GMT""}]","2009-06-30"
"0906.5279","Steven Peil","Steven Peil","Imitating quantum mechanics: qubit-based model for simulation",,"Phys. Rev. A 79, 042320 (2009)","10.1103/PhysRevA.79.042320",,"quant-ph","http://arxiv.org/licenses/nonexclusive-distrib/1.0/","  We present an approach to simulating quantum computation based on a classical
model that directly imitates discrete quantum systems. Qubits are represented
as harmonic functions in a 2D vector space. Multiplication of qubit
representations of different frequencies results in exponential growth of the
state space similar to the tensor-product composition of qubit spaces in
quantum mechanics. Individual qubits remain accessible in a composite system,
which is represented as a complex function of a single variable, though
entanglement imposes a demand on resources that scales exponentially with the
number of entangled qubits. We carry out a simulation of Shor's algorithm and
discuss a simpler implementation in this classical model.
","[{""version"":""v1"",""created"":""Mon, 29 Jun 2009 14:25:00 GMT""}]","2009-06-30"
"0906.5280","Jayajit Das","Jayajit Das, Mehran Kardar, Arup K. Chakraborty","Positive Feedback Regulation Results in Spatial Clustering and Fast
  Spreading of Active Signaling Molecules on a Cell Membrane","37 pages, 8 figures. Journal of Chemical Physics (in press)",,"10.1063/1.3149861",,"cond-mat.soft physics.chem-ph q-bio.MN","http://arxiv.org/licenses/nonexclusive-distrib/1.0/","  Positive feedback regulation is ubiquitous in cell signaling networks, often
leading to binary outcomes in response to graded stimuli. However, the role of
such feedbacks in clustering, and in spatial spreading of activated molecules,
has come to be appreciated only recently. We focus on the latter, using a
simple model developed in the context of Ras activation with competing negative
and positive feedback mechanisms. We find that positive feedback, in the
presence of slow diffusion, results in clustering of activated molecules on the
plasma membrane, and rapid spatial spreading as the front of the cluster
propagates with a constant velocity (dependent on the feedback strength). The
advancing fronts of the clusters of the activated species are rough, with
scaling consistent with the Kardar-Parisi-Zhang (KPZ) equation in one
dimension. Our minimal model is general enough to describe signal transduction
in a wide variety of biological networks where activity in the
membrane-proximal region is subject to feedback regulation.
","[{""version"":""v1"",""created"":""Mon, 29 Jun 2009 14:36:48 GMT""}]","2015-05-13"
"0906.5281","Yu-Gang Ma","X. Y. Sun, D. Q. Fang, Y. G. Ma, X. Z. Cai, J. G. Chen, W. Guo, W. D.
  Tian, H. W. Wang","Neutron/proton ratio of nucleon emissions as a probe of neutron skin","7 pages, 5 figures; accepted by Phys. Lett. B","Phys.Lett.B682:396-400,2010","10.1016/j.physletb.2009.11.031",,"nucl-th nucl-ex","http://arxiv.org/licenses/nonexclusive-distrib/1.0/","  The dependence between neutron-to-proton yield ratio ($R_{np}$) and neutron
skin thickness ($\delta_{np}$) in neutron-rich projectile induced reactions is
investigated within the framework of the Isospin-Dependent Quantum Molecular
Dynamics (IQMD) model. The density distribution of the Droplet model is
embedded in the initialization of the neutron and proton densities in the
present IQMD model. By adjusting the diffuseness parameter of neutron density
in the Droplet model for the projectile, the relationship between the neutron
skin thickness and the corresponding $R_{np}$ in the collisions is obtained.
The results show strong linear correlation between $R_{np}$ and $\delta_{np}$
for neutron-rich Ca and Ni isotopes. It is suggested that $R_{np}$ may be used
as an experimental observable to extract $\delta_{np}$ for neutron-rich nuclei,
which is very significant to the study of the nuclear structure of exotic
nuclei and the equation of state (EOS) of asymmetric nuclear matter.
","[{""version"":""v1"",""created"":""Mon, 29 Jun 2009 14:41:34 GMT""},{""version"":""v2"",""created"":""Thu, 19 Nov 2009 12:47:16 GMT""}]","2009-12-22"
"0906.5282","Sarah Lobb","S.B. Lobb, F.W. Nijhoff, G.R.W. Quispel","Lagrangian multiform structure for the lattice KP system","12 pages, submitted to J. Phys. A: Math. Theor",,,,"nlin.SI","http://arxiv.org/licenses/nonexclusive-distrib/1.0/","  We present a Lagrangian for the bilinear discrete KP (or Hirota-Miwa)
equation. Furthermore, we show that this Lagrangian can be extended to a
Lagrangian 3-form when embedded in a higher dimensional lattice, obeying a
closure relation. Thus we establish the multiform structure as proposed in
arXiv:0903.4086v1 [nlin.SI] in a higher dimensional case.
","[{""version"":""v1"",""created"":""Mon, 29 Jun 2009 14:45:12 GMT""}]","2009-06-30"
