"0906.5174","Vadim V. Cheianov","V. V. Cheianov, V. I. Fal'ko, O. Syljuasen, and B. L. Altshuler","Partial Kekule Ordering of Adatoms on Graphene",,"Solid State Communications 149, pp. 1499-1501 (2009),","10.1016/j.ssc.2009.07.008",,"cond-mat.mtrl-sci cond-mat.stat-mech","http://arxiv.org/licenses/nonexclusive-distrib/1.0/","  Electronic and transport properties of Graphene, a one-atom thick crystalline
material, are sensitive to the presence of atoms adsorbed on its surface. An
ensemble of randomly positioned adatoms, each serving as a scattering center,
leads to the Bolzmann-Drude diffusion of charge determining the resistivity of
the material. An important question, however, is whether the distribution of
adatoms is always genuinely random. In this Article we demonstrate that a
dilute adatoms on graphene may have a tendency towards a spatially correlated
state with a hidden Kekule mosaic order. This effect emerges from the
interaction between the adatoms mediated by the Friedel oscillations of the
electron density in graphene. The onset of the ordered state, as the system is
cooled below the critical temperature, is accompanied by the opening of a gap
in the electronic spectrum of the material, dramatically changing its transport
properties.
","[{""version"":""v1"",""created"":""Sun, 28 Jun 2009 22:26:36 GMT""}]","2015-05-13"
"0906.5175","Jamal Jalilian-Marian","Jamal Jalilian-Marian","From RHIC to EIC: Nuclear Structure Functions","13 pages, 6 figures","Phys.Rev.C80:054904,2009","10.1103/PhysRevC.80.054904",,"hep-ph","http://arxiv.org/licenses/nonexclusive-distrib/1.0/","  We study the nuclear structure function $F_2^A$ and its logarithmic
derivative in the high energy limit (small $x$ region) using the Color Glass
Condensate formalism. In this limit the structure function $F_2$ depends on the
quark anti-quark dipole-target scattering cross section $N_F (x_{bj}, r_t,
b_t)$. The same dipole cross section appears in single hadron and hadron-photon
production cross sections in the forward rapidity region in deuteron
(proton)-nucleus collisions at high energy, i.e. at RHIC and LHC. We use a
parameterization of the dipole cross section, which has successfully been used
to describe the deuteron-gold data at RHIC, to compute the nuclear structure
function $F_2^A$ and its log $Q^2$ derivative (which is related to gluon
distribution function in the double log limit). We provide a quantitative
estimate of the nuclear shadowing of $F_2^A$ and the gluon distribution
function in the kinematic region relevant to a future Electron-Ion Collider.
","[{""version"":""v1"",""created"":""Sun, 28 Jun 2009 22:34:29 GMT""}]","2009-11-10"
"0906.5176","Shmuel Friedland","Shmuel Friedland and Uri N. Peled","The pressure, densities and first order phase transitions associated
  with multidimensional SOFT","33 pages, 2 figures",,,,"math-ph math.DS math.MP","http://arxiv.org/licenses/nonexclusive-distrib/1.0/","  We study theoretical and computational properties of the pressure function
for subshifts of finite type on the integer lattice $\Z^d$, multidimensional
SOFT, which are called Potts models in mathematical physics. We show that the
pressure is Lipschitz and convex. We use the properties of convex functions to
show rigorously that the phase transition of the first order correspond exactly
to the points where the pressure is not differentiable. We give computable
upper and lower bounds for the pressure, which can be arbitrary close the
values of the pressure given a sufficient computational power. We apply our
numerical methods to confirm Baxter's heuristic computations for two
dimensional monomer-dimer model, and to compute the pressure and the density
entropy as functions of two variables for the two dimensional monomer-dimer
model.
","[{""version"":""v1"",""created"":""Sun, 28 Jun 2009 22:44:22 GMT""},{""version"":""v2"",""created"":""Fri, 3 Jul 2009 16:32:31 GMT""},{""version"":""v3"",""created"":""Wed, 22 Jul 2009 22:37:05 GMT""},{""version"":""v4"",""created"":""Tue, 18 May 2010 15:28:00 GMT""}]","2010-05-19"
"0906.5177","Scott Morrison","Michael Freedman, Robert Gompf, Scott Morrison, Kevin Walker","Man and machine thinking about the smooth 4-dimensional Poincar\'e
  conjecture","37 pages; changes reflecting that the integer family of
  Cappell-Shaneson spheres are now known to be standard (arXiv:0907.0136)","Quantum Topology, Volume 1, Issue 2 (2010), pp. 171-208","10.4171/QT/5",,"math.GT math.QA","http://arxiv.org/licenses/nonexclusive-distrib/1.0/","  While topologists have had possession of possible counterexamples to the
smooth 4-dimensional Poincar\'{e} conjecture (SPC4) for over 30 years, until
recently no invariant has existed which could potentially distinguish these
examples from the standard 4-sphere. Rasmussen's s-invariant, a slice
obstruction within the general framework of Khovanov homology, changes this
state of affairs. We studied a class of knots K for which nonzero s(K) would
yield a counterexample to SPC4. Computations are extremely costly and we had
only completed two tests for those K, with the computations showing that s was
0, when a landmark posting of Akbulut (arXiv:0907.0136) altered the terrain.
His posting, appearing only six days after our initial posting, proved that the
family of ``Cappell--Shaneson'' homotopy spheres that we had geared up to study
were in fact all standard. The method we describe remains viable but will have
to be applied to other examples. Akbulut's work makes SPC4 seem more plausible,
and in another section of this paper we explain that SPC4 is equivalent to an
appropriate generalization of Property R (``in S^3, only an unknot can yield
S^1 x S^2 under surgery''). We hope that this observation, and the rich
relations between Property R and ideas such as taut foliations, contact
geometry, and Heegaard Floer homology, will encourage 3-manifold topologists to
look at SPC4.
","[{""version"":""v1"",""created"":""Sun, 28 Jun 2009 23:25:39 GMT""},{""version"":""v2"",""created"":""Thu, 17 Sep 2009 20:32:59 GMT""}]","2010-07-19"
"0906.5178","Wojciech De Roeck","W. De Roeck, J. Froehlich","Diffusion of a massive quantum particle coupled to a quasi-free thermal
  medium","v3 to v4, layout changes, to appear in CMP",,,,"math-ph math.MP","http://arxiv.org/licenses/nonexclusive-distrib/1.0/","  We consider a heavy quantum particle with an internal degree of freedom
moving on the $d$-dimensional lattice $\bbZ^d$ (e.g., a heavy atom with
finitely many excited states). The particle is coupled to a thermal medium
(bath) consisting of free relativistic bosons through an interaction of
strength $\la$ linear in creation and annihilation operators. The mass of the
quantum particle is assumed to be of order $\la^{-2}$, and we assume that the
internal degree of freedom is coupled ""effectively"" to the thermal medium. We
prove that the motion of the quantum particle is diffusive in $d\geq 4$ and for
$\la$ small enough.
","[{""version"":""v1"",""created"":""Sun, 28 Jun 2009 23:34:37 GMT""},{""version"":""v2"",""created"":""Sat, 19 Sep 2009 10:22:03 GMT""},{""version"":""v3"",""created"":""Sun, 22 Aug 2010 22:25:05 GMT""},{""version"":""v4"",""created"":""Sun, 16 Jan 2011 00:49:33 GMT""}]","2011-01-18"
"0906.5180","Luca Perotti","Luca C. Perotti","Small Phase Space Structures and their Relevance to Pulsed Quantum
  Evolution: the Stepwise Ionization of the Excited Hydrogen Atom in a
  Microwave Pulse","46 pages, 23 figures",,"10.1103/PhysRevA.81.033407",,"physics.atom-ph","http://arxiv.org/licenses/nonexclusive-distrib/1.0/","  Experiments have shown that the microwave ionization probability of a highly
excited almost monodimensional hydrogen atom subjected to a microwave pulse
sometimes grows in steps when the peak electric field of the pulse is
increased. Classical pulsed simulations display the same steps, which have been
traced to phase-space metamorphoses. Quantum numerical calculations again
exhibit the same ionization steps. I show that the time-sequence of two level
interactions, responsible for the observed steps in the quantum picture, is
strictly related to the classical phase space structures generated by the above
mentioned metamorphoses.
","[{""version"":""v1"",""created"":""Sun, 28 Jun 2009 23:54:07 GMT""}]","2015-05-13"
"0906.5181","Serguei Mokhov","Serguei A. Mokhov, Joey Paquet, and Mourad Debbabi","Reasoning About a Simulated Printer Case Investigation with Forensic
  Lucid","18 pages, 3 figures, 7 listings, TOC, index; this article closely
  relates to arXiv:0906.0049 and arXiv:0904.3789 but to remain stand-alone
  repeats some of the background and introductory content; abstract presented
  at HSC'09 and the full updated paper at ICDF2C'11. This is an updated/edited
  version after ICDF2C proceedings with more references and corrections","S. A. Mokhov, J. Paquet, and M. Debbabi. Reasoning about a
  simulated printer case investigation with Forensic Lucid. In P. Gladyshev and
  M. K. Rogers, editors, Proceedings of ICDF2C'11, number 0088 in LNICST, pp.
  282-296. Springer, 2012","10.1007/978-3-642-35515-8_23",,"cs.LO cs.CR cs.PL","http://arxiv.org/licenses/nonexclusive-distrib/1.0/","  In this work we model the ACME (a fictitious company name) ""printer case
incident"" and make its specification in Forensic Lucid, a Lucid- and
intensional-logic-based programming language for cyberforensic analysis and
event reconstruction specification. The printer case involves a dispute between
two parties that was previously solved using the finite-state automata (FSA)
approach, and is now re-done in a more usable way in Forensic Lucid. Our
simulation is based on the said case modeling by encoding concepts like
evidence and the related witness accounts as an evidential statement context in
a Forensic Lucid program, which is an input to the transition function that
models the possible deductions in the case. We then invoke the transition
function (actually its reverse) with the evidential statement context to see if
the evidence we encoded agrees with one's claims and then attempt to
reconstruct the sequence of events that may explain the claim or disprove it.
","[{""version"":""v1"",""created"":""Mon, 29 Jun 2009 00:06:22 GMT""},{""version"":""v2"",""created"":""Thu, 26 Apr 2012 09:41:26 GMT""}]","2013-09-17"
"0906.5182","George Simion","John J. Quinn (1), Arkadiusz W\'ojs (2 and 1), Kyung-Soo Yi (3),
  George Simion (1) ((1) Department of Physics and Astronomy, University of
  Tennessee, Knoxville, USA, (2) Wroclaw University of Technology, Wroclaw,
  Poland, (3) Department of Physics, Pusan National University, Busan, Korea)","The Hierarchy of Incompressible Fractional Quantum Hall States","49 pages, 45 figures",,"10.1016/j.physrep.2009.06.002",,"cond-mat.str-el","http://arxiv.org/licenses/nonexclusive-distrib/1.0/","  The correlations that give rise to incompressible quantum liquid (IQL) states
in fractional quantum Hall systems are determined by the pseudopotential
$V(\mathcal R)$ describing the interaction of a pair of Fermions in a
degenerate Landau level (LL) as a function of relative pair angular momentum
$\mathcal R$. $V(\mathcal R)$ is known for a number of different Fermion
systems, e.g. electrons in the lowest Landau level (LL0) or the first excited
Landau level (LL1), and for quasiparticles of Laughlin-Jain IQL states.
Laughlin correlations, the avoidance of pair states with the smallest values of
$\mathcal R$, occur only when $V(\mathcal R)$ satisfies certain conditions. We
show that Jain's composite Fermion (CF) picture is valid only if the conditions
necessary for Laughlin correlations are satisfied, and we present a rigorous
justification of the CF picture without the need of introducing an ""irrelevant""
mean field energy scale. Electrons in LL1 and quasielectrons in IQL states
(e.g. QEs in CF LL1) do not necessarily support Laughlin correlations.
Numerical diagonalization studies for small systems of Fermions (electrons in
LL0 or in LL1, and QEs in CF LL1), with the use appropriate pseudopotentials
$V(\mathcal R)$, show clear evidence for different types of correlations. The
relation between LL degeneracy $g=2\ell+1$ and number of Fermions $N$ at which
IQL states are found is known for a limited range of $N$ values. However, no
simple intuitive models that we have tried satisfactorily describe all of the
systems we have studied. Successes and shortcomings of some simple models are
discussed, and suggestions for further investigation are made.
","[{""version"":""v1"",""created"":""Mon, 29 Jun 2009 01:10:26 GMT""}]","2015-05-13"
"0906.5183","Daniel Are\'an","Daniel Arean","Holographic flavor in the gauge/gravity duality","PhD Thesis. July 2008. (Advisor: Alfonso V. Ramallo)",,,,"hep-th","http://arxiv.org/licenses/nonexclusive-distrib/1.0/","  In this paper we review some results on the generalization of the
gauge/gravity duality to include fundamental matter by means of probe branes.
We compute the meson spectrum of maximally supersymmetric gauge theories in
several dimensions, both in the Coulomb and Higgs branch. We also study the
addition of flavor and compute the meson spectrum for non-commutative theories.
Additionally, we present a thorough search of supersymmetric embeddings of
probe branes in the Klebanov-Witten model.
","[{""version"":""v1"",""created"":""Mon, 29 Jun 2009 00:16:25 GMT""}]","2009-06-30"
"0906.5184","Beena Kalisky","Beena Kalisky, John R. Kirtley, James G. Analytis, Jiun-Haw Chu,
  Arturas Vailionis, Ian R. Fisher and Kathryn A. Moler","Enhanced superfluid density on twin boundaries in Ba(Fe1-xCox)2As2","16 pages, 4 figures",,"10.1103/PhysRevB.81.184513",,"cond-mat.supr-con","http://arxiv.org/licenses/nonexclusive-distrib/1.0/","  Superconducting quantum interference device (SQUID) microscopy shows stripes
of increased diamagnetic susceptibility in underdoped, but not overdoped,
single crystals of Ba(Fe1-xCox)2As2. These stripes of increased diamagnetic
susceptibility are consistent with enhanced superfluid density on twin
boundaries. Individual vortices avoid pinning on or crossing the stripes, and
prefer to travel parallel to them. These results indicate a relationship
between superfluid density, local strain, and frustrated magnetism, and
demonstrate two mechanisms for enhancing critical currents.
","[{""version"":""v1"",""created"":""Mon, 29 Jun 2009 00:21:18 GMT""},{""version"":""v2"",""created"":""Wed, 12 Aug 2009 02:18:37 GMT""}]","2013-05-29"
"0906.5185","Evgeny Mukhin","E. Mukhin, V. Tarasov, and A. Varchenko","Bethe algebra of Gaudin model, Calogero-Moser space and Cherednik
  algebra","Latex, 24 pages",,,,"math.QA math-ph math.MP","http://arxiv.org/licenses/nonexclusive-distrib/1.0/","  We identify the Bethe algebra of the Gaudin model associated to gl(N) acting
on a suitable representation with the center of the rational Cherednik algebra
and with the algebra of regular functions on the Calogero-Moser space.
","[{""version"":""v1"",""created"":""Mon, 29 Jun 2009 00:25:00 GMT""}]","2009-06-30"
"0906.5186","Luca Perotti","Luca C. Perotti","Quantum Stabilization by Coherent Population of Scarred Eigenstates:
  Quantum Suppression of Transport Classically Initiated by Separatrix Band
  Entry","37 pages, 17 figures",,,,"physics.atom-ph","http://arxiv.org/licenses/nonexclusive-distrib/1.0/","  Comparisons of experimental data with numerical predictions of a classical
model indicate that an excited hydrogen atom in a pulsed microwave electric
field exhibits a nonclassical increase of stability over a relatively wide
range of frequencies. I show here that this is due to selective population of
long-lived ""scarred"" states that are associated with the chaotic separatrix
band surrounding the principal classical resonance zone in phase space. A
quantum explanation is given in terms of adiabatic evolution of Floquet states
and the destabilizing effect of two-level quantum resonances is investigated.
The role of neighbouring classical resonance zones in defining the frequency
range of stabilization is revealed both by quasienergy curves and by Husimi
functions for the instantaneous quantum states.
","[{""version"":""v1"",""created"":""Mon, 29 Jun 2009 00:35:10 GMT""}]","2009-06-30"
"0906.5187","Jun Ohkubo","Jun Ohkubo","Variational principle of counting statistics in master equations","4 pages, no figure","Phys. Rev. E 80, 012101 (2009)",,,"cond-mat.stat-mech","http://arxiv.org/licenses/nonexclusive-distrib/1.0/","  We study counting statistics of number of transitions in a stochastic
process. For mesoscopic systems, a path integral formulation for the counting
statistics has already been derived. We here show that it is also possible to
derive the similar path integral formulation without the assumption of
mesoscopic systems. It has been clarified that the saddle point method for the
path integral is not an approximation, but a valid procedure in the present
derivation. Hence, a variational principle in the counting statistics is
naturally derived. In order to obtain the variational principle, we employ many
independent replicas of the same system. In addition, the Euler-Maclaurin
formula is used in order to connect the discrete and continuous properties of
the system.
","[{""version"":""v1"",""created"":""Mon, 29 Jun 2009 00:58:51 GMT""}]","2009-07-21"
"0906.5189","Alistair Savage","Erhard Neher, Alistair Savage, and Prasad Senesi","Irreducible finite-dimensional representations of equivariant map
  algebras","25 pages; v2: results generalized to schemes and arbitrary
  finite-dimensional g; v3: change of notation, minor typos corrected, some
  explanations added; v4: minor typos corrected and references updated","Trans. Amer. Math. Soc., 364 (2012), no. 5, 2619-2646","10.1090/S0002-9947-2011-05420-6",,"math.RT math.AG math.RA","http://arxiv.org/licenses/nonexclusive-distrib/1.0/","  Suppose a finite group acts on a scheme X and a finite-dimensional Lie
algebra g. The corresponding equivariant map algebra is the Lie algebra M of
equivariant regular maps from X to g. We classify the irreducible
finite-dimensional representations of these algebras. In particular, we show
that all such representations are tensor products of evaluation representations
and one-dimensional representations, and we establish conditions ensuring that
they are all evaluation representations. For example, this is always the case
if M is perfect.
  Our results can be applied to multiloop algebras, current algebras, the
Onsager algebra, and the tetrahedron algebra. Doing so, we easily recover the
known classifications of irreducible finite-dimensional representations of
these algebras. Moreover, we obtain previously unknown classifications of
irreducible finite-dimensional representations of other types of equivariant
map algebras, such as the generalized Onsager algebra.
","[{""version"":""v1"",""created"":""Mon, 29 Jun 2009 01:12:14 GMT""},{""version"":""v2"",""created"":""Wed, 16 Sep 2009 22:01:28 GMT""},{""version"":""v3"",""created"":""Mon, 12 Jul 2010 19:13:01 GMT""},{""version"":""v4"",""created"":""Fri, 23 Dec 2011 18:15:53 GMT""}]","2012-04-11"
"0906.5190","Tong Zhang","Kai Yu, Tong Zhang","High Dimensional Nonlinear Learning using Local Coordinate Coding",,,,,"stat.ML stat.ME","http://arxiv.org/licenses/nonexclusive-distrib/1.0/","  This paper introduces a new method for semi-supervised learning on high
dimensional nonlinear manifolds, which includes a phase of unsupervised basis
learning and a phase of supervised function learning. The learned bases provide
a set of anchor points to form a local coordinate system, such that each data
point $x$ on the manifold can be locally approximated by a linear combination
of its nearby anchor points, with the linear weights offering a
local-coordinate coding of $x$. We show that a high dimensional nonlinear
function can be approximated by a global linear function with respect to this
coding scheme, and the approximation quality is ensured by the locality of such
coding. The method turns a difficult nonlinear learning problem into a simple
global linear learning problem, which overcomes some drawbacks of traditional
local learning methods. The work also gives a theoretical justification to the
empirical success of some biologically-inspired models using sparse coding of
sensory data, since a local coding scheme must be sufficiently sparse. However,
sparsity does not always satisfy locality conditions, and can thus possibly
lead to suboptimal results. The properties and performances of the method are
empirically verified on synthetic data, handwritten digit classification, and
object recognition tasks.
","[{""version"":""v1"",""created"":""Mon, 29 Jun 2009 01:22:09 GMT""}]","2009-06-30"
"0906.5191","Ryushi Goto","Ryushi Goto","Calabi-Yau structures and Einstein-Sasakian structures on crepant
  resolutions of isolated singularities","Lemma 5.3 was improved. The transverse Dolbeault theorem is not
  necessary to show the vanishing of the cohomology groups of Lemma 5.3.
  Theorem 1.8 (uniqueness theorem) was also improved","J. Math. Soc. Japan, vol. 64, No. 3 (2012) 1005-1052",,,"math.DG","http://arxiv.org/licenses/nonexclusive-distrib/1.0/","  Let $X_0$ be an affine variety with only normal isolated singularity $p$ and
$\pi: X\to X_0$ a smooth resolution of the singularity with trivial canonical
line bundle $K_X$. If the complement of the affine variety $X_0\backslash\{p\}$
is the cone $C(S)=\Bbb R_{>0}\times S$ of an Einstein-Sasakian manifold $S$, we
shall prove that the crepant resolution $X$ of $X_0$ admits a complete
Ricci-flat K\""ahler metric in every K\""ahler class in $H^2(X)$. We apply the
continuity method for solving the Monge-Amp\`ere equation to obtain a relevant
existence theorem and a uniqueness theorem of Ricci-flat conical K\""ahler
metrics. By using the vanishing theorem on the crepant resolution $X$ and the
Hodge and Lefschetz decompositions of the basic cohomology groups on the
Sasakian manifold $S$, we construct an initial K\""ahler metric in every
K\""ahler class on which the existence theorem can be applied.We show there are
many examples of Ricci-flat complete K\""ahler manifolds arising as crepant
resolutions.
","[{""version"":""v1"",""created"":""Mon, 29 Jun 2009 05:14:04 GMT""},{""version"":""v2"",""created"":""Thu, 16 Jul 2009 03:19:23 GMT""},{""version"":""v3"",""created"":""Mon, 20 Sep 2010 09:19:51 GMT""},{""version"":""v4"",""created"":""Fri, 11 Feb 2011 07:20:14 GMT""}]","2012-07-30"
"0906.5192","Guoxin Wei","Qing-Ming Cheng, Guangyue Huang and Guoxin Wei","Estimates for lower order eigenvalues of a clamped plate problem",,,,,"math.DG","http://arxiv.org/licenses/nonexclusive-distrib/1.0/","  For a bounded domain $\Omega$ in a complete Riemannian manifold $M^n$, we
study estimates for lower order eigenvalues of a clamped plate problem. We
obtain universal inequalities for lower order eigenvalues. We would like to
remark that our results are sharp.
","[{""version"":""v1"",""created"":""Mon, 29 Jun 2009 02:00:14 GMT""}]","2009-06-30"
"0906.5193","Nikolai V. Ivanov","Nikolai V. Ivanov","Sperner's Lemma, Brouwer's fixed-point theorem, and cohomology","12 pages. The text is rewritten to improve the exposition and a minor
  gap in the proof of the no-retraction theorem is filled",,,,"math.GT math.CO","http://arxiv.org/licenses/nonexclusive-distrib/1.0/","  The proof of Brouwer's fixed-point theorem based on Sperner's lemma is often
presented as an elementary combinatorial alternative to advanced proofs based
on algebraic topology. The goal of this note is to show that: (i) the
combinatorial proof of Sperner's Lemma can be considered as a cochain-level
version, written in the combinatorial language, of a standard cohomological
argument; (ii) the standard deduction of Brouwer's theorem from Sperner's lemma
is similar to the usual deduction of Brouwer's theorem from the no-retraction
theorem and is closely related to the notion of a simplicial approximation. In
order to make these connections transparent, we included the above mentioned
standard arguments, so the note is self-contained modulo some basic ideas of
combinatorial topology.
","[{""version"":""v1"",""created"":""Mon, 29 Jun 2009 03:53:10 GMT""},{""version"":""v2"",""created"":""Sun, 25 Aug 2019 22:33:26 GMT""}]","2019-08-27"
"0906.5194","Tetsuya Onogi","Tetuya Onogi","Recent Progress in Lattice QCD","12 pages, 7 figures, talk at ICHEP08, Philadelphia, 2008","Int.J.Mod.Phys.A24:4607-4622,2009","10.1142/S0217751X09046825",,"hep-ph","http://arxiv.org/licenses/nonexclusive-distrib/1.0/","  In recent years, reallistic unquenched QCD simulations have been carried out
with various lattice actions. In this report, I explain the progress in theory
and algorithms and some of the physics results.
","[{""version"":""v1"",""created"":""Mon, 29 Jun 2009 02:12:34 GMT""}]","2009-12-15"
"0906.5195","Dongsoo Shin","Heesang Park, Jongil Park, Dongsoo Shin","Surfaces of general type with $p_g=1$ and $q=0$","21 pages, 29 figures. Title changed. This paper combines two
  preprints arXiv:0906.5195 and arXiv:0910.3506",,,,"math.AG math.GT","http://arxiv.org/licenses/nonexclusive-distrib/1.0/","  In this paper we construct a new family of simply connected minimal complex
surfaces of general type with $p_g=1$, $q=0$, and $K^2=3, 4, 5, 6, 8$ using a
$\mathbb{Q}$-Gorenstein smoothing theory. We also reconstruct minimal complex
surfaces of general type with $p_g=1$, $q=0$, and $K^2=1, 2$ using the same
method.
","[{""version"":""v1"",""created"":""Mon, 29 Jun 2009 02:08:43 GMT""},{""version"":""v2"",""created"":""Sun, 16 Jan 2011 13:23:40 GMT""}]","2011-01-18"
