"0906.5218","Thomas Kuhr","The CDF Collaboration: T. Aaltonen, et al","Precision Measurement of the X(3872) Mass in J/psi pi+ pi- Decays",,"Phys.Rev.Lett.103:152001,2009","10.1103/PhysRevLett.103.152001","FERMILAB-PUB-09-330-E","hep-ex","http://arxiv.org/licenses/nonexclusive-distrib/1.0/","  We present an analysis of the mass of the X(3872) reconstructed via its decay
to J/psi pi+ pi- using 2.4 fb^-1 of integrated luminosity from ppbar collisions
at sqrt(s) = 1.96 TeV, collected with the CDF II detector at the Fermilab
Tevatron. The possible existence of two nearby mass states is investigated.
Within the limits of our experimental resolution the data are consistent with a
single state, and having no evidence for two states we set upper limits on the
mass difference between two hypothetical states for different assumed ratios of
contributions to the observed peak. For equal contributions, the 95% confidence
level upper limit on the mass difference is 3.6 MeV/c^2. Under the single-state
model the X(3872) mass is measured to be 3871.61 +- 0.16 (stat) +- 0.19 (syst)
MeV/c^2, which is the most precise determination to date.
","[{""version"":""v1"",""created"":""Mon, 29 Jun 2009 08:21:02 GMT""},{""version"":""v2"",""created"":""Thu, 8 Oct 2009 07:44:01 GMT""}]","2010-05-12"
"0906.5219","Boris Kosyakov","Andrew E. Chubykalo, Augusto Espinoza, B. P. Kosyakov","Inertial frames of reference, space and time measurements, and physical
  principles of special relativity revisited","LaTeX, 17 pages, 2 figures",,,,"gr-qc","http://arxiv.org/licenses/nonexclusive-distrib/1.0/","  We give a critical analysis of the conceptual foundations of special
relativity. We formulate a simple operational criterion for distinguishing
between noninertial and inertial frames which is introduced prior to geometry.
We associate the concept of maximal velocity with the existence of an upper
bound for a set of rates of movers which travel in the same direction. We
define the standard scale for reading the time flow. We refine the treatment of
both Einstein's postulates, the principle of relativity and constancy of the
velocity of light. The proposed ``reconstruction'' of the geometry of Minkowski
space will hopefully be useful for the ongoing examination of possible Lorentz
violations.
","[{""version"":""v1"",""created"":""Mon, 29 Jun 2009 08:22:35 GMT""}]","2009-06-30"
"0906.5221","Damien Hutsemekers","D. Hutsemekers, J. Manfroid, E. Jehin, C. Arpigny","New constraints on the delivery of cometary water and nitrogen to Earth
  from the 15N/14N isotopic ratio","Accepted for publication in ICARUS",,"10.1016/j.icarus.2009.06.021",,"astro-ph.EP","http://arxiv.org/licenses/nonexclusive-distrib/1.0/","  New independent constraints on the amount of water delivered to Earth by
comets are derived using the 15N/14N isotopic ratio, measured to be roughly
twice as high in cometary CN and HCN as in the present Earth. Under reasonable
assumptions, we find that no more than a few percent of Earth's water can be
attributed to comets, in agreement with the constraints derived from D/H. Our
results also suggest that a significant part of Earth's atmospheric nitrogen
might come from comets. Since the 15N/14N isotopic ratio is not different in
Oort-cloud and Kuiper-belt comets, our estimates apply to the contribution of
both types of objects.
","[{""version"":""v1"",""created"":""Mon, 29 Jun 2009 08:40:19 GMT""}]","2015-05-13"
"0906.5222","Marilena Caramazza","M. Caramazza, J.J. Drake, G. Micela, E. Flaccomio","Hard X-ray flux from low-mass stars in the Cygnus OB2 Association","5 pages",,"10.1051/0004-6361/200811342",,"astro-ph.HE","http://arxiv.org/licenses/nonexclusive-distrib/1.0/","  Context. The Cygnus OB2 association, the central engine of the Cygnus X
star-forming region, is the subject of an extensive INTEGRAL Key Project that
will accumulate 6Ms of observations. Analysis of 2Ms of observations by De
Becker and co-workers provides the most sensitive limit yet obtained on hard
X-ray emission from the cluster. Aims. We investigate the X-ray emission in the
20-40 keV band expected from the flaring low-mass stellar population in Cygnus
OB2. We discuss whether such emission needs to be considered in the
interpretation of existing and future X-ray observations of the region, and
whether such observations might provide insight into the high-energy processes
on low-mass pre-main sequence stars. Methods. The total hard X-ray flux from
low-mass stars is estimated by assuming the observed soft X-ray emission stems
from a superposition of flares. We further assume the ratio of hard X-ray to
soft X-ray emission is described by a scaling found for solar flares by Isola
and co-workers. Results. We estimate the low-mass stellar hard X-ray flux in
the 20-40 keV band to lie in the range ~2x10^31-6x10^32 erg/s and discuss some
potential biases that might affect this result. Conclusions. Hard X-ray
emission could lie at a level not much below the current observed flux upper
limits for Cygnus OB2. If this emission could be detected, it would provide
insight into the hard X-ray production of large flares on pre-main sequence
stars. We highlight the penetrating power of hard X-rays from low-mass stellar
populations as a possible pointer to our Galaxy's hidden star-forming clusters
and super-clusters using more sensitive observations from future missions.
","[{""version"":""v1"",""created"":""Mon, 29 Jun 2009 08:41:21 GMT""}]","2015-05-13"
"0906.5223","Manjunath Krishnapur","Peter J. Forrester and Manjunath Krishnapur","Derivation of an eigenvalue probability density function relating to the
  Poincare disk","11 pages; To appear in J.Phys A",,"10.1088/1751-8113/42/38/385204",,"math-ph math.MP math.PR","http://arxiv.org/licenses/nonexclusive-distrib/1.0/","  A result of Zyczkowski and Sommers [J.Phys.A, 33, 2045--2057 (2000)] gives
the eigenvalue probability density function for the top N x N sub-block of a
Haar distributed matrix from U(N+n). In the case n \ge N, we rederive this
result, starting from knowledge of the distribution of the sub-blocks,
introducing the Schur decomposition, and integrating over all variables except
the eigenvalues. The integration is done by identifying a recursive structure
which reduces the dimension. This approach is inspired by an analogous approach
which has been recently applied to determine the eigenvalue probability density
function for random matrices A^{-1} B, where A and B are random matrices with
entries standard complex normals. We relate the eigenvalue distribution of the
sub-blocks to a many body quantum state, and to the one-component plasma, on
the pseudosphere.
","[{""version"":""v1"",""created"":""Mon, 29 Jun 2009 08:48:29 GMT""},{""version"":""v2"",""created"":""Thu, 10 Sep 2009 12:33:13 GMT""}]","2015-05-13"
"0906.5224","Kiwamu Kudo","Kiwamu Kudo, Tazumi Nagasawa, Rie Sato, Koichi Mizushima","Measurement of nonlinear frequency shift coefficient in spin-torque
  oscillators based on MgO tunnel junctions","4 pages, 5 figures; accepted for publication in Applied Physics
  Letters",,"10.1063/1.3176939",,"cond-mat.mtrl-sci cond-mat.other","http://arxiv.org/licenses/nonexclusive-distrib/1.0/","  The nonlinear frequency shift coefficient, which represents the strength of
the transformation of amplitude fluctuations into phase fluctuations of an
oscillator, is measured for MgO-based spin-torque oscillators by analyzing the
current dependence of the power spectrum. We have observed that linewidth
against inverse normalized power plots show linear behavior below and above the
oscillation threshold as predicted by the analytical theories for spin-torque
oscillators. The magnitude of the coefficient is determined from the ratio of
the linear slopes. Small magnitude of the coefficient has been obtained for the
device exhibiting narrow linewidth at high bias current.
","[{""version"":""v1"",""created"":""Mon, 29 Jun 2009 08:50:44 GMT""}]","2015-05-13"
"0906.5225","Laurent Chevillard","Laurent Chevillard, Raoul Robert, Vincent Vargas","A Stochastic Representation of the Local Structure of Turbulence","6 pages, 3 figures, final version, published.","Europhys. Lett. 89, 54002 (2010).","10.1209/0295-5075/89/54002",,"physics.flu-dyn","http://arxiv.org/licenses/nonexclusive-distrib/1.0/","  Based on the mechanics of the Euler equation at short time, we show that a
Recent Fluid Deformation (RFD) closure for the vorticity field, neglecting the
early stage of advection of fluid particles, allows to build a 3D
incompressible velocity field that shares many properties with empirical
turbulence, such as the teardrop shape of the R-Q plane. Unfortunately, non
gaussianity is weak (i.e. no intermittency) and vorticity gets preferentially
aligned with the wrong eigenvector of the deformation. We then show that
slightly modifying the former vectorial field in order to impose the long range
correlated nature of turbulence allows to reproduce the main properties of
stationary flows. Doing so, we end up with a realistic incompressible, skewed
and intermittent velocity field that reproduces the main characteristics of 3D
turbulence in the inertial range, including correct vorticity alignment
properties.
","[{""version"":""v1"",""created"":""Mon, 29 Jun 2009 08:56:53 GMT""},{""version"":""v2"",""created"":""Tue, 24 Nov 2009 23:59:54 GMT""},{""version"":""v3"",""created"":""Sun, 28 Mar 2010 17:15:41 GMT""}]","2010-03-30"
"0906.5227","David P. Lonie","Graham S. Hall and David P. Lonie","Holonomy and Projective Equivalence in 4-Dimensional Lorentz Manifolds","Comments: 23 pages, LaTeX; typos corrected, page 9 last line
  corrected to $g'=e^{2\chi}a^{-1}$","SIGMA 5 (2009), 066, 23 pages","10.3842/SIGMA.2009.066",,"math.DG gr-qc","http://creativecommons.org/licenses/by-nc-sa/3.0/","  A study is made of 4-dimensional Lorentz manifolds which are projectively
related, that is, whose Levi-Civita connections give rise to the same
(unparameterised) geodesics. A brief review of some relevant recent work is
provided and a list of new results connecting projective relatedness and the
holonomy type of the Lorentz manifold in question is given. This necessitates a
review of the possible holonomy groups for such manifolds which, in turn,
requires a certain convenient classification of the associated curvature
tensors. These reviews are provided.
","[{""version"":""v1"",""created"":""Mon, 29 Jun 2009 09:06:22 GMT""},{""version"":""v2"",""created"":""Wed, 12 Aug 2009 14:41:32 GMT""}]","2009-08-12"
"0906.5228","Alexander Voitkiv B","C.M\""uller, A.B.Voitkiv and B.Najjari","Relativistic electron-ion recombination in the presence of an intense
  laser field","4 papes, 2 figures",,"10.1088/0953-4075/42/22/221001",,"physics.atom-ph physics.gen-ph","http://arxiv.org/licenses/nonexclusive-distrib/1.0/","  Radiative recombination of a relativistic electron with a highly charged ion
in the presence of an intense laser field is considered. Various relativistic
effects, caused by the high energy of the incoming electron and its strong
coupling to the intense laser field, are found to clearly manifest themselves
in the spectra of the emitted $\gamma$-photons.
","[{""version"":""v1"",""created"":""Mon, 29 Jun 2009 09:07:58 GMT""}]","2015-05-13"
"0906.5229","Dirk-S\""oren L\""uhmann","Dirk-S\""oren L\""uhmann, Kai Bongs, Daniela Pfannkuche","Excitation spectrum of Mott shells in optical lattices",,"J. Phys. B: At. Mol. Opt. Phys. 42, 145305 (2009)","10.1088/0953-4075/42/14/145305",,"cond-mat.quant-gas","http://arxiv.org/licenses/nonexclusive-distrib/1.0/","  We theoretically study the excitation spectrum of confined macroscopic
optical lattices in the Mott-insulating limit. For large systems, a fast
numerical method is proposed to calculate the ground state filling and
excitation energies. We introduce many-particle on-site energies capturing
multi-band effects and discuss tunnelling on a perturbative level using an
effectively restricted Hilbert space. Results for small one-dimensional
lattices obtained by this method are in good agreement with the exact
multi-band diagonalization of the Hamiltonian. Spectral properties associated
with the formation of regions with constant filling, so-called Mott shells, are
investigated and interfaces between the shells with strong particle
fluctuations are characterized by gapless local excitations.
","[{""version"":""v1"",""created"":""Mon, 29 Jun 2009 15:25:02 GMT""}]","2009-06-30"
"0906.5230","Xueliang Li","Xueliang Li, Yongtang Shi","Randi\'c index, diameter and the average distance","7 pages",,,,"math.CO","http://arxiv.org/licenses/nonexclusive-distrib/1.0/","  The Randi\'c index of a graph $G$, denoted by $R(G)$, is defined as the sum
of $1/\sqrt{d(u)d(v)}$ over all edges $uv$ of $G$, where $d(u)$ denotes the
degree of a vertex $u$ in $G$. In this paper, we partially solve two
conjectures on the Randi\'c index $R(G)$ with relations to the diameter $D(G)$
and the average distance $\mu(G)$ of a graph $G$. We prove that for any
connected graph $G$ of order $n$ with minimum degree $\delta(G)$, if
$\delta(G)\geq 5$, then $R(G)-D(G)\geq \sqrt 2-\frac{n+1} 2$; if $\delta(G)\geq
n/5$ and $n\geq 15$, $\frac{R(G)}{D(G)} \geq \frac{n-3+2\sqrt 2}{2n-2}$ and
$R(G)\geq \mu(G)$. Furthermore, for any arbitrary real number $\varepsilon \
(0<\varepsilon<1)$, if $\delta(G)\geq \varepsilon n$, then $\frac{R(G)}{D(G)}
\geq \frac{n-3+2\sqrt 2}{2n-2}$ and $R(G)\geq \mu(G)$ hold for sufficiently
large $n$.
","[{""version"":""v1"",""created"":""Mon, 29 Jun 2009 09:17:24 GMT""}]","2009-06-30"
"0906.5231","S N Sandhya","Andal Narayan, Abheera Hazra and S. N. Sandhya","Threshold non-linear absorption in Zeeman transitions",,,,,"quant-ph","http://arxiv.org/licenses/nonexclusive-distrib/1.0/","  We experimentally study the absorption spectroscopy from a collection of
gaseous $^87 Rb$ atoms at room temperature irradiated with three fields. Two of
these fields are in a pump probe saturation absorption configuration. The third
field co-propagates with the pump field. The three fields address Zeeman
degenerate transitions between hyperfine levels $5S_{1/2}, F = 1$ and
$5P_{3/2}, F = 0$ and also between $5S_{1/2}, F = 1$ and $5P_{3/2}, F =1$
around the D2 line. We find a sub-natural absorption resonance in the
counter-propagating probe field. The novel feature of this absorption is its
abrupt onset in the vicinity of $5P_{3/2}, F = 0$, as the laser frequency is
scanned from $5P_{3/2}, F = 0$ to $5P_{3/2}, F =1$. The experimental results
are compared with the theory modeled after a four level system. There is a
qualitative agreement between our theory and experiment. We find the threshold
absorption to be a result of the off-resonant interaction of the strong field
with nearby hyperfine levels.
","[{""version"":""v1"",""created"":""Mon, 29 Jun 2009 09:37:46 GMT""}]","2009-06-30"
"0906.5232","Sergey Ustyugov","Sergey D. Ustyugov","Realistic Magnetohydrodynamical Simulation of Solar Local
  Supergranulation","6 pages, 5 figures, submitted to the proceedings of the GONG 2008 /
  SOHO XXI conference",,"10.1088/0031-8949/2010/T142/014031",,"astro-ph.SR","http://arxiv.org/licenses/nonexclusive-distrib/1.0/","  Three-dimensional numerical simulations of solar surface magnetoconvection
using realistic model physics are conducted. The thermal structure of
convective motions into the upper radiative layers of the photosphere, the main
scales of convective cells and the penetration depths of convection are
investigated. We take part of the solar photosphere with size of 60x60 Mm in
horizontal direction and by depth 20 Mm from level of the visible solar
surface. We use a realistic initial model of the Sun and apply equation of
state and opacities of stellar matter. The equations of fully compressible
radiation magnetohydrodynamics with dynamical viscosity and gravity are solved.
We apply: 1) conservative TVD difference scheme for the magnetohydrodynamics,
2) the diffusion approximation for the radiative transfer, 3) dynamical
viscosity from subgrid scale modeling. In simulation we take uniform
two-dimesional grid in gorizontal plane and nonuniform grid in vertical
direction with number of cells 600x600x204. We use 512 processors with
distributed memory multiprocessors on supercomputer MVS-100k in the Joint
Computational Centre of the Russian Academy of Sciences.
","[{""version"":""v1"",""created"":""Mon, 29 Jun 2009 09:38:09 GMT""},{""version"":""v2"",""created"":""Mon, 29 Jun 2009 20:25:36 GMT""}]","2015-05-13"
"0906.5233","Toby Walsh","George Katsirelos, Sebastian Maneth, Nina Narodytska, Toby Walsh","Restricted Global Grammar Constraints","Proceedings of the 15th International Conference on Principles and
  Practice of Constraint Programming, Lisbon, Portugal. September 2009",,,,"cs.AI cs.FL","http://arxiv.org/licenses/nonexclusive-distrib/1.0/","  We investigate the global GRAMMAR constraint over restricted classes of
context free grammars like deterministic and unambiguous context-free grammars.
We show that detecting disentailment for the GRAMMAR constraint in these cases
is as hard as parsing an unrestricted context free grammar.We also consider the
class of linear grammars and give a propagator that runs in quadratic time.
Finally, to demonstrate the use of linear grammars, we show that a weighted
linear GRAMMAR constraint can efficiently encode the EDITDISTANCE constraint,
and a conjunction of the EDITDISTANCE constraint and the REGULAR constraint
","[{""version"":""v1"",""created"":""Mon, 29 Jun 2009 09:23:39 GMT""}]","2009-06-30"
"0906.5234","Yupeng Yan","Y. Yan, K. Khosonthongkee, C. Kobdaj, P. Suebka","Electron-Positron to Nucleon-Antinucleon Pair at Threshold and Proton
  Form Factor","13 pages, 8 figures",,,,"hep-ph","http://arxiv.org/licenses/nonexclusive-distrib/1.0/","  The reactions of electron-positron to nucleon-antinucleon pair at energy
threshold are studied in a non-perturbative quark model. The puzzling
experimental result that the ratio of the cross section of electron-positron to
proton-antiproton to the one of electron-positron to neutron-antineutron is
smaller than 1 can be understood in the framework of the phenomenological
nonrelativistic quark model and the theoretical predictions for the time-like
proton form factor at energy threshold are well consistent with the
experimental data. The work suggests that the two-step process, in which the
primary quark-antiquark pair forms first a vector meson which in turn decays
into a hadron pair, is dominant over the one-step process in which the primary
quark-antiquark pair is directly dressed by additional quark-antiquark pairs to
form a hadron pair. The experimental data on the reactions of electron-positron
to nucleon-antinucleon strongly suggest the reported vector meson omega(1930)
to be a 2D-wave particle, while the vector meson rho(2000) is preferred to be a
mixture of 3S and 2D states.
","[{""version"":""v1"",""created"":""Mon, 29 Jun 2009 09:24:36 GMT""},{""version"":""v2"",""created"":""Fri, 3 Jul 2009 08:43:32 GMT""}]","2009-07-03"
"0906.5235","Peng Li","Peng Li, Haibin Su, Hui-Ning Dong, Shun-Qing Shen","Incommensurate Phase of a Triangular Frustrated Heisenberg Model Studied
  via Schwinger-Boson Mean-Field Theory","9pages, 3figures","J. Phys.: Condens. Matter 21 (2009) 326005","10.1088/0953-8984/21/32/326005",,"cond-mat.str-el cond-mat.mtrl-sci","http://arxiv.org/licenses/nonexclusive-distrib/1.0/","  We study a triangular frustrated antiferromagnetic Heisenberg model with
nearest-neighbor interaction $J_{1}$ and third-nearest-neighbor interactions
$J_{3}$ by means of Schwinger-boson mean-field theory. It is shown that an
incommensurate phase exists in a finite region in the parameter space for an
antiferromagnetic $J_{3}$ while $J_{1}$ can be either positive or negtaive. A
detailed solution is presented to disclose the main features of this
incommensurate phase. A gapless dispersion of quasiparticles leads to the
intrinsic $T^{2}$-law of specific heat. The local magnetization is
significantly reduced by quantum fluctuations (for S=1 case, a local
magnetization is estimated as $m=<S_{i}> \approx0.6223$). The magnetic
susceptibility is linear in temperature at low temperatures. We address
possible relevance of these results to the low-temperature properties of
NiGa$_{2}$S$_{4}$. From a careful analysis of the incommensurate spin wave
vector, the interaction parameters for NiGa$_{2}% $S$_{4}$ are estimated as,
$J_{1}\approx-3.8755$K and $J_{3}\approx14.0628$K, in order to account for the
experimental data.
","[{""version"":""v1"",""created"":""Mon, 29 Jun 2009 09:27:39 GMT""}]","2009-08-02"
"0906.5236","Jean-Christophe Novelli","Jean-Christophe Novelli, Franco Saliola, Jean-Yves Thibon","Representation theory of the higher order peak algebras","30 pages","J. Algebraic Combin. 32 (2010), 465-495",,,"math.CO math.RT","http://arxiv.org/licenses/nonexclusive-distrib/1.0/","  The representation theory (idempotents, quivers, Cartan invariants and Loewy
series) of the higher order unital peak algebras is investigated. On the way,
we obtain new interpretations and generating functions for the idempotents of
descent algebras introduced in [F. Saliola, J. Algebra 320 (2008) 3866.]
","[{""version"":""v1"",""created"":""Mon, 29 Jun 2009 10:51:41 GMT""}]","2013-02-12"
"0906.5237","Jinwu Jiang","Jin-Wu Jiang, Jian-Sheng Wang, Baowen Li","Young's modulus of Graphene: a molecular dynamics study","accepted by PRB, brief report, discussion on Poisson ratio added","Phys. Rev. B 80, 113405 (2009)","10.1103/PhysRevB.80.113405",,"cond-mat.mtrl-sci","http://arxiv.org/licenses/nonexclusive-distrib/1.0/","  The Young's modulus of graphene is investigated through the intrinsic thermal
vibration in graphene which is `observed' by molecular dynamics, and the
results agree quite well with the recent experiment [Science \textbf{321}, 385
(2008)]. This method is further applied to show that the Young's modulus of
graphene: 1. increases with increasing size and saturation is reached after a
threshold value of the size; 2. increases from 0.95 TPa to 1.1 TPa as
temperature increases in the region [100, 500]K; 3. is insensitive to the
isotopic disorder in the low disorder region ($< 5%$), and decreases gradually
after further increasing the disorder percentage.
","[{""version"":""v1"",""created"":""Mon, 29 Jun 2009 12:14:04 GMT""},{""version"":""v2"",""created"":""Thu, 3 Sep 2009 00:00:38 GMT""}]","2009-09-24"
"0906.5238","Shabnam Akhtari","Shabnam Akhtari","The Method Of Thue-Siegel For Binary Quartic Forms","A version of this paper is to appear in Acta. Arith",,"10.4064/aa141-1-1",,"math.NT","http://arxiv.org/licenses/nonexclusive-distrib/1.0/","  We will use Thue-Siegel method, based on Pad\'e approximation via
hypergeometric functions, to give upper bounds for the number of integral
solutions to the equation $|F(x, y)| = 1$ as well as the inequalities $|F(x,
y)| \leq h$, for a certain family of irreducible quartic binary forms.
","[{""version"":""v1"",""created"":""Mon, 29 Jun 2009 11:12:53 GMT""}]","2015-05-13"
"0906.5239","Takashi Nakatsukasa","Tsunenori Inakura, Takashi Nakatsukasa, Kazuhiro Yabana","Self-consistent calculation of nuclear photoabsorption cross section:
  Finite amplitude method with Skyrme functionals in the three-dimensional real
  space","11 pages, 10 figures","Phys.Rev.C80:044301,2009","10.1103/PhysRevC.80.044301","RIKEN-NC-NP-36","nucl-th","http://arxiv.org/licenses/nonexclusive-distrib/1.0/","  The finite amplitude method (FAM), which we have recently proposed (T.
Nakatsukasa, T. Inakura, and K. Yabana, Phys. Rev. C 76, 024318 (2007)),
simplifies significantly the fully self-consistent RPA calculation. Employing
the FAM, we are conducting systematic, fully self-consistent response
calculations for a wide mass region. This paper is intended to present a
computational scheme to be used in the systematic investigation and to show the
performance of the FAM for a realistic Skyrme energy functional. We implemented
the method in the mixed representation in which the forward and backward RPA
amplitudes are represented by indices of single-particle orbitals for occupied
states and the spatial grid points for unoccupied states. We solve the linear
response equation for a given frequency. The equation is a linear algebraic
problem with a sparse non-hermitian matrix, which is solved with an iterative
method. We show results of the dipole response for selected spherical and
deformed nuclei. The peak energies of the giant dipole resonance agree well
with measurements for heavy nuclei, while they are systematically
underestimated for light nuclei. We also discuss the width of the giant dipole
resonance in the fully self-consistent RPA calculation.
","[{""version"":""v1"",""created"":""Mon, 29 Jun 2009 11:21:05 GMT""}]","2014-11-20"
