"0906.5405","Albert Fannjiang","Albert C. Fannjiang","Compressive Inverse Scattering I. High Frequency SIMO Measurements","A new section on diffraction tomography added; typos fixed; new
  figures added",,"10.1088/0266-5611/26/3/035008",,"math-ph math.MP","http://arxiv.org/licenses/nonexclusive-distrib/1.0/","  Inverse scattering from discrete targets with the
single-input-multiple-output (SIMO), multiple-input-single-output (MISO) or
multiple-input-multiple-output (MIMO) measurements is analyzed by compressed
sensing theory with and without the Born approximation. High frequency analysis
of (probabilistic) recoverability by the $L^1$-based
minimization/regularization principles is presented. In the absence of noise,
it is shown that the $L^1$-based solution can recover exactly the target of
sparsity up to the dimension of the data either with the MIMO measurement for
the Born scattering or with the SIMO/MISO measurement for the exact scattering.
The stability with respect to noisy data is proved for weak or widely separated
scatterers. Reciprocity between the SIMO and MISO measurements is analyzed.
Finally a coherence bound (and the resulting recoverability) is proved for
diffraction tomography with high-frequency, few-view and limited-angle
SIMO/MISO measurements.
","[{""version"":""v1"",""created"":""Tue, 30 Jun 2009 04:01:41 GMT""},{""version"":""v2"",""created"":""Tue, 5 Jan 2010 00:04:42 GMT""},{""version"":""v3"",""created"":""Mon, 18 Jan 2010 03:22:53 GMT""}]","2015-05-13"
"0906.5406","Franciszek Szafraniec","S. Hassi, H.S.V. de Snoo and F.H. Szafraniec","Componentwise and Cartesian decompositions of linear relations",,,,,"math.FA","http://arxiv.org/licenses/nonexclusive-distrib/1.0/","  Let $A$ be a, not necessarily closed, linear relation in a Hilbert space
$\sH$ with a multivalued part $\mul A$. An operator $B$ in $\sH$ with $\ran
B\perp\mul A^{**}$ is said to be an operator part of $A$ when $A=B \hplus
(\{0\}\times \mul A)$, where the sum is componentwise (i.e. span of the
graphs). This decomposition provides a counterpart and an extension for the
notion of closability of (unbounded) operators to the setting of linear
relations. Existence and uniqueness criteria for the existence of an operator
part are established via the so-called canonical decomposition of $A$. In
addition, conditions are developed for the decomposition to be orthogonal
(components defined in orthogonal subspaces of the underlying space). Such
orthogonal decompositions are shown to be valid for several classes of
relations. The relation $A$ is said to have a Cartesian decomposition if
$A=U+\I V$, where $U$ and $V$ are symmetric relations and the sum is
operatorwise. The connection between a Cartesian decomposition of $A$ and the
real and imaginary parts of $A$ is investigated.
","[{""version"":""v1"",""created"":""Tue, 30 Jun 2009 04:07:55 GMT""}]","2009-07-01"
"0906.5407","Matt Visser","Matt Visser (Victoria University of Wellington) and Celine Cattoen
  (Victoria University of Wellington)","Cosmographic analysis of dark energy","14 pages. To appear in the Proceedings of DARK 2009 -- The Seventh
  International Heidelberg Conference on Dark Matter in Astro and Particle
  Physics, Christchurch, New Zealand, January 2009",,"10.1142/9789814293792_0022",,"gr-qc","http://arxiv.org/licenses/nonexclusive-distrib/1.0/","  The Hubble relation between distance and redshift is a purely cosmographic
relation that depends only on the symmetries of a FLRW spacetime, but does not
intrinsically make any dynamical assumptions. This suggests that it should be
possible to estimate the parameters defining the Hubble relation without making
any dynamical assumptions. To test this idea, we perform a number of
inter-related cosmographic fits to the legacy05 and gold06 supernova datasets,
paying careful attention to the systematic uncertainties. Based on this
supernova data, the ""preponderance of evidence"" certainly suggests an
accelerating universe. However we would argue that (unless one uses additional
dynamical and observational information, and makes additional theoretical
assumptions) this conclusion is not currently supported ""beyond reasonable
doubt"". As part of the analysis we develop two particularly transparent
graphical representations of the redshift-distance relation -- representations
in which acceleration versus deceleration reduces to the question of whether
the relevant graph slopes up or down.
","[{""version"":""v1"",""created"":""Tue, 30 Jun 2009 04:12:29 GMT""}]","2016-11-15"
"0906.5408","Franciszek Szafraniec","F.H. Szafraniec","Murphy's {\em Positive definite kernels and Hilbert C${}^*$--modules}
  reorganized",,,,,"math.OA","http://arxiv.org/licenses/nonexclusive-distrib/1.0/","  The paper the title refers to is that in {\em Proceedings of the Edinburgh
Mathematical Society}, {\bf 40} (1997), 367-374. Taking it as an excuse we
intend to realize a twofold purpose: to atomize that important result showing
by the way connections which are out of favour and to rectify a tiny piece of
history.
","[{""version"":""v1"",""created"":""Tue, 30 Jun 2009 04:13:11 GMT""}]","2009-07-01"
"0906.5409","Ken Wharton","K.B. Wharton","Extending Hamilton's principle to quantize classical fields","10 pages, to be submitted to PRL, comments welcome",,,,"quant-ph physics.class-ph","http://arxiv.org/licenses/nonexclusive-distrib/1.0/","  Hamilton's principle does not formally apply to systems whose boundary
conditions lie outside configuration space, but extensions are possible using
certain ""natural"" boundary conditions that allow action extremization. With the
single conjecture that only such action-extremizing boundaries can be
physically realized, the classical relativistic scalar field becomes subject to
certain quantization conditions upon measurement. These conditions appear to be
analogous to Bohr-Sommerfeld quantization, and are derived explicitly for the
case of angular momentum measurements of a classical scalar field.
","[{""version"":""v1"",""created"":""Tue, 30 Jun 2009 04:24:55 GMT""}]","2009-07-14"
"0906.5410","Franciszek Szafraniec","D. Cicho\'n, J. Stochel, F.H. Szafraniec","Extending positive definiteness",,,,,"math.FA","http://arxiv.org/licenses/nonexclusive-distrib/1.0/","  The main result of the paper gives criteria for extendibility of sesquilinear
form-valued mappings defined on symmetric subsets of *-semigroups to positive
definite ones. By specifying this we obtain new solutions of:
  * the truncated complex moment problem,
  * the truncated multidimensional trigonometric moment problem,
  * the truncated two-sided complex moment problem, as well as
characterizations of unbounded subnormality and criteria for the existence of
unitary power dilation.
","[{""version"":""v1"",""created"":""Tue, 30 Jun 2009 04:32:26 GMT""}]","2009-07-01"
"0906.5411","Tai-Kai Ng","Tai-Kai Ng","Ginzburg-Landau theory of dirty two band $s_{\pm}$ superconductors","4 pages, 1 figure","Phys. Rev. Lett. 103, 236402 (2009)","10.1103/PhysRevLett.103.236402",,"cond-mat.supr-con","http://arxiv.org/licenses/nonexclusive-distrib/1.0/","  In this paper we study the effect of non-magnetic impurities on two-band
$s_{\pm}$ superconductors by deriving the corresponding Ginzburg-Landau (GL)
equation. Depending on the strength of (impurity-induced) inter-band scattering
we find that there are two distinctive regions where the superconductors behave
very differently. In the strong impurity induced inter-band scattering regime
$T_c<<\tau^{-1}_t$, where $\tau_t\sim$ mean-life time an electron stays in one
band the two-band superconductor behaves as an effective one-band dirty
superconductor. In the other limit $T_c\geq\tau^{-1}_t$, the dirty two-band
superconductor is described by a network of frustrated two-band superconductor
grains connected by Josepshon tunnelling junctions. We argue that most pnictide
superconductors are in the later regime.
","[{""version"":""v1"",""created"":""Tue, 30 Jun 2009 04:36:00 GMT""}]","2015-05-13"
"0906.5412","Franciszek Szafraniec","F.H.Szafraniec","Normals, subnormals and an open question",,,,,"math.FA","http://arxiv.org/licenses/nonexclusive-distrib/1.0/","  An acute look at \underbar{basic} facts concerning \underbar{unbounded}
subnormal operators is taken here. These operators have the richest structure
and are the most exciting among the whole family of beneficiaries of the normal
ones. Therefore, the latter must necessarily be taken into account as the
reference point for any exposition of subnormality. So as to make the
presentation more appealing a kind of comparative survey of the bounded and
unbounded case has been set forth.
  \noindent This piece of writing serves rather as a practical guide to this
largely impenetrable territory than an exhausting report.
","[{""version"":""v1"",""created"":""Tue, 30 Jun 2009 04:40:45 GMT""}]","2009-07-01"
"0906.5413","Vladimir Ivancevic","Vladimir G. Ivancevic, Eugene V. Aidman and Leong Yen","Extending Feynman's Formalisms for Modelling Human Joint Action
  Coordination","6 pages, Latex",,,,"nlin.AO","http://arxiv.org/licenses/nonexclusive-distrib/1.0/","  The recently developed Life-Space-Foam approach to goal-directed human action
deals with individual actor dynamics. This paper applies the model to
characterize the dynamics of co-action by two or more actors. This dynamics is
modelled by: (i) a two-term joint action (including cognitive/motivatonal
potential and kinetic energy), and (ii) its associated adaptive path integral,
representing an infinite--dimensional neural network. Its feedback adaptation
loop has been derived from Bernstein's concepts of sensory corrections loop in
human motor control and Brooks' subsumption architectures in robotics.
Potential applications of the proposed model in human--robot interaction
research are discussed.
  Keywords: Psycho--physics, human joint action, path integrals
","[{""version"":""v1"",""created"":""Tue, 30 Jun 2009 04:57:10 GMT""}]","2009-07-01"
"0906.5414","Jorgen Rasmussen","Jorgen Rasmussen","Fusion of irreducible modules in WLM(p,p')","25 pages, v3: new section, comments and a reference added","J.Phys.A43:045210,2010","10.1088/1751-8113/43/4/045210",,"hep-th","http://arxiv.org/licenses/nonexclusive-distrib/1.0/","  Based on symmetry principles, we derive a fusion algebra generated from
repeated fusions of the irreducible modules appearing in the W-extended
logarithmic minimal model WLM(p,p'). In addition to the irreducible modules
themselves, closure of the commutative and associative fusion algebra requires
the participation of a variety of reducible yet indecomposable modules. We
conjecture that this fusion algebra is the same as the one obtained by
application of the Nahm-Gaberdiel-Kausch algorithm and find that it reproduces
the known such results for WLM(1,p') and WLM(2,3). For p>1, this fusion algebra
does not contain a unit. Requiring that the spectrum of modules is invariant
under a natural notion of conjugation, however, introduces an additional
(p-1)(p'-1) reducible yet indecomposable rank-1 modules, among which the
identity is found, still yielding a well-defined fusion algebra. In this
greater fusion algebra, the aforementioned symmetries are generated by fusions
with the three irreducible modules of conformal weights Delta_{kp-1,1},
k=1,2,3. We also identify polynomial fusion rings associated with our fusion
algebras.
","[{""version"":""v1"",""created"":""Tue, 30 Jun 2009 05:11:41 GMT""},{""version"":""v2"",""created"":""Sun, 12 Jul 2009 09:13:37 GMT""},{""version"":""v3"",""created"":""Thu, 10 Dec 2009 02:11:51 GMT""}]","2010-01-15"
"0906.5415","Vladimir Ivancevic","Vladimir G. Ivancevic, Darryn J. Reid, and Eugene V. Aidman","Crowd Behavior Dynamics: Entropic Path-Integral Model","32 pages, 2 figures, Latex. Nonlinear Dynamics, to appear",,,,"nlin.AO","http://arxiv.org/licenses/nonexclusive-distrib/1.0/","  We propose an entropic geometrical model of crowd behavior dynamics (with
dissipative crowd kinematics), using Feynman action--amplitude formalism that
operates on three synergetic levels: macro, meso and micro. The intent is to
explain the dynamics of crowds simultaneously and consistently across these
three levels, in order to characterize their geometrical properties
particularly with respect to behavior regimes and the state changes between
them. Its most natural statistical descriptor (order parameter) is crowd
entropy $S$ that satisfies the Prigogine's extended second law of
thermodynamics, $\partial_t S\geq 0$ (for any nonisolated multi-component
system). Qualitative similarities and superpositions between individual and
crowd configuration manifolds motivate our claim that \emph{goal-directed crowd
movement} operates under entropy conservation, $\partial_t S = 0$, while
\emph{naturally chaotic crowd dynamics} operates under (monotonically)
increasing entropy function, $\partial_t S > 0$. Between these two distinct
topological phases lies a phase transition with a chaotic inter-phase. Both
inertial crowd dynamics and its dissipative kinematics represent diffusion
processes on the crowd manifold governed by the Ricci flow.
  Keywords: Crowd behavior dynamics, action--amplitude formalism, entropic
crowd manifold, crowd turbulence, Ricci flow, topological phase transitions.
","[{""version"":""v1"",""created"":""Tue, 30 Jun 2009 05:11:47 GMT""}]","2009-07-01"
"0906.5416","Zhengfeng Ji","Zhengfeng Ji, Xiaodi Wu","Non-Identity Check Remains QMA-Complete for Short Circuits","8 pages",,,,"quant-ph","http://arxiv.org/licenses/nonexclusive-distrib/1.0/","  The Non-Identity Check problem asks whether a given a quantum circuit is far
away from the identity or not. It is well known that this problem is
QMA-Complete \cite{JWB05}. In this note, it is shown that the Non-Identity
Check problem remains QMA-Complete for circuits of short depth. Specifically,
we prove that for constant depth quantum circuit in which each gate is given to
at least $\Omega(\log n)$ bits of precision, the Non-Identity Check problem is
QMA-Complete. It also follows that the hardness of the problem remains for
polylogarithmic depth circuit consisting of only gates from any universal gate
set and for logarithmic depth circuit using some specific universal gate set.
","[{""version"":""v1"",""created"":""Tue, 30 Jun 2009 06:11:22 GMT""}]","2009-07-01"
"0906.5417","Yao Cheng","Yao Cheng","Quantum phase transition of the 103mRh spin-density wave","ICAME09, vienna, July 19-24, 2009",,,,"quant-ph","http://arxiv.org/licenses/nonexclusive-distrib/1.0/","  We induce a quantum phase transition of the 103mRh excitation at the critical
density of 10^{12} cm^{-3} by bremsstrahlung pumping at 300 K. A massive 103mRh
spin-density wave carrying a spin current moves on the identical 103Rh matrix
like a quantum fluid. The collapse-and-revival spectral evolution indicates
that the collective nuclear excitation undergoes dynamic Bose-Einstein
condensation. Applying an external magnetic field, we observe the
Onsager-Feynman quantization, which gives further evidence of the superfluidic
phase.
","[{""version"":""v1"",""created"":""Tue, 30 Jun 2009 15:08:11 GMT""}]","2009-07-01"
"0906.5419","Koji Nuida","Koji Nuida, Gen Kimura, Takayuki Miyadera","Optimal Observables for Minimum-Error State Discrimination in General
  Probabilistic Theories","30 pages, 2 figures","Journal of Mathematical Physics 51, 093505 (2010)","10.1063/1.3479008",,"quant-ph math-ph math.MP","http://arxiv.org/licenses/nonexclusive-distrib/1.0/","  General Probabilistic Theories provide the most general mathematical
framework for the theory of probability in an operationally natural manner, and
generalize classical and quantum theories. In this article, we study
state-discrimination problems in general probabilistic theories using a
Bayesian strategy. After re-formulation of the theories with mathematical
rigor, we first prove that an optimal observable to discriminate any (finite)
number of states always exists in the most general setting. Next, we revisit
our recently proposed geometric approach for the problem and show that, for
two-state discrimination, this approach is indeed effective in arbitrary
dimensional cases. Moreover, our method reveals an operational meaning of
Gudder's ``intrinsic metric'' by means of the optimal success probability,
which turns out to be a generalization of the trace distance for quantum
systems. As its by-product, an information-disturbance theorem in general
probabilistic theories is derived, generalizing its well known quantum version.
","[{""version"":""v1"",""created"":""Tue, 30 Jun 2009 06:38:50 GMT""}]","2010-09-15"
"0906.5420","Yakov Greenberg","Ya. S. Greenberg, E. Il'ichev, and Franco Nori","Cooling a magnetic resonance force microscope via the dynamical
  back-action of nuclear spins","15 pqges, 11 figures. The last part of Section IV.A and Section IV B
  were rewritten. We added three new graphs: Figs. 5, 7, 9 and all graphs in
  this subsection were recalculated for T=600 mK as in the experiment. Several
  new references were added","Phys. Rev. B. 80 (2009) 214423 (13pp)","10.1103/PhysRevB.80.214423",,"cond-mat.mes-hall","http://arxiv.org/licenses/nonexclusive-distrib/1.0/","  We analyze the back-action influence of nuclear spins on the motion of the
cantilever of a magnetic force resonance microscope. We calculate the
contribution of nuclear spins to the damping and frequency shift of the
cantilever. We show that, at the Rabi frequency, the energy exchange between
the cantilever and the spin system cools or heats the cantilever depending on
the sign of the high-frequency detuning. We also show that the spin noise leads
to a significant damping of the cantilever motion.
","[{""version"":""v1"",""created"":""Tue, 30 Jun 2009 06:39:39 GMT""},{""version"":""v2"",""created"":""Sun, 15 Nov 2009 07:03:34 GMT""}]","2013-05-29"
"0906.5421","Victor Efros","N. Barnea, V.D. Efros, W. Leidemann, and G. Orlandini","The Lorentz Integral Transform and its Inversion","10 pages, this version has been made more self-contained","Few Body Syst.47:201-206,2010","10.1007/s00601-009-0081-0",,"nucl-th","http://arxiv.org/licenses/nonexclusive-distrib/1.0/","  The Lorentz integral transform method is briefly reviewed. The issue of the
inversion of the transform, and in particular its ill-posedness, is addressed.
It is pointed out that the mathematical term ill-posed is misleading and merely
due to a historical misconception. In this connection standard regularization
procedures for the solution of the integral transform problem are presented. In
particular a recent one is considered in detail and critical comments on it are
provided. In addition a general remark concerning the concept of the Lorentz
integral transform as a method with a controlled resolution is made.
","[{""version"":""v1"",""created"":""Tue, 30 Jun 2009 07:15:21 GMT""},{""version"":""v2"",""created"":""Wed, 23 Dec 2009 16:15:20 GMT""}]","2010-05-07"
"0906.5422","Slava Khruschev","V. V. Khruschov","Symmetries of fundamental interactions in quantum phase space","5 pages, LaTeX, reference added, corrected style and typos","Grav. Cosmol., 2009, Vol.15, No.4, pp. 323 - 326","10.1134/S0202289309040069",,"hep-th","http://arxiv.org/licenses/nonexclusive-distrib/1.0/","  Quantum operators of coordinates and momentum components of a particle in
Minkowski space-time belong to a noncommutative algebra and give rise to a
quantum phase space. Under some constraints, in particular, the Lorentz
invariance condition, the algebra of observables, including Lorentz group
generators, depends on additional fundamental physical constants with the
dimensions of mass, length and action. Generalized symmetries in a quantum
phase space and some consequences for fundamental interactions of particles are
considered.
","[{""version"":""v1"",""created"":""Tue, 30 Jun 2009 07:21:56 GMT""},{""version"":""v2"",""created"":""Tue, 20 Oct 2009 08:46:48 GMT""}]","2009-10-20"
"0906.5423","Yoshiaki Kato","Y. Kato, M. Miyoshi, R. Takahashi, H. Negoro, and R. Matsumoto","Measuring spin of a supermassive black hole at the Galactic centre --
  Implications for a unique spin","5 pages, 3 figures, accepted by MNRAS LETTER",,"10.1111/j.1745-3933.2010.00818.x",,"astro-ph.GA astro-ph.CO","http://arxiv.org/licenses/nonexclusive-distrib/1.0/","  We determine the spin of a supermassive black hole in the context of
discseismology by comparing newly detected quasi-periodic oscillations (QPOs)
of radio emission in the Galactic centre, Sagittarius A* (Sgr A*), as well as
infrared and X-ray emissions with those of the Galactic black holes. We find
that the spin parameters of black holes in Sgr A* and in Galactic X-ray sources
have a unique value of $\approx 0.44$ which is smaller than the generally
accepted value for supermassive black holes, suggesting evidence for the
angular momentum extraction of black holes during the growth of supermassive
black holes. Our results demonstrate that the spin parameter approaches the
equilibrium value where spin-up via accretion is balanced by spin-down via the
Blandford-Znajek mechanism regardless of its initial spin. We anticipate that
measuring the spin of black holes by using QPOs will open a new window for
exploring the evolution of black holes in the Universe.
","[{""version"":""v1"",""created"":""Tue, 30 Jun 2009 07:24:41 GMT""},{""version"":""v2"",""created"":""Sat, 23 Jan 2010 04:11:23 GMT""}]","2015-05-13"
"0906.5424","Letizia Stanghellini","L. Stanghellini, T.-H. Lee, R. A. Shaw, B. Balick, E. Villaver","Carbon abundance in Small Magellanic Cloud planetary nebulae through
  Advanced Camera for Surveys prism spectroscopy: constraining stellar
  evolution at low metallicity","The Astrophysical Journal, in press","Astrophys.J.702:733-744,2009","10.1088/0004-637X/702/1/733",,"astro-ph.SR astro-ph.CO","http://arxiv.org/licenses/nonexclusive-distrib/1.0/","  We perform near ultraviolet ACS prism spectroscopy of 11 Small Magellanic
Cloud (SMC) planetary nebulae (PNe) with the main aim of deriving the abundance
of carbon. The analysis of the ACS spectra provide reliable atomic carbon
abundances for all but a couple of our targets; ionic C^(2+) abundances are
calculated for all target PNe. With the present paper we more than double the
number of SMC PNe with known carbon abundances, providing a good database to
study the elemental evolution in low- and intermediate-mass stars at low
metallicity. We study carbon abundances of Magellanic Cloud PNe in the
framework of stellar evolution models and the elemental yields. Constraining
SMC and LMC stellar evolutionary models is now possible with the present data,
through the comparison of the final yields calculated and the CNO abundances
observed. We found that SMC PNe are almost exclusively carbon rich, and that
for the most part they have not undergone the hot-bottom burning phase,
contrary to half of the studied LMC PNe. The yields from stellar evolutionary
models with LMC and SMC metallicities broadly agree with the observations. In
particular, evolutionary yields for M$_{\rm to}<3.5 {\rm M}_{\odot}$ well
encompass the abundances of round and elliptical PNe in the SMC. We found that
the carbon emission lines are major coolants for SMC PNe, more so than in their
LMC counterparts, indicating that metallicity has an effect on the physics of
PNe, as predicted by Stanghellini et al. (2003).
","[{""version"":""v1"",""created"":""Tue, 30 Jun 2009 07:31:04 GMT""}]","2009-08-24"
"0906.5425","Ernst Donth","E. Donth","Comment on ""Search for the Standard Model Higgs Boson in the Missing
  Energy and Acoplanar b-Jet Topology at $\sqrt{s} = 1.96$ TeV""","stylistic improvement in second version",,,,"physics.gen-ph","http://arxiv.org/licenses/nonexclusive-distrib/1.0/","  A DO paper of 2008 is exemplarily commented to demonstrate the general risk
that the development of a new paradigm for astroparticle physics can be
hindered by the work of large collaborations. This paper allows sharp
formulations because only the simplest Higgs variant is treated.
  PACS numbers: 01.10 Hx, 13.85 Rm, 14.80 Bn
","[{""version"":""v1"",""created"":""Tue, 30 Jun 2009 07:30:54 GMT""},{""version"":""v2"",""created"":""Mon, 3 Aug 2009 13:48:02 GMT""}]","2009-08-03"
"0906.5426","Anindya Biswas","Anindya Biswas","Effect of realistic interatomic interactions and two-body correlation on
  the heat capacity of a trapped BEC","15 pages, 5 figures","2009 J. Phys. B: At. Mol. Opt. Phys. 42 215302","10.1088/0953-4075/42/21/215302",,"cond-mat.quant-gas","http://arxiv.org/licenses/nonexclusive-distrib/1.0/","  An approximate many-body theory has been used to calculate the heat capacity
and the condensate fraction of a BEC with effective repulsive interaction. The
effect of interactions has been analyzed and compared with the non-interacting
case. It has been found that the repulsive interaction lowers the critical
temperature from the value found in the non-interacting case. The difference
between the critical temperatures increases with the increase in the total
number of atoms in the trap.
","[{""version"":""v1"",""created"":""Tue, 30 Jun 2009 07:33:11 GMT""},{""version"":""v2"",""created"":""Tue, 22 Sep 2009 06:47:24 GMT""}]","2009-10-16"
