"0906.5349","Hakim Atek","Hakim Atek (1), Daniel Kunth (1), Daniel Schaerer (2), Matthew Hayes
  (2), Jean-Michel Deharveng (3), Goran Ostlin (4), J. Miguel Mas-Hesse (5)
  ((1) IAP, (2) Observatoire de Geneve, (3) LAM, (4) OKC Stockholm, (5)
  CSIC-INTA)","Empirical Estimate of Lyman-alpha Escape Fraction in a Statistical
  Sample of Lyman-alpha Emitters","4 pages, 2 figures, accepted for publication in Astronomy and
  Astrophysics",,"10.1051/0004-6361/200912787",,"astro-ph.CO","http://arxiv.org/licenses/nonexclusive-distrib/1.0/","  The Lyman-alpha (Lya) recombination line is a fundamental tool for galaxy
evolution studies and modern observational cosmology. However, subsequent
interpretations are still prone to a number of uncertainties. Besides numerical
efforts, empirical data are urgently needed for a better understanding of Lya
escape process. We empirically estimate the Lyman-alpha escape fraction
fesc(Lya) in a statistically significant sample of z ~ 0 - 0.3 galaxies in
order to calibrate high-redshift Lyman-alpha observations. An optical
spectroscopic follow-up of a sub-sample of 24 Lyman-alpha emitters (LAEs)
detected by GALEX at z ~ 0.2-0.3, combined with a UV-optical sample of local
starbursts, both with matched apertures, allow us to quantify the dust
extinction through Balmer lines, and to estimate the Lyman-alpha escape
fraction from the Halpha flux corrected for extinction in the framework of the
recombination theory. The global escape fraction of Lyman-alpha radiation spans
nearly the entire range of values, from 0.5 to 100 %, and fesc(Lya) clearly
decreases with increasing nebular dust extinction E(B-V). Several objects show
fesc(Lya) greater than fesc(continuum) which may be an observational evidence
for clumpy ISM geometry or for an aspherical ISM. Selection biases and aperture
size effects may still prevail between z ~ 0.2-0.3 LAEs and local starbursts,
which may explain the difference observed for fesc(Lya).
","[{""version"":""v1"",""created"":""Mon, 29 Jun 2009 20:00:09 GMT""},{""version"":""v2"",""created"":""Tue, 15 Sep 2009 12:55:06 GMT""}]","2015-05-13"
"0906.5351","Oleg Y. Gnedin","Oleg Y. Gnedin, Thomas J. Maccarone, Dimitrios Psaltis, Stephen E.
  Zepf","Shrinking the Braneworld: Black Hole in a Globular Cluster",,"Astrophys.J.705:L168-L171,2009","10.1088/0004-637X/705/2/L168",,"astro-ph.CO astro-ph.GA gr-qc","http://arxiv.org/licenses/nonexclusive-distrib/1.0/","  Large extra dimensions have been proposed as a possible solution to the
hierarchy problem in physics. One of the suggested models, the RS2 braneworld
model, makes a prediction that black holes evaporate by Hawking radiation on a
short timescale that depends on the black hole mass and on the asymptotic
radius of curvature of the extra dimensions. Thus the size of the extra
dimensions can be constrained by astrophysical observations. Here we point out
that the black hole, recently discovered in a globular cluster in galaxy NGC
4472, places the strongest constraint on the maximum size of the extra
dimensions, L < 0.003 mm. This black hole has the virtues of old age and
relatively small mass. The derived upper limit is within an order of magnitude
of the absolute limit afforded by astrophysical observations of black holes.
","[{""version"":""v1"",""created"":""Mon, 29 Jun 2009 20:06:39 GMT""}]","2009-11-05"
"0906.5352","Jacob Simon","Jacob B. Simon, John F. Hawley","Viscous and Resistive Effects on the MRI with a Net Toroidal Field","Accepted to ApJ; version 2 - minor changes following review; 35 pages
  (preprint format), 10 figures","Astrophys.J.707:833-843,2009","10.1088/0004-637X/707/1/833",,"astro-ph.HE astro-ph.SR","http://arxiv.org/licenses/nonexclusive-distrib/1.0/","  Resistivity and viscosity have a significant role in establishing the energy
levels in turbulence driven by the magnetorotational instability (MRI) in local
astrophysical disk models. This study uses the Athena code to characterize the
effects of a constant shear viscosity \nu and Ohmic resistivity \eta in
unstratified shearing box simulations with a net toroidal magnetic flux. A
previous study of shearing boxes with zero net magnetic field performed with
the ZEUS code found that turbulence dies out for values of the magnetic Prandtl
number, P_m = \nu/\eta, below P_m \sim 1; for P_m \gtrsim 1, time- and
volume-averaged stress levels increase with P_m. We repeat these experiments
with Athena and obtain consistent results. Next, the influence of viscosity and
resistivity on the toroidal field MRI is investigated both for linear growth
and for fully-developed turbulence. In the linear regime, a sufficiently large
\nu or \eta can prevent MRI growth; P_m itself has little direct influence on
growth from linear perturbations. By applying a range of values for \nu and
\eta to an initial state consisting of fully developed turbulence in the
presence of a background toroidal field, we investigate their effects in the
fully nonlinear system. Here, increased viscosity enhances the turbulence, and
the turbulence decays only if the resistivity is above a critical value;
turbulence can be sustained even when P_m < 1, in contrast to the zero net
field model. While we find preliminary evidence that the stress converges to a
small range of values when \nu and \eta become small enough, the influence of
dissipation terms on MRI-driven turbulence for relatively large \eta and \nu is
significant, independent of field geometry.
","[{""version"":""v1"",""created"":""Tue, 30 Jun 2009 15:32:20 GMT""},{""version"":""v2"",""created"":""Thu, 22 Oct 2009 20:03:03 GMT""}]","2011-02-11"
"0906.5353","Marco Baldi","Marco Baldi (ITP, Heidelberg & MPA, Garching)","Simulations of structure formation in interacting dark energy
  cosmologies","to appear in the proceedings volume of the GGI Dark Energy
  Conference, Florence, Italy, March 2009","Nucl.Phys.Proc.Suppl.194:178-184,2009","10.1016/j.nuclphysbps.2009.07.017",,"astro-ph.CO","http://arxiv.org/licenses/nonexclusive-distrib/1.0/","  The evidence in favor of a dark energy component dominating the Universe, and
driving its presently accelerated expansion, has progressively grown during the
last decade of cosmological observations. If this dark energy is given by a
dynamic scalar field, it may also have a direct interaction with other matter
fields in the Universe, in particular with cold dark matter. Such interaction
would imprint new features on the cosmological background evolution as well as
on the growth of cosmic structure, like an additional long-range fifth-force
between massive particles, or a variation in time of the dark matter particle
mass. We review here the implementation of these new physical effects in the
N-body code GADGET-2, and we discuss the outcomes of a series of
high-resolution N-body simulations for a selected family of interacting dark
energy models, as already presented in Baldi et al. [20]. We interestingly
find, in contrast with previous claims, that the inner overdensity of dark
matter halos decreases in these models with respect to LCDM, and consistently
halo concentrations show a progressive reduction for increasing couplings.
Furthermore, the coupling induces a bias in the overdensities of cold dark
matter and baryons that determines a decrease of the halo baryon fraction below
its cosmological value. These results go in the direction of alleviating
tensions between astrophysical observations and the predictions of the LCDM
model on small scales, thereby opening new room for coupled dark energy models
as an alternative to the cosmological constant.
","[{""version"":""v1"",""created"":""Mon, 29 Jun 2009 20:16:42 GMT""}]","2009-11-05"
"0906.5354","Marcelo J. Reboucas","M.J. Reboucas, J. Santos","G\""{o}del-type universes in f(R) gravity","7 pages, V3: Version to appear in Phys. Rev. D (2009), typos
  corrected, the generality of our main results is emphasized. The illustrative
  character of a particular theory is also made explicit","Phys.Rev.D80:063009,2009","10.1103/PhysRevD.80.063009",,"astro-ph.CO gr-qc hep-th","http://arxiv.org/licenses/nonexclusive-distrib/1.0/","  The $f(R)$ gravity theories provide an alternative way to explain the current
cosmic acceleration without a dark energy matter component. If gravity is
governed by a $f(R)$ theory a number of issues should be reexamined in this
framework, including the violation of causality problem on nonlocal scale. We
examine the question as to whether the $f(R)$ gravity theories permit
space-times in which the causality is violated. We show that the field
equations of these $f(R)$ gravity theories do not exclude solutions with
breakdown of causality for a physically well-motivated perfect-fluid matter
content. We demonstrate that every perfect-fluid G\""{o}del-type solution of a
generic $f(R)$ gravity satisfying the condition $df/dR > 0$ is necessarily
isometric to the G\""odel geometry, and therefore presents violation of
causality. This result extends a theorem on G\""{o}del-type models, which has
been established in the context of general relativity. We also derive an
expression for the critical radius $r_c$ (beyond which the causality is
violated) for an arbitrary $f(R)$ theory, making apparent that the violation of
causality depends on both the $f(R)$ gravity theory and the matter content. As
an illustration, we concretely take a recent $f(R)$ gravity theory that is free
from singularities of the Ricci scalar and is cosmologically viable, and show
that this theory accommodates noncausal as well as causal G\""odel-type
solutions.
","[{""version"":""v1"",""created"":""Mon, 29 Jun 2009 20:11:22 GMT""},{""version"":""v2"",""created"":""Fri, 3 Jul 2009 03:39:29 GMT""},{""version"":""v3"",""created"":""Mon, 21 Sep 2009 20:10:09 GMT""}]","2009-10-02"
"0906.5355","Arne Rau","Arne Rau (1,2), Shrinivas R. Kulkarni (2), Nicholas M. Law (2), Joshua
  S. Bloom (3), David Ciardi (2), George S. Djorgovski (2), Derek B. Fox (4),
  Avishay Gal-Yam (5), Carl C. Grillmair (2), Mansi M. Kasliwal (2), Peter E.
  Nugent (6), Eran O. Ofek (2), Robert M. Quimby (2), William T. Reach (2),
  Michael Shara (7), Lars Bildsten (8), S. Bradley Cenko (3), Andrew J. Drake
  (2), Alexei V. Filippenko (3), David J. Helfand (9), George Helou (2), D.
  Andrew Howell (8,10), Dovi Poznanski (3) and Mark Sullivan (11) ((1) MPE, (2)
  Caltech, (3) UC Berkeley, (4) Pennstate, (5) Weizman, (6) LBLN, (7) AMNH, (8)
  UC Santa Barbara, (9) Columbia, (10) LCOGT, (11) Oxford)","Exploring the Optical Transient Sky with the Palomar Transient Factory","15 pages, 6 figures, submitted to PASP","Publ.Astron.Soc.Pac.121:1334-1351,2009","10.1086/605911",,"astro-ph.CO astro-ph.GA","http://arxiv.org/licenses/nonexclusive-distrib/1.0/","  The Palomar Transient Factory (PTF) is a wide-field experiment designed to
investigate the optical transient and variable sky on time scales from minutes
to years. PTF uses the CFH12k mosaic camera, with a field of view of 7.9 deg^2
and a plate scale of 1 asec/pixel, mounted on the the Palomar Observatory
48-inch Samuel Oschin Telescope. The PTF operation strategy is devised to probe
the existing gaps in the transient phase space and to search for theoretically
predicted, but not yet detected, phenomena, such as fallback supernovae,
macronovae, .Ia supernovae and the orphan afterglows of gamma-ray bursts. PTF
will also discover many new members of known source classes, from cataclysmic
variables in their various avatars to supernovae and active galactic nuclei,
and will provide important insights into understanding galactic dynamics
(through RR Lyrae stars) and the Solar system (asteroids and near-Earth
objects). The lessons that can be learned from PTF will be essential for the
preparation of future large synoptic sky surveys like the Large Synoptic Survey
Telescope. In this paper we present the scientific motivation for PTF and
describe in detail the goals and expectations for this experiment.
","[{""version"":""v1"",""created"":""Mon, 29 Jun 2009 20:02:26 GMT""}]","2010-12-28"
"0906.5356","Antonio Azzollini","Antonio Azzollini","Concentration and compactness in nonlinear Schrodinger-Poisson system
  with a general nonlinearity","22 pages",,,,"math.AP","http://arxiv.org/licenses/nonexclusive-distrib/1.0/","  In this paper we use a concentration and compactness argument to prove the
existence of a nontrivial nonradial solution to the nonlinear
Schrodinger-Poisson equations in R3, assuming on the nonlinearity the general
hypotheses introduced by Berestycki & Lions
","[{""version"":""v1"",""created"":""Mon, 29 Jun 2009 20:02:40 GMT""}]","2009-07-01"
"0906.5357","Philip Hopkins","Philip F. Hopkins (1), Kevin Bundy (1), Darren Croton (2), Lars
  Hernquist (3), Dusan Keres (3), Sadegh Khochfar (4), Kyle Stewart (5), Andrew
  Wetzel (1), Joshua D. Younger (3) ((1)Berkeley, (2)Swinburne, (3)CfA, (4)MPE,
  (5)Irvine)","Mergers and Bulge Formation in Lambda-CDM: Which Mergers Matter?","18 figures, 29 pages. Accepted for publication in ApJ. A script to
  provide predicted galaxy merger rates is available at
  http://www.cfa.harvard.edu/~phopkins/Site/mergercalc.html","Astrophys.J.715:202-229,2010","10.1088/0004-637X/715/1/202",,"astro-ph.CO astro-ph.GA","http://arxiv.org/licenses/nonexclusive-distrib/1.0/","  We use a suite of semi-empirical models to predict galaxy merger rates and
contributions to bulge growth as functions of merger mass, redshift, and mass
ratio. The models use empirical halo occupation constraints to identify
mergers, together with high-resolution simulations to quantify how mergers with
different properties contribute to the bulge population. We find good agreement
with a variety of observational constraints, and provide fitting functions for
merger rates and contributions to bulge growth. We identify several robust
conclusions. (1) Major mergers dominate formation and assembly of L* bulges and
the spheroid mass density, minor mergers contribute ~30%. (2) This is
mass-dependent: bulge formation is dominated by more minor mergers in
lower-mass systems. At higher masses, bulges form in major mergers near L*, but
subsequently assemble in minor mergers. (3) The minor/major contribution is
also morphology-dependent: higher B/T systems form in more major mergers, lower
B/T systems form in situ from minor mergers. (4) Low-mass galaxies, being
gas-rich, require more major mergers to reach the same B/T as high-mass
systems. (5) Absolute merger rates increase with galaxy mass. (6) Predicted
rates agree well with observations, but suggest that some morphology-selected
samples include contamination from minor mergers. (7) Predicted rates agree
with integrated growth in bulge mass with cosmic time, but with factor ~2
uncertainty - half the bulge mass density could come from non-mergers. We
consider ~1000 model variations and quantify resulting uncertainties.
Conclusions regarding the major/minor contribution to bulge growth are very
robust, absolute merger rates have systematic factor ~2 uncertainties.
","[{""version"":""v1"",""created"":""Mon, 29 Jun 2009 20:03:12 GMT""},{""version"":""v2"",""created"":""Sat, 27 Feb 2010 01:36:33 GMT""}]","2010-05-07"
"0906.5358","Norman Murray","Norman Murray, Eliot Quataert, and Todd A. Thompson","The Disruption of Giant Molecular Clouds by Radiation Pressure and the
  Efficiency of Star Formation in Galaxies","17 pages, 5 figures, submitted to ApJ","Astrophys.J.709:191-209,2010","10.1088/0004-637X/709/1/191",,"astro-ph.GA","http://arxiv.org/licenses/nonexclusive-distrib/1.0/","  Star formation is slow, in the sense that the gas consumption time is much
longer than the dynamical time. It is also inefficient; essentially all star
formation in local galaxies takes place in giant molecular clouds (GMCs), but
the fraction of a GMC converted to stars is very small, ~5%. In the most
luminous starbursts, the GMC lifetime is shorter than the main sequence
lifetime of even the most massive stars, so that supernovae can play no role in
GMC disruption. We investigate the disruption of GMCs across a wide range of
galaxies, from normal spirals to the densest starbursts; we take into account
the effects of HII gas pressure, shocked stellar winds, protostellar jets, and
radiation pressure produced by the absorption and scattering of starlight on
dust grains. In the Milky Way, we find that a combination of three mechanisms,
jets, HII gas pressure, and radiation pressure, disrupts the clouds. In more
rapidly star forming galaxies such as ``clump'' galaxies at high-redshift,
ultra-luminous infrared galaxies (ULIRGs) and submillimeter galaxies, radiation
pressure dominates natal cloud distribution. We predict the presence of 10-20
clusters with masses ~10^7 Msun in local ULIRGs such as Arp 220 and a similar
number of clusters with M_* ~ 10^8 Msun in high redshift clump galaxies;
submillimeter galaxies will have even more massive clusters. We find that the
mass fraction of a GMC that ends up in stars is an increasing function of the
gas surface density of a galaxy, reaching ~35% in the most luminous starbursts.
Furthermore, the disruption of bubbles by radiation pressure stirs the
interstellar medium to velocities of ~10 km/s in normal galaxies and to ~100
km/s in ULIRGs like Arp 220, consistent with observations. Thus, radiation
pressure may play a dominant role in the ISM of star-forming galaxies.
","[{""version"":""v1"",""created"":""Mon, 29 Jun 2009 20:26:54 GMT""}]","2010-01-06"
"0906.5359","Konstantin Bobkov","Konstantin Bobkov","Scanning the Fluxless $G_2$ Landscape","22 pages, changed values in equations (56) and (57)",,,,"hep-th","http://arxiv.org/licenses/nonexclusive-distrib/1.0/","  We show that there exists an exponentially large discretuum of vacua in
$G_2$-compactifications of M-theory without flux. In M-theory-inspired
$G_2$-MSSM, quantities relevant for particle physics remain virtually
insensitive to large variations of the vacuum energy across the landscape. The
purely non-perturbative vacua form a special subset of a more general class of
vacua containing fractional Chern-Simons contributions. The cosmological
constant can be dynamically neutralized via a chain of transitions interpolated
by fractional gauge instantons describing spontaneous nucleation of M2-brane
domain walls. Each transition is generically accompanied by a gauge symmetry
breaking in some sector of the theory. In particular, the visible sector GUT
symmetry breaking can likewise be triggered by a spontaneous nucleation of an
M2-brane.
","[{""version"":""v1"",""created"":""Mon, 29 Jun 2009 20:03:28 GMT""},{""version"":""v2"",""created"":""Wed, 1 Jul 2009 06:33:29 GMT""}]","2009-07-01"
"0906.5360","Chaozhong Wu","Chao-Zhong Wu","A Remark on Kac-Wakimoto Hierarchies of D-type","10 pages",,"10.1088/1751-8113/43/3/035201",,"math-ph math.MP math.RT","http://creativecommons.org/licenses/by/3.0/","  For the Kac-Wakimoto hierarchy constructed from the principal vertex operator
realization of the basic representation of the affine Lie algebra $D_n^{(1)}$,
we compute the coefficients of the corresponding Hirota bilinear equations, and
verify the coincidence of these bilinear equations with the ones that are
satisfied by Givental's total descendant potential of the $D_n$ singularity, as
conjectured by Givental and Milanov in \cite{GM}
","[{""version"":""v1"",""created"":""Mon, 29 Jun 2009 20:06:10 GMT""},{""version"":""v2"",""created"":""Mon, 20 Jul 2009 23:56:04 GMT""}]","2015-05-13"
"0906.5361","Louis Strigari","Louis E. Strigari, Roberto Trotta","Reconstructing WIMP Properties in Direct Detection Experiments Including
  Galactic Dark Matter Distribution Uncertainties","Matches JCAP published version","JCAP 0911:019,2009","10.1088/1475-7516/2009/11/019",,"astro-ph.HE astro-ph.CO astro-ph.GA hep-ph","http://arxiv.org/licenses/nonexclusive-distrib/1.0/","  We present a new method for determining Weakly Interacting Massive Particle
(WIMP) properties in future tonne scale direct detection experiments which
accounts for uncertainties in the Milky Way (MW) smooth dark matter
distribution. Using synthetic data on the kinematics of MW halo stars matching
present samples from the Sloan Digital Sky Survey, complemented by local escape
velocity constraints, we demonstrate that the local dark matter density can be
constrained to approximately 20% accuracy. For low mass WIMPs, we find that a
factor of two error in the assumed local dark matter density leads to a
severely biased reconstruction of the WIMP spin-independent cross section that
is incorrect at the 15-sigma level. We show that this bias may be overcome by
marginalizing over parameters that describe the MW potential, and use this
formalism to project the accuracy attainable on WIMP properties in future 1
tonne Xenon detectors. Our method can be readily applied to different detector
technologies and extended to more detailed MW halo models.
","[{""version"":""v1"",""created"":""Tue, 30 Jun 2009 04:26:59 GMT""},{""version"":""v2"",""created"":""Thu, 24 Dec 2009 01:33:36 GMT""}]","2009-12-30"
"0906.5362","Ian Clo\""et","T. Ito, W. Bentz, I. C. Clo\""et, A. W. Thomas and K. Yazaki","The NJL-jet model for quark fragmentation functions","21 pages, 7 figures","Phys.Rev.D80:074008,2009","10.1103/PhysRevD.80.074008",,"nucl-th hep-ex hep-ph nucl-ex","http://arxiv.org/licenses/nonexclusive-distrib/1.0/","  A description of fragmentation functions which satisfy the momentum and
isospin sum rules is presented in an effective quark theory. Concentrating on
the pion fragmentation function, we first explain why the elementary (lowest
order) fragmentation process q --> q \pi is completely inadequate to describe
the empirical data, although the ""crossed"" process \pi --> q \bar{q} describes
the quark distribution functions in the pion reasonably well. Taking into
account cascade-like processes in a generalized jet-model approach, we then
show that the momentum and isospin sum rules can be satisfied naturally,
without the introduction of ad hoc parameters. We present results for the
Nambu--Jona-Lasinio (NJL) model in the invariant mass regularization scheme and
compare them with the empirical parametrizations. We argue that the NJL-jet
model, developed herein, provides a useful framework with which to calculate
the fragmentation functions in an effective chiral quark theory.
","[{""version"":""v1"",""created"":""Mon, 29 Jun 2009 22:28:34 GMT""}]","2009-11-06"
"0906.5363","Adrian Ioana","Ionut Chifan and Adrian Ioana","On Relative Property (T) and Haagerup's Property",,"Transactions of the American Mathematical Society 363 (2011),
  6407-6420","10.1090/S0002-9947-2011-05259-1",,"math.GR math.OA","http://arxiv.org/licenses/nonexclusive-distrib/1.0/","  We consider the following three properties for countable discrete groups
$\Gamma$: (1) $\Gamma$ has an infinite subgroup with relative property (T), (2)
the group von Neumann algebra $L\Gamma$ has a diffuse von Neumann subalgebra
with relative property (T) and (3) $\Gamma$ does not have Haagerup's property.
It is clear that (1) $\Longrightarrow$ (2) $\Longrightarrow$ (3). We prove that
both of the converses are false.
","[{""version"":""v1"",""created"":""Mon, 29 Jun 2009 20:26:56 GMT""}]","2018-02-27"
"0906.5364","Rasmus Voss","R. Voss, M. Gilfanov, G.R. Sivakoff, R.P. Kraft, A. Jordan, S.
  Raychaudhury, M. Birkinshaw, N.J. Brassington, J.H. Croston, D.A. Evans, W.R.
  Forman, M.J. Hardcastle, W.E. Harris, C. Jones, A.M. Juett, S.S. Murray, C.L.
  Sarazin, K.A. Woodley, D.M. Worrall","Luminosity functions of LMXBs in Centaurus A: globular clusters versus
  the field","12 pages, Accepted by ApJ","Astrophys.J.701:471-480,2009","10.1088/0004-637X/701/1/471",,"astro-ph.HE","http://arxiv.org/licenses/nonexclusive-distrib/1.0/","  We study the X-ray luminosity function (XLF) of low mass X-ray binaries
(LMXB) in the nearby early-type galaxy Centaurus A, concentrating primarily on
two aspects of binary populations: the XLF behavior at the low luminosity limit
and comparison between globular cluster and field sources. The 800 ksec
exposure of the deep Chandra VLP program allows us to reach a limiting
luminosity of 8e35 erg/s, about 2-3 times deeper than previous investigations.
We confirm the presence of the low luminosity break in the overall LMXB XLF at
log(L_X)=37.2-37.6 below which the luminosity distribution follows a constant
dN/d(ln L). Separating globular cluster and field sources, we find a
statistically significant difference between the two luminosity distributions
with a relative underabundance of faint sources in the globular cluster
population. This demonstrates that the samples are drawn from distinct parent
populations and may disprove the hypothesis that the entire LMXB population in
early type galaxies is created dynamically in globular clusters. As a plausible
explanation for this difference in the XLFs, we suggest that there is an
enhanced fraction of helium accreting systems in globular clusters, which are
created in collisions between red giants and neutron stars. Due to the 4 times
higher ionization temperature of He, such systems are subject to accretion disk
instabilities at approximately 20 times higher mass accretion rate, and
therefore are not observed as persistent sources at low luminosities.
","[{""version"":""v1"",""created"":""Tue, 30 Jun 2009 09:25:35 GMT""}]","2009-08-10"
