"0906.5487","Bianca Keilhauer","Bianca Keilhauer, Michael Unger","Fluorescence emission induced by extensive air showers in dependence on
  atmospheric conditions","Submitted to the 31th ICRC, Lodz, Poland, 2009",,,,"astro-ph.HE","http://arxiv.org/licenses/nonexclusive-distrib/1.0/","  Charged particles of extensive air showers (EAS), mainly electrons and
positrons, initiate the emission of fluorescence light in the Earth's
atmosphere. This light provides a calorimetric measurement of the energy of
cosmic rays. For reconstructing the primary energy from an observed light track
of an EAS, the fluorescence yield in air has to be known in dependence on
atmospheric conditions, like air temperature, pressure, and humidity. Several
experiments on fluorescence emission have published various sets of data
covering different parts of the dependence of the fluorescence yield on
atmospheric conditions. Using a compilation of published measurements, a
calculation of the fluorescence yield in dependence on altitude is presented.
The fluorescence calculation is applied to simulated air showers and different
atmospheric profiles to estimate the influence of the atmospheric conditions on
the reconstructed shower parameters.
","[{""version"":""v1"",""created"":""Tue, 30 Jun 2009 11:39:10 GMT""}]","2009-07-01"
"0906.5488","Rasmus M{\o}gelberg","Rasmus Ejlers M{\o}gelberg, Alex Simpson","Relational Parametricity for Computational Effects","31 pages, appears in Logical Methods in Computer Science","Logical Methods in Computer Science, Volume 5, Issue 3 (August 9,
  2009) lmcs:1113","10.2168/LMCS-5(3:7)2009",,"cs.PL cs.LO","http://arxiv.org/licenses/nonexclusive-distrib/1.0/","  According to Strachey, a polymorphic program is parametric if it applies a
uniform algorithm independently of the type instantiations at which it is
applied. The notion of relational parametricity, introduced by Reynolds, is one
possible mathematical formulation of this idea. Relational parametricity
provides a powerful tool for establishing data abstraction properties, proving
equivalences of datatypes, and establishing equalities of programs. Such
properties have been well studied in a pure functional setting. Many programs,
however, exhibit computational effects, and are not accounted for by the
standard theory of relational parametricity. In this paper, we develop a
foundational framework for extending the notion of relational parametricity to
programming languages with effects.
","[{""version"":""v1"",""created"":""Tue, 30 Jun 2009 11:47:58 GMT""},{""version"":""v2"",""created"":""Sun, 9 Aug 2009 19:09:56 GMT""}]","2019-03-14"
"0906.5489","Takashi Shinzato","T. Shinzato and I. Kaku","Improved and Developed Upper Bound of Price of Anarchy in Two Echelon
  Case","12 pages, 17 figures, the proceeding of the 2nd international
  workshop on institutional supply chain management, however the original is
  one column",,,,"q-fin.GN","http://arxiv.org/licenses/nonexclusive-distrib/1.0/","  Price of anarchy, the performance ratio, which could characterize the loss of
efficiency of the distributed supply chain management compared with the
integrated supply chain management is discussed by utilizing newsvendor problem
in single period which is well-known. In particular, some of remarkable
distributed policies are handled, the performance ratios in each case which
have been investigated in the previous works are analyzed theoretically and the
tighter upper bound of price of anarchy and the lower bound are presented.
Furthermore our approach is developed based on a generalized framework and a
geometric interpretation of price of anarchy is appeared via the literature of
convex optimization.
","[{""version"":""v1"",""created"":""Tue, 30 Jun 2009 11:50:07 GMT""}]","2009-07-01"
"0906.5490","Martin Cederwall","Martin Cederwall","Pure spinor superfields, with application to D=3 conformal models","13 pp",,,,"hep-th","http://arxiv.org/licenses/nonexclusive-distrib/1.0/","  I review and discuss the construction of supersymmetry multiplets and
manifestly supersymmetric Batalin-Vilkovisky actions using pure spinors, with
emphasis on models with maximal supersymmetry. The special cases of D=3, N=8
(Bagger-Lambert-Gustavsson) and N=6 (Aharony-Bergman-Jafferis-Maldacena)
conformal models are treated in detail. Most of the material is covered by the
papers arXiv:0808.3242 and arXiv:0809.0318. This is the written version of a
talk given at 4th Baltic-Nordic workshop ""Algebra, Geometry and Mathematical
Physics"", Tartu, Estonia, October 9-11, 2008, to appear in the Proceedings of
the Estonian Academy of Sciences, vol 4, 2010.
","[{""version"":""v1"",""created"":""Tue, 30 Jun 2009 11:51:40 GMT""}]","2009-07-01"
"0906.5491","Jens Harlander","Jens Harlander, Jacqueline A Jensen","Exotic relation modules and homotopy types for certain 1-relator groups","This is the version published by Algebraic & Geometric Topology on 19
  November 2006","Algebr. Geom. Topol. 6 (2006) 2163-2173","10.2140/agt.2006.6.2163",,"math.GR math.AT","http://arxiv.org/licenses/nonexclusive-distrib/1.0/","  Using stably free non-free relation modules we construct an infinite
collection of 2-dimensional homotopy types, each of Euler-characteristic one
and with trefoil fundamental group. This provides an affirmative answer to a
question asked by Berridge and Dunwoody [J. London Math. Soc. 19 (1979)
433-436]. We also give new examples of exotic relation modules. We show that
the relation module associated with the generating set x, y^4 for the
Baumslag-Solitar group <x, y | xy^2x^{-1}=y^3> is stably free non-free of rank
one.
","[{""version"":""v1"",""created"":""Tue, 30 Jun 2009 11:52:03 GMT""}]","2009-07-01"
"0906.5492","Franziska Synatschke","Holger Gies, Franziska Synatschke and Andreas Wipf","Supersymmetry breaking as a quantum phase transition","5 pages, 2 figures, discussion of results extended, version to appear
  as a Rapid Communication in Phys. Rev. D",,"10.1103/PhysRevD.80.101701",,"hep-th cond-mat.str-el hep-ph","http://arxiv.org/licenses/nonexclusive-distrib/1.0/","  We explore supersymmetry breaking in the light of a rich fixed-point
structure of two-dimensional supersymmetric Wess-Zumino models with one
supercharge using the functional renormalization group (RG). We relate the
dynamical breaking of supersymmetry to an RG relevant control parameter of the
superpotential which is a common relevant direction of all fixed points of the
system. Supersymmetry breaking can thus be understood as a quantum phase
transition analogously to similar transitions in correlated fermion systems.
Supersymmetry gives rise to a new superscaling relation between the critical
exponent associated with the control parameter and the anomalous dimension of
the field -- a scaling relation which is not known in standard spin systems.
","[{""version"":""v1"",""created"":""Tue, 30 Jun 2009 12:00:08 GMT""},{""version"":""v2"",""created"":""Thu, 19 Nov 2009 08:35:44 GMT""}]","2013-05-29"
"0906.5493","Bhargav  Vaidya","B.Vaidya, C.Fendt and H.Beuther","Accretion disks around massive stars: Hydrodynamic structure, stability
  and dust sublimation","23 pages, 8 figures, accepted by ApJ, For full version see
  http://www.mpia.de/homes/vaidya/","Astrophys.J.702:567-579,2009","10.1088/0004-637X/702/1/567",,"astro-ph.SR","http://arxiv.org/licenses/nonexclusive-distrib/1.0/","  We investigate the structure of accretion disks around massive protostar
applying steady state models of thin disks. The thin disk equations are solved
with proper opacities for dust and gas taking into account the huge temperature
variation along the disk. We explore a wide parameter range concerning stellar
mass, accretion rate, and viscosity parameter \alpha . The most essential
finding is a very high temperature of the inner disk. For e.g. a 10 M_sun
protostar and an accretion rate of 10^-4 M_sun/yr, the disk midplane
temperature may reach almost 10^5 K. The disk luminosity in this case is about
10^4 L_sun and, thus, potentially higher than that of a massive protostar. We
motivate our disk model with similarly hot disks around compact stars. We
calculate a dust sublimation radius by turbulent disk self-heating of more than
10AU, a radius, which is 3 times larger than caused by stellar irradiation. We
discuss implications of this result on the flashlight effect and the
consequences for the radiation pressure of the central star. In difference to
disks around low mass protostars our models suggest rather high values for the
disk turbulence parameter \alpha close to unity. However, disk stability to
fragmentation due to thermal effects and gravitational instability would
require a lower \alpha value. For \alpha = 0.1 we find stable disks out to
80AU. Essentially, our model allows to compare the outer disk to some of the
observed massive protostellar disk sources, and from that, extrapolate on the
disk structure close to the star which is yet impossible to observe.
","[{""version"":""v1"",""created"":""Tue, 30 Jun 2009 11:55:48 GMT""}]","2009-08-17"
"0906.5494","Alexey Rastegin","Alexey E. Rastegin","Optimal cloning with respect to the relative error","9 pages, 2 figures, 1 table. Major changes. New section in which
  different criteria are compared is added. The bibliography is recast",,,,"quant-ph","http://arxiv.org/licenses/nonexclusive-distrib/1.0/","  The relative error of cloning of quantum states with arbitrary prior
probabilities is considered. It is assumed that the ancilla may contain some a
priori information about the input state to be cloned. The lower bound on the
relative error for general cloning scenario is derived. Both the case of
two-state set and case of multi-state set are analyzed in details. The treated
figure of merit is compared with other optimality criteria. The quantum circuit
for optimal cloning of a pair of pure states is constructed.
","[{""version"":""v1"",""created"":""Tue, 30 Jun 2009 11:57:15 GMT""},{""version"":""v2"",""created"":""Thu, 17 Jun 2010 10:27:38 GMT""}]","2010-06-18"
"0906.5495","Jacques Crovisier","D. Bockel\'ee-Morvan, F. Henry, N. Biver, J. Boissier, P. Colom, J.
  Crovisier, D. Despois, R. Moreno, J. Wink","Interferometric imaging of carbon monoxide in comet C/1995 O1
  (Hale-Bopp): evidence for a strong rotating jet","20 pages, 26 figures. Accepted for publication in Astronomy &
  Astrophysics","Astron. Astrophys.505:825-843,2009","10.1051/0004-6361/200911765",,"astro-ph.EP","http://arxiv.org/licenses/nonexclusive-distrib/1.0/","  Observations of the CO J(1-0) 115 GHz and J(2-1) 230 GHz lines in comet
C/1995 O1 (Hale-Bopp) were performed with the IRAM Plateau de Bure
interferometer on 11 March, 1997. The observations were conducted in both
single-dish (ON-OFF) and interferometric modes with 0.13 km s-1 spectral
resolution. Images of CO emission with 1.7 to 3"" angular resolution were
obtained. The ON-OFF and interferometric spectra show a velocity shift with
sinusoidal time variations related to the Hale-Bopp nucleus rotation of 11.35
h. The peak position of the CO images moves perpendicularly to the spin axis
direction in the plane of the sky. This suggests the presence of a CO jet,
which is active night and day at about the same extent, and is spiralling with
nucleus rotation. The high quality of the data allows us to constrain the
characteristics of this CO jet. We have developed a 3-D model to interpret the
temporal evolution of CO spectra and maps. The CO coma is represented as the
combination of an isotropic distribution and a spiralling gas jet, both of
nucleus origin. Spectra and visibilities (the direct output of interferometric
data) analysis shows that the CO jet comprises ~40% the total CO production and
is located at a latitude ~20 degrees North on the nucleus surface. Our
inability to reproduce all observational characteristics shows that the real
structure of the CO coma is more complex than assumed, especially in the first
thousand kilometres from the nucleus. The presence of another moving CO
structure, faint but compact and possibly created by an outburst, is
identified.
","[{""version"":""v1"",""created"":""Tue, 30 Jun 2009 12:34:00 GMT""}]","2010-11-02"
"0906.5496","Peter Markos","P. Markos","Electron transport in strongly disordered structures","Presented at ETOPIM 8","Physica B 405 (2010) 3029","10.1016/j.physb.2010.01.042","Proceedings of ETOPIM, Crete (2009)","cond-mat.dis-nn cond-mat.mes-hall","http://creativecommons.org/licenses/by-nc-sa/3.0/","  Using the transfer matrix technique, we investigate the propagation of
electron through a two dimensional disordered sample. We find that the spatial
distribution of electrons is homogeneous only in the limit of weak disorder
(diffusive transport regime). In the limit of very strong disorder, we identify
a narrow channel through which the electron propagates from one side of the
sample to the opposite side. Even in this limit, we prove the wave character of
the electron propagation.
","[{""version"":""v1"",""created"":""Tue, 30 Jun 2009 12:00:27 GMT""}]","2010-09-28"
"0906.5497","Carla Bleve","The Pierre Auger Collaboration","Atmospheric effects on extensive air showers observed with the Surface
  Detector of the Pierre Auger Observatory","24 pages, 9 figures, accepted for publication in Astroparticle
  Physics","Astropart.Phys.32:89-99,2009; Erratum-ibid.33:65-67,2010","10.1016/j.astropartphys.2009.06.004 10.1016/j.astropartphys.2009.10.005",,"astro-ph.IM","http://arxiv.org/licenses/nonexclusive-distrib/1.0/","  Atmospheric parameters, such as pressure (P), temperature (T) and density,
affect the development of extensive air showers initiated by energetic cosmic
rays. We have studied the impact of atmospheric variations on extensive air
showers by means of the surface detector of the Pierre Auger Observatory. The
rate of events shows a ~10% seasonal modulation and ~2% diurnal one. We find
that the observed behaviour is explained by a model including the effects
associated with the variations of pressure and density. The former affects the
longitudinal development of air showers while the latter influences the Moliere
radius and hence the lateral distribution of the shower particles. The model is
validated with full simulations of extensive air showers using atmospheric
profiles measured at the site of the Pierre Auger Observatory.
","[{""version"":""v1"",""created"":""Tue, 30 Jun 2009 12:08:49 GMT""},{""version"":""v2"",""created"":""Thu, 30 Jul 2009 12:54:59 GMT""}]","2012-08-27"
"0906.5498","Peter Markos","T. Vary and P. Markos","Propagation and scattering of TE surface plasmon polaritons on interface
  between two dielectrics",,"Physica B 405 (2010) 2982","10.1016/j.physb.2010.01.018","Proc. of ETOPIM, Crete 2009","cond-mat.mtrl-sci cond-mat.mes-hall","http://creativecommons.org/licenses/by-nc-sa/3.0/","  We study the TE polarized electromagnetic surface wave propagating along the
interface between materials with positive and negative magnetic permeability.
Contrary to the TM polarized surface wave, the TE surface wave exhibits almost
no radiation losses when scattered at semi-infinite dielectric interfaces.
","[{""version"":""v1"",""created"":""Tue, 30 Jun 2009 12:16:48 GMT""}]","2010-09-28"
"0906.5499","Julien Rabin","Julie Delon (LTCI), Julien Rabin (LTCI), Yann Gousseau (LTCI)","Transportation Distances on the Circle and Applications",,,,,"math.FA math.OC","http://arxiv.org/licenses/nonexclusive-distrib/1.0/","  This paper is devoted to the study of the Monge-Kantorovich theory of optimal
mass transport and its applications, in the special case of one-dimensional and
circular distributions. More precisely, we study the Monge-Kantorovich
distances between discrete sets of points on the unit circle, in the case where
the ground distance between two points x and y is defined as h(d(x,y)), where d
is the geodesic distance on the circle and h a convex and increasing function.
We first prove that computing a Monge-Kantorovich distance between two given
sets of pairwise different points boils down to cut the circle at a well chosen
point and to compute the same distance on the real line. This result is then
used to obtain a metric between 1D and circular discrete histograms, which can
be computed in linear time. A particular case of this formula has already been
used in [Rabin, Delon and Gousseau SIAM 09}] for the matching of local features
between images, involving circular histograms of gradient orientations. In this
paper, other applications are investigated, in particular dealing with the hue
component of color images. In a last part, a study is conducted to compare the
advantages and drawbacks of transportation distances relying on convex or
concave cost functions, and of the classical L-1 distance.
","[{""version"":""v1"",""created"":""Tue, 30 Jun 2009 12:17:17 GMT""},{""version"":""v2"",""created"":""Mon, 6 Jul 2009 14:44:55 GMT""},{""version"":""v3"",""created"":""Wed, 2 Jun 2010 06:54:38 GMT""}]","2010-07-28"
"0906.5500","Armin L\""uhr","Armin L\""uhr and Alejandro Saenz","Collisions of antiprotons with hydrogen molecular ions","12 pages, 5 figures, 4 tables",,"10.1103/PhysRevA.80.022705",,"physics.atom-ph","http://arxiv.org/licenses/nonexclusive-distrib/1.0/","  Time-dependent close-coupling calculations of the ionization and excitation
cross section for antiproton collisions with molecular hydrogen ions are
performed in an impact-energy range from 0.5 keV to 10 MeV. The
Born-Oppenheimer and Franck-Condon approximations as well as the impact
parameter method are applied in order to describe the target molecule and the
collision process. It is shown that three perpendicular orientations of the
molecular axis with respect to the trajectory are sufficient to accurately
reproduce the ionization cross section calculated by [Sakimoto, Phys. Rev. A
71, 062704 (2005)] reducing the numerical effort drastically. The
independent-event model is employed to approximate the cross section for double
ionization and H+ production in antiproton collisions with H2.
","[{""version"":""v1"",""created"":""Tue, 30 Jun 2009 12:21:30 GMT""}]","2015-05-13"
"0906.5501","Jonas Schmidt","Jonas Schmidt","Local Grand Unification in the Heterotic Landscape","141 pages, 6 figures, Ph.D. thesis","Fortsch.Phys.58:3-111,2010","10.1002/prop.200900079","DESY-THESIS-2009-020","hep-th","http://arxiv.org/licenses/nonexclusive-distrib/1.0/","  We consider the possibility that the unification of the electroweak
interactions and the strong force arises from string theory, at energies
significantly lower than the string scale. As a tool, an effective grand
unified field theory in six dimensions is derived from an anisotropic orbifold
compactification of the heterotic string. It is explicitly shown that all
anomalies cancel in the model, though anomalous Abelian gauge symmetries are
present locally at the boundary singularities. In the supersymmetric vacuum
additional interactions arise from higher-dimensional operators. We develop
methods that relate the couplings of the effective theory to the location of
the vacuum, and find that unbroken discrete symmetries play an important role
for the phenomenology of orbifold models. An efficient algorithm for the
calculation of the superpotential to arbitrary order is developed, based on
symmetry arguments. We furthermore present a correspondence between bulk fields
of the orbifold model in six dimensions, and the moduli fields that arise from
compactifying four internal dimensions on a manifold with non-trivial gauge
background.
","[{""version"":""v1"",""created"":""Tue, 30 Jun 2009 12:58:33 GMT""},{""version"":""v2"",""created"":""Thu, 3 Sep 2009 08:39:22 GMT""}]","2010-02-04"
"0906.5502","Boris A. Gelman","Boris A. Gelman","Narrow resonances and short-range interactions","9 pages, 4 figures, references added","Phys.Rev.C80:034005,2009","10.1103/PhysRevC.80.034005",,"nucl-th hep-ph","http://arxiv.org/licenses/nonexclusive-distrib/1.0/","  Narrow resonances in systems with short-range interactions are discussed in
an effective field theory (EFT) framework. An effective Lagrangian is
formulated in the form of a combined expansion in powers of a momentum Q <<
Lambda--a short-distance scale--and an energy difference delta epsilon =
|E-epsilon_0| << epsilon_0--a resonance peak energy. At leading order in the
combined expansion, a two-body scattering amplitude is the sum of a smooth
background term of order Q^0 and a Breit-Wigner term of order Q^2 (delta
epsilon)^{-1} which becomes dominant for delta epsilon <~ Q^3. Such an EFT is
applicable to systems in which short-distance dynamics generates a low-lying
quasistationary state. The EFT is generalized to describe a narrow low-lying
resonance in a system of charged particles. It is shown that in the case of
Coulomb repulsion, a two-body scattering amplitude at leading order in a
combined expansion is the sum of a Coulomb-modified background term and a
Breit-Wigner amplitude with parameters renormalized by Coulomb interactions.
","[{""version"":""v1"",""created"":""Tue, 30 Jun 2009 12:46:51 GMT""},{""version"":""v2"",""created"":""Wed, 23 Sep 2009 20:18:31 GMT""}]","2009-11-06"
"0906.5503","Julian Sitarek","Julian Sitarek, Razmik Mirzoyan (for the MAGIC Collaboration)","Search for an extended emission around blazars with the MAGIC telescope","Contribution to the 31st ICRC, Lodz, Poland, July 2009",,,,"astro-ph.HE","http://arxiv.org/licenses/nonexclusive-distrib/1.0/","  Very high energy gamma rays coming from extra-galactic sources can interact
with intergalactic radiation fields. This process may result in electromagnetic
cascades with the following cycle: the production of electron-positron pairs
and then secondary gamma-rays due to inverse Compton scattering. Since
electrons and positrons will be scattered in the intergalactic magnetic field,
under certain conditions their radiation may be redirected towards the
observer. Thus one can anticipate that the secondary gamma-ray emission may
produce an apparent extended halo around the source.
  MAGIC is an Imaging Atmospheric Cerenkov Telescope located on Canary island
of La Palma at Roque de los Muchachos Observatory (2200 m.a.s.l). Various
source sizes and extended emission profiles within $1^\circ$ diameter have been
studied by using dedicated Monte Carlo simulations for the MAGIC telescope. We
present results of the study of a possible extended emission for Mrk 421 and
Mrk501 done with the MAGIC telescope.
","[{""version"":""v1"",""created"":""Tue, 30 Jun 2009 12:50:10 GMT""}]","2019-08-13"
"0906.5504","Joachim Schr\""oter","Joachim Schroeter","An Extension of Friedmann-Robertson-Walker Theory beyond Big Bang","28 pages, 2 figures",,,,"gr-qc","http://arxiv.org/licenses/nonexclusive-distrib/1.0/","  Starting from the classic Friedmann-Robertson-Walker theory with big bang it
is shown that the solutions of the field equations can be extended to negative
times. Choosing a new cosmic time scale instead of proper time one achieves
complete differentiability of the scale factor and of suitable thermodynamic
quantities equivalent to pressure and energy density. Then, the singularity of
big bang manifests itself only by the vanishing of the scale factor at time
zero. Moreover, all solutions of the field equations are defined for all times
from -infinity to +infinity. In a separate chapter the horizon structure of the
extended theory is studied. Some weak assumptions guarantee that there are no
horizons. Hence, the horizon problem in a strict sence disappears. An intensive
discussion of the results is given at the end of the paper.
","[{""version"":""v1"",""created"":""Tue, 30 Jun 2009 12:52:56 GMT""},{""version"":""v2"",""created"":""Thu, 2 Jul 2009 11:54:11 GMT""},{""version"":""v3"",""created"":""Fri, 3 Jul 2009 17:16:17 GMT""}]","2009-07-03"
"0906.5505","Pieter Vancraeyveld","Pieter Vancraeyveld, Lesley De Cruz, Jan Ryckebusch and Tim Van
  Cauteren","Regge-model predictions for K+Sigma photoproduction from the nucleon","4 pages, 2 figures; Proceedings Tenth Conference on the Intersections
  of Particle and Nuclear Physics, San Diego, 2009","AIP Conf.Proc.1182:619-622,2009","10.1063/1.3293885",,"nucl-th","http://arxiv.org/licenses/nonexclusive-distrib/1.0/","  We present Regge-model predictions for the p(gamma,K+)Sigma0 and
n(gamma,K+)Sigma- differential cross sections and photon-beam asymmetries in
the resonance region. The reaction amplitude encompasses the exchange of
K+(494) and K*+(892) Regge-trajectories, introducing a mere three free
parameters. These are fitted to the available p(gamma,K+)Sigma0 data beyond the
resonance region. The n(gamma,K+)Sigma- amplitude is obtained from the
p(gamma,K+)Sigma0 one through SU(2) isospin symmetry considerations.
","[{""version"":""v1"",""created"":""Tue, 30 Jun 2009 12:57:10 GMT""}]","2010-01-15"
