"0901.3178","Kensuke Kobayashi","Shuji Nakamura, Masayuki Hashisaka, Yoshiaki Yamauchi, Shinya Kasai,
  Teruo Ono, and Kensuke Kobayashi","Conductance Anomaly and Fano Factor Reduction in Quantum Point Contacts","RevTex, 4 pages, 3 figures","Phys. Rev. B 79, 201308(R) (2009)","10.1103/PhysRevB.79.201308",,"cond-mat.mes-hall cond-mat.str-el","http://arxiv.org/licenses/nonexclusive-distrib/1.0/","  We report an experimental study on the shot noise as well as the dc transport
properties of a quantum point contact (QPC) whose conductance anomaly can be
tuned electrostatically by the gate electrodes. By controlling the single QPC
so that it has no anomaly or an anomaly at $0.5 G_0$, $0.8 G_0$ or $0.9 G_0$
($G_0 = 2e^2/h$), we prove that the anomaly always accompanies the Fano factor
reduction due to the asymmetric transmission of the two spin-dependent channels
for the conductance lower than $G_0$. For the QPC tuned to have the anomaly at
$0.5 G_0$ the channel asymmetry is found to be as large as 67% with the spin
gap energy gradually evolving as the conductance increases.
","[{""version"":""v1"",""created"":""Wed, 21 Jan 2009 02:00:25 GMT""},{""version"":""v2"",""created"":""Mon, 8 Jun 2009 00:24:33 GMT""}]","2009-06-08"
"0901.3179","Ural Bekbaev","Ural Bekbaev","A matrix representation of composition of polynomial maps","A need for the new version arose as far as the generalization of the
  Bombieri's inequality presented in the previous one turned out to be wrong",,,,"math.AC math.DS","http://arxiv.org/licenses/nonexclusive-distrib/1.0/","  In this paper polynomial maps are represented by the use of matrices whose
entries are numbered by pair of multiindices and a new product of such matrices
is introduced. A matrix representation of composition of polynomial maps is
given. In the case of real and complex numbers different kind of norms of such
matrices are introduced. Properties of these norms with respect to the ordinary
and new products are investigated. A generalization of Bombieri's inequality is
offered.
","[{""version"":""v1"",""created"":""Wed, 21 Jan 2009 02:22:18 GMT""},{""version"":""v2"",""created"":""Fri, 14 Aug 2009 02:32:30 GMT""},{""version"":""v3"",""created"":""Tue, 22 Sep 2009 11:10:07 GMT""}]","2009-09-22"
"0901.3180","Vijay Kodiyalam","Vijay Kodiyalam and V. S. Sunder","Guionnet-Jones-Shlyakhtenko subfactors associated to finite-dimensional
  Kac algebras","18 pages, 21 figures, corrected typos",,,,"math.OA math.FA","http://arxiv.org/licenses/nonexclusive-distrib/1.0/","  We analyse the Guionnet-Jones-Shlyakhtenko construction for the planar
algebra associated to a finite-dimensional Kac algebra and identify the factors
that arise as finite interpolated free group factors.
","[{""version"":""v1"",""created"":""Wed, 21 Jan 2009 02:31:25 GMT""},{""version"":""v2"",""created"":""Tue, 10 Mar 2009 15:13:14 GMT""}]","2009-03-10"
"0901.3181","Yoshiyuki Fukumoto","H. Kobayashi, Y. Fukumoto and A. Oguchi","Frustrated Ising Model on a Diamond Hierarchical Lattice","10 pages, 15 figures",,"10.1143/JPSJ.78.074004",,"cond-mat.stat-mech","http://arxiv.org/licenses/nonexclusive-distrib/1.0/","  A frustrated Ising model on a diamond hierarchical lattice is studied. We
obtain the exact partition function of this model and calculate the transition
temperature, specific heat, entropy, magnetization, and ferromagnetic
correlation function. Depending on the magnitude of a parameter giving the
frustration, there exist three types of ground states: ferromagnetic, classical
spin-liquid with highly developed short-range order, and paramagnetic. The
dependence of the zero-temperature entropy on the frustration parameter has an
infinite number of steps. The temperature dependence of the specific heat
exhibits many peaks with decreasing temperature and entropy loss. The dominant
spin configurations at low temperatures are also specified.
","[{""version"":""v1"",""created"":""Wed, 21 Jan 2009 03:04:17 GMT""},{""version"":""v2"",""created"":""Mon, 11 May 2009 07:11:27 GMT""}]","2015-05-13"
"0901.3182","Alireza Abdollahi","Alireza Abdollahi","Powerful $p$-groups have noninner automorphisms of order $p$ and some
  cohomology","to appear in Journal of Algebra",,,,"math.GR math.AC","http://arxiv.org/licenses/nonexclusive-distrib/1.0/","  In this paper we study the longstanding conjecture of whether there exists a
noninner automorphism of order $p$ for a finite non-abelian $p$-group. We prove
that if $G$ is a finite non-abelian $p$-group such that $G/Z(G)$ is powerful
then $G$ has a noninner automorphism of order $p$ leaving either $\Phi(G)$ or
$\Omega_1(Z(G))$ elementwise fixed. We also recall a connection between the
conjecture and a cohomological problem and we give an alternative proof of the
latter result for odd $p$, by showing that the Tate cohomology
$H^n(G/N,Z(N))\not=0$ for all $n\geq 0$, where $G$ is a finite $p$-group, $p$
is odd, $G/Z(G)$ is $p$-central (i.e., elements of order $p$ are central) and
$N\lhd G$ with $G/N$ non-cyclic.
","[{""version"":""v1"",""created"":""Wed, 21 Jan 2009 03:39:47 GMT""},{""version"":""v2"",""created"":""Fri, 13 Nov 2009 04:53:04 GMT""}]","2009-11-13"
"0901.3183","Jie-Jun Tseng","Jie-Jun Tseng, Ming-Jer Lee, Sai-Ping Li","Heavy-tailed distributions in fatal traffic accidents: role of human
  activities","10 pages, 5 figures","Int. J. Mod. Phys. C 20, 1281 (2009)","10.1142/S0129183109014345",,"physics.soc-ph physics.data-an","http://arxiv.org/licenses/nonexclusive-distrib/1.0/","  Human activities can play a crucial role in the statistical properties of
observables in many complex systems such as social, technological and economic
systems. We demonstrate this by looking into the heavy-tailed distributions of
observables in fatal plane and car accidents. Their origin is examined and can
be understood as stochastic processes that are related to human activities.
Simple mathematical models are proposed to illustrate such processes and
compared with empirical results obtained from existing databanks.
","[{""version"":""v1"",""created"":""Wed, 21 Jan 2009 03:48:57 GMT""},{""version"":""v2"",""created"":""Mon, 24 Aug 2009 10:18:01 GMT""}]","2009-08-24"
"0901.3184","Alexander Lenz","V. M. Braun, D. Yu. Ivanov, A. Lenz and A. Peters","Threshold Pion Production at Large Momentum Transfers","3 pages, talkpresented at PANIC 2008",,,,"hep-ph nucl-ex nucl-th","http://arxiv.org/licenses/nonexclusive-distrib/1.0/","  We consider threshold pion electroproduction on a proton target for photon
virtualities in the region 1-10 GeV$^2$. The S-wave multipoles at threshold,
$E_{0+}$ and $L_{0+}$, are calculated using light-cone sum rules.
","[{""version"":""v1"",""created"":""Wed, 21 Jan 2009 15:53:18 GMT""}]","2009-02-18"
"0901.3185","William Henney","C. R. O'Dell (Vanderbilt), W. J. Henney (CRyA, UNAM, Mexico), and F.
  Sabbadin (INAF, Padua, Italy)","Tangential Motions and Spectroscopy within NGC 6720, the Ring Nebula","Astronomical Journal, in press",,"10.1088/0004-6256/137/4/3815",,"astro-ph.GA astro-ph.SR","http://arxiv.org/licenses/nonexclusive-distrib/1.0/","  We have combined recent Hubble Space Telescope WFPC2 images in the [O III]
5007 and [N II] 6583 lines with similar images made 9.557 years earlier to
determine the motion of the Ring Nebula within the plane of the sky. Scaled
ratio images argue for homologous expansion, that is, larger velocities scale
with increasing distance from the central star. The rather noisy pattern of
motion of individual features argues for the same conclusion and that the
silhouetted knots move at the same rate as the surrounding gas. These
tangential velocities are combined with information from a recent high
resolution radial velocity study to determine a dynamic distance, which is in
basic agreement with the distance determined from the parallax of the central
star. We have also obtained very high signal to noise ratio moderate resolution
spectra (9.4 Angstrom) along the major and minor axes of the nebula and from
this determined the electron temperatures and density in the multiple
ionization zones present. These results confirm the status of the Ring Nebula
as one of the older planetary nebulae, with a central star transitioning to the
white dwarf cooling curve. (Based on observations with the NASA/ESA Hubble
Space Telescope, obtained at the Space Telescope Science Institute, which is
operated by the Association of Universities for Research in Astronomy, Inc.,
under NASA Contract No. NAS 5-26555 and the San Pedro Martir Observatory
operated by the Universidad Nacional Autonoma de Mexico.)
","[{""version"":""v1"",""created"":""Wed, 21 Jan 2009 04:10:20 GMT""}]","2009-11-13"
"0901.3186","Guo Luo","Guo Luo and Vladimir G. Maz'ya","Wiener Type Regularity of a Boundary Point for the 3D Lam\'e System","19 pages","Potential Anal. 32 (2), pp. 133--151, 2010",,,"math.AP","http://arxiv.org/licenses/nonexclusive-distrib/1.0/","  In this paper, we study the 3D Lam\'e system and establish its weighted
positive definiteness for a certain range of elastic constants. By modifying
the general theory developed in Maz'ya (2002), we then show, under the
assumption of weighted positive definiteness, that the divergence of the
classical Wiener integral for a boundary point guarantees the continuity of
solutions to the Lam\'e system at this point.
","[{""version"":""v1"",""created"":""Wed, 21 Jan 2009 04:10:34 GMT""}]","2013-10-02"
"0901.3187","Ambika G","K P Harikrishnan, R Misra, G Ambika and R E Amritkar","Parametric characterisation of a chaotic attractor using two scale
  Cantor measure","17 pages, 11 figures, submitted to Phys Rev E",,,,"nlin.CD","http://arxiv.org/licenses/nonexclusive-distrib/1.0/","  A chaotic attractor is usually characterised by its multifractal spectrum
which gives a geometric measure of its complexity. Here we present a
characterisation using a minimal set of independant parameters which are
uniquely determined by the underlying process that generates the attractor. The
method maps the f(alpha) spectrum of a chaotic attractor onto that of a general
two scale Cantor measure. We show that the mapping can be done for a large
number of chaotic systems. In order to implement this procedure, we also
propose a generalisation of the standard equations for two scale Cantor set in
one dimension to that in higher dimensions. Another interesting result we have
obtained both theoretically and numerically is that, the f(alpha)
characterisation gives information only upto two scales, even when the
underlying process generating the multifractal involves more than two scales.
","[{""version"":""v1"",""created"":""Wed, 21 Jan 2009 04:37:53 GMT""}]","2009-01-22"
"0901.3189","James Lathrop","Steven M. Kautz, James I. Lathrop","Self-assembly of the discrete Sierpinski carpet and related fractals",,,,,"cs.OH","http://arxiv.org/licenses/nonexclusive-distrib/1.0/","  It is well known that the discrete Sierpinski triangle can be defined as the
nonzero residues modulo 2 of Pascal's triangle, and that from this definition
one can easily construct a tileset with which the discrete Sierpinski triangle
self-assembles in Winfree's tile assembly model. In this paper we introduce an
infinite class of discrete self-similar fractals that are defined by the
residues modulo a prime p of the entries in a two-dimensional matrix obtained
from a simple recursive equation. We prove that every fractal in this class
self-assembles using a uniformly constructed tileset. As a special case we show
that the discrete Sierpinski carpet self-assembles using a set of 30 tiles.
","[{""version"":""v1"",""created"":""Wed, 21 Jan 2009 04:58:13 GMT""}]","2009-01-22"
"0901.3190","Gerardo Adesso","Gerardo Adesso","Experimentally friendly bounds on non-Gaussian entanglement from second
  moments","5 pages, 2 figures. To appear in PRA","Phys. Rev. A 79, 022315 (2009)","10.1103/PhysRevA.79.022315",,"quant-ph","http://arxiv.org/licenses/nonexclusive-distrib/1.0/","  We demonstrate that the entanglement in a class of two-mode non-Gaussian
states obtained by subtracting photons from Gaussian twin beams can be bounded
from above and from below by functionals of the second moments only. Knowledge
of the covariance matrix thus suffices for an entanglement quantification with
appreciable precision. The absolute error in the entanglement estimation scales
with the non-Gaussianity of the considered states.
","[{""version"":""v1"",""created"":""Wed, 21 Jan 2009 05:58:51 GMT""},{""version"":""v2"",""created"":""Thu, 22 Jan 2009 06:09:41 GMT""}]","2009-02-15"
"0901.3191","Mahmood Roshan","Mahmood Roshan, Maryam Nouri, Fatimah Shojai","Cosmological solutions of time varying speed of light theories","16 pages, final version accepted for publication in Physics Letters B","Phys.Lett.B672:197-202,2009","10.1016/j.physletb.2009.01.042",,"gr-qc","http://arxiv.org/licenses/nonexclusive-distrib/1.0/","  We consider scalar-tensor theory for describing varying speed of light in a
spatially flat FRW space-time. We find some exact solutions in the metric and
Palatini formalisms. Also we examine the dynamics of this theory by dynamical
system method assuming a $\Lambda$CDM background and we find some exact
solutions by considering the character of critical points of the theory in both
formalisms. We show that for any attractor the form of non-minimal coupling
coefficient is quadratic in terms of the scalar field $\Psi$. Also we show that
only attractors of the de Sitter era satisfy the horizon criteria.
","[{""version"":""v1"",""created"":""Wed, 21 Jan 2009 06:01:00 GMT""},{""version"":""v2"",""created"":""Sun, 1 Feb 2009 19:09:50 GMT""}]","2010-04-23"
"0901.3192","Meixia Tao","Xiaolu Zhang, Meixia Tao, Wenhua Jiao and Chun Sum Ng","End-to-End Outage Minimization in OFDM Based Linear Relay Networks","25 pages, 8 figures",,,,"cs.IT math.IT","http://arxiv.org/licenses/nonexclusive-distrib/1.0/","  Multi-hop relaying is an economically efficient architecture for coverage
extension and throughput enhancement in future wireless networks. OFDM, on the
other hand, is a spectrally efficient physical layer modulation technique for
broadband transmission. As a natural consequence of combining OFDM with
multi-hop relaying, the allocation of per-hop subcarrier power and per-hop
transmission time is crucial in optimizing the network performance. This paper
is concerned with the end-to-end information outage in an OFDM based linear
relay network. Our goal is to find an optimal power and time adaptation policy
to minimize the outage probability under a long-term total power constraint. We
solve the problem in two steps. First, for any given channel realization, we
derive the minimum short-term power required to meet a target transmission
rate. We show that it can be obtained through two nested bisection loops. To
reduce computational complexity and signalling overhead, we also propose a
sub-optimal algorithm. In the second step, we determine a power threshold to
control the transmission on-off so that the long-term total power constraint is
satisfied. Numerical examples are provided to illustrate the performance of the
proposed power and time adaptation schemes with respect to other resource
adaptation schemes.
","[{""version"":""v1"",""created"":""Wed, 21 Jan 2009 06:37:55 GMT""}]","2009-01-22"
"0901.3193","Anirban Pathak","Amit Verma and Anirban Pathak","Generalized structure of higher order nonclassicality","14 pages, 7 figures","Physics Letters A 374 (2010) 1009-1020","10.1016/j.physleta.2009.12.041",,"quant-ph","http://arxiv.org/licenses/nonexclusive-distrib/1.0/","  A generalized notion of higher order nonclassicality (in terms of higher
order moments) is introduced. Under this generalized framework of higher order
nonclassicality, conditions of higher order squeezing and higher order
subpoissonian photon statistics are derived. A simpler form of the Hong-Mandel
higher order squeezing criterion is derived under this framework by using an
operator ordering theorem introduced by us in [J. Phys. A. 33 (2000) 5607]. It
is also generalized for multi-photon Bose operators of Brandt and Greenberg.
Similarly, condition for higher order subpoissonian photon statistics is
derived by normal ordering of higher powers of number operator. Further, with
the help of simple density matrices, it is shown that the higher order
antibunching (HOA) and higher order subpoissonian photon statistics (HOSPS) are
not the manifestation of the same phenomenon and consequently it is incorrect
to use the condition of HOA as a test of HOSPS. It is also shown that the HOA
and HOSPS may exist even in absence of the corresponding lower order
phenomenon. Binomial state, nonlinear first order excited squeezed state
(NLESS) and nonlinear vacuum squeezed state (NLVSS) are used as examples of
quantum state and it is shown that these states may show higher order
nonclssical characteristics. It is observed that the Binomial state which is
always antibunched, is not always higher order squeezed and NLVSS which shows
higher order squeezing does not show HOSPS and HOA. The opposite is observed in
NLESS and consequently it is established that the HOSPS and HOS are two
independent signatures of higher order nonclassicality
","[{""version"":""v1"",""created"":""Wed, 21 Jan 2009 06:40:32 GMT""}]","2022-06-07"
"0901.3194","Vincenzo F. Cardone","V.F. Cardone, S. Capozziello, M.G. Dainotti","An updated Gamma Ray Bursts Hubble diagram","version accepted for publication on MNRAS; 19 pages, 8 figures, 4
  tables; contains two new sections on the analysis of systematic errors and
  cosmological constraints using present day and forecasts on future data","Mon. Not. R. Astron. Soc. 400, 775-790 (2009)","10.1111/j.1365-2966.2009.15456.x",,"astro-ph.CO","http://arxiv.org/licenses/nonexclusive-distrib/1.0/","  Gamma ray bursts (GRBs) have recently attracted much attention as a possible
way to extend the Hubble diagram to very high redshift. To this aim, the
luminosity (or isotropic emitted energy) of a GRB at redshift z must be
evaluated from a correlation with a distance independent quantity so that one
can then solve for the luminosity distance D_L(z) and hence the distance
modulus mu(z). Averaging over five different two parameters correlations and
using a fiducial cosmological model to calibrate them, Schaefer (2007) has
compiled a sample of 69 GRBs with measured mu(z) which has since then been
widely used to constrain cosmological parameters. We update here that sample by
many aspects. First, we add a recently found correlation for the X - ray
afterglow and use a Bayesian inspired fitting method to calibrate the different
GRBs correlations known insofar assuming a fiducial LCDM model in agreement
with the recent WMAP5 data. Averaging over six correlations, we end with a new
GRBs Hubble diagram comprising 83 objects. We also extensively explore the
impact of varying the fiducial cosmological model considering how the estimated
mu(z) change as a function of the $(\Omega_M, w_0, w_a)$ parameters of the
Chevallier - Polarski - Linder phenomenological dark energy equation of state.
In order to avoid the need of assuming an {\it a priori} cosmological model, we
present a new calibration procedure based on a model independent local
regression estimate of mu(z) using the Union SNeIa sample to calibrate the GRBs
correlations. This finally gives us a GRBs Hubble diagram made out of 69 GRBs
whose estimated distance modulus mu(z) is almost independent on the underlying
cosmological model.
","[{""version"":""v1"",""created"":""Wed, 21 Jan 2009 07:07:42 GMT""},{""version"":""v2"",""created"":""Mon, 27 Jul 2009 16:35:29 GMT""}]","2010-01-11"
"0901.3195","Spyros Basilakos","Spyros Basilakos (Academy of Athens)","Solving the main cosmological puzzles with a generalized time varying
  vacuum energy","9 pages, 2 figures, Accepted for publication by Astronomy and
  Astrophysics",,"10.1051/0004-6361/200912575",,"astro-ph.CO gr-qc hep-ph hep-th","http://arxiv.org/licenses/nonexclusive-distrib/1.0/","  We study the dynamics of the FLRW flat cosmological models in which the
vacuum energy density varies with time, $\Lambda(t)$. In particular, we
investigate the dynamical properties of a generalized vacuum model and we find
that under certain conditions the vacuum term in the radiation era varies as
$\Lambda(z) \propto (1+z)^{4}$, while in the matter era we have
$\Lambda(z)\propto (1+z)^{3}$ up to $z\simeq 3$ and $\Lambda(z)=\Lambda$ for
$z\le 3$. The confirmation of such a behavior would be of paramount importance
because it could provide a solution to the cosmic coincidence problem as well
as to the fine tuning problem, without changing the well known (from the
concordance $\Lambda$ cosmology) Hubble expansion.
","[{""version"":""v1"",""created"":""Wed, 21 Jan 2009 07:21:05 GMT""},{""version"":""v2"",""created"":""Mon, 12 Oct 2009 08:32:15 GMT""}]","2015-05-13"
"0901.3196","Farzan Haddadi","Farzan Haddadi, Mohammadreza Malekmohammadi, Mohammad Mahdi Nayebi,
  Mohammad Reza Aref","Statistical Performance Analysis of MDL Source Enumeration in Array
  Processing","Accepted for publication in IEEE Transactions on Signal Processing,
  April 2009",,"10.1109/TSP.2009.2028207",,"cs.IT math.IT","http://arxiv.org/licenses/nonexclusive-distrib/1.0/","  In this correspondence, we focus on the performance analysis of the
widely-used minimum description length (MDL) source enumeration technique in
array processing. Unfortunately, available theoretical analysis exhibit
deviation from the simulation results. We present an accurate and insightful
performance analysis for the probability of missed detection. We also show that
the statistical performance of the MDL is approximately the same under both
deterministic and stochastic signal models. Simulation results show the
superiority of the proposed analysis over available results.
","[{""version"":""v1"",""created"":""Wed, 21 Jan 2009 07:26:05 GMT""},{""version"":""v2"",""created"":""Thu, 23 Apr 2009 10:27:45 GMT""}]","2015-05-13"
"0901.3197","Danny Bickson","Danny Bickson, Alexander T. Ihler and Danny Dolev","A Low Density Lattice Decoder via Non-Parametric Belief Propagation","Submitted for publication",,"10.1109/ALLERTON.2009.5394798",,"cs.IT math.IT","http://arxiv.org/licenses/nonexclusive-distrib/1.0/","  The recent work of Sommer, Feder and Shalvi presented a new family of codes
called low density lattice codes (LDLC) that can be decoded efficiently and
approach the capacity of the AWGN channel. A linear time iterative decoding
scheme which is based on a message-passing formulation on a factor graph is
given.
  In the current work we report our theoretical findings regarding the relation
between the LDLC decoder and belief propagation. We show that the LDLC decoder
is an instance of non-parametric belief propagation and further connect it to
the Gaussian belief propagation algorithm. Our new results enable borrowing
knowledge from the non-parametric and Gaussian belief propagation domains into
the LDLC domain. Specifically, we give more general convergence conditions for
convergence of the LDLC decoder (under the same assumptions of the original
LDLC convergence analysis). We discuss how to extend the LDLC decoder from
Latin square to full rank, non-square matrices. We propose an efficient
construction of sparse generator matrix and its matching decoder. We report
preliminary experimental results which show our decoder has comparable symbol
to error rate compared to the original LDLC decoder.%
","[{""version"":""v1"",""created"":""Wed, 21 Jan 2009 07:47:10 GMT""},{""version"":""v2"",""created"":""Thu, 9 Jul 2009 13:04:38 GMT""},{""version"":""v3"",""created"":""Mon, 13 Jul 2009 11:27:50 GMT""},{""version"":""v4"",""created"":""Wed, 7 Oct 2009 17:14:11 GMT""}]","2010-03-23"
"0901.3198","Laurent Noe","Mikhail A. Roytberg (IMPB), Anna Gambin, Laurent No\'e (LIFL, INRIA
  Lille - Nord Europe), Slawomir Lasota, Eugenia Furletova (IMPB), Ewa Szczurek
  (MPI), Gregory Kucherov (LIFL, INRIA Lille - Nord Europe)","On subset seeds for protein alignment","IEEE/ACM Transactions on Computational Biology and Bioinformatics
  (2009)","IEEE/ACM Transactions on Computational Biology and Bioinformatics,
  6 (3) : 483-494, 2009","10.1109/TCBB.2009.4",,"q-bio.QM","http://arxiv.org/licenses/nonexclusive-distrib/1.0/","  We apply the concept of subset seeds proposed in [1] to similarity search in
protein sequences. The main question studied is the design of efficient seed
alphabets to construct seeds with optimal sensitivity/selectivity trade-offs.
We propose several different design methods and use them to construct several
alphabets. We then perform a comparative analysis of seeds built over those
alphabets and compare them with the standard BLASTP seeding method [2], [3], as
well as with the family of vector seeds proposed in [4]. While the formalism of
subset seeds is less expressive (but less costly to implement) than the
cumulative principle used in BLASTP and vector seeds, our seeds show a similar
or even better performance than BLASTP on Bernoulli models of proteins
compatible with the common BLOSUM62 matrix. Finally, we perform a large-scale
benchmarking of our seeds against several main databases of protein alignments.
Here again, the results show a comparable or better performance of our seeds
vs. BLASTP.
","[{""version"":""v1"",""created"":""Wed, 21 Jan 2009 07:59:27 GMT""}]","2011-01-18"
