"0901.2925","Patrick Meade","Patrick Meade, Michele Papucci, Tomer Volansky","Dark Matter Sees The Light","47 pages, 17 figures","JHEP 0912:052,2009","10.1088/1126-6708/2009/12/052",,"hep-ph astro-ph.HE","http://arxiv.org/licenses/nonexclusive-distrib/1.0/","  We construct a Dark Matter (DM) annihilation module that can encompass the
predictions from a wide array of models built to explain the recently reported
PAMELA and ATIC/PPB-BETS excesses. We present a detailed analysis of the
injection spectrums for DM annihilation and quantitatively demonstrate effects
that have previously not been included from the particle physics perspective.
With this module we demonstrate the parameter space that can account for the
aforementioned excesses and be compatible with existing high energy gamma ray
and neutrino experiments. However, we find that it is relatively generic to
have some tension between the results of the HESS experiment and the
ATIC/PPB-BETS experiments within the context of annihilating DM. We discuss
ways to alleviate this tension and how upcoming experiments will be able to
differentiate amongst the various possible explanations of the purported
excesses.
","[{""version"":""v1"",""created"":""Tue, 20 Jan 2009 20:16:30 GMT""}]","2010-01-15"
"0901.2926","Daniel Stolarski","Jeremy Mardon, Yasunori Nomura, Daniel Stolarski, Jesse Thaler","Dark Matter Signals from Cascade Annihilations","36 pages, 11 figures, 7 tables; references added","JCAP 0905:016,2009","10.1088/1475-7516/2009/05/016","UCB-PTH-09/02","hep-ph astro-ph.CO","http://arxiv.org/licenses/nonexclusive-distrib/1.0/","  A leading interpretation of the electron/positron excesses seen by PAMELA and
ATIC is dark matter annihilation in the galactic halo. Depending on the
annihilation channel, the electron/positron signal could be accompanied by a
galactic gamma ray or neutrino flux, and the non-detection of such fluxes
constrains the couplings and halo properties of dark matter. In this paper, we
study the interplay of electron data with gamma ray and neutrino constraints in
the context of cascade annihilation models, where dark matter annihilates into
light degrees of freedom which in turn decay into leptons in one or more steps.
Electron and muon cascades give a reasonable fit to the PAMELA and ATIC data.
Compared to direct annihilation, cascade annihilations can soften gamma ray
constraints from final state radiation by an order of magnitude. However, if
dark matter annihilates primarily into muons, the neutrino constraints are
robust regardless of the number of cascade decay steps. We also examine the
electron data and gamma ray/neutrino constraints on the recently proposed
""axion portal"" scenario.
","[{""version"":""v1"",""created"":""Tue, 20 Jan 2009 18:41:08 GMT""},{""version"":""v2"",""created"":""Fri, 30 Jan 2009 23:37:56 GMT""}]","2009-09-29"
"0901.2937","Murad Alim","M. Alim, M. Hecht, P. Mayr, A. Mertens","Mirror Symmetry for Toric Branes on Compact Hypersurfaces","36 pages, references added","JHEP 0909:126,2009","10.1088/1126-6708/2009/09/126","LMU-ASC 02/09","hep-th math.AG","http://arxiv.org/licenses/nonexclusive-distrib/1.0/","  We use toric geometry to study open string mirror symmetry on compact
Calabi-Yau manifolds. For a mirror pair of toric branes on a mirror pair of
toric hypersurfaces we derive a canonical hypergeometric system of differential
equations, whose solutions determine the open/closed string mirror maps and the
partition functions for spheres and discs. We define a linear sigma model for
the brane geometry and describe a correspondence between dual toric polyhedra
and toric brane geometries. The method is applied to study examples with
obstructed and classically unobstructed brane moduli at various points in the
deformation space. Computing the instanton expansion at large volume in the
flat coordinates on the open/closed deformation space we obtain predictions for
enumerative invariants.
","[{""version"":""v1"",""created"":""Tue, 20 Jan 2009 17:59:20 GMT""},{""version"":""v2"",""created"":""Thu, 13 Aug 2009 07:48:42 GMT""}]","2009-10-02"
"0901.2993","Achim Klenke","Achim Klenke, Mario Oeler","A Trotter-type approach to infinite rate mutually catalytic branching","Published in at http://dx.doi.org/10.1214/09-AOP488 the Annals of
  Probability (http://www.imstat.org/aop/) by the Institute of Mathematical
  Statistics (http://www.imstat.org)","Annals of Probability 2010, Vol. 38, No. 2, 479-497","10.1214/09-AOP488","IMS-AOP-AOP488","math.PR","http://arxiv.org/licenses/nonexclusive-distrib/1.0/","  Dawson and Perkins [Ann. Probab. 26 (1988) 1088--1138] constructed a
stochastic model of an interacting two-type population indexed by a countable
site space which locally undergoes a mutually catalytic branching mechanism. In
Klenke and Mytnik [Preprint (2008), arXiv:0901.0623], it is shown that as the
branching rate approaches infinity, the process converges to a process that is
called the infinite rate mutually catalytic branching process (IMUB). It is
most conveniently characterized as the solution of a certain martingale
problem. While in the latter reference, a noise equation approach is used in
order to construct a solution to this martingale problem, the aim of this paper
is to provide a Trotter-type construction. The construction presented here will
be used in a forthcoming paper, Klenke and Mytnik [Preprint (2009)], to
investigate the long-time behavior of IMUB (coexistence versus segregation of
types). This paper is partly based on the Ph.D. thesis of the second author
(2008), where the Trotter approach was first introduced.
","[{""version"":""v1"",""created"":""Tue, 20 Jan 2009 20:43:14 GMT""},{""version"":""v2"",""created"":""Fri, 1 Oct 2010 13:20:50 GMT""}]","2010-10-04"
"0901.3042","Yuhan Zha","Yuhan Zha","A Height Inequality","This is a revision of the previous version. A mistake is found in the
  previous version. Total 29 pages",,,,"math.AG math.NT","http://arxiv.org/licenses/nonexclusive-distrib/1.0/","  We give a mathematical structure on an arithmetic surface, that has algebraic
meanings over finite places and can estimate the canonical norm for a relative
differential form on the arithmetic surface. This will give a lower bound for
the canonical norm for a relative differential form on an arithmetic surface,
which proves a Height Inequality on the arithmetic surface.
","[{""version"":""v1"",""created"":""Tue, 20 Jan 2009 18:12:52 GMT""},{""version"":""v2"",""created"":""Mon, 5 Apr 2010 08:00:32 GMT""},{""version"":""v3"",""created"":""Wed, 19 Dec 2012 03:25:21 GMT""},{""version"":""v4"",""created"":""Fri, 7 Aug 2015 01:57:48 GMT""}]","2015-08-10"
"0901.3057","Vaclav Janis","V. Janis","Integrability of the diffusion pole in the diagrammatic description of
  noninteracting electrons in a random potential","REVTeX4, 8 pages, no figures","J. Phys.: Condens. Matter 21, 485501 (2009)","10.1088/0953-8984/21/48/485501",,"cond-mat.dis-nn","http://arxiv.org/licenses/nonexclusive-distrib/1.0/","  We discuss restrictions on the existence of the diffusion pole in the
translationally invariant diagrammatic treatment of disordered electron
systems. We use the Bethe-Salpeter equations for the two-particle vertex in the
electron-hole and the electron-electron scattering channels and derive for
systems with time reversal symmetry a nonlinear integral equation the
two-particle irreducible vertices from both channels must obey. We use this
equation to test the existence of the diffusion pole in the two-particle
vertex. We find that a singularity of the diffusion pole can exist only if it
is integrable, that is only in the metallic phase in dimensions $d>2$.
","[{""version"":""v1"",""created"":""Tue, 20 Jan 2009 16:48:33 GMT""}]","2010-02-25"
"0901.3081","Willard Miller Jr.","Ernest G. Kalnins, Jonathan M. Kress, Willard Miller Jr. and Sarah
  Post","Structure Theory for Second Order 2D Superintegrable Systems with
  1-Parameter Potentials",,"SIGMA 5 (2009), 008, 24 pages","10.3842/SIGMA.2009.008",,"math-ph math.MP nlin.SI","http://creativecommons.org/licenses/by-nc-sa/3.0/","  The structure theory for the quadratic algebra generated by first and second
order constants of the motion for 2D second order superintegrable systems with
nondegenerate (3-parameter) and or 2-parameter potentials is well understood,
but the results for the strictly 1-parameter case have been incomplete. Here we
work out this structure theory and prove that the quadratic algebra generated
by first and second order constants of the motion for systems with 4 second
order constants of the motion must close at order three with the functional
relationship between the 4 generators of order four. We also show that every
1-parameter superintegrable system is St\""ackel equivalent to a system on a
constant curvature space.
","[{""version"":""v1"",""created"":""Tue, 20 Jan 2009 16:59:17 GMT""}]","2009-01-23"
"0901.3083","Francois Fressin","Fressin Francois, Guillot Tristan, Nesta Lionel","Interpreting the yield of transit surveys: Are there groups in the known
  transiting planets population?","17 pages","Astronomy & Astrophysics 2008","10.1051/0004-6361/200810097",,"astro-ph.EP","http://arxiv.org/licenses/nonexclusive-distrib/1.0/","  Each transiting planet discovered is characterized by 7 measurable
quantities, that may or may not be linked together (planet mass, radius,
orbital period, and star mass, radius, effective temperature, and metallicity).
Correlations between planet mass and period, surface gravity and period, planet
radius and star temperature have been previously observed among the known
transiting giant planets. Two classes of planets have been previously
identified based on their Safronov number. We use the CoRoTlux code to compare
simulated events to the sample of discovered planets and test the statistical
significance of these correlations. We first generate a stellar field with
planetary companions based on radial velocity discoveries and a planetary
evolution model, then apply a detection criterion that includes both
statistical and red noise sources. We compare the yield of our simulated survey
with the ensemble of 31 well-characterized giant transiting planets, using a
multivariate logistic analysis to assess whether the simulated distribution
matches the known transiting planets. Our multivariate analysis shows that our
simulated sample and observations are consistent to 76%. The mass vs. period
correlation for giant planets first observed with radial velocity holds with
transiting planets. Our model naturally explains the correlation between planet
surface gravity and period and the one between planet radius and stellar
effective temperature. Finally, we are also able to reproduce the previously
observed apparent bimodal distribution of Safronov numbers in 10% of our
simulated cases, although our model predicts a continuous distribution. This
shows that the evidence for the existence of two groups of planets with
different intrinsic properties is not statistically significant.
","[{""version"":""v1"",""created"":""Tue, 20 Jan 2009 17:35:28 GMT""}]","2015-05-13"
"0901.3084","John Alexander Crosse","J. A. Crosse and Stefan Scheel","Atomic multipole relaxation rates near surfaces","Updated to journal version. 16 pages","Phys. Rev. A, 79, 062902 (2009)","10.1103/PhysRevA.79.062902",,"quant-ph","http://arxiv.org/licenses/nonexclusive-distrib/1.0/","  The spontaneous relaxation rates for an atom in free space and close to an
absorbing surface are calculated to various orders of the electromagnetic
multipole expansion. The spontaneous decay rates for dipole, quadrupole and
octupole transitions are calculated in terms of their respective primitive
electric multipole moments and the magnetic relaxation rate is calculated for
the dipole and quadrupole transitions in terms of their respective primitive
magnetic multipole moments. The theory of electromagnetic field quantization in
magnetoelectric materials is used to derive general expressions for the decay
rates in terms of the dyadic Green function. We focus on the decay rates in
free space and near an infinite half space. For the decay of atoms near to an
absorbing dielectric surface we find a hierarchy of scaling laws depending on
the atom-surface distance z.
","[{""version"":""v1"",""created"":""Tue, 20 Jan 2009 16:45:47 GMT""},{""version"":""v2"",""created"":""Fri, 13 Aug 2010 12:08:52 GMT""}]","2010-08-16"
"0901.3085","Fergus Simpson","Fergus Simpson, John A. Peacock, Patrick Simon","Locating the Baryon Acoustic Peak","8 pages, 7 figures, minor changes reflect published version","Phys.Rev.D79:063508,2009","10.1103/PhysRevD.79.063508",,"astro-ph.CO","http://arxiv.org/licenses/nonexclusive-distrib/1.0/","  Forthcoming photometric redshift surveys should provide an accurate probe of
the acoustic peak in the two-point galaxy correlation function, in the form of
angular clustering of galaxies within a given shell in redshift space. We
investigate the form of the anticipated signal, quantifying the distortions
that arise due to projection effects, and in particular explore the validity of
applying the Limber approximation. A single-integral prescription is presented,
which provides an alternative to Limber's equation, and produces a
significantly improved prediction in the regime of interest.
  The position of the acoustic peak within the angular correlation function
relates to the angular diameter distance to the far side of the redshift bin.
Thicker redshift bins therefore shift comoving features towards smaller angular
scales. As a result, the value of the photometric redshift error acquires a
greater significance, particularly at lower redshifts. In order to recover the
dark energy equation of state to a level of 1%, we find the total redshift
dispersion must be determined to within \Delta \sigma_z ~ 10^-3, which may
prove challenging to achieve in practice.
","[{""version"":""v1"",""created"":""Tue, 20 Jan 2009 16:12:42 GMT""},{""version"":""v2"",""created"":""Thu, 12 Mar 2009 10:52:19 GMT""}]","2009-03-24"
"0901.3086","Jia-An Yan","Jia-An Yan, W. Y. Ruan, and M. Y. Chou","Electron-Phonon Interactions for Optical Phonon Modes in Few-Layer
  Graphene","6 pages,5 figures, submitted to PRB","Phys. Rev. B 79, 115443 (2009)","10.1103/PhysRevB.79.115443",,"cond-mat.mtrl-sci cond-mat.str-el","http://arxiv.org/licenses/nonexclusive-distrib/1.0/","  We present a first-principles study of the electron-phonon (e-ph)
interactions and their contributions to the linewidths for the optical phonon
modes at $\Gamma$ and K in one to three-layer graphene. It is found that due to
the interlayer coupling and the stacking geometry, the high-frequency optical
phonon modes in few-layer graphene couple with different valence and conduction
bands, giving rise to different e-ph interaction strengths for these modes.
Some of the multilayer optical modes derived from the $\Gamma$-$E_{2g}$ mode of
monolayer graphene exhibit slightly higher frequencies and much reduced
linewidths. In addition, the linewidths of K-$A'_1$ related modes in
multilayers depend on the stacking pattern and decrease with increasing layer
numbers.
","[{""version"":""v1"",""created"":""Tue, 20 Jan 2009 16:17:32 GMT""}]","2009-03-31"
"0901.3087","Fran\c{c}ois Gallet","Francois Gallet, Delphine Arcizet, Pierre Bohec, Alain Richert","Power Spectrum of Out-of-equilibrium Forces in Living Cells : Amplitude
  and Frequency Dependence",,,,,"physics.bio-ph q-bio.SC","http://arxiv.org/licenses/nonexclusive-distrib/1.0/","  Living cells exhibit an important out-of-equilibrium mechanical activity,
mainly due to the forces generated by molecular motors. These motor proteins,
acting individually or collectively on the cytoskeleton, contribute to the
violation of the fluctuation-dissipation theorem in living systems. In this
work we probe the cytoskeletal out-of-equilibrium dynamics by performing
simultaneous active and passive microrheology experiments, using the same
micron-sized probe specifically bound to the actin cortex. The free motion of
the probe exhibits a constrained, subdiffusive behavior at short time scales (t
< 2s), and a directed, superdiffusive behavior at larger time scales, while, in
response to a step force, its creep function presents the usual weak power law
dependence with time. Combining the results of both experiments, we precisely
measure for the first time the power spectrum of the force fluctuations exerted
on this probe, which lies more than one order of magnitude above the spectrum
expected at equilibrium, and greatly depends on frequency. We retrieve an
effective temperature Teff of the system, as an estimate of the departure from
thermal equilibrium. This departure is especially pronounced on long time
scales, where Teff bears the footprint of the cooperative activity of motors
pulling on the actin network. ATP depletion reduces the fluctuating force
amplitude and results in a sharp decrease of Teff towards equilibrium.
","[{""version"":""v1"",""created"":""Tue, 20 Jan 2009 16:24:14 GMT""}]","2009-01-21"
"0901.3088","Matteo Varbaro Dr.","Leila Sharifan, Matteo Varbaro","Graded Betti numbers of ideals with linear quotients","6 pages","Le Matematiche, V. LXIII (2008) - Fasc. II, pp. 257-265",,,"math.AC","http://arxiv.org/licenses/nonexclusive-distrib/1.0/","  In the present paper we prove that all homogeneous ideals with linear
quotients are componentwise linear. Moreover we establish an extended version
of Eliahou-Kervaire formula for graded Betti numbers.
","[{""version"":""v1"",""created"":""Tue, 20 Jan 2009 16:26:53 GMT""},{""version"":""v2"",""created"":""Fri, 16 Sep 2011 12:59:09 GMT""}]","2011-09-19"
"0901.3089","Treleani Daniele","G. Calucci and D. Treleani","Multi-parton correlations and ""exclusive"" cross sections","18 pages, no figures, corrected typos","Phys.Rev.D79:074013,2009","10.1103/PhysRevD.79.074013",,"hep-ph","http://arxiv.org/licenses/nonexclusive-distrib/1.0/","  In addition to the inclusive cross sections discussed within the QCD-parton
model, in the regime of multiple parton interactions, different and more
exclusive cross sections become experimentally viable and may be suitably
measured. Indeed, in its study of double parton collisions, the quantity
measured by CDF was an ""exclusive"" rather than an inclusive cross section. The
non perturbative input to the ""exclusive"" cross sections is different with
respect to the non perturbative input of the inclusive cross sections and
involves correlation terms of the hadron structure already at the level of
single parton collisions. The matter is discussed in details keeping explicitly
into account the effects of double and of triple parton collisions.
","[{""version"":""v1"",""created"":""Tue, 20 Jan 2009 16:31:10 GMT""},{""version"":""v2"",""created"":""Fri, 23 Jan 2009 17:37:05 GMT""},{""version"":""v3"",""created"":""Wed, 18 Mar 2009 18:02:19 GMT""}]","2015-05-13"
"0901.3090","Serge Bouc","Serge Bouc (LAMFA)","Complexity and cohomology of cohomological Mackey functors",,,,,"math.GR math.CT math.KT","http://arxiv.org/licenses/nonexclusive-distrib/1.0/","  Let $k$ be a field of characteristic $p>0$. Call a finite group $G$ a poco
group over $k$ if any finitely generated cohomological Mackey functor for $G$
over $k$ has polynomial growth. The main result of this paper is that $G$ is a
poco group over $k$ if and only if the Sylow $p$-subgroups of $G$ are cyclic,
when $p>2$, or have sectional rank at most 2, when $p=2$. A major step in the
proof is the case where $G$ is an elementary abelian $p$-group. In particular,
when $p=2$, all the extension groups between simple functors can be determined
completely, using a presentation of the graded algebra of self extensions of
the simple functor $S_1^G$, by explicit generators and relations.
","[{""version"":""v1"",""created"":""Tue, 20 Jan 2009 16:34:37 GMT""}]","2009-01-21"
"0901.3091","Tommaso Roscilde","T. Roscilde, M. Rodriguez, K. Eckert, O. Romero-Isart, M. Lewenstein,
  E. Polzik and A. Sanpera","Quantum polarization spectroscopy of correlations in attractive
  fermionic gases","16 pages, 9 figures","New J. Phys. 11, 055041 (2009)","10.1088/1367-2630/11/5/055041",,"cond-mat.str-el cond-mat.mes-hall","http://arxiv.org/licenses/nonexclusive-distrib/1.0/","  We show how spin-spin correlations, detected in a non-destructive way via
spatially resolved quantum polarization spectroscopy, strongly characterize
various phases realized in trapped ultracold fermionic atoms. Polarization
degrees of freedom of the light couple to spatially resolved components of the
atomic spin. In this way quantum fluctuations of matter are faithfully mapped
onto those of light. In particular we demonstrate that quantum spin
polarization spectroscopy provides a direct method to detect the
Fulde-Ferrell-Larkin-Ovchinnikov phase realized in a one-dimensional imbalanced
Fermi system.
","[{""version"":""v1"",""created"":""Tue, 20 Jan 2009 16:35:09 GMT""}]","2010-03-23"
"0901.3092","Brendon Lovett","Simon C. Benjamin, Brendon W. Lovett, Jason M. Smith","Prospects for measurement-based quantum computing with solid state spins","Submitted to Laser and Photonics Reviews","Laser and Photonics Reviews 3 556 (2009)","10.1002/lpor.200810051",,"quant-ph cond-mat.mtrl-sci","http://arxiv.org/licenses/nonexclusive-distrib/1.0/","  This article aims to review the developments, both theoretical and
experimental, that have in the past decade laid the ground for a new approach
to solid state quantum computing. Measurement-based quantum computing (MBQC)
requires neither direct interaction between qubits nor even what would be
considered controlled generation of entanglement. Rather it can be achieved
using entanglement that is generated probabilistically by the collapse of
quantum states upon measurement. Single electronic spins in solids make
suitable qubits for such an approach, offering long coherence times and well
defined routes to optical measurement. We will review the theoretical basis of
MBQC and experimental data for two frontrunner candidate qubits --
nitrogen-vacancy (NV) centres in diamond and semiconductor quantum dots -- and
discuss the prospects and challenges that lie ahead in realising MBQC in the
solid state.
","[{""version"":""v1"",""created"":""Tue, 20 Jan 2009 16:36:27 GMT""},{""version"":""v2"",""created"":""Wed, 21 Jan 2009 09:57:06 GMT""}]","2009-11-11"
"0901.3093","Jia-An Yan","Jia-An Yan, W. Y. Ruan, and M. Y. Chou","Phonon dispersions and vibrational properties of monolayer, bilayer, and
  trilayer graphene","8 pages, 10 figures","Phys. Rev. B 77, 125401 (2008)","10.1103/PhysRevB.77.125401",,"cond-mat.mtrl-sci cond-mat.other","http://arxiv.org/licenses/nonexclusive-distrib/1.0/","  The phonon dispersions of monolayer and few-layer graphene (AB bilayer, ABA
and ABC trilayers) are investigated using the density-functional perturbation
theory (DFPT). Compared with the monolayer, the optical phonon $E_{2g}$ mode at
$\Gamma$ splits into two and three doubly degenerate branches for bilayer and
trilayer graphene, respectively, due to the weak interlayer coupling. These
modes are of various symmetry and exhibit different sensitivity to either Raman
or infrared (IR) measurements (or both). The splitting is found to be 5
cm$^{-1}$ for bilayer and 2 to 5 cm$^{-1}$ for trilayer graphene. The
interlayer coupling is estimated to be about 2 cm$^{-1}$. We found that the
highest optical modes at K move up by about 12 cm$^{-1}$ for bilayer and 18
cm$^{-1}$ for trilayer relative to monolayer graphene. The atomic displacements
of these optical eigenmodes are analyzed.
","[{""version"":""v1"",""created"":""Tue, 20 Jan 2009 16:37:14 GMT""}]","2009-11-13"
"0901.3094","Massimo Siani","Silvia Penati, Alberto Romagnoni, Massimo Siani","A renormalizable N=1/2 SYM theory with interacting matter","LaTex, 38 pages, 3 figures","JHEP 0903:112,2009","10.1088/1126-6708/2009/03/112",,"hep-th","http://arxiv.org/licenses/nonexclusive-distrib/1.0/","  We consider nonanticommutative SYM theories with chiral matter in the adjoint
representation of the SU(N) x U(1) gauge group. In a superspace setup and
manifest background covariant approach we investigate the one-loop
renormalization of the theory when a cubic superpotential is present. The
structure of the divergent terms reveals that the theory simply obtained from
the ordinary one by trading products for star products is not renormalizable.
Moreover, because of the different renormalization undergone by the abelian
field compared to the non-abelian ones, the superpotential seems to be
incompatible with the requests of renormalizability, gauge and N=1/2
invariance. However, by a suitable modification of the quadratic action for the
U(1) (anti)chiral superfields and the addition of extra couplings, we find an
action which is one-loop renormalizable and manifestly N=1/2 supersymmetric and
supergauge invariant. We conclude that interacting matter can be safely
introduced in NAC gauge theories, in contrast with previous results.
","[{""version"":""v1"",""created"":""Tue, 20 Jan 2009 16:39:43 GMT""}]","2009-04-02"
