"0901.3116","Carla Figueira de Morisson Faria","W. Quan, X. Liu and C. Figueira de Morisson Faria","Nonsequential Double Ionization with Polarization-gated Pulses","17 pages, 6 figures",,"10.1088/0953-4075/42/13/134008",,"physics.atom-ph","http://arxiv.org/licenses/nonexclusive-distrib/1.0/","  We investigate laser-induced nonsequential double ionization by a
polarization-gated laser pulse, constructed employing two counter-rotating
circularly polarized few cycle pulses with a time delay $T_{d}$. We address the
problem within a classical framework, and mimic the behavior of the
quantum-mechanical electronic wave packet by means of an ensemble of classical
electron trajectories. These trajectories are initially weighted with the
quasi-static tunneling rate, and with suitably chosen distributions for the
momentum components parallel and perpendicular to the laser-field polarization,
in the temporal region for which it is nearly linearly polarized. We show that,
if the time delay $T_{d}$ is of the order of the pulse length, the
electron-momentum distributions, as functions of the parallel momentum
components, are highly asymmetric and dependent on the carrier-envelope (CE)
phase. As this delay is decreased, this asymmetry gradually vanishes. We
explain this behavior in terms of the available phase space, the quasi-static
tunneling rate and the recollision rate for the first electron, for different
sets of trajectories. Our results show that polarization-gating technique may
provide an efficient way to study the NSDI dynamics in the single-cycle limit,
without employing few-cycle pulses.
","[{""version"":""v1"",""created"":""Tue, 20 Jan 2009 18:34:54 GMT""}]","2015-05-13"
"0901.3117","Adrian Lewis","J. Bolte, A. Daniilidis and A.S. Lewis","Generic identifiability and second-order sufficiency in tame convex
  optimization",,,,,"math.OC math.NA","http://arxiv.org/licenses/nonexclusive-distrib/1.0/","  We consider linear optimization over a fixed compact convex feasible region
that is semi-algebraic (or, more generally, ""tame""). Generically, we prove that
the optimal solution is unique and lies on a unique manifold, around which the
feasible region is ""partly smooth"", ensuring finite identification of the
manifold by many optimization algorithms. Furthermore, second-order optimality
conditions hold, guaranteeing smooth behavior of the optimal solution under
small perturbations to the objective.
","[{""version"":""v1"",""created"":""Tue, 20 Jan 2009 18:45:42 GMT""}]","2009-01-21"
"0901.3118","Heinz Andernach","O.V. Verkhodanov (1), S.A. Trushkin (1), H. Andernach (2), and V.N.
  Chernenkov (1) ((1) Special Astrophysical Observatory, Nizhnij Arkhyz,
  Karachaj-Cherkesia, Russia; (2) Argelander-Institut fuer Astronomie,
  Universitaet Bonn, Bonn, Germany; on leave of absence from Depto. de
  Astronomia, Univ. Guanajuato, Mexico)","The CATS Service: an Astrophysical Research Tool","8 pages, no figures; accepted for publication in Data Science
  Journal, vol. 8 (2009), http://dsj.codataweb.org; presented at Special
  Session ""Astronomical Data and the Virtual Observatory"" on the conference
  ""CODATA 21"", Kiev, Ukraine, October 5-8, 2008; replaced incorrect reference
  arXiv:0901.2085 with arXiv:0901.2805",,"10.2481/dsj.8.34",,"astro-ph.IM astro-ph.CO","http://arxiv.org/licenses/nonexclusive-distrib/1.0/","  We describe the current status of CATS (astrophysical CATalogs Support
system), a publicly accessible tool maintained at Special Astrophysical
Observatory of the Russian Academy of Sciences (SAO RAS) (http://cats.sao.ru)
allowing one to search hundreds of catalogs of astronomical objects discovered
all along the electromagnetic spectrum. Our emphasis is mainly on catalogs of
radio continuum sources observed from 10 MHz to 245 GHz, and secondly on
catalogs of objects such as radio and active stars, X-ray binaries, planetary
nebulae, HII regions, supernova remnants, pulsars, nearby and radio galaxies,
AGN and quasars. CATS also includes the catalogs from the largest extragalactic
surveys with non-radio waves. In 2008 CATS comprised a total of about 10e9
records from over 400 catalogs in the radio, IR, optical and X-ray windows,
including most source catalogs deriving from observations with the Russian
radio telescope RATAN-600. CATS offers several search tools through different
ways of access, e.g. via web interface and e-mail. Since its creation in 1997
CATS has managed about 10,000 requests. Currently CATS is used by external
users about 1500 times per day and since its opening to the public in 1997 has
received about 4000 requests for its selection and matching tasks.
","[{""version"":""v1"",""created"":""Tue, 20 Jan 2009 18:48:59 GMT""},{""version"":""v2"",""created"":""Sat, 24 Jan 2009 19:23:47 GMT""}]","2009-11-13"
"0901.3119","Josef Cibulka","Josef Cibulka","Average number of flips in pancake sorting","21 pages, new computational results for unburnt pancakes (up to n=19)","Theor. Comput. Sci. 412, pp. 822-834 (2011)","10.1016/j.tcs.2010.11.028",,"cs.DM","http://arxiv.org/licenses/nonexclusive-distrib/1.0/","  We are given a stack of pancakes of different sizes and the only allowed
operation is to take several pancakes from top and flip them. The unburnt
version requires the pancakes to be sorted by their sizes at the end, while in
the burnt version they additionally need to be oriented burnt-side down. We
present an algorithm with the average number of flips, needed to sort a stack
of n burnt pancakes, equal to 7n/4+O(1) and a randomized algorithm for the
unburnt version with at most 17n/12+O(1) flips on average.
  In addition, we show that in the burnt version, the average number of flips
of any algorithm is at least n+\Omega(n/log n) and conjecture that some
algorithm can reach n+\Theta(n/log n).
  We also slightly increase the lower bound on g(n), the minimum number of
flips needed to sort the worst stack of n burnt pancakes. This bound, together
with the upper bound found by Heydari and Sudborough in 1997, gives the exact
number of flips to sort the previously conjectured worst stack -I_n for n=3 mod
4 and n>=15. Finally we present exact values of f(n) up to n=19 and of g(n) up
to n=17 and disprove a conjecture of Cohen and Blum by showing that the burnt
stack -I_{15} is not the worst one for n=15.
","[{""version"":""v1"",""created"":""Tue, 20 Jan 2009 20:08:57 GMT""},{""version"":""v2"",""created"":""Thu, 10 Sep 2009 16:17:16 GMT""}]","2011-02-07"
"0901.3120","S\""onke Rollenske","S\""onke Rollenske","Geometry of nilmanifolds with left-invariant complex structure and
  deformations in the large","40 pages, revised version of the second part of arXiv:0709.0467v1. To
  appear in Proc. LMS","Proc. London Math. Soc., 99, 425-460, 2009,","10.1112/plms/pdp001",,"math.AG math.DG","http://arxiv.org/licenses/nonexclusive-distrib/1.0/","  The relation between nilmanifolds with left-invariant complex structure and
iterated principal holomorphic torus bundles is clarified and we give criteria
under which deformations in the large are again of such type. As an application
we obtain a fairly complete picture in complex dimension three.
","[{""version"":""v1"",""created"":""Tue, 20 Jan 2009 19:14:29 GMT""}]","2009-10-31"
"0901.3121","Demetra Psiachos","D. Psiachos and S. Mazumdar","Correlated-electron description of the photophysics of thin films of
  $\pi$-conjugated polymers",,"Phys. Rev. B 79, 155106 (2009)","10.1103/PhysRevB.79.155106",,"cond-mat.mtrl-sci cond-mat.other","http://arxiv.org/licenses/nonexclusive-distrib/1.0/","  We extend Mulliken's theory of ground state charge transfer in a
donor-acceptor complex to excited state charge transfer between pairs of
identical $\pi$-conjugated oligomers, one of which is in the optically excited
state and the other in the ground state, leading to the formation of a
charge-transfer exciton. Within our theory, optical absorptions from the
charge-transfer exciton should include a low energy intermolecular
charge-transfer excitation, as well as distinct intramolecular excitations from
both the neutral delocalized exciton component and the Coulombically bound
polaron-pair component of the charge-transfer exciton. We report high order
configuration-interaction calculations for pairs of oligomers of
poly-paraphenylenevinylene (PPV) that go beyond our previous single
configuration-interaction calculation and find all five excited state
absorptions predicted using heuristic arguments based on the Mulliken concept.
Our calculated excited state absorption spectrum exhibits strong qualitative
agreement with the complete wavelength-dependent ultrafast photoinduced
absorption in films of PPV derivatives, suggesting that a significant fraction
of the photoinduced absorption here is from the charge-transfer exciton. We
make detailed comparisons to experiments, and a testable experimental
prediction.
","[{""version"":""v1"",""created"":""Tue, 20 Jan 2009 19:10:36 GMT""}]","2009-05-18"
"0901.3122","Joan Schmelz","J. T. Schmelz, S. H. Saar, E. E. DeLuca, L. Golub, V. L. Kashyap, M.
  A. Weber, J. A. Klimchuk","Hinode X-Ray Telescope Detection of Hot Emission from Quiescent Active
  Regions: A Nanoflare Signature?","Submitted to ApJ Letters","Astrophysical Journal Letters 693 (2009) L131-L135","10.1088/0004-637X/693/2/L131",,"astro-ph.SR","http://arxiv.org/licenses/nonexclusive-distrib/1.0/","  The X-Ray Telescope (XRT) on the Japanese/USA/UK {\it Hinode (Solar-B)}
spacecraft has detected emission from a quiescent active region core that is
consistent with nanoflare heating. The fluxes from 10 broadband X-ray filters
and filter combinations were used to constructed Differential Emission Measure
(DEM) curves. In addition to the expected active region peak at Log T =
6.3-6.5, we find a high-temperature component with significant emission measure
at Log T $>$ 7.0. This emission measure is weak compared to the main peak --
the DEM is down by almost three orders of magnitude -- which accounts of the
fact that it has not been observed with earlier instruments. It is also
consistent with spectra of quiescent active regions: no Fe XIX lines are
observed in a CHIANTI synthetic spectrum generated using the XRT DEM
distribution. The DEM result is successfully reproduced with a simple
two-component nanoflare model.
","[{""version"":""v1"",""created"":""Tue, 20 Jan 2009 19:12:10 GMT""}]","2009-11-13"
"0901.3123","Alexander Fritz","Alexander Fritz (1), Asmus Boehm (2), Bodo L. Ziegler (3) ((1) Gemini,
  (2) AIP, (3) ESO)","The Evolution of Field Early-Type Galaxies in the FDF and WHDF","26 pages, 23 figures, accepted for publication in MNRAS",,"10.1111/j.1365-2966.2008.14241.x",,"astro-ph.CO","http://arxiv.org/licenses/nonexclusive-distrib/1.0/","  We explore the properties of 24 field early-type galaxies at 0.20<z<0.75 down
to M_B<=-19.30 in a sample extracted from the FORS Deep Field and the William
Herschel Deep Field. High S/N intermediate-resolution VLT spectroscopy was
complemented by deep high-resolution HST/ACS imaging and additional
ground-based multi-band photometry. To clarify the low level of star formation
(SF) detected in some galaxies, we identify the amount of AGN activity in our
sample using archive data of Chandra and XMM-Newton X-ray surveys. The B and
K-band Faber-Jackson relations and the Fundamental Plane display a moderate
evolution for the field early-type galaxies. Lenticular (S0) galaxies feature
on average a stronger luminosity evolution and bluer rest-frame colours which
can be explained that they comprise more diverse stellar populations compared
to elliptical galaxies. The evolution of the FP can be interpreted as an
average change in the dynamical mass-to-light ratio of our galaxies as <\Delta
\log{(M/L_B)}/z>=-0.74\pm0.08. The M/L evolution of these field galaxies
suggests a continuous mass assembly of field early-type galaxies during the
last 5 Gyr, that gets support by recent studies of field galaxies up to z~1.
Independent evidence for recent SF activity is provided by spectroscopic (OII
em., Hdelta) and photometric (rest-frame colors) diagnostics. Based on the
Hdelta absorption feature we detect a weak residual SF for galaxies that
accounts for 5%-10% in the total stellar mass of these galaxies. The
co-evolution in the luminosity and mass of our galaxies favours a downsizing
formation process. We find some evidence that our galaxies experienced a period
of SF quenching, possible triggered by AGN activity that is in good agreement
with recent results on both observational and theoretical side. (abridged)
","[{""version"":""v1"",""created"":""Tue, 20 Jan 2009 20:49:37 GMT""}]","2009-11-13"
"0901.3124","Evgeny Verbitskiy","Klaus Schmidt, Evgeny Verbitskiy","Abelian Sandpiles and the Harmonic Model",,,"10.1007/s00220-009-0884-3",,"math.DS math-ph math.MP","http://arxiv.org/licenses/nonexclusive-distrib/1.0/","  We present a construction of an entropy-preserving equivariant surjective map
from the $d$-dimensional critical sandpile model to a certain closed,
shift-invariant subgroup of $\mathbb{T}^{\mathbb{Z}^d}$ (the `harmonic model').
A similar map is constructed for the dissipative abelian sandpile model and is
used to prove uniqueness and the Bernoulli property of the measure of maximal
entropy for that model.
","[{""version"":""v1"",""created"":""Tue, 20 Jan 2009 19:24:45 GMT""}]","2015-05-13"
"0901.3125","Evgeni Gurevich","E. Gurevich and O. Kenneth","Lyapunov exponent for the laser speckle potential: a weak disorder
  expansion","5 pages, 2 figures","Phys. Rev. A 79, 063617 (2009)","10.1103/PhysRevA.79.063617",,"cond-mat.dis-nn cond-mat.stat-mech","http://arxiv.org/licenses/nonexclusive-distrib/1.0/","  Anderson localization of matter waves was recently observed with cold atoms
in a weak 1D disorder realized with laser speckle potential [J. Billy et al.,
Nature 453, 891 (2008)]. The latter is special in that it does not have spatial
frequency components above certain cutoff $q_{c}$. As a result, the Lyapunov
exponent (LE), or inverse localization length, vanishes in Born approximation
for particle wavevector $k>{1/2}q_{c}$, and higher orders become essential.
These terms, up to the order four, are calculated analytically and compared
with numerical simulations. For very weak disorder, LE exhibits a sharp drop at
$k$ $={1/2}q_{c}$. For moderate disorder (a) the drop is less dramatic than
expected from the fourth order approximation and (b) LE becomes very sensitive
to the sign of the disorder skewness (which can be controlled in cold atom
experiments). Both observations are related to the strongly non-Gaussian
character of the speckle intensity.
","[{""version"":""v1"",""created"":""Tue, 20 Jan 2009 19:32:31 GMT""},{""version"":""v2"",""created"":""Tue, 20 Oct 2009 09:35:33 GMT""}]","2009-10-20"
"0901.3126","Mark Mineev-Weinstein","Dmitry Khavinson, Mark Mineev-Weinstein, Mihai Putinar","Planar elliptic growth","27 pages",,"10.1007/s11785-008-0093-7","LA-UR-08-04677","nlin.SI","http://arxiv.org/licenses/nonexclusive-distrib/1.0/","  The planar elliptic extension of the Laplacian growth is, after a proper
parametrization, given in a form of a solution to the equation for
area-preserving diffeomorphisms. The infinite set of conservation laws
associated with such elliptic growth is interpreted in terms of potential
theory, and the relations between two major forms of the elliptic growth are
analyzed. The constants of integration for closed form solutions are identified
as the singularities of the Schwarz function, which are located both inside and
outside the moving contour. Well-posedness of the recovery of the elliptic
operator governing the process from the continuum of interfaces parametrized by
time is addressed and two examples of exact solutions of elliptic growth are
presented.
","[{""version"":""v1"",""created"":""Tue, 20 Jan 2009 19:33:30 GMT""}]","2009-01-21"
"0901.3127","Wojciech Dybalski","Wojciech Dybalski","Spectral Theory of Automorphism Groups and Particle Structures in
  Quantum Field Theory","PhD thesis, University of Goettingen, 2008 (advisor D. Buchholz) 156
  pages",,,,"math-ph hep-th math.MP","http://arxiv.org/licenses/nonexclusive-distrib/1.0/","  This Thesis presents some physically motivated criteria for the existence of
particles and infra-particles in a given quantum field theory. It is based on a
refined spectral theory of automorphism groups describing the energy-momentum
transfer of local observables. In particular, a novel decomposition of the
algebra of local observables into spectral subspaces is constructed. Apart from
the counterparts of the pure-point and absolutely continuous subspaces,
familiar from the spectral theory of operators, there appears a new
'point-continuous' subspace. It belongs to the singular-continuous part of the
decomposition, but is finite-dimensional in a large class of models; its
dimension carries information about the infrared structure of a theory. It is
shown that this point-continuous subspace is trivial in all theories complying
with a regularity condition proposed in this work. Moreover, this condition
entails the existence of particles if the theory admits a stress-energy tensor.
The uniqueness of the decomposition of the algebra of observables into the
pure-point and continuous subspace is established by proving an ergodic theorem
for automorphism groups. The proof is based on physically motivated phase space
conditions which have a number of interesting consequences pertaining to the
vacuum structure such as the convergence of physical states to a unique vacuum
under large timelike translations.
","[{""version"":""v1"",""created"":""Tue, 20 Jan 2009 19:46:48 GMT""}]","2009-01-26"
"0901.3128","Mark Mineev-Weinstein","Alexander Leshchiner, Matthew Thrasher, Mark B. Mineev-Weinstein,
  Harry L. Swinney","Harmonic moment dynamics in Laplacian growth","10 pages, 7 figures",,"10.1103/PhysRevE.81.016206","LA-UR 09-00164","nlin.PS","http://arxiv.org/licenses/nonexclusive-distrib/1.0/","  Harmonic moments are integrals of integer powers of z = x+iy over a domain.
Here the domain is an exterior of a bubble of air growing in an oil layer
between two horizontal closely spaced plates. Harmonic moments are a natural
basis for such Laplacian growth phenomena because, unlike other
representations, these moments linearize the zero surface tension problem
(Richardson, 1972), so that all moments except the lowest one are conserved in
time. For non-zero surface tension, we show that the the harmonic moments decay
in time rather than exhibiting the divergences of other representations. Our
laboratory observations confirm the theoretical predictions and demonstrate
that an interface dynamics description in terms of harmonic moments is
physically realizable and robust. In addition, by extending the theory to
include surface tension, we obtain from measurements of the time evolution of
the harmonic moments a value for the surface tension that is within 20% of the
accepted value.
","[{""version"":""v1"",""created"":""Tue, 20 Jan 2009 19:51:03 GMT""}]","2013-05-29"
"0901.3129","Andrea Simoni","A. Simoni, J-M. Launay, P. Soldan","Feshbach resonances in ultracold atom-molecule collisions","7 pages, 6 figures",,"10.1103/PhysRevA.79.032701",,"quant-ph","http://arxiv.org/licenses/nonexclusive-distrib/1.0/","  We investigate the presence of Feshbach resonances in ultracold
alkali-dialkali reactive collisions. Quantum scattering calculations are
performed on a new Na_3 quartet potential energy surface. An analysis of
scattering features is performed through a systematic variation of the
nonadditive three-body interaction potential. Our results should provide useful
information for interpreting future atom-molecule collision experiments.
","[{""version"":""v1"",""created"":""Tue, 20 Jan 2009 19:52:15 GMT""}]","2009-11-13"
"0901.3130","Mustafa Cenk Gursoy","Mustafa Cenk Gursoy","Secure Communication in the Low-SNR Regime: A Characterization of the
  Energy-Secrecy Tradeoff",,,,,"cs.IT math.IT","http://arxiv.org/licenses/nonexclusive-distrib/1.0/","  Secrecy capacity of a multiple-antenna wiretap channel is studied in the low
signal-to-noise ratio (SNR) regime. Expressions for the first and second
derivatives of the secrecy capacity with respect to SNR at SNR = 0 are derived.
Transmission strategies required to achieve these derivatives are identified.
In particular, it is shown that it is optimal in the low-SNR regime to transmit
in the maximum-eigenvalue eigenspace of H_m* H_m - N_m/N_e H_e* H_e where H_m
and H_e denote the channel matrices associated with the legitimate receiver and
eavesdropper, respectively, and N_m and N_e are the noise variances at the
receiver and eavesdropper, respectively. Energy efficiency is analyzed by
finding the minimum bit energy required for secure and reliable communications,
and the wideband slope. Increased bit energy requirements under secrecy
constraints are quantified. Finally, the impact of fading is investigated.
","[{""version"":""v1"",""created"":""Tue, 20 Jan 2009 19:53:43 GMT""}]","2009-01-21"
"0901.3131","Carlos Gustavo Tamm de Araujo Moreira","Carlos Gustavo Tamm de Araujo Moreira","There are no C^1-stable intersections of regular Cantor sets","8 pages",,,,"math.DS","http://arxiv.org/licenses/nonexclusive-distrib/1.0/","  We show that there are no C^1-stable intersections of regular Cantor sets.
","[{""version"":""v1"",""created"":""Tue, 20 Jan 2009 20:07:32 GMT""}]","2009-01-21"
"0901.3132","Mustafa Cenk Gursoy","Junwei Zhang and Mustafa Cenk Gursoy","Low-SNR Analysis of Interference Channels under Secrecy Constraints",,,,,"cs.IT math.IT","http://arxiv.org/licenses/nonexclusive-distrib/1.0/","  In this paper, we study the secrecy rates over weak Gaussian interference
channels for different transmission schemes. We focus on the low-SNR regime and
obtain the minimum bit energy E_b/N_0_min values, and the wideband slope
regions for both TDMA and multiplexed transmission schemes. We show that
secrecy constraints introduce a penalty in both the minimum bit energy and the
slope regions. Additionally, we identify under what conditions TDMA or
multiplexed transmission is optimal. Finally, we show that TDMA is more likely
to be optimal in the presence of secrecy constraints.
","[{""version"":""v1"",""created"":""Tue, 20 Jan 2009 20:00:00 GMT""}]","2009-09-30"
"0901.3133","Oren Suchoi","Oren Suchoi, Baleegh Abdo, Eran Segev, Oleg Shtempluck, M. P.
  Blencowe, and Eyal Buks","Intermode Dephasing in a Superconducting Stripline Resonator -
  Supplementary Information","9 pages and 2 figures, supplementary to arXiv:0901.3110",,"10.1103/PhysRevB.81.174525",,"cond-mat.supr-con cond-mat.mes-hall","http://arxiv.org/licenses/nonexclusive-distrib/1.0/","  Supplementary information for the article ""Intermode Dephasing in a
Superconducting Stripline Resonator"" (arXiv:0901.3110). The supplementary
information is devoted to three main issues. In section I we describe the
fabrication process; in section II we present the derivation of the Hamiltonian
of the system and provide a more detailed discussion about the properties of
the microbridges; in section III the hysteretic response of the resonator and
the effect of heating are discussed.
","[{""version"":""v1"",""created"":""Tue, 20 Jan 2009 20:16:35 GMT""}]","2013-05-29"
"0901.3134","Mustafa Cenk Gursoy","Deli Qiao, Mustafa Cenk Gursoy, and Senem Velipasalar","Energy Efficiency of Fixed-Rate Wireless Transmissions under Queueing
  Constraints and Channel Uncertainty",,,,,"cs.IT math.IT","http://arxiv.org/licenses/nonexclusive-distrib/1.0/","  Energy efficiency of fixed-rate transmissions is studied in the presence of
queueing constraints and channel uncertainty. It is assumed that neither the
transmitter nor the receiver has channel side information prior to
transmission. The channel coefficients are estimated at the receiver via
minimum mean-square-error (MMSE) estimation with the aid of training symbols.
It is further assumed that the system operates under statistical queueing
constraints in the form of limitations on buffer violation probabilities. The
optimal fraction of of power allocated to training is identified. Spectral
efficiency--bit energy tradeoff is analyzed in the low-power and wideband
regimes by employing the effective capacity formulation. In particular, it is
shown that the bit energy increases without bound in the low-power regime as
the average power vanishes. On the other hand, it is proven that the bit energy
diminishes to its minimum value in the wideband regime as the available
bandwidth increases. For this case, expressions for the minimum bit energy and
wideband slope are derived. Overall, energy costs of channel uncertainty and
queueing constraints are identified.
","[{""version"":""v1"",""created"":""Tue, 20 Jan 2009 20:07:38 GMT""}]","2009-01-21"
"0901.3135","James Ciston","J. Ciston, A. Subramanian, I. K. Robinson, L. D. Marks","Charge Density Refinement of the Si (111) 7x7 Surface","10 pages including 1 Figure","Physical Review, B79, 193302 (2009)","10.1103/PhysRevB.79.193302",,"cond-mat.mtrl-sci","http://arxiv.org/licenses/nonexclusive-distrib/1.0/","  We report an experimental refinement of the local charge density at the Si
(111) 7x7 surface utilizing a combination of x-ray and high energy electron
diffraction. By perturbing about a bond-centered pseudoatom model, we find
experimentally that the adatoms are in an anti-bonding state with the atoms
directly below. We are also able to experimentally refine a charge transfer of
0.26(4) e- from each adatom site to the underlying layers. These results are
compared with a full-potential all-electron density functional DFT calculation.
","[{""version"":""v1"",""created"":""Tue, 20 Jan 2009 20:27:40 GMT""}]","2015-05-13"
