"0901.3245","Boaz Nadler","Boaz Nadler","Finite sample approximation results for principal component analysis: a
  matrix perturbation approach","Published in at http://dx.doi.org/10.1214/08-AOS618 the Annals of
  Statistics (http://www.imstat.org/aos/) by the Institute of Mathematical
  Statistics (http://www.imstat.org)","Annals of Statistics 2008, Vol. 36, No. 6, 2791-2817","10.1214/08-AOS618","IMS-AOS-AOS618","math.ST stat.TH","http://arxiv.org/licenses/nonexclusive-distrib/1.0/","  Principal component analysis (PCA) is a standard tool for dimensional
reduction of a set of $n$ observations (samples), each with $p$ variables. In
this paper, using a matrix perturbation approach, we study the nonasymptotic
relation between the eigenvalues and eigenvectors of PCA computed on a finite
sample of size $n$, and those of the limiting population PCA as $n\to\infty$.
As in machine learning, we present a finite sample theorem which holds with
high probability for the closeness between the leading eigenvalue and
eigenvector of sample PCA and population PCA under a spiked covariance model.
In addition, we also consider the relation between finite sample PCA and the
asymptotic results in the joint limit $p,n\to\infty$, with $p/n=c$. We present
a matrix perturbation view of the ""phase transition phenomenon,"" and a simple
linear-algebra based derivation of the eigenvalue and eigenvector overlap in
this asymptotic limit. Moreover, our analysis also applies for finite $p,n$
where we show that although there is no sharp phase transition as in the
infinite case, either as a function of noise level or as a function of sample
size $n$, the eigenvector of sample PCA may exhibit a sharp ""loss of tracking,""
suddenly losing its relation to the (true) eigenvector of the population PCA
matrix. This occurs due to a crossover between the eigenvalue due to the signal
and the largest eigenvalue due to noise, whose eigenvector points in a random
direction.
","[{""version"":""v1"",""created"":""Wed, 21 Jan 2009 12:05:10 GMT""}]","2009-01-22"
"0901.3246","Hanna D\""oring","Hanna D\""oring and Peter Eichelsbacher","Moderate deviations in random graphs and Bernoulli random matrices","23 pages","Electronic Journal of Probability, Vol. 14, 2009, Paper no. 92,
  2636-2656",,,"math.PR","http://arxiv.org/licenses/nonexclusive-distrib/1.0/","  We prove a moderate deviation principle for subgraph count statistics of
Erdos-Renyi random graphs. This is equivalent in showing a moderate deviation
principle for the trace of a power of a Bernoulli random matrix. It is done via
an estimation of the log-Laplace transform and the Gaertner-Ellis theorem. We
obtain upper bounds on the upper tail probabilities of the number of
occurrences of small subgraphs. The method of proof is used to show
supplemental moderate deviation principles for a class of symmetric statistics,
including non-degenerate U-statistics with independent or Markovian entries.
","[{""version"":""v1"",""created"":""Wed, 21 Jan 2009 12:07:42 GMT""}]","2010-03-31"
"0901.3247","Alireza Akbari","Alireza Akbari, Peter Thalmeier, and Peter Fulde","Theory of Spin Exciton in the Kondo Semiconductor $Yb B_{12}$","5 pages, 4 figures, To be published in Physical Review Letters","Phys. Rev. Lett. 102, 106402 (2009).","10.1103/PhysRevLett.102.106402",,"cond-mat.str-el","http://arxiv.org/licenses/nonexclusive-distrib/1.0/","  The Kondo semiconductor $Yb B_{12}$ exhibits a spin and charge gap of
approximately 15 meV. Close to the gap energy narrow dispersive collective
excitations were identified by previous inelastic neutron scattering
experiments. We present a theoretical analysis of these excitations. Starting
from a periodic Anderson model for crystalline electric field (CEF) split 4f
states we derive the hybridized quasiparticle bands in slave boson mean-field
approximation and calculate the momentum dependent dynamical susceptibility in
random phase approximation (RPA). We show that a small difference in the
hybridization of the two CEF (quasi-) quartets leads to the appearance of two
dispersive spin resonance excitations at the continuum threshold. Their
intensity is largest at the antiferromagnetic (AF) zone boundary point and they
have an upward dispersion which merges with the continuum less than halfway
into the Brillouin zone. Our theoretical analysis explains the most salient
features of previously unexplained experiments on the magnetic excitations of
$Yb B_{12}$.
","[{""version"":""v1"",""created"":""Wed, 21 Jan 2009 12:08:09 GMT""}]","2009-03-10"
"0901.3248","Surajit Sen","Surajit Sen, Mihir Ranjan Nath, Tushar Kanti Dey and Gautam
  Gangopadhyay","Bloch space structure of cascade, lambda and vee type of three-level
  systems and qutrit wave function","14 pages, 2 Figures, Some changes",,,,"quant-ph","http://arxiv.org/licenses/nonexclusive-distrib/1.0/","  The cascade, lambda and vee type of three-level systems are shown to be
described by three different Hamiltonians in the SU(3) basis. We investigate
the Bloch space structure of each configuration by solving the corresponding
Bloch equation and show that at resonance, the seven-dimensional Bloch sphere
${\mathcal S}^7$ is broken into two distinct subspaces ${\mathcal
S}^2{\times}{\mathcal S}^4$ due to the existence of a pair of quadratic
constants. We also give a possible representation of the qutrit wave function
and discuss its equivalence with the three-level system.
","[{""version"":""v1"",""created"":""Wed, 21 Jan 2009 12:09:56 GMT""},{""version"":""v2"",""created"":""Sat, 2 May 2009 10:20:06 GMT""},{""version"":""v3"",""created"":""Thu, 28 Jan 2010 09:10:25 GMT""}]","2010-01-28"
"0901.3249","Elton S. Smith","Elton S. Smith","The 12 GeV JLab Upgrade Project","6 pages, 8 figures, submitted to proceedings for PANIC08","Nucl.Phys.A827:599c-604c,2009","10.1016/j.nuclphysa.2009.05.132","JLAB-PHY-09-938","nucl-ex","http://arxiv.org/licenses/nonexclusive-distrib/1.0/","  The upgrade of the CEBAF Accelerator at Jefferson Lab to 12 GeV will deliver
high luminosity and high quality beams, which will open unique opportunities
for studies of the quark and gluon structure of hadrons in the valence region.
Such physics will be made accessible by substantial additions to the
experimental equipment in combination with the increased energy reach of the
upgraded machine. The emphasis of the talk will be on the program in a new
experimental Hall D designed to search for gluonic excitations.
","[{""version"":""v1"",""created"":""Wed, 21 Jan 2009 12:11:00 GMT""}]","2010-02-25"
"0901.3250","Johannes Courtial","Alasdair C. Hamilton and Johannes Courtial","Generalized refraction using lenslet arrays","12 pages, 8 figures",,"10.1088/1464-4258/11/6/065502",,"physics.optics","http://arxiv.org/licenses/nonexclusive-distrib/1.0/","  We have recently started to investigate 2D arrays of confocal lens pairs.
Miniaturization of the lens pairs can make the array behave ray-optically like
a homogeneous medium. Here we generalize the geometry of the lens pairs. These
generalisations include a sideways shift of the lens centres and a change in
the orientation of both lenses in each pair. We investigate the basic ray
optics of the resulting arrays, and illustrate these with movies rendered using
ray-tracing software. We suggest that confocal lenslet arrays could be used to
realize ray-optically some recent metamaterials concepts such as the
coordinate-transform design paradigm.
","[{""version"":""v1"",""created"":""Wed, 21 Jan 2009 12:15:21 GMT""}]","2009-11-13"
"0901.3251","Luce Prignano","Luce Prignano (Dipartimento di Fisica, Universit\`a di Roma ""La
  Sapienza"", Roma, Italy), Maurizio Serva (Dipartimento di Matematica,
  Universit\`a dell'Aquila, L'Aquila, Italy)","Genealogical trees from genetic distances","20 pages, 5 eps figures, added figure and changed content of sez.5",,"10.1140/epjb/e2009-00176-5",,"q-bio.PE cond-mat.stat-mech","http://arxiv.org/licenses/nonexclusive-distrib/1.0/","  In a population with haploid reproduction any individual has a single parent
in the previous generation. If all genealogical distances among pairs of
individuals (generations from the closest common ancestor) are known it is
possible to exactly reconstruct their genealogical tree. Unfortunately, in most
cases, genealogical distances are unknown and only genetic distances are
available. The genetic distance between two individuals is measurable from
differences in mtDNA (mitochondrial DNA) in the case of humans or other complex
organisms while an analogous distance can be also given for languages where it
is measured from lexical differences. Assuming a constant rate of mutation,
these genetic distances are random and proportional only on average to
genealogical ones. The reconstruction of the genealogical tree from the
available genetic distances is forceful imprecise. In this paper we try to
quantify the error one may commit in the reconstruction of the tree for
different degrees of randomness. The errors may concern both topology of the
tree (the branching hierarchy) and, in case of correct topology, the
proportions of the tree (length of various branches).
","[{""version"":""v1"",""created"":""Wed, 21 Jan 2009 15:41:25 GMT""},{""version"":""v2"",""created"":""Wed, 11 Feb 2009 10:22:33 GMT""}]","2015-05-13"
"0901.3252","Mohammad Reza Setare","M. R. Setare","Holographic modified gravity","10 pages, no gigure","Int.J.Mod.Phys.D17:2219-2228,2008","10.1142/S0218271808013819",,"hep-th","http://arxiv.org/licenses/nonexclusive-distrib/1.0/","  In this paper we study cosmological application of holographic dark energy
density in the modified gravity framework. We employ the holographic model of
dark energy to obtain the equation of state for the holographic energy density
in spatially flat universe. Our calculation show, taking
$\Omega_{\Lambda}=0.73$ for the present time, it is possible to have $w_{\rm
\Lambda}$ crossing -1. This implies that one can generate phantom-like equation
of state from a holographic dark energy model in flat universe in the modified
gravity cosmology framework. Also we develop a reconstruction scheme for the
modified gravity with $f(R)$ action.
","[{""version"":""v1"",""created"":""Wed, 21 Jan 2009 12:22:48 GMT""}]","2010-11-11"
"0901.3253","Changliang Ren","Mingjun Shi, Changliang Ren, Jiangfeng Du","Non-homogeneous Bell-type Inequalities for Two- and Three-qubit States",,,,,"quant-ph","http://arxiv.org/licenses/nonexclusive-distrib/1.0/","  A systematic approach is presented to construct non-homogeneous two- and
three-qubit Bell-type inequalities. When projector-like terms are subtracted
from homogeneous two-qubit CHSH polynomial, non-homogeneous inequalities are
attained and the maximal quantum mechanical violation asymptotically equals a
constant with the subtracted terms becoming sufficiently large. In the case of
three-qubit system, it is found that most significant three-qubit inequalities
presented in literature can be recovered in our framework. We aslo discuss the
behavior of such inequalities in the loophole-free Bell test and obtain
corresponding thresholds of detection efficiency.
","[{""version"":""v1"",""created"":""Wed, 21 Jan 2009 12:18:11 GMT""}]","2009-01-22"
"0901.3254","Raghunath Sahoo","Raghunath Sahoo, Tapan K. Nayak, Jan-e Alam, Sonia Kabana, Basanta K.
  Nandi and D P Mahapatra","The QCD Equation of State with Thermal Properties of $\phi$ mesons","7 pages, 7 figures, Presented in SQM08. To appear in Journal of
  Physics G: Nucl. and Part. Phys","J.Phys.G36:064071,2009","10.1088/0954-3899/36/6/064071",,"nucl-ex hep-ph nucl-th","http://arxiv.org/licenses/nonexclusive-distrib/1.0/","  In this work a first attempt is made to extract the Equation of State (EoS)
using experimental results of the $\phi$ meson produced in nuclear collisions
at AGS, SPS and RHIC energies. The data are confronted to simple thermodynamic
expectations and lattice results. The experimental data indicate a first order
phase transition, with a mixed phase stretching energy density between $\sim$ 1
and 3.2 GeV/$fm^3$.
","[{""version"":""v1"",""created"":""Wed, 21 Jan 2009 12:37:09 GMT""}]","2010-01-15"
"0901.3255","Zaza Osmanov","Nino Chkheidze","On the emission polarization of RX J1856.5-3754","4 pages, 2 figures",,"10.1051/0004-6361/200911648",,"astro-ph.SR","http://arxiv.org/licenses/nonexclusive-distrib/1.0/","  The polarization properties of RX J1856.5-3754 are investigated, based on the
plasma emission model presented in previous works. It is shown that if the
emission of this source is generated by the synchrotron mechanism, the X-ray
and the optical emission are linearly polarized and the corresponding degrees
of linear polarization are calculated. The measurement of the polarization
patterns of this source appears to be most reliable way, to make clear its real
emission nature.
","[{""version"":""v1"",""created"":""Wed, 21 Jan 2009 12:38:26 GMT""}]","2015-05-13"
"0901.3256","Hyung Mok Lee","Hyung Mok Lee, Seong Jin Kim, Myungshin Im, Hideo Matsuhara, Shinki
  Oyabu, Takehiko Wada, Takao Nakagawa, Jongwan Ko, Hyun Jin Shim, Myung Gyoon
  Lee, Narae Hwang, Toshinobu Takagi, Chris Pearson","North Ecliptic Pole Wide Field Survey of AKARI: Survey Strategy and Data
  Characteristics","18 pages, 11 figures, to appear in PASJ, Vol. 61, No. 2. April 25,
  2009 issue",,"10.1093/pasj/61.2.375",,"astro-ph.GA astro-ph.CO","http://arxiv.org/licenses/nonexclusive-distrib/1.0/","  We present the survey strategy and the data characteristics of the North
Ecliptic Pole (NEP) Wide Survey of AKARI. The survey was carried out for about
one year starting from May 2006 with 9 passbands from 2.5 to 24 micron and the
areal coverage of about 5.8 sq. degrees centered on NEP. The survey depth
reaches to 21.8 AB magnitude near infrared (NIR) bands, and ~ 18.6 AB
maggnitude at the mid infrared (MIR) bands such as 15 and 18 micron. The total
number of sources detected in this survey is about 104,000, with more sources
in NIR than in the MIR. We have cross matched infrared sources with optically
identified sources in CFHT imaging survey which covered about 2 sq. degrees
within NEP-Wide survey region in order to characterize the nature of infrared
sources. The majority of the mid infrared sources at 15 and 18 micron band are
found to be star forming disk galaxies, with smaller fraction of early type
galaxies and AGNs. We found that a large fraction (60~80 %) of bright sources
in 9 and 11 micron stars while stellar fraction decreases toward fainter
sources. We present the histograms of the sources at mid infrared bands at 9,
11, 15 and 18 micron. The number of sources per magnitude thus varies as m^0.6
for longer wavelength sources while shorter wavelength sources show steeper
variation with m, where m is the AB magnitude.
","[{""version"":""v1"",""created"":""Wed, 21 Jan 2009 13:19:31 GMT""}]","2015-05-13"
"0901.3257","Simon Heimlicher","Simon Heimlicher, Merkouris Karaliopoulos, Hanoch Levy and
  Thrasyvoulos Spyropoulos","On Leveraging Partial Paths in Partially-Connected Networks","Extended version of paper appearing at IEEE INFOCOM 2009, April
  20-25, Rio de Janeiro, Brazil",,"10.1109/INFCOM.2009.5061906","TR-303","cs.NI","http://arxiv.org/licenses/nonexclusive-distrib/1.0/","  Mobile wireless network research focuses on scenarios at the extremes of the
network connectivity continuum where the probability of all nodes being
connected is either close to unity, assuming connected paths between all nodes
(mobile ad hoc networks), or it is close to zero, assuming no multi-hop paths
exist at all (delay-tolerant networks). In this paper, we argue that a sizable
fraction of networks lies between these extremes and is characterized by the
existence of partial paths, i.e. multi-hop path segments that allow forwarding
data closer to the destination even when no end-to-end path is available. A
fundamental issue in such networks is dealing with disruptions of end-to-end
paths. Under a stochastic model, we compare the performance of the established
end-to-end retransmission (ignoring partial paths), against a forwarding
mechanism that leverages partial paths to forward data closer to the
destination even during disruption periods. Perhaps surprisingly, the
alternative mechanism is not necessarily superior. However, under a stochastic
monotonicity condition between current v.s. future path length, which we
demonstrate to hold in typical network models, we manage to prove superiority
of the alternative mechanism in stochastic dominance terms. We believe that
this study could serve as a foundation to design more efficient data transfer
protocols for partially-connected networks, which could potentially help
reducing the gap between applications that can be supported over disconnected
networks and those requiring full connectivity.
","[{""version"":""v1"",""created"":""Wed, 21 Jan 2009 14:47:45 GMT""},{""version"":""v2"",""created"":""Thu, 22 Jan 2009 01:04:26 GMT""}]","2016-11-15"
"0901.3258","Jocelyn Read","Jocelyn S. Read, Charalampos Markakis, Masaru Shibata, Koji Uryu,
  Jolien D. E. Creighton, John L. Friedman","Measuring the neutron star equation of state with gravitational wave
  observations","12 pages, 5 figures, to be submitted to Phys. Rev. D","Phys.Rev.D79:124033,2009","10.1103/PhysRevD.79.124033",,"gr-qc astro-ph.HE","http://arxiv.org/licenses/nonexclusive-distrib/1.0/","  We report the results of a first study that uses numerical simulations to
estimate the accuracy with which one can use gravitational wave observations of
double neutron star inspiral to measure parameters of the neutron-star equation
of state. The simulations use the evolution and initial-data codes of Shibata
and Uryu to compute the last several orbits and the merger of neutron stars,
with matter described by a parametrized equation of state. Previous work
suggested the use of an effective cutoff frequency to place constraints on the
equation of state. We find, however, that greater accuracy is obtained by
measuring departures from the point-particle limit of the gravitational
waveform produced during the late inspiral.
  As the stars approach their final plunge and merger, the gravitational wave
phase accumulates more rapidly for smaller values of the neutron star
compactness (the ratio of the mass of the neutron star to its radius). We
estimate that realistic equations of state will lead to gravitational waveforms
that are distinguishable from point particle inspirals at an effective distance
(the distance to an optimally oriented and located system that would produce an
equivalent waveform amplitude) of 100 Mpc or less. As Lattimer and Prakash
observed, neutron-star radius is closely tied to the pressure at density not
far above nuclear. Our results suggest that broadband gravitational wave
observations at frequencies between 500 and 1000 Hz will constrain this
pressure, and we estimate the accuracy with which it can be measured. Related
first estimates of radius measurability show that the radius can be determined
to an accuracy of ~1 km at 100 Mpc.
","[{""version"":""v1"",""created"":""Wed, 21 Jan 2009 14:56:42 GMT""}]","2010-04-14"
"0901.3259","A. V. Syromyatnikov","A.V. Syromyatnikov","Instability of the collinear phase in two-dimensional ferromagnet in
  strong in-plane magnetic field","12 pages, 5 figures. Variation of k_c lowers the energy further. As a
  result k_c decreases as the field decreases and the value of the lower
  critical field reduces further. To appear in Journal of Physics: Condensed
  Matter","J. Phys.: Condens. Matter 21 (2009) 216009","10.1088/0953-8984/21/21/216009",,"cond-mat.str-el","http://arxiv.org/licenses/nonexclusive-distrib/1.0/","  It is well-known that in thin ferromagnetic film with a net magnetization
perpendicular to the film the collinear arrangement of spins is unstable in an
in-plane field $H$ smaller than its saturation value $H_c$. Existence of a
stripe phase was proposed with elongated domains of alternating direction of
magnetization component perpendicular to the film. We consider in the present
paper the strong-field regime $H<H_c$ and discuss the minimal microscopic model
describing this phenomenon, two-dimensional Heisenberg ferromagnet with strong
easy-axis anisotropy and dipolar forces. The noncollinear (stripe) phase is
discussed using the technique of the Bose-Einstein condensation of magnons.
Some previously unknown results are observed concerning the stripe phase.
Evolution is established of the spin arrangement in the noncollinear phase upon
the field rotation within the plane. We find a rapid decreasing of the period
of the stripe structure as the field decreases. We demonstrate that spins
components perpendicular to the film form a sinusoid in the noncollinear phase
at $H\approx H_c$ that transforms to a step-like profile upon the field
decreasing so that the domain wall density decreases from unity to a value much
smaller than unity. The spin-wave spectrum in the noncollinear phase is
discussed.
","[{""version"":""v1"",""created"":""Wed, 21 Jan 2009 12:45:17 GMT""},{""version"":""v2"",""created"":""Sun, 26 Apr 2009 11:56:04 GMT""}]","2009-05-04"
"0901.3260","Uma Divakaran","Uma Divakaran and Amit Dutta","Reverse quenching in a one-dimensional Kitaev model","10 pages, 8 figures, added references and details of calculations,
  Accepted in Phys. Rev.B","Phys. Rev. B 79, 224408 (2009)","10.1103/PhysRevB.79.224408",,"cond-mat.stat-mech quant-ph","http://arxiv.org/licenses/nonexclusive-distrib/1.0/","  We present an exact result for the non-adiabatic transition probability and
hence the defect density in the final state of a one-dimensional Kitaev model
following a slow quench of the parameter $J_-$, which estimates the anisotropy
between the interactions, as $J_-(t)\sim -|t/\tau|$. Here, time $t$ goes from
$-\infty$ to $+\infty$ and $\tau$ defines the rate of change of the
Hamiltonian. In other words, the spin chain initially prepared in its ground
state is driven by changing $J_-$ linearly in time up to the quantum critical
point, which in the model considered here occurs at at $t=0$, reversed and then
gradually decreased to its initial value at the same rate. We have thoroughly
compared the reverse quenching with its counterpart forward quenching $i.e.,$
$J_-\sim t/\tau$. Our exact calculation shows that the probability of
excitations is zero for the wave vector at which the instantaneous energy gap
is zero at the critical point $J_{-}=0$ as opposed to the maximum value of
unity in the forward quenching. It is also shown that the defect density in the
final state following a reverse quenching, we propose here, is nearly half of
the defects generated in the forward quenching. We argue that the defects
produced when the system reaches the quantum critical point gets redistributed
in the wave vector space at the final time in case of reverse quenching whereas
it keeps on increasing till the final time in the forward quenching. We study
the entropy density and also the time evolution of the diagonal entropy density
in the case of the reverse quenching and compare it with the forward case.
","[{""version"":""v1"",""created"":""Wed, 21 Jan 2009 12:45:17 GMT""},{""version"":""v2"",""created"":""Thu, 27 Aug 2009 13:23:46 GMT""}]","2015-05-13"
"0901.3261","Enrico Valdinoci","Enrico Valdinoci","From the long jump random walk to the fractional Laplacian","Submitted to the Probability Surveys (http://www.i-journals.org/ps/)
  by the Institute of Mathematical Statistics (http://www.imstat.org)",,,"IMS-PS-PS_2009_143","math.PR","http://arxiv.org/licenses/nonexclusive-distrib/1.0/","  This note illustrates how a simple random walk with possibly long jumps is
related to fractional powers of the Laplace operator. The exposition is
elementary and self-contained.
","[{""version"":""v1"",""created"":""Wed, 21 Jan 2009 12:46:38 GMT""}]","2009-01-22"
"0901.3262","Ilja Schmelzer","Ilja Schmelzer","Why the Hamilton operator alone is not enough",,"Found. Phys. 39: 486-498, 2009","10.1007/s10701-009-9299-4",,"quant-ph","http://arxiv.org/licenses/nonexclusive-distrib/1.0/","  In the many worlds community seems to exist a belief that the physics of a
quantum theory is completely defined by it's Hamilton operator given in an
abstract Hilbert space, especially that the position basis may be derived from
it as preferred using decoherence techniques.
  We show, by an explicit example of non-uniqueness, taken from the theory of
the KdV equation, that the Hamilton operator alone is not sufficient to fix the
physics. We need the canonical operators p, q as well. As a consequence, it is
not possible to derive a ""preferred basis"" from the Hamilton operator alone,
without postulating some additional structure like a ""decomposition into
systems"". We argue that this makes such a derivation useless for fundamental
physics.
","[{""version"":""v1"",""created"":""Wed, 21 Jan 2009 12:46:39 GMT""},{""version"":""v2"",""created"":""Thu, 7 May 2009 12:47:28 GMT""}]","2009-05-07"
"0901.3263","Margherita Roggero","Giorgio Ferrarese and Margherita Roggero","Homogeneous varieties for Hilbert schemes","References added and corrected typos",,,,"math.AC math.AG","http://arxiv.org/licenses/nonexclusive-distrib/1.0/","  The paper concerns the affine varieties that are homogeneous with respect to
a (non-standard) graduation over the group Z^m. Among the other properties it
is shown that every such a variety can be embedded in its Zariski tangent space
at the origin, so that it is smooth if and only if it is isomorphic to an
affine space. The results directly apply to the study of Hilbert schemes of
subvarieties in P^n.
","[{""version"":""v1"",""created"":""Wed, 21 Jan 2009 12:54:35 GMT""},{""version"":""v2"",""created"":""Thu, 9 Jul 2009 08:50:55 GMT""}]","2009-07-09"
