"0901.3337","Christopher Kolda","Brian Dudley and Christopher Kolda","Constraining the Charged Higgs Mass in the MSSM: A Low-Energy Approach","19 pages, 5 figures. High-resolution figures available on request",,,,"hep-ph","http://arxiv.org/licenses/nonexclusive-distrib/1.0/","  We examine the current lower bound on the charged Higgs boson mass in the
Minimal Supersymmetric Standard Model. By applying direct search constraints on
the neutral Higgs bosons and other supersymmetric states, as well as a number
of indirect constraints (b -> s gamma, B_s -> mu mu, B -> tau nu, B -> D tau
nu), we find that it is possible to push the charged Higgs boson mass as low as
140 GeV. We work in a completely low-energy approach with no assumptions about
scalar mass unification, examining two of the most popular limits for neutral
Higgs boson searches: the Max-Mixing and No-Mixing scenarios. While both
scenarios allow light charged Higgs bosons, they do so for completely different
ranges of tan(beta). In either case, one expects light top squarks to accompany
a light charged Higgs.
","[{""version"":""v1"",""created"":""Wed, 21 Jan 2009 19:16:36 GMT""}]","2009-01-22"
"0901.3338","Parveen Kumar","Parveen Kumar, K. Shahi","Ion transport study of mechanically-milled amorphous AgI-Ag2O-V2O5 fast
  ionic conductors","This wosk is presented in ""National Conference on Condensed Matter
  and Materials Physics (CMMP06) on 19-21st January 2006 at The M.S.University
  of Baroda, Vadodara","Indian Journal of Pure & Applied Physics, Vol. 45, January 2007,
  pp. 48-51",,"IPC Code: G01R","cond-mat.mtrl-sci cond-mat.dis-nn","http://arxiv.org/licenses/nonexclusive-distrib/1.0/","  The structural and electrical characterizations of mechanically-milled (MM)
amorphous fast ionic conductors (a-FICs), viz. xAgI (100-x)[0.67 Ag\_2
O-0.33V\_2O\_5] (x = 40, 50, 55 and 70) have been reported. The amorphisation
is restricted only to the compositions which are well within the glass forming
region and all samples are found to be highly agglomerated and X-ray amorphous
in nature. The frequency dependent ac conductivity, \sigma'(\omega), of the
amorphous samples investigated in the frequency range 5Hz -13 MHz and
temperature range 100- 350 K shows a dc conductivity regime at low frequencies
and a dispersive regime at higher frequencies. The spectra can be described by
the Jonscher power law (JPL), \simga'(\omega) = \sigma\_dc +A(T) \omega\_n.
However, the values \sigma\_dc (T) and A(T) both show two distinct Arrhenius
regions and n (< 1) is found to be temperature dependent, i.e., decreasing with
increasing temperature.
","[{""version"":""v1"",""created"":""Wed, 21 Jan 2009 19:18:29 GMT""}]","2009-01-22"
"0901.3339","Sergey Smirnov","Sergey Smirnov","Ruderman-Kittel-Kasuya-Yosida spin density oscillations: impact of the
  finite radius of the exchange interaction","6 pages, 4 figures, early attempts to take into account the finite
  size of the ionic spin distribution in connection with Heusler alloys are now
  metioned","Physical Review B 79, 134403 (2009)","10.1103/PhysRevB.79.134403",,"cond-mat.mes-hall cond-mat.stat-mech","http://arxiv.org/licenses/nonexclusive-distrib/1.0/","  A non-interacting electron gas on a one-dimensional ring is considered at
finite temperatures. The localized spin is embedded at some point on the ring
and it is assumed that the interaction between this spin and the electrons is
the exchange interaction being the basis of the Ruderman-Kittel-Kasuya-Yosida
indirect exchange effect. When the number of electrons is large enough, it
turns out that any small but finite interaction radius value can always produce
an essential change of the spin density oscillations in comparison with the
zero interaction radius traditionally used to model the
Ruderman-Kittel-Kasuya-Yosida effect.
","[{""version"":""v1"",""created"":""Wed, 21 Jan 2009 19:18:51 GMT""},{""version"":""v2"",""created"":""Mon, 6 Apr 2009 15:44:15 GMT""}]","2009-04-06"
"0901.3340","K\'aroly J. B\""or\""oczky","K\'aroly J. B\""or\""oczky","Stability of the Blaschke-Santal\'o and the affine isoperimetric
  inequality",,,,,"math.MG","http://arxiv.org/licenses/nonexclusive-distrib/1.0/","  A stability version of the Blaschke-Santal\'o inequality and the affine
isoperimetric inequality for convex bodies of dimension n>2 is proved. The
first step is the reduction to the case when the convex body is o-symmetric and
has axial rotational symmetry. This step works for related inequalities
compatible with Steiner symmetrization. Secondly, for these convex bodies, a
stability version of the characterization of ellipsoids by the fact that each
hyperplane section is centrally symmetric is established.
","[{""version"":""v1"",""created"":""Wed, 21 Jan 2009 19:40:25 GMT""}]","2009-01-22"
"0901.3341","Chiara Mancini","C. Mancini, I. Matute, A. Cimatti, E. Daddi, M. Dickinson, G.
  Rodighiero, M. Bolzonella, L. Pozzetti","Searching for massive galaxies at z>=3.5 in GOODS-North","Accepted by A&A; 35 pages, 15 figures, references updated",,"10.1051/0004-6361/200810630",,"astro-ph.CO","http://arxiv.org/licenses/nonexclusive-distrib/1.0/","  We constrain the space density and properties of massive galaxy candidates at
redshifts of z>=3.5 in the GOODS-N field. By selecting sources in the
Spitzer+IRAC bands, a highly stellar mass-complete sample is
assembled,including massive galaxies which are very faint in the
optical/near-IR bands that would be missed by samples selected at shorter
wavelengths. The z>=3.5 sample was selected down to 23 mag at 4.5 micron using
photometric redshifts that have been obtained by fitting the galaxies SEDs at
optical, near-IR and IRAC bands. We also require that the brightest band in
which candidates are detected is the IRAC 8 micron band in order to ensure that
the near-IR 1.6 micron (rest-frame) peak is falling in or beyond this band. We
found 53 z>=3.5 candidates, with masses in the range of M~10^10-10^11M_sun. At
least ~81% of these galaxies are missed by traditional Lyman Break selection
methods based on UV light. Spitzer+MIPS emission is detected for 60% of the
sample of z>=3.5 galaxy candidates. Although in some cases this might suggest a
residual contamination from lower redshift star-forming galaxies or AGN, 37% of
these objects are also detected in the sub-mm/mm bands in recent SCUBA,AzTEC
and MAMBO surveys, and have properties fully consistent with vigorous starburst
galaxies at z>=3.5. The comoving number density of galaxies with stellar masses
>= 5x10^10M_sun(a reasonable stellar mass completeness limit for our sample) is
2.6x10^-5Mpc^-3 (using the volume within 3.5<z<5), and the corresponding
stellar mass density is ~2.9x10^6M_sunMpc^-3, or~3% of the local density above
the same stellar mass limit.For the sub-sample of MIPS-undetected galaxies,we
find a number density of ~0.97x10^-5Mpc^-3 and a stellar mass density of
~1.15x10^6M_sun Mpc^-3.[abridged]
","[{""version"":""v1"",""created"":""Wed, 21 Jan 2009 19:41:13 GMT""},{""version"":""v2"",""created"":""Tue, 3 Feb 2009 18:57:59 GMT""}]","2015-05-13"
"0901.3342","Jonathan Irwin","Jonathan Irwin, Jerome Bouvier","The rotational evolution of low-mass stars","10 pages, 6 figures, 1 table. To appear in the Proceedings of the
  258th IAU Symposium: ""The Ages of Stars"", October 2008, Baltimore, MD, USA",,"10.1017/S1743921309032025",,"astro-ph.SR","http://arxiv.org/licenses/nonexclusive-distrib/1.0/","  We summarise recent progress in the understanding of the rotational evolution
of low-mass stars (here defined as solar mass down to the hydrogen burning
limit) both in terms of observations and modelling. Wide-field imaging surveys
on moderate-size telescopes can now efficiently derive rotation periods for
hundreds to thousands of open cluster members, providing unprecedented sample
sizes which are ripe for exploration. We summarise the available measurements,
and provide simple phenomenological and model-based interpretations of the
presently-available data, while highlighting regions of parameter space where
more observations are required, particularly at the lowest masses and ages >~
500 Myr.
","[{""version"":""v1"",""created"":""Wed, 21 Jan 2009 19:48:30 GMT""}]","2018-04-04"
"0901.3343","K\'aroly J. B\""or\""oczky","K\'aroly J. B\""or\""oczky and Rolf Schneider","The mean width of circumscribed random polytopes",,,,,"math.MG math.PR","http://arxiv.org/licenses/nonexclusive-distrib/1.0/","  For a given convex body K in $R^d$, a random polytope $K^{(n)}$ is defined
(essentially) as the intersection of $n$ independent closed halfspaces
containing $K$ and having an isotropic and (in a specified sense) uniform
distribution. We prove upper and lower bounds, of optimal orders, for the
difference of the mean widths of $K^{(n)}$ and K, as n tends to infinity. For a
simplicial polytope P, a precise asymptotic formula for the difference of the
mean widths of $P^{(n)}$ and P is obtained.
","[{""version"":""v1"",""created"":""Wed, 21 Jan 2009 19:50:43 GMT""}]","2009-01-22"
"0901.3344","Ramin Nowbakht Ghalati","R. N. Ghalati","A Novel Hamiltonian Formulation of First Order Einstein-Hilbert Action:
  Connection with ADM, Diffeomorphism Invariance and Linearized Theory","35 pages",,,"UWO-TH-09/1","gr-qc","http://arxiv.org/licenses/nonexclusive-distrib/1.0/","  A novel Dirac Hamiltonian formulation of the first order Einstein-Hilbert
(EH) action, in which algebraic constraints are not solved to eliminate fields
from the action at the Lagrangian level, has been shown to lead to an action
and a constraint structure apparently distinct from the ADM action and the ADM
constraint structure in that secondary first class constraints as well as
tertiary first class constraints arise with an unusual Poisson Bracket (PB)
algebra [24]. By canonical transformations of the fundamental fields we show
how from the tertiary constraints one may derive the Hamiltonian and momentum
constraints. Special attention is paid to the Hamiltonian formulation of the
first order EH action in terms of the variables h, h^i and q^{ij} employed in
[19,20]. It is shown that the variables h and h^i are left undetermined in the
formalism. This fact is used for a proper gauge fixation of the secondary
constraints and reduction to the Faddeev action [19,20]. Considering
invariances of the total action, the generator of the gauge transformations of
the EH Lagrangian action is derived. Using this generator, the explicit form of
the gauge invariance of the field h is obtained, by which the relation between
the gauge functions and the descriptors of the diffeomorphism invariance is
determined in order for the gauge transformations to correspond to
diffeomorphism invariance. By linearizing the novel Hamiltonian formulation of
[24], the Hamiltonian formulation of the first order action for the free spin
two field [4,24] is derived.
","[{""version"":""v1"",""created"":""Wed, 21 Jan 2009 20:09:34 GMT""},{""version"":""v2"",""created"":""Tue, 7 Apr 2009 02:19:19 GMT""}]","2009-04-07"
"0901.3345","Juha Javanainen","Uttam Shrestha, Juha Javanainen, and Janne Ruostekoski","Quantum dynamics of instability-induced pulsations of a Bose-Einstein
  condensate in an optical lattice",,"Phys. Rev. A 79 (2009) 043617","10.1103/PhysRevA.79.043617",,"cond-mat.other quant-ph","http://arxiv.org/licenses/nonexclusive-distrib/1.0/","  We study the dynamics of a Bose-Einstein condensate in a one-dimensional
optical lattice in the limit of weak atom-atom interactions, including an
approximate model for quantum fluctuations. A pulsating dynamical instability
in which atoms periodically collect together and subsequently disperse back
into the initial homogeneous state may occur in the time evolution. We take
into account the quantum fluctuations within the truncated Wigner
approximation. We observe that the quasiperiodic behavior still persists for a
single realization that represents a typical experimental outcome, but ensemble
averages show various manifestations of quantum fluctuations. Quantum effects
become more prominent when the effective interaction strength is increased.
","[{""version"":""v1"",""created"":""Wed, 21 Jan 2009 20:50:35 GMT""}]","2009-04-17"
"0901.3346","Dan Yasaki","Dan Yasaki","Binary Hermitian forms over a cyclotomic field","11 pages, 1 table",,,,"math.NT","http://arxiv.org/licenses/nonexclusive-distrib/1.0/","  Let z be a primitive fifth root of unity and let F be the cyclotomic field
F=Q(z). Let O be the ring of integers. We compute the Voronoi polyhedron of
binary Hermitian forms over F and classify GL_2(O)-conjugacy classes of perfect
forms. The combinatorial data of this polyhedron can be used to compute the
cohomology of the arithmetic group GL_2(O) and Hecke eigen forms.
","[{""version"":""v1"",""created"":""Wed, 21 Jan 2009 20:03:41 GMT""}]","2009-01-22"
"0901.3347","Gerd Bergmann","Gerd Bergmann","Oscillations of the magnetic polarization in a Kondo impurity at finite
  magnetic fields",,,"10.1140/epjb/e2009-00405-y",,"cond-mat.mes-hall cond-mat.str-el","http://arxiv.org/licenses/nonexclusive-distrib/1.0/","  The electronic properties of a Kondo impurity are investigated in a magnetic
field using linear response theory. The distribution of electrical charge and
magnetic polarization are calculated in real space. The (small) magnetic field
does not change the charge distribution. However, it unmasks the Kondo cloud.
The (equal) weight of the d-electron components with their magnetic moment up
and down is shifted and the compensating s-electron clouds don't cancel any
longer (a requirement for an experimental detection of the Kondo cloud). In
addition to the net magnetic polarization of the conduction electrons an
oscillating magnetic polarization with a period of half the Fermi wave length
is observed. However, this oscillating magnetic polarization does not show the
long range behavior of Rudermann-Kittel-Kasuya-Yosida oscillations because the
oscillations don't extend beyond the Kondo radius. They represent an internal
electronic structure of the Kondo impurity in a magnetic field. PACS: 75.20.Hr,
71.23.An, 71.27.+a
","[{""version"":""v1"",""created"":""Wed, 21 Jan 2009 20:07:01 GMT""}]","2015-05-13"
"0901.3348","Stephen Vavasis","Brendan Ames, Stephen Vavasis","Nuclear norm minimization for the planted clique and biclique problems",,,,,"cs.DS cs.NA","http://arxiv.org/licenses/nonexclusive-distrib/1.0/","  We consider the problems of finding a maximum clique in a graph and finding a
maximum-edge biclique in a bipartite graph. Both problems are NP-hard. We write
both problems as matrix-rank minimization and then relax them using the nuclear
norm. This technique, which may be regarded as a generalization of compressive
sensing, has recently been shown to be an effective way to solve rank
optimization problems. In the special cases that the input graph has a planted
clique or biclique (i.e., a single large clique or biclique plus diversionary
edges), our algorithm successfully provides an exact solution to the original
instance. For each problem, we provide two analyses of when our algorithm
succeeds. In the first analysis, the diversionary edges are placed by an
adversary. In the second, they are placed at random. In the case of random
edges for the planted clique problem, we obtain the same bound as Alon,
Krivelevich and Sudakov as well as Feige and Krauthgamer, but we use different
techniques.
","[{""version"":""v1"",""created"":""Wed, 21 Jan 2009 20:08:21 GMT""}]","2009-01-22"
"0901.3349","Hector Hernandez-Coronado","C. Chryssomalakos, H. Hernandez-Coronado and E. Okon","Center of mass in special and general relativity and its role in an
  effective description of spacetime","Prepared for the procceding of the conference DICE 2008","J.Phys.Conf.Ser.174:012026,2009","10.1088/1742-6596/174/1/012026",,"gr-qc","http://arxiv.org/licenses/nonexclusive-distrib/1.0/","  In this contribution, we suggest the approach that geometric concepts ought
to be defined in terms of physical operations involving quantum matter. In this
way it is expected that some (presumably nocive) idealizations lying deep
within the roots of the notion of spacetime might be excluded. In particular,
we consider that spacetime can be probed only with physical (and therefore
extended) particles, which can be effectively described by coordinates that
fail to commute by a term proportional to the spin of the particles.
","[{""version"":""v1"",""created"":""Wed, 21 Jan 2009 20:21:36 GMT""}]","2009-07-24"
"0901.3350","Martin Laming","J. Martin Laming","Non-WKB Models of the FIP Effect: Implications for Solar Coronal Heating
  and the Coronal Helium and Neon Abundances","37 pages, 15 figures, accepted by ApJ","Astrophys.J.695:954-969,2009","10.1088/0004-637X/695/2/954",,"astro-ph.SR","http://creativecommons.org/licenses/publicdomain/","  We revisit in more detail a model for element abundance fractionation in the
solar chromosphere, that gives rise to the ""FIP Effect"" in the solar corona and
wind. Elements with first ionization potential below about 10 eV, i.e. those
that are predominantly ionized in the chromosphere, are enriched in the corona
by a factor 3-4. We model the propagation of Alfven waves through the
chromosphere using a non-WKB treatment, and evaluate the ponderomotive force
associated with these waves. Under solar conditions, this is generally pointed
upwards in the chromosphere, and enhances the abundance of chromospheric ions
in the corona. Our new approach captures the essentials of the solar coronal
abundance anomalies, including the depletion of He relative to H, and also the
putative depletion of Ne, recently discussed in the literature. We also argue
that the FIP effect provides the strongest evidence to date for energy fluxes
of Alfven waves sufficient to heat the corona. However it appears that these
waves must also be generated in the corona, in order to preserve the rather
regular fractionation pattern without strong variations from loop to loop
observed in the solar corona and slow speed solar wind.
","[{""version"":""v1"",""created"":""Wed, 21 Jan 2009 20:46:26 GMT""}]","2014-11-18"
"0901.3351","Eleonora Torresi","E. Torresi (1,2), P. Grandi (1), M. Guainazzi (3), G.G.C. Palumbo (2),
  G. Ponti (4), S. Bianchi (5) ((1) INAF-IASF Bologna, (2) Univ. Bologna, (3)
  ESA Madrid, (4) APC Paris, (5) Univ. Roma3)","3C 33: another case of photoionized soft X-ray emission in radio
  galaxies","7 pages, 5 figures, accepted for publication in A&A",,"10.1051/0004-6361/200810944",,"astro-ph.HE","http://arxiv.org/licenses/nonexclusive-distrib/1.0/","  All the observations available in the Chandra and XMM-Newton archives have
been used to investigate the X-ray spectral properties of 3C 33. In this paper
is presented a complete X-ray analysis of the nuclear emission of this narrow
line radio galaxy. The broad band spectrum of 3C 33 is complex. The hard part
resembles that of Seyfert 2 galaxies, with a heavily obscured nuclear continuum
(N_H~10^23 cm^-2) and a prominent Fe Kalpha line. This represents the nuclear
radiation directly observed in transmission through a cold circumnuclear gas.
On the other hand an unabsorbed continuum plus emission lines seem to fit well
the soft part of the spectrum (0.5-2 keV) suggesting that the jet does not
significantly contribute to the X-ray emission. We discuss the possible
collisional or photoionized origin of the gas that emits the soft X-ray lines.
Our results, strengthened by optical spectroscopy favor the photoionization
scenario.
","[{""version"":""v1"",""created"":""Wed, 21 Jan 2009 21:13:29 GMT""}]","2009-11-13"
"0901.3352","Sergey Pankratov","S.S. Pankratov, E.E. Saperstein, M.V. Zverev, M. Baldo, U. Lombardo","Spatial correlation properties of the anomalous density matrix in a slab
  of nuclear matter with realistic NN-forces","19 pages, 13 figures","Phys.Rev.C79:024309,2009","10.1103/PhysRevC.79.024309",,"nucl-th","http://arxiv.org/licenses/nonexclusive-distrib/1.0/","  Spatial correlation characteristics of the anomalous density matrix $\kappa$
in a slab of nuclear matter with the Paris and Argonne v18 forces are
calculated. A detailed comparison with predictions of the effective Gogny force
is made. It is found that the two realistic forces lead to very close results
which are qualitatively similar to those for the Gogny force. At the same time,
the magnitude of $\kappa$ for realistic forces is essentially smaller than the
one for the Gogny force. The correlation characteristics are practically
independent of the magnitude of $\kappa$ and turn out to be quite close for the
three kinds of the force. In particular, all of them predict a small value of
the local correlation length at the surface of the slab and a big one, inside.
These results are in agreement with those obtained recently by Pillet at al.
for finite nuclei with the Gogny force.
","[{""version"":""v1"",""created"":""Wed, 21 Jan 2009 21:04:17 GMT""}]","2009-04-28"
"0901.3354","Roberto Trotta","Mihran Vardanyan (Oxford), Roberto Trotta (Imperial College London)
  and Joe Silk (Oxford)","How flat can you get? A model comparison perspective on the curvature of
  the Universe","Added discussion on the impact of adopting (wa, w0) dark energy
  model, main conclusions unchanged. Version accepted by MNRAS","Mon.Not.Roy.Astron.Soc.397:431-444,2009","10.1111/j.1365-2966.2009.14938.x",,"astro-ph.CO","http://arxiv.org/licenses/nonexclusive-distrib/1.0/","  The question of determining the spatial geometry of the Universe is of
greater relevance than ever, as precision cosmology promises to verify
inflationary predictions about the curvature of the Universe. We revisit the
question of what can be learnt about the spatial geometry of the Universe from
the perspective of a three-way Bayesian model comparison. We show that, given
current data, the probability that the Universe is spatially infinite lies
between 67% and 98%, depending on the choice of priors. For the strongest prior
choice, we find odds of order 50:1 (200:1) in favour of a flat Universe when
compared with a closed (open) model. We also report a robust, prior-independent
lower limit to the number of Hubble spheres in the Universe, N_U > 5 (at 99%
confidence). We forecast the accuracy with which future CMB and BAO
observations will be able to constrain curvature, finding that a cosmic
variance limited CMB experiment together with an SKA-like BAO observation will
constrain curvature with a precision of about sigma ~ 4.5x10^{-4}. We
demonstrate that the risk of 'model confusion' (i.e., wrongly favouring a flat
Universe in the presence of curvature) is much larger than might be assumed
from parameter errors forecasts for future probes. We argue that a 5-sigma
detection threshold guarantees a confusion- and ambiguity-free model selection.
Together with inflationary arguments, this implies that the geometry of the
Universe is not knowable if the value of the curvature parameter is below
|Omega_curvature| ~ 10^{-4}, a bound one order of magnitude larger than the
size of curvature perturbations, ~ 10^{-5}. [abridged]
","[{""version"":""v1"",""created"":""Wed, 21 Jan 2009 21:50:29 GMT""},{""version"":""v2"",""created"":""Mon, 20 Apr 2009 17:21:54 GMT""}]","2010-05-11"
"0901.3356","Taras Banakh","T.Banakh, I.V.Protasov","Symmetry and colorings: Some results and open problems","Some references are updated","Izv. Gomel Univ. Voprosy Algebry. 2001. Issue 4(17). P.5--16",,,"math.CO math.GR","http://arxiv.org/licenses/nonexclusive-distrib/1.0/","  We survey some principal results and open problems related to colorings of
algebraic and geometric objects endowed with symmetries.
","[{""version"":""v1"",""created"":""Wed, 21 Jan 2009 21:02:24 GMT""},{""version"":""v2"",""created"":""Mon, 23 Feb 2009 22:40:47 GMT""}]","2009-02-24"
"0901.3357","Nico Cappelluti","N. Cappelluti, M. Ajello, P. Rebusco, S. Komossa, A. Bongiorno, C.
  Clemens, M. Salvato, P. Esquej, T. Aldcroft, J. Greiner, H. Quintana","A candidate tidal disruption event in the Galaxy cluster Abell 3571","A&A letter,Accepted 4 pages, 4 figures, language edited",,"10.1051/0004-6361/200811479",,"astro-ph.CO astro-ph.HE","http://arxiv.org/licenses/nonexclusive-distrib/1.0/","  Tidal disruption events are possible sources of temporary nuclear activity in
galactic nuclei and can be considered as good indicators of the existence of
super massive black holes in the centers of galaxies. A new X-ray source has
been serendipitously detected with ROSAT in a PSPC pointed observation of the
galaxy cluster A3571. Given the strong flux decay of the object in subsequent
detections, the tidal disruption scenario is investigated as possible
explanationof the event. We followed up the evolution of the X-ray transient
with ROSAT, XMM-Newton and Chandra for a total period of ~13 years. We also
obtained 7-band optical/NIR photometry with GROND at the ESO/MPI 2.2m
telescope. We report a very large decay of the X-ray flux of ROSAT source
identified with the galaxy LEDA 095953 a member of the cluster Abell 3571. We
measured a maximum 0.3-2.4 keV luminosity Log(L_X)=42.8 erg s^-1. The high
state of the source lasted at least 150 ks, afterwards L_X declined as ~t^-2.
The spectrum of the brightest epoch is consistent with a black body with
temperature kT ~0.12 keV. The total energy released by this event in 10 yr was
estimated to be Delta_E>2x10^50 erg. We interpret this event as a tidal
disruption of a solar type star by the central supermassive black hole (i.e.
~10^7 M_sun) of the galaxy.
","[{""version"":""v1"",""created"":""Wed, 21 Jan 2009 21:06:31 GMT""},{""version"":""v2"",""created"":""Mon, 26 Jan 2009 22:08:24 GMT""}]","2009-11-13"
