"0901.3145","Matthias Vojta","Matthias Vojta","Lattice symmetry breaking in cuprate superconductors: Stripes, nematics,
  and superconductivity","Review article prepared for Adv. Phys., 66 pg, 22 figs. Comments
  welcome, (v2) extensions and clarifications, added references, final version
  to be published","Adv. Phys. 58, 699 (2009)","10.1080/00018730903122242",,"cond-mat.supr-con cond-mat.str-el","http://arxiv.org/licenses/nonexclusive-distrib/1.0/","  This article will give an overview on both theoretical and experimental
developments concerning states with lattice symmetry breaking in the cuprate
high-temperature superconductors. Recent experiments have provided evidence for
states with broken rotation as well as translation symmetry, and will be
discussed in terms of nematic and stripe physics. Of particular importance here
are results obtained using the techniques of neutron and x-ray scattering and
scanning tunneling spectroscopy. Ideas on the origin of lattice-symmetry-broken
states will be reviewed, and effective models accounting for various
experimentally observed phenomena will be summarized. These include both
weak-coupling and strong-coupling approaches, with a discussion on their
distinctions and connections. The collected experimental data indicate that the
tendency toward uni-directional stripe-like ordering is common to underdoped
cuprates, but becomes weaker with increasing number of adjacent CuO_2 layers.
","[{""version"":""v1"",""created"":""Wed, 21 Jan 2009 16:11:34 GMT""},{""version"":""v2"",""created"":""Fri, 19 Jun 2009 09:08:38 GMT""}]","2009-11-11"
"0901.3161","Davide Fioravanti","Davide Fioravanti, Paolo Grinza and Marco Rossi","Beyond cusp anomalous dimension from integrability","Latex version","Phys.Lett.B675:137-144,2009","10.1016/j.physletb.2009.03.053",,"hep-th","http://arxiv.org/licenses/nonexclusive-distrib/1.0/","  We study the first sub-leading correction $O((\ln s)^0)$ to the cusp
anomalous dimension in the high spin expansion of finite twist operators in
${\cal N}=4$ SYM theory. Since this approximation is still governed by a linear
integral equation (derived already from the Bethe Ansatz equations in a
previous paper), we finalise it better in order to study the weak and strong
coupling regimes. In fact, we emphasise how easily the weak coupling expansion
can be obtained, confirms the known four loop result and predicts the higher
orders. Eventually, we pay particular attention to the strong coupling regime
showing agreement and predictions in comparison with string expansion;
speculations on the 'universal' part (upon subtracting the collinear anomalous
dimension) are brought forward.
","[{""version"":""v1"",""created"":""Wed, 21 Jan 2009 20:42:09 GMT""},{""version"":""v2"",""created"":""Tue, 27 Jan 2009 20:51:58 GMT""}]","2010-10-27"
"0901.3164","Matthew Sexton","Matthew G. Sexton (Minnesota U.)","The evolution and decay of supersymmetric flat directions in the early
  universe and their role in thermalizing the universe","193 Pages, Ph. D. Thesis",,,,"hep-ph","http://arxiv.org/licenses/nonexclusive-distrib/1.0/","  I study the post-inflation oscillation and decay of light coherent scalar
field condensates that may develop during an inflationary phase of the
universe. In particular, the light scalars studied are a composition of the
scalar particles of a supersymmetric theory which correspond to the flat
directions of the theory's scalar potential. Some toy models that possess
supersymmetric flat directions are presented and numerical solutions for the
evolution of the scalar fields are obtained. Both analytic and numeric results
suggest that such condensates, if they existed in the early universe, can decay
through a rapid and nonperturbative process long before these condensates could
significantly affect the thermalization of the universe.
","[{""version"":""v1"",""created"":""Wed, 21 Jan 2009 16:49:32 GMT""}]","2009-01-22"
"0901.3188","Narad Rampersad","James Currie and Narad Rampersad","Dejean's conjecture holds for n>=27","minor revisions",,,,"math.CO cs.FL","http://arxiv.org/licenses/nonexclusive-distrib/1.0/","  We show that Dejean's conjecture holds for n>=27. This brings the final
resolution of the conjecture by the approach of Moulin Ollagnier within range
of the computationally feasible.
","[{""version"":""v1"",""created"":""Wed, 21 Jan 2009 20:52:16 GMT""},{""version"":""v2"",""created"":""Thu, 9 Jul 2009 13:43:39 GMT""}]","2009-07-09"
"0901.3205","David Hernandez","Nicolas Guay, David Hernandez, Sergey Loktev","Double affine Lie algebras and finite groups","31 pages","Pacific Journal of Mathematics 243 (2009), no. 1, 1--41",,,"math.RT math.GR","http://arxiv.org/licenses/nonexclusive-distrib/1.0/","  We introduce and begin to study Lie theoretical analogs of symplectic
reflection algebras for a finite cyclic group, which we call ""cyclic double
affine Lie algebra"". We focus on type A : in the finite (resp. affine, double
affine) case, we prove that these structures are finite (resp. affine,
toroidal) type Lie algebras, but the gradings differ. The case which is
essentially new involves $\mathbb{C}[u,v]$. We describe its universal central
extensions and start the study of its representation theory, in particular of
its highest weight integrable modules and Weyl modules. We also consider the
first Weyl algebra $A_1$ instead of the polynomial ring $\mathbb{C}[u,v]$, and,
more generally, a rank one rational Cherednik algebra. We study quasi-finite
highest weight representations of these Lie algebras.
","[{""version"":""v1"",""created"":""Wed, 21 Jan 2009 17:47:41 GMT""},{""version"":""v2"",""created"":""Fri, 19 Jun 2009 17:46:41 GMT""},{""version"":""v3"",""created"":""Thu, 5 Nov 2009 09:05:50 GMT""}]","2009-11-05"
"0901.3235","Ingrid Carbone","Aljosa Volcic","A generalization of Kakutani's splitting procedure","14 pages, submitted",,,,"math.NT","http://arxiv.org/licenses/nonexclusive-distrib/1.0/","  In this paper we will study uniformly distributed sequences of partitions of
[0,1], a concept which has been introduced by Kakutani in 1976. We will
construct new families of u.d. sequences of partitions and study relations with
the classical concept of uniformly distributed sequences of points.
","[{""version"":""v1"",""created"":""Wed, 21 Jan 2009 20:57:38 GMT""}]","2009-01-22"
"0901.3286","Carlos Mauricio Chaves","C. M. Chaves, A. A. Gomes, A. Troper","On the use of a single site approximation to describe correlation in
  pure metals","2 pages and 2 figures","Physica B, 403, 1459, 2008","10.1016/j.physb.2007.10.310",,"cond-mat.str-el cond-mat.stat-mech","http://arxiv.org/licenses/nonexclusive-distrib/1.0/","  The magnetic properties of pure transition-like metals are discussed within
the single site approximation, to take into account the electron correlation.
The metal is described by two hybridized bands one of which includes the
Coulomb correlation. Our results indicate that ferromagnetism follows from
adequate values of the correlation and hybridization.
","[{""version"":""v1"",""created"":""Wed, 21 Jan 2009 16:06:25 GMT""},{""version"":""v2"",""created"":""Thu, 22 Jan 2009 15:04:07 GMT""}]","2009-11-13"
"0901.3298","Julian Moosmann","Julian Moosmann","Solitonic fermions in the confining phase of SU(2) Yang-Mills theory","Diploma thesis, 60 pages,26 figures",,,,"hep-th","http://arxiv.org/licenses/nonexclusive-distrib/1.0/","  We consider spatial coarse-graining in statistical ensembles of
non-selfintersecting and one-fold selfintersecting center-vortex loops as they
emerge in the confining phase of SU(2) Yang-Mills thermodynamics. This
coarse-graining is due to a noisy environment and described by a curve
shrinking flow of center-vortex loops locally embedded in a two-dimensional
flat plane. The renormalization-group flow of an effective `action', which is
defined in purely geometric terms, is driven by the curve shrinking evolution.
  In the case of non-selfintersecting center-vortex loops, we observe critical
behavior of the effective `action' as soon as the center-vortex loops vanish
from the spectrum of the confining phase due to curve shrinking. This suggest
the existence of an asymptotic mass gap.
  An entirely unexpected behavior in the ensemble of one-fold selfintersecting
center-vortex loops is connected with the spontaneous emergence of order. We
speculate that the physics of planar, one-fold selfintersecting center-vortex
loops to be relevant for two-dimensional systems exhibiting high-temperature
superconductivity.
","[{""version"":""v1"",""created"":""Wed, 21 Jan 2009 16:06:19 GMT""}]","2009-01-22"
"0901.3299","Matthias Mnich","Leo van Iersel, Matthias Mnich","Computing Rooted and Unrooted Maximum Consistent Supertrees","This paper has been withdrawn by the authors due to an error",,,,"cs.DM cs.DS","http://arxiv.org/licenses/nonexclusive-distrib/1.0/","  A chief problem in phylogenetics and database theory is the computation of a
maximum consistent tree from a set of rooted or unrooted trees. A standard
input are triplets, rooted binary trees on three leaves, or quartets, unrooted
binary trees on four leaves. We give exact algorithms constructing rooted and
unrooted maximum consistent supertrees in time O(2^n n^5 m^2 log(m)) for a set
of m triplets (quartets), each one distinctly leaf-labeled by some subset of n
labels. The algorithms extend to weighted triplets (quartets). We further
present fast exact algorithms for constructing rooted and unrooted maximum
consistent trees in polynomial space. Finally, for a set T of m rooted or
unrooted trees with maximum degree D and distinctly leaf-labeled by some subset
of a set L of n labels, we compute, in O(2^{mD} n^m m^5 n^6 log(m)) time, a
tree distinctly leaf-labeled by a maximum-size subset X of L that all trees in
T, when restricted to X, are consistent with.
","[{""version"":""v1"",""created"":""Wed, 21 Jan 2009 16:04:46 GMT""},{""version"":""v2"",""created"":""Fri, 28 May 2010 06:18:27 GMT""}]","2010-05-31"
"0901.3300","Gondran Michel","Michel Gondran","Proca equations derived from first principles","6 pages","Am. J. Phys. 77, 10 (2009)","10.1119/1.3137042",,"quant-ph","http://arxiv.org/licenses/nonexclusive-distrib/1.0/","  Gersten has shown how Maxwell equations can be derived from first principles,
similar to those which have been used to obtain the Dirac relativistic electron
equation. We show how Proca equations can be also deduced from first
principles, similar to those which have been used to find Dirac and Maxwell
equations. Contrary to Maxwell equations, it is necessary to introduce a
potential in order to transform a second order differential equation, as the
Klein-Gordon equation, into a first order differential equation, like Proca
equations.
","[{""version"":""v1"",""created"":""Wed, 21 Jan 2009 16:12:37 GMT""}]","2015-05-13"
"0901.3301","Ahmad Idilbi S","Ahmad idilbi and Chul Kim","Factorization and resummation for color octet production","To appear in the proceedings of PANIC08",,,,"hep-ph","http://arxiv.org/licenses/nonexclusive-distrib/1.0/","  We discuss the production of heavy colored paricles at the Large Hadron
Collider (LHC) through gluon-gluon fusion process. A factorization theorem is
obtained for this process using Soft Collinear Effective Theory. Our
factorization theorem does not depend on any assumptions regarding the physics
above the mass of the heavy colored particle. In this sense it is universal.
The matching coefficient at the heavy particle mass scale depends however on
the unkown physics above that scale and thus it is model dependent.
  Due to the large mass of the heavy colored particle, i.e., the hard scale and
near the partonic kinematic threshold for production of such particles a
resummation of large logarithms needs to be performed. The resummation is
justified due to the dominance of the gluon distribution function at small $x$.
For phenomenological purposes we utilize the Manohar-Wise model.
","[{""version"":""v1"",""created"":""Wed, 21 Jan 2009 16:00:15 GMT""}]","2009-01-22"
"0901.3302","Roger Horsley","N. Cundy, M. G\""ockeler, R. Horsley, T. Kaltenbrunner, A. D. Kennedy,
  Y. Nakamura, H. Perlt, D. Pleiter, P. E. L. Rakow, A. Sch\""afer, G.
  Schierholz, A. Schiller, H. St\""uben, J. M. Zanotti","Non-perturbative improvement of stout-smeared three flavour clover
  fermions","30 pages, 13 figures, minor changes, published version","Phys.Rev.D79:094507,2009","10.1103/PhysRevD.79.094507","DESY 08-141, Edinburgh 2009/01, LTH 819","hep-lat","http://arxiv.org/licenses/nonexclusive-distrib/1.0/","  We discuss a 3-flavour lattice QCD action with clover improvement in which
the fermion matrix has single level stout smearing for the hopping terms
together with unsmeared links for the clover term. With the (tree-level)
Symanzik improved gluon action this constitutes the Stout Link Non-perturbative
Clover or SLiNC action. To cancel O(a) terms the clover term coefficient has to
be tuned. We present here results of a non-perturbative determination of this
coefficient using the Schroedinger functional and as a by-product a
determination of the critical hopping parameter. Comparisons of the results are
made with lowest order perturbation theory.
","[{""version"":""v1"",""created"":""Wed, 21 Jan 2009 16:00:53 GMT""},{""version"":""v2"",""created"":""Wed, 3 Jun 2009 15:37:12 GMT""}]","2009-07-30"
"0901.3303","Isabelle Bouchoule","Isabelle Bouchoule (LCFIO), N. J. Van Druten, Christoph I. Westbrook
  (LCFIO)","Atom chips and one-dimensional Bose gases",,,,,"physics.atom-ph","http://arxiv.org/licenses/nonexclusive-distrib/1.0/","  In this review article, we describe the studies of 1D gases realised on
atom-chip experiments.
","[{""version"":""v1"",""created"":""Wed, 21 Jan 2009 16:08:22 GMT""},{""version"":""v2"",""created"":""Mon, 26 Jan 2009 08:33:18 GMT""}]","2009-01-26"
"0901.3304","Michel Dekking","Michel Dekking, K\'aroly Simon, Bal\'azs Sz\'ekely","The algebraic difference of two random Cantor sets: The Larsson family","Published in at http://dx.doi.org/10.1214/10-AOP558 the Annals of
  Probability (http://www.imstat.org/aop/) by the Institute of Mathematical
  Statistics (http://www.imstat.org)","Annals of Probability 2011, Vol. 39, No. 2, 549-586","10.1214/10-AOP558","IMS-AOP-AOP558","math.PR math.MG","http://arxiv.org/licenses/nonexclusive-distrib/1.0/","  In this paper, we consider a family of random Cantor sets on the line and
consider the question of whether the condition that the sum of the Hausdorff
dimensions is larger than one implies the existence of interior points in the
difference set of two independent copies. We give a new and complete proof that
this is the case for the random Cantor sets introduced by Per Larsson.
","[{""version"":""v1"",""created"":""Wed, 21 Jan 2009 16:11:29 GMT""},{""version"":""v2"",""created"":""Mon, 14 Mar 2011 11:35:37 GMT""}]","2011-03-15"
"0901.3305","Yuehong Xie","Yuehong Xie","Formalism for Simulation-based Optimization of Measurement Errors in
  High Energy Physics","7 pages",,,,"hep-ex","http://arxiv.org/licenses/nonexclusive-distrib/1.0/","  Miminizing errors of the physical parameters of interest should be the
ultimate goal of any event selection optimization in high energy physics data
analysis involving parameter determination. Quick and reliable error estimation
is a crucial ingredient for realizing this goal. In this paper we derive a
formalism for direct evaluation of measurement errors using the signal
probability density function and large fully simulated signal and background
samples without need for data fitting and background modelling. We illustrate
the elegance of the formalism in the case of event selection optimization for
CP violation measurement in B decays. The implication of this formalism on
choosing event variables for data analysis is discussed.
","[{""version"":""v1"",""created"":""Wed, 21 Jan 2009 16:11:48 GMT""},{""version"":""v2"",""created"":""Wed, 29 Apr 2009 14:16:32 GMT""}]","2009-04-29"
"0901.3306","Volodymyr Magas","V.K. Magas, E. Oset, A. Ramos","Two and three nucleon K- absorption in nuclei","3 pages, 3 figures. In the proceedings of the International
  Conference on Particles And Nuclei (PANIC08), Eilat, Israel, November 9-14,
  2008, pp. 450-452.",,,,"nucl-th","http://arxiv.org/licenses/nonexclusive-distrib/1.0/","  We analyze the peaks in the (Lambda p) and (Lambda d) invariant mass
distributions, observed in recent FINUDA experiments and claimed to be signals
of deeply bound kaonic states, and find them to be naturally explained in terms
of K- absorption by two or three nucleons leaving the rest of the original
nuclei as spectator. For reactions on heavy nuclei, the subsequent interactions
of the particles produced in the primary absorption process with the residual
nucleus play an important role. Thus at present there is no experimental
evidence of deeply bound K- states in nuclei. However some new physics can be
extracted from the data of FINUDA experiments.
","[{""version"":""v1"",""created"":""Wed, 21 Jan 2009 16:12:01 GMT""},{""version"":""v2"",""created"":""Mon, 19 Oct 2009 15:14:27 GMT""},{""version"":""v3"",""created"":""Wed, 24 Mar 2010 16:08:21 GMT""}]","2010-05-13"
"0901.3307","Markus Sch\""oller","S. Hubrig, M. Schoeller, R.S. Schnerr, I. Ilyin, H.F. Henrichs, R.
  Ignace, J.F. Gonzalez","Magnetic fields in O-type stars measured with FORS1 at the VLT","2 pages, 1 figure, to appear in Proceedings of IAU Symposium 259
  ""Cosmic Magnetic Fields: from Planets, to Stars and Galaxies"", Tenerife,
  Spain, November 3-7, 2008",,"10.1017/S1743921309030762",,"astro-ph.SR","http://arxiv.org/licenses/nonexclusive-distrib/1.0/","  The presence of magnetic fields in O-type stars has been suspected for a long
time. The discovery of such fields would explain a wide range of well
documented enigmatic phenomena in massive stars, in particular cyclical wind
variability, Halpha emission variations, chemical peculiarity, narrow X-ray
emission lines and non-thermal radio/X-ray emission. Here we present the
results of our studies of magnetic fields in O-type stars, carried out over the
last years.
","[{""version"":""v1"",""created"":""Wed, 21 Jan 2009 16:19:28 GMT""}]","2009-11-13"
"0901.3308","Alexander Mishchenko","Alexander S. Mishchenko, Quitzeh Morales Mel\'endez","Description of the vector $G$-bundles over $G$-spaces with quasi-free
  proper action of discrete group $G$","15 pages",,,,"math.AT math.KT","http://creativecommons.org/licenses/publicdomain/","  We give a description of the vector $G$-bundles over $G$-spaces with
quasi-free proper action of discrete group $G$ in terms of the classifying
space.
","[{""version"":""v1"",""created"":""Wed, 21 Jan 2009 16:37:27 GMT""}]","2009-01-22"
"0901.3309","Christian Gabriel","C. Gabriel, J. Janousek, and H.-A. Bachor","Determining the Minimum Uncertainty State of Nonclassical Light",,,,,"quant-ph","http://arxiv.org/licenses/nonexclusive-distrib/1.0/","  Squeezing experiments which are capable of creating a minimum uncertainty
state during the nonlinear process, for example optical parametric
amplification, are commonly used to produce light far below the quantum noise
limit. This report presents a method with which one can characterize this
minimum uncertainty state and gain valuable knowledge of the experimental
setup.
","[{""version"":""v1"",""created"":""Wed, 21 Jan 2009 16:38:48 GMT""}]","2009-01-22"
"0901.3310","Ross Young","R. D. Young, A. W. Thomas","Octet baryon masses and sigma terms from an SU(3) chiral extrapolation","4 pages, 2 figures, pdftex. v2: uncertainties from inputs quantified;
  small m_pi*L ensemble removed from analysis","Phys.Rev.D81:014503,2010","10.1103/PhysRevD.81.014503","ANL-PHY-12245-THY-2009, JLAB-THY-08-922","hep-lat","http://arxiv.org/licenses/nonexclusive-distrib/1.0/","  We report an analysis of the impressive new lattice simulation results for
octet baryon masses in 2+1-flavor QCD. The analysis is based on a low order
expansion about the chiral SU(3) limit in which the symmetry breaking arises
from terms linear in the quark masses plus the variation of the Goldstone boson
masses in the leading chiral loops. The baryon masses evaluated at the physical
light quark masses are in remarkable agreement with the experimental values,
with a model dependence considerably smaller than the rather small statistical
uncertainty. From the mass formulae one can evaluate the sigma commutators for
all octet baryons. This yields an accurate value for the pion-nucleon sigma
commutator. It also yields the first determination of the strangeness sigma
term based on 2+1-flavor lattice QCD and, in general, the sigma commutators
provide a resolution to the difficult issue of fine-tuning the strange quark
mass.
","[{""version"":""v1"",""created"":""Wed, 21 Jan 2009 16:40:46 GMT""},{""version"":""v2"",""created"":""Wed, 2 Sep 2009 16:23:24 GMT""}]","2010-04-06"
"0901.3311","Isabel P\'erez-Arjona","Isabel Perez-Arjona, Victor Sanchez-Morcillo, Javier Redondo, Kestutis
  Staliunas, and Eugenio Roldan","Diffusion stabilizes cavity solitons in bidirectional lasers","submitted to Optics Express",,"10.1364/OE.17.004897",,"nlin.PS","http://arxiv.org/licenses/nonexclusive-distrib/1.0/","  We study the influence of field diffusion on the spatial localized structures
(cavity solitons) recently predicted in bidirectional lasers. We find twofold
positive role of the diffusion: 1) it increases the stability range of the
individual (isolated) solitons; 2) it reduces the long-range interaction
between the cavity solitons. Latter allows the independent manipulation
(writing and erasing) of individual cavity solitons.
","[{""version"":""v1"",""created"":""Wed, 21 Jan 2009 16:41:30 GMT""}]","2009-11-13"
"0901.3312","Jinqiao Duan","Aijun Du and Jinqiao Duan","A Stochastic Approach for Parameterizing Unresolved Scales in a System
  with Memory","Journal of Algorithms & Computational Technology, 2009 (to appear).
  12 pages, 6 figures",,,,"math.NA math.DS math.PR","http://arxiv.org/licenses/nonexclusive-distrib/1.0/","  Complex systems display variability over a broad range of spatial and
temporal scales. Some scales are unresolved due to computational limitations.
The impact of these unresolved scales on the resolved scales needs to be
parameterized or taken into account. One stochastic parameterization scheme is
devised to take the effects of unresolved scales into account, in the context
of solving a nonlinear partial differential equation with memory (a
time-integral term), via large eddy simulations.
  The obtained large eddy simulation model is a stochastic partial differential
equation. Numerical experiments are performed to compare the solutions of the
original system and of the stochastic large eddy simulation model.
","[{""version"":""v1"",""created"":""Wed, 21 Jan 2009 16:51:09 GMT""}]","2009-01-22"
"0901.3313","Arnoldas Deltuva","A. Deltuva","Spin observables in three-body direct nuclear reactions","Expanded theory section","Nucl.Phys.A821:72-79,2009","10.1016/j.nuclphysa.2009.02.002",,"nucl-th","http://arxiv.org/licenses/nonexclusive-distrib/1.0/","  Direct nuclear reactions $\vec{d}+A$ and $\vec{p}+(An)$ are described in the
framework of three-body Faddeev-type equations. Differential cross section and
analyzing powers are calculated using several optical potential models and
compared with the experimental data. Quite satisfactory agreement is found
except for few systematic discrepancies.
","[{""version"":""v1"",""created"":""Wed, 21 Jan 2009 16:57:58 GMT""},{""version"":""v2"",""created"":""Sun, 22 Mar 2009 12:55:23 GMT""}]","2009-03-22"
"0901.3314","Stephan Tinguely","Amos Lapidoth, Stephan Tinguely","Sending a Bi-Variate Gaussian over a Gaussian MAC","submitted to the IEEE Transactions on Information Theory",,"10.1109/ISIT.2006.261926",,"cs.IT math.IT","http://arxiv.org/licenses/nonexclusive-distrib/1.0/","  We study the power versus distortion trade-off for the distributed
transmission of a memoryless bi-variate Gaussian source over a two-to-one
average-power limited Gaussian multiple-access channel. In this problem, each
of two separate transmitters observes a different component of a memoryless
bi-variate Gaussian source. The two transmitters then describe their source
component to a common receiver via an average-power constrained Gaussian
multiple-access channel. From the output of the multiple-access channel, the
receiver wishes to reconstruct each source component with the least possible
expected squared-error distortion. Our interest is in characterizing the
distortion pairs that are simultaneously achievable on the two source
components.
  We present sufficient conditions and necessary conditions for the
achievability of a distortion pair. These conditions are expressed as a
function of the channel signal-to-noise ratio (SNR) and of the source
correlation. In several cases the necessary conditions and sufficient
conditions are shown to agree. In particular, we show that if the channel SNR
is below a certain threshold, then an uncoded transmission scheme is optimal.
We also derive the precise high-SNR asymptotics of an optimal scheme.
","[{""version"":""v1"",""created"":""Wed, 21 Jan 2009 19:14:57 GMT""}]","2016-11-17"
