"0901.3461","Anthony Flatters","Anthony Flatters","Power Values of Certain Quadratic Polynomials","16 Pages; corrected and expanded version",,,,"math.NT","http://arxiv.org/licenses/nonexclusive-distrib/1.0/","  In this article we compute the $q$th power values of the quadratic
polynomials $f$ with negative squarefree discriminant such that $q$ is coprime
to the class number of the splitting field of $f$ over $\mathbb{Q}$. The theory
of unique factorisation and that of primitive divisors of integer sequences is
used to deduce a bound on the values of $q$ which is small enough to allow the
remaining cases to be easily checked. The results are used to determine all
perfect power terms of certain polynomially generated integer sequences,
including the Sylvester sequence.
","[{""version"":""v1"",""created"":""Thu, 22 Jan 2009 13:14:35 GMT""},{""version"":""v2"",""created"":""Fri, 12 Mar 2010 13:26:19 GMT""}]","2010-03-15"
"0901.3462","Yu. M. Zinoviev","Yu. M. Zinoviev","On massive spin 2 electromagnetic interactions","24 pages, no figures. Clarifications and references added. Version to
  appear in Nucl. Phys. B","Nucl.Phys.B821:431-451,2009","10.1016/j.nuclphysb.2009.04.027",,"hep-th","http://arxiv.org/licenses/nonexclusive-distrib/1.0/","  In this paper we investigate electromagnetic interactions for massive spin 2
particles in (A)dS space at linear approximation using gauge invariant
description for such massive particles. We follow bottom-up approach, i.e. we
begin with the introduction of minimal interaction and then proceed by adding
non-minimal interactions with higher and higher number of derivatives together
with corresponding non-minimal corrections to gauge transformations until we
are able to restore gauge invariance broken by transition to gauge covariant
derivatives. We manage to construct a model that smoothly interpolates between
massless particle in (A)dS space and massive one in a flat Minkowski space.
Also we reproduce the same results in a frame-like formalism which can be more
suitable for generalizations on higher spins.
","[{""version"":""v1"",""created"":""Thu, 22 Jan 2009 12:12:54 GMT""},{""version"":""v2"",""created"":""Wed, 28 Jan 2009 13:35:37 GMT""},{""version"":""v3"",""created"":""Thu, 14 May 2009 09:37:10 GMT""}]","2009-09-28"
"0901.3463","Yue Chongxing","Wei Liu, Chong-Xing Yue, Hui-Di Yang","Rare decays $B_s\to l^+l^-$ and $B\to Kl^+l^-$ in \the topcolor-assisted
  technicolor model","29 pages, 9 figure, corrected typos, the version to appear in PRD","Phys.Rev.D79:034008,2009","10.1103/PhysRevD.79.034008",,"hep-ph","http://arxiv.org/licenses/nonexclusive-distrib/1.0/","  We examine the rare decays $B_s\to l^+l^-$ and $B\to Kl^+l^-$ in the
framework of the topcolor-assisted technicolor ($TC2$) model. The contributions
of the new particles predicted by this model to these rare decay processes are
evaluated. We find that the values of their branching ratios are larger than
the standard model predictions by one order of magnitude in wide range of the
parameter space. The longitudinal polarization asymmetry of leptons in $B_s \to
l^+l^-$ can approach $\ord(10^{-2})$. The forward-backward asymmetry of leptons
in $B \to Kl^+l^-$ is not large enough to be measured in future experiments. We
also give some discussions about the branching ratios and the asymmetry
observables related to these rare decay processes in the littlest Higgs model
with T-parity.
","[{""version"":""v1"",""created"":""Thu, 22 Jan 2009 12:13:07 GMT""},{""version"":""v2"",""created"":""Sun, 8 Feb 2009 12:16:53 GMT""},{""version"":""v3"",""created"":""Sat, 30 May 2009 02:44:49 GMT""}]","2014-11-18"
"0901.3464","Emmanuel Jacob","Emmanuel Jacob (LPMA)","Excursions of the integral of the Brownian motion","In this second version, some consequent changes of notations and
  presentation. The space we work on for Proposition 2 and Theorem 2 changed a
  bit (the proofs are unchanged)",,,,"math.PR","http://arxiv.org/licenses/nonexclusive-distrib/1.0/","  The integrated Brownian motion is sometimes known as the Langevin process.
Lachal studied several excursion laws induced by the latter. Here we follow a
different point of view developed by Pitman for general stationary processes.
We first construct a stationary Langevin process and then determine explicitly
its stationary excursion measure. This is then used to provide new descriptions
of Ito's excursion measure of the Langevin process reflected at a completely
inelastic boundary, which has been introduced recently by Bertoin.
","[{""version"":""v1"",""created"":""Thu, 22 Jan 2009 12:14:59 GMT""},{""version"":""v2"",""created"":""Thu, 18 Jun 2009 15:10:24 GMT""}]","2009-06-18"
"0901.3465","Jana Ka\v{s}parov\'a","J. Ka\v{s}parov\'a, P. Heinzel, M. Karlick\'y, Z. Moravec, M. Varady","Far-IR and radio thermal continua in solar flares","7 pages, 3 figures, accepted to Central European Astrophysical
  Bulletin","Centr. Eur. Astrophys. Bull. 33 (2009), 1, 309-315",,,"astro-ph.SR","http://arxiv.org/licenses/nonexclusive-distrib/1.0/","  With the invention of new far-infrared (FIR) and radio mm and sub-mm
instruments (DESIR on SMESE satellite, ESO-ALMA), there is a growing interest
in observations and analysis of solar flares in this so far unexplored
wavelength region. Two principal radiation mechanisms play a role: the
synchrotron emission due to accelerated particle beams moving in the magnetic
field and the thermal emission due to the energy deposit in the lower
atmospheric layers. In this contribution we explore the time-dependent effects
of beams on thermal FIR and radio continua. We show how and where these
continua are formed in the presence of time dependent beam heating and
non-thermal excitation/ionisation of the chromospheric hydrogen plasma.
","[{""version"":""v1"",""created"":""Thu, 22 Jan 2009 12:18:42 GMT""}]","2009-05-22"
"0901.3466","Viktor Toth","Viktor T. Toth","Independent analysis of the orbits of Pioneer 10 and 11","22 pages, 5 figures; accepted for publication in IJMPD","Int.J.Mod.Phys.D18:717-741,2009","10.1142/S0218271809014728",,"physics.space-ph gr-qc","http://arxiv.org/licenses/nonexclusive-distrib/1.0/","  Independently developed orbit determination software is used to analyze the
orbits of Pioneer 10 and 11 using Doppler data. The analysis takes into account
the gravitational fields of the Sun and planets using the latest JPL
ephemerides, accurate station locations, signal propagation delays (e.g., the
Shapiro delay, atmospheric effects), the spacecrafts' spin, and maneuvers. New
to this analysis is the ability to utilize telemetry data for spin, maneuvers,
and other on-board systematic effects. Using data that was analyzed in prior
JPL studies, the anomalous acceleration of the two spacecraft is confirmed. We
are also able to put limits on any secondary acceleration (i.e., jerk) terms.
The tools that were developed will be used in the upcoming analysis of recently
recovered Pioneer 10 and 11 Doppler data files.
","[{""version"":""v1"",""created"":""Thu, 22 Jan 2009 12:28:39 GMT""}]","2009-06-17"
"0901.3467","Alexandre Soro","Alexandre Soro, Mathieu Cunche, Jerome Lacan, Vincent Roca","Erasure Codes with a Banded Structure for Hybrid Iterative-ML Decoding","5 pages",,,,"cs.IT math.IT","http://arxiv.org/licenses/nonexclusive-distrib/1.0/","  This paper presents new FEC codes for the erasure channel, LDPC-Band, that
have been designed so as to optimize a hybrid iterative-Maximum Likelihood (ML)
decoding. Indeed, these codes feature simultaneously a sparse parity check
matrix, which allows an efficient use of iterative LDPC decoding, and a
generator matrix with a band structure, which allows fast ML decoding on the
erasure channel. The combination of these two decoding algorithms leads to
erasure codes achieving a very good trade-off between complexity and erasure
correction capability.
","[{""version"":""v1"",""created"":""Thu, 22 Jan 2009 12:25:00 GMT""}]","2009-01-23"
"0901.3468","Stefanie M\""uhle","S. M\""uhle, E.R. Seaquist, C. Henkel","Properties of the Molecular Gas in Starburst Galaxies and AGN","6 pages, 4 figures, proceedings of the 9th European VLBI Network
  Symposium on ""The role of VLBI in the Golden Age for Radio Astronomy and EVN
  Users Meeting"", to appear in Proceedings of Science",,,,"astro-ph.GA astro-ph.CO","http://arxiv.org/licenses/nonexclusive-distrib/1.0/","  There is growing evidence that the properties of the molecular gas in the
nuclei of starburst galaxies and in AGN may be very different from those seen
in Galactic star forming regions and that a high kinetic temperature in the
molecular gas may lead to a non-standard initial mass function in the next
generation of stars. Unfortunately, among the fundamental parameters derived
from molecular line observations, the kinetic temperature of the molecular gas
in external galaxies is often not well determined due to a lack of suitable
tracer molecules. We discuss the diagnostic power of selected transition lines
of formaldehyde (H_2CO), which can be used as a molecular thermometer as well
as an excellent tracer of the molecular gas density. As a proof of concept, we
present the results of our multi-transition line study of the H_2CO emission
from the prototypical starburst galaxy M82. Using our large velocity gradient
model, we tightly constrain the physical properties of the dense gas in the
prominent molecular lobes, completely independent of the standard ""cloud
thermometer"" ammonia (NH_3) or other molecular tracers. Our results agree well
with the properties of the high-excitation molecular gas component found in the
most comprehensive CO studies. Our observations also indicate that there may be
an asymmetry between the two molecular lobes.
","[{""version"":""v1"",""created"":""Thu, 22 Jan 2009 12:45:39 GMT""}]","2009-04-14"
"0901.3469","Michael L. Stein","Montserrat Fuentes, Peter Guttorp, Michael L. Stein","Special section on statistics in the atmospheric sciences","Published in at http://dx.doi.org/10.1214/08-AOAS209 the Annals of
  Applied Statistics (http://www.imstat.org/aoas/) by the Institute of
  Mathematical Statistics (http://www.imstat.org)","Annals of Applied Statistics 2008, Vol. 2, No. 4, 1143-1147","10.1214/08-AOAS209","IMS-AOAS-AOAS209","stat.AP","http://arxiv.org/licenses/nonexclusive-distrib/1.0/","  With the possible exception of gambling, meteorology, particularly
precipitation forecasting, may be the area with which the general public is
most familiar with probabilistic assessments of uncertainty. Despite the heavy
use of stochastic models and statistical methods in weather forecasting and
other areas of the atmospheric sciences, papers in these areas have
traditionally been somewhat uncommon in statistics journals. We see signs of
this changing in recent years and we have sought to highlight some present
research directions at the interface of statistics and the atmospheric sciences
in this special section.
","[{""version"":""v1"",""created"":""Thu, 22 Jan 2009 12:39:49 GMT""}]","2009-01-23"
"0901.3470","Zaza Osmanov","Machabeli George and Osmanov Zaza","The Synchrotron Emission Mechanism in the Recently Detected Very High
  Energy Radiation from the Crab Pulsar","8 pages, 1 figure","Astrophys.J.700:L114-L117,2009","10.1088/0004-637X/700/2/L114",,"astro-ph.HE","http://arxiv.org/licenses/nonexclusive-distrib/1.0/","  Interpretation of the recently discovered very high energy (VHE) pulsed
emission from the Crab pulsar is presented. By taking into account the fact
that Crab pulsar's radiation for the optical and VHE spectrum peak at the same
phases, we argue that the source of this broad band emission is spatially
localized. It is shown that the only mechanism providing the results of the
MAGIC Cherenkov telescope, should be the synchrotron radiation. We find that in
the magnetospheric electron-positron plasma, due to the cyclotron instability,
the pitch angle becomes non-vanishing, which leads to the efficient synchrotron
mechanism, intensifying on the light cylinder lengthscales. We also estimate
the VHE radiation spectral index to be equal to -1/2.
","[{""version"":""v1"",""created"":""Thu, 22 Jan 2009 12:47:12 GMT""},{""version"":""v2"",""created"":""Fri, 23 Jan 2009 06:50:30 GMT""},{""version"":""v3"",""created"":""Wed, 10 Jun 2009 06:34:31 GMT""},{""version"":""v4"",""created"":""Sat, 8 Aug 2009 19:47:22 GMT""}]","2009-08-10"
"0901.3471","Dragi Anevski","Dragi Anevski, Philippe Soulier","Monotone spectral density estimation","Published in at http://dx.doi.org/10.1214/10-AOS804 the Annals of
  Statistics (http://www.imstat.org/aos/) by the Institute of Mathematical
  Statistics (http://www.imstat.org)","Annals of Statistics 2011, Vol. 39, No. 1, 418-438","10.1214/10-AOS804","IMS-AOS-AOS804","math.ST stat.TH","http://arxiv.org/licenses/nonexclusive-distrib/1.0/","  We propose two estimators of a monotone spectral density, that are based on
the periodogram. These are the isotonic regression of the periodogram and the
isotonic regression of the log-periodogram. We derive pointwise limit
distribution results for the proposed estimators for short memory linear
processes and long memory Gaussian processes and also that the estimators are
rate optimal.
","[{""version"":""v1"",""created"":""Thu, 22 Jan 2009 12:50:09 GMT""},{""version"":""v2"",""created"":""Fri, 29 Jan 2010 15:38:40 GMT""},{""version"":""v3"",""created"":""Wed, 9 Mar 2011 12:58:22 GMT""}]","2011-03-10"
"0901.3472","Jean-Noel Roux","Jean-No\""el Roux (LMSGC, UR Navier), Fran\c{c}ois Chevoir (LMSGC, UR
  Navier)","Simulation nnnum\'erique discr\`ete et comportement m\'ecanique des
  mat\'eriaux granulaires","Article in French. A free English translation is available on the web
  site of the journal : http://www.lcpc.fr/en/sources/blpc/index.php","Bulletin des Laboratoires des Ponts et Chauss\'ees 254 (2005) pp.
  109-138",,,"physics.class-ph","http://arxiv.org/licenses/nonexclusive-distrib/1.0/","  As a complementary tool to laboratory experiments, discrete numerical
simulation, applied to granular materials, provides valuable information on the
grain and contact scale microstructure, thereby enabling one to better
understand the microscopic origin of macroscopic mechanical behaviours. We
first introduce different simulation methods, which we regard as techniques for
numerical experimentation, in connection with micromechanical models for
intergranular contacts. We lay special emphasis on the important issue of
sample representativity and stress the usefulness of dimensional analysis in
the definition of relevant control parameters. We then apply this approach to
two important rheological regimes of granular systems: solid-like, slowly
strained granular materials, which might be ruled by elastoplastic constitutive
relations; and liquid-like, dense granular flows, either confined or with a
free surface, described by suitable friction and dilatancy laws
","[{""version"":""v1"",""created"":""Thu, 22 Jan 2009 12:51:04 GMT""}]","2009-01-23"
"0901.3473","Seiya Nishiyama","Seiya Nishiyama, Joao da Providencia, Constanca Providencia, Flavio
  Cordeiro and Takao Komatsu","Self-Consistent-Field Method and $\tau$-Functional Method on Group
  Manifold in Soliton Theory: a Review and New Results",,"SIGMA 5 (2009), 009, 76 pages","10.3842/SIGMA.2009.009",,"nlin.SI cond-mat.stat-mech math-ph math.MP quant-ph","http://creativecommons.org/licenses/by-nc-sa/3.0/","  The maximally-decoupled method has been considered as a theory to apply an
basic idea of an integrability condition to certain multiple parametrized
symmetries. The method is regarded as a mathematical tool to describe a
symmetry of a collective submanifold in which a canonicity condition makes the
collective variables to be an orthogonal coordinate-system. For this aim we
adopt a concept of curvature unfamiliar in the conventional time-dependent (TD)
self-consistent field (SCF) theory. Our basic idea lies in the introduction of
a sort of Lagrange manner familiar to fluid dynamics to describe a collective
coordinate-system. This manner enables us to take a one-form which is linearly
composed of a TD SCF Hamiltonian and infinitesimal generators induced by
collective variable differentials of a canonical transformation on a group. The
integrability condition of the system read the curvature C=0. Our method is
constructed manifesting itself the structure of the group under consideration.
>...
","[{""version"":""v1"",""created"":""Thu, 22 Jan 2009 12:56:37 GMT""}]","2009-01-23"
"0901.3474","Robert Brandenberger","Robert Brandenberger, Yi-Fu Cai, Wei Xue, and Xinmin Zhang (McGill and
  IHEP Beijing)","Cosmic Ray Positrons from Cosmic Strings","9 pages, 4 figures, 2 references added",,,,"hep-ph astro-ph.HE gr-qc hep-th","http://arxiv.org/licenses/nonexclusive-distrib/1.0/","  We study the spectrum of cosmic ray positrons produced by a scaling
distribution of non-superconducting cosmic strings. In this scenario, the
positrons are produced from the jets which form from the cosmic string cusp
annihilation process. The spectral shape is a robust feature of our scenario,
and is in good agreement with the results from the recent PAMELA and ATIC
experiments. In particular, the model predicts a sharp upper cutoff in the
spectrum, and a flux which rises as the upper cutoff is approached. The energy
at which the flux peaks is determined by the initial jet energy. The amplitude
of the flux can be adjusted by changing the cosmic string tension and also
depends on the cusp annihilation efficiency.
","[{""version"":""v1"",""created"":""Thu, 22 Jan 2009 12:57:19 GMT""},{""version"":""v2"",""created"":""Sun, 25 Jan 2009 17:25:16 GMT""}]","2009-01-25"
"0901.3475","In Sook Park","In Sook Park","Efficient decoding algorithm using triangularity of $\mbf{R}$ matrix of
  QR-decomposition","This paper is submitted to IEEE transactions on Information theory",,,,"cs.IT math.IT","http://arxiv.org/licenses/nonexclusive-distrib/1.0/","  An efficient decoding algorithm named `divided decoder' is proposed in this
paper. Divided decoding can be combined with any decoder using QR-decomposition
and offers different pairs of performance and complexity. Divided decoding
provides various combinations of two or more different searching algorithms.
Hence it makes flexibility in error rate and complexity for the algorithms
using it. We calculate diversity orders and upper bounds of error rates for
typical models when these models are solved by divided decodings with sphere
decoder, and discuss about the effects of divided decoding on complexity.
Simulation results of divided decodings combined with a sphere decoder
according to different splitting indices correspond to the theoretical
analysis.
","[{""version"":""v1"",""created"":""Thu, 22 Jan 2009 12:57:42 GMT""}]","2009-01-23"
"0901.3476","Sylvain Rubenthaler","Sylvain Rubenthaler (JAD)","Expansion of the propagation of chaos for Bird and Nanbu systems",,"Annales de la Facult{\'e}e de Sciences de Toulouse, 2016",,,"math.PR","http://arxiv.org/licenses/nonexclusive-distrib/1.0/","  The Bird and Nanbu systems are particle systems used to approximate the
solution of the mollied Boltzmann equation. In particular, they have the
propagation of chaos property. Following [GM94, GM97, GM99], we use coupling
techniques and results on branching processes to write an expansion of the
error in the propagation of chaos in terms of the number of particles, for
slightly more general systems than the ones cited above. This result leads to
the proof of the a.s convergence and the centrallimit theorem for these
systems. In particular, we have a central-limit theorem for the empirical
measure of the system under less assumptions then in [M{\'e}l98]. As in [GM94,
GM97, GM99], these results apply to the trajectories of particles on an
interval [0; T].
","[{""version"":""v1"",""created"":""Thu, 22 Jan 2009 13:13:26 GMT""},{""version"":""v10"",""created"":""Tue, 18 Oct 2016 12:21:18 GMT""},{""version"":""v2"",""created"":""Mon, 2 Mar 2009 12:33:25 GMT""},{""version"":""v3"",""created"":""Fri, 6 Mar 2009 19:05:58 GMT""},{""version"":""v4"",""created"":""Mon, 6 Apr 2009 08:32:10 GMT""},{""version"":""v5"",""created"":""Wed, 24 Jun 2009 15:24:09 GMT""},{""version"":""v6"",""created"":""Wed, 21 Oct 2009 15:09:15 GMT""},{""version"":""v7"",""created"":""Fri, 15 Oct 2010 04:27:12 GMT""},{""version"":""v8"",""created"":""Tue, 29 Nov 2011 12:40:13 GMT""},{""version"":""v9"",""created"":""Fri, 7 Sep 2012 18:33:57 GMT""}]","2016-10-19"
"0901.3477","Edan Lerner","Edan Lerner and Itamar Procaccia","Locality and Non-locality in Elasto-plastic Responses of Amorphous
  Solids","11 pages, 15 figures",,"10.1103/PhysRevE.79.066109",,"cond-mat.stat-mech cond-mat.dis-nn cond-mat.mtrl-sci","http://arxiv.org/licenses/nonexclusive-distrib/1.0/","  A number of current theories of plasticity in amorphous solids assume at
their basis that plastic deformations are spatially localized. We present in
this paper a series of numerical experiments to test the degree of locality of
plastic deformation. These experiments increase in terms of the stringency of
the removal of elastic contributions to the observed elasto-plastic
deformations. It is concluded that for all our simulational protocols the
plastic deformations are not localized, and their scaling is sub-extensive. We
offer a number of measures of the magnitude of the plastic deformation, all of
which display sub-extensive scaling characterized by non-trivial exponents. We
provide some evidence that the scaling exponents governing the sub-extensive
scaling laws are non-universal, depending on the degree of disorder and on the
parameters of the systems. Nevertheless understanding what determines these
exponents should shed considerable light on the physics of amorphous solids.
","[{""version"":""v1"",""created"":""Thu, 22 Jan 2009 15:00:26 GMT""},{""version"":""v2"",""created"":""Tue, 3 Feb 2009 09:11:42 GMT""}]","2015-05-13"
"0901.3478","Montserrat Fuentes","Montserrat Fuentes, Brian Reich, Gyuwon Lee","Spatial--temporal mesoscale modeling of rainfall intensity using gage
  and radar data","Published in at http://dx.doi.org/10.1214/08-AOAS166 the Annals of
  Applied Statistics (http://www.imstat.org/aoas/) by the Institute of
  Mathematical Statistics (http://www.imstat.org)","Annals of Applied Statistics 2008, Vol. 2, No. 4, 1148-1169","10.1214/08-AOAS166","IMS-AOAS-AOAS166","stat.AP","http://arxiv.org/licenses/nonexclusive-distrib/1.0/","  Gridded estimated rainfall intensity values at very high spatial and temporal
resolution levels are needed as main inputs for weather prediction models to
obtain accurate precipitation forecasts, and to verify the performance of
precipitation forecast models. These gridded rainfall fields are also the main
driver for hydrological models that forecast flash floods, and they are
essential for disaster prediction associated with heavy rain. Rainfall
information can be obtained from rain gages that provide relatively accurate
estimates of the actual rainfall values at point-referenced locations, but they
do not characterize well enough the spatial and temporal structure of the
rainfall fields. Doppler radar data offer better spatial and temporal coverage,
but Doppler radar measures effective radar reflectivity ($Ze$) rather than
rainfall rate ($R$). Thus, rainfall estimates from radar data suffer from
various uncertainties due to their measuring principle and the conversion from
$Ze$ to $R$. We introduce a framework to combine radar reflectivity and gage
data, by writing the different sources of rainfall information in terms of an
underlying unobservable spatial temporal process with the true rainfall values.
We use spatial logistic regression to model the probability of rain for both
sources of data in terms of the latent true rainfall process. We characterize
the different sources of bias and error in the gage and radar data and we
estimate the true rainfall intensity with its posterior predictive
distribution, conditioning on the observed data.
","[{""version"":""v1"",""created"":""Thu, 22 Jan 2009 13:22:27 GMT""}]","2009-01-23"
"0901.3479","Jens Smiatek","Jens Smiatek, Marcello Sega, Christian Holm, Ulf D. Schiller,
  Friederike Schmid","Mesoscopic simulations of the counterion-induced electroosmotic flow - a
  comparative study","10 pages, 8 figures, 3 tables, additional references and minor
  changes in the text",,"10.1063/1.3152844",,"cond-mat.other","http://arxiv.org/licenses/nonexclusive-distrib/1.0/","  We present mesoscopic simulations of the counterion-induced electroosmotic
flow in different electrostatic coupling regimes. Two simulation methods are
compared, Dissipative Particle Dynamics (DPD) and coupled
Lattice-Boltzmann/Molecular Dynamics (LB/MD). A general mapping scheme to match
DPD to LB/MD is developed. For the weak-coupling regime, analytic expressions
for the flow profiles in the presence of partial-slip as well as no-slip
boundary conditions are derived from the Poisson-Boltzmann and Stokes
equations, which are in good agreement with the numerical results. The
influence of electrofriction and partial slip on the flow profiles is
discussed.
","[{""version"":""v1"",""created"":""Thu, 22 Jan 2009 13:25:21 GMT""},{""version"":""v2"",""created"":""Tue, 19 May 2009 09:17:30 GMT""}]","2011-03-03"
