"0901.3398","Igor Halperin","Matthias Arnsdorf and Igor Halperin","BSLP: Markovian Bivariate Spread-Loss Model for Portfolio Credit
  Derivatives","42 pages, 9 figures",,,,"q-fin.PR","http://arxiv.org/licenses/nonexclusive-distrib/1.0/","  BSLP is a two-dimensional dynamic model of interacting portfolio-level loss
and spread (more exactly, loss intensity) processes. The model is similar to
the top-down HJM-like frameworks developed by Schonbucher (2005) and
Sidenius-Peterbarg-Andersen (SPA) (2005), however is constructed as a
Markovian, short-rate intensity model. This property of the model enables fast
lattice methods for pricing various portfolio credit derivatives such as
tranche options, forward-starting tranches, leveraged super-senior tranches
etc. A non-parametric model specification is used to achieve nearly perfect
calibration to liquid tranche quotes across strikes and maturities. A
non-dynamic version of the model obtained in the zero volatility limit of
stochastic intensity is useful on its own as an arbitrage-free interpolation
model to price non-standard index tranches off the standard ones.
","[{""version"":""v1"",""created"":""Thu, 22 Jan 2009 03:10:55 GMT""}]","2009-01-23"
"0901.3399","Robert W. Johnson Jr","Robert W. Johnson","Comment on ""Plasma ionization by annularly bounded helicon waves"" [Phys
  . Plasmas 13, 063501 (2006)]","7 pages, 1 figure, to be published in Phys. Plasmas,
  http://link.aip.org/link/?PHPAEN/16/054701/1","Phys. Plasmas 16, 054701 (2009)","10.1063/1.3100238",,"physics.plasm-ph","http://arxiv.org/licenses/nonexclusive-distrib/1.0/","  The neoclassical calculation of the helicon wave theory contains a
fundamental flaw. Use is made of a proportional relationship between the
magnetic field and its curl to derive the Helmholtz equation describing helicon
wave propagation; however, by the fundamental theorem of Stokes, the curl of
the magnetic field must be perpendicular to that portion of the field
contributing to the local curl. Reexamination of the equations of motion
indicates that only electromagnetic waves propagate through a stationary region
of constant pressure in a fully ionized, neutral medium.
","[{""version"":""v1"",""created"":""Thu, 22 Jan 2009 03:13:11 GMT""}]","2009-05-06"
"0901.3400","Sung-Gi Kim","M. Ishiduki, S.-G. Kim, N. Maekawa and K. Sakurai","CEDM constraints on modified sfermion universality and spontaneous CP
  violation","Hg EDM bound updated, content modified, figure added, typos
  corrected, references added","Prog.Theor.Phys.122:659-671,2009","10.1143/PTP.122.659",,"hep-ph","http://arxiv.org/licenses/nonexclusive-distrib/1.0/","  We discuss the supersymmetric CP problem that arises when the sfermion soft
mass universality is modified. We place the 3rd generation SU(5) ten-plet
sfermion masses in the weak scale in view of the naturalness. The other
sfermion masses are assumed to be universal and a TeV scale in order to weaken
the flavor changing neutral current processes and electric dipole moment (EDM)
constraints. However this modification generically induces too large up quark
chromo-EDM (CEDM) via the weak scale stop loop. In order to suppress this CEDM,
we propose certain type of flavor structure where the parameters of the
up-(s)quark sector are real whereas those of the down-(s)quark and the charged
(s)lepton sectors are complex at the GUT scale. It is shown that, in this set
up, up quark CEDM can be suppressed within the range where the current and
future experiments have their sensitivity. We briefly illustrate the simple
realization of these particular forms of the modified sfermion universality
with real up-(s)quark sector by spontaneous CP violation in E$_6$ SUSY GUT with
SU(2) flavor symmetry.
","[{""version"":""v1"",""created"":""Thu, 22 Jan 2009 14:13:40 GMT""},{""version"":""v2"",""created"":""Thu, 28 May 2009 13:04:15 GMT""}]","2010-01-07"
"0901.3401","Pin-Gao Gu","Pin-Gao Gu, Gordon I. Ogilvie","Diurnal Thermal Tides in a Non-synchronized Hot Jupiter","accepted for publication in MNRAS",,"10.1111/j.1365-2966.2009.14531.x",,"astro-ph.EP","http://arxiv.org/licenses/nonexclusive-distrib/1.0/","  We perform a linear analysis to investigate the dynamical response of a
non-synchronized hot Jupiter to stellar irradiation. In this work, we consider
the diurnal Fourier harmonic of the stellar irradiation acting at the top of a
radiative layer of a hot Jupiter with no clouds and winds. In the absence of
the Coriolis force, the diurnal thermal forcing can excite internal waves
propagating into the planet's interior when the thermal forcing period is
longer than the sound crossing time of the planet's surface. When the Coriolis
effect is taken into consideration, the latitude-dependent stellar heating can
excite weak internal waves (g modes) and/or strong baroclinic Rossby waves
(buoyant r modes) depending on the asynchrony of the planet. When the planet
spins faster than its orbital motion (i.e. retrograde thermal forcing), these
waves carry negative angular momentum and are damped by radiative loss as they
propagate downwards from the upper layer of the radiative zone. As a result,
angular momentum is transferred from the lower layer of the radiative zone to
the upper layer and generates a vertical shear. We estimate the resulting
internal torques for different rotation periods based on the parameters of HD
209458b.
","[{""version"":""v1"",""created"":""Thu, 22 Jan 2009 03:36:58 GMT""}]","2009-11-13"
"0901.3402","Yanwen Shang","Erich Poppitz, Yanwen Shang","Lattice chirality, anomaly matching, and more on the (non)decoupling of
  mirror fermions","46 pages, 8 figures, some typos fixed and references added","JHEP 0903:103,2009","10.1088/1126-6708/2009/03/103",,"hep-lat hep-th","http://arxiv.org/licenses/nonexclusive-distrib/1.0/","  We study 't Hooft anomaly matching in lattice models with strong Yukawa or
multi-fermion interactions. Strong non-gauge interactions among the mirror
fermions in a vectorlike lattice gauge theory are introduced with the aim to
obtain, in a strong-coupling symmetric phase, a long-distance unbroken gauge
theory with chiral fermions in a complex representation. We show how to use
exact lattice chirality to analyze the anomaly matching conditions on chiral
symmetry current correlators at finite lattice spacing and volume. We perform a
Monte Carlo study of the realization of anomaly matching in a toy
two-dimensional model with an anomalous mirror-fermion content at strong mirror
Yukawa coupling. We show that 't Hooft anomaly matching is satisfied, in most
of the phase diagram, via the minimal solution in either the massless fermion
or ""Goldstone"" mode, while in some cases there are extra massless vectorlike
mirror fermions. The mirror spectrum at strong coupling is thus consistent with
long-distance unitarity. We discuss the implications of our results for future
studies of the most interesting case of the decoupling of anomaly-free
mirror-fermion sectors.
","[{""version"":""v1"",""created"":""Thu, 22 Jan 2009 03:35:54 GMT""},{""version"":""v2"",""created"":""Tue, 10 Feb 2009 17:43:11 GMT""}]","2009-04-29"
"0901.3403","Marco Duarte","Dror Baron, Marco F. Duarte, Michael B. Wakin, Shriram Sarvotham,
  Richard G. Baraniuk","Distributed Compressive Sensing","42 pages, 6 figures. Submitted November 27, 2005; Revised January 21,
  2009",,,,"cs.IT math.IT","http://arxiv.org/licenses/nonexclusive-distrib/1.0/","  Compressive sensing is a signal acquisition framework based on the revelation
that a small collection of linear projections of a sparse signal contains
enough information for stable recovery. In this paper we introduce a new theory
for distributed compressive sensing (DCS) that enables new distributed coding
algorithms for multi-signal ensembles that exploit both intra- and inter-signal
correlation structures. The DCS theory rests on a new concept that we term the
joint sparsity of a signal ensemble. Our theoretical contribution is to
characterize the fundamental performance limits of DCS recovery for jointly
sparse signal ensembles in the noiseless measurement setting; our result
connects single-signal, joint, and distributed (multi-encoder) compressive
sensing. To demonstrate the efficacy of our framework and to show that
additional challenges such as computational tractability can be addressed, we
study in detail three example models for jointly sparse signals. For these
models, we develop practical algorithms for joint recovery of multiple signals
from incoherent projections. In two of our three models, the results are
asymptotically best-possible, meaning that both the upper and lower bounds
match the performance of our practical algorithms. Moreover, simulations
indicate that the asymptotics take effect with just a moderate number of
signals. DCS is immediately applicable to a range of problems in sensor arrays
and networks.
","[{""version"":""v1"",""created"":""Thu, 22 Jan 2009 04:30:29 GMT""}]","2009-01-23"
"0901.3404","Igor Halperin","Igor Halperin and Pascal Tomecek","Climbing Down from the Top: Single Name Dynamics in Credit Top Down
  Models","34 pages, 9 figures",,,,"q-fin.PR q-fin.CP","http://arxiv.org/licenses/nonexclusive-distrib/1.0/","  In the top-down approach to multi-name credit modeling, calculation of singe
name sensitivities appears possible, at least in principle, within the
so-called random thinning (RT) procedure which dissects the portfolio risk into
individual contributions. We make an attempt to construct a practical RT
framework that enables efficient calculation of single name sensitivities in a
top-down framework, and can be extended to valuation and risk management of
bespoke tranches. Furthermore, we propose a dynamic extension of the RT method
that enables modeling of both idiosyncratic and default-contingent individual
spread dynamics within a Monte Carlo setting in a way that preserves the
portfolio ""top""-level dynamics. This results in a model that is not only
calibrated to tranche and single name spreads, but can also be tuned to
approximately match given levels of spread volatilities and correlations of
names in the portfolio.
","[{""version"":""v1"",""created"":""Thu, 22 Jan 2009 04:31:12 GMT""}]","2009-01-23"
"0901.3405","Pablo M. Saz Parkinson","P. M. Saz Parkinson (for the Fermi-LAT Collaboration)","Fermi Gamma-ray Space Telescope Observations of Gamma-ray Pulsars","To appear in the Proceedings of the 6th Workshop on Science with the
  New Generation of High Energy Gamma-Ray Experiments (SciNeGHE '08), held in
  Padova, 8-10 October 2008, Eds. D. Bastieri, R. Rando","AIP Conf.Proc.1112:79-88,2009","10.1063/1.3125794",,"astro-ph.GA","http://arxiv.org/licenses/nonexclusive-distrib/1.0/","  The Large Area Telescope on the recently launched Fermi Gamma-ray Space
Telescope (formerly GLAST), with its large field of view and effective area,
combined with its excellent timing capabilities, is poised to revolutionize the
field of gamma-ray astrophysics. The large improvement in sensitivity over
EGRET is expected to result in the discovery of many new gamma-ray pulsars,
which in turn should lead to fundamental advances in our understanding of
pulsar physics and the role of neutron stars in the Galaxy. Almost immediately
after launch, Fermi clearly detected all previously known gamma-ray pulsars and
is producing high precision results on these. An extensive radio and X-ray
timing campaign of known (primarily radio) pulsars is being carried out in
order to facilitate the discovery of new gamma-ray pulsars. In addition, a
highly efficient time-differencing technique is being used to conduct blind
searches for radio-quiet pulsars, which has already resulted in new
discoveries. I present some recent results from searches for pulsars carried
out on Fermi data, both blind searches, and using contemporaneous timing of
known radio pulsars.
","[{""version"":""v1"",""created"":""Thu, 22 Jan 2009 04:58:23 GMT""}]","2019-08-14"
"0901.3406","Erik Spence","E. J. Spence, K. Reuter, and C. B. Forest","A Spherical Plasma Dynamo Experiment",,,"10.1088/0004-637X/700/1/470",,"physics.plasm-ph astro-ph.EP astro-ph.GA physics.flu-dyn physics.geo-ph physics.space-ph","http://arxiv.org/licenses/nonexclusive-distrib/1.0/","  We propose a plasma experiment to be used to investigate fundamental
properties of astrophysical dynamos. The highly conducting, fast-flowing plasma
will allow experimenters to explore systems with magnetic Reynolds numbers an
order of magnitude larger than those accessible with liquid-metal experiments.
The plasma is confined using a ring-cusp strategy and subject to a toroidal
differentially rotating outer boundary condition. As proof of principle, we
present magnetohydrodynamic simulations of the proposed experiment. When a von
K\'arm\'an-type boundary condition is specified, and the magnetic Reynolds
number is large enough, dynamo action is observed. At different values of the
magnetic Prandtl and Reynolds numbers the simulations demonstrate either
laminar or turbulent dynamo action.
","[{""version"":""v1"",""created"":""Thu, 22 Jan 2009 05:09:49 GMT""},{""version"":""v2"",""created"":""Fri, 23 Jan 2009 15:52:20 GMT""},{""version"":""v3"",""created"":""Tue, 7 Apr 2009 16:50:24 GMT""}]","2015-05-13"
"0901.3407","Jesse Kinder","Jesse M. Kinder, Jonathan J. Dorando, Haitao Wang, Garnet K.-L. Chan","Perfect Reflection of Chiral Fermions in Gated Graphene Nanoribbons","9 pages, 3 figures. Submitted to Nano Letters","Nano Letters 9, 1980--1083. (2009)","10.1021/nl900227e",,"cond-mat.mes-hall cond-mat.mtrl-sci","http://arxiv.org/licenses/nonexclusive-distrib/1.0/","  We describe the results of a theoretical study of transport through gated
metallic graphene nanoribbons using a non-equilibrium Green function method.
Although analogies with quantum field theory predict perfect transmission of
chiral fermions through gated regions in one dimension, we find \emph{perfect
reflection} of chiral fermions in armchair ribbons for specific configurations
of the gate. This effect should be measurable in narrow graphene constrictions
gated by a charged carbon nanotube.
","[{""version"":""v1"",""created"":""Thu, 22 Jan 2009 05:43:50 GMT""}]","2011-01-19"
"0901.3408","Arash Amini","Arash Amini and Farokh Marvasti","Limits of Deterministic Compressed Sensing Considering Arbitrary
  Orthonormal Basis for Sparsity","4 pages, submitted to SAMPTA2009",,,,"cs.IT math.IT","http://arxiv.org/licenses/nonexclusive-distrib/1.0/","  It is previously shown that proper random linear samples of a finite discrete
signal (vector) which has a sparse representation in an orthonormal basis make
it possible (with probability 1) to recover the original signal. Moreover, the
choice of the linear samples does not depend on the sparsity domain. In this
paper, we will show that the replacement of random linear samples with
deterministic functions of the signal (not necessarily linear) will not result
in unique reconstruction of k-sparse signals except for k=1. We will show that
there exist deterministic nonlinear sampling functions for unique
reconstruction of 1- sparse signals while deterministic linear samples fail to
do so.
","[{""version"":""v1"",""created"":""Thu, 22 Jan 2009 05:36:43 GMT""}]","2009-01-23"
"0901.3409","V. Ryzhii","V. Ryzhii, M. Ryzhii","Graphene Bilayer Field-Effect Phototransistor for Terahertz and Infrared
  Detection","7 Pages, 7 figures",,"10.1103/PhysRevB.79.245311",,"cond-mat.mes-hall cond-mat.mtrl-sci","http://arxiv.org/licenses/nonexclusive-distrib/1.0/","  A graphene bilayer phototransistor (GBL-PT) is proposed and analyzed. The
GBL-PT under consideration has the structure of a field-effect transistor with
a GBL as the channel and the back and top gates. The positive bias of the back
gate results in the formation of conducting source and drain sections in the
channel, while the negatively biased top gate provides the potential barrier
which is controlled by the charge of the photogenerated holes. The features of
the GBL-PT operation are associated with the variations of both the potential
distribution and the energy gap in different sections of the channel when the
gate voltages and the charge in the barrier section change. Using the developed
GBL-PT device model, the spectral characteristics, dark current, responsivity
and detectivity are calculated as functions of the applied voltages, energy of
incident photons, intensity of electron and hole scattering, and geometrical
parameters. It is shown that the GBL-PT spectral characteristics are voltage
tuned. The GBL-PT performance as photodetector in the terahertz and infrared
photodetectors can markedly exceed the performance of other photodetectors.
","[{""version"":""v1"",""created"":""Thu, 22 Jan 2009 05:36:58 GMT""}]","2013-05-29"
"0901.3410","Yanwei Ma","Yanpeng Qi, Xianping Zhang, Zhaoshun Gao, Zhiyu Zhang, Lei Wang,
  Dongliang Wang, Yanwei Ma","Superconductivity of powder-in-tube Sr0.6K0.4Fe2As2 wires","15 pages, 6 figures","Physica C 469 (2009) 717-720","10.1016/j.physc.2009.03.008",,"cond-mat.supr-con","http://arxiv.org/licenses/nonexclusive-distrib/1.0/","  Nb-sheathed Sr0.6K0.4Fe2As2 superconducting wires have been fabricated using
the powder-in-tube (PIT) method for the first time and the superconducting
properties of the wires have been investigated. The transition temperature (Tc)
of the Sr0.6K0.4Fe2As2 wires is confirmed to be as high as 35.3 K. Most
importantly, Sr0.6K0.4Fe2As2 wires exhibit a very weak Jc-field dependence
behavior even the temperature is very close to Tc. The upper critical field
Hc2(0) value can exceed 140 T, surpassing those of MgB2 and all the low
temperature superconductors. Such high Hc2 and superior Jc-field performance
make the 122 phase SrKFeAs wire conductors a powerful competitor potentially
useful in very high field applications.
","[{""version"":""v1"",""created"":""Thu, 22 Jan 2009 05:50:16 GMT""}]","2015-05-13"
"0901.3411","Seng Ghee Tan","S. G. Tan, M. B. A. Jalil, Takashi Fujita","Monopole and Topological Electron Dynamics in Adiabatic Spintronic and
  Graphene Systems","21 pages",,"10.1016/j.aop.2010.04.007",,"quant-ph cond-mat.mes-hall","http://arxiv.org/licenses/nonexclusive-distrib/1.0/","  A unified theoretical treatment is presented to describe the physics of
electron dynamics in semiconductor and graphene systems. Electron spin fast
alignment with the Zeeman magnetic field (physical or effective) is treated as
a form of adiabatic spin evolution which necessarily generates a monopole in
magnetic space. One could transform this monopole into the physical and
intuitive topological magnetic fields in the useful momentum (K) or real spaces
(R). The physics of electron dynamics related to spin Hall, torque,
oscillations and other technologically useful spinor effects can be inferred
from the topological magnetic fields in spintronic, graphene and other SU(2)
systems.
","[{""version"":""v1"",""created"":""Thu, 22 Jan 2009 06:15:36 GMT""}]","2015-05-13"
"0901.3412","Sunandan Gangopadhyay","Joseph Ben Geloun, Sunandan Gangopadhyay, Frederik G Scholtz","Harmonic oscillator in a background magnetic field in noncommutative
  quantum phase-space","7 pages Latex","Europhys.Lett.86:51001,2009","10.1209/0295-5075/86/51001",,"hep-th","http://arxiv.org/licenses/nonexclusive-distrib/1.0/","  We solve explicitly the two-dimensional harmonic oscillator and the harmonic
oscillator in a background magnetic field in noncommutative phase-space without
making use of any type of representation. A key observation that we make is
that for a specific choice of the noncommutative parameters, the time reversal
symmetry of the systems get restored since the energy spectrum becomes
degenerate. This is in contrast to the noncommutative configuration space where
the time reversal symmetry of the harmonic oscillator is always broken.
","[{""version"":""v1"",""created"":""Thu, 22 Jan 2009 14:25:28 GMT""}]","2009-08-03"
"0901.3413","Shang-Yung Wang","Chung Ngoc Leung, Shang-Yung Wang","Is there a maximum magnetic field in QED?","5 pages, 2 figures, to appear in Phys. Lett. B","Phys.Lett.B674:344-347,2009","10.1016/j.physletb.2009.03.039",,"hep-th astro-ph.HE hep-ph","http://arxiv.org/licenses/nonexclusive-distrib/1.0/","  It was recently conjectured by Shabad and Usov that there exists in QED a
maximum magnetic field of 10^{42} G, above which the magnetized vacuum becomes
unstable. Using a nonperturbative analysis that consistently incorporates the
effective electron mass and the screening effect in a strong magnetic field, we
show that the conjectured phenomenon of positronium collapse never takes place.
Thus, there does not exist a maximum magnetic field in QED and the magnetized
vacuum is stable for all values of the magnetic field.
","[{""version"":""v1"",""created"":""Thu, 22 Jan 2009 07:19:46 GMT""},{""version"":""v2"",""created"":""Mon, 30 Mar 2009 06:05:22 GMT""}]","2009-12-04"
"0901.3415","Deanna Matthews","D. Matthews, L. Staveley-Smith, P.Dyson, E. Muller","Cool Gas in the Magellanic Stream",,"Astrophys.J.691:L115-L118,2009","10.1088/0004-637X/691/2/L115",,"astro-ph.GA astro-ph.CO","http://arxiv.org/licenses/nonexclusive-distrib/1.0/","  We present the first direct detection of cold atomic gas in the Magellanic
Stream, through 21 cm line absorption toward a background radio source, J0119 -
6809, using the Australia Telescope Compact Array. Two absorption components
were identified at heliocentric velocities 218.6 km/s and 227.0 km/s, with
optical depths of tau ~ 0.02. The corresponding H I emission region has a
column density in excess of 2 x 10^20 cm^{-2}. The inferred spin temperature of
the emitting gas is ~70 K. We failed to find cool gas in observations of three
other radio continuum sources. Although we have definitively detected cool gas
in the Stream, its spin temperature is higher than similar components in the
LMC, SMC and Bridge, and its contribution to the total H I density is probably
lower. No corresponding 12CO(J = 1 -> 0) or dust appears to be associated with
the cool gas, suggesting that the cloud is not forming stars.
","[{""version"":""v1"",""created"":""Thu, 22 Jan 2009 06:44:04 GMT""}]","2011-02-11"
"0901.3416","Chris Parker","Chris Parker, Gernot Stroth","On strongly $p$-embedded subgroups of Lie rank 2","9 pages",,,,"math.GR","http://arxiv.org/licenses/nonexclusive-distrib/1.0/","  Suppose that $p$ is a prime, $G$ is a finite group and $H$ is a strongly
$p$-embedded subgroup in $G$. We consider the possibility that $F^*(H)$ is a
simple group of Lie rank 2 defined in characteristic $p$.
","[{""version"":""v1"",""created"":""Thu, 22 Jan 2009 07:02:04 GMT""}]","2009-01-23"
"0901.3417","Tinggui Wang","T. G. Wang (USTC), H. Y. Zhou (USTC & Mpe), D. Grupe (PSU), W. M. Yuan
  (YNAO), X. B. Dong (USTC) and H. L. Lu (USTC)","X-ray Absorption and Optical Extinction in the Partially Obscured
  Seyfert Nucleus in Mrk 1393","25 pages, 5 figures, accepted to AJ",,"10.1088/0004-6256/137/4/4002",,"astro-ph.CO astro-ph.GA","http://arxiv.org/licenses/nonexclusive-distrib/1.0/","  We present a detailed study of the X-ray and optical spectra of the luminous
Seyfert galaxy Mrk 1393, which revealed variable partial obscuration of the
active nucleus. The X-ray spectra obtained by XMM-Newton and Swift show
moderate absorption with a column density around 3x10^21 cm^-2, consistent with
a dust-reddening interpretation of the steep Balmer decrement seen in recent
optical spectra. The X-ray flux in the 0.5 to 2 keV band during the XMM-Newton
observation in 2005 and Swift observation in 2006 was a factor 6 brighter than
that of the ROSAT All Sky Survey in 1991. In the past 4 years, the broad
H\alpha line brightened by a factor of 4 accompanied by a decrease in the
Balmer decrement. A comparison with literature spectra reveals variations in
the dust extinction on time scales of several years, suggesting that the
obscuring material is very close to the active nucleus. These observations
indicate that a dust-to-gas ratio as high as the Galactic value can be present
in moderately thick gas in the vicinity of the central engine within a few
parsecs. We suggest that the obscuring material may be debris disrupted from
the dusty torus.
","[{""version"":""v1"",""created"":""Thu, 22 Jan 2009 07:02:35 GMT""}]","2009-11-13"
"0901.3418","Meta van Faassen","Meta van Faassen and Kieron Burke","Time-dependent density functional theory of high excitations: To
  infinity, and beyond","Resubmitted version, Changed acknowledgments, 17 pages including
  supplementary table, submitted to PCCP themed issue on time-dependent
  density-functional theory",,"10.1039/b901402k",,"cond-mat.other","http://arxiv.org/licenses/nonexclusive-distrib/1.0/","  We review the theoretical background for obtaining both quantum defects and
scattering phase shifts from time-dependent density functional theory. The
quantum defect on the negative energy side of the spectrum and the phase shift
on the positive energy side merge continuously at E=0, allowing both to be
found by the same method. We illustrate with simple one-dimensional examples:
the spherical well and the delta well potential. As an example of a real
system, we study in detail elastic electron scattering from the He${}^{+}$ ion.
We show how the results are influenced by different approximations to the
unknown components in (time-dependent) density functional theory: the ground
state exchange-correlation potential and time-dependent kernel. We also revisit
our previously obtained results for $e$-H scattering. Our results are
remarkably accurate in may cases, but fail qualitatively in others.
","[{""version"":""v1"",""created"":""Thu, 22 Jan 2009 07:15:18 GMT""},{""version"":""v2"",""created"":""Mon, 2 Feb 2009 08:27:04 GMT""},{""version"":""v3"",""created"":""Wed, 11 Feb 2009 09:25:18 GMT""}]","2019-03-27"
