"0908.4173","Alexander Barabash S.","A.S. Barabash","Average and recommended half-life values for two neutrino double beta
  decay: upgrade-09","10 pages; talk at Matrix Elements for the Double-beta-decay
  Experiments (MEDEX'09), Prague, Czech Republic, June 15-19, 2009","AIP Conf.Proc.1180:6-15,2009","10.1063/1.3266106",,"nucl-ex","http://arxiv.org/licenses/nonexclusive-distrib/1.0/","  All existing ``positive'' results on two neutrino double beta decay in
different nuclei were analyzed. Using the procedure recommended by the Particle
Data Group, weighted average values for half-lives of $^{48}$Ca, $^{76}$Ge,
$^{82}$Se, $^{96}$Zr, $^{100}$Mo, $^{100}$Mo - $^{100}$Ru ($0^+_1$),
$^{116}$Cd, $^{130}$Te, $^{150}$Nd, $^{150}$Nd - $^{150}$Sm ($0^+_1$) and
$^{238}$U were obtained. Existing geochemical data were analyzed and
recommended values for half-lives of $^{128}$Te, $^{130}$Te and $^{130}$Ba are
proposed. We recommend the use of these results as presently the most precise
and reliable values for half-lives.
","[{""version"":""v1"",""created"":""Fri, 28 Aug 2009 09:56:15 GMT""}]","2009-11-18"
"0908.4174","Leandro Filipe Gomes de Jesus","Leandro F. Gomes de Jesus and Boris V. Gudiksen","Photospheric Motions and Their Effects on the Corona: a Numerical
  Approach","11 pages with 13 figures, accepted for publication in The
  Astrophysical Journal","Astrophys.J.704:705-714,2009","10.1088/0004-637X/704/1/705",,"astro-ph.SR","http://arxiv.org/licenses/nonexclusive-distrib/1.0/","  We perform a number of numerical simulations of the solar corona with the aim
to understand how it responds to different conditions in the photosphere. By
changing parameters which govern the motion of the plasma at the photosphere we
study the behavior of the corona, in particular, the effects on the current
density generated. An MHD code is used to run simulations, using a 20x20x20
Mm^3 box with time spans ranging from one hundred to several hundreds of
minutes. All the experiments show a fast initial increase of the current
density, followed by a stabilization around an asymptotic value which depends
on the photospheric conditions. These asymptotic average current densities as
well as the turn-over points are discussed.
","[{""version"":""v1"",""created"":""Fri, 28 Aug 2009 11:37:18 GMT""}]","2014-11-20"
"0908.4175","Eisterer Michael","M. Eisterer, R. Fuger, M. Chudy, F. Hengstberger, H. W. Weber","Neutron irradiation of coated conductors",,"Supercond. Sci. Technol. 23 (2010) 014009","10.1088/0953-2048/23/1/014009",,"cond-mat.supr-con","http://arxiv.org/licenses/nonexclusive-distrib/1.0/","  Various commercial coated conductors were irradiated with fast neutrons in
order to introduce randomly distributed, uncorrelated defects which increase
the critical current density, Jc, in a wide temperature and field range. The
Jc-anisotropy is significantly reduced and the angular dependence of Jc does
not obey the anisotropic scaling approach. These defects enhance the
irreversibility line in not fully optimized tapes, but they do not in
state-of-the-art conductors. Neutron irradiation provides a clear distinction
between the low field region, where Jc is limited by the grain boundaries, and
the high field region, where depinning leads to dissipation.
","[{""version"":""v1"",""created"":""Fri, 28 Aug 2009 09:57:02 GMT""}]","2015-05-14"
"0908.4176","Vallery Stanishev","V. Stanishev, A. Goobar, K. Paech, R. Amanullah, T. Dahl\'en, J.
  J\""onsson, J. P. Kneib, C. Lidman, M. Limousin, E. M\""ortsell, S. Nobili, J.
  Richard, T. Riehm, M. von Strauss","Near-IR search for lensed supernovae behind galaxy clusters: I.
  Observations and transient detection efficiency","Language-edited version, 9 pages, 6 figures, accepted by A&A",,"10.1051/0004-6361/200911982",,"astro-ph.CO","http://arxiv.org/licenses/nonexclusive-distrib/1.0/","  Massive galaxy clusters at intermediate redshift can magnify the flux of
distant background sources by several magnitudes and we exploit this effect to
search for lensed distant supernovae that may otherwise be too faint to be
detected. A supernova search was conducted at near infrared wavelengths using
the ISAAC instrument at the VLT. The galaxy clusters Abell 1689, Abell 1835 and
AC114 were observed at multiple epochs of 2 hours of exposure time, separated
by a month. Image-subtraction techniques were used to search for transient
objects with light curve properties consistent with supernovae, both in our new
and archival ISAAC/VLT data. The limiting magnitude of the individual epochs
was estimated by adding artificial stars to the subtracted images. Most of the
epochs reach 90% detection efficiency at SZ(J) ~= 23.8-24.0 mag (Vega). Two
transient objects, both in archival images of Abell 1689 and AC114, were
detected. The transient in AC114 coincides - within the position uncertainty -
with an X-ray source and is likely to be a variable AGN at the cluster
redshift. The transient in Abell 1689 was found at SZ=23.24 mag, ~0.5 arcsec
away from a galaxy with photometric redshift z=0.6 +/-0.15. The light curves
and the colors of the transient are consistent with a reddened Type IIP
supernova at redshift z=0.59 +/- 0.05. The lensing model of Abell 1689 predicts
~1.4 mag of magnification at the position of the transient, making it the most
magnified supernova ever found and only the second supernova found behind a
galaxy cluster. Our pilot survey has demonstrated the feasibility to find
distant gravitationally magnified supernovae behind massive galaxy clusters.
One likely supernova was found behind Abell 1689, in accordance with the
expectations for this survey, as shown in an accompanying analysis paper.
","[{""version"":""v1"",""created"":""Fri, 28 Aug 2009 09:57:06 GMT""},{""version"":""v2"",""created"":""Thu, 3 Sep 2009 07:00:22 GMT""}]","2015-05-14"
"0908.4177","Vincent Pilaud","Benjamin Matschke, Julian Pfeifle, and Vincent Pilaud","Prodsimplicial-Neighborly Polytopes","28 pages, 9 figures; minor corrections","Discrete Comput. Geom., 46(1):100-131, 2011","10.1007/s00454-010-9311-y",,"math.MG math.CO","http://arxiv.org/licenses/nonexclusive-distrib/1.0/","  Simultaneously generalizing both neighborly and neighborly cubical polytopes,
we introduce PSN polytopes: their k-skeleton is combinatorially equivalent to
that of a product of r simplices. We construct PSN polytopes by three different
methods, the most versatile of which is an extension of Sanyal and Ziegler's
""projecting deformed products"" construction to products of arbitrary simple
polytopes. For general r and k, the lowest dimension we achieve is 2k+r+1.
Using topological obstructions similar to those introduced by Sanyal to bound
the number of vertices of Minkowski sums, we show that this dimension is
minimal if we additionally require that the PSN polytope is obtained as a
projection of a polytope that is combinatorially equivalent to the product of r
simplices, when the dimensions of these simplices are all large compared to k.
","[{""version"":""v1"",""created"":""Fri, 28 Aug 2009 13:43:55 GMT""},{""version"":""v2"",""created"":""Wed, 8 Sep 2010 10:15:00 GMT""}]","2022-03-25"
"0908.4178","Luca Fabbri","Luca Fabbri","Geometrical Properties and Propagation for the Proca Field Theory","6 pages","Annales Fond.Broglie 36:19-28,2011",,,"gr-qc","http://arxiv.org/licenses/nonexclusive-distrib/1.0/","  We consider the Proca field with dynamical term given by the exterior
derivative with respect to the most general connection; the most general Proca
field equations are given, and a discussion about the propagation and the
geometrical properties are presented: it is shown that this generalization is
inconsistent. So the standard theory is already the most general Proca Theory
possible.
","[{""version"":""v1"",""created"":""Fri, 28 Aug 2009 10:18:07 GMT""}]","2012-12-06"
"0908.4179","Yves Wiaux","Y. Wiaux, G. Puy, P. Vandergheynst","Compressed sensing reconstruction of a string signal from
  interferometric observations of the cosmic microwave background","11 pages, 6 figures. Version 2 matches version accepted for
  publication in MNRAS. Changes include minor clarifications","Mon. Not. Roy. Astron. Soc. 402 (2010) 2626-2636","10.1111/j.1365-2966.2009.16079.x",,"astro-ph.CO astro-ph.IM","http://arxiv.org/licenses/nonexclusive-distrib/1.0/","  We propose an algorithm for the reconstruction of the signal induced by
cosmic strings in the cosmic microwave background (CMB), from
radio-interferometric data at arcminute resolution. Radio interferometry
provides incomplete and noisy Fourier measurements of the string signal, which
exhibits sparse or compressible magnitude of the gradient due to the
Kaiser-Stebbins (KS) effect. In this context the versatile framework of
compressed sensing naturally applies for solving the corresponding inverse
problem. Our algorithm notably takes advantage of a model of the prior
statistical distribution of the signal fitted on the basis of realistic
simulations. Enhanced performance relative to the standard CLEAN algorithm is
demonstrated by simulated observations under noise conditions including primary
and secondary CMB anisotropies.
","[{""version"":""v1"",""created"":""Fri, 28 Aug 2009 10:20:45 GMT""},{""version"":""v2"",""created"":""Fri, 20 Nov 2009 18:06:59 GMT""}]","2015-05-14"
"0908.4180","Cyrille Marquet","C. Marquet and B. Wu","Exclusive vs. diffractive vector meson production in DIS at small x or
  off nuclei","5 pages, 1 figure, Proceedings of the XVIIth International Workshop
  on Deep Inelastic Scattering (DIS09), Madrid, Spain, April 26-30 2009",,,,"hep-ph","http://arxiv.org/licenses/nonexclusive-distrib/1.0/","  The diffractive production of vector mesons in deep inelastic scattering
(DIS) is calculated in the McLerran-Venugopalan model. This is relevant when
large parton densities are probed by the virtual photon, as is the case at
small Bjorken x or in DIS off nuclei. We investigate differences between the
exclusive production (when the target doesn't break up) which dominates at
small momentum transfer squared |t|, and the diffractive production (when the
target scatters inelastically) which dominates at large |t|.
","[{""version"":""v1"",""created"":""Fri, 28 Aug 2009 10:22:55 GMT""}]","2009-08-31"
"0908.4181","Guy Bensky","Guy Bensky, D. D. Bhaktavatsala Rao, Goren Gordon, David
  Gelbwaser-Klimovsky, Noam Erez, Gershon Kurizki","Non-Markovian control of qubit thermodynamics by frequent quantum
  measurements","8 pages, 9 figures","Physica E 42, 477 (2010)","10.1016/j.physe.2009.06.029",,"quant-ph","http://arxiv.org/licenses/nonexclusive-distrib/1.0/","  We explore the effects of frequent, impulsive quantum nondemolition
measurements of the energy of two-level systems (TLS), alias qubits, in contact
with a thermal bath. The resulting entropy and temperature of both the system
and the bath are found to be completely determined by the measurement rate, and
unrelated to what is expected by standard thermodynamical rules that hold for
Markovian baths. These anomalies allow for very fast control of heating,
cooling and state-purification (entropy reduction) of qubits, much sooner than
their thermal equilibration time.
","[{""version"":""v1"",""created"":""Fri, 28 Aug 2009 10:23:03 GMT""}]","2012-02-16"
"0908.4182","Roman Zwicky","Roman Zwicky and Thomas Fischbacher","On discrete Minimal Flavour Violation","25 pages (15 pages main text) added reference and edited appendix
  A.2.1. concerning (C) & (D) groups","Phys.Rev.D80:076009,2009","10.1103/PhysRevD.80.076009","SHEP 09-16","hep-ph","http://arxiv.org/licenses/nonexclusive-distrib/1.0/","  We investigate the consequences of replacing the global flavour symmetry of
Minimal Flavour Violation (MFV) SU(3)_QxSU(3)_UxSU(3)_Dx..., by a discrete
D_QxD_UxD_Dx.. symmetry. Goldstone bosons resulting from the breaking of the
flavour symmetry generically lead to bounds on new flavour structure many
orders of magnitude above the TeV-scale. The absence of Goldstone bosons for
discrete symmetries constitute the \emph{primary} motivation of our work. Less
symmetry implies further invariants and renders the mass flavour basis
transformation observable in principle and calls for a hierarchy in the Yukawa
matrix expansion. We show, through the dimension of the representations, that
the (discrete) symmetry in principle does allow for additional Delta F = 2
operators. If though the Delta F = 2 transitions are generated by two
subsequent Delta F = 1 processes, as for example in the Standard Model, then
the four crystal-like groups Sigma(168) ~ PSL(2,7), Sigma(72phi), Sigma(216phi)
and especially Sigma(360phi) do provide enough protection for a TeV-scale
discrete MFV scenario. Models where this is not the case have to be
investigated case by case. Interestingly Sigma(216phi) has a (non-faithful)
representation corresponding to an A4-symmetry. Moreover we argue that the,
apparently often omitted, (D)-groups are subgroups of an appropriate
Delta(6g^2). We would like to stress that we do not provide an actual model
that realizes the MFV scenario nor any other theory of flavour.
","[{""version"":""v1"",""created"":""Fri, 28 Aug 2009 10:37:47 GMT""},{""version"":""v2"",""created"":""Mon, 5 Oct 2009 19:03:03 GMT""},{""version"":""v3"",""created"":""Thu, 17 Jun 2010 13:18:28 GMT""},{""version"":""v4"",""created"":""Thu, 20 Jan 2011 15:16:15 GMT""}]","2011-01-21"
"0908.4183","\'Oscar Maci\'a","Oscar Macia","A Nearly Quaternionic Structure on SU(3)",,"Journal of Geometry and Physics 60 (2010), pp. 791-798","10.1016/j.geomphys.2010.01.009",,"math.DG","http://arxiv.org/licenses/nonexclusive-distrib/1.0/","  It is shown that the compact Lie group SU(3) admits an Sp(2)Sp(1)-structure
whose distinguished 2-forms $\omega_1,\omega_2,\omega_3$ span a differential
ideal. This is achieved by first reducing the structure further to a subgroup
isomorphic to SO(3).
","[{""version"":""v1"",""created"":""Fri, 28 Aug 2009 10:28:50 GMT""}]","2010-04-02"
"0908.4184","Eliecer Hernandez-Gajate","J.E. Amaro, E. Hern\'andez, J. Nieves, M. Valverde, M.J. Vicente-Vacas","Neutrino induced weak pion production off the nucleon and coherent pion
  production in nuclei at low energies","Talk given at the NUINT09 Conference. 6 latex pages, 4 figures","AIP Conf.Proc.1189:224-229,2009","10.1063/1.3274160",,"hep-ph","http://arxiv.org/licenses/nonexclusive-distrib/1.0/","  We present a microscopic model for neutrino induced one-pion production off
the nucleon and its implementation for the purpose of calculating coherent pion
production in nuclei.
  We further criticize the use of the Rein--Sehgal model for coherent pion
production by low energy neutrinos. In particular, we show how the
approximations in that model give rise to a much flatter differential cross
section in the $\eta=E_\pi(1-\cos\theta_\pi)$ variable. We discuss the
limitations intrinsic to any approach based on the partial conservation of the
axial current hypothesis and the inability of such models to properly determine
the angular distribution of the outgoing pion with respect to the direction of
the incoming neutrino. We show the effects of those limitation for the case of
the $\frac{d\sigma}{d\eta}$ differential cross section.
","[{""version"":""v1"",""created"":""Fri, 28 Aug 2009 10:33:03 GMT""}]","2009-12-07"
"0908.4185","Andrea Miglio","S. Salmon, J. Montalban, A. Miglio, T. Morel, M.-A. Dupret, A. Noels","The Enigma of B-type Pulsators in the SMC","3 pages, 3 figures, proceeding for ""Stellar Pulsation: Challenges for
  Theory and Observation"", Santa Fe 2009","AIP Conf.Proc.1170:385-387,2009","10.1063/1.3246521",,"astro-ph.SR","http://arxiv.org/licenses/nonexclusive-distrib/1.0/","  Since the early nineties it is accepted that the excitation mechanism of
B-type pulsators on the main sequence is due to the opacity peak in the
iron-group elements at $T\approx 200,000$ K. The Fe content plays then a major
role in the excitation of $\beta$ Cep and SPB pulsations. While theoretical
non-adiabatic computations predict no $\beta$ Cep pulsators and only a small
number of SPBs for low metallicity environments such as that of the Magellanic
Clouds (MCs), recent variability surveys of B stars in the SMC have reported
the detection of a significant number of SPB and $\beta$ Cep candidates. Since
the SMC is the metal poorest (Z$\approx$0.001-0.004) of the MCs, it constitutes
an interesting object for investigating the disagreement between theory and
observations. We approach the problem by calling into question some of the
hypotheses made in previous studies: given the different chemical evolution of
the SMC compared with our local galactic environment, is it appropriate to
describe the chemical composition of SMC B stars by scaling the solar mixture
to lower $Z$? Is that composition uniform in space and time? In this paper we
present the results of a stability analysis of B-type stellar models computed
with a revised chemical composition and metallicity specific to the SMC.
","[{""version"":""v1"",""created"":""Fri, 28 Aug 2009 10:41:41 GMT""}]","2014-11-20"
"0908.4186","Constantine Thanassoulas","C. Thanassoulas, V. Klentos, G. Verveniotis, N. Zymaris","Seismic electric precursors observed prior to the 6.3R EQ of July 1st
  2009, Greece and their use in short-term earthquake prediction","25 figures, 14 pages, http://www.earthquakeprediction.gr",,,,"physics.geo-ph","http://arxiv.org/licenses/nonexclusive-distrib/1.0/","  The normalized raw data of the Earth's electric field, monitored at PYR, ATH,
HIO monitoring sites in Greece, are studied as far as it concerns the presence
of electric seismic precursors. Electric preseismic pulses, plateau-like
anomalous electric field and Very Long Period (VLP) anomalies were detected
prior to the occurrence of the July 1st, 2009 large (Ms = 6.3R) EQ in Greece.
Further processing of the same data revealed the true form of the generated
preseimic potential thus providing an indirect estimation of the time window of
the occurrence of the large EQ. Finally, by correlating, at pairs, the
anomalous electric field from all monitoring sites it is possible to calculate
the ""strange attractor like"" seismic electric precursor that provides a time
window for the occurrence of the large EQ and utilizes the determination not
only of the regional seismogenic area that has been activated but also a more
precise epicenter too.
","[{""version"":""v1"",""created"":""Fri, 28 Aug 2009 10:44:39 GMT""}]","2009-08-31"
"0908.4187","Orlov Dmitri","Valery A. Lunts, Dmitri O. Orlov","Uniqueness of enhancement for triangulated categories","LATEX, 56 pages. A few minor errors were corrected. Appendix B was
  added","J. Amer. Math. Soc. 23 (2010), 3, 853--908","10.1090/S0894-0347-10-00664-8",,"math.AG math.CT","http://arxiv.org/licenses/nonexclusive-distrib/1.0/","  The paper contains general results on the uniqueness of a DG enhancement for
triangulated categories. As a consequence we obtain such uniqueness for the
unbounded categories of quasi-coherent sheaves, for the triangulated categories
of perfect complexes, and for the bounded derived categories of coherent
sheaves on quasi-projective schemes. If a scheme is projective then we also
prove a strong uniqueness for the triangulated category of perfect complexes
and for the bounded derived categories of coherent sheaves. These results
directly imply that fully faithful functors from the bounded derived categories
of coherent sheaves and the triangulated categories of perfect complexes on
projective schemes can be represented by objects on the product.
","[{""version"":""v1"",""created"":""Fri, 28 Aug 2009 11:08:04 GMT""},{""version"":""v2"",""created"":""Fri, 6 Nov 2009 13:24:56 GMT""},{""version"":""v3"",""created"":""Mon, 23 Nov 2009 18:32:41 GMT""},{""version"":""v4"",""created"":""Mon, 30 Nov 2009 01:13:13 GMT""},{""version"":""v5"",""created"":""Mon, 14 Dec 2009 21:08:05 GMT""}]","2012-09-18"
"0908.4188","R Doomun","Suman Saha","Consideration Points Detecting Cross-Site Scripting","8 Pages IEEE format, International Journal of Computer Science and
  Information Security, IJCSIS 2009, ISSN 1947 5500, Impact Factor 0.423,
  http://sites.google.com/site/ijcsis/","International Journal of Computer Science and Information
  Security, IJCSIS, Vol. 4, No. 1 & 2, August 2009, USA",,"ISSN 1947 5500","cs.CR cs.PL","http://arxiv.org/licenses/nonexclusive-distrib/1.0/","  Web application (WA) expands its usages to provide more and more services and
it has become one of the most essential communication channels between service
providers and the users. To augment the users experience many web applications
are using client side scripting languages such as JavaScript but this growing
of JavaScript is increasing serious security vulnerabilities in web application
too, such as cross site scripting (XSS). In this paper, I survey all the
techniques those have been used to detect XSS and arrange a number of analyses
to evaluate performances of those methodologies. This paper points major
difficulties to detect XSS. I do not implement any solution of this
vulnerability problem because my focus is for reviewing this issue. But, I
believe that this assessment will be cooperative for further research on this
concern as this treatise figure out everything on this transcendent security
problem.
","[{""version"":""v1"",""created"":""Fri, 28 Aug 2009 11:01:27 GMT""}]","2009-08-31"
"0908.4189","Ho-Ung Yee","Ho-Ung Yee","Holographic Chiral Magnetic Conductivity","30 pages, 10 figs. v2: references and acknowledgment updated, v3:
  references added, v4: discussion on proper definition of currents added",,"10.1088/1126-6708/2009/11/085","IC/2009/066","hep-th hep-ph nucl-th","http://arxiv.org/licenses/nonexclusive-distrib/1.0/","  We present holographic computations of the time-dependent chiral magnetic
conductivity in the framework of gauge/gravity correspondence. Chiral magnetic
effect is a phenomenon where an electromagnetic current parallel to an applied
magnetic field is induced in the presence of a finite axial chemical potential.
Motivated by a recent weak-coupling perturbative QCD calculation, our aim is to
provide a couple of complementary computations for strongly coupled regime
which might be relevant for strongly coupled RHIC plasma. We take two
prototypical holographic set-ups for computing chiral magnetic conductivity;
the first model is Einstein gravity with U(1)_L X U(1)_R Maxwell theory, and
our second set-up is based on the Sakai-Sugimoto model in a deconfined and
chiral symmetry restored phase. While the former takes into account full
back-reaction while the latter not, the common feature is an important role
played by the appropriate 5-dimensional Chern-Simons term corresponding to the
4-dimensional axial anomaly.
","[{""version"":""v1"",""created"":""Fri, 28 Aug 2009 13:41:53 GMT""},{""version"":""v2"",""created"":""Thu, 3 Sep 2009 09:58:11 GMT""},{""version"":""v3"",""created"":""Tue, 22 Sep 2009 12:05:36 GMT""},{""version"":""v4"",""created"":""Wed, 18 Nov 2009 13:13:35 GMT""}]","2015-05-14"
"0908.4190","Basil Sa'd","Basil A. Sa'd, J\""urgen Schaffner-Bielich","Dissipation of radial oscillations in compact stars","4 pages V(2,3) Some minor changes in the text, new references added",,,,"astro-ph.SR hep-ph","http://arxiv.org/licenses/nonexclusive-distrib/1.0/","  We demonstrate that there exists a new mechanism for dissipating the energy
of stellar oscillations. For neutron stars, in particular, we show that the
mechanical energy of density perturbations is not only dissipated to heat via
bulk viscosity, but also that energy is radiated away via neutrinos. This
energy dissipation will be associated with a viscosity coefficient, the
radiative viscosity, which is larger than the bulk viscosity in the case of
non-strange quark matter and nuclear matter.
","[{""version"":""v1"",""created"":""Fri, 28 Aug 2009 11:09:43 GMT""},{""version"":""v2"",""created"":""Wed, 5 May 2010 12:45:48 GMT""},{""version"":""v3"",""created"":""Wed, 23 Jun 2010 10:24:15 GMT""}]","2010-06-24"
"0908.4191","Wolfgang Schmid","A. Geroldinger, D. J. Grynkiewicz, G. J. Schaeffer, W. A. Schmid","On the arithmetic of Krull monoids with infinite cyclic class group",,,,,"math.AC","http://arxiv.org/licenses/nonexclusive-distrib/1.0/","  Let $H$ be a Krull monoid with infinite cyclic class group $G$ and let $G_P
\subset G$ denote the set of classes containing prime divisors. We study under
which conditions on $G_P$ some of the main finiteness properties of
factorization theory--such as local tameness, the finiteness and rationality of
the elasticity, the structure theorem for sets of lengths, the finiteness of
the catenary degree, and the existence of monotone and of near monotone chains
of factorizations--hold in $H$. In many cases, we derive explicit
characterizations.
","[{""version"":""v1"",""created"":""Fri, 28 Aug 2009 11:22:34 GMT""}]","2009-08-31"
"0908.4192","D Skryabin","C. Milian, D.V. Skryabin, A. Ferrando","Continuum generation by dark solitons",,"Optics Letters., July, 2009. Vol. 14, pp. 2096-2098","10.1364/OL.34.002096",,"physics.optics","http://arxiv.org/licenses/nonexclusive-distrib/1.0/","  We demonstrate that the dark soliton trains in optical fibers with a zero of
the group velocity dispersion can generate broad spectral distribution
(continuum) associated with the resonant dispersive radiation emitted by
solitons. This radiation is either enhanced or suppressed by the Raman
scattering depending on the sign of the third order dispersion.
","[{""version"":""v1"",""created"":""Fri, 28 Aug 2009 11:20:10 GMT""}]","2015-05-14"
