"0908.4076","Manda Riehl","Sergey Kitaev, Andrew Niedermaier, Jeffrey Remmel, Manda Riehl","New pattern matching conditions for wreath products of the cyclic groups
  with symmetric groups","Results presented at Permutation Patterns 2009",,,,"math.CO","http://arxiv.org/licenses/nonexclusive-distrib/1.0/","  We present several multi-variable generating functions for a new pattern
matching condition on the wreath product of the cyclic group and the symmetric
group. Our new pattern matching condition requires that the underlying
permutations match in the usual sense of pattern matching for the symmetric
group and that the corresponding sequence of signs match in the sense of words,
rather than the exact equality of signs which has been previously studied. We
produce the generating functions for the number of matches that occur in
elements of the wreath product for any pattern of length 2 by applying
appropriate homomorphisms from the ring of symmetric functions over an infinite
number of variables to simple symmetric function identities. We also provide
multi-variable generating functions for the distribution of non-overlapping
matches and for the number of elements of the wreath product which have exactly
2 matches which do not overlap for several patterns of length 2.
","[{""version"":""v1"",""created"":""Thu, 27 Aug 2009 19:39:56 GMT""}]","2009-08-28"
"0908.4077","David Chernoff","David F. Chernoff","Clustering of Superstring Loops",,,,,"astro-ph.CO gr-qc hep-ph hep-th","http://arxiv.org/licenses/nonexclusive-distrib/1.0/","  The fragmentation of horizon crossing superstrings creates loops that accrete
and bind to collapsing matter perturbations if the string tension is less than
a critical value and if the loops are large-scale. For typical model parameters
(velocity dispersion of newly formed loops, loop length distribution, etc.) the
galactic loop density is greatly enhanced as compared to the universe's mean
loop density. The limiting enhancement of loop (energy) density is 0.25-0.4
times the enhancement of cold dark matter (ratio of galaxy to universe's dark
matter densities) and is fully achieved for dimensionless string tensions less
than 10^-13 at galactic scales less than 100 kpc. The enhancement is
substantial for any tension less than the critical value which is of order
10^-9. The fact that the string loop enhancement roughly tracks that of cold
dark matter is a robust result for small tension and large-scale fragmentation.
Experiments sensitive to the local Galactic population of loops, especially
microlensing, should enjoy characteristic detection rates greatly boosted over
homogeneous estimates.
","[{""version"":""v1"",""created"":""Thu, 27 Aug 2009 21:01:00 GMT""}]","2009-09-01"
"0908.4079","Tomotsugu Goto","Tomotsugu Goto (ifa, University of Hawaii), Yousuke Utsumi, Hisanori
  Furusawa, Satoshi Miyazaki, Yutaka Komiyama (NAOJ)","A QSO host galaxy and its Lyalpha emission at z=6.43","Accepted for publication in MNRAS. A higher resolution pdf is at
  http://ifa.hawaii.edu/~tomo/QSOhost/QSOhost_v7.pdf",,"10.1111/j.1365-2966.2009.15486.x",,"astro-ph.CO","http://arxiv.org/licenses/nonexclusive-distrib/1.0/","  We report an optical detection of an extended structure around a QSO at
z=6.43 (CFHQSJ2329-0301, the highest redshift QSO currently known) in deep z'
and z_r-band images of the Subaru/Suprime-Cam. After a careful PSF (QSO)
subtraction, a structure in the z'-band extends more than 4'' on the sky
(R_e=11 kpc), and thus, is well-resolved (16sigma detection). The
PSF-subtracted z_r-band structure is in a similar shape to that in the z'-band,
but less significant with a 3 sigma detection. In the z'-band, a radial profile
of the QSO+host shows a clear excess over that of the averaged PSF in 0.8-3''
radius.
  Since the z'-band includes a Lya emission at z=6.43, the z' flux is perhaps a
mixture of the host (continuum light) and its Lya emission, whereas the
z_r-band flux is from the host. Through a SED modeling, we estimate 40% of the
PSF-subtracted z'-band light is from the host (continuum) and 60% is from Lya
emission. The absolute magnitude of the host is M_{1450}=-23.9 (c.f.
M_{1450}=-26.4 for the QSO). A lower limit of the SFR(Lya) is 1.6 Msun yr^{-1}
with stellar mass ranging 6.2 x 10^8 to 1.1 x 10^10 Msun when 100 Myrs of age
is assumed. The detection shows that a luminous QSO is already harbored by a
large, star-forming galaxy in the early Universe only after ~840 Myr after the
big bang. The host may be a forming giant galaxy, co-evolving with a super
massive black hole.
","[{""version"":""v1"",""created"":""Thu, 27 Aug 2009 20:00:13 GMT""}]","2015-05-14"
"0908.4081","Gennady Valyavin G","Hyun-Sook Kim, Inwoo Han, G. Valyavin, Byeong-Cheol Lee, V. Shimansky,
  G.A. Galazutdinov","Atlas of Vega: 3850 -- 6860 \AA","9 pages, 1 table, 4 figures, accepted to be published in The
  Publications of the Astronomical Society of the Pacific (PASP)",,"10.1086/606029",,"astro-ph.SR astro-ph.IM","http://arxiv.org/licenses/nonexclusive-distrib/1.0/","  We present a high resolving power ($\lambda$ / $\Delta\lambda$ = 90,000) and
high signal-to-noise ratio ($\sim$700) spectral atlas of Vega covering the 3850
-- 6860 \AA wavelength range. The atlas is a result of averaging of spectra
recorded with the aid of the echelle spectrograph BOES fed by the 1.8-m
telescope at Bohyunsan observatory (Korea). The atlas is provided only in
machine-readable form (electronic data file) and will be available in the
SIMBAD database upon publication.
","[{""version"":""v1"",""created"":""Thu, 27 Aug 2009 20:01:57 GMT""}]","2015-05-14"
"0908.4082","Pat Scott","Pat Scott (OKC/Stockholm U) and Sofia Sivertsson (OKC/KTH)","Gamma rays from ultracompact primordial dark matter minihalos","5 pages, 3 figures. Minor update to match published version of
  erratum","Phys.Rev.Lett.103:211301,2009; Erratum-ibid.105:119902,2010","10.1103/PhysRevLett.103.211301 10.1103/PhysRevLett.105.119902",,"astro-ph.CO astro-ph.HE hep-ph","http://arxiv.org/licenses/nonexclusive-distrib/1.0/","  Ultracompact minihalos have recently been proposed as a new class of dark
matter structure. These minihalos would be produced by phase transitions in the
early Universe or features in the inflaton potential, and constitute
non-baryonic massive compact halo objects (MACHOs) today. We examine the
prospect of detecting ultracompact minihalos in gamma-rays if dark matter
consists of self-annihilating particles. We compute present-day fluxes from
minihalos produced in the electron-positron annihilation epoch, and the QCD and
electroweak phase transitions in the early Universe. Even at a distance of 100
pc, minihalos produced during the electron-positron annihilation epoch should
be eminently detectable today, either by the Fermi satellite, current Air
Cherenkov telescopes, or even in archival EGRET data. Within ~1 pc, minihalos
formed in the QCD phase transition would have similar predicted fluxes to the
dwarf spheroidal galaxies targeted by current indirect dark matter searches, so
might also be detectable by present or upcoming experiments.
","[{""version"":""v1"",""created"":""Thu, 27 Aug 2009 20:02:12 GMT""},{""version"":""v2"",""created"":""Fri, 23 Oct 2009 15:55:52 GMT""},{""version"":""v3"",""created"":""Tue, 15 Jun 2010 16:39:04 GMT""},{""version"":""v4"",""created"":""Mon, 21 Jun 2010 10:42:03 GMT""},{""version"":""v5"",""created"":""Thu, 2 Sep 2010 16:20:39 GMT""}]","2014-11-20"
"0908.4083","Francisco Fontenele","Francisco Fontenele and Frederico Xavier","Good shadows, dynamics, and convex hulls","1 figure",,,,"math.DG","http://arxiv.org/licenses/nonexclusive-distrib/1.0/","  The Ekeland variational principle implies what can be regarded as a strong
version, in the $C^1$ category, of the Yau minimum principle: under the
appropriate hypotheses {\it every} minimizing sequence admits a {\it good
shadow}, a second minimizing sequence that has good properties and is
asymptotic to the original one. Using arguments from dynamical systems, we give
another proof of this result and also establish, with the aid of Gromov's
theorem on monotonicity of volume ratios, a special case of a conjecture
claiming the existence of good shadows in the original $C^2$ setting of the Yau
minimum principle. The interest in having an abundance of good shadows stems
from the fact that this is a desirable property if one wants to refine the
applications of the asymptotic minimum principle, as it allows for information
to be localized at infinity. These ideas are applied in this paper to the study
of the convex hulls of complete submanifolds of Euclidean $n$-space that have
controlled Grassmanian-valued Gauss maps.
","[{""version"":""v1"",""created"":""Thu, 27 Aug 2009 20:03:47 GMT""}]","2009-08-31"
"0908.4084","Lei Hao","Lei Hao, Yanling Wu, V. Charmandaris, H. W. W. Spoon, J.
  Bernard-Salas, D. Devost, V. Lebouteiller, and J. R. Houck","Probing the Excitation of Extreme Starbursts: High Resolution Mid-IR
  Spectroscopy of Blue Compact Dwarfs","15 pages, including 1 table and 14 figures. Accepted by ApJ",,"10.1088/0004-637X/704/2/1159",,"astro-ph.CO","http://arxiv.org/licenses/nonexclusive-distrib/1.0/","  We present an analysis of the mid-infrared emission lines for a sample of 12
low metallicity Blue Compact Dwarf (BCD) galaxies based on high resolution
observations obtained with Infrared Spectrograph on board the {\rm Spitzer}
Space Telescope. We compare our sample with a local sample of typical starburst
galaxies and active galactic nuclei (AGNs), to study the ionization field of
starbursts over a broad range of physical parameters and examine its difference
from the one produced by AGN. The high-ionization line [OIV]25.89$\mu$m is
detected in most of the BCDs, starbursts, and AGNs in our sample. We propose a
diagnostic diagram of the line ratios [OIV]25.89$\mu$m/[SIII]33.48$\mu$m as a
function of [NeIII]15.56$\mu$m/[NeII]12.81$\mu$m which can be useful in
identifying the principal excitation mechanism in a galaxy. Galaxies in this
diagram split naturally into two branches. Classic AGNs as well as starburst
galaxies with an AGN component populate the upper branch, with stronger AGNs
displaying higher [NeIII]/[NeII] ratios. BCDs and pure starbursts are located
in the lower branch. We find that overall the placement of galaxies on this
diagram correlates well with their corresponding locations in the
log([NII]/H$\alpha$) vs. log([OIII]/H$\beta$) diagnostic diagram, which has
been widely used in the optical. The two diagrams provide consistent
classifications of the excitation mechanism in a galaxy. On the other hand, the
diagram of [NeIII]15.56$\mu$m/[NeII]12.81$\mu$m vs.
[SIV]10.51$\mu$m/[SIII]18.71$\mu$m is not as efficient in separating AGNs from
BCDs and pure starbursts. (abridged)
","[{""version"":""v1"",""created"":""Thu, 27 Aug 2009 20:04:32 GMT""}]","2015-05-14"
"0908.4085","David Gerdes","David W. Gerdes, Adam J. Sypniewski, Timothy A. McKay, Jiangang Hao,
  Matthew R. Weis, Risa H. Wechsler, Michael T. Busha","ArborZ: Photometric Redshifts Using Boosted Decision Trees","10 pages, 13 figures, submitted to ApJ","Astrophysical Journal 715 (2010) 823-832","10.1088/0004-637X/715/2/823",,"astro-ph.CO","http://arxiv.org/licenses/nonexclusive-distrib/1.0/","  Precision photometric redshifts will be essential for extracting cosmological
parameters from the next generation of wide-area imaging surveys. In this paper
we introduce a photometric redshift algorithm, ArborZ, based on the
machine-learning technique of Boosted Decision Trees. We study the algorithm
using galaxies from the Sloan Digital Sky Survey and from mock catalogs
intended to simulate both the SDSS and the upcoming Dark Energy Survey. We show
that it improves upon the performance of existing algorithms. Moreover, the
method naturally leads to the reconstruction of a full probability density
function (PDF) for the photometric redshift of each galaxy, not merely a single
""best estimate"" and error, and also provides a photo-z quality figure-of-merit
for each galaxy that can be used to reject outliers. We show that the stacked
PDFs yield a more accurate reconstruction of the redshift distribution N(z). We
discuss limitations of the current algorithm and ideas for future work.
","[{""version"":""v1"",""created"":""Thu, 27 Aug 2009 20:04:45 GMT""}]","2010-05-06"
"0908.4086","Jan Forbrich","Jan Forbrich, Charles J. Lada, August A. Muench, Jo\~ao Alves, Marco
  Lombardi","A Spitzer Census of Star Formation Activity in the Pipe Nebula","23 pages, 8 figures, accepted for publication in ApJ",,"10.1088/0004-637X/704/1/292",,"astro-ph.SR","http://arxiv.org/licenses/nonexclusive-distrib/1.0/","  The Pipe Nebula, a large nearby molecular cloud lacks obvious signposts of
star formation in all but one of more than 130 dust extinction cores that have
been identified within it. In order to quantitatively determine the current
level of star formation activity in the Pipe Nebula, we analyzed 13 square
degrees of sensitive mid-infrared maps of the entire cloud, obtained with the
Multiband Imaging Photometer for Spitzer (MIPS) at wavelengths of 24 micron and
70 micron to search for candidate Young Stellar Objects (YSOs) in the
high-extinction regions. We argue that our search is complete for class I and
typical class II YSOs with luminosities of Lbol~0.2 Lo and greater. We find
only 18 candidate YSOs in the high-extinction regions of the entire Pipe cloud.
Twelve of these sources are previously known members of a small cluster
associated with Barnard 59, the largest and most massive dense core in the
cloud. With only six candidate class I and class II YSOs detected towards
extinction cores outside of this cluster, our findings emphatically confirm the
notion of an extremely low level of star formation activity in the Pipe Nebula.
The resulting star formation efficiency for the entire cloud mass is only ~0.06
%.
","[{""version"":""v1"",""created"":""Thu, 27 Aug 2009 20:11:06 GMT""}]","2015-05-14"
"0908.4087","Michael Brown","M.E. Brown, A.L. Smith, C. Chen, M. Adamkovics","Discovery of fog at the south pole of Titan","submitted to ApJL",,"10.1088/0004-637X/706/1/L110",,"astro-ph.EP","http://arxiv.org/licenses/nonexclusive-distrib/1.0/","  While Saturn's moon Titan appears to support an active methane hydrological
cycle, no direct evidence for surface-atmosphere exchange has yet appeared. It
is possible that the identified lake-features could be filled with ethane, an
involatile long term residue of atmospheric photolysis; the apparent stream and
channel features could be ancient from a previous climate; and the tropospheric
methane clouds, while frequent, could cause no rain to reach the surface. We
report here the detection of fog at the south pole of Titan during late summer
using observations from the VIMS instrument on board the Cassini spacecraft.
While terrestrial fog can form from a variety of causes, most of these
processes are inoperable on Titan. Fog on Titan can only be caused by
evaporation of liquid methane; the detection of fog provides the first direct
link between surface and atmospheric methane. Based on the detections presented
here, liquid methane appears widespread at the south pole of Titan in late
southern summer, and the hydrolgical cycle on Titan is current active.
","[{""version"":""v1"",""created"":""Thu, 27 Aug 2009 20:54:12 GMT""}]","2015-05-14"
"0908.4088","Philip Hopkins","Philip F. Hopkins (1), Norman Murray (2), Eliot Quataert (1), Todd A.
  Thompson (3) ((1) Berkeley, (2) CITA, (3) OSU)","A Maximum Stellar Surface Density in Dense Stellar Systems","6 pages, 2 figures, accepted to MNRAS Letters (matches accepted
  version)","Mon.Not.Roy.Astron.Soc. 401:L19-L23, 2010","10.1111/j.1745-3933.2009.00777.x",,"astro-ph.CO astro-ph.GA astro-ph.SR","http://arxiv.org/licenses/nonexclusive-distrib/1.0/","  We compile observations of the surface mass density profiles of dense stellar
systems, including globular clusters in the Milky Way and nearby galaxies,
massive star clusters in nearby starbursts, nuclear star clusters in dwarf
spheroidals and late-type disks, ultra-compact dwarfs, and galaxy spheroids
spanning the range from low-mass cusp bulges and ellipticals to massive core
ellipticals. We show that in all cases the maximum stellar surface density
attained in the central regions of these systems is similar, Sigma_max ~ 10^11
M_sun/kpc^2 (~20 g/cm^2), despite the fact that the systems span 7 orders of
magnitude in total stellar mass M_star, 5 in effective radius R_e, and have a
wide range in effective surface density M_star/R_e^2. The surface density limit
is reached on a wide variety of physical scales in different systems and is
thus not a limit on three-dimensional stellar density. Given the very different
formation mechanisms involved in these different classes of objects, we argue
that a single piece of physics likely determines Sigma_max. The radiation
fields and winds produced by massive stars can have a significant influence on
the formation of both star clusters and galaxies, while neither supernovae nor
black hole accretion are important in star cluster formation. We thus conclude
that feedback from massive stars likely accounts for the observed Sigma_max,
plausibly because star formation reaches an Eddington-like flux that regulates
the growth of these diverse systems. This suggests that current models of
galaxy formation, which focus on feedback from supernovae and active galactic
nuclei, are missing a crucial ingredient.
","[{""version"":""v1"",""created"":""Thu, 27 Aug 2009 20:06:12 GMT""},{""version"":""v2"",""created"":""Fri, 23 Oct 2009 21:10:44 GMT""}]","2015-05-14"
"0908.4089","Mohamed Anber","Mohamed M. Anber, Lorenzo Sorbo","Naturally inflating on steep potentials through electromagnetic
  dissipation","7 pages, some sections are extended, two appendices are added, few
  references are added.",,"10.1103/PhysRevD.81.043534",,"hep-th astro-ph.CO hep-ph","http://arxiv.org/licenses/nonexclusive-distrib/1.0/","  In models of natural inflation, the inflaton is an axion-like particle.
Unfortunately, axion potentials in UV-complete theories appear to be too steep
to drive inflation. We show that, even for a steep potential, natural inflation
can occur if the coupling between axion and gauge fields is taken into account.
Due to this coupling, quanta of the gauge field are produced by the rolling of
the axion. If the coupling is large enough, such a dissipative effect slows
down the axion, leading to inflation even for a steep potential. The spectrum
of perturbations is quasi-scale invariant, but in the simplest construction its
amplitude is larger than $10^{-5}$. We discuss a possible way out of this
problem.
","[{""version"":""v1"",""created"":""Thu, 27 Aug 2009 20:07:19 GMT""},{""version"":""v2"",""created"":""Wed, 10 Mar 2010 05:32:46 GMT""}]","2015-05-14"
"0908.4090","Ido Regev","Laurent Boue', H.G.E. Hentschel, Itamar Procaccia, Ido Regev and
  Jacques Zylberg","The Effective Temperature in Elasto-Plasticity of Amorphous Solids","4 pages, 5 figures",,"10.1103/PhysRevB.81.100201",,"cond-mat.stat-mech cond-mat.mtrl-sci","http://arxiv.org/licenses/nonexclusive-distrib/1.0/","  An effective temperature $T_{\rm eff}$ which differs from the bath
temperature is believed to play an essential role in the theory of
elasto-plasticity of amorphous solids. The definition of a measurable $T_{\rm
eff}$ in the literature on sheared solids suffers however from being connected
to a fluctuation-dissipation theorem which is correct only in equilibrium. Here
we introduce a natural definition of $T_{\rm eff}$ based on measurable
structural features without recourse to any questionable assumption. The value
of $T_{\rm eff}$ is connected, using theory and scaling concepts, to the flow
stress and the mean energy that characterize the elasto-plastic flow.
","[{""version"":""v1"",""created"":""Thu, 27 Aug 2009 20:08:00 GMT""}]","2015-05-14"
"0908.4091","Julie Nantais","J. B. Nantais, J. P. Huchra, B. McLeod, J. Strader, J. P. Brodie","Star Cluster Candidates in M81","35 pages, 11 figures, submitted to AJ",,"10.1088/0004-6256/139/4/1413",,"astro-ph.CO","http://arxiv.org/licenses/nonexclusive-distrib/1.0/","  We present a catalog of extended objects in the vicinity of M81 based a set
of 24 Hubble Space Telescope Advanced Camera for Surveys (ACS) Wide Field
Camera (WFC) F814W (I-band) images. We have found 233 good globular cluster
candidates; 92 candidate HII regions, OB associations, or diffuse open
clusters; 489 probable background galaxies; and 1719 unclassified objects. We
have color data from ground-based g- and r-band MMT Megacam images for 79
galaxies, 125 globular cluster candidates, 7 HII regions, and 184 unclassified
objects. The color-color diagram of globular cluster candidates shows that most
fall into the range 0.25 < g-r < 1.25 and 0.5 < r-I < 1.25, similar to the
color range of Milky Way globular clusters. Unclassified objects are often
blue, suggesting that many of them are likely to be HII regions and open
clusters, although a few galaxies and globular clusters may be among them.
","[{""version"":""v1"",""created"":""Thu, 27 Aug 2009 20:16:09 GMT""},{""version"":""v2"",""created"":""Wed, 2 Dec 2009 22:03:24 GMT""},{""version"":""v3"",""created"":""Wed, 24 Feb 2010 03:04:10 GMT""}]","2015-05-14"
"0908.4092","James Jenkins Dr","J S Jenkins, L W Ramsey, H R A Jones, Y Pavlenko, J Gallardo, J R
  Barnes and D J Pinfield","Rotation Velocities for M-dwarfs","22 pages, 11 figures, 4 tables, Accepted for publication in ApJ",,"10.1088/0004-637X/704/2/975",,"astro-ph.SR astro-ph.EP","http://arxiv.org/licenses/nonexclusive-distrib/1.0/","  We present spectroscopic rotation velocities (v sin i) for 56 M dwarf stars
using high resolution HET HRS red spectroscopy. In addition we have also
determined photometric effective temperatures, masses and metallicities
([Fe/H]) for some stars observed here and in the literature where we could
acquire accurate parallax measurements and relevant photometry. We have
increased the number of known v sin is for mid M stars by around 80% and can
confirm a weakly increasing rotation velocity with decreasing effective
temperature. Our sample of v sin is peak at low velocities (~3 km/s). We find a
change in the rotational velocity distribution between early M and late M
stars, which is likely due to the changing field topology between partially and
fully convective stars. There is also a possible further change in the
rotational distribution towards the late M dwarfs where dust begins to play a
role in the stellar atmospheres. We also link v sin i to age and show how it
can be used to provide mid-M star age limits. When all literature velocities
for M dwarfs are added to our sample there are 198 with v sin i less than or
equal to 10 km/s and 124 in the mid-to-late M star regime (M3.0-M9.5) where
measuring precision optical radial-velocities is difficult. In addition we also
search the spectra for any significant Halpha emission or absorption. 43% were
found to exhibit such emission and could represent young, active objects with
high levels of radial-velocity noise. The tables presented here will aid any
future M star planet search target selection to extract stars that will exhibit
low radial-velocity jitter.
","[{""version"":""v1"",""created"":""Thu, 27 Aug 2009 20:29:55 GMT""}]","2015-05-14"
"0908.4094","Arya Mazumdar","Alexander Barg and Arya Mazumdar","Codes in Permutations and Error Correction for Rank Modulation","Some typos corrected from the published journal version","IEEE Transactions on Information Theory, Vol. 56, Issue 7, July
  2010, pp. 3158 - 3165","10.1109/TIT.2010.2048455",,"cs.IT math.IT","http://arxiv.org/licenses/nonexclusive-distrib/1.0/","  Codes for rank modulation have been recently proposed as a means of
protecting flash memory devices from errors. We study basic coding theoretic
problems for such codes, representing them as subsets of the set of
permutations of $n$ elements equipped with the Kendall tau distance. We derive
several lower and upper bounds on the size of codes. These bounds enable us to
establish the exact scaling of the size of optimal codes for large values of
$n$. We also show the existence of codes whose size is within a constant factor
of the sphere packing bound for any fixed number of errors.
","[{""version"":""v1"",""created"":""Thu, 27 Aug 2009 20:28:16 GMT""},{""version"":""v2"",""created"":""Thu, 8 Oct 2009 03:16:28 GMT""},{""version"":""v3"",""created"":""Fri, 22 Oct 2010 22:33:52 GMT""}]","2010-12-10"
"0908.4095","Shanta Saha","Shanta R. Saha, Nicholas P. Butch, Kevin Kirshenbaum, and Johnpierre
  Paglione","Annealing effects on superconductivity in SrFe2-xNixAs2",,"Physica C 470 (2010) S379","10.1016/j.physc.2009.11.079",,"cond-mat.supr-con cond-mat.str-el","http://arxiv.org/licenses/nonexclusive-distrib/1.0/","  Superconductivity has been explored in single crystals of the Ni-doped
FeAs-compound SrFe2-xNixAs2 grown by self-flux solution method. The
antiferromagnetic order associated with the magnetostructural transition of the
parent compound SrFe2As2 is gradually suppressed with increasing Ni
concentration x and bulk-phase superconductivity with full diamagnetic
screening is induced near the optimal doping of x = 0.15 with a maximum
transition temperature Tc ~9.8 K. An investigation of high-temperature
annealing on as-grown samples indicate that the heat treatment can enhance Tc
as much as ~50 %.
","[{""version"":""v1"",""created"":""Thu, 27 Aug 2009 20:29:27 GMT""},{""version"":""v2"",""created"":""Tue, 18 Jan 2011 22:52:27 GMT""}]","2011-01-27"
