"0908.4116","Nikos Triandopoulos","Michael T. Goodrich, Roberto Tamassia, Nikos Triandopoulos","Efficient Authenticated Data Structures for Graph Connectivity and
  Geometric Search Problems","Full version of related paper appearing in CT-RSA 2003",,,,"cs.CR cs.DS","http://arxiv.org/licenses/nonexclusive-distrib/1.0/","  Authenticated data structures provide cryptographic proofs that their answers
are as accurate as the author intended, even if the data structure is being
controlled by a remote untrusted host. We present efficient techniques for
authenticating data structures that represent graphs and collections of
geometric objects. We introduce the path hash accumulator, a new primitive
based on cryptographic hashing for efficiently authenticating various
properties of structured data represented as paths, including any decomposable
query over sequences of elements. We show how to employ our primitive to
authenticate queries about properties of paths in graphs and search queries on
multi-catalogs. This allows the design of new, efficient authenticated data
structures for fundamental problems on networks, such as path and connectivity
queries over graphs, and complex queries on two-dimensional geometric objects,
such as intersection and containment queries.
","[{""version"":""v1"",""created"":""Fri, 28 Aug 2009 00:18:06 GMT""}]","2009-08-31"
"0908.4117","Kristopher Tapp","Kristopher Tapp","Roots of a compact Lie group",,,,,"math.DG math.HO","http://arxiv.org/licenses/nonexclusive-distrib/1.0/","  This expository article introduces the topic of roots in a compact Lie group.
Compared to the many other treatments of this standard topic, I intended for
mine to be relatively elementary, example-driven, and free of unnecessary
abstractions. Some familiarity with matrix groups and with maximal tori is
assumed.
  This article is self-contained, but is also intended to serve as a
supplemental 10th chapter of an eventual new edition of my textbook, ``Matrix
Groups for Undergraduates.''
","[{""version"":""v1"",""created"":""Fri, 28 Aug 2009 00:18:10 GMT""}]","2009-08-31"
"0908.4118","Yuriy Polyakov","Serge F. Timashev, Yuriy S. Polyakov, Pavel I. Misurkin, Sergey G.
  Lakeev","Anomalous diffusion in the dynamics of complex processes","47 pages, 15 figures; Submitted to Physical Review E",,"10.1103/PhysRevE.81.041128",,"physics.data-an physics.med-ph","http://arxiv.org/licenses/nonexclusive-distrib/1.0/","  Anomalous diffusion, process in which the mean-squared displacement of system
states is a non-linear function of time, is usually identified in real
stochastic processes by comparing experimental and theoretical displacements at
relatively small time intervals. This paper proposes an interpolation
expression for the identification of anomalous diffusion in complex signals for
the cases when the dynamics of the system under study reaches a steady state
(large time intervals). This interpolation expression uses the chaotic
difference moment (transient structural function) of the second order as an
average characteristic of displacements. A general procedure for identifying
anomalous diffusion and calculating its parameters in real stochastic signals,
which includes the removal of the regular (low-frequency) components from the
source signal and the fitting of the chaotic part of the experimental
difference moment of the second order to the interpolation expression, is
presented. The procedure was applied to the analysis of the dynamics of
magnetoencephalograms, blinking fluorescence of quantum dots, and X-ray
emission from accreting objects. For all three applications, the interpolation
was able to adequately describe the chaotic part of the experimental difference
moment, which implies that anomalous diffusion manifests itself in these
natural signals. The results of this study make it possible to broaden the
range of complex natural processes in which anomalous diffusion can be
identified. The relation between the interpolation expression and a diffusion
model, which is derived in the paper, allows one to simulate the chaotic
processes in the open complex systems with anomalous diffusion.
","[{""version"":""v1"",""created"":""Fri, 28 Aug 2009 00:40:38 GMT""},{""version"":""v2"",""created"":""Fri, 28 Aug 2009 21:08:15 GMT""}]","2013-05-29"
"0908.4119","Aleksey Polunchenko","George V. Moustakides, Aleksey S. Polunchenko and Alexander G.
  Tartakovsky","Numerical Comparison of Cusum and Shiryaev-Roberts Procedures for
  Detecting Changes in Distributions","21 pages, 8 figures, to appear in Communications in Statistics -
  Theory and Methods","Communications in Statistics - Theory and Methods, vol. 38, no.
  16-17, pp. 3225-3239, 2009","10.1080/03610920902947774",,"stat.CO","http://arxiv.org/licenses/nonexclusive-distrib/1.0/","  The CUSUM procedure is known to be optimal for detecting a change in
distribution under a minimax scenario, whereas the Shiryaev-Roberts procedure
is optimal for detecting a change that occurs at a distant time horizon. As a
simpler alternative to the conventional Monte Carlo approach, we propose a
numerical method for the systematic comparison of the two detection schemes in
both settings, i.e., minimax and for detecting changes that occur in the
distant future. Our goal is accomplished by deriving a set of exact integral
equations for the performance metrics, which are then solved numerically. We
present detailed numerical results for the problem of detecting a change in the
mean of a Gaussian sequence, which show that the difference between the two
procedures is significant only when detecting small changes.
","[{""version"":""v1"",""created"":""Fri, 28 Aug 2009 00:44:32 GMT""}]","2011-09-15"
"0908.4120","Milton David Jara","Milton Jara","Hydrodynamic limit of the exclusion process in inhomogeneous media","14 pages",,,,"math.PR math-ph math.MP","http://arxiv.org/licenses/nonexclusive-distrib/1.0/","  We obtain the hydrodynamic limit of a simple exclusion process in an
inhomogeneous environment of divergence form. Our main assumption is a suitable
version of Gamma-convergence for the environment. In this way we obtain an
unified approach to recent works on the field.
","[{""version"":""v1"",""created"":""Fri, 28 Aug 2009 01:58:28 GMT""}]","2009-08-31"
"0908.4121","Misha Verbitsky","Misha Verbitsky","A global Torelli theorem for hyperkahler manifolds","51 pages, final version, accepted by Duke Math. J","Duke Math. J. Volume 162, Number 15 (2013), 2929-2986",,,"math.AG math.AT math.DG","http://creativecommons.org/licenses/by/3.0/","  A mapping class group of an oriented manifold is a quotient of its
diffeomorphism group by the isotopies. We compute a mapping class group of a
hypekahler manifold $M$, showing that it is commensurable to an arithmetic
subgroup in SO(3, b_2-3). A Teichmuller space of $M$ is a space of complex
structures on $M$ up to isotopies. We define a birational Teichmuller space by
identifying certain points corresponding to bimeromorphically equivalent
manifolds, and show that the period map gives an isomorphism of the birational
Teichmuller space and the corresponding period space $SO(b_2-3, 3)/SO(2)\times
SO(b_2 -3, 1)$. We use this result to obtain a Torelli theorem identifying any
connected component of birational moduli space with a quotient of a period
space by an arithmetic subgroup. When $M$ is a Hilbert scheme of $n$ points on
a K3 surface, with $n-1$ a prime power, our Torelli theorem implies the usual
Hodge-theoretic birational Torelli theorem (for other examples of hyperkahler
manifolds the Hodge-theoretic Torelli theorem is known to be false).
","[{""version"":""v1"",""created"":""Fri, 28 Aug 2009 11:09:36 GMT""},{""version"":""v2"",""created"":""Fri, 25 Sep 2009 01:09:02 GMT""},{""version"":""v3"",""created"":""Sat, 17 Oct 2009 11:23:36 GMT""},{""version"":""v4"",""created"":""Sun, 27 Dec 2009 16:19:57 GMT""},{""version"":""v5"",""created"":""Wed, 3 Mar 2010 15:39:03 GMT""},{""version"":""v6"",""created"":""Thu, 11 Nov 2010 20:26:19 GMT""},{""version"":""v7"",""created"":""Sat, 2 Apr 2011 12:12:56 GMT""},{""version"":""v8"",""created"":""Wed, 22 May 2013 14:06:09 GMT""}]","2013-12-09"
"0908.4122","Jayne Thompson","Jayne E. Thompson, Raymond R. Volkas","SO(10) domain-wall brane models","16 pages, 2 figures A new section has been added on page 12. 3 new
  paragraphs have been added to the end of section (IV B) 'Localising Fermions'
  and 1 new paragraph has been added to section (IV C)'Adding Warped Gravity'.
  A new reference has been added to the bibliography at position [29]. The
  paper has been accepted in to Phys. Rev. D","Phys.Rev.D80:125016,2009","10.1103/PhysRevD.80.125016",,"hep-ph","http://arxiv.org/licenses/nonexclusive-distrib/1.0/","  We construct domain-wall brane models based on the grand-unification group
SO(10), generalising the SU(5) model of Davies, George and Volkas. Motivated by
the Dvali-Shifman proposal for the dynamical localisation of gauge bosons, the
SO(10) symmetry is spontaneously broken inside the wall. We present two
scenarios: in the first, the unbroken subgroup inside the wall is SU(5) x
U(1)X, and in the second it is the left-right symmetry group SU(3) x SU(2)L x
SU(2)R x U(1)B-L. In both cases we demonstrate that the
phenomenologically-correct fermion zero modes can be localised to the wall, and
we briefly discuss how the symmetry-breaking dynamics may be extended to induce
breaking to the standard model group with subsequent electroweak breaking.
Dynamically localised gravity is realised through the type 2 Randall-Sundrum
mechanism.
","[{""version"":""v1"",""created"":""Fri, 28 Aug 2009 02:24:42 GMT""},{""version"":""v2"",""created"":""Thu, 5 Nov 2009 00:59:26 GMT""}]","2009-12-30"
"0908.4123","Shinji Mukohyama","Shinji Mukohyama","Can ghost condensate decrease entropy?","16 pages, paper invited to the open astronomy journal hot topic
  ""Gravitational Alternative for Dark Energy and Inflation""; (v2) typo
  corrected, reference added","Open Astron.J.3:30-36,2010","10.2174/1874381101003020030","IPMU-09-0099","hep-th astro-ph.CO gr-qc hep-ph","http://arxiv.org/licenses/nonexclusive-distrib/1.0/","  By looking for possible violation of the generalized second law, we might be
able to find regions in the space of theories and states that do not allow
holographic dual descriptions. We revisit three proposals for violation of the
generalized second law in the simplest Higgs phase of gravity called ghost
condensate. Two of them, (i) analogue of Penrose process and (ii) semiclassical
heat flow, are based on Lorentz breaking effects, by which particles of
different species can have different limits of speed. We show that processes in
both (i) and (ii) are always slower than accretion of ghost condensate and
cannot decrease the total entropy before the accretion increases the entropy.
The other proposal is to use (iii) negative energy carried by excitations of
ghost condensate. We prove an averaged null energy condition, which we
conjecture prevents the proposal (iii) from violating the generalized second
law in a coarse-grained sense.
","[{""version"":""v1"",""created"":""Fri, 28 Aug 2009 14:42:13 GMT""},{""version"":""v2"",""created"":""Tue, 17 Nov 2009 23:40:20 GMT""}]","2011-04-07"
"0908.4124","Stefan Kallweit","S. Dittmaier, S. Kallweit, P. Uwer","NLO QCD corrections to pp/ppbar --> WW+jet+X including leptonic W-boson
  decays","56 pages, 46 figures, 25 tables","Nucl.Phys.B826:18-70,2010","10.1016/j.nuclphysb.2009.09.029","HU-EP-09/25, MPP-2009-153, PSI-PR-09-11, SFB/CPP-09-45","hep-ph","http://arxiv.org/licenses/nonexclusive-distrib/1.0/","  We report on the calculation of the next-to-leading order QCD corrections to
the production of W-boson pairs in association with a hard jet at the Tevatron
and the LHC, which is an important source of background for Higgs and
new-physics searches. Leptonic decays of the W bosons are included by applying
an improved version of the narrow-width approximation that treats the W bosons
as on-shell particles, but keeps the information on the W spin. Contributions
from external bottom quarks are neglected, because they are either numerically
suppressed or should be attributed to different processes such as Wt or ttbar
production. A survey of differential NLO QCD cross sections is provided both
for the LHC and the Tevatron. The QCD corrections stabilize the leading-order
prediction for the cross section with respect to scale variations. However, the
scale dependence of the next-to-leading order results for the LHC is only
reduced considerably if a veto against the emission of a second hard jet is
applied. In general, the corrections do not simply rescale the differential
leading-order cross sections. In particular, their shapes are distorted if an
additional energy scale is involved.
","[{""version"":""v1"",""created"":""Fri, 28 Aug 2009 14:36:39 GMT""}]","2009-11-18"
"0908.4125","Nevena Maric","J. Theodore Cox, Nevena Maric, Rinaldo B. Schinazi","Contact process in a wedge","11 pages, 4 figures","Journal of Statistical Physics, Volume 139, Issue 3, pp 506-517
  (2010)","10.1007/s10955-010-9950-7",,"math.PR","http://arxiv.org/licenses/nonexclusive-distrib/1.0/","  We prove that the supercritical one-dimensional contact process survives in
certain wedge-like space-time regions, and that when it survives it couples
with the unrestricted contact process started from its upper invariant measure.
As an application we show that a type of weak coexistence is possible in the
nearest-neighbor ``grass-bushes-trees'' successional model introduced in
Durrett and Swindle (1991).
","[{""version"":""v1"",""created"":""Fri, 28 Aug 2009 03:24:42 GMT""}]","2015-05-14"
"0908.4126","Vaughn Climenhaga","Vaughn Climenhaga","Bowen's equation in the non-uniform setting","23 pages, 1 figure: v2 has expanded introduction; ""bounded""
  contraction replaced with ""tempered""; Section 4, Proposition 5.1 added; proof
  of Lemma 6.2 corrected","Ergodic Theory and Dynamical Systems (2011), 31: 1163-1182","10.1017/S0143385710000362",,"math.DS","http://arxiv.org/licenses/nonexclusive-distrib/1.0/","  We show that Bowen's equation, which characterises the Hausdorff dimension of
certain sets in terms of the topological pressure of an expanding conformal
map, applies in greater generality than has been heretofore established. In
particular, we consider an arbitrary subset Z of a compact metric space and
require only that the lower Lyapunov exponents be positive on Z, together with
a tempered contraction condition. Among other things, this allows us to compute
the dimension spectrum for Lyapunov exponents for maps with parabolic periodic
points, and to relate the Hausdorff dimension to the topological entropy for
arbitrary subsets of symbolic space with the appropriate metric.
","[{""version"":""v1"",""created"":""Fri, 28 Aug 2009 03:48:01 GMT""},{""version"":""v2"",""created"":""Sun, 7 Mar 2010 04:41:42 GMT""}]","2011-07-15"
"0908.4127","Thomas Jacques","T. D. Jacques","Robust Constraints on Dark Matter Annihilation into Gamma Rays and
  Charged Particles","7 pages, 5 figures. Talk given at DSU 09, Melbourne, Australia, June
  2009","AIP Conf.Proc.1178:104-110,2009","10.1063/1.3264543",,"astro-ph.HE astro-ph.GA","http://arxiv.org/licenses/nonexclusive-distrib/1.0/","  Using gamma-ray data from observations of the Milky Way, Andromeda (M31), and
the cosmic background, we calculate conservative upper limits on the dark
matter self-annihilation cross section to a number of final states, over a wide
range of dark matter masses. We first constrain annihilation to a pair of
monoenergetic gamma rays, and show that in general our results are unchanged
for a broader annihilation spectrum, if at least a few gamma rays are produced
with energies within a factor of a few from the dark matter mass. We then place
constraints on the self-annihilation cross section to an electron-positron
pair, using gamma rays produced via internal bremsstrahlung radiative
corrections. We also place constraints on annihilation into the other charged
leptons. We make conservative assumptions about the astrophysical inputs, and
demonstrate how our derived bounds would be strengthened if stronger
assumptions about these inputs are adopted.
","[{""version"":""v1"",""created"":""Fri, 28 Aug 2009 03:35:46 GMT""}]","2014-11-20"
"0908.4128","Baerbel Silvia Koribalski","Baerbel S. Koribalski (ATNF) and Angel R. Lopez-Sanchez (ATNF)","Gas Dynamics and Star Formation in the Galaxy Pair NGC1512/1510","accepted in MNRAS (please find the high-resolution pdf file and
  further information at http://www.atnf.csiro.au/people/bkoribal/ngc1512)",,"10.1111/j.1365-2966.2009.15610.x",,"astro-ph.CO astro-ph.GA","http://arxiv.org/licenses/nonexclusive-distrib/1.0/","  (abridged) Here we present HI line and 20-cm radio continuum data of the
nearby galaxy pair NGC1512/1510 as obtained with the Australia Telescope
Compact Array. These are complemented by GALEX UV-, SINGG Halpha- and Spitzer
mid-infrared images, allowing us to compare the distribution and kinematics of
the neutral atomic gas with the locations and ages of the stellar clusters
within the system. For the barred, double-ring galaxy NGC1512 we find a very
large HI disk, about 4x its optical diameter, with two pronounced spiral/tidal
arms. Both its gas distribution and the distribution of the star-forming
regions are affected by gravitational interaction with the neighbouring blue
compact dwarf galaxy NGC1510. The two most distant HI clumps, at radii of about
80 kpc, show signs of star formation and are likely tidal dwarf galaxies. Star
formation in the outer disk of NGC1512 is revealed by deep optical- and
two-color ultraviolet images. Using the latter we determine the properties of
about 200 stellar clusters and explore their correlation with dense HI clumps
in the even larger 2XHI disk. The multi-wavelength analysis of the NGC1512/1510
system, which is probably in the first stages of a minor merger having started
about 400 Myr ago, links stellar and gaseous galaxy properties on scales from
one to 100 kpc.
","[{""version"":""v1"",""created"":""Fri, 28 Aug 2009 03:43:49 GMT""}]","2015-05-14"
"0908.4129","Zhi-Yun Li","Peng Wang (Standford), Zhi-Yun Li (University of Virginia), Tom Abel
  (Stanford), Fumitaka Nakamura (Niigata University)","Outflow Feedback Regulated Massive Star Formation in Parsec-Scale
  Cluster Forming Clumps","36 pages, 9 figures, submitted to ApJ, contact the authors for movies
  of the simulations","Astrophys.J.709:27-41,2010","10.1088/0004-637X/709/1/27",,"astro-ph.SR","http://arxiv.org/licenses/nonexclusive-distrib/1.0/","  (Abridged) We investigate massive star formation in turbulent, magnetized,
parsec-scale clumps of molecular clouds including protostellar outflow feedback
using Enzo-based MHD simulations with accreting sink particles and effective
resolution $2048^3$. We find that, in the absence of regulation by magnetic
fields and outflow feedback, massive stars form readily in a turbulent,
moderately condensed clump of $\sim 1,600$ solar masses, along with a cluster
of hundreds of lower mass stars. The massive stars are fed at high rates by (1)
transient dense filaments produced by large-scale turbulent compression at
early times, and (2) by the clump-wide global collapse resulting from
turbulence decay at late times. In both cases, the bulk of the massive star's
mass is supplied from outside a 0.1 pc-sized ""core"" that surrounds the star. In
our simulation, the massive star is clump-fed rather than core-fed. The need
for large-scale feeding makes the massive star formation prone to regulation by
outflow feedback, which directly opposes the feeding processes. The outflows
reduce the mass accretion rates onto the massive stars by breaking up the dense
filaments that feed the massive star formation at early times, and by
collectively slowing down the global collapse that fuel the massive star
formation at late times. The latter is aided by a moderate magnetic field of
strength in the observed range. We conclude that the massive star formation in
our simulated turbulent, magnetized, parsec-scale clump is outflow-regulated
and clump-fed (ORCF for short). An important implication is that the formation
of low-mass stars in a dense clump can affect the formation of massive stars in
the same clump, through their outflow feedback on the clump dynamics.
","[{""version"":""v1"",""created"":""Fri, 28 Aug 2009 04:31:33 GMT""}]","2014-11-20"
"0908.4130","Jie Liu","J.Liu and L.B.Fu","Berry Phase of Nonlinear Correction","4pages, no figure",,,,"cond-mat.quant-gas","http://arxiv.org/licenses/nonexclusive-distrib/1.0/","  We investigate the geometric phase or Berry phase of adiabatic quantum
evolution in the Bose-Einstein condensate (BEC) systems governed by nonlinear
Gross-Pitaevskii(GP) equations. We study how this phase is modified by the
nonlinearity and find that the Bogoliubov fluctuations around the eigenstates
are accumulated during the nonlinear adiabatic evolution and contribute a
finite phase of geometric nature. A two-mode BEC model is used to illustrate
our theory. Our theory is applicable to other nonlinear systems such as
paraxial wave equation for nonlinear optics and Ginzburg-Landau equations for
complex order parameters in condensed-matter physics.
","[{""version"":""v1"",""created"":""Fri, 28 Aug 2009 04:32:27 GMT""}]","2009-08-31"
"0908.4131","Denis Gokhfeld","D.M. Gokhfeld, D.A. Balaev, S.I. Popkov, K.A. Shaykhutdinov, M.I.
  Petrov","Asymmetry of magnetization curves of textured BSCCO","4 pages, 1 figure, will be published in Physica C","Physica C, Vol. 470 (2010) S870-S872","10.1016/j.physc.2009.10.049","PHYSC1250649","cond-mat.supr-con","http://arxiv.org/licenses/nonexclusive-distrib/1.0/","  The dependence of magnetization on magnetic field M(H) was measured for
textured BSCCO samples for H || c, H || ab at different temperatures. Inclusion
of the pinning parameter in the Valkov-Khrustalev model [V.V. Valkov, B.P.
Khrustalev, JETP 80 (1995) 680] allowed to describe successfully the asymmetric
M(H) dependencies. The temperature and magnetic field dependencies of critical
current and pinning parameter for H || c and H || ab were estimated.
","[{""version"":""v1"",""created"":""Fri, 28 Aug 2009 04:40:34 GMT""}]","2011-01-12"
"0908.4132","Yun Soo  Myung","Yun Soo Myung","Entropy of black holes in the deformed Ho\v{r}ava-Lifshitz gravity","11 pages, version to appear in PLB","Phys.Lett.B684:158-161,2010","10.1016/j.physletb.2010.01.014",,"hep-th","http://arxiv.org/licenses/nonexclusive-distrib/1.0/","  We find the entropy of Kehagias-Sfetsos black hole in the deformed
Ho\v{r}ava-Lifshitz gravity by using the first law of thermodynamics. When
applying generalized uncertainty principle (GUP) to Schwarzschild black hole,
the entropy $S=A/4+(\pi/\omega)\ln(A/4)$ may be interpreted as the GUP-inspired
black hole entropy. Hence, it implies that the duality in the entropy between
the Kehagias-Sfetsos black hole and GUP-inspired Schwarzschild black hole is
present.
","[{""version"":""v1"",""created"":""Fri, 28 Aug 2009 08:58:59 GMT""},{""version"":""v2"",""created"":""Sun, 30 Aug 2009 02:02:52 GMT""},{""version"":""v3"",""created"":""Wed, 13 Jan 2010 02:07:01 GMT""}]","2010-02-01"
"0908.4133","Rosa Amelia Gonzalez-Lopez Lira","Rosa A. Gonzalez-Lopezlira, Gustavo Bruzual-A., Stephane Charlot,
  Javier Ballesteros-Paredes, Laurent Loinard","Tracers of stellar mass-loss. I. Optical and near-IR colours and surface
  brightness fluctuations","31 pages, 17 figures, accepted for publication in MNRAS","Mon.Not.Roy.Astron.Soc.403:1213-1238,2010","10.1111/j.1365-2966.2009.16205.x",,"astro-ph.CO","http://arxiv.org/licenses/nonexclusive-distrib/1.0/","  We present optical and IR integrated colours and SBF magnitudes, computed
from stellar population synthesis models that include emission from the dusty
envelopes surrounding TP-AGB stars undergoing mass-loss. We explore the effects
of varying the mass-loss rate by one order of magnitude around the fiducial
value, modifying accordingly both the stellar parameters and the output spectra
of the TP-AGB stars plus their dusty envelopes. The models are single burst,
and range in age from a few Myr to 14 Gyr, and in metallicity between $Z$ =
0.0001 and $Z$ = 0.07; they combine new calculations for the evolution of stars
in the TP-AGB phase, with star plus envelope SEDs produced with the radiative
transfer code DUSTY. We compare these models to optical and near-IR data of
single AGB stars and Magellanic star clusters. This comparison validates the
current understanding of the role of mass-loss in determining stellar
parameters and spectra in the TP-AGB. However, neither broad-band colours nor
SBF measurements in the optical or the near-IR can discern global changes in
the mass-loss rate of a stellar population. We predict that mid-IR SBF
measurements can pick out such changes, and actually resolve whether a relation
between metallicity and mass-loss exists.
","[{""version"":""v1"",""created"":""Fri, 28 Aug 2009 05:03:16 GMT""},{""version"":""v2"",""created"":""Fri, 11 Dec 2009 06:26:27 GMT""}]","2014-11-20"
