"0908.3934","Gabriel Silva","Marius Buibas and Gabriel A. Silva","A framework for simulating and estimating the state and functional
  topology of complex dynamic geometric networks","Revised following initial peer review. Current version 28 pages and 7
  figures. A slightly modified version has been accepted to Neural Computation
  and is now in press",,,,"cond-mat.dis-nn math-ph math.MP physics.bio-ph q-bio.NC","http://arxiv.org/licenses/nonexclusive-distrib/1.0/","  We present a framework for simulating signal propagation in geometric
networks (i.e. networks that can be mapped to geometric graphs in some space)
and for developing algorithms that estimate (i.e. map) the state and functional
topology of complex dynamic geometric net- works. Within the framework we
define the key features typically present in such networks and of particular
relevance to biological cellular neural networks: Dynamics, signaling,
observation, and control. The framework is particularly well-suited for
estimating functional connectivity in cellular neural networks from
experimentally observable data, and has been implemented using graphics
processing unit (GPU) high performance computing. Computationally, the
framework can simulate cellular network signaling close to or faster than real
time. We further propose a standard test set of networks to measure performance
and compare different mapping algorithms.
","[{""version"":""v1"",""created"":""Thu, 27 Aug 2009 16:33:52 GMT""},{""version"":""v2"",""created"":""Fri, 23 Apr 2010 06:44:22 GMT""},{""version"":""v3"",""created"":""Tue, 22 Jun 2010 04:05:08 GMT""}]","2010-06-23"
"0908.3975","Gao Weihong","Wei-Hong Gao, Jirong Mao, Dong Xu and Yi-Zhong Fan","GRB 080916C and GRB 090510: the high energy emission and the afterglow","5 pages; accepted for publication in ApJL","Astrophys.J. 706: L33-L36, 2009","10.1088/0004-637X/706/1/L33",,"astro-ph.HE","http://arxiv.org/licenses/nonexclusive-distrib/1.0/","  We constrain the physical composition of the outflows of GRBs 080916C and
090510 with the prompt emission data and find that the former is likely
magnetic while the latter may be baryonic. The X-ray and optical afterglow
emission of both GRBs can be reasonably fitted using the standard external
shock model but the density profiles of the circum-burst medium are different.
We also propose a simple method to estimate the number of the seed photons
suppose the GeV afterglow photons are due to the inverse Compton radiation of
external forward shock electrons. The seed photons needed in the modeling are
too many to be realistic for both events. The synchrotron radiation of the
forward shock seems able to account for the GeV afterglow data.
","[{""version"":""v1"",""created"":""Thu, 27 Aug 2009 19:55:47 GMT""},{""version"":""v2"",""created"":""Tue, 13 Oct 2009 18:28:12 GMT""},{""version"":""v3"",""created"":""Thu, 29 Oct 2009 14:39:31 GMT""}]","2015-05-14"
"0908.3988","Dragan Huterer","Ray Zhang and Dragan Huterer (University of Michigan)","Disks in the sky: A reassessment of the WMAP ""cold spot""","7 pages, 3 figures, minor additions","Astroparticle Physics, 33, 69 (2010)","10.1016/j.astropartphys.2009.11.005",,"astro-ph.CO gr-qc","http://arxiv.org/licenses/nonexclusive-distrib/1.0/","  We reassess the evidence that WMAP temperature maps contain a statistically
significant ""cold spot"" by repeating the analysis using simple circular top-hat
(disk) weights, as well as Gaussian weights of varying width. Contrary to
previous results that used Spherical Mexican Hat Wavelets, we find no
significant signal at any scale when we compare the coldest spot from our sky
to ones from simulated Gaussian random, isotropic maps. We trace this apparent
discrepancy to the fact that WMAP cold spot's temperature profile just happens
to favor the particular profile given by the wavelet. Since randomly generated
maps typically do not exhibit this coincidence, we conclude that the original
cold spot significance originated at least partly due to a fortuitous choice of
using a particular basis of weight functions. We also examine significance of a
more general measure that returns the most significant result among several
choices of the weighting function, angular scale of the spot, and the
statistics applied, and again find a null result.
","[{""version"":""v1"",""created"":""Thu, 27 Aug 2009 19:44:40 GMT""},{""version"":""v2"",""created"":""Sun, 13 Sep 2009 19:08:35 GMT""}]","2010-05-18"
"0908.4030","Lorenz von Smekal","Sam Edwards and Lorenz von Smekal","SU(2) lattice gauge theory in 2+1 dimensions: critical couplings from
  twisted boundary conditions and universality","7 pages, 8 figures (eps)","Phys.Lett.B681:484-490,2009","10.1016/j.physletb.2009.10.063",,"hep-lat","http://arxiv.org/licenses/nonexclusive-distrib/1.0/","  We present a precision determination of the critical coupling beta_c for the
deconfinement transition in pure SU(2) gauge theory in 2+1 dimensions. This is
possible from universality, by intersecting the center vortex free energy as a
function of the lattice coupling beta with the exactly known value of the
interface free energy in the 2D Ising model at criticality. Results for
lattices with different numbers of sites N_t along the Euclidean time direction
are used to determine how beta varies with temperature for a given N_t around
the deconfinement transition.
","[{""version"":""v1"",""created"":""Thu, 27 Aug 2009 16:39:57 GMT""}]","2009-11-16"
"0908.4036","Norbert Schuch","Alessandro Sfondrini, Javier Cerrillo, Norbert Schuch, J. Ignacio
  Cirac","Simulating two- and three-dimensional frustrated quantum systems with
  string-bond states","9 pages, 11 figures; v2: accepted version, Journal-Ref added","Phys. Rev. B 81, 214426 (2010)","10.1103/PhysRevB.81.214426",,"cond-mat.str-el quant-ph","http://arxiv.org/licenses/nonexclusive-distrib/1.0/","  Simulating frustrated quantum magnets is among the most challenging tasks in
computational physics. We apply String-Bond States, a recently introduced
ansatz which combines Tensor Networks with Monte Carlo based methods, to the
simulation of frustrated quantum systems in both two and three dimensions. We
compare our results with existing results for unfrustrated and two-dimensional
systems with open boundary conditions, and demonstrate that the method applies
equally well to the simulation of frustrated systems with periodic boundaries
in both two and three dimensions.
","[{""version"":""v1"",""created"":""Thu, 27 Aug 2009 16:07:22 GMT""},{""version"":""v2"",""created"":""Wed, 7 Jul 2010 01:37:27 GMT""}]","2010-07-08"
"0908.4037","Amit Hogadi","Indranil Biswas and Amit Hogadi","Unitary representations of the fundamental group of Orbifolds","revised version",,,,"math.AG","http://arxiv.org/licenses/nonexclusive-distrib/1.0/","  There is a well known bijective correspondence between isomorphism classes of
polystable vector bundles $E$ with $c_i(E)=0$ for $i\geq 1$ on a smooth complex
projective variety and equivalence classes of unitary representations of the
fundamental group of the variety. We show that this bijective correspondence
extends to smooth orbifolds.
","[{""version"":""v1"",""created"":""Thu, 27 Aug 2009 16:07:32 GMT""},{""version"":""v2"",""created"":""Mon, 6 Feb 2012 05:31:49 GMT""}]","2012-02-07"
"0908.4038","Martin Tancer","Martin Tancer","Non-representability of finite projective planes by convex sets","8 pages, 4 figures",,,,"math.CO","http://arxiv.org/licenses/nonexclusive-distrib/1.0/","  We prove that there is no d such that all finite projective planes can be
represented by convex sets in R^d, answering a question of Alon, Kalai,
Matousek, and Meshulam. Here, if P is a projective plane with lines
l_1,...,l_n, a representation of P by convex sets in R^d is a collection of
convex sets C_1,...,C_n in R^d such that C_{i_1},...,C_{i_k} have a common
point if and only if the corresponding lines l_{i_1},...,l_{i_k} have a common
point in P. The proof combines a positive-fraction selection lemma of Pach with
a result of Alon on ""expansion"" of finite projective planes. As a corollary, we
show that for every $d$ there are 2-collapsible simplicial complexes that are
not d-representable, strengthening a result of Matousek and the author.
","[{""version"":""v1"",""created"":""Thu, 27 Aug 2009 16:15:58 GMT""}]","2009-08-28"
"0908.4039","Diego Altamirano","D. Altamirano, M. Linares, A. Patruno, N. Degenaar, R. Wijnands, M.
  Klein-Wolt, M. van der Klis, C. Markwardt, J. Swank","Type I X-ray bursts, burst oscillations and kHz quasi-periodic
  oscillations in the neutron star system IGR J17191-2821","9 pages, 7 figures - accepted for publication in MNRAS",,"10.1111/j.1365-2966.2009.15627.x",,"astro-ph.HE","http://arxiv.org/licenses/nonexclusive-distrib/1.0/","  We present a detailed study of the X-ray energy and power spectral properties
of the neutron star transient IGR J17191-2821. We discovered four instances of
pairs of simultaneous kilohertz quasi-periodic oscillations (kHz QPOs). The
frequency difference between these kHz QPOs is between 315 Hz and 362 Hz. We
also report on the detection of five thermonuclear type-I X-ray bursts and the
discovery of burst oscillations at ~294 Hz during three of them. Finally, we
report on a faint and short outburst precursor, which occurred about two months
before the main outburst. Our results on the broadband spectral and variability
properties allow us to firmly establish the atoll source nature of IGR
J17191-2821.
","[{""version"":""v1"",""created"":""Thu, 27 Aug 2009 16:31:05 GMT""}]","2015-05-14"
"0908.4040","Francois Henault","Francois Henault","Multi-spectral piston sensor for co-phasing giant segmented mirrors and
  multi-aperture interferometric arrays",,"Journal of Optics A: Pure Applied Optics vol. 11, 125503 (2009)","10.1088/1464-4258/11/12/125503",,"physics.optics astro-ph.IM","http://arxiv.org/licenses/nonexclusive-distrib/1.0/","  This paper presents the optical design of a multi-spectral piston sensor
suitable to co-phasing giant segmented mirrors equipping the Future Extremely
Large Telescopes (ELTs). The general theory of the sensor is described in
detail and numerical simulations have been carried out, demonstrating that
direct piston and tip-tilt measurements are feasible within accuracies
respectively close to 20 nm and 10 nano-radians. Those values are compatible
with the co-phasing requirements, although the method seems to be perturbed by
uncorrected atmospheric seeing
","[{""version"":""v1"",""created"":""Thu, 27 Aug 2009 16:22:48 GMT""}]","2015-05-14"
"0908.4041","Alireza Bagheri","Alireza Bagheri and Mohammadreza Razzazi","Complexity of Planar Embeddability of Trees inside Simple Polygons",,,,,"cs.CG cs.CC","http://arxiv.org/licenses/nonexclusive-distrib/1.0/","  Geometric embedding of graphs in a point set in the plane is a well known
problem. In this paper, the complexity of a variant of this problem, where the
point set is bounded by a simple polygon, is considered. Given a point set in
the plane bounded by a simple polygon and a free tree, we show that deciding
whether there is a planar straight-line embedding of the tree on the point set
inside the simple polygon is NP-complete. This implies that the straight-line
constrained point-set embedding of trees is also NP-complete, which was posed
as an open problem in [8].
","[{""version"":""v1"",""created"":""Thu, 27 Aug 2009 16:35:26 GMT""}]","2009-08-28"
"0908.4042","Mark H. Finger","Mark H. Finger, Nazar R. Ikhsanov, Colleen A. Wilson-Hodge, and
  Sandeep K. Patel","Spin-Down of the Long-Period Accreting Pulsar 4U 2206+54","Submitted to The Astrophysical Journal",,"10.1088/0004-637X/709/2/1249",,"astro-ph.HE","http://arxiv.org/licenses/nonexclusive-distrib/1.0/","  4U 2206+54 is a high mass X-ray binary which has been suspected to contain a
neutron star accreting from the wind of its companion BD +53 2790. Reig et al.
have recently detected 5560 s period pulsations in both RXTE and INTEGRAL
observations which they conclude are due to the spin of the neutron star. We
present observations made with Suzaku which are contemporaneous with their RXTE
observation of this source. We find strong pulsations at a period of 5554 +/- 9
s in agreement with their results. We also present a reanalysis of BeppoSAX
observations of 4U 2206+54 made in 1998, in which we find strong pulsations at
a period of 5420 +/- 28 seconds, revealing a spin-down trend in this
long-period accreting pulsar. Analysis of these data suggests that the neutron
star in this system is an accretion-powered magnetar.
","[{""version"":""v1"",""created"":""Thu, 27 Aug 2009 16:41:12 GMT""}]","2015-05-14"
"0908.4043","Changqing Jin","Z. Deng, X. C. Wang, Q.Q. Liu, S. J. Zhang, Y. X. Lv, J. L. Zhu, R.C.
  Yu, C.Q. Jin","A new 111 type iron pnictide superconductor LiFeP","3 figures + 1 table","EPL 87, 3704(2009)","10.1209/0295-5075/87/37004",,"cond-mat.supr-con cond-mat.str-el","http://arxiv.org/licenses/nonexclusive-distrib/1.0/","  A new iron pnictide LiFeP superconductor was found. The compound crystallizes
into a Cu2Sb structure containing an FeP layer showing superconductivity with
maximum Tc of 6K. This is the first 111 type iron pnictide superconductor
containing no arsenic. The new superconductor is featured with itinerant
behavior at normal state that could helpful to understand the novel
superconducting mechanism of iron pnictide compounds.
","[{""version"":""v1"",""created"":""Thu, 27 Aug 2009 16:54:58 GMT""}]","2015-05-14"
"0908.4044","Li-Hsin Chien","Li-Hsin Chien","Star Formation History In Merging Galaxies","6 pages, 5 figures, to appear in ASP Conference Series: ""Galaxy Wars:
  Star Formation and Stellar Populations in Interacting Galaxies""",,,,"astro-ph.CO astro-ph.GA","http://arxiv.org/licenses/nonexclusive-distrib/1.0/","  Galaxy interactions are known to trigger starbursts. Young massive star
clusters formed in interacting galaxies and mergers may become young globular
clusters. The ages of these clusters can provide clues about the timing of
interaction-triggered events, and thus provide an important way to reconstruct
the star formation history of merging galaxies. Numerical simulations of galaxy
mergers can implement different star formation rules. For instance, star
formation dependent on gas density or triggered by shocks, predicts
significantly different star formation histories. To test the validity of these
models, multi-object spectroscopy was used to map the ages of young star
clusters throughout the bodies and tails of a series of galaxy mergers at
different stages (Arp 256, NGC 7469, NGC 4676, Arp 299, IC 883 and NGC 2623).
We found that the cumulative distribution of ages becomes shallower as the
stage of merger advances. This result suggests a trend of cluster ages as a
function of merger stage. In NGC 4676 we found that two clusters have ages of
about 170 Myr, suggesting that they likely formed during its first passage.
Their locations in the tidal tails are consistent with the spatial distribution
of star formation predicted by shock-induced models. When comparing the ages
and spatial distribution of clusters in NGC 7252 to our model, we found that
some clusters are likely to form during the prompt starburst at first passage,
as predicted by simulations with shock-induced star formation. These
simulations show that the shock-induced mechanism is an important trigger of
star formation and that using the ages of clusters formed in the starbursts can
effectively determine the star formation history of merging galaxies.
","[{""version"":""v1"",""created"":""Thu, 27 Aug 2009 17:09:29 GMT""}]","2009-08-28"
"0908.4045","Miloslav Znojil","Miloslav Znojil","Cryptohermitian Picture of Scattering Using Quasilocal Metric Operators",,"SIGMA 5 (2009), 085, 21 pages","10.3842/SIGMA.2009.085",,"quant-ph math-ph math.MP","http://creativecommons.org/licenses/by-nc-sa/3.0/","  One-dimensional unitary scattering controlled by non-Hermitian (typically,
${\cal PT}$-symmetric) quantum Hamiltonians $H\neq H^\dagger$ is considered.
Treating these operators via Runge-Kutta approximation, our three-Hilbert-space
formulation of quantum theory is reviewed as explaining the unitarity of
scattering. Our recent paper on bound states [Znojil M., SIGMA 5 (2009), 001,
19 pages, arXiv:0901.0700] is complemented by the text on scattering. An
elementary example illustrates the feasibility of the resulting innovative
theoretical recipe. A new family of the so called quasilocal inner products in
Hilbert space is found to exist. Constructively, these products are all
described in terms of certain non-equivalent short-range metric operators
$\Theta\neq I$ represented, in Runge-Kutta approximation, by $(2R-1)$-diagonal
matrices.
","[{""version"":""v1"",""created"":""Thu, 27 Aug 2009 17:05:16 GMT""},{""version"":""v2"",""created"":""Mon, 31 Aug 2009 07:33:42 GMT""}]","2009-08-31"
"0908.4046","Hans-Werner Hammer","Eric Braaten, H.-W. Hammer, Daekyoung Kang, Lucas Platter","Efimov Physics in 6Li Atoms","27 pages, 9 figures, REVTeX4, published version","Phys.Rev.A81:013605,2010","10.1103/PhysRevA.81.013605","HISKP-TH-09-30","cond-mat.quant-gas hep-ph nucl-th","http://arxiv.org/licenses/nonexclusive-distrib/1.0/","  A new narrow 3-atom loss resonance associated with an Efimov trimer crossing
the 3-atom threshold has recently been discovered in a many-body system of
ultracold 6Li atoms in the three lowest hyperfine spin states at a magnetic
field near 895 G. O'Hara and coworkers have used measurements of the 3-body
recombination rate in this region to determine the complex 3-body parameter
associated with Efimov physics. Using this parameter as the input, we calculate
the universal predictions for the spectrum of Efimov states and for the 3-body
recombination rate in the universal region above 600 G where all three
scattering lengths are large. We predict an atom-dimer loss resonance at (672
+/- 2) G associated with an Efimov trimer disappearing through an atom-dimer
threshold. We also predict an interference minimum in the 3-body recombination
rate at (759 +/- 1) G where the 3-spin mixture may be sufficiently stable to
allow experimental study of the many-body system.
","[{""version"":""v1"",""created"":""Thu, 27 Aug 2009 17:37:19 GMT""},{""version"":""v2"",""created"":""Mon, 26 Jul 2010 11:36:52 GMT""}]","2015-03-13"
"0908.4047","Alexis  Hern\'andez","Alexis R. Hern\'andez, and Caio H. Lewenkopf","Nonlinear conductance in a ballistic Aharonov-Bohm ring","5 pages, 4 figures",,"10.1103/PhysRevLett.103.166801",,"cond-mat.mes-hall","http://arxiv.org/licenses/nonexclusive-distrib/1.0/","  The nonlinear electronic transport properties of a ballistic Aharonov-Bohm
ring are investigated. It is demonstrated how the electronic interaction breaks
the phase rigidity in a two-probe mesoscopic device as the voltage bias is
increased. The possibility of studying interference effects in the nonlinear
regime is addressed. The occurrence of magnetic feld symmetries in higher order
conductance coefficients is analyzed. The results are compared with recent
experimental data.
","[{""version"":""v1"",""created"":""Thu, 27 Aug 2009 17:42:32 GMT""}]","2015-05-14"
"0908.4048","Kevin Zumbrun","Guy Metivier, Benjamin Texier, and Kevin Zumbrun","Existence of quasilinear relaxation shock profiles",,,,,"math.AP","http://arxiv.org/licenses/nonexclusive-distrib/1.0/","  We establish existence with sharp rates of decay and distance from the
Chapman--Enskog approximation of small-amplitude quasilinear relaxation shocks
in the general case that the profile ODE may become degenerate. Our method of
analysis follows the general approach used by M\'etivier and Zumbrun in the
semilinear case, based on Chapman--Enskog expansion and the macro--micro
decomposition of Liu and Yu. In the quasilinear case, however, we find it
necessary to apply a parameter-dependent Nash-Moser iteration to close the
analysis, whereas, in the semilinear case, a simple contraction-mapping
argument sufficed.
","[{""version"":""v1"",""created"":""Thu, 27 Aug 2009 17:42:53 GMT""}]","2009-08-28"
"0908.4049","Sergey A. Denisov","Sergey A. Denisov","Continuous analogs of polynomials orthogonal on the unit circle. Krein
  systems","Prepint with corrected typos. The final version published in IMRS by
  Hindawi Publishing corporation,
  http://imrs.oxfordjournals.org/cgi/content/abstract/2006/54517/54517","International Mathematics Research Surveys (2007) Vol. 2006,
  article ID 54517, 148 pages",,,"math.CA","http://arxiv.org/licenses/nonexclusive-distrib/1.0/","  This survey contains the introduction to the subject. Many new results are
also included.
","[{""version"":""v1"",""created"":""Thu, 27 Aug 2009 17:47:08 GMT""}]","2009-08-28"
"0908.4050","Philippe Nadeau","Philippe Nadeau","The structure of alternative tableaux","23 pages. v2: minor corrections",,,,"math.CO","http://arxiv.org/licenses/nonexclusive-distrib/1.0/","  In this paper we study alternative tableaux introduced by Viennot. These
tableaux are in simple bijection with permutation tableaux, defined previously
by Postnikov . We exhibit a simple recursive structure for alternative
tableaux. From this decomposition, we can easily deduce a number of enumerative
results. We also give bijections between these tableaux and certain classes of
labeled trees. Finally, we exhibit a bijection with permutations, and relate it
to some other bijections that already appeared in the literature.
","[{""version"":""v1"",""created"":""Thu, 27 Aug 2009 17:50:53 GMT""},{""version"":""v2"",""created"":""Mon, 14 Sep 2009 15:06:40 GMT""}]","2009-09-14"
"0908.4051","Aslan Tchamkerten","Venkat Chandar, Aslan Tchamkerten, Gregory W. Wornell","Training-Based Schemes are Suboptimal for High Rate Asynchronous
  Communication","To appear in the proceedings of the 2009 IEEE Information Theory
  Workshop (Taormina)",,"10.1109/ITW.2009.5351435",,"cs.IT math.IT","http://arxiv.org/licenses/nonexclusive-distrib/1.0/","  We consider asynchronous point-to-point communication. Building on a recently
developed model, we show that training based schemes, i.e., communication
strategies that separate synchronization from information transmission, perform
suboptimally at high rate.
","[{""version"":""v1"",""created"":""Thu, 27 Aug 2009 19:44:59 GMT""}]","2016-11-17"
"0908.4052","Nikita A. Nekrasov","Nikita A. Nekrasov, Samson L. Shatashvili","Quantization of Integrable Systems and Four Dimensional Gauge Theories","32 pp. 1 figure",,"10.1142/9789814304634_0015","TCD-MATH-09-19, HMI-09-09, IHES/P/09/38","hep-th math-ph math.AG math.AP math.MP nlin.SI","http://arxiv.org/licenses/nonexclusive-distrib/1.0/","  We study four dimensional N=2 supersymmetric gauge theory in the
Omega-background with the two dimensional N=2 super-Poincare invariance. We
explain how this gauge theory provides the quantization of the classical
integrable system underlying the moduli space of vacua of the ordinary four
dimensional N=2 theory.
  The epsilon-parameter of the Omega-background is identified with the Planck
constant, the twisted chiral ring maps to quantum Hamiltonians, the
supersymmetric vacua are identified with Bethe states of quantum integrable
systems. This four dimensional gauge theory in its low energy description has
two dimensional twisted superpotential which becomes the Yang-Yang function of
the integrable system. We present the thermodynamic-Bethe-ansatz like formulae
for these functions and for the spectra of commuting Hamiltonians following the
direct computation in gauge theory. The general construction is illustrated at
the examples of the many-body systems, such as the periodic Toda chain, the
elliptic Calogero-Moser system, and their relativistic versions, for which we
present a complete characterization of the L^2-spectrum. We very briefly
discuss the quantization of Hitchin system.
","[{""version"":""v1"",""created"":""Thu, 27 Aug 2009 18:21:13 GMT""}]","2017-08-23"
"0908.4053","Antun Milas","Drazen Adamovic, Antun Milas","On W-algebras associated to (2,p) minimal models and their
  representations","27 pages, v2: minor changes",,,,"math.QA hep-th math-ph math.CO math.MP math.RT","http://arxiv.org/licenses/nonexclusive-distrib/1.0/","  For every odd p \geq 3, we investigate representation theory of the vertex
algebra WW_{2,p} associated to (2,p) minimal models for the Virasoro algebras.
We demonstrate that vertex algebras WW_{2,p} are C_2--cofinite and irrational.
Complete classification of irreducible representations for WW_{2,3} is
obtained, while the classification for p \geq 5 is subject to certain constant
term identities. These identities can be viewed as ""logarithmic deformations""
of Dyson and Selberg constant term identities, and are of independent interest.
","[{""version"":""v1"",""created"":""Thu, 27 Aug 2009 18:21:31 GMT""},{""version"":""v2"",""created"":""Sat, 10 Oct 2009 00:49:05 GMT""}]","2009-10-10"
"0908.4054","Antun Milas","Corina Calinescu, James Lepowsky, Antun Milas","Vertex-algebraic structure of the principal subspaces of level one
  modules for the untwisted affine Lie algebras of types A,D,E","25 pages, to appear in Journal of Algebra. v2: no changes",,,,"math.QA hep-th math.RT","http://arxiv.org/licenses/nonexclusive-distrib/1.0/","  Generalizing some of our earlier work, we prove natural presentations of the
principal subspaces of the level one standard modules for the untwisted affine
Lie algebras of types A, D and E, and also of certain related spaces. As a
consequence, we obtain a canonical complete set of recursions (q-difference
equations) for the (multi-)graded dimensions of these spaces, and we derive
their graded dimensions. Our methods are based on intertwining operators in
vertex operator algebra theory.
","[{""version"":""v1"",""created"":""Thu, 27 Aug 2009 18:21:51 GMT""},{""version"":""v2"",""created"":""Sat, 10 Oct 2009 01:10:42 GMT""}]","2009-10-10"
